who had no place in the sun,	0 0 0 1 1 0 1	place in the sun	figurative	identical	NOUN VERB DET NOUN ADP DET NOUN
But in the period covered by this book society was not quite so hierarchical as before or after ; nor did a man's place in the sun depend on the number and dignity of his ancestors.	0 0 0 0 0 0 0 0 0 0 0 0 0 0 0 0 0 0 0 0 0 0 0 1 1 0 1 0 0 0 0 0 0 0 0 0	place in the sun	figurative	identical	CCONJ ADP DET NOUN VERB ADP DET NOUN NOUN VERB ADV ADV ADV ADJ ADP ADV CCONJ ADV PUNCT CCONJ VERB DET NOUN NOUN ADP DET NOUN VERB ADP DET NOUN CCONJ NOUN ADP ADJ NOUN
Solar energy is produced by the thermonuclear reactions which are constantly taking place in the sun which has a temperature of 20 million degrees centigrade.	0 0 0 0 0 0 0 0 0 0 0 0 1 1 0 1 0 0 0 0 0 0 0 0 0	place in the sun	literal	identical	ADJ NOUN VERB VERB ADP DET NOUN NOUN ADJ VERB ADV VERB NOUN ADP DET NOUN ADJ VERB DET NOUN ADP NUM NUM NOUN NOUN
Football : Why Robson must discover innovation : Patrick Barclay, Football Correspondent, on England's overriding need for understudies now a place in the Italian sun has been secured	0 0 0 0 0 0 0 0 0 0 0 0 0 0 0 0 0 0 0 0 1 1 0 0 1 0 0 0	place in the sun	figurative	insertion-other	NOUN PUNCT ADV PROPN VERB VERB NOUN PUNCT PROPN PROPN PROPN NOUN ADP PROPN VERB NOUN ADP NOUN ADV DET NOUN ADP DET ADJ NOUN VERB VERB VERB
Regarding the possible replacement of Texas by Fujitsu Ltd as Sun Microsystems Inc's manufacturing partner for the MicroSparc, Rhines said ' Fujitsu ( a good customer of Texas's ) also need their place in the Sun '.	0 0 0 0 0 0 0 0 0 0 0 0 0 0 0 0 0 0 0 0 0 0 0 0 0 0 0 0 0 0 0 0 1 1 0 1 0	place in the sun	figurative	case	VERB DET ADJ NOUN ADP PROPN ADP PROPN PROPN ADP PROPN PROPN PROPN NOUN NOUN ADP DET PROPN PROPN VERB PUNCT PROPN PUNCT DET ADJ NOUN ADP PROPN PUNCT ADV VERB ADJ NOUN ADP DET PROPN PUNCT
MOST Californians are outsiders over half have travelled thousands of miles for a place in the sun.	0 0 0 0 0 0 0 0 0 0 0 0 0 1 1 0 1	place in the sun	literal	identical	ADJ PROPN VERB NOUN ADP NOUN VERB VERB NOUN ADP NOUN ADP DET NOUN ADP DET NOUN
For example, if an advert is placed in The Sun for construction supervisors, it may well produce 500 replies within a couple of days.	0 0 0 0 0 0 1 1 0 1 0 0 0 0 0 0 0 0 0 0 0 0 0 0	place in the sun	literal	misc	ADP NOUN ADP DET NOUN VERB VERB ADP DET PROPN ADP NOUN NOUN PRON VERB ADV VERB NUM NOUN ADP DET NOUN ADP NOUN
The farm worker, in many respects, has yet to achieve his place in the sun, but he is also less willing to accept the low status which the rest of society seems to offer him.	0 0 0 0 0 0 0 0 0 0 0 1 1 0 1 0 0 0 0 0 0 0 0 0 0 0 0 0 0 0 0 0 0 0 0	place in the sun	figurative	identical	DET NOUN NOUN ADP ADJ NOUN VERB ADV PART VERB ADJ NOUN ADP DET NOUN CCONJ PRON VERB ADV ADV ADJ PART VERB DET ADJ NOUN ADJ DET NOUN ADP NOUN VERB PART VERB PRON
‘ A place in the sun’?	0 0 1 1 0 1	place in the sun	figurative	dashes	PUNCT DET NOUN ADP DET NOUN
Imperial expansion was driven forward not only by the collapse of order in extra - European societies, but also by intensifying competition from Britain's European rivals for ‘ a place in the sun’.	0 0 0 0 0 0 0 0 0 0 0 0 0 0 0 0 0 0 0 0 0 0 0 0 0 0 0 0 0 1 1 0 1	place in the sun	figurative	dashes	ADJ NOUN VERB VERB ADV ADV ADV ADP DET NOUN ADP NOUN ADP ADJ PUNCT ADJ NOUN CCONJ ADV ADP VERB NOUN ADP PROPN ADJ NOUN ADP PUNCT DET NOUN ADP DET NOUN
A place in the sun, Diano Marina beach	0 1 1 0 1 0 0 0	place in the sun	figurative	identical	DET NOUN ADP DET NOUN PROPN PROPN NOUN
Edwin Gooch, the former President of the NUAAW, once demanded that the farm worker be given his ‘ place in the sun’, by which he meant not only better pay and conditions but a more deserving recognition by the rest of society and equality of opportunity within it.	0 0 0 0 0 0 0 0 0 0 0 0 0 0 0 0 0 0 1 1 0 1 0 0 0 0 0 0 0 0 0 0 0 0 0 0 0 0 0 0 0 0 0 0 0 0 0 0	place in the sun	figurative	dashes	PROPN PROPN DET ADJ PROPN ADP DET PROPN ADV VERB ADP DET NOUN NOUN VERB VERB ADJ ADJ NOUN ADP DET NOUN ADP ADJ PRON VERB ADV ADV ADJ NOUN CCONJ NOUN CCONJ DET ADV ADJ NOUN ADP DET NOUN ADP NOUN CCONJ NOUN ADP NOUN ADP PRON
A place in the sun!	0 1 1 0 1	place in the sun	literal	identical	DET NOUN ADP DET NOUN
The market for places in the sun was the first to be hit when high interest rates and the recession at home began to bite but, with mortgage rates now in single figures, people are once more looking abroad.	0 0 0 1 1 0 1 0 0 0 0 0 0 0 0 0 0 0 0 0 0 0 0 0 0 0 0 0 0 0 0 0 0 0 0 0 0 0 0	place in the sun	literal	inflection	DET NOUN ADP NOUN ADP DET NOUN VERB DET ADJ PART VERB VERB ADV ADJ NOUN NOUN CCONJ DET NOUN ADP NOUN VERB PART VERB CCONJ ADP NOUN NOUN ADV ADP ADJ NOUN NOUN VERB ADV ADV VERB ADV
Certainly if farmers wish to have a suitably skilled and motivated labour force by the late 1980s they will have to do more to recognize the farm worker's quite legitimate aspirations and to help rather than hinder his search for ‘ a place in the sun’.	0 0 0 0 0 0 0 0 0 0 0 0 0 0 0 0 0 0 0 0 0 0 0 0 0 0 0 0 0 0 0 0 0 0 0 0 0 0 0 0 0 0 1 1 0 1	place in the sun	literal	dashes	ADV ADP NOUN VERB PART VERB DET ADV ADJ CCONJ VERB ADJ NOUN ADP DET ADJ NUM PRON VERB VERB PART VERB ADJ PART VERB DET NOUN NOUN ADV ADJ NOUN CCONJ PART VERB ADV ADP VERB ADJ NOUN ADP ADJ DET NOUN ADP DET NOUN
It might even be possible to create a ‘ place in the sun’, where car parking has been placed underground because a place in the sun for townsfolk is more important than a place in the sun for cars ( e ).	0 0 0 0 0 0 0 0 0 0 0 0 0 0 0 0 0 0 0 0 0 0 1 1 0 1 0 0 0 0 0 0 0 0 0 0 0 0 0 0 0 0	place in the sun	literal	identical	PRON VERB ADV VERB ADJ PART VERB DET ADJ NOUN ADP DET NOUN ADV NOUN NOUN VERB VERB VERB ADV ADP DET NOUN ADP DET NOUN ADP NOUN VERB ADV ADJ ADP DET NOUN ADP DET NOUN ADP NOUN PUNCT PUNCT PUNCT
Britain's solar powered car takes its place in the sun.	0 0 0 0 0 0 1 1 0 1	place in the sun	figurative	identical	PROPN ADJ ADJ NOUN VERB ADJ NOUN ADP DET NOUN