Sorry for coming in under the wire at er nine fourteen according to this clock.	0 0 0 0 1 0 1 0 0 0 0 0 0 0 0	under the wire	figurative	identical	INTJ ADP VERB PART ADP DET NOUN ADP INTJ NUM NUM VERB ADP DET NOUN
I was firmly in the present, watching the starlings cavort over and under the telegraph wires and the wind shimmer the young leaves into a muzzy Monet.	0 0 0 0 0 0 0 0 0 0 0 0 1 0 0 1 0 0 0 0 0 0 0 0 0 0 0	under the wire	literal	combined-inflection	PRON VERB ADV ADP DET NOUN VERB DET NOUN VERB ADV CCONJ ADP DET NOUN NOUN CCONJ DET NOUN VERB DET ADJ NOUN ADP DET ADJ PROPN
I can crawl under the wire where it's broken.	0 0 0 1 0 1 0 0 0	under the wire	literal	identical	PRON VERB VERB ADP DET NOUN ADV PRON ADJ
Lithuania, Latvia, and Estonia, which were annexed by the Soviet ~ Union in 1940, slipped in under the wire in 2004.	0 0 0 0 0 0 0 0 0 0 0 0 0 0 0 0 1 0 1 0 0	under the wire	figurative	identical	PROPN PROPN CCONJ PROPN ADJ VERB VERB ADP DET PROPN PUNCT PROPN ADP NUM VERB ADP ADP DET NOUN ADP NUM
It slinks greyly among the marram grass ; it slides over and under barbed wire ; it makes an eagle lose direction and settles a dank wetness on his feathers ; it softens the landscape into obscurity, it hides the familiar cliffs, it turns sheep into monsters and highland cattle into roaring mountains which lurch up towards an eagle out of the clinging mist.	0 0 0 0 0 0 0 0 0 0 0 0 1 0 1 0 0 0 0 0 0 0 0 0 0 0 0 0 0 0 0 0 0 0 0 0 0 0 0 0 0 0 0 0 0 0 0 0 0 0 0 0 0 0 0 0 0 0 0 0 0 0 0 0	under the wire	literal	determiner-broad	PRON VERB NOUN ADP DET NOUN NOUN PUNCT PRON VERB ADV CCONJ ADP ADJ NOUN PUNCT PRON VERB DET NOUN ADJ NOUN CCONJ VERB DET ADJ NOUN ADP ADJ NOUN PUNCT PRON VERB DET NOUN ADP NOUN PRON VERB DET ADJ NOUN PRON VERB NOUN ADP NOUN CCONJ ADJ NOUN ADP VERB NOUN ADJ VERB PART ADP DET NOUN ADP ADP DET VERB NOUN
It is loaded from the bottom wire upwards and the natural settling of the crop makes big air tunnels under each wire.	0 0 0 0 0 0 0 0 0 0 0 0 0 0 0 0 0 0 0 1 0 1	under the wire	literal	determiner-broad	PRON VERB VERB ADP DET ADJ NOUN ADV CCONJ DET ADJ NOUN ADP DET NOUN VERB ADJ NOUN NOUN ADP DET NOUN
For once they managed to evade the searchlights, dodge the guard - dogs, tunnel under the barbed wire and make it back to the sanctuary of their bunks before Stein and the Stalag Squad knew they were gone.	0 0 0 0 0 0 0 0 0 0 0 0 0 0 1 0 0 1 0 0 0 0 0 0 0 0 0 0 0 0 0 0 0 0 0 0 0 0	under the wire	literal	insertion-other	ADP ADV PRON VERB PART VERB DET NOUN VERB DET NOUN PUNCT NOUN NOUN ADP DET ADJ NOUN CCONJ VERB PRON ADV ADP DET NOUN ADP ADJ NOUN ADP PROPN CCONJ DET PROPN PROPN VERB PRON VERB VERB
Jack Nicholson almost crept under the wire before the studio system was finally extinguished at MGM.	0 0 0 0 1 0 1 0 0 0 0 0 0 0 0 0	under the wire	figurative	identical	PROPN PROPN ADV VERB ADP DET NOUN ADP DET NOUN NOUN VERB ADV VERB ADP PROPN