To my mind we 've gone overboard on fitness.	0 0 0 0 0 1 1 0 0	go overboard	figurative	inflection	ADP ADJ NOUN PRON VERB VERB ADV ADP NOUN
Don't go overboard with it, or your owner won't thank you.	0 1 1 0 0 0 0 0 0 0 0	go overboard	figurative	identical	VERB VERB ADV ADP PRON CCONJ ADJ NOUN VERB VERB PRON
Yes I know I 'm going overboard but I was impressed.	0 0 0 0 0 1 1 0 0 0 0	go overboard	figurative	inflection	INTJ PRON VERB PRON VERB VERB ADV CCONJ PRON VERB ADJ
But Hugh Dykes, MP for Harrow East, said : ‘ I hope politicians will not go overboard and seek to bring in tough laws to curb the press.	0 0 0 0 0 0 0 0 0 0 0 0 0 0 0 1 1 0 0 0 0 0 0 0 0 0 0 0	go overboard	figurative	identical	CCONJ PROPN PROPN PROPN ADP PROPN PROPN VERB PUNCT PUNCT PRON VERB NOUN VERB ADV VERB ADV CCONJ VERB PART VERB PART ADJ NOUN PART VERB DET NOUN
It went overboard into the sea. "	0 1 1 0 0 0 0	go overboard	literal	inflection	PRON VERB ADV ADP DET NOUN PUNCT
Lee Morris, of Newbiggin, went overboard at about 3:50am some three miles east of Whitley Bay while the vessel Boy Peter, on which he was a crew member, was putting out nets.	0 0 0 0 1 1 0 0 0 0 0 0 0 0 0 0 0 0 0 0 0 0 0 0 0 0 0 0 0 0 0 0	go overboard	literal	inflection	PROPN PROPN ADP PROPN VERB ADV ADP ADP NOUN DET NUM NOUN ADV ADP PROPN PROPN ADP DET NOUN PROPN PROPN ADP ADJ PRON VERB DET NOUN NOUN VERB VERB PART NOUN
yeah, something really, no don't go overboard	0 0 0 0 0 1 1	go overboard	figurative	identical	INTJ NOUN ADV INTJ VERB VERB ADV
Gifford had gone overboard a bit in the blues though …	0 0 1 1 0 0 0 0 0 0 0	go overboard	figurative	inflection	PROPN VERB VERB ADV DET NOUN ADP DET NOUN ADV PUNCT
On the other hand, talk to him about a book — like one that Gordon Jackson lent him — and he would go overboard about it.’	0 0 0 0 0 0 0 0 0 0 0 0 0 0 0 0 0 0 0 0 0 0 1 1 0 0	go overboard	figurative	identical	ADP DET ADJ NOUN VERB ADP PRON ADP DET NOUN PUNCT ADP NUM ADJ PROPN PROPN VERB PRON PUNCT CCONJ PRON VERB VERB ADV ADP NOUN
But I am not going to go overboard — I expect us to beat them. '	0 0 0 0 0 0 1 1 0 0 0 0 0 0 0 0	go overboard	figurative	identical	CCONJ PRON VERB ADV VERB PART VERB ADV PUNCT PRON VERB PRON PART VERB PRON PUNCT
Hunched in a remote and subordinate cranny of government — devising a rent bill at the Ministry of Housing and Local Government, as a matter of fact — I was not disposed to go overboard when our armed forces were launched into the attack in November ; but what on earth was intended to come out of it and how an occupation found untenable could be tenably restored and sustained by force was beyond the comprehension of this unmoved spectator.	0 0 0 0 0 0 0 0 0 0 0 0 0 0 0 0 0 0 0 0 0 0 0 0 0 0 0 0 0 0 0 0 0 1 1 0 0 0 0 0 0 0 0 0 0 0 0 0 0 0 0 0 0 0 0 0 0 0 0 0 0 0 0 0 0 0 0 0 0 0 0 0 0 0 0 0 0 0 0 0	go overboard	figurative	identical	VERB ADP DET ADJ CCONJ ADJ NOUN ADP NOUN PUNCT VERB DET NOUN NOUN ADP DET PROPN ADP PROPN CCONJ ADJ PROPN ADP DET NOUN ADP NOUN PUNCT PRON VERB ADV VERB PART VERB ADV ADV ADJ ADJ NOUN VERB VERB ADP DET NOUN ADP PROPN PUNCT CCONJ NOUN ADP NOUN VERB VERB PART VERB ADP ADP PRON CCONJ ADV DET NOUN VERB ADJ VERB VERB ADV VERB CCONJ VERB ADP NOUN VERB ADP DET NOUN ADP DET ADJ NOUN
Maybe I went overboard.	0 0 1 1	go overboard	figurative	inflection	ADV PRON VERB ADV
" Gone a bit overboard this time, hasn't he?	0 1 0 0 1 0 0 0 0	go overboard	figurative	combined-inflection	PUNCT VERB DET NOUN ADV DET NOUN VERB PRON
McCoist's effort put a better complexion on the night for Scotland though without enabling anyone to go overboard about their prospects in World Cup qualifying Group I.	0 0 0 0 0 0 0 0 0 0 0 0 0 0 0 0 1 1 0 0 0 0 0 0 0 0 0	go overboard	figurative	identical	PROPN NOUN VERB DET ADJ NOUN ADP DET NOUN ADP PROPN ADV ADP VERB NOUN PART VERB ADV ADP ADJ NOUN ADP PROPN PROPN VERB PROPN PROPN
You help to prevent us going overboard.’	0 0 0 0 0 1 1	go overboard	figurative	combined-inflection	PRON VERB PART VERB PRON VERB PART
No nation quite so much as the British likes its art to tell a story ( witness the pictures of Victorian England ) and no nation went overboard quite like the British to buy the Vung Tau cargo ; but with French, German, Italian, Dutch and Taiwanese buyers sharing out these decorations of the age of William and Mary, we must assume that the ‘ shipwreck factor’ in these prices appeals to more than the nation which owned the Titanic and whose schoolboys read Mr Midshipman Easy and Moby Dick.	0 0 0 0 0 0 0 0 0 0 0 0 0 0 0 0 0 0 0 0 0 0 0 0 0 0 1 1 0 0 0 0 0 0 0 0 0 0 0 0 0 0 0 0 0 0 0 0 0 0 0 0 0 0 0 0 0 0 0 0 0 0 0 0 0 0 0 0 0 0 0 0 0 0 0 0 0 0 0 0 0 0 0 0 0 0 0 0 0 0	go overboard	figurative	inflection	DET NOUN ADV ADV ADV ADP DET PROPN VERB ADJ NOUN PART VERB DET NOUN PUNCT VERB DET NOUN ADP PROPN PROPN PUNCT CCONJ DET NOUN VERB ADV ADV ADP DET PROPN PART VERB DET PROPN PROPN NOUN PUNCT CCONJ ADP ADJ ADJ ADJ ADJ CCONJ ADJ NOUN VERB PART DET NOUN ADP DET NOUN ADP PROPN CCONJ PROPN PRON VERB VERB ADP DET PUNCT NOUN ADP ADP DET NOUN NOUN ADP ADJ ADP DET NOUN ADJ VERB DET NOUN CCONJ ADJ NOUN VERB PROPN PROPN PROPN CCONJ PROPN PROPN
‘ I 'm beginning to understand why Garry went overboard for you,’ he said huskily.	0 0 0 0 0 0 0 0 1 1 0 0 0 0 0	go overboard	figurative	inflection	PUNCT PRON VERB VERB PART VERB ADV PROPN VERB ADV ADP NOUN PRON VERB ADV
That's a bit going overboard that is.	0 0 0 1 1 0 0	go overboard	figurative	inflection	DET DET NOUN VERB ADV DET VERB
They haven't said, ‘ Oh, well, we 're not going to tell you anything,’ but they haven't either erm gone overboard as the American schools, many of them, have done, into becoming simply the ephemeral erm products of local opinion.	0 0 0 0 0 0 0 0 0 0 0 0 0 0 0 0 0 0 0 1 1 0 0 0 0 0 0 0 0 0 0 0 0 0 0 0 0 0 0 0	go overboard	figurative	inflection	PRON VERB VERB PUNCT INTJ INTJ PRON VERB ADV VERB PART VERB PRON PUNCT CCONJ PRON VERB CCONJ ADV VERB ADV ADP DET ADJ NOUN ADJ ADP PRON VERB VERB ADP VERB ADV DET ADJ NOUN NOUN ADP ADJ NOUN
you 'd be expected to, to do a lot of work by yourself, and that's reflecting the fact that erm you 'll probably have four or five lessons in each of your three subjects, but most people would choose three subjects for A level, and that means that er, when you 're not having lessons, you 've got a lot of time that is not accountable for, you will have been, or going to a general studies period and stuff like that, but there will be a fair number of private study periods, erm, there are some people I think who, who go overboard, and you 've got such a different approach erm from er the lower sixth, people don't use the time that they have, erm, what I 'm really saying is that if you go into the sixth form and you spend less school time in the sixth form you don't need to be prepared	0 0 0 0 0 0 0 0 0 0 0 0 0 0 0 0 0 0 0 0 0 0 0 0 0 0 0 0 0 0 0 0 0 0 0 0 0 0 0 0 0 0 0 0 0 0 0 0 0 0 0 0 0 0 0 0 0 0 0 0 0 0 0 0 0 0 0 0 0 0 0 0 0 0 0 0 0 0 0 0 0 0 0 0 0 0 0 0 0 0 0 0 0 0 0 0 0 0 0 0 0 0 1 1 0 0 0 0 0 0 0 0 0 0 0 0 0 0 0 0 0 0 0 0 0 0 0 0 0 0 0 0 0 0 0 0 0 0 0 0 0 0 0 0 0 0 0 0 0 0 0 0 0 0 0 0 0	go overboard	figurative	identical	PRON VERB VERB VERB PART PART VERB DET NOUN ADP NOUN ADP PRON CCONJ DET VERB DET NOUN ADP NOUN PRON VERB ADV VERB NUM CCONJ NUM NOUN ADP DET ADP ADJ NUM NOUN CCONJ ADJ NOUN VERB VERB NUM NOUN ADP DET NOUN CCONJ DET VERB ADP INTJ ADV PRON VERB ADV VERB NOUN PRON VERB VERB DET NOUN ADP NOUN ADJ VERB ADV ADJ ADP PRON VERB VERB VERB CCONJ VERB ADP DET ADJ NOUN NOUN CCONJ NOUN ADP DET CCONJ ADV VERB VERB DET ADJ NOUN ADP ADJ NOUN NOUN NOUN ADV VERB DET NOUN PRON VERB NOUN NOUN VERB ADV CCONJ PRON VERB VERB ADJ DET ADJ NOUN NOUN ADP INTJ DET ADV ADJ NOUN VERB VERB DET NOUN ADJ PRON VERB INTJ NOUN PRON VERB ADV VERB VERB ADP ADP PRON VERB ADP DET ADJ NOUN CCONJ PRON VERB ADJ NOUN NOUN ADP DET ADJ NOUN PRON VERB VERB PART VERB VERB
‘ Don't go overboard with the gratitude,’ he rejoined with heavy irony.	0 0 1 1 0 0 0 0 0 0 0 0	go overboard	figurative	identical	PUNCT VERB VERB ADV ADP DET NOUN PRON VERB ADP ADJ NOUN
‘ Chris has a bit of a temper sometimes and can go overboard.	0 0 0 0 0 0 0 0 0 0 0 1 1	go overboard	figurative	identical	PUNCT PROPN VERB DET NOUN ADP DET NOUN ADV CCONJ VERB VERB ADV
You are demonstrating to them how to recognize, name and communicate their feelings without going overboard.	0 0 0 0 0 0 0 0 0 0 0 0 0 0 1 1	go overboard	figurative	inflection	PRON VERB VERB ADP PRON ADV PART VERB VERB CCONJ VERB ADJ NOUN ADP VERB ADV
It was feared he 'd gone overboard and air and sea search was launched.	0 0 0 0 0 1 1 0 0 0 0 0 0 0	go overboard	literal	inflection	PRON VERB VERB PRON VERB VERB ADV CCONJ NOUN CCONJ NOUN NOUN VERB VERB
( 68 ) Ianthe Ambrose could have gone overboard any time after 9.10, when she was seen to leave the lecture, and on her own statement she had been no swimmer.	0 0 0 0 0 0 0 1 1 0 0 0 0 0 0 0 0 0 0 0 0 0 0 0 0 0 0 0 0 0 0	go overboard	literal	inflection	PUNCT NUM PUNCT PROPN PROPN VERB VERB VERB ADV DET NOUN ADP NUM ADV PRON VERB VERB PART VERB DET NOUN CCONJ ADP ADJ ADJ NOUN PRON VERB VERB DET NOUN
' I don't have to go overboard with delight. '	0 0 0 0 0 1 1 0 0 0	go overboard	figurative	identical	PUNCT PRON VERB VERB PART VERB ADV ADP NOUN PUNCT
In the past ten years, Japanese people have gone overboard for squid, consuming half a million tonnes annually.	0 0 0 0 0 0 0 0 1 1 0 0 0 0 0 0 0 0	go overboard	figurative	inflection	ADP DET ADJ NUM NOUN ADJ NOUN VERB VERB ADV ADP NOUN VERB ADJ DET NUM NOUN ADV
This contained some very relevant names and addresses which the Pakistani owner had obviously tried to dispose of during the night, but in the confusion and darkness he had failed to realise it had not gone overboard. "	0 0 0 0 0 0 0 0 0 0 0 0 0 0 0 0 0 0 0 0 0 0 0 0 0 0 0 0 0 0 0 0 0 0 0 1 1 0	go overboard	figurative	inflection	DET VERB DET ADV ADJ NOUN CCONJ NOUN ADJ DET ADJ NOUN VERB ADV VERB PART VERB ADP ADP DET NOUN CCONJ ADP DET NOUN CCONJ NOUN PRON VERB VERB PART VERB PRON VERB ADV VERB ADV PUNCT
This new Alton band provide lots of variety on their debut release without going overboard.	0 0 0 0 0 0 0 0 0 0 0 0 0 1 1	go overboard	figurative	inflection	DET ADJ PROPN NOUN VERB NOUN ADP NOUN ADP ADJ NOUN NOUN ADP VERB ADV
Homer does not go overboard for the stereotype of the well - meaning, but stressed carer who may snap once or twice out of exasperation.	0 0 0 1 1 0 0 0 0 0 0 0 0 0 0 0 0 0 0 0 0 0 0 0 0	go overboard	figurative	identical	PROPN VERB ADV VERB ADV ADP DET NOUN ADP DET ADV PUNCT NOUN CCONJ ADJ NOUN NOUN VERB VERB ADV CCONJ ADV ADP ADP NOUN
Finally, avoid sexist language — but don't go overboard.	0 0 0 0 0 0 0 1 1	go overboard	figurative	identical	ADV VERB ADJ NOUN PUNCT CCONJ VERB VERB ADV
So are the reports that have flourished on the LA gossip circuit — Kilmer is going overboard ; Kilmer thinks he is Jim Morrison ; Kilmer has it written into his contract that everybody has to address him as Jim.	0 0 0 0 0 0 0 0 0 0 0 0 0 0 0 1 1 0 0 0 0 0 0 0 0 0 0 0 0 0 0 0 0 0 0 0 0 0 0 0	go overboard	figurative	inflection	CCONJ VERB DET NOUN ADJ VERB VERB ADP DET PROPN NOUN NOUN PUNCT PROPN VERB VERB ADV PUNCT PROPN VERB PRON VERB PROPN PROPN PUNCT PROPN VERB PRON VERB ADP ADJ NOUN ADP NOUN VERB PART VERB PRON ADP PROPN
All is not lost ; the mania is not an epidemic : this weekend ( January 27th ) is the 235th anniversary of the composer's birth, and only Britain's Radio 3 went overboard on it.	0 0 0 0 0 0 0 0 0 0 0 0 0 0 0 0 0 0 0 0 0 0 0 0 0 0 0 0 0 0 0 1 1 0 0	go overboard	figurative	inflection	DET VERB ADV VERB PUNCT DET NOUN VERB ADV DET NOUN PUNCT DET NOUN PUNCT PROPN NOUN PUNCT VERB DET ADJ NOUN ADP DET NOUN NOUN CCONJ ADV PROPN NOUN NUM VERB ADV ADP PRON
There is a human characteristic that we like to think, see things in, in very clear cut ways and you 're saying we shouldn't go overboard and just think that Boris Yeltsin because of his courage standing on the tank and, and helping to prevent the coup, we shouldn't go overboard and think that he's er the most marvellous human liberal democrat who ever walked the earth.	0 0 0 0 0 0 0 0 0 0 0 0 0 0 0 0 0 0 0 0 0 0 0 0 0 0 0 0 0 0 0 0 0 0 0 0 0 0 0 0 0 0 0 0 0 0 0 0 0 1 1 0 0 0 0 0 0 0 0 0 0 0 0 0 0 0 0	go overboard	figurative	identical	ADV VERB DET ADJ NOUN ADP PRON VERB PART VERB VERB NOUN PART ADP ADV ADJ NOUN NOUN CCONJ PRON VERB VERB PRON VERB VERB ADV CCONJ ADV VERB ADP PROPN PROPN ADP ADP ADJ NOUN NOUN ADP DET NOUN CCONJ CCONJ VERB PART VERB DET NOUN PRON VERB VERB ADV CCONJ VERB ADP PRON INTJ DET ADV ADJ ADJ ADJ PROPN NOUN ADV VERB DET NOUN
' Well, ' said Karen, ' it's a damn good job I didn't drink enough to go overboard with Mallachy, isn't it?	0 0 0 0 0 0 0 0 0 0 0 0 0 0 0 0 1 1 0 0 0 0	go overboard	figurative	identical	PUNCT INTJ PUNCT VERB PROPN PUNCT PRON DET ADV ADJ NOUN PRON VERB VERB ADV PART VERB ADV ADP PROPN VERB PRON