Use the Charts to help narrow your selection of suitable lenders, which will save considerable time and money in the long run.	0 0 0 0 0 0 0 0 0 0 0 0 0 0 0 0 0 0 1 0 1 1	in the long run	figurative	identical	VERB DET PROPN PART VERB VERB ADJ NOUN ADP ADJ NOUN ADJ VERB VERB ADJ NOUN CCONJ NOUN ADP DET ADJ NOUN
My Lords, it's a question of cost in the long run, but er the reason that the our British Library will have fewer than the French Library is originally it was planned to have three thousand places, but er further er examination which has really been taken undertaken very, very thoroughly has proved that this is really not necessary.	0 0 0 0 0 0 0 1 0 1 1 0 0 0 0 0 0 0 0 0 0 0 0 0 0 0 0 0 0 0 0 0 0 0 0 0 0 0 0 0 0 0 0 0 0 0 0 0 0 0 0 0 0 0 0 0 0 0 0	in the long run	figurative	identical	ADJ PROPN PRON DET NOUN ADP NOUN ADP DET ADJ NOUN CCONJ INTJ DET NOUN ADJ DET ADJ PROPN PROPN VERB VERB ADJ ADP DET PROPN PROPN VERB ADV PRON VERB VERB PART VERB NUM NUM NOUN CCONJ INTJ ADJ INTJ NOUN ADJ VERB ADV VERB VERB VERB ADV ADV ADV VERB VERB ADP DET VERB ADV ADV ADJ
Only if productivity increases is it possible in the long - run for both groups to be successful.	0 0 0 0 0 0 0 1 0 1 0 1 0 0 0 0 0 0	in the long run	figurative	dashes	ADV ADP NOUN VERB VERB PRON ADJ ADP DET ADJ PUNCT NOUN ADP DET NOUN PART VERB ADJ
But companies that are willing to take the time to lay this solid foundation will gain the edge in the long run.	0 0 0 0 0 0 0 0 0 0 0 0 0 0 0 0 0 0 1 0 1 1	in the long run	figurative	identical	CCONJ NOUN ADJ VERB ADJ PART VERB DET NOUN PART VERB DET ADJ NOUN VERB VERB DET NOUN ADP DET ADJ NOUN
The two are related : more tourists might boost the economy, but they would damage Bhutan ’s environment and culture, and so reduce happiness in the long run.	0 0 0 0 0 0 0 0 0 0 0 0 0 0 0 0 0 0 0 0 0 0 0 0 1 0 1 1	in the long run	figurative	identical	DET NUM VERB VERB PUNCT ADJ NOUN VERB VERB DET NOUN CCONJ PRON VERB VERB PROPN PART NOUN CCONJ NOUN CCONJ ADV VERB NOUN ADP DET ADJ NOUN
Your overall objective should be to ensure that a deal that at first sight looks attractive is not, in the long run, undermined because you have to expend significant additional sums in order to maintain a reasonable life - style abroad and fulfil your duties adequately.	0 0 0 0 0 0 0 0 0 0 0 0 0 0 0 0 0 0 1 0 1 1 0 0 0 0 0 0 0 0 0 0 0 0 0 0 0 0 0 0 0 0 0 0 0 0	in the long run	figurative	identical	ADJ ADJ NOUN VERB VERB PART VERB ADP DET NOUN ADJ ADP ADJ NOUN VERB ADJ VERB ADV ADP DET ADJ NOUN VERB ADP PRON VERB PART VERB ADJ ADJ NOUN ADP NOUN PART VERB DET ADJ NOUN PUNCT NOUN ADV CCONJ VERB ADJ NOUN ADV
Pétain was also a disciple of attrition, but in an entirely different sense from Joffre and Haig with their inhumanly simple calculations that the Germans could be beaten in the long run through losing man for man, by virtue of the Allied superiority in cannon fodder.	0 0 0 0 0 0 0 0 0 0 0 0 0 0 0 0 0 0 0 0 0 0 0 0 0 0 0 0 1 0 1 1 0 0 0 0 0 0 0 0 0 0 0 0 0 0	in the long run	figurative	identical	PROPN VERB ADV DET NOUN ADP NOUN CCONJ ADP DET ADV ADJ NOUN ADP PROPN CCONJ PROPN ADP ADJ ADJ ADJ NOUN ADP DET PROPN VERB VERB VERB ADP DET ADJ NOUN ADP VERB NOUN ADP NOUN ADP NOUN ADP DET PROPN NOUN ADP NOUN NOUN
By forcing out some existing competitors, or merely holding this increased threat over potential entrants, they may be able to increase their market share in the long run, deter entry, and charge high prices for every more.	0 0 0 0 0 0 0 0 0 0 0 0 0 0 0 0 0 0 0 0 0 0 0 0 1 0 1 1 0 0 0 0 0 0 0 0 0	in the long run	figurative	identical	ADP VERB PART DET VERB NOUN CCONJ ADV VERB DET VERB NOUN ADP ADJ NOUN PRON VERB VERB ADJ PART VERB ADJ NOUN NOUN ADP DET ADJ NOUN VERB NOUN CCONJ VERB ADJ NOUN ADP DET ADJ
The designs were brilliantly successful in the long run, but his daughter suffered for them.	0 0 0 0 0 1 0 1 1 0 0 0 0 0 0	in the long run	figurative	identical	DET NOUN VERB ADV ADJ ADP DET ADJ NOUN CCONJ ADJ NOUN VERB ADP PRON
We can not live together in the long run if we do not talk to one ~ another and know nothing of each ~ other.	0 0 0 0 0 1 0 1 1 0 0 0 0 0 0 0 0 0 0 0 0 0 0 0 0	in the long run	figurative	identical	PRON VERB ADV VERB ADV ADP DET ADJ NOUN ADP PRON VERB ADV VERB ADP NUM PUNCT DET CCONJ VERB NOUN ADP DET PUNCT ADJ
And if a deficit on that scale were allowed to persist Italian - style, the accumulation in outstanding debt would inevitably means higher taxes in the longer run to meet the burden of interest payments.	0 0 0 0 0 0 0 0 0 0 0 0 0 0 0 0 0 0 0 0 0 0 0 0 1 0 1 1 0 0 0 0 0 0 0	in the long run	figurative	misc	CCONJ ADP DET NOUN ADP DET NOUN VERB VERB PART VERB ADJ PUNCT NOUN DET NOUN ADP ADJ NOUN VERB ADV VERB ADJ NOUN ADP DET ADJ VERB PART VERB DET NOUN ADP NOUN NOUN
One US study found that spillovers lead to average cost reductions of between 5 and 13 per cent in the short run and 10–20 per cent in the long run, creating a divergence between private and social rates of return of 67 per cent in chemicals, 123 percent in petroleum, 30 percent in machinery, and 90 percent in instrument engineering ( Bernstein and Nadiri, 1989 ).	0 0 0 0 0 0 0 0 0 0 0 0 0 0 0 0 0 0 0 0 0 0 0 0 0 0 1 0 1 1 0 0 0 0 0 0 0 0 0 0 0 0 0 0 0 0 0 0 0 0 0 0 0 0 0 0 0 0 0 0 0 0 0 0 0 0	in the long run	figurative	identical	NUM PROPN NOUN VERB ADP NOUN VERB ADP ADJ NOUN NOUN ADP ADP NUM CCONJ NUM NOUN NOUN ADP DET ADJ NOUN CCONJ NUM NOUN NOUN ADP DET ADJ NOUN VERB DET NOUN ADP ADJ CCONJ ADJ NOUN ADP NOUN ADP NUM NOUN NOUN ADP NOUN NUM NOUN ADP NOUN NUM NOUN ADP NOUN CCONJ NUM NOUN ADP NOUN NOUN PUNCT PROPN CCONJ PROPN NUM PUNCT
‘ Yet in the long run — and we have already had a pretty long run — the results are potentially devastating.’	0 0 1 0 1 1 0 0 0 0 0 0 0 0 0 0 0 0 0 0 0 0	in the long run	figurative	identical	PUNCT ADV ADP DET ADJ NOUN PUNCT CCONJ PRON VERB ADV VERB DET ADV ADJ NOUN PUNCT DET NOUN VERB ADV ADJ
I mean you 've got to try and keep yourself afloat, and then even that's not going to help you, if nobody comes along and picks you up either, so I mean that But I mean I I didn't Oh well I Suppose I could say I gave up hope a few times but obviously if you s The struggle to survive comes through in the long run, and I mean it's it's not easy to give up hope,	0 0 0 0 0 0 0 0 0 0 0 0 0 0 0 0 0 0 0 0 0 0 0 0 0 0 0 0 0 0 0 0 0 0 0 0 0 0 0 0 0 0 0 0 0 0 0 0 0 0 0 0 0 0 0 0 0 0 0 0 0 0 0 0 1 0 1 1 0 0 0 0 0 0 0 0 0 0 0	in the long run	figurative	identical	PRON VERB PRON VERB VERB PART VERB CCONJ VERB PRON ADV CCONJ ADV ADV DET ADV VERB PART VERB PRON ADP NOUN VERB PART CCONJ VERB PRON PART ADV ADV PRON VERB ADP CCONJ PRON VERB PRON PRON VERB INTJ INTJ PRON VERB PRON VERB VERB PRON VERB PART NOUN DET ADJ NOUN CCONJ ADV ADP PRON VERB DET NOUN PART VERB VERB PART ADP DET ADJ NOUN CCONJ PRON VERB PRON PRON ADV ADJ PART VERB PART NOUN
There are often regulatory barriers to converting farmland into urban land, but these barriers tend to be thwarted in the long run if economic incentives to work around them become sufficiently powerful.	0 0 0 0 0 0 0 0 0 0 0 0 0 0 0 0 0 0 1 0 1 1 0 0 0 0 0 0 0 0 0 0	in the long run	figurative	identical	ADV VERB ADV ADJ NOUN ADP VERB NOUN ADP ADJ NOUN CCONJ DET NOUN VERB PART VERB VERB ADP DET ADJ NOUN ADP ADJ NOUN PART VERB ADP PRON VERB ADV ADJ
Moreover, whatever economic growth some of these countries might eventually register is contingent on enacting politically unpopular reforms that will work only in the long run – and at the cost of even more short - term pain.	0 0 0 0 0 0 0 0 0 0 0 0 0 0 0 0 0 0 0 0 0 0 1 0 1 1 0 0 0 0 0 0 0 0 0 0 0 0	in the long run	figurative	identical	ADV ADJ ADJ NOUN DET ADP DET NOUN VERB ADV VERB VERB ADJ ADP VERB ADV ADJ NOUN ADJ VERB VERB ADV ADP DET ADJ NOUN PUNCT CCONJ ADP DET NOUN ADP ADV ADJ ADJ PUNCT NOUN NOUN
Packets of seeds are much less expensive than florists ' flowers in the long run, but they do cost a lot more in time and effort.	0 0 0 0 0 0 0 0 0 0 0 1 0 1 1 0 0 0 0 0 0 0 0 0 0 0	in the long run	figurative	identical	NOUN ADP NOUN VERB ADV ADV ADJ ADP NOUN PART NOUN ADP DET ADJ NOUN CCONJ PRON VERB VERB DET NOUN ADJ ADP NOUN CCONJ NOUN
I wouldn't mind being thinner and better looking but those things aren't terribly important in the long run.’	0 0 0 0 0 0 0 0 0 0 0 0 0 0 1 0 1 1	in the long run	figurative	dashes	PRON VERB VERB VERB ADJ CCONJ ADV VERB CCONJ DET NOUN VERB ADV ADJ ADP DET ADJ NOUN
We knew that premature attempts to achieve long - term fiscal balance would worsen the short - term crisis – and thus be counterproductive in the long - run.	0 0 0 0 0 0 0 0 0 0 0 0 0 0 0 0 0 0 0 0 0 0 0 0 1 0 1 0 1	in the long run	figurative	dashes	PRON VERB ADP ADJ NOUN PART VERB ADJ PUNCT NOUN ADJ NOUN VERB VERB DET ADJ PUNCT NOUN NOUN PUNCT CCONJ ADV VERB ADJ ADP DET ADJ PUNCT NOUN
In the long run, moving to fees might provide the simplest solution to the problem of charging structures, and still offer good value for investors.	1 0 1 1 0 0 0 0 0 0 0 0 0 0 0 0 0 0 0 0 0 0 0 0 0	in the long run	figurative	case	ADP DET ADJ NOUN VERB ADP NOUN VERB VERB DET ADJ NOUN ADP DET NOUN ADP VERB NOUN CCONJ ADV VERB ADJ NOUN ADP NOUN
Hopefully he would be led to others which were more fruitful in the long run.	0 0 0 0 0 0 0 0 0 0 0 1 0 1 1	in the long run	figurative	identical	ADV PRON VERB VERB VERB ADP NOUN ADJ VERB ADV ADJ ADP DET ADJ NOUN
They had been long debated, but it should be emphasized how few individuals at this time believed that poverty could actually be eliminated, except perhaps in the very long run.	0 0 0 0 0 0 0 0 0 0 0 0 0 0 0 0 0 0 0 0 0 0 0 0 0 1 0 0 1 1	in the long run	figurative	insertion-other	PRON VERB VERB ADV VERB CCONJ PRON VERB VERB VERB ADV ADJ NOUN ADP DET NOUN VERB ADP NOUN VERB ADV VERB VERB ADP ADV ADP DET ADV ADJ NOUN
Treaty was signed in 1992 that a monetary union without something similar in the fiscal domain would be unsustainable in the long run.	0 0 0 0 0 0 0 0 0 0 0 0 0 0 0 0 0 0 0 1 0 1 1	in the long run	figurative	identical	PROPN VERB VERB ADP NUM ADP DET ADJ NOUN ADP NOUN ADJ ADP DET ADJ NOUN VERB VERB ADJ ADP DET ADJ NOUN
But the most exciting, important and, in the long run, sensible thing to happen in the paperback business this year is the amalgamation of Fontana and Grafton in August, to become HarperCollins Paperbacks.	0 0 0 0 0 0 1 0 1 1 0 0 0 0 0 0 0 0 0 0 0 0 0 0 0 0 0 0 0 0 0 0 0	in the long run	figurative	identical	CCONJ DET ADV ADJ ADJ CCONJ ADP DET ADJ NOUN ADJ NOUN PART VERB ADP DET NOUN NOUN DET NOUN VERB DET NOUN ADP PROPN CCONJ PROPN ADP PROPN PART VERB PROPN PROPN
Mr Harvey McGregor has said in McGregor on Damages,(15th ed Sweet & Maxwell 1988, para 1588 ) : It may be argued that the benefit of a mother's personal attention to a child's upbringing, morals, education and psychology, which the services of a housekeeper, nurse or governess could never provide has, in the long run, a financial value for the child difficult as it is to assess.	0 0 0 0 0 0 0 0 0 0 0 0 0 0 0 0 0 0 0 0 0 0 0 0 0 0 0 0 0 0 0 0 0 0 0 0 0 0 0 0 0 0 0 0 0 0 0 0 0 0 0 1 0 1 1 0 0 0 0 0 0 0 0 0 0 0 0	in the long run	figurative	identical	PROPN PROPN PROPN VERB VERB ADP PROPN ADP PROPN X PROPN CCONJ PROPN NUM ADJ NUM PUNCT PUNCT PRON VERB VERB VERB ADP DET NOUN ADP DET NOUN ADJ NOUN ADP DET NOUN NOUN NOUN NOUN CCONJ NOUN ADJ DET NOUN ADP DET NOUN NOUN CCONJ NOUN VERB ADV VERB VERB ADP DET ADJ NOUN DET ADJ NOUN ADP DET NOUN ADJ ADP PRON VERB PART VERB
Don't try to remove anything before it is ready as it will only go wrong in the long run, making all your work so far a complete waste of effort.	0 0 0 0 0 0 0 0 0 0 0 0 0 0 0 1 0 1 1 0 0 0 0 0 0 0 0 0 0 0	in the long run	figurative	identical	VERB VERB PART VERB NOUN ADP PRON VERB ADJ ADP PRON VERB ADV VERB ADJ ADP DET ADJ NOUN VERB DET ADJ NOUN ADV ADV DET ADJ NOUN ADP NOUN
MH : Well it is initially, but in the long run your progress is just as valid.	0 0 0 0 0 0 0 1 0 1 1 0 0 0 0 0 0	in the long run	figurative	identical	PROPN PUNCT INTJ PRON VERB ADV CCONJ ADP DET ADJ NOUN ADJ NOUN VERB ADV ADV ADJ
Thus in the long run, taking account of the capacity cost of building the extra power stations, the marginal cost of supplying peak users is very high.	0 1 0 1 1 0 0 0 0 0 0 0 0 0 0 0 0 0 0 0 0 0 0 0 0 0 0	in the long run	figurative	identical	ADV ADP DET ADJ NOUN VERB NOUN ADP DET NOUN NOUN ADP VERB DET ADJ NOUN NOUN DET ADJ NOUN ADP VERB NOUN NOUN VERB ADV ADJ
But customers who deal direct are cheaper in the long run to process than those who buy through branches.	0 0 0 0 0 0 0 1 0 1 1 0 0 0 0 0 0 0 0	in the long run	figurative	identical	CCONJ NOUN NOUN VERB ADJ VERB ADJ ADP DET ADJ NOUN PART VERB ADP DET NOUN VERB ADP NOUN
The energetic pursuit of these two policies should in the long run ensure a substantial improvement in the employment situation.	0 0 0 0 0 0 0 0 1 0 1 1 0 0 0 0 0 0 0 0	in the long run	figurative	identical	DET ADJ NOUN ADP DET NUM NOUN VERB ADP DET ADJ NOUN VERB DET ADJ NOUN ADP DET NOUN NOUN
This phenomenon leads to an endless chain of adaptive responses and in the long run means that fitness and rate of extinction remain constant.	0 0 0 0 0 0 0 0 0 0 0 1 0 1 1 0 0 0 0 0 0 0 0 0	in the long run	figurative	identical	DET NOUN VERB ADP DET ADJ NOUN ADP ADJ NOUN CCONJ ADP DET ADJ NOUN NOUN ADP NOUN CCONJ NOUN ADP NOUN VERB ADJ
So, in the long run Berlin will have its own version of Cork Street where one can buy an early Baselitz, Kounellis or Richter, and perhaps new works by such artists.	0 1 0 1 1 0 0 0 0 0 0 0 0 0 0 0 0 0 0 0 0 0 0 0 0 0 0 0 0 0 0	in the long run	figurative	identical	ADV ADP DET ADJ NOUN PROPN VERB VERB ADJ ADJ NOUN ADP PROPN PROPN ADV PRON VERB VERB DET ADJ PROPN PROPN CCONJ PROPN CCONJ ADV ADJ NOUN ADP ADJ NOUN
Equally important, how many of them will be strong enough to avoid being taken over by foreign companies in the long run?	0 0 0 0 0 0 0 0 0 0 0 0 0 0 0 0 0 0 1 0 1 1	in the long run	figurative	identical	ADV ADJ ADV ADJ ADP PRON VERB VERB ADJ ADV PART VERB VERB VERB PART ADP ADJ NOUN ADP DET ADJ NOUN
He pointed out that, while rigid systems may seem more stable, they are not equipped to cope with unexpected shocks, making them fragile in the long run.	0 0 0 0 0 0 0 0 0 0 0 0 0 0 0 0 0 0 0 0 0 0 0 1 0 1 1	in the long run	figurative	identical	PRON VERB PART ADP ADP ADJ NOUN VERB VERB ADV ADJ PRON VERB ADV VERB PART VERB ADP ADJ NOUN VERB PRON ADJ ADP DET ADJ NOUN
The main reason why the long - run Phillips curve may have a negative slope is that workers may continue to suffer from money illusion in the long - run and so be prepared to accept money wage increases which fall short of the actual inflation rate.	0 0 0 0 0 0 0 0 0 0 0 0 0 0 0 0 0 0 0 0 0 0 0 0 0 1 0 1 0 1 0 0 0 0 0 0 0 0 0 0 0 0 0 0 0 0 0	in the long run	figurative	dashes	DET ADJ NOUN ADV DET ADJ PUNCT NOUN PROPN NOUN VERB VERB DET ADJ NOUN VERB ADP NOUN VERB VERB PART VERB ADP NOUN NOUN ADP DET ADJ PUNCT NOUN CCONJ ADV VERB ADJ PART VERB NOUN NOUN NOUN ADJ VERB ADV ADP DET ADJ NOUN NOUN
And are not a desirable way to shop in the long run.	0 0 0 0 0 0 0 0 1 0 1 1	in the long run	figurative	identical	CCONJ VERB ADV DET ADJ NOUN ADP NOUN ADP DET ADJ NOUN
The real question, wrote Harsnet, is where the short run ends and the long run begins, since in the long run long and short are also without meaning.	0 0 0 0 0 0 0 0 0 0 0 0 0 0 0 0 0 1 0 1 1 0 0 0 0 0 0 0	in the long run	figurative	identical	DET ADJ NOUN VERB PROPN VERB ADV DET ADJ NOUN NOUN CCONJ DET ADJ NOUN VERB ADP ADP DET ADJ NOUN ADJ CCONJ ADJ VERB ADV ADP VERB
In order to survive international tax competition – and thus be able to rely on corporate taxes as a source of revenue – Japan ’s corporate - tax rate should be lowered in the long run.	0 0 0 0 0 0 0 0 0 0 0 0 0 0 0 0 0 0 0 0 0 0 0 0 0 0 0 0 0 0 0 0 1 0 1 1	in the long run	figurative	identical	ADP NOUN PART VERB ADJ NOUN NOUN PUNCT CCONJ ADV VERB ADJ PART VERB ADP ADJ NOUN ADP DET NOUN ADP NOUN PUNCT PROPN PART ADJ PUNCT NOUN NOUN VERB VERB VERB ADP DET ADJ NOUN
In the long run, however, ministers doubted whether the country could meet its present commitments to these organizations in the light of the events of July - August.	1 0 1 1 0 0 0 0 0 0 0 0 0 0 0 0 0 0 0 0 0 0 0 0 0 0 0 0	in the long run	figurative	case	ADP DET ADJ NOUN ADV NOUN VERB ADP DET NOUN VERB VERB ADJ ADJ NOUN ADP DET NOUN ADP DET NOUN ADP DET NOUN ADP PROPN PUNCT PROPN
Neither position proved to be tenable in the long run.	0 0 0 0 0 0 1 0 1 1	in the long run	figurative	identical	DET NOUN VERB PART VERB ADJ ADP DET ADJ NOUN
I in the shorter run erm often suggestion therapy will work, but seldom in the long run and er then it needs reinforcement you need to go back and have more.	0 0 0 0 0 0 0 0 0 0 0 0 0 1 0 1 1 0 0 0 0 0 0 0 0 0 0 0 0 0 0	in the long run	figurative	identical	PRON ADP DET ADJ NOUN ADV ADV NOUN NOUN VERB VERB CCONJ ADV ADP DET ADJ NOUN CCONJ INTJ ADV PRON VERB NOUN PRON VERB PART VERB ADV CCONJ VERB ADJ
In assessing the impact of policy, one must remember that what seems fixed and unalterable can in the long - run be adjusted — as the designers of the window tax discovered.	0 0 0 0 0 0 0 0 0 0 0 0 0 0 0 0 1 0 1 0 1 0 0 0 0 0 0 0 0 0 0 0	in the long run	figurative	dashes	ADP VERB DET NOUN ADP NOUN PRON VERB VERB ADP NOUN VERB VERB CCONJ ADJ VERB ADP DET ADJ PUNCT NOUN VERB VERB PUNCT ADP DET NOUN ADP DET NOUN NOUN VERB
To do otherwise was to risk driving underground legitimate political expression, which would create worse problems in the long run.	0 0 0 0 0 0 0 0 0 0 0 0 0 0 0 0 1 0 1 1	in the long run	figurative	identical	PART VERB ADV VERB PART VERB VERB ADJ ADJ ADJ NOUN ADJ VERB VERB ADJ NOUN ADP DET ADJ NOUN
Perhaps a erm perhaps a lesser impact than on the economy of Great Britain in the long run as to, as to whether those resources are developed effectively.	0 0 0 0 0 0 0 0 0 0 0 0 0 0 1 0 1 1 0 0 0 0 0 0 0 0 0 0	in the long run	figurative	identical	ADV DET NOUN ADV DET ADJ NOUN ADP ADP DET NOUN ADP PROPN PROPN ADP DET ADJ NOUN ADP ADP ADP ADP ADP DET NOUN VERB VERB ADV
Yeah, mind you his, his short er term policies so it doesn't matter in the long run.	0 0 0 0 0 0 0 0 0 0 0 0 0 1 0 1 1	in the long run	figurative	identical	INTJ VERB PRON ADJ ADJ ADJ INTJ NOUN NOUN ADP PRON VERB VERB ADP DET ADJ NOUN
" Learn from your mistakes " and " Experience is the best teacher " they say, but in the long run even the best teacher gets mad, if he or she has too much to teach in too little time.	0 0 0 0 0 0 0 0 0 0 0 0 0 0 0 0 0 1 0 1 1 0 0 0 0 0 0 0 0 0 0 0 0 0 0 0 0 0 0 0	in the long run	figurative	identical	PUNCT VERB ADP ADJ NOUN PUNCT CCONJ PUNCT NOUN VERB DET ADJ NOUN PUNCT PRON VERB CCONJ ADP DET ADJ NOUN ADV DET ADJ NOUN VERB ADJ ADP PRON CCONJ PRON VERB ADV ADJ PART VERB ADP ADV ADJ NOUN
There is no reason to suppose we will be any better, in the long run, at demonstrating respect towards our partner than we are to our parents and relatives.	0 0 0 0 0 0 0 0 0 0 0 1 0 1 1 0 0 0 0 0 0 0 0 0 0 0 0 0 0	in the long run	figurative	identical	ADV VERB DET NOUN PART VERB PRON VERB VERB ADV ADJ ADP DET ADJ NOUN ADP VERB NOUN ADP ADJ NOUN ADP PRON VERB ADP ADJ NOUN CCONJ NOUN
I mean, in the long run their both, they both give the same outcome, alright, but farmers want to try and avoid that variability of income, alright, so they 'll much prefer to, instead of having, you know, they probably prefer erm, a certain income of forty pounds rather than erm, an equal chance of getting one hundred pounds or zero.	0 0 1 0 1 1 0 0 0 0 0 0 0 0 0 0 0 0 0 0 0 0 0 0 0 0 0 0 0 0 0 0 0 0 0 0 0 0 0 0 0 0 0 0 0 0 0 0 0 0 0 0 0 0 0 0 0 0 0 0 0	in the long run	figurative	identical	PRON VERB ADP DET ADJ NOUN ADJ DET PRON DET VERB DET ADJ NOUN INTJ CCONJ NOUN VERB PART VERB CCONJ VERB DET NOUN ADP NOUN INTJ ADV PRON VERB ADV VERB PART ADV ADP VERB PRON VERB PRON ADV VERB NOUN DET ADJ NOUN ADP NUM NOUN ADV ADP NOUN DET ADJ NOUN ADP VERB NUM NUM NOUN CCONJ NUM
This was the point of his famous remark, " In the long run we are all dead. "	0 0 0 0 0 0 0 0 0 1 0 1 1 0 0 0 0 0	in the long run	figurative	case	DET VERB DET NOUN ADP ADJ ADJ NOUN PUNCT ADP DET ADJ NOUN PRON VERB ADV ADJ PUNCT
Given aging populations in industrial countries, large commitments from governments to social - insurance systems, and no clear plans for balancing government budgets in the long run, we would expect to see inflation and risk premiums – perhaps not substantial, but clearly visible – priced into even the largest and richest economies ’ treasury debt.	0 0 0 0 0 0 0 0 0 0 0 0 0 0 0 0 0 0 0 0 0 0 0 1 0 1 1 0 0 0 0 0 0 0 0 0 0 0 0 0 0 0 0 0 0 0 0 0 0 0 0 0 0 0 0	in the long run	figurative	identical	VERB VERB NOUN ADP ADJ NOUN ADJ NOUN ADP NOUN ADP ADJ PUNCT NOUN NOUN CCONJ DET ADJ NOUN ADP VERB NOUN NOUN ADP DET ADJ NOUN PRON VERB VERB PART VERB NOUN CCONJ NOUN NOUN PUNCT ADV ADV ADJ CCONJ ADV ADJ PUNCT VERB ADP ADV DET ADJ CCONJ ADJ NOUN PART NOUN NOUN
Austerity should thus always be beneficial for solvency in the long run, even if the debt / GDP ratio deteriorates in the short run.	0 0 0 0 0 0 0 0 1 0 1 1 0 0 0 0 0 0 0 0 0 0 0 0	in the long run	figurative	identical	PROPN VERB ADV ADV VERB ADJ ADP NOUN ADP DET ADJ NOUN ADV ADP DET NOUN SYM PROPN NOUN VERB ADP DET ADJ NOUN
In the long run, investment and the efficient level of capacity should be determined to ensure that, when pricing at short - run marginal cost, average daily or yearly prices equal long - run marginal cost.	1 0 1 1 0 0 0 0 0 0 0 0 0 0 0 0 0 0 0 0 0 0 0 0 0 0 0 0 0 0 0 0 0 0 0 0	in the long run	figurative	case	ADP DET ADJ NOUN NOUN CCONJ DET ADJ NOUN ADP NOUN VERB VERB VERB PART VERB ADP ADV VERB ADP ADJ PUNCT VERB ADJ NOUN ADJ ADJ CCONJ ADJ NOUN VERB ADJ PUNCT VERB ADJ NOUN
‘ However, the one thing the southern hemisphere does know a thing or two about is rugby union and to close the door would be to the detriment of the English game in the long run.	0 0 0 0 0 0 0 0 0 0 0 0 0 0 0 0 0 0 0 0 0 0 0 0 0 0 0 0 0 0 0 0 1 0 1 1	in the long run	figurative	identical	PUNCT ADV DET NUM NOUN DET ADJ NOUN VERB VERB DET NOUN CCONJ NUM ADP VERB VERB NOUN CCONJ PART VERB DET NOUN VERB VERB ADP DET NOUN ADP DET ADJ NOUN ADP DET ADJ NOUN
In the long run, risk - averse inaction can prove riskier than readiness to take risks.	1 0 1 1 0 0 0 0 0 0 0 0 0 0 0 0	in the long run	figurative	case	ADP DET ADJ NOUN NOUN PUNCT ADJ NOUN VERB VERB ADJ ADP NOUN PART VERB NOUN
In the long run, a population is said to be stable if the TFR is at the replacement rate, which is a little above 2.3 for the world as a whole, and somewhat lower, at 2.1, for developed countries, reflecting their lower infant - mortality rates.	1 0 1 1 0 0 0 0 0 0 0 0 0 0 0 0 0 0 0 0 0 0 0 0 0 0 0 0 0 0 0 0 0 0 0 0 0 0 0 0 0 0 0 0 0 0	in the long run	figurative	case	ADP DET ADJ NOUN DET NOUN VERB VERB PART VERB ADJ ADP DET PROPN VERB ADP DET NOUN NOUN ADJ VERB DET ADJ ADP NUM ADP DET NOUN ADP DET NOUN CCONJ ADV ADJ ADP NUM ADP VERB NOUN VERB ADJ ADJ NOUN PUNCT NOUN NOUN
‘ I very much doubt that these figures are sustainable in the long run.	0 0 0 0 0 0 0 0 0 0 1 0 1 1	in the long run	figurative	identical	PUNCT PRON ADV ADV NOUN ADP DET NOUN VERB ADJ ADP DET ADJ NOUN
In the long run, this was thought to be about 3 per cent per year.	1 0 1 1 0 0 0 0 0 0 0 0 0 0 0	in the long run	figurative	case	ADP DET ADJ NOUN DET VERB VERB PART VERB ADP NUM ADP NOUN ADP NOUN
Where government introduces measures that exclude people from resources long since used by them, the people come to view the project as a zero - sum game ( Thomson in Glantz, ed. 1977 ), where their loss is exactly others ' gain, and conservation will not in the long run lead to an increase in their incomes.	0 0 0 0 0 0 0 0 0 0 0 0 0 0 0 0 0 0 0 0 0 0 0 0 0 0 0 0 0 0 0 0 0 0 0 0 0 0 0 0 0 0 0 0 0 0 1 0 1 1 0 0 0 0 0 0 0	in the long run	figurative	identical	ADV NOUN VERB NOUN ADJ VERB NOUN ADP NOUN ADV ADP VERB ADP PRON DET NOUN VERB PART VERB DET NOUN ADP DET NUM PUNCT NOUN NOUN PUNCT PROPN ADP PROPN NOUN NUM PUNCT ADV ADJ NOUN VERB ADV NOUN PART NOUN CCONJ NOUN VERB ADV ADP DET ADJ NOUN NOUN ADP DET NOUN ADP ADJ NOUN
In the long run we aim to introduce a Citizen's income, a payment to every individual, irrespective of sex, marital status, income of employment status.	1 0 1 1 0 0 0 0 0 0 0 0 0 0 0 0 0 0 0 0 0 0 0 0 0	in the long run	figurative	case	ADP DET ADJ NOUN PRON VERB PART VERB DET PROPN NOUN DET NOUN ADP DET ADJ ADV ADP NOUN ADJ NOUN NOUN ADP NOUN NOUN
Another, related, fallacy is the assumption that reforms can reap benefits only in the long run.	0 0 0 0 0 0 0 0 0 0 0 0 1 0 1 1	in the long run	figurative	identical	DET ADJ NOUN VERB DET NOUN ADP NOUN VERB VERB NOUN ADV ADP DET ADJ NOUN
But in the long run, it's bound to strengthen Germany's economy tremendously, in fact some people think it's going to strengthen it a bit too much, because it's, it's strong enough er already.	0 1 0 1 1 0 0 0 0 0 0 0 0 0 0 0 0 0 0 0 0 0 0 0 0 0 0 0 0 0 0 0 0	in the long run	figurative	identical	CCONJ ADP DET ADJ NOUN PRON VERB PART VERB PROPN NOUN ADV ADP NOUN DET NOUN VERB PRON VERB PART VERB PRON DET NOUN ADV ADV ADP PRON PRON ADJ ADV INTJ ADV
By putting their money as well as their trust into credit, they are in the long run paying more, not less.	0 0 0 0 0 0 0 0 0 0 0 0 0 1 0 1 1 0 0 0 0	in the long run	figurative	identical	ADP VERB ADJ NOUN ADV ADV ADP ADJ NOUN ADP NOUN PRON VERB ADP DET ADJ NOUN VERB ADJ ADV ADJ
In the long run, especially in winter when the refugees had to spend free time in crowded recreation rooms, cabin fever set in.	1 0 1 1 0 0 0 0 0 0 0 0 0 0 0 0 0 0 0 0 0 0 0	in the long run	figurative	case	ADP DET ADJ NOUN ADV ADP NOUN ADV DET NOUN VERB PART VERB ADJ NOUN ADP ADJ NOUN NOUN NOUN NOUN VERB PART
