Erm so I mean I think, you know, it might be useful, well, in some ways it would be very useful for you to have erm two sort of six month stints in rather different environments so that then you 'd sort of keep your options open a bit.	0 0 0 0 0 0 0 0 0 0 0 0 0 0 0 0 0 0 0 0 0 0 0 0 0 0 0 0 0 0 0 0 0 0 0 0 0 0 0 0 0 0 0 1 1 1 1 0 0	keep your options open	figurative	identical	INTJ ADV PRON VERB PRON VERB PRON VERB PRON VERB VERB ADJ INTJ ADP DET NOUN PRON VERB VERB ADV ADJ ADP PRON PART VERB ADV NUM NOUN ADP NUM NOUN NOUN ADP ADV ADJ NOUN ADP ADP ADV PRON VERB ADV ADV VERB ADJ NOUN VERB DET NOUN
Either way, you can keep your options open.	0 0 0 0 1 1 1 1	keep your options open	figurative	identical	DET NOUN PRON VERB VERB ADJ NOUN ADJ
' Keeping your options open? '	0 1 1 1 1 0	keep your options open	figurative	combined-inflection	PUNCT VERB ADJ NOUN ADJ PUNCT
‘ It's called keeping your options open.	0 0 0 1 1 1 1	keep your options open	figurative	inflection	PUNCT PRON VERB VERB ADJ NOUN ADJ
Keep your options open	1 1 1 1	keep your options open	figurative	case	VERB ADJ NOUN ADJ
Delays or frustrations are indicated as November gets underway, so keep your options open until the Full Moon on the 10th — or preferably until after the Sun conjuncts Pluto on the 14th — when plans, contracts or important arrangements will be confirmed.	0 0 0 0 0 0 0 0 0 0 1 1 1 1 0 0 0 0 0 0 0 0 0 0 0 0 0 0 0 0 0 0 0 0 0 0 0 0 0 0 0 0 0	keep your options open	figurative	identical	NOUN CCONJ NOUN VERB VERB ADP PROPN VERB ADJ ADV VERB ADJ NOUN ADJ ADP DET PROPN NOUN ADP DET ADJ PUNCT CCONJ ADV ADP ADP DET PROPN VERB PROPN ADP DET ADJ PUNCT ADV NOUN NOUN CCONJ ADJ NOUN VERB VERB VERB