The kisses moved to her face and she opened her eyes.	0 0 0 0 0 0 0 0 1 1 1	open someone's eyes	literal	combined-inflection	DET NOUN VERB ADP ADJ NOUN CCONJ PRON VERB ADJ NOUN	▁The ▁k isse s ▁moved ▁to ▁her ▁face ▁and ▁she ▁opened ▁her ▁eyes .	0 0 0 0 0 0 0 0 0 0 1 1 1 1	DET NOUN NOUN NOUN VERB ADP ADJ NOUN CCONJ PRON VERB ADJ NOUN NOUN
She opened her eyes again and saw, hazily at first, Oliver.	0 1 1 1 0 0 0 0 0 0 0	open someone's eyes	literal	combined-inflection	PRON VERB ADJ NOUN ADV CCONJ VERB ADV ADP ADV PROPN	▁She ▁opened ▁her ▁eyes ▁again ▁and ▁saw , ▁h azi ly ▁at ▁first , ▁Olive r .	0 1 1 1 0 0 0 0 0 0 0 0 0 0 0 0 0	PRON VERB ADJ NOUN ADV CCONJ VERB VERB ADV ADV ADV ADP ADV ADV PROPN PROPN PROPN
I open my eyes and push myself up.	0 1 1 1 0 0 0 0	open someone's eyes	literal	possessive	PRON VERB ADJ NOUN CCONJ VERB PRON PART	▁I ▁open ▁my ▁eyes ▁and ▁push ▁myself ▁up .	0 1 1 1 0 0 0 0 0	PRON VERB ADJ NOUN CCONJ VERB PRON PART PART
He opened his eyes again ; the old butler looked at him anxiously.	0 1 1 1 0 0 0 0 0 0 0 0 0	open someone's eyes	literal	combined-inflection	PRON VERB ADJ NOUN ADV PUNCT DET ADJ NOUN VERB ADP PRON ADV	▁He ▁opened ▁his ▁eyes ▁again ▁ ; ▁the ▁old ▁but ler ▁looked ▁at ▁him ▁anxious ly .	0 1 1 1 0 0 0 0 0 0 0 0 0 0 0 0 0	PRON VERB ADJ NOUN ADV PUNCT PUNCT DET ADJ NOUN NOUN VERB ADP PRON ADV ADV ADV
‘ I opened my eyes as Peter walked in,’ says Avril.	0 0 1 1 1 0 0 0 0 0 0	open someone's eyes	literal	combined-inflection	PUNCT PRON VERB ADJ NOUN ADP PROPN VERB PROPN VERB PROPN	▁ ‘ ▁I ▁opened ▁my ▁eyes ▁as ▁Peter ▁walked ▁in , ’ ▁says ▁Av ril .	0 0 0 1 1 1 0 0 0 0 0 0 0 0 0 0	PUNCT PUNCT PRON VERB ADJ NOUN ADP PROPN VERB PROPN PROPN PROPN VERB PROPN PROPN PROPN
When I opened my eyes again, the carriage was standing beneath tall linden - trees, on the other side of which a broad flight of steps led between columns into a magnificent castle.	0 0 1 1 1 0 0 0 0 0 0 0 0 0 0 0 0 0 0 0 0 0 0 0 0 0 0 0 0 0 0 0 0	open someone's eyes	literal	combined-inflection	ADV PRON VERB ADJ NOUN ADV DET NOUN VERB VERB ADP ADJ NOUN PUNCT NOUN ADP DET ADJ NOUN ADP ADJ DET ADJ NOUN ADP NOUN VERB ADP NOUN ADP DET ADJ NOUN	▁When ▁I ▁opened ▁my ▁eyes ▁again , ▁the ▁carriage ▁was ▁standing ▁beneath ▁tall ▁lin den ▁- ▁trees , ▁on ▁the ▁other ▁side ▁of ▁which ▁a ▁broad ▁flight ▁of ▁steps ▁led ▁between ▁columns ▁into ▁a ▁magnificent ▁cast le .	0 0 1 1 1 0 0 0 0 0 0 0 0 0 0 0 0 0 0 0 0 0 0 0 0 0 0 0 0 0 0 0 0 0 0 0 0 0	ADV PRON VERB ADJ NOUN ADV ADV DET NOUN VERB VERB ADP ADJ NOUN NOUN PUNCT NOUN NOUN ADP DET ADJ NOUN ADP ADJ DET ADJ NOUN ADP NOUN VERB ADP NOUN ADP DET ADJ NOUN NOUN NOUN
John opens his eyes.	0 1 1 1	open someone's eyes	literal	combined-inflection	PROPN VERB ADJ NOUN	▁John ▁opens ▁his ▁eyes .	0 1 1 1 1	PROPN VERB ADJ NOUN NOUN
He opened his eyes to see Jenny there with a horse at her side, and he smiled.	0 1 1 1 0 0 0 0 0 0 0 0 0 0 0 0 0	open someone's eyes	literal	combined-inflection	PRON VERB ADJ NOUN PART VERB PROPN ADV ADP DET NOUN ADP ADJ NOUN CCONJ PRON VERB	▁He ▁opened ▁his ▁eyes ▁to ▁see ▁J en ny ▁there ▁with ▁a ▁horse ▁at ▁her ▁side , ▁and ▁he ▁smile d .	0 1 1 1 0 0 0 0 0 0 0 0 0 0 0 0 0 0 0 0 0 0	PRON VERB ADJ NOUN PART VERB PROPN PROPN PROPN ADV ADP DET NOUN ADP ADJ NOUN NOUN CCONJ PRON VERB VERB VERB
