Chambord not out of the woods	0 0 1 1 0 1	out of the woods	figurative	identical	PROPN ADV ADP ADP DET NOUN	▁Cham bor d ▁not ▁out ▁of ▁the ▁wood s	0 0 0 0 1 1 0 1 1	PROPN PROPN PROPN ADV ADP ADP DET NOUN NOUN
Forest not out of the woods	0 0 1 1 0 1	out of the woods	figurative	identical	NOUN ADV ADP ADP DET NOUN	▁Forest ▁not ▁out ▁of ▁the ▁wood s	0 0 1 1 0 1 1	NOUN ADV ADP ADP DET NOUN NOUN
There was a place — he recalled it now — Burkett had pointed it out to him when they were fishing on Derwent Water — a sheer cliff coming suddenly out of woods and fronting the valley.	0 0 0 0 0 0 0 0 0 0 0 0 0 0 0 0 0 0 0 0 0 0 0 0 0 0 0 0 0 0 1 1 1 0 0 0 0	out of the woods	literal	deletion-determiner	ADV VERB DET NOUN PUNCT PRON VERB PRON ADV PUNCT PROPN VERB VERB PRON PART ADP PRON ADV PRON VERB VERB ADP PROPN PROPN PUNCT DET ADJ NOUN VERB ADV ADP ADP NOUN CCONJ VERB DET NOUN	▁There ▁was ▁a ▁place ▁ — ▁he ▁recalled ▁it ▁now ▁ — ▁Burk ett ▁had ▁pointed ▁it ▁out ▁to ▁him ▁when ▁they ▁were ▁fishing ▁on ▁D er went ▁Water ▁ — ▁a ▁she er ▁cl iff ▁coming ▁suddenly ▁out ▁of ▁wood s ▁and ▁front ing ▁the ▁valley .	0 0 0 0 0 0 0 0 0 0 0 0 0 0 0 0 0 0 0 0 0 0 0 0 0 0 0 0 0 0 0 0 0 0 0 0 0 0 1 1 1 1 0 0 0 0 0 0	ADV VERB DET NOUN PUNCT PUNCT PRON VERB PRON ADV PUNCT PUNCT PROPN PROPN VERB VERB PRON PART ADP PRON ADV PRON VERB VERB ADP PROPN PROPN PROPN PROPN PUNCT PUNCT DET ADJ ADJ NOUN NOUN VERB ADV ADP ADP NOUN NOUN CCONJ VERB VERB DET NOUN NOUN
With one final corkscrew twist the path came out of the woods, flattened out and meandered along the edge of a lush expanse of green lawn.	0 0 0 0 0 0 0 0 1 1 0 1 0 0 0 0 0 0 0 0 0 0 0 0 0 0	out of the woods	literal	identical	ADP NUM ADJ NOUN VERB DET NOUN VERB ADP ADP DET NOUN VERB PART CCONJ VERB ADP DET NOUN ADP DET ADJ NOUN ADP ADJ NOUN	▁With ▁one ▁final ▁cork s c rew ▁twist ▁the ▁path ▁came ▁out ▁of ▁the ▁wood s , ▁flat ten ed ▁out ▁and ▁mean der ed ▁along ▁the ▁edge ▁of ▁a ▁lu sh ▁ex pan se ▁of ▁green ▁law n .	0 0 0 0 0 0 0 0 0 0 0 1 1 0 1 1 1 0 0 0 0 0 0 0 0 0 0 0 0 0 0 0 0 0 0 0 0 0 0 0	ADP NUM ADJ NOUN NOUN NOUN NOUN VERB DET NOUN VERB ADP ADP DET NOUN NOUN NOUN VERB VERB VERB PART CCONJ VERB VERB VERB ADP DET NOUN ADP DET ADJ ADJ NOUN NOUN NOUN ADP ADJ NOUN NOUN NOUN
I also loved making gadgets out of wood, and my heart's desire was a chemistry set.	0 0 0 0 0 1 1 1 0 0 0 0 0 0 0 0	out of the woods	literal	combined-inflection	PRON ADV VERB VERB NOUN ADP ADP NOUN CCONJ ADJ NOUN NOUN VERB DET NOUN VERB	▁I ▁also ▁love d ▁making ▁g ad get s ▁out ▁of ▁wood , ▁and ▁my ▁heart ' s ▁desire ▁was ▁a ▁chemistry ▁set .	0 0 0 0 0 0 0 0 0 1 1 1 1 0 0 0 0 0 0 0 0 0 0 0	PRON ADV VERB VERB VERB NOUN NOUN NOUN NOUN ADP ADP NOUN NOUN CCONJ ADJ NOUN NOUN NOUN NOUN VERB DET NOUN VERB VERB
Beds varied in their design and some were raised platforms made out of wood or stone.	0 0 0 0 0 0 0 0 0 0 0 1 1 1 0 0	out of the woods	literal	combined-inflection	NOUN ADJ ADP ADJ NOUN CCONJ DET VERB VERB NOUN VERB ADP ADP NOUN CCONJ NOUN	▁B ed s ▁varied ▁in ▁their ▁design ▁and ▁some ▁were ▁raised ▁platforms ▁made ▁out ▁of ▁wood ▁or ▁stone .	0 0 0 0 0 0 0 0 0 0 0 0 0 1 1 1 0 0 0	NOUN NOUN NOUN ADJ ADP ADJ NOUN CCONJ DET VERB VERB NOUN VERB ADP ADP NOUN CCONJ NOUN NOUN
They weren't out of the woods yet — far from it.	0 0 1 1 0 1 0 0 0 0 0	out of the woods	figurative	identical	PRON VERB ADP ADP DET NOUN ADV PUNCT ADV ADP PRON	▁They ▁were n ' t ▁out ▁of ▁the ▁wood s ▁yet ▁ — ▁far ▁from ▁it .	0 0 0 0 0 1 1 0 1 1 0 0 0 0 0 0 0	PRON VERB VERB VERB VERB ADP ADP DET NOUN NOUN ADV PUNCT PUNCT ADV ADP PRON PRON
But Mr Major and his Government are not yet out of the woods.	0 0 0 0 0 0 0 0 0 1 1 0 1	out of the woods	figurative	identical	CCONJ PROPN PROPN CCONJ ADJ PROPN VERB ADV ADV ADP ADP DET NOUN	▁But ▁Mr ▁Major ▁and ▁his ▁Government ▁are ▁not ▁yet ▁out ▁of ▁the ▁wood s .	0 0 0 0 0 0 0 0 0 1 1 0 1 1 1	CCONJ PROPN PROPN CCONJ ADJ PROPN VERB ADV ADV ADP ADP DET NOUN NOUN NOUN
Although the sum will make a considerable dent in Philips ' net debt, it doesn't get the company out of the woods altogether — total borrowings are $ 8,500 m.	0 0 0 0 0 0 0 0 0 0 0 0 0 0 0 0 0 0 1 1 0 1 0 0 0 0 0 0 0 0	out of the woods	figurative	identical	ADP DET NOUN VERB VERB DET ADJ NOUN ADP PROPN PART ADJ NOUN PRON VERB VERB DET NOUN ADP ADP DET NOUN ADV PUNCT ADJ NOUN VERB SYM NUM NOUN	▁Although ▁the ▁sum ▁will ▁make ▁a ▁considerable ▁dent ▁in ▁Philip s ▁' ▁net ▁debt , ▁it ▁does n ' t ▁get ▁the ▁company ▁out ▁of ▁the ▁wood s ▁altogether ▁ — ▁total ▁borrowings ▁are ▁$ ▁8, 500 ▁m .	0 0 0 0 0 0 0 0 0 0 0 0 0 0 0 0 0 0 0 0 0 0 0 1 1 0 1 1 0 0 0 0 0 0 0 0 0 0 0	ADP DET NOUN VERB VERB DET ADJ NOUN ADP PROPN PROPN PART ADJ NOUN NOUN PRON VERB VERB VERB VERB VERB DET NOUN ADP ADP DET NOUN NOUN ADV PUNCT PUNCT ADJ NOUN VERB SYM NUM NUM NOUN NOUN
Manager Harry McNally said : ‘ We are not out of the wood but we have been thrown a lifeline.	0 0 0 0 0 0 0 0 0 1 1 0 1 0 0 0 0 0 0 0	out of the woods	figurative	inflection	PROPN PROPN PROPN VERB PUNCT PUNCT PRON VERB ADV ADP ADP DET NOUN CCONJ PRON VERB VERB VERB DET NOUN	▁Manager ▁H arry ▁Mc N ally ▁said ▁ : ▁ ‘ ▁We ▁are ▁not ▁out ▁of ▁the ▁wood ▁but ▁we ▁have ▁been ▁thrown ▁a ▁life line .	0 0 0 0 0 0 0 0 0 0 0 0 0 0 1 1 0 1 0 0 0 0 0 0 0 0 0	PROPN PROPN PROPN PROPN PROPN PROPN VERB PUNCT PUNCT PUNCT PUNCT PRON VERB ADV ADP ADP DET NOUN CCONJ PRON VERB VERB VERB DET NOUN NOUN NOUN
He is back home with mother Christine now but she yesterday said : ‘ The medical advice is that he is not out of the woods yet.’	0 0 0 0 0 0 0 0 0 0 0 0 0 0 0 0 0 0 0 0 0 0 1 1 0 1 0	out of the woods	figurative	identical	PRON VERB ADV ADV ADP NOUN PROPN ADV CCONJ PRON NOUN VERB PUNCT PUNCT DET ADJ NOUN VERB ADP PRON VERB ADV ADP ADP DET NOUN PROPN	▁He ▁is ▁back ▁home ▁with ▁mother ▁Christ ine ▁now ▁but ▁she ▁yesterday ▁said ▁ : ▁ ‘ ▁The ▁medical ▁advice ▁is ▁that ▁he ▁is ▁not ▁out ▁of ▁the ▁wood s ▁yet . ’	0 0 0 0 0 0 0 0 0 0 0 0 0 0 0 0 0 0 0 0 0 0 0 0 0 1 1 0 1 1 0 0 0	PRON VERB ADV ADV ADP NOUN PROPN PROPN ADV CCONJ PRON NOUN VERB PUNCT PUNCT PUNCT PUNCT DET ADJ NOUN VERB ADP PRON VERB ADV ADP ADP DET NOUN NOUN PROPN PROPN PROPN
One of the males used a length of cut hazel to pole the craft out of the willow wood and into clear water.	0 0 0 0 0 0 0 0 0 0 0 0 0 0 1 1 0 0 1 0 0 0 0	out of the woods	literal	combined-inflection	NUM ADP DET NOUN VERB DET NOUN ADP VERB NOUN PART VERB DET NOUN ADP ADP DET ADJ NOUN CCONJ ADP ADJ NOUN	▁One ▁of ▁the ▁males ▁used ▁a ▁length ▁of ▁cut ▁ha zel ▁to ▁pole ▁the ▁craft ▁out ▁of ▁the ▁will ow ▁wood ▁and ▁into ▁clear ▁water .	0 0 0 0 0 0 0 0 0 0 0 0 0 0 0 1 1 0 0 0 1 0 0 0 0 0	NUM ADP DET NOUN VERB DET NOUN ADP VERB NOUN NOUN PART VERB DET NOUN ADP ADP DET ADJ ADJ NOUN CCONJ ADP ADJ NOUN NOUN
I remember the terror though : when the bear comes out of the wood and stalks after unsuspecting Charlot on the steep, cliff - edged mountain path.	0 0 0 0 0 0 0 0 0 0 1 1 0 1 0 0 0 0 0 0 0 0 0 0 0 0 0	out of the woods	literal	inflection	PRON VERB DET NOUN ADV PUNCT ADV DET NOUN VERB ADP ADP DET NOUN CCONJ NOUN ADP VERB PROPN ADP DET ADJ NOUN PUNCT VERB NOUN NOUN	▁I ▁remember ▁the ▁terror ▁though ▁ : ▁when ▁the ▁bear ▁comes ▁out ▁of ▁the ▁wood ▁and ▁stalk s ▁after ▁un su spect ing ▁Char lot ▁on ▁the ▁steep , ▁cl iff ▁- ▁edge d ▁mountain ▁path .	0 0 0 0 0 0 0 0 0 0 0 1 1 0 1 0 0 0 0 0 0 0 0 0 0 0 0 0 0 0 0 0 0 0 0 0 0	PRON VERB DET NOUN ADV PUNCT PUNCT ADV DET NOUN VERB ADP ADP DET NOUN CCONJ NOUN NOUN ADP VERB VERB VERB VERB PROPN PROPN ADP DET ADJ ADJ NOUN NOUN PUNCT VERB VERB NOUN NOUN NOUN
Mr Major is by no means out of the woods, and must fight to defend his leadership at a crisis Cabinet meeting to be called early today.	0 0 0 0 0 0 1 1 0 1 0 0 0 0 0 0 0 0 0 0 0 0 0 0 0 0 0	out of the woods	figurative	identical	PROPN PROPN VERB ADP DET NOUN ADP ADP DET NOUN CCONJ VERB VERB PART VERB ADJ NOUN ADP DET NOUN PROPN NOUN PART VERB VERB ADJ NOUN	▁Mr ▁Major ▁is ▁by ▁no ▁means ▁out ▁of ▁the ▁wood s , ▁and ▁must ▁fight ▁to ▁defend ▁his ▁leadership ▁at ▁a ▁crisis ▁Cabinet ▁meeting ▁to ▁be ▁called ▁early ▁today .	0 0 0 0 0 0 1 1 0 1 1 1 0 0 0 0 0 0 0 0 0 0 0 0 0 0 0 0 0 0	PROPN PROPN VERB ADP DET NOUN ADP ADP DET NOUN NOUN NOUN CCONJ VERB VERB PART VERB ADJ NOUN ADP DET NOUN PROPN NOUN PART VERB VERB ADJ NOUN NOUN
In the graveyard outside is a crucifix of the kind known as a ' Cross of the Outrages ' : it is roughly hewn out of wood, with the instruments of the Passion fixed to it, a ladder, nails, pliers, hammer, a crown of thorns, all in iron.	0 0 0 0 0 0 0 0 0 0 0 0 0 0 0 0 0 0 0 0 0 0 0 0 1 1 1 0 0 0 0 0 0 0 0 0 0 0 0 0 0 0 0 0 0 0 0 0	out of the woods	literal	combined-inflection	ADP DET NOUN ADV VERB DET NOUN ADP DET NOUN VERB ADP DET PUNCT PROPN ADP DET PROPN PART PUNCT PRON VERB ADV VERB ADP ADP NOUN ADP DET NOUN ADP DET PROPN VERB ADP PRON DET NOUN NOUN NOUN NOUN DET NOUN ADP NOUN ADV ADP NOUN	▁In ▁the ▁grave yard ▁outside ▁is ▁a ▁cru ci fix ▁of ▁the ▁kind ▁known ▁as ▁a ▁' ▁Cross ▁of ▁the ▁Outr ages ▁' ▁ : ▁it ▁is ▁roughly ▁he wn ▁out ▁of ▁wood , ▁with ▁the ▁instruments ▁of ▁the ▁Pass ion ▁fixed ▁to ▁it , ▁a ▁ladder , ▁nail s , ▁p lier s , ▁hammer , ▁a ▁crown ▁of ▁thorn s , ▁all ▁in ▁iron .	0 0 0 0 0 0 0 0 0 0 0 0 0 0 0 0 0 0 0 0 0 0 0 0 0 0 0 0 0 0 1 1 1 1 0 0 0 0 0 0 0 0 0 0 0 0 0 0 0 0 0 0 0 0 0 0 0 0 0 0 0 0 0 0 0 0 0	ADP DET NOUN NOUN ADV VERB DET NOUN NOUN NOUN ADP DET NOUN VERB ADP DET PUNCT PROPN ADP DET PROPN PROPN PART PUNCT PUNCT PRON VERB ADV VERB VERB ADP ADP NOUN NOUN ADP DET NOUN ADP DET PROPN PROPN VERB ADP PRON PRON DET NOUN NOUN NOUN NOUN NOUN NOUN NOUN NOUN NOUN NOUN NOUN DET NOUN ADP NOUN NOUN NOUN ADV ADP NOUN NOUN
The monks, experienced in warfare, received the area of the Burzenland ( Brasov ) depression with the permission to build castles and cities out of wood only, pay no taxes, have duty free markets, keep half of the mined gold and silver and deny hospitality to the Wojwode.	0 0 0 0 0 0 0 0 0 0 0 0 0 0 0 0 0 0 0 0 0 0 0 1 1 1 0 0 0 0 0 0 0 0 0 0 0 0 0 0 0 0 0 0 0 0 0 0	out of the woods	literal	combined-inflection	DET NOUN VERB ADP NOUN VERB DET NOUN ADP DET PROPN PUNCT PROPN PUNCT NOUN ADP DET NOUN PART VERB NOUN CCONJ NOUN ADP ADP NOUN ADV VERB DET NOUN VERB NOUN ADJ NOUN VERB NOUN ADP DET VERB NOUN CCONJ NOUN CCONJ VERB NOUN ADP DET PROPN	▁The ▁mon ks , ▁experienced ▁in ▁warfare , ▁received ▁the ▁area ▁of ▁the ▁Bur zen land ▁( ▁Bra s ov ▁ ) ▁depression ▁with ▁the ▁permission ▁to ▁build ▁cast les ▁and ▁cities ▁out ▁of ▁wood ▁only , ▁pay ▁no ▁taxes , ▁have ▁duty ▁free ▁markets , ▁keep ▁half ▁of ▁the ▁min ed ▁gold ▁and ▁silver ▁and ▁deny ▁hospital ity ▁to ▁the ▁Wo j wo de .	0 0 0 0 0 0 0 0 0 0 0 0 0 0 0 0 0 0 0 0 0 0 0 0 0 0 0 0 0 0 0 0 1 1 1 0 0 0 0 0 0 0 0 0 0 0 0 0 0 0 0 0 0 0 0 0 0 0 0 0 0 0 0 0 0 0	DET NOUN NOUN NOUN VERB ADP NOUN NOUN VERB DET NOUN ADP DET PROPN PROPN PROPN PUNCT PROPN PROPN PROPN PUNCT PUNCT NOUN ADP DET NOUN PART VERB NOUN NOUN CCONJ NOUN ADP ADP NOUN ADV ADV VERB DET NOUN NOUN VERB NOUN ADJ NOUN NOUN VERB NOUN ADP DET VERB VERB NOUN CCONJ NOUN CCONJ VERB NOUN NOUN ADP DET PROPN PROPN PROPN PROPN PROPN
Oh I hope so, but still not out of the woods yet	0 0 0 0 0 0 0 1 1 0 1 0	out of the woods	figurative	identical	INTJ PRON VERB ADV CCONJ ADV ADV ADP ADP DET NOUN ADV	▁O h ▁I ▁hope ▁so , ▁but ▁still ▁not ▁out ▁of ▁the ▁wood s ▁yet	0 0 0 0 0 0 0 0 0 1 1 0 1 1 0	INTJ INTJ PRON VERB ADV ADV CCONJ ADV ADV ADP ADP DET NOUN NOUN ADV
I learnt how to make fish, and fruit, and a piece of meat out of wood and coloured paper.	0 0 0 0 0 0 0 0 0 0 0 0 0 1 1 1 0 0 0	out of the woods	literal	combined-inflection	PRON VERB ADV PART VERB NOUN CCONJ NOUN CCONJ DET NOUN ADP NOUN ADP ADP NOUN CCONJ ADJ NOUN	▁I ▁learnt ▁how ▁to ▁make ▁fish , ▁and ▁fruit , ▁and ▁a ▁piece ▁of ▁meat ▁out ▁of ▁wood ▁and ▁coloured ▁paper .	0 0 0 0 0 0 0 0 0 0 0 0 0 0 0 1 1 1 0 0 0 0	PRON VERB ADV PART VERB NOUN NOUN CCONJ NOUN NOUN CCONJ DET NOUN ADP NOUN ADP ADP NOUN CCONJ ADJ NOUN NOUN
A little boy came out of the woods opposite and began skiing down the slope towards the road.	0 0 0 0 1 1 0 1 0 0 0 0 0 0 0 0 0 0	out of the woods	literal	identical	DET ADJ NOUN VERB ADP ADP DET NOUN ADV CCONJ VERB VERB ADP DET NOUN ADP DET NOUN	▁A ▁little ▁boy ▁came ▁out ▁of ▁the ▁wood s ▁opposite ▁and ▁began ▁ski ing ▁down ▁the ▁slope ▁towards ▁the ▁road .	0 0 0 0 1 1 0 1 1 0 0 0 0 0 0 0 0 0 0 0 0	DET ADJ NOUN VERB ADP ADP DET NOUN NOUN ADV CCONJ VERB VERB VERB ADP DET NOUN ADP DET NOUN NOUN
The scheme is not out of the woods yet ; and rather than break the law Maxen last week filled in the local VATman's registration form.	0 0 0 0 1 1 0 1 0 0 0 0 0 0 0 0 0 0 0 0 0 0 0 0 0 0	out of the woods	figurative	identical	DET NOUN VERB ADV ADP ADP DET NOUN ADV PUNCT CCONJ ADV ADP VERB DET NOUN PROPN ADJ NOUN VERB ADP DET ADJ PROPN NOUN NOUN	▁The ▁scheme ▁is ▁not ▁out ▁of ▁the ▁wood s ▁yet ▁ ; ▁and ▁rather ▁than ▁break ▁the ▁law ▁Max en ▁last ▁week ▁filled ▁in ▁the ▁local ▁VAT man ' s ▁registration ▁form .	0 0 0 0 1 1 0 1 1 0 0 0 0 0 0 0 0 0 0 0 0 0 0 0 0 0 0 0 0 0 0 0 0	DET NOUN VERB ADV ADP ADP DET NOUN NOUN ADV PUNCT PUNCT CCONJ ADV ADP VERB DET NOUN PROPN PROPN ADJ NOUN VERB ADP DET ADJ PROPN PROPN PROPN PROPN NOUN NOUN NOUN
Though its international activities and long term contracts business appear to offer some cause for cheer, it seems that Egham, Surrey - based consultancy P - E International Plc is not out of the woods yet.	0 0 0 0 0 0 0 0 0 0 0 0 0 0 0 0 0 0 0 0 0 0 0 0 0 0 0 0 0 0 0 1 1 0 1 0	out of the woods	figurative	identical	ADP ADJ ADJ NOUN CCONJ ADJ NOUN NOUN NOUN VERB PART VERB DET NOUN ADP NOUN PRON VERB ADP PROPN PROPN PUNCT VERB NOUN NOUN PUNCT PROPN PROPN PROPN VERB ADV ADP ADP DET NOUN ADV	▁Though ▁its ▁international ▁activities ▁and ▁long ▁term ▁contracts ▁business ▁appear ▁to ▁offer ▁some ▁cause ▁for ▁che er , ▁it ▁seems ▁that ▁E g ham , ▁Sur re y ▁- ▁based ▁consultancy ▁P ▁- ▁E ▁International ▁P lc ▁is ▁not ▁out ▁of ▁the ▁wood s ▁yet .	0 0 0 0 0 0 0 0 0 0 0 0 0 0 0 0 0 0 0 0 0 0 0 0 0 0 0 0 0 0 0 0 0 0 0 0 0 0 0 1 1 0 1 1 0 0	ADP ADJ ADJ NOUN CCONJ ADJ NOUN NOUN NOUN VERB PART VERB DET NOUN ADP NOUN NOUN NOUN PRON VERB ADP PROPN PROPN PROPN PROPN PROPN PROPN PROPN PUNCT VERB NOUN NOUN PUNCT PROPN PROPN PROPN PROPN VERB ADV ADP ADP DET NOUN NOUN ADV ADV
We came out of Flakebridge Wood, down the road and into Dufton Gill Wood, following the beck that flowed over chocolate - brown sandstone.	0 0 1 1 0 1 0 0 0 0 0 0 0 0 0 0 0 0 0 0 0 0 0 0	out of the woods	literal	combined-inflection	PRON VERB ADP ADP PROPN PROPN ADP DET NOUN CCONJ ADP PROPN PROPN PROPN VERB DET NOUN ADJ VERB ADP NOUN PUNCT ADJ NOUN	▁We ▁came ▁out ▁of ▁F lak e bridge ▁Wood , ▁down ▁the ▁road ▁and ▁into ▁D uf ton ▁Gill ▁Wood , ▁following ▁the ▁be ck ▁that ▁flow ed ▁over ▁chocolate ▁- ▁brown ▁sand stone .	0 0 1 1 0 0 0 0 1 1 0 0 0 0 0 0 0 0 0 0 0 0 0 0 0 0 0 0 0 0 0 0 0 0 0	PRON VERB ADP ADP PROPN PROPN PROPN PROPN PROPN PROPN ADP DET NOUN CCONJ ADP PROPN PROPN PROPN PROPN PROPN PROPN VERB DET NOUN NOUN ADJ VERB VERB ADP NOUN PUNCT ADJ NOUN NOUN NOUN
‘ And although he's much better, the dear love isn't out of the woods yet.	0 0 0 0 0 0 0 0 0 0 1 1 0 1 0	out of the woods	figurative	identical	PUNCT CCONJ ADP PRON ADV ADJ DET ADJ NOUN VERB ADP ADP DET NOUN ADV	▁ ‘ ▁And ▁although ▁he ' s ▁much ▁better , ▁the ▁dear ▁love ▁is n ' t ▁out ▁of ▁the ▁wood s ▁yet .	0 0 0 0 0 0 0 0 0 0 0 0 0 0 0 0 0 1 1 0 1 1 0 0	PUNCT PUNCT CCONJ ADP PRON PRON PRON ADV ADJ ADJ DET ADJ NOUN VERB VERB VERB VERB ADP ADP DET NOUN NOUN ADV ADV
there's still a feeling Nick Brown may not yet be out of the woods.	0 0 0 0 0 0 0 0 0 0 1 1 0 1	out of the woods	figurative	identical	ADV ADV DET NOUN PROPN PROPN VERB ADV ADV VERB ADP ADP DET NOUN	▁there ' s ▁still ▁a ▁feeling ▁N ick ▁Brown ▁may ▁not ▁yet ▁be ▁out ▁of ▁the ▁wood s .	0 0 0 0 0 0 0 0 0 0 0 0 0 1 1 0 1 1 1	ADV ADV ADV ADV DET NOUN PROPN PROPN PROPN VERB ADV ADV VERB ADP ADP DET NOUN NOUN NOUN
But we are not out of the woods.	0 0 0 0 1 1 0 1	out of the woods	figurative	identical	CCONJ PRON VERB ADV ADP ADP DET NOUN	▁But ▁we ▁are ▁not ▁out ▁of ▁the ▁wood s .	0 0 0 0 1 1 0 1 1 1	CCONJ PRON VERB ADV ADP ADP DET NOUN NOUN NOUN
And there was a big room and you and you could go there and, and make things out of wood.	0 0 0 0 0 0 0 0 0 0 0 0 0 0 0 0 0 1 1 1	out of the woods	literal	combined-inflection	CCONJ ADV VERB DET ADJ NOUN CCONJ PRON CCONJ PRON VERB VERB ADV CCONJ CCONJ VERB NOUN ADP ADP NOUN	▁And ▁there ▁was ▁a ▁big ▁room ▁and ▁you ▁and ▁you ▁could ▁go ▁there ▁and , ▁and ▁make ▁things ▁out ▁of ▁wood .	0 0 0 0 0 0 0 0 0 0 0 0 0 0 0 0 0 0 1 1 1 1	CCONJ ADV VERB DET ADJ NOUN CCONJ PRON CCONJ PRON VERB VERB ADV CCONJ CCONJ CCONJ VERB NOUN ADP ADP NOUN NOUN
He 'd most likely be out of the wood by now.	0 0 0 0 0 1 1 0 1 0 0	out of the woods	figurative	inflection	PRON VERB ADV ADV VERB ADP ADP DET NOUN ADP ADV	▁He ▁' d ▁most ▁likely ▁be ▁out ▁of ▁the ▁wood ▁by ▁now .	0 0 0 0 0 0 1 1 0 1 0 0 0	PRON VERB VERB ADV ADV VERB ADP ADP DET NOUN ADP ADV ADV
The boy's head came up sharply, the green eyes flashed their invariable challenge, and flew back jealously to the shape of the opening flower that was heaving itself painfully out of the wood.	0 0 0 0 0 0 0 0 0 0 0 0 0 0 0 0 0 0 0 0 0 0 0 0 0 0 0 0 0 1 1 0 1	out of the woods	figurative	inflection	DET NOUN NOUN VERB PART ADV DET ADJ NOUN VERB ADJ ADJ NOUN CCONJ VERB ADV ADV ADP DET NOUN ADP DET NOUN NOUN ADJ VERB VERB PRON ADV ADP ADP DET NOUN	▁The ▁boy ' s ▁head ▁came ▁up ▁sharply , ▁the ▁green ▁eyes ▁flash ed ▁their ▁in variable ▁challenge , ▁and ▁f lew ▁back ▁jealous ly ▁to ▁the ▁shape ▁of ▁the ▁opening ▁flower ▁that ▁was ▁he av ing ▁itself ▁painful ly ▁out ▁of ▁the ▁wood .	0 0 0 0 0 0 0 0 0 0 0 0 0 0 0 0 0 0 0 0 0 0 0 0 0 0 0 0 0 0 0 0 0 0 0 0 0 0 0 0 1 1 0 1 1	DET NOUN NOUN NOUN NOUN VERB PART ADV ADV DET ADJ NOUN VERB VERB ADJ ADJ ADJ NOUN NOUN CCONJ VERB VERB ADV ADV ADV ADP DET NOUN ADP DET NOUN NOUN ADJ VERB VERB VERB VERB PRON ADV ADV ADP ADP DET NOUN NOUN
While the tank was being prepared and the water standing, six large pieces of bogwood were being soaked in a dustbin to allow the tannic acid to leach out of the wood to a limited extent, as I intended that the wood would still leach out the acid and brown coloration into the aquarium water providing the fish with darkened water to swim around in.	0 0 0 0 0 0 0 0 0 0 0 0 0 0 0 0 0 0 0 0 0 0 0 0 0 0 0 0 1 1 0 1 0 0 0 0 0 0 0 0 0 0 0 0 0 0 0 0 0 0 0 0 0 0 0 0 0 0 0 0 0 0 0 0 0	out of the woods	literal	inflection	ADP DET NOUN VERB VERB VERB CCONJ DET NOUN VERB NUM ADJ NOUN ADP NOUN VERB VERB VERB ADP DET NOUN PART VERB DET ADJ NOUN PART VERB ADP ADP DET NOUN ADP DET ADJ NOUN ADP PRON VERB ADP DET NOUN VERB ADV VERB PART DET NOUN CCONJ ADJ NOUN ADP DET ADJ NOUN VERB DET NOUN ADP VERB NOUN PART VERB ADV ADV	▁While ▁the ▁tank ▁was ▁being ▁prepared ▁and ▁the ▁water ▁standing , ▁six ▁large ▁pieces ▁of ▁bog wood ▁were ▁being ▁soak ed ▁in ▁a ▁dust bin ▁to ▁allow ▁the ▁ tan nic ▁acid ▁to ▁le ach ▁out ▁of ▁the ▁wood ▁to ▁a ▁limited ▁extent , ▁as ▁I ▁intended ▁that ▁the ▁wood ▁would ▁still ▁le ach ▁out ▁the ▁acid ▁and ▁brown ▁color ation ▁into ▁the ▁a quar ium ▁water ▁providing ▁the ▁fish ▁with ▁dark ened ▁water ▁to ▁sw im ▁around ▁in .	0 0 0 0 0 0 0 0 0 0 0 0 0 0 0 0 0 0 0 0 0 0 0 0 0 0 0 0 0 0 0 0 0 0 0 1 1 0 1 0 0 0 0 0 0 0 0 0 0 0 0 0 0 0 0 0 0 0 0 0 0 0 0 0 0 0 0 0 0 0 0 0 0 0 0 0 0 0 0 0	ADP DET NOUN VERB VERB VERB CCONJ DET NOUN VERB VERB NUM ADJ NOUN ADP NOUN NOUN VERB VERB VERB VERB ADP DET NOUN NOUN PART VERB DET ADJ ADJ ADJ NOUN PART VERB VERB ADP ADP DET NOUN ADP DET ADJ NOUN NOUN ADP PRON VERB ADP DET NOUN VERB ADV VERB VERB PART DET NOUN CCONJ ADJ NOUN NOUN ADP DET ADJ ADJ ADJ NOUN VERB DET NOUN ADP VERB VERB NOUN PART VERB VERB ADV ADV ADV
She climbed out of the wood by means of a stile and took the path that led round the cornfield.	0 0 1 1 0 1 0 0 0 0 0 0 0 0 0 0 0 0 0 0	out of the woods	literal	inflection	PRON VERB ADP ADP DET NOUN ADP NOUN ADP DET NOUN CCONJ VERB DET NOUN ADJ VERB ADP DET NOUN	▁She ▁climb ed ▁out ▁of ▁the ▁wood ▁by ▁means ▁of ▁a ▁st ile ▁and ▁took ▁the ▁path ▁that ▁led ▁round ▁the ▁corn field .	0 0 0 1 1 0 1 0 0 0 0 0 0 0 0 0 0 0 0 0 0 0 0 0	PRON VERB VERB ADP ADP DET NOUN ADP NOUN ADP DET NOUN NOUN CCONJ VERB DET NOUN ADJ VERB ADP DET NOUN NOUN NOUN
He looks really dodgy coming out of the woods like that doesn't he?	0 0 0 0 0 1 1 0 1 0 0 0 0	out of the woods	literal	identical	PRON VERB ADV ADJ VERB ADP ADP DET NOUN ADP DET VERB PRON	▁He ▁looks ▁really ▁do d gy ▁coming ▁out ▁of ▁the ▁wood s ▁like ▁that ▁does n ' t ▁he ?	0 0 0 0 0 0 0 1 1 0 1 1 0 0 0 0 0 0 0 0	PRON VERB ADV ADJ ADJ ADJ VERB ADP ADP DET NOUN NOUN ADP DET VERB VERB VERB VERB PRON PRON
But what Katherine liked best were the corner shelves which housed three miniature cities, carved out of wood and painted by an expert hand so that they evoked future urban landscapes.	0 0 0 0 0 0 0 0 0 0 0 0 0 0 0 1 1 1 0 0 0 0 0 0 0 0 0 0 0 0 0	out of the woods	literal	combined-inflection	CCONJ NOUN PROPN VERB ADJ VERB DET NOUN NOUN ADJ VERB NUM ADJ NOUN VERB ADP ADP NOUN CCONJ VERB ADP DET ADJ NOUN ADP ADP PRON VERB ADJ ADJ NOUN	▁But ▁what ▁K ather ine ▁like d ▁best ▁were ▁the ▁corner ▁shelve s ▁which ▁house d ▁three ▁mini ature ▁cities , ▁car ved ▁out ▁of ▁wood ▁and ▁painted ▁by ▁an ▁expert ▁hand ▁so ▁that ▁they ▁e vo ked ▁future ▁urban ▁landscape s .	0 0 0 0 0 0 0 0 0 0 0 0 0 0 0 0 0 0 0 0 0 0 0 1 1 1 0 0 0 0 0 0 0 0 0 0 0 0 0 0 0 0 0	CCONJ NOUN PROPN PROPN PROPN VERB VERB ADJ VERB DET NOUN NOUN NOUN ADJ VERB VERB NUM ADJ ADJ NOUN NOUN VERB VERB ADP ADP NOUN CCONJ VERB ADP DET ADJ NOUN ADP ADP PRON VERB VERB VERB ADJ ADJ NOUN NOUN NOUN
The manager who took Sunderland to Wembley six months ago knows that he's still not out of the woods, but he has turned back the clock in a bid to stay in business.	0 0 0 0 0 0 0 0 0 0 0 0 0 0 0 1 1 0 1 0 0 0 0 0 0 0 0 0 0 0 0 0 0	out of the woods	figurative	identical	DET NOUN NOUN VERB PROPN ADP PROPN NUM NOUN ADV VERB ADP PRON ADV ADV ADP ADP DET NOUN CCONJ PRON VERB VERB PART DET NOUN ADP DET NOUN PART VERB ADP NOUN	▁The ▁manager ▁who ▁took ▁S under land ▁to ▁We mble y ▁six ▁months ▁ago ▁knows ▁that ▁he ' s ▁still ▁not ▁out ▁of ▁the ▁wood s , ▁but ▁he ▁has ▁turned ▁back ▁the ▁clock ▁in ▁a ▁bid ▁to ▁stay ▁in ▁business .	0 0 0 0 0 0 0 0 0 0 0 0 0 0 0 0 0 0 0 0 0 1 1 0 1 1 1 0 0 0 0 0 0 0 0 0 0 0 0 0 0 0	DET NOUN NOUN VERB PROPN PROPN PROPN ADP PROPN PROPN PROPN NUM NOUN ADV VERB ADP PRON PRON PRON ADV ADV ADP ADP DET NOUN NOUN NOUN CCONJ PRON VERB VERB PART DET NOUN ADP DET NOUN PART VERB ADP NOUN NOUN
Another player came out of the wood and began to jog across the Paddock.	0 0 0 1 1 0 1 0 0 0 0 0 0 0	out of the woods	literal	inflection	DET NOUN VERB ADP ADP DET NOUN CCONJ VERB PART VERB ADP DET PROPN	▁Another ▁player ▁came ▁out ▁of ▁the ▁wood ▁and ▁began ▁to ▁jo g ▁across ▁the ▁Pad d ock .	0 0 0 1 1 0 1 0 0 0 0 0 0 0 0 0 0 0	DET NOUN VERB ADP ADP DET NOUN CCONJ VERB PART VERB VERB ADP DET PROPN PROPN PROPN PROPN
Hers said it was by mistake but I know it wasn't and he came wandering out of the wood, all black and shaggy like the Beast in the fairy tale in the most peculiar clothes, very ancient, and dreadful wild hair like pictures of the Prophets.’	0 0 0 0 0 0 0 0 0 0 0 0 0 0 0 1 1 0 1 0 0 0 0 0 0 0 0 0 0 0 0 0 0 0 0 0 0 0 0 0 0 0 0 0 0 0	out of the woods	literal	inflection	NOUN VERB PRON VERB ADP NOUN CCONJ PRON VERB PRON VERB CCONJ PRON VERB VERB ADP ADP DET NOUN DET ADJ CCONJ NOUN ADP DET PROPN ADP DET NOUN NOUN ADP DET ADV ADJ NOUN ADV ADJ CCONJ ADJ ADJ NOUN ADP NOUN ADP DET NOUN	▁Her s ▁said ▁it ▁was ▁by ▁mistake ▁but ▁I ▁know ▁it ▁was n ' t ▁and ▁he ▁came ▁wa nder ing ▁out ▁of ▁the ▁wood , ▁all ▁black ▁and ▁sha gg y ▁like ▁the ▁B east ▁in ▁the ▁fair y ▁ tale ▁in ▁the ▁most ▁peculiar ▁clothes , ▁very ▁ancient , ▁and ▁dreadful ▁wild ▁hair ▁like ▁pictures ▁of ▁the ▁Prop het s . ’	0 0 0 0 0 0 0 0 0 0 0 0 0 0 0 0 0 0 0 0 0 1 1 0 1 1 0 0 0 0 0 0 0 0 0 0 0 0 0 0 0 0 0 0 0 0 0 0 0 0 0 0 0 0 0 0 0 0 0 0 0 0 0 0	NOUN NOUN VERB PRON VERB ADP NOUN CCONJ PRON VERB PRON VERB VERB VERB VERB CCONJ PRON VERB VERB VERB VERB ADP ADP DET NOUN NOUN DET ADJ CCONJ NOUN NOUN NOUN ADP DET PROPN PROPN ADP DET NOUN NOUN NOUN NOUN ADP DET ADV ADJ NOUN NOUN ADV ADJ ADJ CCONJ ADJ ADJ NOUN ADP NOUN ADP DET NOUN NOUN NOUN NOUN NOUN
