He recognizes in Raskolnikov a fellow - struggler, and repeatedly he says that the two of them are birds of a feather ; but he also bids him farewell with a pointed ‘ You to the right and I to the left, or the other way round if you like’ towards the end of their final meeting, because setting off for America, unlike the North Pole, while it may or may not amount to doing anything ( Crime and Punishment doesn't raise the question ) marks a parting of their ways.	0 0 0 0 0 0 0 0 0 0 0 0 0 0 0 0 0 0 1 1 0 1 0 0 0 0 0 0 0 0 0 0 0 0 0 0 0 0 0 0 0 0 0 0 0 0 0 0 0 0 0 0 0 0 0 0 0 0 0 0 0 0 0 0 0 0 0 0 0 0 0 0 0 0 0 0 0 0 0 0 0 0 0 0 0 0 0 0 0 0 0	birds of a feather	figurative	identical	PRON VERB ADP PROPN DET ADJ PUNCT NOUN CCONJ ADV PRON VERB ADP DET NUM ADP PRON VERB NOUN ADP DET NOUN PUNCT CCONJ PRON ADV VERB PRON INTJ ADP DET ADJ NOUN PRON ADP DET NOUN CCONJ PRON ADP DET NOUN CCONJ DET ADJ NOUN ADV ADP PRON ADV ADP DET NOUN ADP ADJ ADJ NOUN ADP VERB PART ADP PROPN ADP DET PROPN PROPN ADP PRON VERB CCONJ VERB ADV VERB ADP VERB NOUN PUNCT PROPN CCONJ PROPN VERB VERB DET NOUN PUNCT VERB DET NOUN ADP ADJ NOUN	▁He ▁recognize s ▁in ▁R ask ol ni kov ▁a ▁fellow ▁- ▁struggle r , ▁and ▁repeatedly ▁he ▁says ▁that ▁the ▁two ▁of ▁them ▁are ▁birds ▁of ▁a ▁feather ▁ ; ▁but ▁he ▁also ▁bids ▁him ▁far e well ▁with ▁a ▁pointed ▁ ‘ ▁You ▁to ▁the ▁right ▁and ▁I ▁to ▁the ▁left , ▁or ▁the ▁other ▁way ▁round ▁if ▁you ▁like ’ ▁towards ▁the ▁end ▁of ▁their ▁final ▁meeting , ▁because ▁setting ▁off ▁for ▁America , ▁unlike ▁the ▁North ▁Pol e , ▁while ▁it ▁may ▁or ▁may ▁not ▁amount ▁to ▁doing ▁anything ▁( ▁Crime ▁and ▁P un ish ment ▁does n ' t ▁raise ▁the ▁question ▁ ) ▁marks ▁a ▁part ing ▁of ▁their ▁ways .	0 0 0 0 0 0 0 0 0 0 0 0 0 0 0 0 0 0 0 0 0 0 0 0 0 1 1 0 1 0 0 0 0 0 0 0 0 0 0 0 0 0 0 0 0 0 0 0 0 0 0 0 0 0 0 0 0 0 0 0 0 0 0 0 0 0 0 0 0 0 0 0 0 0 0 0 0 0 0 0 0 0 0 0 0 0 0 0 0 0 0 0 0 0 0 0 0 0 0 0 0 0 0 0 0 0 0 0 0 0 0 0 0 0 0 0 0	PRON VERB VERB ADP PROPN PROPN PROPN PROPN PROPN DET ADJ PUNCT NOUN NOUN NOUN CCONJ ADV PRON VERB ADP DET NUM ADP PRON VERB NOUN ADP DET NOUN PUNCT PUNCT CCONJ PRON ADV VERB PRON INTJ INTJ INTJ ADP DET ADJ NOUN NOUN PRON ADP DET NOUN CCONJ PRON ADP DET NOUN NOUN CCONJ DET ADJ NOUN ADV ADP PRON ADV ADV ADP DET NOUN ADP ADJ ADJ NOUN NOUN ADP VERB PART ADP PROPN PROPN ADP DET PROPN PROPN PROPN PROPN ADP PRON VERB CCONJ VERB ADV VERB ADP VERB NOUN PUNCT PROPN CCONJ PROPN PROPN PROPN PROPN VERB VERB VERB VERB VERB DET NOUN PUNCT PUNCT VERB DET NOUN NOUN ADP ADJ NOUN NOUN
birds of a feather aren't they really?	1 1 0 1 0 0 0	birds of a feather	figurative	identical	NOUN ADP DET NOUN VERB PRON ADV	▁birds ▁of ▁a ▁feather ▁are n ' t ▁they ▁really ?	1 1 0 1 0 0 0 0 0 0 0	NOUN ADP DET NOUN VERB VERB VERB VERB PRON ADV ADV
Novice anthropologists are not all birds of a feather but most readers of this book are likely to have grown up in a modern industrialized society of the sort which presupposes a particular type of major distinction between private affairs and public affairs.	0 0 0 0 0 1 1 0 1 0 0 0 0 0 0 0 0 0 0 0 0 0 0 0 0 0 0 0 0 0 0 0 0 0 0 0 0 0 0 0 0 0 0	birds of a feather	figurative	identical	NOUN NOUN VERB ADV DET NOUN ADP DET ADJ CCONJ ADJ NOUN ADP DET NOUN VERB ADJ PART VERB VERB PART ADP DET ADJ VERB NOUN ADP DET NOUN ADJ VERB DET ADJ NOUN ADP ADJ NOUN ADP ADJ NOUN CCONJ ADJ NOUN	▁No vice ▁a nthrop ologists ▁are ▁not ▁all ▁birds ▁of ▁a ▁feather ▁but ▁most ▁readers ▁of ▁this ▁book ▁are ▁likely ▁to ▁have ▁grown ▁up ▁in ▁a ▁modern ▁industrial ized ▁society ▁of ▁the ▁sort ▁which ▁presuppose s ▁a ▁particular ▁type ▁of ▁major ▁distinction ▁between ▁private ▁affairs ▁and ▁public ▁affairs .	0 0 0 0 0 0 0 0 1 1 0 1 0 0 0 0 0 0 0 0 0 0 0 0 0 0 0 0 0 0 0 0 0 0 0 0 0 0 0 0 0 0 0 0 0 0 0 0 0	NOUN NOUN NOUN NOUN NOUN VERB ADV DET NOUN ADP DET ADJ CCONJ ADJ NOUN ADP DET NOUN VERB ADJ PART VERB VERB PART ADP DET ADJ VERB VERB NOUN ADP DET NOUN ADJ VERB VERB DET ADJ NOUN ADP ADJ NOUN ADP ADJ NOUN CCONJ ADJ NOUN NOUN
She's told them what to do, birds of a feather.	0 0 0 0 0 0 1 1 0 1	birds of a feather	figurative	identical	PRON VERB PRON NOUN PART VERB NOUN ADP DET NOUN	▁She ' s ▁told ▁them ▁what ▁to ▁do , ▁birds ▁of ▁a ▁feather .	0 0 0 0 0 0 0 0 0 1 1 0 1 1	PRON PRON PRON VERB PRON NOUN PART VERB VERB NOUN ADP DET NOUN NOUN
He too ( ‘ birds of a feather’ ) has nobody to be, and the ice - cold comedy of his father / photographer / landowner mélange projects the disjunctive genius of Crime and Punishment on yet another plane.	0 0 0 0 1 1 0 1 0 0 0 0 0 0 0 0 0 0 0 0 0 0 0 0 0 0 0 0 0 0 0 0 0 0 0 0 0 0 0	birds of a feather	figurative	dashes	PRON ADV PUNCT PUNCT NOUN ADP DET NOUN PUNCT VERB NOUN PART VERB CCONJ DET NOUN PUNCT ADJ NOUN ADP ADJ NOUN SYM NOUN SYM NOUN NOUN NOUN DET ADJ NOUN ADP PROPN CCONJ PROPN ADP ADV DET NOUN	▁He ▁too ▁( ▁ ‘ ▁birds ▁of ▁a ▁feather ’ ▁ ) ▁has ▁nobody ▁to ▁be , ▁and ▁the ▁ice ▁- ▁cold ▁come dy ▁of ▁his ▁father ▁/ ▁photograph er ▁/ ▁land owner ▁ mé lang e ▁projects ▁the ▁dis junc tive ▁g enius ▁of ▁Crime ▁and ▁P un ish ment ▁on ▁yet ▁another ▁plane .	0 0 0 0 0 1 1 0 1 1 0 0 0 0 0 0 0 0 0 0 0 0 0 0 0 0 0 0 0 0 0 0 0 0 0 0 0 0 0 0 0 0 0 0 0 0 0 0 0 0 0 0 0 0 0 0	PRON ADV PUNCT PUNCT PUNCT NOUN ADP DET NOUN NOUN PUNCT PUNCT VERB NOUN PART VERB VERB CCONJ DET NOUN PUNCT ADJ NOUN NOUN ADP ADJ NOUN SYM NOUN NOUN SYM NOUN NOUN NOUN NOUN NOUN NOUN NOUN DET ADJ ADJ ADJ NOUN NOUN ADP PROPN CCONJ PROPN PROPN PROPN PROPN ADP ADV DET NOUN NOUN
Strains of The Rolling Stones, The Faces, Bad Company and Free floated to the surface ( mainly due to Chris Robinson's earthy vocal ), but dig a little deeper and, like all good things, something special eventually showed itself and The Black Crowes proved that they were birds of another feather entirely.	0 0 0 0 0 0 0 0 0 0 0 0 0 0 0 0 0 0 0 0 0 0 0 0 0 0 0 0 0 0 0 0 0 0 0 0 0 0 0 0 0 0 0 0 0 0 0 1 1 0 1 0	birds of a feather	figurative	determiner-broad	NOUN ADP DET PROPN PROPN DET PROPN PROPN PROPN CCONJ PROPN VERB ADP DET NOUN PUNCT ADV ADJ ADP PROPN PROPN ADJ NOUN PUNCT CCONJ VERB DET ADJ ADJ CCONJ ADP DET ADJ NOUN NOUN ADJ ADV VERB PRON CCONJ DET PROPN PROPN VERB ADP PRON VERB NOUN ADP DET NOUN ADV	▁Stra ins ▁of ▁The ▁Rolling ▁Stone s , ▁The ▁Fac es , ▁Bad ▁Company ▁and ▁Free ▁float ed ▁to ▁the ▁surface ▁( ▁mainly ▁due ▁to ▁Chr is ▁Ro bin son ' s ▁earth y ▁voca l ▁ ), ▁but ▁di g ▁a ▁little ▁deeper ▁and , ▁like ▁all ▁good ▁things , ▁something ▁special ▁eventually ▁showed ▁itself ▁and ▁The ▁Black ▁Crow es ▁proved ▁that ▁they ▁were ▁birds ▁of ▁another ▁feather ▁entirely .	0 0 0 0 0 0 0 0 0 0 0 0 0 0 0 0 0 0 0 0 0 0 0 0 0 0 0 0 0 0 0 0 0 0 0 0 0 0 0 0 0 0 0 0 0 0 0 0 0 0 0 0 0 0 0 0 0 0 0 0 0 0 0 0 0 1 1 0 1 0 0	NOUN NOUN ADP DET PROPN PROPN PROPN PROPN DET PROPN PROPN PROPN PROPN PROPN CCONJ PROPN VERB VERB ADP DET NOUN PUNCT ADV ADJ ADP PROPN PROPN PROPN PROPN PROPN PROPN PROPN ADJ ADJ NOUN NOUN PUNCT PUNCT CCONJ VERB VERB DET ADJ ADJ CCONJ CCONJ ADP DET ADJ NOUN NOUN NOUN ADJ ADV VERB PRON CCONJ DET PROPN PROPN PROPN VERB ADP PRON VERB NOUN ADP DET NOUN ADV ADV
