Mr Jeremy took a reed pole, and pushed the boat out into open water.	0 0 0 0 0 0 0 1 0 1 1 0 0 0	push the boat out	literal	inflection	PROPN PROPN VERB DET ADJ NOUN CCONJ VERB DET NOUN PART ADP ADJ NOUN	▁Mr ▁Je rem y ▁took ▁a ▁re ed ▁pole , ▁and ▁pushed ▁the ▁boat ▁out ▁into ▁open ▁water .	0 0 0 0 0 0 0 0 0 0 0 1 0 1 1 0 0 0 0	PROPN PROPN PROPN PROPN VERB DET ADJ ADJ NOUN NOUN CCONJ VERB DET NOUN PART ADP ADJ NOUN NOUN
From the physical joys of fine wines, gourmet foods and making love to the cerebral delights of a trip to the theatre, cinema or ballet this is your chance to push the boat out.	0 0 0 0 0 0 0 0 0 0 0 0 0 0 0 0 0 0 0 0 0 0 0 0 0 0 0 0 0 0 1 0 1 1	push the boat out	figurative	identical	ADP DET ADJ NOUN ADP ADJ NOUN NOUN NOUN CCONJ VERB NOUN ADP DET ADJ NOUN ADP DET NOUN ADP DET NOUN NOUN CCONJ NOUN DET VERB ADJ NOUN PART VERB DET NOUN PART	▁From ▁the ▁physical ▁joy s ▁of ▁fine ▁wines , ▁go ur met ▁foods ▁and ▁making ▁love ▁to ▁the ▁ cerebral ▁delight s ▁of ▁a ▁trip ▁to ▁the ▁theatre , ▁cinema ▁or ▁ball et ▁this ▁is ▁your ▁chance ▁to ▁push ▁the ▁boat ▁out .	0 0 0 0 0 0 0 0 0 0 0 0 0 0 0 0 0 0 0 0 0 0 0 0 0 0 0 0 0 0 0 0 0 0 0 0 0 0 1 0 1 1 1	ADP DET ADJ NOUN NOUN ADP ADJ NOUN NOUN NOUN NOUN NOUN NOUN CCONJ VERB NOUN ADP DET ADJ ADJ NOUN NOUN ADP DET NOUN ADP DET NOUN NOUN NOUN CCONJ NOUN NOUN DET VERB ADJ NOUN PART VERB DET NOUN PART PART
There was a strong smell of fuel, and the water was like ice round my feet as I pushed the boat out before jumping in … ’	0 0 0 0 0 0 0 0 0 0 0 0 0 0 0 0 0 0 1 0 1 1 0 0 0 0 0	push the boat out	literal	inflection	ADV VERB DET ADJ NOUN ADP NOUN CCONJ DET NOUN VERB ADP NOUN ADP ADJ NOUN ADP PRON VERB DET NOUN PART ADP VERB PART PUNCT PUNCT	▁There ▁was ▁a ▁strong ▁smell ▁of ▁fuel , ▁and ▁the ▁water ▁was ▁like ▁ice ▁round ▁my ▁feet ▁as ▁I ▁pushed ▁the ▁boat ▁out ▁before ▁jump ing ▁in ▁... ▁ ’	0 0 0 0 0 0 0 0 0 0 0 0 0 0 0 0 0 0 0 1 0 1 1 0 0 0 0 0 0 0	ADV VERB DET ADJ NOUN ADP NOUN NOUN CCONJ DET NOUN VERB ADP NOUN ADP ADJ NOUN ADP PRON VERB DET NOUN PART ADP VERB VERB PART PUNCT PUNCT PUNCT
‘ By pushing the boat out unilaterally,’ says Weir Group's Ron Garrick, ‘ the Government has put us at a severe disadvantage compared with our German and American counterparts.	0 0 1 0 1 1 0 0 0 0 0 0 0 0 0 0 0 0 0 0 0 0 0 0 0 0 0 0 0	push the boat out	figurative	inflection	PUNCT ADP VERB DET NOUN PART INTJ VERB PROPN PROPN PROPN PROPN PUNCT DET PROPN VERB VERB PRON ADP DET ADJ NOUN VERB ADP ADJ ADJ CCONJ ADJ NOUN	▁ ‘ ▁By ▁pushing ▁the ▁boat ▁out ▁unilaterally , ’ ▁says ▁We ir ▁Group ' s ▁R on ▁Gar rick , ▁ ‘ ▁the ▁Government ▁has ▁put ▁us ▁at ▁a ▁severe ▁disadvantage ▁compared ▁with ▁our ▁German ▁and ▁American ▁counterparts .	0 0 0 1 0 1 1 0 0 0 0 0 0 0 0 0 0 0 0 0 0 0 0 0 0 0 0 0 0 0 0 0 0 0 0 0 0 0 0 0	PUNCT PUNCT ADP VERB DET NOUN PART INTJ INTJ INTJ VERB PROPN PROPN PROPN PROPN PROPN PROPN PROPN PROPN PROPN PROPN PUNCT PUNCT DET PROPN VERB VERB PRON ADP DET ADJ NOUN VERB ADP ADJ ADJ CCONJ ADJ NOUN NOUN
Sir James pushes the boat out for a double celebration	0 0 1 0 1 1 0 0 0 0	push the boat out	figurative	inflection	PROPN PROPN VERB DET NOUN PART ADP DET ADJ NOUN	▁Sir ▁James ▁push es ▁the ▁boat ▁out ▁for ▁a ▁double ▁celebration	0 0 1 1 0 1 1 0 0 0 0	PROPN PROPN VERB VERB DET NOUN PART ADP DET ADJ NOUN
This is carried by a show of hands and the commodore pushes the boat out.	0 0 0 0 0 0 0 0 0 0 0 1 0 1 1	push the boat out	figurative	inflection	DET VERB VERB ADP DET NOUN ADP NOUN CCONJ DET NOUN VERB DET NOUN PART	▁This ▁is ▁carried ▁by ▁a ▁show ▁of ▁hands ▁and ▁the ▁com mod ore ▁push es ▁the ▁boat ▁out .	0 0 0 0 0 0 0 0 0 0 0 0 0 1 1 0 1 1 1	DET VERB VERB ADP DET NOUN ADP NOUN CCONJ DET NOUN NOUN NOUN VERB VERB DET NOUN PART PART
Just when you 're looking forward to pushing the boat out and having a spending spree, your sensible side reminds you of all the practical and prudent things you should be doing with any extra money you have.	0 0 0 0 0 0 0 1 0 1 1 0 0 0 0 0 0 0 0 0 0 0 0 0 0 0 0 0 0 0 0 0 0 0 0 0 0 0	push the boat out	figurative	inflection	ADV ADV PRON VERB VERB ADV ADP VERB DET NOUN PART CCONJ VERB DET NOUN NOUN ADJ ADJ NOUN VERB PRON ADP ADJ DET ADJ CCONJ ADJ NOUN PRON VERB VERB VERB ADP DET ADJ NOUN PRON VERB	▁Just ▁when ▁you ▁' re ▁looking ▁forward ▁to ▁pushing ▁the ▁boat ▁out ▁and ▁having ▁a ▁spending ▁s pre e , ▁your ▁sensible ▁side ▁remind s ▁you ▁of ▁all ▁the ▁practical ▁and ▁prudent ▁things ▁you ▁should ▁be ▁doing ▁with ▁any ▁extra ▁money ▁you ▁have .	0 0 0 0 0 0 0 0 1 0 1 1 0 0 0 0 0 0 0 0 0 0 0 0 0 0 0 0 0 0 0 0 0 0 0 0 0 0 0 0 0 0 0 0	ADV ADV PRON VERB VERB VERB ADV ADP VERB DET NOUN PART CCONJ VERB DET NOUN NOUN NOUN NOUN NOUN ADJ ADJ NOUN VERB VERB PRON ADP ADJ DET ADJ CCONJ ADJ NOUN PRON VERB VERB VERB ADP DET ADJ NOUN PRON VERB VERB
