I mean when one starts to, to scratch the surface, let me just give one example I mean we feel er I M R O fails on on its membership I mean the fact that you had Bishopsgate Investment Management which was the beneficial owner was an organisation in Liechtenstein.	0 0 0 0 0 0 0 1 0 1 0 0 0 0 0 0 0 0 0 0 0 0 0 0 0 0 0 0 0 0 0 0 0 0 0 0 0 0 0 0 0 0 0 0 0 0 0 0 0 0	scratch the surface	figurative	identical	PRON VERB ADV PRON VERB ADP PART VERB DET NOUN VERB PRON ADV VERB NUM NOUN PRON VERB PRON VERB INTJ NOUN NOUN NOUN NOUN VERB PART ADP ADJ NOUN PRON VERB DET NOUN ADP PRON VERB PROPN PROPN PROPN ADJ VERB DET ADJ NOUN VERB DET NOUN ADP PROPN
‘ While partnerships are part of our industry's culture, we were not even scratching the surface of the benefits that could come from taking traditional relationships many steps further,’ he said.	0 0 0 0 0 0 0 0 0 0 0 0 0 1 0 1 0 0 0 0 0 0 0 0 0 0 0 0 0 0 0	scratch the surface	figurative	inflection	PUNCT ADP NOUN VERB NOUN ADP ADJ NOUN NOUN PRON VERB ADV ADV VERB DET NOUN ADP DET NOUN ADJ VERB VERB ADP VERB ADJ NOUN ADJ NOUN ADV PRON VERB
But the community forests — plus the Commission's other plan for 100,000 acres of new forest in the Midlands, which will also soak up redundant land — together with new land released for development, will barely scratch the surface of the problem.	0 0 0 0 0 0 0 0 0 0 0 0 0 0 0 0 0 0 0 0 0 0 0 0 0 0 0 0 0 0 0 0 0 0 0 0 1 0 1 0 0 0	scratch the surface	figurative	identical	CCONJ DET NOUN NOUN PUNCT CCONJ DET PROPN ADJ NOUN ADP NUM NOUN ADP ADJ NOUN ADP DET PROPN ADJ VERB ADV VERB PART ADJ NOUN PUNCT ADV ADP ADJ NOUN VERB ADP NOUN VERB ADV VERB DET NOUN ADP DET NOUN
Never ever use scourers or coarse cleaning pads as this will scratch the stainless steel surface and make cleaning an arduous task in the future.	0 0 0 0 0 0 0 0 0 0 0 1 0 0 0 1 0 0 0 0 0 0 0 0 0	scratch the surface	literal	insertion-other	ADV ADV VERB NOUN CCONJ ADV VERB NOUN ADP DET VERB VERB DET ADJ NOUN NOUN CCONJ VERB VERB DET ADJ NOUN ADP DET NOUN
The subject turned out to be vast and in one year I barely scratched the surface!	0 0 0 0 0 0 0 0 0 0 0 0 0 1 0 1	scratch the surface	figurative	inflection	DET NOUN VERB PART PART VERB ADJ CCONJ ADP NUM NOUN PRON ADV VERB DET NOUN
The various departmental select committees looking at the estimates and the Public Accounts Committee looking at the accounts of what has been spent, can only scratch the surface.	0 0 0 0 0 0 0 0 0 0 0 0 0 0 0 0 0 0 0 0 0 0 0 0 0 1 0 1	scratch the surface	figurative	identical	DET ADJ ADJ ADJ NOUN VERB ADP DET NOUN CCONJ DET PROPN PROPN PROPN VERB ADP DET NOUN ADP NOUN VERB VERB VERB VERB ADV VERB DET NOUN
A Federal Housing Act ( 1949 ) provided funds for slum clearance and housing for those on low incomes, though it only scratched the surface of an increasingly serious problem.	0 0 0 0 0 0 0 0 0 0 0 0 0 0 0 0 0 0 0 0 0 0 1 0 1 0 0 0 0 0	scratch the surface	figurative	inflection	DET PROPN PROPN PROPN PUNCT NUM PUNCT VERB NOUN ADP NOUN NOUN CCONJ NOUN ADP DET ADP ADJ NOUN ADP PRON ADV VERB DET NOUN ADP DET ADV ADJ NOUN
There was much to see and we only ‘ scratched the surface’.	0 0 0 0 0 0 0 0 0 1 0 1	scratch the surface	figurative	combined-inflection	ADV VERB ADJ PART VERB CCONJ PRON ADV PUNCT VERB DET NOUN
Very limited entrepreneurial ambitions, conspicuous consumption and a tendency to spread their thin investments over many ventures [ the ‘ group of companies’ mentality ], a tendency … to only scratch the surface of innovation, the aversion to teaming up with others, all these and other motivational factors are likely to continue to limit the growth of Nigerian enterprises even in those spheres which are exclusively reserved to them and to postpone the day when they may hope to take over the higher reaches of enterprise.	0 0 0 0 0 0 0 0 0 0 0 0 0 0 0 0 0 0 0 0 0 0 0 0 0 0 0 0 0 0 1 0 1 0 0 0 0 0 0 0 0 0 0 0 0 0 0 0 0 0 0 0 0 0 0 0 0 0 0 0 0 0 0 0 0 0 0 0 0 0 0 0 0 0 0 0 0 0 0 0 0 0 0 0 0 0	scratch the surface	figurative	identical	ADV ADJ ADJ NOUN ADJ NOUN CCONJ DET NOUN PART VERB ADJ ADJ NOUN ADP ADJ NOUN PUNCT DET ADJ NOUN ADP NOUN NOUN PUNCT DET NOUN PUNCT PART ADV VERB DET NOUN ADP NOUN DET NOUN ADP VERB PART ADP NOUN ADJ DET CCONJ ADJ ADJ NOUN VERB ADJ PART VERB PART VERB DET NOUN ADP ADJ NOUN ADV ADP DET NOUN ADJ VERB ADV ADJ ADP PRON CCONJ PART VERB DET NOUN ADV PRON VERB VERB PART VERB PART DET ADJ NOUN ADP NOUN
But Mr Smith has merely scratched the surface of Labour's election promises.	0 0 0 0 0 1 0 1 0 0 0 0	scratch the surface	figurative	inflection	CCONJ PROPN PROPN VERB ADV VERB DET NOUN ADP PROPN NOUN NOUN
It's very good — we 've only been there two days and couldn't even scratch the surface.	0 0 0 0 0 0 0 0 0 0 0 0 0 0 1 0 1	scratch the surface	figurative	identical	PRON ADV ADJ PUNCT PRON VERB ADV VERB ADV NUM NOUN CCONJ VERB ADV VERB DET NOUN
All too soon it was over and we left feeling we had just scratched the surface of this fascinating Republic.	0 0 0 0 0 0 0 0 0 0 0 0 0 1 0 1 0 0 0 0	scratch the surface	figurative	inflection	ADV ADV ADV PRON VERB ADV CCONJ PRON VERB NOUN PRON VERB ADV VERB DET NOUN ADP DET ADJ PROPN
There's so much to do about the roots of music that this series hasn't even scratched the surface.	0 0 0 0 0 0 0 0 0 0 0 0 0 0 0 1 0 1	scratch the surface	figurative	inflection	ADV ADV ADJ PART VERB ADP DET NOUN ADP NOUN ADJ DET NOUN VERB ADV VERB DET NOUN
Take care not to scratch the surface on plastic baths.	0 0 0 0 1 0 1 0 0 0	scratch the surface	literal	identical	VERB NOUN ADV PART VERB DET NOUN ADP ADJ NOUN
So far, research into psychoneuroimmunology has done no more than scratch the surface of this potentially important topic.	0 0 0 0 0 0 0 0 0 0 1 0 1 0 0 0 0 0	scratch the surface	figurative	identical	ADV ADV NOUN ADP NOUN VERB VERB DET ADJ ADP NOUN DET NOUN ADP DET ADV ADJ NOUN
Even the prescription of a joint approach to issues of sexism and racism ( Brah and Deem, 1986 ) does little more than scratch the surface of a very much deeper problem.	0 0 0 0 0 0 0 0 0 0 0 0 0 0 0 0 0 0 0 0 0 0 0 1 0 1 0 0 0 0 0 0	scratch the surface	figurative	identical	ADV DET NOUN ADP DET ADJ NOUN ADP NOUN ADP NOUN CCONJ NOUN PUNCT PROPN CCONJ PROPN NUM PUNCT VERB ADJ ADJ ADP NOUN DET NOUN ADP DET ADV ADV ADJ NOUN
The most daunting problem facing Louis Gerstner is that as yet he has absolutely no idea just how much he doesn't know — and he will be Superman if in six months he has more than scratched the surface on that problem.	0 0 0 0 0 0 0 0 0 0 0 0 0 0 0 0 0 0 0 0 0 0 0 0 0 0 0 0 0 0 0 0 0 0 0 0 1 0 1 0 0 0	scratch the surface	figurative	inflection	DET ADV ADJ NOUN VERB PROPN PROPN VERB DET ADV ADV PRON VERB ADV DET NOUN ADV ADV ADJ PRON VERB VERB PUNCT CCONJ PRON VERB VERB PROPN ADP ADP NUM NOUN PRON VERB ADV ADP VERB DET NOUN ADP DET NOUN
Its thin beam barely scratched the surface of the door.	0 0 0 0 1 0 1 0 0 0	scratch the surface	figurative	inflection	ADJ ADJ NOUN ADV VERB DET NOUN ADP DET NOUN
My grandad fought for them all his life, but the things you 're talking about, they 're only scratching the surface.’	0 0 0 0 0 0 0 0 0 0 0 0 0 0 0 0 0 0 1 0 1	scratch the surface	figurative	combined-inflection	ADJ NOUN VERB ADP PRON ADJ ADJ NOUN CCONJ DET NOUN PRON VERB VERB ADP PRON VERB ADV VERB DET NOUN
As Rob said : ‘ Our contribution hardly scratched the surface of what was needed out there, but it's essential that every effort is made to make life bearable until sanity returns.’	0 0 0 0 0 0 0 0 1 0 1 0 0 0 0 0 0 0 0 0 0 0 0 0 0 0 0 0 0 0 0 0	scratch the surface	figurative	inflection	ADP PROPN VERB PUNCT PUNCT ADJ NOUN ADV VERB DET NOUN ADP NOUN VERB VERB ADV ADV CCONJ PRON ADJ ADP DET NOUN VERB VERB PART VERB NOUN ADJ ADP NOUN ADJ
‘ Utilities such as electricity have a boring image but scratch the surface and it's fascinating.	0 0 0 0 0 0 0 0 0 0 1 0 1 0 0 0	scratch the surface	figurative	identical	PUNCT NOUN ADJ ADP NOUN VERB DET ADJ NOUN CCONJ VERB DET NOUN CCONJ PRON ADJ
And scratched the surface.	0 1 0 1	scratch the surface	figurative	inflection	CCONJ VERB DET NOUN
But scratch the surface, and an astonishing mystery is revealed.	0 1 0 1 0 0 0 0 0 0	scratch the surface	figurative	identical	CCONJ VERB DET NOUN CCONJ DET ADJ NOUN VERB VERB
By the time we finish with it we shall have just scratched the surface of the subject.	0 0 0 0 0 0 0 0 0 0 0 1 0 1 0 0 0	scratch the surface	figurative	inflection	ADP DET NOUN PRON VERB ADP PRON PRON VERB VERB ADV VERB DET NOUN ADP DET NOUN
In fact, this negative verdict barely scratches the surface of France ’s predicament.	0 0 0 0 0 0 1 0 1 0 0 0 0	scratch the surface	figurative	inflection	ADP NOUN DET ADJ NOUN ADV VERB DET NOUN ADP PROPN PART NOUN
‘ In fact, you 'll soon find out that three square meals a day is hardly scratching the surface — most kids seem to have an ever - open stomach.’	0 0 0 0 0 0 0 0 0 0 0 0 0 0 0 0 1 0 1 0 0 0 0 0 0 0 0 0 0 0	scratch the surface	figurative	inflection	PUNCT ADP NOUN PRON VERB ADV VERB PART ADP NUM ADJ NOUN DET NOUN VERB ADV VERB DET NOUN PUNCT ADJ NOUN VERB PART VERB DET ADV PUNCT ADJ NOUN