Dempsey's tooth there's all blood coming out of his mouth I said see, serves you right.	0 0 0 0 0 0 0 0 0 0 0 0 0 1 1 1	serve someone right	figurative	combined-inflection	PROPN NOUN ADV DET NOUN VERB ADP ADP ADJ NOUN PRON VERB INTJ VERB PRON ADJ	▁De mp s ey ' s ▁to oth ▁there ' s ▁all ▁blood ▁coming ▁out ▁of ▁his ▁mouth ▁I ▁said ▁see , ▁serves ▁you ▁right .	0 0 0 0 0 0 0 0 0 0 0 0 0 0 0 0 0 0 0 0 0 0 1 1 1 1	PROPN PROPN PROPN PROPN PROPN PROPN NOUN NOUN ADV ADV ADV DET NOUN VERB ADP ADP ADJ NOUN PRON VERB INTJ INTJ VERB PRON ADJ ADJ
Serve you right if he 'd killed you, ' and he stared at her, his lower jaw drooping.	1 1 1 0 0 0 0 0 0 0 0 0 0 0 0 0 0 0	serve someone right	figurative	combined-other	VERB PRON ADV ADP PRON VERB VERB PRON PUNCT CCONJ PRON VERB ADP PRON ADJ ADJ NOUN VERB	▁Serv e ▁you ▁right ▁if ▁he ▁' d ▁killed ▁you , ▁' ▁and ▁he ▁star ed ▁at ▁her , ▁his ▁lower ▁jaw ▁ dro op ing .	1 1 1 1 0 0 0 0 0 0 0 0 0 0 0 0 0 0 0 0 0 0 0 0 0 0 0	VERB VERB PRON ADV ADP PRON VERB VERB VERB PRON PRON PUNCT CCONJ PRON VERB VERB ADP PRON PRON ADJ ADJ NOUN VERB VERB VERB VERB VERB
Rhoda said when she came to tea at the weekend, ‘ You only remember what you want to remember, Ken ; serve you right.	0 0 0 0 0 0 0 0 0 0 0 0 0 0 0 0 0 0 0 0 0 1 1 1	serve someone right	figurative	objective	PROPN VERB ADV PRON VERB ADP NOUN ADP DET NOUN PUNCT PRON ADV VERB NOUN PRON VERB PART VERB PROPN PUNCT VERB PRON ADJ	▁R ho da ▁said ▁when ▁she ▁came ▁to ▁tea ▁at ▁the ▁weekend , ▁ ‘ ▁You ▁only ▁remember ▁what ▁you ▁want ▁to ▁remember , ▁K en ▁ ; ▁serve ▁you ▁right .	0 0 0 0 0 0 0 0 0 0 0 0 0 0 0 0 0 0 0 0 0 0 0 0 0 0 0 0 1 1 1 1	PROPN PROPN PROPN VERB ADV PRON VERB ADP NOUN ADP DET NOUN NOUN PUNCT PUNCT PRON ADV VERB NOUN PRON VERB PART VERB VERB PROPN PROPN PUNCT PUNCT VERB PRON ADJ ADJ
Serves him right if the sea rises up and drowns him! '	1 1 1 0 0 0 0 0 0 0 0 0	serve someone right	figurative	combined-inflection	VERB PRON ADV ADP DET NOUN VERB PART CCONJ VERB PRON PUNCT	▁Serv es ▁him ▁right ▁if ▁the ▁sea ▁rises ▁up ▁and ▁dr own s ▁him ! ▁'	1 1 1 1 0 0 0 0 0 0 0 0 0 0 0 0	VERB VERB PRON ADV ADP DET NOUN VERB PART CCONJ VERB VERB VERB PRON PRON PUNCT
It served her right for thinking too much of the violets ; not caring much for drink, she did not mind losing the Madeira.	0 1 1 1 0 0 0 0 0 0 0 0 0 0 0 0 0 0 0 0 0 0 0 0	serve someone right	figurative	combined-inflection	PRON VERB PRON ADV ADP VERB ADV ADJ ADP DET NOUN PUNCT ADV VERB ADV ADP NOUN PRON VERB ADV VERB VERB DET PROPN	▁It ▁served ▁her ▁right ▁for ▁thinking ▁too ▁much ▁of ▁the ▁ violet s ▁ ; ▁not ▁caring ▁much ▁for ▁drink , ▁she ▁did ▁not ▁mind ▁ losing ▁the ▁Madeira .	0 1 1 1 0 0 0 0 0 0 0 0 0 0 0 0 0 0 0 0 0 0 0 0 0 0 0 0 0 0	PRON VERB PRON ADV ADP VERB ADV ADJ ADP DET NOUN NOUN NOUN PUNCT PUNCT ADV VERB ADV ADP NOUN NOUN PRON VERB ADV VERB VERB VERB DET PROPN PROPN
She was happily thinking, Serves him right, a pity there wasn't a cloudburst, when across the car park, in an area where the top managers of Vasey's normally parked their cars, she noticed that room had been made for another car.	0 0 0 0 1 1 1 0 0 0 0 0 0 0 0 0 0 0 0 0 0 0 0 0 0 0 0 0 0 0 0 0 0 0 0 0 0 0 0 0 0	serve someone right	figurative	combined-inflection	PRON VERB ADV VERB VERB PRON ADV DET NOUN ADV VERB DET NOUN ADV ADP DET NOUN NOUN ADP DET NOUN ADV DET ADJ NOUN ADP PROPN ADV VERB ADJ NOUN PRON VERB DET NOUN VERB VERB VERB ADP DET NOUN	▁She ▁was ▁happily ▁thinking , ▁Serv es ▁him ▁right , ▁a ▁pity ▁there ▁was n ' t ▁a ▁cloud bur st , ▁when ▁across ▁the ▁car ▁park , ▁in ▁an ▁area ▁where ▁the ▁top ▁managers ▁of ▁V ase y ' s ▁normally ▁park ed ▁their ▁cars , ▁she ▁noticed ▁that ▁room ▁had ▁been ▁made ▁for ▁another ▁car .	0 0 0 0 0 1 1 1 1 1 0 0 0 0 0 0 0 0 0 0 0 0 0 0 0 0 0 0 0 0 0 0 0 0 0 0 0 0 0 0 0 0 0 0 0 0 0 0 0 0 0 0 0 0 0 0 0 0	PRON VERB ADV VERB VERB VERB VERB PRON ADV ADV DET NOUN ADV VERB VERB VERB VERB DET NOUN NOUN NOUN NOUN ADV ADP DET NOUN NOUN NOUN ADP DET NOUN ADV DET ADJ NOUN ADP PROPN PROPN PROPN PROPN PROPN ADV VERB VERB ADJ NOUN NOUN PRON VERB DET NOUN VERB VERB VERB ADP DET NOUN NOUN
' Serve her right. '	0 1 1 1 0	serve someone right	figurative	combined-other	PUNCT VERB PRON NOUN PUNCT	▁' ▁Serv e ▁her ▁right . ▁'	0 1 1 1 1 1 0	PUNCT VERB VERB PRON NOUN NOUN PUNCT
serves them right my makes you wanna fucking cry don't it, ah?	1 1 1 0 0 0 0 0 0 0 0 0	serve someone right	figurative	combined-inflection	VERB PRON ADV ADJ VERB PRON ADJ INTJ NOUN VERB PRON INTJ	▁serves ▁them ▁right ▁my ▁makes ▁you ▁w anna ▁f uck ing ▁cry ▁don ' t ▁it , ▁a h ?	1 1 1 0 0 0 0 0 0 0 0 0 0 0 0 0 0 0 0 0	VERB PRON ADV ADJ VERB PRON ADJ ADJ INTJ INTJ INTJ NOUN VERB VERB VERB PRON PRON INTJ INTJ INTJ
' Serve him right, ' Mrs Wormwood said.	0 1 1 1 0 0 0 0	serve someone right	figurative	combined-other	PUNCT VERB PRON ADJ PUNCT PROPN PROPN VERB	▁' ▁Serv e ▁him ▁right , ▁' ▁Mrs ▁Wo rm wood ▁said .	0 1 1 1 1 1 0 0 0 0 0 0 0	PUNCT VERB VERB PRON ADJ ADJ PUNCT PROPN PROPN PROPN PROPN VERB VERB
Serve him right, Virginia thought uncharitably, but some buried corner of her rejoiced that Guy had told the truth, at least on that score …	1 1 1 0 0 0 0 0 0 0 0 0 0 0 0 0 0 0 0 0 0 0 0 0 0	serve someone right	figurative	combined-other	VERB PRON ADJ PROPN VERB ADV CCONJ DET VERB NOUN ADP ADJ ADJ ADP PROPN VERB VERB DET NOUN ADP ADJ ADP DET NOUN PUNCT	▁Serv e ▁him ▁right , ▁ Virginia ▁thought ▁un char i tably , ▁but ▁some ▁buried ▁corner ▁of ▁her ▁rejoice d ▁that ▁Gu y ▁had ▁told ▁the ▁truth , ▁at ▁least ▁on ▁that ▁score ▁...	1 1 1 1 1 0 0 0 0 0 0 0 0 0 0 0 0 0 0 0 0 0 0 0 0 0 0 0 0 0 0 0 0 0 0	VERB VERB PRON ADJ ADJ PROPN PROPN VERB ADV ADV ADV ADV ADV CCONJ DET VERB NOUN ADP ADJ ADJ ADJ ADP PROPN PROPN VERB VERB DET NOUN NOUN ADP ADJ ADP DET NOUN PUNCT
‘ Well,’ he said, ‘ that serves you right.	0 0 0 0 0 0 1 1 1	serve someone right	figurative	combined-inflection	PUNCT ADP PRON VERB PUNCT ADJ VERB PRON ADJ	▁ ‘ ▁Well , ’ ▁he ▁said , ▁ ‘ ▁that ▁serves ▁you ▁right .	0 0 0 0 0 0 0 0 0 0 0 1 1 1 1	PUNCT PUNCT ADP ADP ADP PRON VERB VERB PUNCT PUNCT ADJ VERB PRON ADJ ADJ
Well, it would serve them right for treating her like a baby.	0 0 0 1 1 1 0 0 0 0 0 0	serve someone right	figurative	objective	INTJ PRON VERB VERB PRON ADJ ADP VERB PRON ADP DET NOUN	▁Well , ▁it ▁would ▁serve ▁them ▁right ▁for ▁treating ▁her ▁like ▁a ▁baby .	0 0 0 0 1 1 1 0 0 0 0 0 0 0	INTJ INTJ PRON VERB VERB PRON ADJ ADP VERB PRON ADP DET NOUN NOUN
serves her right	1 1 1	serve someone right	figurative	combined-inflection	VERB PRON ADJ	▁serves ▁her ▁right	1 1 1	VERB PRON ADJ
‘ It was a new bike and served you right, anyway,’ he said.	0 0 0 0 0 0 0 1 1 1 0 0 0	serve someone right	figurative	combined-inflection	PUNCT PRON VERB DET ADJ NOUN CCONJ VERB PRON ADV PROPN PRON VERB	▁ ‘ ▁It ▁was ▁a ▁new ▁bi ke ▁and ▁served ▁you ▁right , ▁anyway , ’ ▁he ▁said .	0 0 0 0 0 0 0 0 0 1 1 1 1 0 0 0 0 0 0	PUNCT PUNCT PRON VERB DET ADJ NOUN NOUN CCONJ VERB PRON ADV ADV PROPN PROPN PROPN PRON VERB VERB
' Serves you right, my girl, ' she whispered.	0 1 1 1 0 0 0 0 0	serve someone right	figurative	combined-inflection	PUNCT VERB PRON ADV ADJ NOUN PUNCT PRON VERB	▁' ▁Serv es ▁you ▁right , ▁my ▁girl , ▁' ▁she ▁wh isper ed .	0 1 1 1 1 1 0 0 0 0 0 0 0 0 0	PUNCT VERB VERB PRON ADV ADV ADJ NOUN NOUN PUNCT PRON VERB VERB VERB VERB
‘ That 'll serve Gina right.’	0 0 0 1 1 0	serve someone right	figurative	combined-other	PUNCT DET VERB VERB PROPN PUNCT	▁ ‘ ▁That ▁' ll ▁serve ▁G ina ▁right . ’	0 0 0 0 0 1 1 1 0 0 0	PUNCT PUNCT DET VERB VERB VERB PROPN PROPN PUNCT PUNCT PUNCT
It 'll serve him right if he fails the exam ; he doesn't study at ~ all.	0 0 1 1 1 0 0 0 0 0 0 0 0 0 0 0 0	serve someone right	figurative	objective	PRON VERB VERB PRON ADV ADP PRON VERB DET NOUN PUNCT PRON VERB VERB ADP PUNCT DET	▁It ▁' ll ▁serve ▁him ▁right ▁if ▁he ▁fails ▁the ▁exam ▁ ; ▁he ▁does n ' t ▁study ▁at ▁ ~ ▁all .	0 0 0 1 1 1 0 0 0 0 0 0 0 0 0 0 0 0 0 0 0 0 0 0	PRON VERB VERB VERB PRON ADV ADP PRON VERB DET NOUN PUNCT PUNCT PRON VERB VERB VERB VERB VERB ADP PUNCT PUNCT DET DET
‘ It would serve you right if you had broken the damn ankle,’ Travis declared with suppressed violence as he knelt down.	0 0 0 1 1 1 0 0 0 0 0 0 0 0 0 0 0 0 0 0 0 0	serve someone right	figurative	objective	PUNCT PRON VERB VERB PRON ADV ADP PRON VERB VERB DET NOUN ADJ PROPN VERB ADP VERB NOUN ADP PRON VERB PART	▁ ‘ ▁It ▁would ▁serve ▁you ▁right ▁if ▁you ▁had ▁broken ▁the ▁dam n ▁ankle , ’ ▁Tra vis ▁declared ▁with ▁suppressed ▁violence ▁as ▁he ▁k nel t ▁down .	0 0 0 0 1 1 1 0 0 0 0 0 0 0 0 0 0 0 0 0 0 0 0 0 0 0 0 0 0 0	PUNCT PUNCT PRON VERB VERB PRON ADV ADP PRON VERB VERB DET NOUN NOUN ADJ ADJ ADJ PROPN PROPN VERB ADP VERB NOUN ADP PRON VERB VERB VERB PART PART
It would serve her right.	0 0 1 1 1	serve someone right	figurative	objective	PRON VERB VERB PRON NOUN	▁It ▁would ▁serve ▁her ▁right .	0 0 1 1 1 1	PRON VERB VERB PRON NOUN NOUN
' Served the bastard right … ' he said quietly.	0 1 0 1 1 0 0 0 0 0	serve someone right	figurative	combined-inflection	PUNCT VERB DET NOUN NOUN PUNCT PUNCT PRON VERB ADV	▁' ▁Serv ed ▁the ▁bast ard ▁right ▁... ▁' ▁he ▁said ▁quiet ly .	0 1 1 0 1 1 1 0 0 0 0 0 0 0	PUNCT VERB VERB DET NOUN NOUN NOUN PUNCT PUNCT PRON VERB ADV ADV ADV
It's crazy, it's crazy, if only people again'd sit back and look at it and see exactly what's happening, rather than saying it serves them right, they shouldn't of done this, they shouldn't of got themselves into that position they 're in that position	0 0 0 0 0 0 0 0 0 0 0 0 0 0 0 0 0 0 0 0 0 0 0 1 1 1 0 0 0 0 0 0 0 0 0 0 0 0 0 0 0 0 0 0	serve someone right	figurative	combined-inflection	PRON ADJ PRON ADJ ADP ADJ NOUN NOUN VERB ADV CCONJ VERB ADP PRON CCONJ VERB ADV NOUN VERB ADV ADP VERB PRON VERB PRON ADJ PRON VERB VERB VERB DET PRON VERB ADP VERB PRON ADP DET NOUN PRON VERB ADP DET NOUN	▁It ' s ▁c raz y , ▁it ' s ▁c raz y , ▁if ▁only ▁people ▁again ' d ▁sit ▁back ▁and ▁look ▁at ▁it ▁and ▁see ▁exactly ▁what ' s ▁happening , ▁rather ▁than ▁saying ▁it ▁serves ▁them ▁right , ▁they ▁should n ' t ▁of ▁done ▁this , ▁they ▁should n ' t ▁of ▁got ▁themselves ▁into ▁that ▁position ▁they ▁' re ▁in ▁that ▁position	0 0 0 0 0 0 0 0 0 0 0 0 0 0 0 0 0 0 0 0 0 0 0 0 0 0 0 0 0 0 0 0 0 0 0 0 0 0 1 1 1 1 0 0 0 0 0 0 0 0 0 0 0 0 0 0 0 0 0 0 0 0 0 0 0 0 0 0	PRON PRON PRON ADJ ADJ ADJ ADJ PRON PRON PRON ADJ ADJ ADJ ADJ ADP ADJ NOUN NOUN NOUN NOUN VERB ADV CCONJ VERB ADP PRON CCONJ VERB ADV NOUN NOUN NOUN VERB VERB ADV ADP VERB PRON VERB PRON ADJ ADJ PRON VERB VERB VERB VERB VERB VERB DET DET PRON VERB VERB VERB VERB ADP VERB PRON ADP DET NOUN PRON VERB VERB ADP DET NOUN
But serve her right, she had cut off her own source of fine delicate shoes, she would not find their like again, not in Swansea.	0 1 1 1 0 0 0 0 0 0 0 0 0 0 0 0 0 0 0 0 0 0 0 0 0	serve someone right	figurative	objective	CCONJ VERB PRON ADV PRON VERB VERB PART ADJ ADJ NOUN ADP ADJ ADJ NOUN PRON VERB ADV VERB ADJ INTJ ADV ADV ADP PROPN	▁But ▁serve ▁her ▁right , ▁she ▁had ▁cut ▁off ▁her ▁own ▁source ▁of ▁fine ▁delicate ▁shoes , ▁she ▁would ▁not ▁find ▁their ▁like ▁again , ▁not ▁in ▁S wan sea .	0 1 1 1 1 0 0 0 0 0 0 0 0 0 0 0 0 0 0 0 0 0 0 0 0 0 0 0 0 0 0	CCONJ VERB PRON ADV ADV PRON VERB VERB PART ADJ ADJ NOUN ADP ADJ ADJ NOUN NOUN PRON VERB ADV VERB ADJ INTJ ADV ADV ADV ADP PROPN PROPN PROPN PROPN
It 'd 've served him right for being such a spaced - out hippy.	0 0 0 1 1 1 0 0 0 0 0 0 0 0	serve someone right	figurative	combined-inflection	PRON VERB VERB VERB PRON ADV ADP VERB ADJ DET VERB PUNCT PART ADJ	▁It ▁' d ▁' ve ▁served ▁him ▁right ▁for ▁being ▁such ▁a ▁space d ▁- ▁out ▁hip py .	0 0 0 0 0 1 1 1 0 0 0 0 0 0 0 0 0 0 0	PRON VERB VERB VERB VERB VERB PRON ADV ADP VERB ADJ DET VERB VERB PUNCT PART ADJ ADJ ADJ
It serves her right really.	0 1 1 1 0	serve someone right	figurative	combined-inflection	PRON VERB PRON ADV ADV	▁It ▁serves ▁her ▁right ▁really .	0 1 1 1 0 0	PRON VERB PRON ADV ADV ADV
Serve him right.	1 1 1	serve someone right	figurative	combined-other	VERB PRON ADJ	▁Serv e ▁him ▁right .	1 1 1 1 1	VERB VERB PRON ADJ ADJ
Serve them right, he thought vindictively and then, imitated at his own childishness, turned his head to look at the other people arranged alongside him, the desk's shining expanse of polished wood reflecting their faces as twisted white blobs.	1 1 1 0 0 0 0 0 0 0 0 0 0 0 0 0 0 0 0 0 0 0 0 0 0 0 0 0 0 0 0 0 0 0 0 0 0 0 0	serve someone right	figurative	combined-other	VERB PRON ADV PRON VERB ADV CCONJ ADV VERB ADP ADJ ADJ NOUN VERB ADJ NOUN PART VERB ADP DET ADJ NOUN VERB ADP PRON DET NOUN VERB NOUN ADP ADJ NOUN VERB ADJ NOUN ADP ADJ ADJ NOUN	▁Serv e ▁them ▁right , ▁he ▁thought ▁ vin dic tively ▁and ▁then , ▁im itate d ▁at ▁his ▁own ▁child ish ness , ▁turned ▁his ▁head ▁to ▁look ▁at ▁the ▁other ▁people ▁arranged ▁alongside ▁him , ▁the ▁desk ' s ▁sh in ing ▁ex pan se ▁of ▁polished ▁wood ▁reflecting ▁their ▁faces ▁as ▁twisted ▁white ▁b lob s .	1 1 1 1 1 0 0 0 0 0 0 0 0 0 0 0 0 0 0 0 0 0 0 0 0 0 0 0 0 0 0 0 0 0 0 0 0 0 0 0 0 0 0 0 0 0 0 0 0 0 0 0 0 0 0 0 0 0 0 0	VERB VERB PRON ADV ADV PRON VERB ADV ADV ADV ADV CCONJ ADV ADV VERB VERB VERB ADP ADJ ADJ NOUN NOUN NOUN NOUN VERB ADJ NOUN PART VERB ADP DET ADJ NOUN VERB ADP PRON PRON DET NOUN NOUN NOUN VERB VERB VERB NOUN NOUN NOUN ADP ADJ NOUN VERB ADJ NOUN ADP ADJ ADJ NOUN NOUN NOUN NOUN
' Serve him right if they do.	0 1 1 1 0 0 0	serve someone right	figurative	combined-other	PUNCT VERB PRON ADV ADP PRON VERB	▁' ▁Serv e ▁him ▁right ▁if ▁they ▁do .	0 1 1 1 1 0 0 0 0	PUNCT VERB VERB PRON ADV ADP PRON VERB VERB
‘ Oh well, serves me right for being nosey.	0 0 0 1 1 1 0 0 0	serve someone right	figurative	combined-inflection	PUNCT INTJ INTJ VERB PRON ADJ ADP VERB ADJ	▁ ‘ ▁O h ▁well , ▁serves ▁me ▁right ▁for ▁being ▁nose y .	0 0 0 0 0 0 1 1 1 0 0 0 0 0	PUNCT PUNCT INTJ INTJ INTJ INTJ VERB PRON ADJ ADP VERB ADJ ADJ ADJ
It serves them right for playing a game in which even the winners become losers if they try to repeat their success.	0 1 1 1 0 0 0 0 0 0 0 0 0 0 0 0 0 0 0 0 0 0	serve someone right	figurative	combined-inflection	PRON VERB PRON ADJ ADP VERB DET NOUN ADP ADJ ADV DET NOUN VERB NOUN ADP PRON VERB PART VERB ADJ NOUN	▁It ▁serves ▁them ▁right ▁for ▁playing ▁a ▁game ▁in ▁which ▁even ▁the ▁winner s ▁become ▁lose rs ▁if ▁they ▁try ▁to ▁repeat ▁their ▁success .	0 1 1 1 0 0 0 0 0 0 0 0 0 0 0 0 0 0 0 0 0 0 0 0 0	PRON VERB PRON ADJ ADP VERB DET NOUN ADP ADJ ADV DET NOUN NOUN VERB NOUN NOUN ADP PRON VERB PART VERB ADJ NOUN NOUN
Serve them right.	1 1 1	serve someone right	figurative	combined-other	VERB PRON ADJ	▁Serv e ▁them ▁right .	1 1 1 1 1	VERB VERB PRON ADJ ADJ
It's a lot of bucks but it serves me right.’	0 0 0 0 0 0 0 1 1 1	serve someone right	figurative	combined-inflection	PRON DET NOUN ADP NOUN CCONJ PRON VERB PRON PUNCT	▁It ' s ▁a ▁lot ▁of ▁buck s ▁but ▁it ▁serves ▁me ▁right . ’	0 0 0 0 0 0 0 0 0 0 1 1 1 1 1	PRON PRON PRON DET NOUN ADP NOUN NOUN CCONJ PRON VERB PRON PUNCT PUNCT PUNCT
serves you right.	1 1 1	serve someone right	figurative	combined-inflection	VERB PRON ADJ	▁serves ▁you ▁right .	1 1 1 1	VERB PRON ADJ ADJ
Serve her right.	1 1 1	serve someone right	figurative	combined-other	VERB PRON NOUN	▁Serv e ▁her ▁right .	1 1 1 1 1	VERB VERB PRON NOUN NOUN
Serves her right.	1 1 1	serve someone right	figurative	combined-inflection	VERB PRON NOUN	▁Serv es ▁her ▁right .	1 1 1 1 1	VERB VERB PRON NOUN NOUN
Come on serves them right	0 0 1 1 1	serve someone right	figurative	combined-inflection	VERB PART VERB PRON ADJ	▁Com e ▁on ▁serves ▁them ▁right	0 0 0 1 1 1	VERB VERB PART VERB PRON ADJ
They made me feel like a dirty slag and serve me right for getting pregnant.	0 0 0 0 0 0 0 0 0 1 1 1 0 0 0	serve someone right	figurative	objective	PRON VERB PRON VERB ADP DET ADJ NOUN CCONJ VERB PRON ADV ADP VERB ADJ	▁They ▁made ▁me ▁feel ▁like ▁a ▁dirty ▁slag ▁and ▁serve ▁me ▁right ▁for ▁gett ing ▁pregnant .	0 0 0 0 0 0 0 0 0 1 1 1 0 0 0 0 0	PRON VERB PRON VERB ADP DET ADJ NOUN CCONJ VERB PRON ADV ADP VERB VERB ADJ ADJ
Nobody has exemplified the extremes of this aberration of outdoor endeavour more than Chris Townsend, so it serves him right that he is called to write a book on the subject.	0 0 0 0 0 0 0 0 0 0 0 0 0 0 0 0 0 1 1 1 0 0 0 0 0 0 0 0 0 0 0	serve someone right	figurative	combined-inflection	NOUN VERB VERB DET NOUN ADP DET NOUN ADP ADJ NOUN ADJ ADP PROPN PROPN CCONJ PRON VERB PRON ADJ ADP PRON VERB VERB PART VERB DET NOUN ADP DET NOUN	▁Nobody ▁has ▁ex em pl ified ▁the ▁extreme s ▁of ▁this ▁aberration ▁of ▁outdoor ▁endeavour ▁more ▁than ▁Chr is ▁Town s end , ▁so ▁it ▁serves ▁him ▁right ▁that ▁he ▁is ▁called ▁to ▁write ▁a ▁book ▁on ▁the ▁subject .	0 0 0 0 0 0 0 0 0 0 0 0 0 0 0 0 0 0 0 0 0 0 0 0 0 1 1 1 0 0 0 0 0 0 0 0 0 0 0 0	NOUN VERB VERB VERB VERB VERB DET NOUN NOUN ADP DET NOUN ADP ADJ NOUN ADJ ADP PROPN PROPN PROPN PROPN PROPN PROPN CCONJ PRON VERB PRON ADJ ADP PRON VERB VERB PART VERB DET NOUN ADP DET NOUN NOUN
Well, it served me right.	0 0 1 1 1	serve someone right	figurative	combined-inflection	INTJ PRON VERB PRON ADV	▁Well , ▁it ▁served ▁me ▁right .	0 0 0 1 1 1 1	INTJ INTJ PRON VERB PRON ADV ADV
It was an Unmentionable Disease, and he 'd caught it because he 'd been to an Unmentionable Place and so it served him right, but that didn't make it any less sore.	0 0 0 0 0 0 0 0 0 0 0 0 0 0 0 0 0 0 0 0 0 1 1 1 0 0 0 0 0 0 0 0	serve someone right	figurative	combined-inflection	PRON VERB DET PROPN PROPN CCONJ PRON VERB VERB PRON ADP PRON VERB VERB ADP DET PROPN PROPN CCONJ ADV PRON VERB PRON ADV CCONJ DET VERB VERB PRON DET ADV ADJ	▁It ▁was ▁an ▁Un ment ion able ▁Disease , ▁and ▁he ▁' d ▁caught ▁it ▁because ▁he ▁' d ▁been ▁to ▁an ▁Un ment ion able ▁Place ▁and ▁so ▁it ▁served ▁him ▁right , ▁but ▁that ▁did n ' t ▁make ▁it ▁any ▁less ▁sore .	0 0 0 0 0 0 0 0 0 0 0 0 0 0 0 0 0 0 0 0 0 0 0 0 0 0 0 0 0 0 1 1 1 1 0 0 0 0 0 0 0 0 0 0 0 0	PRON VERB DET PROPN PROPN PROPN PROPN PROPN PROPN CCONJ PRON VERB VERB VERB PRON ADP PRON VERB VERB VERB ADP DET PROPN PROPN PROPN PROPN PROPN CCONJ ADV PRON VERB PRON ADV ADV CCONJ DET VERB VERB VERB VERB VERB PRON DET ADV ADJ ADJ
He put his hand up her tunic — serve her right for having it so short — just as she got the door open and staggered screaming into her mother's arms.	0 0 0 0 0 0 0 0 1 1 1 0 0 0 0 0 0 0 0 0 0 0 0 0 0 0 0 0 0 0 0	serve someone right	figurative	objective	PRON VERB ADJ NOUN PART ADJ ADJ PUNCT VERB PRON NOUN ADP VERB PRON ADV ADV PUNCT ADV ADP PRON VERB DET NOUN ADJ CCONJ VERB VERB ADP ADJ NOUN NOUN	▁He ▁put ▁his ▁hand ▁up ▁her ▁tu nic ▁ — ▁serve ▁her ▁right ▁for ▁having ▁it ▁so ▁short ▁ — ▁just ▁as ▁she ▁got ▁the ▁door ▁open ▁and ▁staggered ▁s cream ing ▁into ▁her ▁mother ' s ▁arms .	0 0 0 0 0 0 0 0 0 0 1 1 1 0 0 0 0 0 0 0 0 0 0 0 0 0 0 0 0 0 0 0 0 0 0 0 0 0 0	PRON VERB ADJ NOUN PART ADJ ADJ ADJ PUNCT PUNCT VERB PRON NOUN ADP VERB PRON ADV ADV PUNCT PUNCT ADV ADP PRON VERB DET NOUN ADJ CCONJ VERB VERB VERB VERB ADP ADJ NOUN NOUN NOUN NOUN NOUN
Which means … the darkness, and serve me right.	0 0 0 0 0 0 1 1 1	serve someone right	figurative	objective	ADJ VERB PUNCT DET NOUN CCONJ VERB PRON ADJ	▁Which ▁means ▁... ▁the ▁darkness , ▁and ▁serve ▁me ▁right .	0 0 0 0 0 0 0 1 1 1 1	ADJ VERB PUNCT DET NOUN NOUN CCONJ VERB PRON ADJ ADJ
Say no I 'm alright and I must 've lifted my head, all I could hear was this old scraggy voice like a witch, ah serve the fucking bastard right, the fucking honest to fuck, so I must 've sat for another half an hour and I knew I had to go that way to get home.	0 0 0 0 0 0 0 0 0 0 0 0 0 0 0 0 0 0 0 0 0 0 0 0 0 1 0 0 1 1 0 0 0 0 0 0 0 0 0 0 0 0 0 0 0 0 0 0 0 0 0 0 0 0 0 0 0	serve someone right	figurative	combined-other	VERB INTJ PRON VERB INTJ CCONJ PRON VERB VERB VERB ADJ NOUN DET PRON VERB VERB VERB DET ADJ ADJ NOUN ADP DET NOUN INTJ VERB DET ADJ NOUN NOUN DET ADJ ADJ PART NOUN ADV PRON VERB VERB VERB ADP DET ADJ DET NOUN CCONJ PRON VERB PRON VERB PART VERB DET NOUN PART VERB ADV	▁Say ▁no ▁I ▁' m ▁al right ▁and ▁I ▁must ▁' ve ▁lifted ▁my ▁head , ▁all ▁I ▁could ▁hear ▁was ▁this ▁old ▁scr ag gy ▁voice ▁like ▁a ▁w itch , ▁a h ▁serve ▁the ▁f uck ing ▁bast ard ▁right , ▁the ▁f uck ing ▁honest ▁to ▁f uck , ▁so ▁I ▁must ▁' ve ▁sat ▁for ▁another ▁half ▁an ▁hour ▁and ▁I ▁knew ▁I ▁had ▁to ▁go ▁that ▁way ▁to ▁get ▁home .	0 0 0 0 0 0 0 0 0 0 0 0 0 0 0 0 0 0 0 0 0 0 0 0 0 0 0 0 0 0 0 0 0 0 1 0 0 0 0 1 1 1 1 0 0 0 0 0 0 0 0 0 0 0 0 0 0 0 0 0 0 0 0 0 0 0 0 0 0 0 0 0 0 0 0 0	VERB INTJ PRON VERB VERB INTJ INTJ CCONJ PRON VERB VERB VERB VERB ADJ NOUN NOUN DET PRON VERB VERB VERB DET ADJ ADJ ADJ ADJ NOUN ADP DET NOUN NOUN NOUN INTJ INTJ VERB DET ADJ ADJ ADJ NOUN NOUN NOUN NOUN DET ADJ ADJ ADJ ADJ PART NOUN NOUN NOUN ADV PRON VERB VERB VERB VERB ADP DET ADJ DET NOUN CCONJ PRON VERB PRON VERB PART VERB DET NOUN PART VERB ADV ADV
Serves you right!	1 1 1	serve someone right	figurative	combined-inflection	VERB PRON ADJ	▁Serv es ▁you ▁right !	1 1 1 1 1	VERB VERB PRON ADJ ADJ
Serves him right.	1 1 1	serve someone right	figurative	combined-inflection	VERB PRON ADJ	▁Serv es ▁him ▁right .	1 1 1 1 1	VERB VERB PRON ADJ ADJ
Knowing your Mum is a served you right!	0 0 0 0 0 1 1 1	serve someone right	figurative	combined-inflection	VERB ADJ PROPN VERB DET VERB PRON ADJ	▁Know ing ▁your ▁M um ▁is ▁a ▁served ▁you ▁right !	0 0 0 0 0 0 0 1 1 1 1	VERB VERB ADJ PROPN PROPN VERB DET VERB PRON ADJ ADJ
no that serves you right, shame in it?	0 0 1 1 1 0 0 0	serve someone right	figurative	combined-inflection	INTJ DET VERB PRON ADV NOUN ADP PRON	▁no ▁that ▁serves ▁you ▁right , ▁shame ▁in ▁it ?	0 0 1 1 1 1 0 0 0 0	INTJ DET VERB PRON ADV ADV NOUN ADP PRON PRON
That would serve them right.’	0 0 1 1 1	serve someone right	figurative	combined-other	DET VERB VERB PRON PUNCT	▁That ▁would ▁serve ▁them ▁right . ’	0 0 1 1 1 1 1	DET VERB VERB PRON PUNCT PUNCT PUNCT
Bloody buggering serve him right!	0 0 1 1 1	serve someone right	figurative	objective	ADJ VERB VERB PRON ADJ	▁Blood y ▁bu g ger ing ▁serve ▁him ▁right !	0 0 0 0 0 0 1 1 1 1	ADJ ADJ VERB VERB VERB VERB VERB PRON ADJ ADJ
If all the Scots went back to Scotland — it would serve them right.’	0 0 0 0 0 0 0 0 0 0 0 1 1 1	serve someone right	figurative	combined-other	ADP ADJ DET PROPN VERB ADV ADP PROPN PUNCT PRON VERB VERB PRON PUNCT	▁If ▁all ▁the ▁Sc ots ▁went ▁back ▁to ▁Scotland ▁ — ▁it ▁would ▁serve ▁them ▁right . ’	0 0 0 0 0 0 0 0 0 0 0 0 0 1 1 1 1 1	ADP ADJ DET PROPN PROPN VERB ADV ADP PROPN PUNCT PUNCT PRON VERB VERB PRON PUNCT PUNCT PUNCT
My first attempt on these hills ended at about 1500 feet when two of us were simply blasted off, which I suppose served us right for even setting out on a morning dark and grey as a used Brillo pad.	0 0 0 0 0 0 0 0 0 0 0 0 0 0 0 0 0 0 0 0 0 0 1 1 1 0 0 0 0 0 0 0 0 0 0 0 0 0 0 0	serve someone right	figurative	combined-inflection	ADJ ADJ NOUN ADP DET NOUN VERB ADP ADV NUM NOUN ADV NUM ADP PRON VERB ADV VERB PART ADJ PRON VERB VERB PRON ADV ADP ADV VERB PART ADP DET NOUN NOUN CCONJ NOUN ADP DET VERB PROPN NOUN	▁My ▁first ▁attempt ▁on ▁these ▁hill s ▁ended ▁at ▁about ▁1500 ▁feet ▁when ▁two ▁of ▁us ▁were ▁simply ▁blast ed ▁off , ▁which ▁I ▁suppose ▁served ▁us ▁right ▁for ▁even ▁setting ▁out ▁on ▁a ▁morning ▁dark ▁and ▁grey ▁as ▁a ▁used ▁Br illo ▁pad .	0 0 0 0 0 0 0 0 0 0 0 0 0 0 0 0 0 0 0 0 0 0 0 0 0 1 1 1 0 0 0 0 0 0 0 0 0 0 0 0 0 0 0 0 0	ADJ ADJ NOUN ADP DET NOUN NOUN VERB ADP ADV NUM NOUN ADV NUM ADP PRON VERB ADV VERB VERB PART PART ADJ PRON VERB VERB PRON ADV ADP ADV VERB PART ADP DET NOUN NOUN CCONJ NOUN ADP DET VERB PROPN PROPN NOUN NOUN
Serves him right.	1 1 1	serve someone right	figurative	combined-inflection	VERB PRON ADJ	▁Serv es ▁him ▁right .	1 1 1 1 1	VERB VERB PRON ADJ ADJ
' Serve him right.	0 1 1 1	serve someone right	figurative	combined-other	PUNCT VERB PRON ADJ	▁' ▁Serv e ▁him ▁right .	0 1 1 1 1 1	PUNCT VERB VERB PRON ADJ ADJ
And that people who told porkies went into the oven, and serve them right so she 'd better watch out.	0 0 0 0 0 0 0 0 0 0 0 1 1 1 0 0 0 0 0 0	serve someone right	figurative	objective	CCONJ ADP NOUN NOUN VERB NOUN VERB ADP DET NOUN CCONJ VERB PRON ADV ADV PRON VERB ADV VERB PART	▁And ▁that ▁people ▁who ▁told ▁por k ies ▁went ▁into ▁the ▁oven , ▁and ▁serve ▁them ▁right ▁so ▁she ▁' d ▁better ▁watch ▁out .	0 0 0 0 0 0 0 0 0 0 0 0 0 0 1 1 1 0 0 0 0 0 0 0 0	CCONJ ADP NOUN NOUN VERB NOUN NOUN NOUN VERB ADP DET NOUN NOUN CCONJ VERB PRON ADV ADV PRON VERB VERB ADV VERB PART PART
