It 'd serve her right!’	0 0 1 1 1	serve someone right	figurative	combined-other	PRON VERB VERB ADJ NOUN	▁It ▁' d ▁serve ▁her ▁right ! ’	0 0 0 1 1 1 1 1	PRON VERB VERB VERB ADJ NOUN NOUN NOUN
Serve him right!	1 1 1	serve someone right	figurative	combined-other	VERB PRON ADJ	▁Serv e ▁him ▁right !	1 1 1 1 1	VERB VERB PRON ADJ ADJ
Serves them right, they don't deserve to win, a load of rubbish	1 1 1 0 0 0 0 0 0 0 0 0	serve someone right	figurative	combined-inflection	VERB PRON ADV PRON VERB VERB PART VERB DET NOUN ADP NOUN	▁Serv es ▁them ▁right , ▁they ▁don ' t ▁deserve ▁to ▁win , ▁a ▁load ▁of ▁rubbish	1 1 1 1 1 0 0 0 0 0 0 0 0 0 0 0 0	VERB VERB PRON ADV ADV PRON VERB VERB VERB VERB PART VERB VERB DET NOUN ADP NOUN
It would serve you right if I didn't tell my piece de resistance.’	0 0 1 1 1 0 0 0 0 0 0 0 0	serve someone right	figurative	objective	PRON VERB VERB PRON ADV ADP PRON VERB VERB ADJ NOUN ADP PUNCT	▁It ▁would ▁serve ▁you ▁right ▁if ▁I ▁did n ' t ▁tell ▁my ▁piece ▁de ▁resistance . ’	0 0 1 1 1 0 0 0 0 0 0 0 0 0 0 0 0 0	PRON VERB VERB PRON ADV ADP PRON VERB VERB VERB VERB VERB ADJ NOUN ADP PUNCT PUNCT PUNCT
It was a shame about Mitch, but as to Felipe, it served him right!	0 0 0 0 0 0 0 0 0 0 0 1 1 1	serve someone right	figurative	combined-inflection	PRON VERB DET NOUN ADP PROPN CCONJ ADP ADP PROPN PRON VERB PRON ADV	▁It ▁was ▁a ▁shame ▁about ▁M itch , ▁but ▁as ▁to ▁Fe lip e , ▁it ▁served ▁him ▁right !	0 0 0 0 0 0 0 0 0 0 0 0 0 0 0 0 1 1 1 1	PRON VERB DET NOUN ADP PROPN PROPN PROPN CCONJ ADP ADP PROPN PROPN PROPN PROPN PRON VERB PRON ADV ADV
Serves him right.	1 1 1	serve someone right	figurative	combined-inflection	VERB PRON ADJ	▁Serv es ▁him ▁right .	1 1 1 1 1	VERB VERB PRON ADJ ADJ
Serves me right for I suppose.	1 1 1 0 0 0	serve someone right	figurative	combined-inflection	VERB PRON ADV ADP PRON VERB	▁Serv es ▁me ▁right ▁for ▁I ▁suppose .	1 1 1 1 0 0 0 0	VERB VERB PRON ADV ADP PRON VERB VERB
' Serve her right, ' Doreen declared heartlessly.	0 1 1 1 0 0 0 0	serve someone right	figurative	combined-other	PUNCT VERB PRON NOUN PUNCT NOUN VERB ADV	▁' ▁Serv e ▁her ▁right , ▁' ▁Do re en ▁declared ▁heart lessly .	0 1 1 1 1 1 0 0 0 0 0 0 0 0	PUNCT VERB VERB PRON NOUN NOUN PUNCT NOUN NOUN NOUN VERB ADV ADV ADV
She said, ' Serve you right.	0 0 0 1 1 1	serve someone right	figurative	combined-other	PRON VERB PUNCT VERB PRON ADJ	▁She ▁said , ▁' ▁Serv e ▁you ▁right .	0 0 0 0 1 1 1 1 1	PRON VERB VERB PUNCT VERB VERB PRON ADJ ADJ
serves her right	1 1 1	serve someone right	figurative	combined-inflection	VERB PRON ADJ	▁serves ▁her ▁right	1 1 1	VERB PRON ADJ
