I 'm also sick to death of patronising DJ shits like Simon Bates saying that Sinead is ill and that when she is being nice, she is the loveliest person in the world.	0 0 0 1 1 1 0 0 0 0 0 0 0 0 0 0 0 0 0 0 0 0 0 0 0 0 0 0 0 0 0 0 0	sick to death	figurative	identical	PRON VERB ADV ADJ ADP NOUN ADP VERB PROPN NOUN ADP PROPN PROPN VERB ADP PROPN VERB ADJ CCONJ ADP ADV PRON VERB VERB ADJ PRON VERB DET ADJ NOUN ADP DET NOUN	▁I ▁' m ▁also ▁sick ▁to ▁death ▁of ▁pat ron ising ▁D J ▁sh its ▁like ▁Simon ▁B ates ▁saying ▁that ▁S ine ad ▁is ▁ill ▁and ▁that ▁when ▁she ▁is ▁being ▁nice , ▁she ▁is ▁the ▁love li est ▁person ▁in ▁the ▁world .	0 0 0 0 1 1 1 0 0 0 0 0 0 0 0 0 0 0 0 0 0 0 0 0 0 0 0 0 0 0 0 0 0 0 0 0 0 0 0 0 0 0 0 0 0	PRON VERB VERB ADV ADJ ADP NOUN ADP VERB VERB VERB PROPN PROPN NOUN NOUN ADP PROPN PROPN PROPN VERB ADP PROPN PROPN PROPN VERB ADJ CCONJ ADP ADV PRON VERB VERB ADJ ADJ PRON VERB DET ADJ ADJ ADJ NOUN ADP DET NOUN NOUN
I 'm sick to death of men who want to prove something.	0 0 1 1 1 0 0 0 0 0 0 0	sick to death	figurative	identical	PRON VERB ADJ ADP NOUN ADP NOUN NOUN VERB PART VERB NOUN	▁I ▁' m ▁sick ▁to ▁death ▁of ▁men ▁who ▁want ▁to ▁prove ▁something .	0 0 0 1 1 1 0 0 0 0 0 0 0 0	PRON VERB VERB ADJ ADP NOUN ADP NOUN NOUN VERB PART VERB NOUN NOUN
‘ I am sick to death of fighting this!’ he bit out, reaching for her.	0 0 0 1 1 1 0 0 0 0 0 0 0 0 0	sick to death	figurative	identical	PUNCT PRON VERB ADJ ADP NOUN ADP VERB NOUN PRON VERB PART VERB ADP PRON	▁ ‘ ▁I ▁am ▁sick ▁to ▁death ▁of ▁fighting ▁this ! ’ ▁he ▁bit ▁out , ▁reaching ▁for ▁her .	0 0 0 0 1 1 1 0 0 0 0 0 0 0 0 0 0 0 0 0	PUNCT PUNCT PRON VERB ADJ ADP NOUN ADP VERB NOUN NOUN NOUN PRON VERB PART PART VERB ADP PRON PRON
Jonathan Hastings - Day, vice - chairman of the Conservative Disability Group, said the disabled should be able to buy the services they need from privately run agencies : ‘ I am sick to death of social workers sitting around having case conferences.	0 0 0 0 0 0 0 0 0 0 0 0 0 0 0 0 0 0 0 0 0 0 0 0 0 0 0 0 0 0 0 0 1 1 1 0 0 0 0 0 0 0 0	sick to death	figurative	identical	PROPN PROPN PUNCT PROPN NOUN PUNCT NOUN ADP DET PROPN PROPN PROPN VERB DET ADJ VERB VERB ADJ PART VERB DET NOUN PRON VERB ADP ADV VERB NOUN PUNCT PUNCT PRON VERB ADJ ADP NOUN ADP ADJ NOUN VERB ADP VERB NOUN NOUN	▁Jonathan ▁Has ting s ▁- ▁Day , ▁vice ▁- ▁chairman ▁of ▁the ▁C onservative ▁Dis ability ▁Group , ▁said ▁the ▁disabled ▁should ▁be ▁able ▁to ▁buy ▁the ▁services ▁they ▁need ▁from ▁privately ▁run ▁agencies ▁ : ▁ ‘ ▁I ▁am ▁sick ▁to ▁death ▁of ▁social ▁workers ▁sitting ▁around ▁having ▁case ▁conferences .	0 0 0 0 0 0 0 0 0 0 0 0 0 0 0 0 0 0 0 0 0 0 0 0 0 0 0 0 0 0 0 0 0 0 0 0 0 0 0 0 1 1 1 0 0 0 0 0 0 0 0 0	PROPN PROPN PROPN PROPN PUNCT PROPN PROPN NOUN PUNCT NOUN ADP DET PROPN PROPN PROPN PROPN PROPN PROPN VERB DET ADJ VERB VERB ADJ PART VERB DET NOUN PRON VERB ADP ADV VERB NOUN PUNCT PUNCT PUNCT PUNCT PRON VERB ADJ ADP NOUN ADP ADJ NOUN VERB ADP VERB NOUN NOUN NOUN
That suited Comfort, because she was sick to death of war stories and all she wanted to do was forget the whole horrible business and somehow get her life back on to its prewar footing.	0 0 0 0 0 0 1 1 1 0 0 0 0 0 0 0 0 0 0 0 0 0 0 0 0 0 0 0 0 0 0 0 0 0 0	sick to death	figurative	identical	DET VERB PROPN ADP PRON VERB ADJ ADP NOUN ADP NOUN NOUN CCONJ DET PRON VERB PART VERB VERB VERB DET ADJ ADJ NOUN CCONJ ADV VERB ADJ NOUN ADV ADV ADP ADJ ADJ NOUN	▁That ▁suited ▁Com fort , ▁because ▁she ▁was ▁sick ▁to ▁death ▁of ▁war ▁stories ▁and ▁all ▁she ▁wanted ▁to ▁do ▁was ▁forget ▁the ▁whole ▁horr ible ▁business ▁and ▁somehow ▁get ▁her ▁life ▁back ▁on ▁to ▁its ▁pre war ▁footing .	0 0 0 0 0 0 0 0 1 1 1 0 0 0 0 0 0 0 0 0 0 0 0 0 0 0 0 0 0 0 0 0 0 0 0 0 0 0 0 0	DET VERB PROPN PROPN PROPN ADP PRON VERB ADJ ADP NOUN ADP NOUN NOUN CCONJ DET PRON VERB PART VERB VERB VERB DET ADJ ADJ ADJ NOUN CCONJ ADV VERB ADJ NOUN ADV ADV ADP ADJ ADJ ADJ NOUN NOUN
He killed himself because he was literally sick to death of fighting some of the largest manufacturers of FM radios for the royalties they owed him.	0 0 0 0 0 0 0 1 1 1 0 0 0 0 0 0 0 0 0 0 0 0 0 0 0 0	sick to death	figurative	identical	PRON VERB PRON ADP PRON VERB ADV ADJ ADP NOUN ADP VERB DET ADP DET ADJ NOUN ADP PROPN NOUN ADP DET NOUN PRON VERB PRON	▁He ▁killed ▁himself ▁because ▁he ▁was ▁literally ▁sick ▁to ▁death ▁of ▁fighting ▁some ▁of ▁the ▁largest ▁manufacturers ▁of ▁F M ▁radio s ▁for ▁the ▁royalties ▁they ▁owed ▁him .	0 0 0 0 0 0 0 1 1 1 0 0 0 0 0 0 0 0 0 0 0 0 0 0 0 0 0 0 0	PRON VERB PRON ADP PRON VERB ADV ADJ ADP NOUN ADP VERB DET ADP DET ADJ NOUN ADP PROPN PROPN NOUN NOUN ADP DET NOUN PRON VERB PRON PRON
I am absolutely sick to death of irresponsible dog owners who allow their dogs to foul public footpaths.	0 0 0 1 1 1 0 0 0 0 0 0 0 0 0 0 0 0	sick to death	figurative	identical	PRON VERB ADV ADJ ADP NOUN ADP ADJ NOUN NOUN NOUN VERB ADJ NOUN PART VERB ADJ NOUN	▁I ▁am ▁absolutely ▁sick ▁to ▁death ▁of ▁ir responsible ▁dog ▁owners ▁who ▁allow ▁their ▁dogs ▁to ▁fo ul ▁public ▁foot path s .	0 0 0 1 1 1 0 0 0 0 0 0 0 0 0 0 0 0 0 0 0 0 0	PRON VERB ADV ADJ ADP NOUN ADP ADJ ADJ NOUN NOUN NOUN VERB ADJ NOUN PART VERB VERB ADJ NOUN NOUN NOUN NOUN
I 'm sick of it, really, just sick to death with it.	0 0 0 0 0 0 0 1 1 1 0 0	sick to death	figurative	identical	PRON VERB ADJ ADP PRON ADV ADV ADJ ADP NOUN ADP PRON	▁I ▁' m ▁sick ▁of ▁it , ▁really , ▁just ▁sick ▁to ▁death ▁with ▁it .	0 0 0 0 0 0 0 0 0 0 1 1 1 0 0 0	PRON VERB VERB ADJ ADP PRON PRON ADV ADV ADV ADJ ADP NOUN ADP PRON PRON
I 'm sick to death of it.	0 0 1 1 1 0 0	sick to death	figurative	identical	PRON VERB ADJ ADP NOUN ADP PRON	▁I ▁' m ▁sick ▁to ▁death ▁of ▁it .	0 0 0 1 1 1 0 0 0	PRON VERB VERB ADJ ADP NOUN ADP PRON PRON
And I told her once, I said I 'm sick to death of hearing you say that every time I come!	0 0 0 0 0 0 0 0 0 1 1 1 0 0 0 0 0 0 0 0 0	sick to death	figurative	identical	CCONJ PRON VERB PRON ADV PRON VERB PRON VERB ADJ ADP NOUN ADP VERB PRON VERB ADP DET NOUN PRON VERB	▁And ▁I ▁told ▁her ▁once , ▁I ▁said ▁I ▁' m ▁sick ▁to ▁death ▁of ▁hearing ▁you ▁say ▁that ▁every ▁time ▁I ▁come !	0 0 0 0 0 0 0 0 0 0 0 1 1 1 0 0 0 0 0 0 0 0 0 0	CCONJ PRON VERB PRON ADV ADV PRON VERB PRON VERB VERB ADJ ADP NOUN ADP VERB PRON VERB ADP DET NOUN PRON VERB VERB
I 'll tell you what comrades, I 'm sick to death of some people in the party shying away from association with us.	0 0 0 0 0 0 0 0 1 1 1 0 0 0 0 0 0 0 0 0 0 0 0	sick to death	figurative	identical	PRON VERB VERB PRON NOUN VERB PRON VERB ADJ ADP NOUN ADP DET NOUN ADP DET NOUN VERB ADV ADP NOUN ADP PRON	▁I ▁' ll ▁tell ▁you ▁what ▁comrade s , ▁I ▁' m ▁sick ▁to ▁death ▁of ▁some ▁people ▁in ▁the ▁party ▁sh ying ▁away ▁from ▁association ▁with ▁us .	0 0 0 0 0 0 0 0 0 0 0 0 1 1 1 0 0 0 0 0 0 0 0 0 0 0 0 0 0	PRON VERB VERB VERB PRON NOUN VERB VERB VERB PRON VERB VERB ADJ ADP NOUN ADP DET NOUN ADP DET NOUN VERB VERB ADV ADP NOUN ADP PRON PRON
Sick to death?	1 1 1	sick to death	figurative	case	ADJ ADP NOUN	▁S ick ▁to ▁death ?	1 1 1 1 1	ADJ ADJ ADP NOUN NOUN
Tell you the truth, I 'm sick to death of the lot of it, but I can't think of anything to do with it that won't have my old man haunting me and have other people's feelings hurt.	0 0 0 0 0 0 1 1 1 0 0 0 0 0 0 0 0 0 0 0 0 0 0 0 0 0 0 0 0 0 0 0 0 0 0 0 0 0	sick to death	figurative	identical	VERB PRON DET NOUN PRON VERB ADJ ADP NOUN ADP DET NOUN ADP PRON CCONJ PRON VERB VERB ADP NOUN PART VERB ADP PRON ADJ VERB VERB ADJ ADJ NOUN VERB PRON CCONJ VERB ADJ NOUN NOUN VERB	▁Tell ▁you ▁the ▁truth , ▁I ▁' m ▁sick ▁to ▁death ▁of ▁the ▁lot ▁of ▁it , ▁but ▁I ▁can ' t ▁think ▁of ▁anything ▁to ▁do ▁with ▁it ▁that ▁won ' t ▁have ▁my ▁old ▁man ▁ha unt ing ▁me ▁and ▁have ▁other ▁people ' s ▁feelings ▁hurt .	0 0 0 0 0 0 0 0 1 1 1 0 0 0 0 0 0 0 0 0 0 0 0 0 0 0 0 0 0 0 0 0 0 0 0 0 0 0 0 0 0 0 0 0 0 0 0 0 0 0	VERB PRON DET NOUN NOUN PRON VERB VERB ADJ ADP NOUN ADP DET NOUN ADP PRON PRON CCONJ PRON VERB VERB VERB VERB ADP NOUN PART VERB ADP PRON ADJ VERB VERB VERB VERB ADJ ADJ NOUN VERB VERB VERB PRON CCONJ VERB ADJ NOUN NOUN NOUN NOUN VERB VERB
I 'm sick to death of you being rude to me.	0 0 1 1 1 0 0 0 0 0 0	sick to death	figurative	identical	PRON VERB ADJ ADP NOUN ADP PRON VERB ADJ ADP PRON	▁I ▁' m ▁sick ▁to ▁death ▁of ▁you ▁being ▁ru de ▁to ▁me .	0 0 0 1 1 1 0 0 0 0 0 0 0 0	PRON VERB VERB ADJ ADP NOUN ADP PRON VERB ADJ ADJ ADP PRON PRON
As far as ho erm the H R T is erm here we go you see, this is post - natal illness this is right, we need one on that as well, but what we need to know, and what we need to be aware of, is that the discussion has to be actually put out through the members in the same sort of way as Ken and Peggy have done in the erm Midland and East Coast region and also on Working Women's Safety, it needs to be taken on board that we are absolutely fed up, sick to death and absolutely running out of patience at having to hammer home this thing about equality.	0 0 0 0 0 0 0 0 0 0 0 0 0 0 0 0 0 0 0 0 0 0 0 0 0 0 0 0 0 0 0 0 0 0 0 0 0 0 0 0 0 0 0 0 0 0 0 0 0 0 0 0 0 0 0 0 0 0 0 0 0 0 0 0 0 0 0 0 0 0 0 0 0 0 0 0 0 0 0 0 0 0 0 0 0 0 0 0 0 0 0 0 0 0 0 0 0 0 1 1 1 0 0 0 0 0 0 0 0 0 0 0 0 0 0 0	sick to death	figurative	identical	ADV ADV ADP X ADV DET NOUN NOUN NOUN VERB ADV ADV PRON VERB PRON VERB DET VERB NOUN PUNCT ADJ NOUN DET VERB ADJ PRON VERB NUM ADP DET ADV ADV CCONJ NOUN PRON VERB PART VERB CCONJ NOUN PRON VERB PART VERB ADJ ADP VERB ADP DET NOUN VERB PART VERB ADV VERB PART ADP DET NOUN ADP DET ADJ NOUN ADP NOUN ADP PROPN CCONJ PROPN VERB VERB ADP DET ADJ PROPN CCONJ PROPN PROPN NOUN CCONJ ADV ADP PROPN PROPN PROPN PRON VERB PART VERB VERB ADP NOUN ADP PRON VERB ADV VERB PART ADJ ADP NOUN CCONJ ADV VERB ADP ADP NOUN ADP VERB PART VERB ADV DET NOUN ADP NOUN	▁As ▁far ▁as ▁ho ▁er m ▁the ▁H ▁R ▁T ▁is ▁er m ▁here ▁we ▁go ▁you ▁see , ▁this ▁is ▁post ▁- ▁ natal ▁illness ▁this ▁is ▁right , ▁we ▁need ▁one ▁on ▁that ▁as ▁well , ▁but ▁what ▁we ▁need ▁to ▁know , ▁and ▁what ▁we ▁need ▁to ▁be ▁aware ▁of , ▁is ▁that ▁the ▁discussion ▁has ▁to ▁be ▁actually ▁put ▁out ▁through ▁the ▁members ▁in ▁the ▁same ▁sort ▁of ▁way ▁as ▁K en ▁and ▁Peg gy ▁have ▁done ▁in ▁the ▁er m ▁Mid land ▁and ▁East ▁Coast ▁region ▁and ▁also ▁on ▁Working ▁Women ' s ▁Safety , ▁it ▁needs ▁to ▁be ▁taken ▁on ▁board ▁that ▁we ▁are ▁absolutely ▁fed ▁up , ▁sick ▁to ▁death ▁and ▁absolutely ▁running ▁out ▁of ▁patience ▁at ▁having ▁to ▁hammer ▁home ▁this ▁thing ▁about ▁equality .	0 0 0 0 0 0 0 0 0 0 0 0 0 0 0 0 0 0 0 0 0 0 0 0 0 0 0 0 0 0 0 0 0 0 0 0 0 0 0 0 0 0 0 0 0 0 0 0 0 0 0 0 0 0 0 0 0 0 0 0 0 0 0 0 0 0 0 0 0 0 0 0 0 0 0 0 0 0 0 0 0 0 0 0 0 0 0 0 0 0 0 0 0 0 0 0 0 0 0 0 0 0 0 0 0 0 0 0 0 0 0 0 0 0 1 1 1 0 0 0 0 0 0 0 0 0 0 0 0 0 0 0 0	ADV ADV ADP X ADV ADV DET NOUN NOUN NOUN VERB ADV ADV ADV PRON VERB PRON VERB VERB DET VERB NOUN PUNCT ADJ ADJ NOUN DET VERB ADJ ADJ PRON VERB NUM ADP DET ADV ADV ADV CCONJ NOUN PRON VERB PART VERB VERB CCONJ NOUN PRON VERB PART VERB ADJ ADP ADP VERB ADP DET NOUN VERB PART VERB ADV VERB PART ADP DET NOUN ADP DET ADJ NOUN ADP NOUN ADP PROPN PROPN CCONJ PROPN PROPN VERB VERB ADP DET ADJ ADJ PROPN PROPN CCONJ PROPN PROPN NOUN CCONJ ADV ADP PROPN PROPN PROPN PROPN PROPN PROPN PRON VERB PART VERB VERB ADP NOUN ADP PRON VERB ADV VERB PART PART ADJ ADP NOUN CCONJ ADV VERB ADP ADP NOUN ADP VERB PART VERB ADV DET NOUN ADP NOUN NOUN
ROS : Well I can tell you I 'm sick to death of it.	0 0 0 0 0 0 0 0 0 1 1 1 0 0	sick to death	figurative	identical	NOUN PUNCT INTJ PRON VERB VERB PRON PRON VERB ADJ ADP NOUN ADP PRON	▁RO S ▁ : ▁Well ▁I ▁can ▁tell ▁you ▁I ▁' m ▁sick ▁to ▁death ▁of ▁it .	0 0 0 0 0 0 0 0 0 0 0 0 1 1 1 0 0 0	NOUN NOUN PUNCT PUNCT INTJ PRON VERB VERB PRON PRON VERB VERB ADJ ADP NOUN ADP PRON PRON
See that fucking knife Mark, I ought to stab you or him with it, I am sick to death of yous.	0 0 0 0 0 0 0 0 0 0 0 0 0 0 0 0 1 1 1 0 0	sick to death	figurative	identical	VERB DET ADJ NOUN PROPN PRON VERB PART VERB PRON CCONJ PRON ADP PRON PRON VERB ADJ ADP NOUN ADP ADJ	▁See ▁that ▁f uck ing ▁knife ▁Mark , ▁I ▁ought ▁to ▁sta b ▁you ▁or ▁him ▁with ▁it , ▁I ▁am ▁sick ▁to ▁death ▁of ▁you s .	0 0 0 0 0 0 0 0 0 0 0 0 0 0 0 0 0 0 0 0 0 1 1 1 0 0 0 0	VERB DET ADJ ADJ ADJ NOUN PROPN PROPN PRON VERB PART VERB VERB PRON CCONJ PRON ADP PRON PRON PRON VERB ADJ ADP NOUN ADP ADJ ADJ ADJ
I 'm sick to death of sharing you with your business.	0 0 1 1 1 0 0 0 0 0 0	sick to death	figurative	identical	PRON VERB ADJ ADP NOUN ADP VERB PRON ADP ADJ NOUN	▁I ▁' m ▁sick ▁to ▁death ▁of ▁sharing ▁you ▁with ▁your ▁business .	0 0 0 1 1 1 0 0 0 0 0 0 0	PRON VERB VERB ADJ ADP NOUN ADP VERB PRON ADP ADJ NOUN NOUN
I 'm sick to death of it.	0 0 1 1 1 0 0	sick to death	figurative	identical	PRON VERB ADJ ADP NOUN ADP PRON	▁I ▁' m ▁sick ▁to ▁death ▁of ▁it .	0 0 0 1 1 1 0 0 0	PRON VERB VERB ADJ ADP NOUN ADP PRON PRON
I 'm sick to death of the worry it's brought, what with the lease - owners demanding money from me, when I 've no bloody rents to collect there …	0 0 1 1 1 0 0 0 0 0 0 0 0 0 0 0 0 0 0 0 0 0 0 0 0 0 0 0 0 0	sick to death	figurative	identical	PRON VERB ADJ ADP NOUN ADP DET NOUN PRON VERB NOUN ADP DET NOUN PUNCT NOUN VERB NOUN ADP PRON ADV PRON VERB DET ADJ NOUN PART VERB ADV PUNCT	▁I ▁' m ▁sick ▁to ▁death ▁of ▁the ▁worry ▁it ' s ▁brought , ▁what ▁with ▁the ▁lease ▁- ▁owners ▁demanding ▁money ▁from ▁me , ▁when ▁I ▁' ve ▁no ▁blood y ▁rent s ▁to ▁collect ▁there ▁...	0 0 0 1 1 1 0 0 0 0 0 0 0 0 0 0 0 0 0 0 0 0 0 0 0 0 0 0 0 0 0 0 0 0 0 0 0 0	PRON VERB VERB ADJ ADP NOUN ADP DET NOUN PRON PRON PRON VERB VERB NOUN ADP DET NOUN PUNCT NOUN VERB NOUN ADP PRON PRON ADV PRON VERB VERB DET ADJ ADJ NOUN NOUN PART VERB ADV PUNCT
