However, if we kid ourselves that we are all sweetness and light, then our angry and hateful Shadow will manifest itself elsewhere — in other people, in our view of the world, in our body, and in dreams ( perhaps as a dark, shadowy figure, or a thoroughly unpleasant character ).	0 0 0 0 0 0 0 0 0 1 1 1 0 0 0 0 0 0 0 0 0 0 0 0 0 0 0 0 0 0 0 0 0 0 0 0 0 0 0 0 0 0 0 0 0 0 0 0 0 0 0	sweetness and light	figurative	identical	ADV ADP PRON VERB PRON ADP PRON VERB DET NOUN CCONJ NOUN ADV ADJ ADJ CCONJ ADJ PROPN VERB VERB PRON ADV PUNCT ADP ADJ NOUN ADP ADJ NOUN ADP DET NOUN ADP ADJ NOUN CCONJ ADP NOUN PUNCT ADV ADP DET ADJ ADJ NOUN CCONJ DET ADV ADJ NOUN PUNCT	▁However , ▁if ▁we ▁kid ▁ourselves ▁that ▁we ▁are ▁all ▁sweet ness ▁and ▁light , ▁then ▁our ▁angry ▁and ▁hate ful ▁Sha dow ▁will ▁manifest ▁itself ▁elsewhere ▁ — ▁in ▁other ▁people , ▁in ▁our ▁view ▁of ▁the ▁world , ▁in ▁our ▁body , ▁and ▁in ▁dreams ▁( ▁perhaps ▁as ▁a ▁dark , ▁shadow y ▁figure , ▁or ▁a ▁thoroughly ▁unpleasant ▁character ▁ ).	0 0 0 0 0 0 0 0 0 0 1 1 1 1 1 0 0 0 0 0 0 0 0 0 0 0 0 0 0 0 0 0 0 0 0 0 0 0 0 0 0 0 0 0 0 0 0 0 0 0 0 0 0 0 0 0 0 0 0 0 0 0 0 0	ADV ADV ADP PRON VERB PRON ADP PRON VERB DET NOUN NOUN CCONJ NOUN NOUN ADV ADJ ADJ CCONJ ADJ ADJ PROPN PROPN VERB VERB PRON ADV PUNCT PUNCT ADP ADJ NOUN NOUN ADP ADJ NOUN ADP DET NOUN NOUN ADP ADJ NOUN NOUN CCONJ ADP NOUN PUNCT ADV ADP DET ADJ ADJ ADJ ADJ NOUN NOUN CCONJ DET ADV ADJ NOUN PUNCT PUNCT
I 'm immune to sweetness and light.’	0 0 0 0 1 1 1	sweetness and light	figurative	dashes	PRON VERB ADJ ADP NOUN CCONJ NOUN	▁I ▁' m ▁immune ▁to ▁sweet ness ▁and ▁light . ’	0 0 0 0 0 1 1 1 1 1 1	PRON VERB VERB ADJ ADP NOUN NOUN CCONJ NOUN NOUN NOUN
‘ Why all this sweetness and light?’ she asked wryly.	0 0 0 0 1 1 1 0 0 0	sweetness and light	figurative	dashes	PUNCT ADV ADJ DET NOUN CCONJ NOUN PRON VERB ADV	▁ ‘ ▁Why ▁all ▁this ▁sweet ness ▁and ▁light ? ’ ▁she ▁asked ▁w ry ly .	0 0 0 0 0 1 1 1 1 1 1 0 0 0 0 0 0	PUNCT PUNCT ADV ADJ DET NOUN NOUN CCONJ NOUN NOUN NOUN PRON VERB ADV ADV ADV ADV
It's all sweetness and light here at BBC Good Food.	0 0 1 1 1 0 0 0 0 0	sweetness and light	figurative	identical	PRON DET NOUN CCONJ NOUN ADV ADP PROPN PROPN PROPN	▁It ' s ▁all ▁sweet ness ▁and ▁light ▁here ▁at ▁B BC ▁Good ▁Food .	0 0 0 0 1 1 1 1 0 0 0 0 0 0 0	PRON PRON PRON DET NOUN NOUN CCONJ NOUN ADV ADP PROPN PROPN PROPN PROPN PROPN
How far should Nonconformity work to avoid the type of praise given by the Bishop of Ripon in his 1892 article on Spurgeon : ‘ The Puritan type may mean heedlessness of culture and loss of sweetness and light, but it also means seriousness, earnestness and a courageous bearing.’	0 0 0 0 0 0 0 0 0 0 0 0 0 0 0 0 0 0 0 0 0 0 0 0 0 0 0 0 0 0 0 0 0 0 0 0 1 1 1 0 0 0 0 0 0 0 0 0 0	sweetness and light	figurative	identical	ADV ADV VERB NOUN VERB PART VERB DET NOUN ADP NOUN VERB ADP DET PROPN ADP PROPN ADP ADJ NUM NOUN ADP PROPN PUNCT PUNCT DET PROPN NOUN VERB VERB NOUN ADP NOUN CCONJ NOUN ADP NOUN CCONJ NOUN CCONJ PRON ADV VERB NOUN VERB CCONJ DET ADJ NOUN	▁How ▁far ▁should ▁Non conformity ▁work ▁to ▁avoid ▁the ▁type ▁of ▁praise ▁given ▁by ▁the ▁Bis hop ▁of ▁Ri pon ▁in ▁his ▁18 92 ▁article ▁on ▁S pur ge on ▁ : ▁ ‘ ▁The ▁Pu ritan ▁type ▁may ▁mean ▁heed lessness ▁of ▁culture ▁and ▁loss ▁of ▁sweet ness ▁and ▁light , ▁but ▁it ▁also ▁means ▁seriousness , ▁earnest ness ▁and ▁a ▁courageous ▁bearing . ’	0 0 0 0 0 0 0 0 0 0 0 0 0 0 0 0 0 0 0 0 0 0 0 0 0 0 0 0 0 0 0 0 0 0 0 0 0 0 0 0 0 0 0 0 0 0 0 1 1 1 1 1 0 0 0 0 0 0 0 0 0 0 0 0 0 0	ADV ADV VERB NOUN NOUN VERB PART VERB DET NOUN ADP NOUN VERB ADP DET PROPN PROPN ADP PROPN PROPN ADP ADJ NUM NUM NOUN ADP PROPN PROPN PROPN PROPN PUNCT PUNCT PUNCT PUNCT DET PROPN PROPN NOUN VERB VERB NOUN NOUN ADP NOUN CCONJ NOUN ADP NOUN NOUN CCONJ NOUN NOUN CCONJ PRON ADV VERB NOUN NOUN VERB VERB CCONJ DET ADJ NOUN NOUN NOUN
Not because Bloom was liberal sweetness - and - light, but because he praised the good, the true and the beautiful in useless splendour and denounced relevance, accountability and the rest ; the very qualities these Thatcherites wer bullying British higher education to adopt.	0 0 0 0 0 1 0 1 0 1 0 0 0 0 0 0 0 0 0 0 0 0 0 0 0 0 0 0 0 0 0 0 0 0 0 0 0 0 0 0 0 0 0 0	sweetness and light	figurative	dashes	ADV ADP PROPN VERB ADJ NOUN PUNCT CCONJ PUNCT NOUN CCONJ ADP PRON VERB DET NOUN DET ADJ CCONJ DET ADJ ADP ADJ ADJ CCONJ ADJ NOUN NOUN CCONJ DET NOUN PUNCT DET ADJ NOUN DET PROPN VERB VERB ADJ ADJ NOUN PART VERB	▁Not ▁because ▁B loom ▁was ▁liberal ▁sweet ness ▁- ▁and ▁- ▁light , ▁but ▁because ▁he ▁praise d ▁the ▁good , ▁the ▁true ▁and ▁the ▁beautiful ▁in ▁useless ▁splen d our ▁and ▁denounce d ▁relevance , ▁accountability ▁and ▁the ▁rest ▁ ; ▁the ▁very ▁qualities ▁these ▁Thatcher ites ▁we r ▁bull ying ▁British ▁higher ▁education ▁to ▁adopt .	0 0 0 0 0 0 1 1 0 1 0 1 1 0 0 0 0 0 0 0 0 0 0 0 0 0 0 0 0 0 0 0 0 0 0 0 0 0 0 0 0 0 0 0 0 0 0 0 0 0 0 0 0 0 0 0 0 0	ADV ADP PROPN PROPN VERB ADJ NOUN NOUN PUNCT CCONJ PUNCT NOUN NOUN CCONJ ADP PRON VERB VERB DET NOUN NOUN DET ADJ CCONJ DET ADJ ADP ADJ ADJ ADJ ADJ CCONJ ADJ ADJ NOUN NOUN NOUN CCONJ DET NOUN PUNCT PUNCT DET ADJ NOUN DET PROPN PROPN VERB VERB VERB VERB ADJ ADJ NOUN PART VERB VERB
There was a slight lurch and suddenly Nails found that all was sweetness and light ; he was moving with delicious ease, his bottom glued to the saddle, no slithering, no jerking, no bumping, just a pleasant sensation of moving to a smooth, easy rhythm.	0 0 0 0 0 0 0 0 0 0 0 0 1 1 1 0 0 0 0 0 0 0 0 0 0 0 0 0 0 0 0 0 0 0 0 0 0 0 0 0 0 0 0 0 0	sweetness and light	figurative	identical	ADV VERB DET ADJ NOUN CCONJ ADV PROPN VERB ADP DET VERB NOUN CCONJ NOUN PUNCT PRON VERB VERB ADP ADJ NOUN ADJ NOUN VERB ADP DET NOUN DET NOUN DET NOUN DET NOUN ADV DET ADJ NOUN ADP VERB ADP DET ADJ ADJ NOUN	▁There ▁was ▁a ▁slight ▁lu rch ▁and ▁suddenly ▁Na ils ▁found ▁that ▁all ▁was ▁sweet ness ▁and ▁light ▁ ; ▁he ▁was ▁moving ▁with ▁del ic ious ▁ease , ▁his ▁bottom ▁glu ed ▁to ▁the ▁saddle , ▁no ▁slit her ing , ▁no ▁ jer king , ▁no ▁b ump ing , ▁just ▁a ▁pleasant ▁sensation ▁of ▁moving ▁to ▁a ▁smooth , ▁easy ▁rhythm .	0 0 0 0 0 0 0 0 0 0 0 0 0 0 1 1 1 1 0 0 0 0 0 0 0 0 0 0 0 0 0 0 0 0 0 0 0 0 0 0 0 0 0 0 0 0 0 0 0 0 0 0 0 0 0 0 0 0 0 0 0 0 0 0 0	ADV VERB DET ADJ NOUN NOUN CCONJ ADV PROPN PROPN VERB ADP DET VERB NOUN NOUN CCONJ NOUN PUNCT PUNCT PRON VERB VERB ADP ADJ ADJ ADJ NOUN NOUN ADJ NOUN VERB VERB ADP DET NOUN NOUN DET NOUN NOUN NOUN NOUN DET NOUN NOUN NOUN NOUN DET NOUN NOUN NOUN NOUN ADV DET ADJ NOUN ADP VERB ADP DET ADJ ADJ ADJ NOUN NOUN
Matthew grew up in a family atmosphere of sweetness and light.	0 0 0 0 0 0 0 0 1 1 1	sweetness and light	figurative	identical	PROPN VERB PART ADP DET NOUN NOUN ADP NOUN CCONJ NOUN	▁Mat the w ▁grew ▁up ▁in ▁a ▁family ▁atmosphere ▁of ▁sweet ness ▁and ▁light .	0 0 0 0 0 0 0 0 0 0 1 1 1 1 1	PROPN PROPN PROPN VERB PART ADP DET NOUN NOUN ADP NOUN NOUN CCONJ NOUN NOUN
But Khrushchev's next visit to the West was one of sweetness and light, to Britain at the invitation of Eden.	0 0 0 0 0 0 0 0 0 0 1 1 1 0 0 0 0 0 0 0	sweetness and light	figurative	identical	CCONJ PROPN ADJ NOUN ADP DET PROPN VERB NUM ADP NOUN CCONJ NOUN ADP PROPN ADP DET NOUN ADP PROPN	▁But ▁Kh rus h che v ' s ▁next ▁visit ▁to ▁the ▁West ▁was ▁one ▁of ▁sweet ness ▁and ▁light , ▁to ▁Britain ▁at ▁the ▁invitation ▁of ▁E den .	0 0 0 0 0 0 0 0 0 0 0 0 0 0 0 0 1 1 1 1 1 0 0 0 0 0 0 0 0 0	CCONJ PROPN PROPN PROPN PROPN PROPN PROPN PROPN ADJ NOUN ADP DET PROPN VERB NUM ADP NOUN NOUN CCONJ NOUN NOUN ADP PROPN ADP DET NOUN ADP PROPN PROPN PROPN
You know, it isn't all sweetness and light here, not by any manner of means.	0 0 0 0 0 1 1 1 0 0 0 0 0 0 0	sweetness and light	figurative	identical	PRON VERB PRON VERB DET NOUN CCONJ NOUN ADV ADV ADP DET NOUN ADP NOUN	▁You ▁know , ▁it ▁is n ' t ▁all ▁sweet ness ▁and ▁light ▁here , ▁not ▁by ▁any ▁manner ▁of ▁means .	0 0 0 0 0 0 0 0 0 1 1 1 1 0 0 0 0 0 0 0 0 0	PRON VERB VERB PRON VERB VERB VERB VERB DET NOUN NOUN CCONJ NOUN ADV ADV ADV ADP DET NOUN ADP NOUN NOUN
Societies should always be aware when they are launched that life is not always sweetness and light when the pressure is on and constitutions should be framed so that disputes do arrive the framework for settlement already exists.	0 0 0 0 0 0 0 0 0 0 0 0 0 0 1 1 1 0 0 0 0 0 0 0 0 0 0 0 0 0 0 0 0 0 0 0 0 0	sweetness and light	figurative	identical	NOUN VERB ADV VERB ADJ ADV PRON VERB VERB ADP NOUN VERB ADV ADV NOUN CCONJ NOUN ADV DET NOUN VERB ADP CCONJ NOUN VERB VERB VERB ADP ADP NOUN VERB VERB DET NOUN ADP NOUN ADV VERB	▁ Societ ies ▁should ▁always ▁be ▁aware ▁when ▁they ▁are ▁launched ▁that ▁life ▁is ▁not ▁always ▁sweet ness ▁and ▁light ▁when ▁the ▁pressure ▁is ▁on ▁and ▁constitution s ▁should ▁be ▁framed ▁so ▁that ▁disputes ▁do ▁arrive ▁the ▁framework ▁for ▁settlement ▁already ▁exists .	0 0 0 0 0 0 0 0 0 0 0 0 0 0 0 0 1 1 1 1 0 0 0 0 0 0 0 0 0 0 0 0 0 0 0 0 0 0 0 0 0 0 0	NOUN NOUN NOUN VERB ADV VERB ADJ ADV PRON VERB VERB ADP NOUN VERB ADV ADV NOUN NOUN CCONJ NOUN ADV DET NOUN VERB ADP CCONJ NOUN NOUN VERB VERB VERB ADP ADP NOUN VERB VERB DET NOUN ADP NOUN ADV VERB VERB
They knew how desperately he and his comrades wanted to celebrate their day amid sweetness and light.	0 0 0 0 0 0 0 0 0 0 0 0 0 0 1 1 1	sweetness and light	figurative	identical	PRON VERB ADV ADV PRON CCONJ ADJ NOUN VERB PART VERB ADJ NOUN ADP NOUN CCONJ NOUN	▁They ▁knew ▁how ▁desperately ▁he ▁and ▁his ▁comrade s ▁wanted ▁to ▁celebrate ▁their ▁day ▁a mid ▁sweet ness ▁and ▁light .	0 0 0 0 0 0 0 0 0 0 0 0 0 0 0 0 1 1 1 1 1	PRON VERB ADV ADV PRON CCONJ ADJ NOUN NOUN VERB PART VERB ADJ NOUN ADP ADP NOUN NOUN CCONJ NOUN NOUN
If Senna becomes champion, and to do it he must win in Japan and Australia, then Prost's recent criticism of his treatment at the hands of Honda will immediately spring to mind regardless of a subsequent and rather naive document, signed by all sides and designed to give the impression that all is sweetness and light.	0 0 0 0 0 0 0 0 0 0 0 0 0 0 0 0 0 0 0 0 0 0 0 0 0 0 0 0 0 0 0 0 0 0 0 0 0 0 0 0 0 0 0 0 0 0 0 0 0 0 0 0 0 1 1 1	sweetness and light	figurative	identical	ADP PROPN VERB NOUN CCONJ PART VERB PRON PRON VERB VERB ADP PROPN CCONJ PROPN ADV PROPN ADJ NOUN ADP ADJ NOUN ADP DET NOUN ADP PROPN VERB ADV VERB ADP NOUN ADV ADP DET ADJ CCONJ ADV ADJ NOUN VERB ADP DET NOUN CCONJ VERB PART VERB DET NOUN ADP DET VERB NOUN CCONJ NOUN	▁If ▁S enna ▁becomes ▁champion , ▁and ▁to ▁do ▁it ▁he ▁must ▁win ▁in ▁Japan ▁and ▁Australia , ▁then ▁Pro st ' s ▁recent ▁criticism ▁of ▁his ▁treatment ▁at ▁the ▁hands ▁of ▁H on da ▁will ▁immediately ▁spring ▁to ▁mind ▁regardless ▁of ▁a ▁subsequent ▁and ▁rather ▁na ive ▁document , ▁signed ▁by ▁all ▁sides ▁and ▁designed ▁to ▁give ▁the ▁impression ▁that ▁all ▁is ▁sweet ness ▁and ▁light .	0 0 0 0 0 0 0 0 0 0 0 0 0 0 0 0 0 0 0 0 0 0 0 0 0 0 0 0 0 0 0 0 0 0 0 0 0 0 0 0 0 0 0 0 0 0 0 0 0 0 0 0 0 0 0 0 0 0 0 0 0 0 0 1 1 1 1 1	ADP PROPN PROPN VERB NOUN NOUN CCONJ PART VERB PRON PRON VERB VERB ADP PROPN CCONJ PROPN PROPN ADV PROPN PROPN PROPN PROPN ADJ NOUN ADP ADJ NOUN ADP DET NOUN ADP PROPN PROPN PROPN VERB ADV VERB ADP NOUN ADV ADP DET ADJ CCONJ ADV ADJ ADJ NOUN NOUN VERB ADP DET NOUN CCONJ VERB PART VERB DET NOUN ADP DET VERB NOUN NOUN CCONJ NOUN NOUN
However, the Franco - German relationship, for all its sweetness and light in public, is a complicated relationship.	0 0 0 0 0 0 0 0 0 1 1 1 0 0 0 0 0 0	sweetness and light	figurative	identical	ADV DET PROPN PUNCT ADJ NOUN ADP ADJ ADJ NOUN CCONJ NOUN ADP NOUN VERB DET ADJ NOUN	▁However , ▁the ▁Franco ▁- ▁German ▁relationship , ▁for ▁all ▁its ▁sweet ness ▁and ▁light ▁in ▁public , ▁is ▁a ▁complicated ▁relationship .	0 0 0 0 0 0 0 0 0 0 0 1 1 1 1 0 0 0 0 0 0 0 0	ADV ADV DET PROPN PUNCT ADJ NOUN NOUN ADP ADJ ADJ NOUN NOUN CCONJ NOUN ADP NOUN NOUN VERB DET ADJ NOUN NOUN
In the attempt to win society's approval by a cultured ministry that had both sweetness and light, would Nonconformity produce a ministry cut off from the faithful?	0 0 0 0 0 0 0 0 0 0 0 0 0 0 1 1 1 0 0 0 0 0 0 0 0 0 0	sweetness and light	figurative	identical	ADP DET NOUN PART VERB NOUN NOUN ADP DET ADJ NOUN ADJ VERB DET NOUN CCONJ NOUN VERB NOUN VERB DET NOUN VERB PART ADP DET NOUN	▁In ▁the ▁attempt ▁to ▁win ▁society ' s ▁approval ▁by ▁a ▁cultured ▁ministry ▁that ▁had ▁both ▁sweet ness ▁and ▁light , ▁would ▁Non conformity ▁produce ▁a ▁ministry ▁cut ▁off ▁from ▁the ▁faithful ?	0 0 0 0 0 0 0 0 0 0 0 0 0 0 0 0 1 1 1 1 1 0 0 0 0 0 0 0 0 0 0 0 0	ADP DET NOUN PART VERB NOUN NOUN NOUN NOUN ADP DET ADJ NOUN ADJ VERB DET NOUN NOUN CCONJ NOUN NOUN VERB NOUN NOUN VERB DET NOUN VERB PART ADP DET NOUN NOUN
When he's around she's all sweetness and light.’	0 0 0 0 0 1 1 1	sweetness and light	figurative	dashes	ADV PRON ADP PRON DET NOUN CCONJ NOUN	▁When ▁he ' s ▁around ▁she ' s ▁all ▁sweet ness ▁and ▁light . ’	0 0 0 0 0 0 0 0 0 1 1 1 1 1 1	ADV PRON PRON PRON ADP PRON PRON PRON DET NOUN NOUN CCONJ NOUN NOUN NOUN
He's been all sweetness and light, promised nothing and done ditto.’	0 0 0 1 1 1 0 0 0 0 0	sweetness and light	figurative	identical	PRON VERB DET NOUN CCONJ NOUN VERB NOUN CCONJ VERB NOUN	▁He ' s ▁been ▁all ▁sweet ness ▁and ▁light , ▁promised ▁nothing ▁and ▁done ▁di t to . ’	0 0 0 0 0 1 1 1 1 1 0 0 0 0 0 0 0 0 0	PRON PRON PRON VERB DET NOUN NOUN CCONJ NOUN NOUN VERB NOUN CCONJ VERB NOUN NOUN NOUN NOUN NOUN
No sweetness and light at all.	0 1 1 1 0 0	sweetness and light	figurative	identical	DET NOUN CCONJ NOUN ADV ADV	▁No ▁sweet ness ▁and ▁light ▁at ▁all .	0 1 1 1 1 0 0 0	DET NOUN NOUN CCONJ NOUN ADV ADV ADV
Even back at the estuary all is not the sweetness and light that events like this week's launch suggests.	0 0 0 0 0 0 0 0 0 1 1 1 0 0 0 0 0 0 0	sweetness and light	figurative	identical	ADV ADV ADP DET NOUN DET VERB ADV DET NOUN CCONJ NOUN ADJ NOUN ADP DET NOUN NOUN VERB	▁Even ▁back ▁at ▁the ▁est u ary ▁all ▁is ▁not ▁the ▁sweet ness ▁and ▁light ▁that ▁events ▁like ▁this ▁week ' s ▁launch ▁suggests .	0 0 0 0 0 0 0 0 0 0 0 1 1 1 1 0 0 0 0 0 0 0 0 0 0	ADV ADV ADP DET NOUN NOUN NOUN DET VERB ADV DET NOUN NOUN CCONJ NOUN ADJ NOUN ADP DET NOUN NOUN NOUN NOUN VERB VERB
It was hard to be all sweetness and light when she was desperately trying to catch up with her own quarry before McKenna did.	0 0 0 0 0 0 1 1 1 0 0 0 0 0 0 0 0 0 0 0 0 0 0 0	sweetness and light	figurative	identical	PRON VERB ADJ PART VERB DET NOUN CCONJ NOUN ADV PRON VERB ADV VERB PART VERB PART ADP ADJ ADJ NOUN ADP PROPN VERB	▁It ▁was ▁hard ▁to ▁be ▁all ▁sweet ness ▁and ▁light ▁when ▁she ▁was ▁desperately ▁trying ▁to ▁catch ▁up ▁with ▁her ▁own ▁qua rry ▁before ▁McK enna ▁did .	0 0 0 0 0 0 1 1 1 1 0 0 0 0 0 0 0 0 0 0 0 0 0 0 0 0 0 0	PRON VERB ADJ PART VERB DET NOUN NOUN CCONJ NOUN ADV PRON VERB ADV VERB PART VERB PART ADP ADJ ADJ NOUN NOUN ADP PROPN PROPN VERB VERB
Yeah, like the electricity, but your chickens come home to roost when your overtime goes, when your job goes and you take on a commitment and they never, the last ten, fifteen, twenty, twenty five years and they 've never ever, ever taken on a commitment like that before, when it's presented with just the roses around it, everything's sweetness and light and roses and the other side isn't really put, put to you, think of the worse scenario, you 're out of a job, what can you do?	0 0 0 0 0 0 0 0 0 0 0 0 0 0 0 0 0 0 0 0 0 0 0 0 0 0 0 0 0 0 0 0 0 0 0 0 0 0 0 0 0 0 0 0 0 0 0 0 0 0 0 0 0 0 0 0 0 0 0 1 1 1 0 0 0 0 0 0 0 0 0 0 0 0 0 0 0 0 0 0 0 0 0 0 0 0 0 0 0	sweetness and light	figurative	identical	INTJ ADP DET NOUN CCONJ ADJ NOUN VERB ADV PART VERB ADV ADJ NOUN VERB ADV ADJ NOUN VERB CCONJ PRON VERB PART DET NOUN CCONJ PRON ADV DET ADJ NUM NUM NUM NUM NUM NOUN CCONJ PRON VERB ADV ADV ADV VERB PART DET NOUN ADP DET ADV ADV PRON VERB ADP ADV DET NOUN ADP PRON NOUN NOUN CCONJ NOUN CCONJ NOUN CCONJ DET ADJ NOUN VERB ADV VERB VERB ADP PRON VERB ADP DET ADJ NOUN PRON VERB ADP ADP DET NOUN NOUN VERB PRON VERB	▁Ye ah , ▁like ▁the ▁electricity , ▁but ▁your ▁chickens ▁come ▁home ▁to ▁ro ost ▁when ▁your ▁overtime ▁goes , ▁when ▁your ▁job ▁goes ▁and ▁you ▁take ▁on ▁a ▁commitment ▁and ▁they ▁never , ▁the ▁last ▁ten , ▁fifteen , ▁twenty , ▁twenty ▁five ▁years ▁and ▁they ▁' ve ▁never ▁ever , ▁ever ▁taken ▁on ▁a ▁commitment ▁like ▁that ▁before , ▁when ▁it ' s ▁presented ▁with ▁just ▁the ▁rose s ▁around ▁it , ▁everything ' s ▁sweet ness ▁and ▁light ▁and ▁rose s ▁and ▁the ▁other ▁side ▁is n ' t ▁really ▁put , ▁put ▁to ▁you , ▁think ▁of ▁the ▁worse ▁scenario , ▁you ▁' re ▁out ▁of ▁a ▁job , ▁what ▁can ▁you ▁do ?	0 0 0 0 0 0 0 0 0 0 0 0 0 0 0 0 0 0 0 0 0 0 0 0 0 0 0 0 0 0 0 0 0 0 0 0 0 0 0 0 0 0 0 0 0 0 0 0 0 0 0 0 0 0 0 0 0 0 0 0 0 0 0 0 0 0 0 0 0 0 0 0 0 0 0 0 0 1 1 1 1 0 0 0 0 0 0 0 0 0 0 0 0 0 0 0 0 0 0 0 0 0 0 0 0 0 0 0 0 0 0 0 0 0 0 0 0 0	INTJ INTJ INTJ ADP DET NOUN NOUN CCONJ ADJ NOUN VERB ADV PART VERB VERB ADV ADJ NOUN VERB VERB ADV ADJ NOUN VERB CCONJ PRON VERB PART DET NOUN CCONJ PRON ADV ADV DET ADJ NUM NUM NUM NUM NUM NUM NUM NUM NOUN CCONJ PRON VERB VERB ADV ADV ADV ADV VERB PART DET NOUN ADP DET ADV ADV ADV PRON PRON PRON VERB ADP ADV DET NOUN NOUN ADP PRON PRON NOUN NOUN NOUN NOUN NOUN CCONJ NOUN CCONJ NOUN NOUN CCONJ DET ADJ NOUN VERB VERB VERB VERB ADV VERB VERB VERB ADP PRON PRON VERB ADP DET ADJ NOUN NOUN PRON VERB VERB ADP ADP DET NOUN NOUN NOUN VERB PRON VERB VERB
It is conceivable that if an agreement had been signed and if henceforth Anglo - American relations had been bathed in sweetness and light, arrangements might have been made for pooling atomic weapons production.	0 0 0 0 0 0 0 0 0 0 0 0 0 0 0 0 0 0 0 0 0 1 1 1 0 0 0 0 0 0 0 0 0 0	sweetness and light	figurative	identical	PRON VERB ADJ ADP ADP DET NOUN VERB VERB VERB CCONJ ADP ADJ ADJ PUNCT ADJ NOUN VERB VERB VERB ADP NOUN CCONJ NOUN NOUN VERB VERB VERB VERB ADP VERB ADJ NOUN NOUN	▁It ▁is ▁conceivabl e ▁that ▁if ▁an ▁agreement ▁had ▁been ▁signed ▁and ▁if ▁henceforth ▁Anglo ▁- ▁American ▁relations ▁had ▁been ▁bath ed ▁in ▁sweet ness ▁and ▁light , ▁arrangements ▁might ▁have ▁been ▁made ▁for ▁pooling ▁at omic ▁weapons ▁production .	0 0 0 0 0 0 0 0 0 0 0 0 0 0 0 0 0 0 0 0 0 0 0 1 1 1 1 1 0 0 0 0 0 0 0 0 0 0 0 0	PRON VERB ADJ ADJ ADP ADP DET NOUN VERB VERB VERB CCONJ ADP ADJ ADJ PUNCT ADJ NOUN VERB VERB VERB VERB ADP NOUN NOUN CCONJ NOUN NOUN NOUN VERB VERB VERB VERB ADP VERB ADJ ADJ NOUN NOUN NOUN
For the rest of that evening Dr Jones astonished the Casualty junior staff by being, for him, an angel of sweetness and light to us.	0 0 0 0 0 0 0 0 0 0 0 0 0 0 0 0 0 0 0 0 1 1 1 0 0	sweetness and light	figurative	identical	ADP DET NOUN ADP DET NOUN PROPN PROPN VERB DET PROPN ADJ NOUN ADP VERB ADP PRON DET NOUN ADP NOUN CCONJ NOUN ADP PRON	▁For ▁the ▁rest ▁of ▁that ▁evening ▁Dr ▁Jones ▁astonished ▁the ▁Ca s ual ty ▁junior ▁staff ▁by ▁being , ▁for ▁him , ▁an ▁angel ▁of ▁sweet ness ▁and ▁light ▁to ▁us .	0 0 0 0 0 0 0 0 0 0 0 0 0 0 0 0 0 0 0 0 0 0 0 0 0 1 1 1 1 0 0 0	ADP DET NOUN ADP DET NOUN PROPN PROPN VERB DET PROPN PROPN PROPN PROPN ADJ NOUN ADP VERB VERB ADP PRON PRON DET NOUN ADP NOUN NOUN CCONJ NOUN ADP PRON PRON
At first, all was Christian sweetness and light.	0 0 0 0 0 1 1 1	sweetness and light	figurative	identical	ADP ADV DET VERB ADJ NOUN CCONJ NOUN	▁At ▁first , ▁all ▁was ▁Christian ▁sweet ness ▁and ▁light .	0 0 0 0 0 0 1 1 1 1 1	ADP ADV ADV DET VERB ADJ NOUN NOUN CCONJ NOUN NOUN
Hilton embodies his sense of how the contemplative grows in love for Christ as God, in the image of Mary Magdalene reaching out to touch the risen Jesus who says : Hilton enlarges : It is this love, knowledge and worship which is experienced in the darkness ; the " lif vnseable " ( 30.102r. –252 ) of the soul"as the gift of the Holy Ghost at Pentecost who : This is the core of contemplative knowledge, not the quasi - sensual experience of heat and sweetness and light which may accompany it.	0 0 0 0 0 0 0 0 0 0 0 0 0 0 0 0 0 0 0 0 0 0 0 0 0 0 0 0 0 0 0 0 0 0 0 0 0 0 0 0 0 0 0 0 0 0 0 0 0 0 0 0 0 0 0 0 0 0 0 0 0 0 0 0 0 0 0 0 0 0 0 0 0 0 0 0 0 0 0 0 0 0 0 0 0 0 1 1 1 0 0 0 0	sweetness and light	figurative	identical	PROPN VERB ADJ NOUN ADP ADV DET NOUN VERB ADP NOUN ADP PROPN ADP PROPN ADP DET NOUN ADP PROPN PROPN VERB ADP PART VERB DET VERB PROPN NOUN VERB PUNCT PROPN NOUN PUNCT PRON VERB DET NOUN NOUN CCONJ NOUN ADJ VERB VERB ADP DET NOUN PUNCT DET PUNCT ADJ ADJ PUNCT PUNCT NUM PROPN PUNCT ADP DET NOUN DET NOUN ADP DET PROPN PROPN ADP PROPN NOUN PUNCT DET VERB DET NOUN ADP ADJ NOUN ADV DET ADV PUNCT ADJ NOUN ADP NOUN CCONJ NOUN CCONJ NOUN ADJ VERB VERB PRON	▁H il ton ▁em bo dies ▁his ▁sense ▁of ▁how ▁the ▁contemplat ive ▁grow s ▁in ▁love ▁for ▁Christ ▁as ▁God , ▁in ▁the ▁image ▁of ▁Mary ▁Mag dal ene ▁reaching ▁out ▁to ▁touch ▁the ▁risen ▁Jesus ▁who ▁says ▁ : ▁H il ton ▁enlarge s ▁ : ▁It ▁is ▁this ▁love , ▁knowledge ▁and ▁worship ▁which ▁is ▁experienced ▁in ▁the ▁darkness ▁ ; ▁the ▁" ▁l if ▁v ns e able ▁" ▁( ▁30 . 102 r . ▁ – 25 2 ▁ ) ▁of ▁the ▁soul " as ▁the ▁gift ▁of ▁the ▁Holy ▁G host ▁at ▁Pen te cost ▁who ▁ : ▁This ▁is ▁the ▁core ▁of ▁contemplat ive ▁knowledge , ▁not ▁the ▁quasi ▁- ▁sen s ual ▁experience ▁of ▁heat ▁and ▁sweet ness ▁and ▁light ▁which ▁may ▁accompany ▁it .	0 0 0 0 0 0 0 0 0 0 0 0 0 0 0 0 0 0 0 0 0 0 0 0 0 0 0 0 0 0 0 0 0 0 0 0 0 0 0 0 0 0 0 0 0 0 0 0 0 0 0 0 0 0 0 0 0 0 0 0 0 0 0 0 0 0 0 0 0 0 0 0 0 0 0 0 0 0 0 0 0 0 0 0 0 0 0 0 0 0 0 0 0 0 0 0 0 0 0 0 0 0 0 0 0 0 0 0 0 0 0 0 0 0 0 0 0 0 0 0 0 0 0 0 1 1 1 1 0 0 0 0 0	PROPN PROPN PROPN VERB VERB VERB ADJ NOUN ADP ADV DET NOUN NOUN VERB VERB ADP NOUN ADP PROPN ADP PROPN PROPN ADP DET NOUN ADP PROPN PROPN PROPN PROPN VERB ADP PART VERB DET VERB PROPN NOUN VERB PUNCT PUNCT PROPN PROPN PROPN NOUN NOUN PUNCT PUNCT PRON VERB DET NOUN NOUN NOUN CCONJ NOUN ADJ VERB VERB ADP DET NOUN PUNCT PUNCT DET PUNCT ADJ ADJ ADJ ADJ ADJ ADJ PUNCT PUNCT NUM NUM NUM NUM NUM PROPN PROPN PROPN PROPN PUNCT PUNCT ADP DET NOUN NOUN NOUN DET NOUN ADP DET PROPN PROPN PROPN ADP PROPN PROPN PROPN NOUN PUNCT PUNCT DET VERB DET NOUN ADP ADJ ADJ NOUN NOUN ADV DET ADV PUNCT ADJ ADJ ADJ NOUN ADP NOUN CCONJ NOUN NOUN CCONJ NOUN ADJ VERB VERB PRON PRON
ALL is sweetness and light again between the Tory Party and its advertising agency, Saatchi and Saatchi.	0 0 1 1 1 0 0 0 0 0 0 0 0 0 0 0 0	sweetness and light	figurative	identical	DET VERB NOUN CCONJ NOUN ADV ADP DET PROPN PROPN CCONJ ADJ NOUN NOUN PROPN CCONJ PROPN	▁ALL ▁is ▁sweet ness ▁and ▁light ▁again ▁between ▁the ▁To ry ▁Party ▁and ▁its ▁advertising ▁agency , ▁Sa at chi ▁and ▁Sa at chi .	0 0 1 1 1 1 0 0 0 0 0 0 0 0 0 0 0 0 0 0 0 0 0 0 0	DET VERB NOUN NOUN CCONJ NOUN ADV ADP DET PROPN PROPN PROPN CCONJ ADJ NOUN NOUN NOUN PROPN PROPN PROPN CCONJ PROPN PROPN PROPN PROPN
