The different cliques stood together in their separate groups, talking shop : the ethnic collection of the new Paris - trained designer ; the likely winners in the next cabinet reshuffle ; the latest chapter in the interminable Bofors corruption scandal.	0 0 0 0 0 0 0 0 0 1 1 0 0 0 0 0 0 0 0 0 0 0 0 0 0 0 0 0 0 0 0 0 0 0 0 0 0 0 0 0 0	talk shop	figurative	inflection	DET ADJ NOUN VERB ADV ADP ADJ ADJ NOUN VERB NOUN PUNCT DET ADJ NOUN ADP DET ADJ PROPN PUNCT VERB NOUN PUNCT DET ADJ NOUN ADP DET ADJ NOUN NOUN PUNCT DET ADJ NOUN ADP DET ADJ PROPN NOUN NOUN	▁The ▁different ▁cli ques ▁stood ▁together ▁in ▁their ▁separate ▁groups , ▁talking ▁shop ▁ : ▁the ▁ethnic ▁collection ▁of ▁the ▁new ▁Paris ▁- ▁trained ▁design er ▁ ; ▁the ▁likely ▁winner s ▁in ▁the ▁next ▁cabinet ▁re sh uff le ▁ ; ▁the ▁latest ▁chapter ▁in ▁the ▁inter min able ▁Bo for s ▁corruption ▁scandal .	0 0 0 0 0 0 0 0 0 0 0 1 1 0 0 0 0 0 0 0 0 0 0 0 0 0 0 0 0 0 0 0 0 0 0 0 0 0 0 0 0 0 0 0 0 0 0 0 0 0 0 0 0 0 0 0	DET ADJ NOUN NOUN VERB ADV ADP ADJ ADJ NOUN NOUN VERB NOUN PUNCT PUNCT DET ADJ NOUN ADP DET ADJ PROPN PUNCT VERB NOUN NOUN PUNCT PUNCT DET ADJ NOUN NOUN ADP DET ADJ NOUN NOUN NOUN NOUN NOUN PUNCT PUNCT DET ADJ NOUN ADP DET ADJ ADJ ADJ PROPN PROPN PROPN NOUN NOUN NOUN
The new tiers of membership, which become available this month, are intended to add some teeth to the X / Open's existing system vendor, independent software vendor and user councils, described by X / Open chief technical officer Mike Lambert as pure ‘ talking shops.’	0 0 0 0 0 0 0 0 0 0 0 0 0 0 0 0 0 0 0 0 0 0 0 0 0 0 0 0 0 0 0 0 0 0 0 0 0 0 0 0 0 0 0 1 1	talk shop	figurative	misc	DET ADJ NOUN ADP NOUN ADJ VERB ADJ DET NOUN VERB VERB PART VERB DET NOUN ADP DET NOUN SYM PROPN VERB NOUN NOUN ADJ NOUN NOUN CCONJ NOUN NOUN VERB ADP PROPN SYM ADJ ADJ ADJ NOUN PROPN PROPN ADV ADJ PUNCT NOUN ADP	▁The ▁new ▁tiers ▁of ▁membership , ▁which ▁become ▁available ▁this ▁month , ▁are ▁intended ▁to ▁add ▁some ▁teeth ▁to ▁the ▁X ▁/ ▁Open ' s ▁existing ▁system ▁vendor , ▁independent ▁software ▁vendor ▁and ▁user ▁councils , ▁described ▁by ▁X ▁/ ▁Open ▁chief ▁technical ▁officer ▁M ike ▁Lamb ert ▁as ▁pure ▁ ‘ ▁talking ▁shops . ’	0 0 0 0 0 0 0 0 0 0 0 0 0 0 0 0 0 0 0 0 0 0 0 0 0 0 0 0 0 0 0 0 0 0 0 0 0 0 0 0 0 0 0 0 0 0 0 0 0 0 0 0 1 1 1 1	DET ADJ NOUN ADP NOUN NOUN ADJ VERB ADJ DET NOUN NOUN VERB VERB PART VERB DET NOUN ADP DET NOUN SYM PROPN PROPN PROPN VERB NOUN NOUN NOUN ADJ NOUN NOUN CCONJ NOUN NOUN NOUN VERB ADP PROPN SYM ADJ ADJ ADJ NOUN PROPN PROPN PROPN PROPN ADV ADJ PUNCT PUNCT NOUN ADP ADP ADP
Parliament is a talking shop where members seek to influence others by debate.	0 0 0 1 1 0 0 0 0 0 0 0 0	talk shop	figurative	inflection	PROPN VERB DET VERB NOUN ADV NOUN VERB PART VERB NOUN ADP NOUN	▁Parliament ▁is ▁a ▁talking ▁shop ▁where ▁members ▁seek ▁to ▁influence ▁others ▁by ▁debate .	0 0 0 1 1 0 0 0 0 0 0 0 0 0	PROPN VERB DET VERB NOUN ADV NOUN VERB PART VERB NOUN ADP NOUN NOUN
‘ I 'm not meaning to talk shop but I thought you might be interested.’	0 0 0 0 0 0 1 1 0 0 0 0 0 0 0	talk shop	figurative	identical	PUNCT PRON VERB ADV VERB PART VERB NOUN CCONJ PRON VERB PRON VERB VERB ADJ	▁ ‘ ▁I ▁' m ▁not ▁meaning ▁to ▁talk ▁shop ▁but ▁I ▁thought ▁you ▁might ▁be ▁interested . ’	0 0 0 0 0 0 0 0 1 1 0 0 0 0 0 0 0 0 0	PUNCT PUNCT PRON VERB VERB ADV VERB PART VERB NOUN CCONJ PRON VERB PRON VERB VERB ADJ ADJ ADJ
‘ Don't tell me that you two are talking shop,’ Andrew said.	0 0 0 0 0 0 0 0 1 1 0 0	talk shop	figurative	combined-inflection	PUNCT VERB VERB PRON ADP PRON NUM VERB VERB PROPN PROPN VERB	▁ ‘ ▁Don ' t ▁tell ▁me ▁that ▁you ▁two ▁are ▁talking ▁shop , ’ ▁Andrew ▁said .	0 0 0 0 0 0 0 0 0 0 0 1 1 1 1 0 0 0	PUNCT PUNCT VERB VERB VERB VERB PRON ADP PRON NUM VERB VERB PROPN PROPN PROPN PROPN VERB VERB
They would incessantly ‘ talk shop’, for example, especially in that important semi - public arena — the village pub.	0 0 0 0 1 1 0 0 0 0 0 0 0 0 0 0 0 0 0 0	talk shop	figurative	dashes	PRON VERB ADV PUNCT NOUN PROPN ADP NOUN ADV ADP DET ADJ NOUN PUNCT ADJ NOUN PUNCT DET NOUN NOUN	▁They ▁would ▁in cess ant ly ▁ ‘ ▁talk ▁shop ’ , ▁for ▁example , ▁especially ▁in ▁that ▁important ▁semi ▁- ▁public ▁are na ▁ — ▁the ▁village ▁pub .	0 0 0 0 0 0 0 0 1 1 1 1 0 0 0 0 0 0 0 0 0 0 0 0 0 0 0 0 0 0	PRON VERB ADV ADV ADV ADV PUNCT PUNCT NOUN PROPN PROPN PROPN ADP NOUN NOUN ADV ADP DET ADJ NOUN PUNCT ADJ NOUN NOUN PUNCT PUNCT DET NOUN NOUN NOUN
‘ We were talking shop ; it was shop - talk, not gossip.’	0 0 0 1 1 0 0 0 0 0 0 0 0	talk shop	figurative	inflection	PUNCT PRON VERB VERB NOUN PUNCT PRON VERB NOUN PUNCT NOUN ADV X	▁ ‘ ▁We ▁were ▁talking ▁shop ▁ ; ▁it ▁was ▁shop ▁- ▁talk , ▁not ▁go s s ip . ’	0 0 0 0 1 1 0 0 0 0 0 0 0 0 0 0 0 0 0 0 0	PUNCT PUNCT PRON VERB VERB NOUN PUNCT PUNCT PRON VERB NOUN PUNCT NOUN NOUN ADV X X X X X X
From time to time, taking one to lunch or meeting up for a drink gives you a chance to talk shop and learn about the other's work and publications.	0 0 0 0 0 0 0 0 0 0 0 0 0 0 0 0 0 0 0 1 1 0 0 0 0 0 0 0 0	talk shop	figurative	identical	ADP NOUN ADP NOUN VERB NUM ADP NOUN CCONJ NOUN PART ADP DET NOUN VERB PRON DET NOUN PART VERB NOUN CCONJ VERB ADP DET ADJ NOUN CCONJ NOUN	▁From ▁time ▁to ▁time , ▁taking ▁one ▁to ▁lunch ▁or ▁meeting ▁up ▁for ▁a ▁drink ▁gives ▁you ▁a ▁chance ▁to ▁talk ▁shop ▁and ▁learn ▁about ▁the ▁other ' s ▁work ▁and ▁publications .	0 0 0 0 0 0 0 0 0 0 0 0 0 0 0 0 0 0 0 0 1 1 0 0 0 0 0 0 0 0 0 0 0	ADP NOUN ADP NOUN NOUN VERB NUM ADP NOUN CCONJ NOUN PART ADP DET NOUN VERB PRON DET NOUN PART VERB NOUN CCONJ VERB ADP DET ADJ ADJ ADJ NOUN CCONJ NOUN NOUN
He realized that accepting it as an office would have meant being pressed into staying late at night talking shop.	0 0 0 0 0 0 0 0 0 0 0 0 0 0 0 0 0 0 1 1	talk shop	figurative	inflection	PRON VERB ADP VERB PRON ADP DET NOUN VERB VERB VERB VERB VERB ADP VERB ADV ADP NOUN VERB NOUN	▁He ▁realized ▁that ▁accepting ▁it ▁as ▁an ▁office ▁would ▁have ▁meant ▁being ▁pressed ▁into ▁staying ▁late ▁at ▁night ▁talking ▁shop .	0 0 0 0 0 0 0 0 0 0 0 0 0 0 0 0 0 0 1 1 1	PRON VERB ADP VERB PRON ADP DET NOUN VERB VERB VERB VERB VERB ADP VERB ADV ADP NOUN VERB NOUN NOUN
This is intended to publish a wide range of action research and related studies, with the aim of making their outcomes widely available and exemplifying the variety of possible styles of reporting ( ie not just another narrow, jargon - laden talking shop for academics ).	0 0 0 0 0 0 0 0 0 0 0 0 0 0 0 0 0 0 0 0 0 0 0 0 0 0 0 0 0 0 0 0 0 0 0 0 0 0 0 0 0 1 1 0 0 0	talk shop	figurative	inflection	DET VERB VERB PART VERB DET ADJ NOUN ADP NOUN NOUN CCONJ ADJ NOUN ADP DET NOUN ADP VERB ADJ NOUN ADV ADJ CCONJ VERB DET NOUN ADP ADJ NOUN ADP NOUN PUNCT X ADV ADV DET ADJ NOUN PUNCT ADJ VERB NOUN ADP NOUN PUNCT	▁This ▁is ▁intended ▁to ▁publish ▁a ▁wide ▁range ▁of ▁action ▁research ▁and ▁related ▁studies , ▁with ▁the ▁aim ▁of ▁making ▁their ▁outcomes ▁widely ▁available ▁and ▁ex em pl ifying ▁the ▁variety ▁of ▁possible ▁style s ▁of ▁reporting ▁( ▁ ie ▁not ▁just ▁another ▁narrow , ▁jar gon ▁- ▁laden ▁talking ▁shop ▁for ▁academic s ▁ ).	0 0 0 0 0 0 0 0 0 0 0 0 0 0 0 0 0 0 0 0 0 0 0 0 0 0 0 0 0 0 0 0 0 0 0 0 0 0 0 0 0 0 0 0 0 0 0 0 0 1 1 0 0 0 0 0	DET VERB VERB PART VERB DET ADJ NOUN ADP NOUN NOUN CCONJ ADJ NOUN NOUN ADP DET NOUN ADP VERB ADJ NOUN ADV ADJ CCONJ VERB VERB VERB VERB DET NOUN ADP ADJ NOUN NOUN ADP NOUN PUNCT X X ADV ADV DET ADJ ADJ NOUN NOUN PUNCT ADJ VERB NOUN ADP NOUN NOUN PUNCT PUNCT
Critics of consultative committees dismiss them as ineffectual talking shops, dominated by the ‘ concerned and worthy’ middle classes and excluding those members of dispossessed minorities on the receiving end of police policies ( Brogden et al., 1988:176 ).	0 0 0 0 0 0 0 0 1 1 0 0 0 0 0 0 0 0 0 0 0 0 0 0 0 0 0 0 0 0 0 0 0 0 0 0 0 0 0	talk shop	figurative	misc	NOUN ADP ADJ NOUN VERB PRON ADP ADJ NOUN NOUN VERB ADP DET NUM ADJ CCONJ ADJ ADJ NOUN CCONJ VERB DET NOUN ADP VERB NOUN ADP DET VERB NOUN ADP NOUN NOUN PUNCT PROPN PROPN PROPN NUM PUNCT	▁C ri tics ▁of ▁consult ative ▁committees ▁dismiss ▁them ▁as ▁in effect ual ▁talking ▁shops , ▁dominated ▁by ▁the ▁ ‘ ▁concerned ▁and ▁worthy ’ ▁middle ▁classes ▁and ▁excluding ▁those ▁members ▁of ▁dispos ses s ed ▁minorities ▁on ▁the ▁receiving ▁end ▁of ▁police ▁policies ▁( ▁B rog den ▁et ▁al . , ▁1988 : 176 ▁ ).	0 0 0 0 0 0 0 0 0 0 0 0 0 1 1 1 0 0 0 0 0 0 0 0 0 0 0 0 0 0 0 0 0 0 0 0 0 0 0 0 0 0 0 0 0 0 0 0 0 0 0 0 0 0 0 0 0	NOUN NOUN NOUN ADP ADJ ADJ NOUN VERB PRON ADP ADJ ADJ ADJ NOUN NOUN NOUN VERB ADP DET NUM NUM ADJ CCONJ ADJ ADJ ADJ NOUN CCONJ VERB DET NOUN ADP VERB VERB VERB VERB NOUN ADP DET VERB NOUN ADP NOUN NOUN PUNCT PROPN PROPN PROPN PROPN PROPN PROPN PROPN NUM NUM NUM PUNCT PUNCT
Indeed for a number of meetings there was an exchange of views about education, training and industry and increasing concern about whether partnership added anything to previous links, replaced them, or was simply another talking shop.	0 0 0 0 0 0 0 0 0 0 0 0 0 0 0 0 0 0 0 0 0 0 0 0 0 0 0 0 0 0 0 0 0 0 1 1	talk shop	figurative	inflection	ADV ADP DET NOUN ADP NOUN ADV VERB DET NOUN ADP NOUN ADP NOUN NOUN CCONJ NOUN CCONJ VERB NOUN ADP ADP NOUN VERB NOUN ADP ADJ NOUN VERB PRON CCONJ VERB ADV DET VERB NOUN	▁Indeed ▁for ▁a ▁number ▁of ▁meetings ▁there ▁was ▁an ▁exchange ▁of ▁views ▁about ▁education , ▁training ▁and ▁industry ▁and ▁increasing ▁concern ▁about ▁whether ▁partnership ▁added ▁anything ▁to ▁previous ▁links , ▁replaced ▁them , ▁or ▁was ▁simply ▁another ▁talking ▁shop .	0 0 0 0 0 0 0 0 0 0 0 0 0 0 0 0 0 0 0 0 0 0 0 0 0 0 0 0 0 0 0 0 0 0 0 0 0 1 1 1	ADV ADP DET NOUN ADP NOUN ADV VERB DET NOUN ADP NOUN ADP NOUN NOUN NOUN CCONJ NOUN CCONJ VERB NOUN ADP ADP NOUN VERB NOUN ADP ADJ NOUN NOUN VERB PRON PRON CCONJ VERB ADV DET VERB NOUN NOUN
He observes the prohibition against ‘ talking shop’, whereas Pound through his London years seems never to have talked anything else.	0 0 0 0 0 0 1 1 0 0 0 0 0 0 0 0 0 0 0 0 0	talk shop	figurative	combined-inflection	PRON VERB DET NOUN ADP PUNCT VERB PROPN ADP NOUN ADP ADJ PROPN NOUN VERB ADV PART VERB VERB NOUN ADV	▁He ▁observes ▁the ▁prohibition ▁against ▁ ‘ ▁talking ▁shop ’ , ▁whereas ▁P ound ▁through ▁his ▁London ▁years ▁seems ▁never ▁to ▁have ▁talked ▁anything ▁else .	0 0 0 0 0 0 0 1 1 1 1 0 0 0 0 0 0 0 0 0 0 0 0 0 0 0	PRON VERB DET NOUN ADP PUNCT PUNCT VERB PROPN PROPN PROPN ADP NOUN NOUN ADP ADJ PROPN NOUN VERB ADV PART VERB VERB NOUN ADV ADV
What was your opinion of of the Conference, did you find it er a useful, a useful er talking shop?	0 0 0 0 0 0 0 0 0 0 0 0 0 0 0 0 0 0 1 1	talk shop	figurative	inflection	NOUN VERB ADJ NOUN ADP ADP DET PROPN VERB PRON VERB PRON INTJ DET ADJ DET ADJ INTJ VERB NOUN	▁What ▁was ▁your ▁opinion ▁of ▁of ▁the ▁Conference , ▁did ▁you ▁find ▁it ▁er ▁a ▁useful , ▁a ▁useful ▁er ▁talking ▁shop ?	0 0 0 0 0 0 0 0 0 0 0 0 0 0 0 0 0 0 0 0 1 1 1	NOUN VERB ADJ NOUN ADP ADP DET PROPN PROPN VERB PRON VERB PRON INTJ DET ADJ ADJ DET ADJ INTJ VERB NOUN NOUN
In any case, standards in conservation science can not be managed by a committee which will become a bureaucratic talking shop, needing endless feeding with papers and briefings, and will doubtless spawn sub - committees.	0 0 0 0 0 0 0 0 0 0 0 0 0 0 0 0 0 0 0 1 1 0 0 0 0 0 0 0 0 0 0 0 0 0 0	talk shop	figurative	inflection	ADP DET NOUN NOUN ADP NOUN NOUN VERB ADV VERB VERB ADP DET NOUN ADJ VERB VERB DET ADJ NOUN NOUN VERB ADJ NOUN ADP NOUN CCONJ NOUN CCONJ VERB VERB ADJ NOUN PUNCT NOUN	▁In ▁any ▁case , ▁standards ▁in ▁conservation ▁science ▁can ▁not ▁be ▁managed ▁by ▁a ▁committee ▁which ▁will ▁become ▁a ▁bureaucra tic ▁talking ▁shop , ▁need ing ▁endless ▁feeding ▁with ▁papers ▁and ▁briefing s , ▁and ▁will ▁doubtless ▁sp aw n ▁sub ▁- ▁committees .	0 0 0 0 0 0 0 0 0 0 0 0 0 0 0 0 0 0 0 0 0 1 1 1 0 0 0 0 0 0 0 0 0 0 0 0 0 0 0 0 0 0 0 0	ADP DET NOUN NOUN NOUN ADP NOUN NOUN VERB ADV VERB VERB ADP DET NOUN ADJ VERB VERB DET ADJ ADJ NOUN NOUN NOUN VERB VERB ADJ NOUN ADP NOUN CCONJ NOUN NOUN NOUN CCONJ VERB VERB ADJ ADJ ADJ NOUN PUNCT NOUN NOUN
And the main talking - shop with workers is not the union but a quarterly ' company council ' with delegates elected by all employees.	0 0 0 1 0 1 0 0 0 0 0 0 0 0 0 0 0 0 0 0 0 0 0 0 0	talk shop	figurative	combined-inflection	CCONJ DET ADJ VERB PUNCT NOUN ADP NOUN VERB ADV DET NOUN CCONJ DET ADJ PART NOUN NOUN PUNCT ADP NOUN VERB ADP DET NOUN	▁And ▁the ▁main ▁talking ▁- ▁shop ▁with ▁workers ▁is ▁not ▁the ▁union ▁but ▁a ▁quarterly ▁' ▁company ▁council ▁' ▁with ▁delegates ▁elected ▁by ▁all ▁employees .	0 0 0 1 0 1 0 0 0 0 0 0 0 0 0 0 0 0 0 0 0 0 0 0 0 0	CCONJ DET ADJ VERB PUNCT NOUN ADP NOUN VERB ADV DET NOUN CCONJ DET ADJ PART NOUN NOUN PUNCT ADP NOUN VERB ADP DET NOUN NOUN
Keep all your meetings and get togethers on a light note by banning anyone talking shop.	0 0 0 0 0 0 0 0 0 0 0 0 0 0 1 1	talk shop	figurative	inflection	VERB DET ADJ NOUN CCONJ VERB NOUN ADP DET ADJ NOUN ADP VERB NOUN VERB NOUN	▁Keep ▁all ▁your ▁meetings ▁and ▁get ▁together s ▁on ▁a ▁light ▁note ▁by ▁bann ing ▁anyone ▁talking ▁shop .	0 0 0 0 0 0 0 0 0 0 0 0 0 0 0 0 1 1 1	VERB DET ADJ NOUN CCONJ VERB NOUN NOUN ADP DET ADJ NOUN ADP VERB VERB NOUN VERB NOUN NOUN
Rupert had not specified what the ‘ friends’ consisted of, so nobody could have known about the anthropological colleague and his wife and their children aged seven, five, and three, or pictured Rupert going to church alone on Christmas morning, helping to wash up after the adequate but plain Christmas dinner, spending the evening talking shop, and retiring early to his hard uncomfortable bed.	0 0 0 0 0 0 0 0 0 0 0 0 0 0 0 0 0 0 0 0 0 0 0 0 0 0 0 0 0 0 0 0 0 0 0 0 0 0 0 0 0 0 0 0 0 0 0 0 0 0 0 0 0 0 1 1 0 0 0 0 0 0 0 0	talk shop	figurative	inflection	PROPN VERB ADV VERB NOUN DET ADJ NOUN VERB ADP CCONJ NOUN VERB VERB VERB ADP DET ADJ NOUN CCONJ ADJ NOUN CCONJ ADJ NOUN VERB NUM NUM CCONJ NUM CCONJ VERB PROPN VERB ADP NOUN ADJ ADP PROPN NOUN VERB PART VERB PART ADP DET ADJ CCONJ ADJ PROPN NOUN VERB DET NOUN VERB NOUN CCONJ VERB ADV ADP ADJ ADJ ADJ NOUN	▁Ru per t ▁had ▁not ▁specified ▁what ▁the ▁ ‘ ▁friends ’ ▁consisted ▁of , ▁so ▁nobody ▁could ▁have ▁known ▁about ▁the ▁a nthrop ological ▁colleague ▁and ▁his ▁wife ▁and ▁their ▁children ▁aged ▁seven , ▁five , ▁and ▁three , ▁or ▁picture d ▁Ru per t ▁going ▁to ▁church ▁alone ▁on ▁Christmas ▁morning , ▁help ing ▁to ▁wash ▁up ▁after ▁the ▁adequate ▁but ▁plain ▁Christmas ▁dinner , ▁spending ▁the ▁evening ▁talking ▁shop , ▁and ▁re ti ring ▁early ▁to ▁his ▁hard ▁un com for table ▁be d .	0 0 0 0 0 0 0 0 0 0 0 0 0 0 0 0 0 0 0 0 0 0 0 0 0 0 0 0 0 0 0 0 0 0 0 0 0 0 0 0 0 0 0 0 0 0 0 0 0 0 0 0 0 0 0 0 0 0 0 0 0 0 0 0 0 0 0 0 0 0 1 1 1 0 0 0 0 0 0 0 0 0 0 0 0 0 0 0	PROPN PROPN PROPN VERB ADV VERB NOUN DET ADJ ADJ NOUN NOUN VERB ADP ADP CCONJ NOUN VERB VERB VERB ADP DET ADJ ADJ ADJ NOUN CCONJ ADJ NOUN CCONJ ADJ NOUN VERB NUM NUM NUM NUM CCONJ NUM NUM CCONJ VERB VERB PROPN PROPN PROPN VERB ADP NOUN ADJ ADP PROPN NOUN NOUN VERB VERB PART VERB PART ADP DET ADJ CCONJ ADJ PROPN NOUN NOUN VERB DET NOUN VERB NOUN NOUN CCONJ VERB VERB VERB ADV ADP ADJ ADJ ADJ ADJ ADJ ADJ NOUN NOUN NOUN
Andy the Mouse got pretty manic and spent half an hour talking shop with a Mickey.	0 0 0 0 0 0 0 0 0 0 0 1 1 0 0 0	talk shop	figurative	inflection	PROPN DET PROPN VERB ADV ADJ CCONJ VERB ADJ DET NOUN VERB NOUN ADP DET PROPN	▁And y ▁the ▁Mo use ▁got ▁pretty ▁manic ▁and ▁spent ▁half ▁an ▁hour ▁talking ▁shop ▁with ▁a ▁Mic key .	0 0 0 0 0 0 0 0 0 0 0 0 0 1 1 0 0 0 0 0	PROPN PROPN DET PROPN PROPN VERB ADV ADJ CCONJ VERB ADJ DET NOUN VERB NOUN ADP DET PROPN PROPN PROPN
But as the years went on, they were useless I mean er they were just talking shops.	0 0 0 0 0 0 0 0 0 0 0 0 0 0 0 1 1	talk shop	figurative	misc	CCONJ ADP DET NOUN VERB PART PRON VERB ADJ PRON VERB INTJ PRON VERB ADV VERB NOUN	▁But ▁as ▁the ▁years ▁went ▁on , ▁they ▁were ▁useless ▁I ▁mean ▁er ▁they ▁were ▁just ▁talking ▁shops .	0 0 0 0 0 0 0 0 0 0 0 0 0 0 0 0 1 1 1	CCONJ ADP DET NOUN VERB PART PART PRON VERB ADJ PRON VERB INTJ PRON VERB ADV VERB NOUN NOUN
Lowe represented what had always been the basis of the project until then — the concerned, upmarket readership of Right - Ons which was the perfect setting for a talking - shop.	0 0 0 0 0 0 0 0 0 0 0 0 0 0 0 0 0 0 0 0 0 0 0 0 0 0 0 0 0 1 0 1	talk shop	figurative	combined-inflection	PROPN VERB NOUN VERB ADV VERB DET NOUN ADP DET NOUN ADP ADV PUNCT DET ADJ ADJ NOUN ADP NOUN PUNCT NOUN ADJ VERB DET ADJ NOUN ADP DET VERB PUNCT NOUN	▁Low e ▁represented ▁what ▁had ▁always ▁been ▁the ▁basis ▁of ▁the ▁project ▁until ▁then ▁ — ▁the ▁concerned , ▁up market ▁reader ship ▁of ▁Right ▁- ▁On s ▁which ▁was ▁the ▁perfect ▁setting ▁for ▁a ▁talking ▁- ▁shop .	0 0 0 0 0 0 0 0 0 0 0 0 0 0 0 0 0 0 0 0 0 0 0 0 0 0 0 0 0 0 0 0 0 0 0 1 0 1 1	PROPN PROPN VERB NOUN VERB ADV VERB DET NOUN ADP DET NOUN ADP ADV PUNCT PUNCT DET ADJ ADJ ADJ ADJ NOUN NOUN ADP NOUN PUNCT NOUN NOUN ADJ VERB DET ADJ NOUN ADP DET VERB PUNCT NOUN NOUN
However, it would be wrong to view assemblies as no more than talking - shops.	0 0 0 0 0 0 0 0 0 0 0 0 1 0 1	talk shop	figurative	misc	ADV PRON VERB VERB ADJ PART VERB NOUN ADP DET ADV ADP VERB PUNCT NOUN	▁However , ▁it ▁would ▁be ▁wrong ▁to ▁view ▁assemblies ▁as ▁no ▁more ▁than ▁talking ▁- ▁shops .	0 0 0 0 0 0 0 0 0 0 0 0 0 1 0 1 1	ADV ADV PRON VERB VERB ADJ PART VERB NOUN ADP DET ADV ADP VERB PUNCT NOUN NOUN
So I believe it is a rather a waste of money, it's just talking shop, shuffling papers about, and we regret that in in the time when er resources are difficult, staffing could be put elsewhere instead of this	0 0 0 0 0 0 0 0 0 0 0 0 0 1 1 0 0 0 0 0 0 0 0 0 0 0 0 0 0 0 0 0 0 0 0 0 0 0 0	talk shop	figurative	inflection	ADV PRON VERB PRON VERB DET ADV DET NOUN ADP NOUN PRON ADV VERB NOUN VERB NOUN ADP CCONJ PRON VERB ADP PART ADP DET NOUN ADV INTJ NOUN VERB ADJ NOUN VERB VERB VERB ADV ADV ADP DET	▁So ▁I ▁believe ▁it ▁is ▁a ▁rather ▁a ▁waste ▁of ▁money , ▁it ' s ▁just ▁talking ▁shop , ▁sh uff ling ▁papers ▁about , ▁and ▁we ▁regret ▁that ▁in ▁in ▁the ▁time ▁when ▁er ▁resources ▁are ▁difficult , ▁staff ing ▁could ▁be ▁put ▁elsewhere ▁instead ▁of ▁this	0 0 0 0 0 0 0 0 0 0 0 0 0 0 0 0 1 1 1 0 0 0 0 0 0 0 0 0 0 0 0 0 0 0 0 0 0 0 0 0 0 0 0 0 0 0 0 0	ADV PRON VERB PRON VERB DET ADV DET NOUN ADP NOUN NOUN PRON PRON PRON ADV VERB NOUN NOUN VERB VERB VERB NOUN ADP ADP CCONJ PRON VERB ADP PART ADP DET NOUN ADV INTJ NOUN VERB ADJ ADJ NOUN NOUN VERB VERB VERB ADV ADV ADP DET
Then I heard how he lived hand to mouth in the Bronx, lobbying whom he could at the talking - shop.	0 0 0 0 0 0 0 0 0 0 0 0 0 0 0 0 0 0 1 0 1	talk shop	figurative	combined-inflection	ADV PRON VERB ADV PRON VERB NOUN ADP NOUN ADP DET PROPN VERB NOUN PRON VERB ADP DET VERB PUNCT NOUN	▁Then ▁I ▁heard ▁how ▁he ▁lived ▁hand ▁to ▁mouth ▁in ▁the ▁B ron x , ▁lobb ying ▁whom ▁he ▁could ▁at ▁the ▁talking ▁- ▁shop .	0 0 0 0 0 0 0 0 0 0 0 0 0 0 0 0 0 0 0 0 0 0 1 0 1 1	ADV PRON VERB ADV PRON VERB NOUN ADP NOUN ADP DET PROPN PROPN PROPN PROPN VERB VERB NOUN PRON VERB ADP DET VERB PUNCT NOUN NOUN
The Assembly's first meeting, in September 1949, disappointed both Britain's Labour leaders ( who condemned it as a ‘ talk shop’ ) and European federalists ( who recognised its powerlessness ).	0 0 0 0 0 0 0 0 0 0 0 0 0 0 0 0 0 0 0 1 1 0 0 0 0 0 0 0 0 0 0	talk shop	figurative	dashes	DET PROPN ADJ NOUN ADP PROPN NUM VERB CCONJ PROPN PROPN NOUN PUNCT NOUN VERB PRON ADP DET ADJ NOUN PROPN PUNCT CCONJ ADJ NOUN PUNCT NOUN VERB ADJ NOUN PUNCT	▁The ▁Assembly ' s ▁first ▁meeting , ▁in ▁September ▁194 9, ▁disappointed ▁both ▁Britain ' s ▁Labour ▁leaders ▁( ▁who ▁condemned ▁it ▁as ▁a ▁ ‘ ▁talk ▁shop ’ ▁ ) ▁and ▁European ▁federal ists ▁( ▁who ▁recognised ▁its ▁power lessness ▁ ).	0 0 0 0 0 0 0 0 0 0 0 0 0 0 0 0 0 0 0 0 0 0 0 0 0 0 1 1 1 0 0 0 0 0 0 0 0 0 0 0 0 0 0	DET PROPN PROPN PROPN ADJ NOUN NOUN ADP PROPN NUM NUM VERB CCONJ PROPN PROPN PROPN PROPN NOUN PUNCT NOUN VERB PRON ADP DET ADJ ADJ NOUN PROPN PROPN PUNCT PUNCT CCONJ ADJ NOUN NOUN PUNCT NOUN VERB ADJ NOUN NOUN PUNCT PUNCT
In doing so, they tend to ‘ talk shop’.	0 0 0 0 0 0 0 1 1	talk shop	figurative	dashes	ADP VERB ADV PRON VERB PART PUNCT NOUN PROPN	▁In ▁doing ▁so , ▁they ▁tend ▁to ▁ ‘ ▁talk ▁shop ’ .	0 0 0 0 0 0 0 0 0 1 1 1 1	ADP VERB ADV ADV PRON VERB PART PUNCT PUNCT NOUN PROPN PROPN PROPN
