Sabre Rattler, a beaten hot favourite on each of his first two starts, may make it third - time - lucky in the EBF Beckhampton Maiden Stakes ( 2.10 ).	0 0 0 0 0 0 0 0 0 0 0 0 0 0 0 0 1 0 1 0 1 0 0 0 0 0 0 0 0 0	third time lucky	figurative	dashes	PROPN PROPN DET VERB ADJ NOUN ADP DET ADP ADJ ADJ NUM NOUN VERB VERB PRON ADJ PUNCT NOUN PUNCT ADJ ADP DET PROPN PROPN PROPN PROPN PUNCT NUM PUNCT	▁Sab re ▁R att ler , ▁a ▁beat en ▁hot ▁favour ite ▁on ▁each ▁of ▁his ▁first ▁two ▁starts , ▁may ▁make ▁it ▁third ▁- ▁time ▁- ▁luck y ▁in ▁the ▁E B F ▁B eck h ampton ▁Ma iden ▁Sta kes ▁( ▁2.10 ▁ ).	0 0 0 0 0 0 0 0 0 0 0 0 0 0 0 0 0 0 0 0 0 0 0 1 0 1 0 1 1 0 0 0 0 0 0 0 0 0 0 0 0 0 0 0 0 0	PROPN PROPN PROPN PROPN PROPN PROPN DET VERB VERB ADJ NOUN NOUN ADP DET ADP ADJ ADJ NUM NOUN NOUN VERB VERB PRON ADJ PUNCT NOUN PUNCT ADJ ADJ ADP DET PROPN PROPN PROPN PROPN PROPN PROPN PROPN PROPN PROPN PROPN PROPN PUNCT NUM PUNCT PUNCT
Odds - on favourite last time at Haydock, he was narrowly beaten into third place, but tomorrow should prove third time lucky.	0 0 0 0 0 0 0 0 0 0 0 0 0 0 0 0 0 0 0 1 1 1	third time lucky	figurative	identical	NOUN PUNCT PART ADJ ADJ NOUN ADP PROPN PRON VERB ADV VERB ADP ADJ NOUN CCONJ NOUN VERB VERB ADJ NOUN ADJ	▁Odd s ▁- ▁on ▁favour ite ▁last ▁time ▁at ▁Ha y d ock , ▁he ▁was ▁narrow ly ▁beat en ▁into ▁third ▁place , ▁but ▁tomorrow ▁should ▁prove ▁third ▁time ▁luck y .	0 0 0 0 0 0 0 0 0 0 0 0 0 0 0 0 0 0 0 0 0 0 0 0 0 0 0 0 1 1 1 1 1	NOUN NOUN PUNCT PART ADJ ADJ ADJ NOUN ADP PROPN PROPN PROPN PROPN PROPN PRON VERB ADV ADV VERB VERB ADP ADJ NOUN NOUN CCONJ NOUN VERB VERB ADJ NOUN ADJ ADJ ADJ
Third time lucky, and are you still there, Mrs Worthington?	1 1 1 0 0 0 0 0 0 0	third time lucky	figurative	case	ADJ NOUN ADJ CCONJ VERB PRON ADV ADV PROPN PROPN	▁Third ▁time ▁luck y , ▁and ▁are ▁you ▁still ▁there , ▁Mrs ▁W or thing ton ?	1 1 1 1 1 0 0 0 0 0 0 0 0 0 0 0 0	ADJ NOUN ADJ ADJ ADJ CCONJ VERB PRON ADV ADV ADV PROPN PROPN PROPN PROPN PROPN PROPN
CAN it be third - time lucky for the French steeplechaser, The Fellow, in today's £ 150,000 Cheltenham Tote Gold Cup?	0 0 0 1 0 1 1 0 0 0 0 0 0 0 0 0 0 0 0 0 0	third time lucky	figurative	dashes	VERB PRON VERB ADJ PUNCT NOUN ADJ ADP DET ADJ NOUN DET PROPN ADP NOUN SYM NUM PROPN PROPN PROPN PROPN	▁C AN ▁it ▁be ▁third ▁- ▁time ▁luck y ▁for ▁the ▁French ▁steep le cha ser , ▁The ▁F el low , ▁in ▁today ' s ▁£ ▁15 0,000 ▁Che l ten ham ▁To te ▁Gold ▁C up ?	0 0 0 0 1 0 1 1 1 0 0 0 0 0 0 0 0 0 0 0 0 0 0 0 0 0 0 0 0 0 0 0 0 0 0 0 0 0 0	VERB VERB PRON VERB ADJ PUNCT NOUN ADJ ADJ ADP DET ADJ NOUN NOUN NOUN NOUN NOUN DET PROPN PROPN PROPN PROPN ADP NOUN NOUN NOUN SYM NUM NUM PROPN PROPN PROPN PROPN PROPN PROPN PROPN PROPN PROPN PROPN
President, congress well, third time lucky, eh?	0 0 0 1 1 1 0	third time lucky	figurative	identical	PROPN NOUN ADV ADJ NOUN ADJ INTJ	▁President , ▁congress ▁well , ▁third ▁time ▁luck y , ▁ eh ?	0 0 0 0 0 1 1 1 1 1 0 0 0	PROPN PROPN NOUN ADV ADV ADJ NOUN ADJ ADJ ADJ INTJ INTJ INTJ
' Third time lucky.	0 1 1 1	third time lucky	figurative	case	PUNCT ADJ NOUN ADJ	▁' ▁Third ▁time ▁luck y .	0 1 1 1 1 1	PUNCT ADJ NOUN ADJ ADJ ADJ
‘ Do you think it might be third time lucky?’	0 0 0 0 0 0 0 1 1 1	third time lucky	figurative	dashes	PUNCT VERB PRON VERB PRON VERB VERB ADJ NOUN NOUN	▁ ‘ ▁Do ▁you ▁think ▁it ▁might ▁be ▁third ▁time ▁luck y ? ’	0 0 0 0 0 0 0 0 1 1 1 1 1 1	PUNCT PUNCT VERB PRON VERB PRON VERB VERB ADJ NOUN NOUN NOUN NOUN NOUN
Finally, after 180 gallons of water and three hundredweight of coal going through Jesse, Gerry Williams made it third time lucky.	0 0 0 0 0 0 0 0 0 0 0 0 0 0 0 0 0 0 1 1 1	third time lucky	figurative	identical	ADV ADP NUM NOUN ADP NOUN CCONJ NUM NOUN ADP NOUN VERB ADP PROPN PROPN PROPN VERB PRON ADJ NOUN ADJ	▁Finally , ▁after ▁180 ▁gall ons ▁of ▁water ▁and ▁three ▁hundred weight ▁of ▁coal ▁going ▁through ▁J esse , ▁Ger ry ▁William s ▁made ▁it ▁third ▁time ▁luck y .	0 0 0 0 0 0 0 0 0 0 0 0 0 0 0 0 0 0 0 0 0 0 0 0 0 1 1 1 1 1	ADV ADV ADP NUM NOUN NOUN ADP NOUN CCONJ NUM NOUN NOUN ADP NOUN VERB ADP PROPN PROPN PROPN PROPN PROPN PROPN PROPN VERB PRON ADJ NOUN ADJ ADJ ADJ
Okay third time lucky oh that was sneaky just got it in.	0 1 1 1 0 0 0 0 0 0 0 0	third time lucky	figurative	identical	INTJ ADJ NOUN ADJ INTJ DET VERB ADJ ADV VERB PRON PART	▁O ka y ▁third ▁time ▁luck y ▁ oh ▁that ▁was ▁sn ea ky ▁just ▁got ▁it ▁in .	0 0 0 1 1 1 1 0 0 0 0 0 0 0 0 0 0 0 0	INTJ INTJ INTJ ADJ NOUN ADJ ADJ INTJ INTJ DET VERB ADJ ADJ ADJ ADV VERB PRON PART PART
Third time lucky.	1 1 1	third time lucky	figurative	case	ADJ NOUN ADJ	▁Third ▁time ▁luck y .	1 1 1 1 1	ADJ NOUN ADJ ADJ ADJ
This is one of the things I want you to se see today and this wonderful film I was gon na show today and I hope I 'll show next week, third time lucky, they actually interview the wives, the polygynous wives of of some erm erm guy in Africa, some African erm and they to them they actually ask the wives, why do you, you know why are you married to this man and they say well he feeds us, you know th that's why we 're married to him, he gives us food and he's apparently got five this particular man they interviewed, three of them were active and two of them were elderly, and the three active wives are quite open about the fact that this man's a good provider and therefore they stay with him, but they, they wouldn't in the case of Australian Aborigines, they wouldn't stay if they didn't get fed and they only get fed because he's a good hunter and to be a good hunter you need to go on good terms of men and that's how it works.	0 0 0 0 0 0 0 0 0 0 0 0 0 0 0 0 0 0 0 0 0 0 0 0 0 0 0 0 0 0 0 1 1 1 0 0 0 0 0 0 0 0 0 0 0 0 0 0 0 0 0 0 0 0 0 0 0 0 0 0 0 0 0 0 0 0 0 0 0 0 0 0 0 0 0 0 0 0 0 0 0 0 0 0 0 0 0 0 0 0 0 0 0 0 0 0 0 0 0 0 0 0 0 0 0 0 0 0 0 0 0 0 0 0 0 0 0 0 0 0 0 0 0 0 0 0 0 0 0 0 0 0 0 0 0 0 0 0 0 0 0 0 0 0 0 0 0 0 0 0 0 0 0 0 0 0 0 0 0 0 0 0 0 0 0 0 0 0 0 0 0 0 0 0 0 0 0 0 0 0 0 0 0 0 0 0 0	third time lucky	figurative	identical	DET VERB NUM ADP DET NOUN PRON VERB PRON PART VERB VERB NOUN CCONJ DET ADJ NOUN PRON VERB VERB PART VERB NOUN CCONJ PRON VERB PRON VERB VERB ADJ NOUN ADJ NOUN ADJ PRON ADV VERB DET NOUN DET ADJ NOUN ADP ADP DET NOUN NOUN NOUN ADP PROPN DET ADJ NOUN CCONJ PRON ADP PRON PRON ADV VERB DET NOUN ADV VERB PRON PRON VERB ADV VERB PRON ADJ ADP DET NOUN CCONJ PRON VERB INTJ PRON VERB PRON PRON VERB X DET ADV PRON VERB ADJ ADP PRON PRON VERB PRON NOUN CCONJ PRON ADV VERB NUM DET ADJ NOUN PRON VERB NUM ADP PRON VERB ADJ CCONJ NUM ADP PRON VERB ADJ CCONJ DET NUM ADJ NOUN VERB ADV ADJ ADP DET NOUN ADP DET NOUN DET ADJ NOUN CCONJ ADV PRON VERB ADP PRON CCONJ PRON PRON VERB ADP DET NOUN ADP PROPN PROPN PRON VERB VERB ADP PRON VERB VERB VERB CCONJ PRON ADV VERB VERB ADP PRON DET ADJ NOUN CCONJ PART VERB DET ADJ NOUN PRON VERB PART VERB ADP ADJ NOUN ADP NOUN CCONJ DET ADV PRON VERB	▁This ▁is ▁one ▁of ▁the ▁things ▁I ▁want ▁you ▁to ▁se ▁see ▁today ▁and ▁this ▁wonderful ▁film ▁I ▁was ▁ gon ▁na ▁show ▁today ▁and ▁I ▁hope ▁I ▁' ll ▁show ▁next ▁week , ▁third ▁time ▁luck y , ▁they ▁actually ▁interview ▁the ▁wives , ▁the ▁poly g yn ous ▁wives ▁of ▁of ▁some ▁er m ▁er m ▁ guy ▁in ▁Africa , ▁some ▁African ▁er m ▁and ▁they ▁to ▁them ▁they ▁actually ▁ask ▁the ▁wives , ▁why ▁do ▁you , ▁you ▁know ▁why ▁are ▁you ▁married ▁to ▁this ▁man ▁and ▁they ▁say ▁well ▁he ▁feed s ▁us , ▁you ▁know ▁th ▁that ' s ▁why ▁we ▁' re ▁married ▁to ▁him , ▁he ▁gives ▁us ▁food ▁and ▁he ' s ▁apparently ▁got ▁five ▁this ▁particular ▁man ▁they ▁interview ed , ▁three ▁of ▁them ▁were ▁active ▁and ▁two ▁of ▁them ▁were ▁elderly , ▁and ▁the ▁three ▁active ▁wives ▁are ▁quite ▁open ▁about ▁the ▁fact ▁that ▁this ▁man ' s ▁a ▁good ▁provider ▁and ▁therefore ▁they ▁stay ▁with ▁him , ▁but ▁they , ▁they ▁would n ' t ▁in ▁the ▁case ▁of ▁Australia n ▁Ab origin es , ▁they ▁would n ' t ▁stay ▁if ▁they ▁did n ' t ▁get ▁fed ▁and ▁they ▁only ▁get ▁fed ▁because ▁he ' s ▁a ▁good ▁hunt er ▁and ▁to ▁be ▁a ▁good ▁hunt er ▁you ▁need ▁to ▁go ▁on ▁good ▁terms ▁of ▁men ▁and ▁that ' s ▁how ▁it ▁works .	0 0 0 0 0 0 0 0 0 0 0 0 0 0 0 0 0 0 0 0 0 0 0 0 0 0 0 0 0 0 0 0 0 0 1 1 1 1 1 0 0 0 0 0 0 0 0 0 0 0 0 0 0 0 0 0 0 0 0 0 0 0 0 0 0 0 0 0 0 0 0 0 0 0 0 0 0 0 0 0 0 0 0 0 0 0 0 0 0 0 0 0 0 0 0 0 0 0 0 0 0 0 0 0 0 0 0 0 0 0 0 0 0 0 0 0 0 0 0 0 0 0 0 0 0 0 0 0 0 0 0 0 0 0 0 0 0 0 0 0 0 0 0 0 0 0 0 0 0 0 0 0 0 0 0 0 0 0 0 0 0 0 0 0 0 0 0 0 0 0 0 0 0 0 0 0 0 0 0 0 0 0 0 0 0 0 0 0 0 0 0 0 0 0 0 0 0 0 0 0 0 0 0 0 0 0 0 0 0 0 0 0 0 0 0 0 0 0 0 0 0 0 0 0 0 0 0 0 0 0 0 0 0 0 0 0 0 0	DET VERB NUM ADP DET NOUN PRON VERB PRON PART VERB VERB NOUN CCONJ DET ADJ NOUN PRON VERB VERB VERB PART VERB NOUN CCONJ PRON VERB PRON VERB VERB VERB ADJ NOUN NOUN ADJ NOUN ADJ ADJ ADJ PRON ADV VERB DET NOUN NOUN DET ADJ ADJ ADJ ADJ NOUN ADP ADP DET NOUN NOUN NOUN NOUN NOUN NOUN ADP PROPN PROPN DET ADJ NOUN NOUN CCONJ PRON ADP PRON PRON ADV VERB DET NOUN NOUN ADV VERB PRON PRON PRON VERB ADV VERB PRON ADJ ADP DET NOUN CCONJ PRON VERB INTJ PRON VERB VERB PRON PRON PRON VERB X DET DET DET ADV PRON VERB VERB ADJ ADP PRON PRON PRON VERB PRON NOUN CCONJ PRON PRON PRON ADV VERB NUM DET ADJ NOUN PRON VERB VERB VERB NUM ADP PRON VERB ADJ CCONJ NUM ADP PRON VERB ADJ ADJ CCONJ DET NUM ADJ NOUN VERB ADV ADJ ADP DET NOUN ADP DET NOUN NOUN NOUN DET ADJ NOUN CCONJ ADV PRON VERB ADP PRON PRON CCONJ PRON PRON PRON VERB VERB VERB VERB ADP DET NOUN ADP PROPN PROPN PROPN PROPN PROPN PROPN PRON VERB VERB VERB VERB VERB ADP PRON VERB VERB VERB VERB VERB VERB CCONJ PRON ADV VERB VERB ADP PRON PRON PRON DET ADJ NOUN NOUN CCONJ PART VERB DET ADJ NOUN NOUN PRON VERB PART VERB ADP ADJ NOUN ADP NOUN CCONJ DET DET DET ADV PRON VERB VERB
( WES ADLIB)(ANNE ) Still to come on Central News, will it be third time lucky for Big Syd?	0 0 0 0 0 0 0 0 0 0 0 0 0 1 1 1 0 0 0	third time lucky	figurative	identical	PUNCT PROPN PROPN PUNCT ADV PART VERB ADP PROPN PROPN VERB PRON VERB ADJ NOUN ADJ ADP PROPN PROPN	▁( ▁W ES ▁AD LI B ) ( ANN E ▁ ) ▁Still ▁to ▁come ▁on ▁Central ▁News , ▁will ▁it ▁be ▁third ▁time ▁luck y ▁for ▁Big ▁S y d ?	0 0 0 0 0 0 0 0 0 0 0 0 0 0 0 0 0 0 0 0 0 0 1 1 1 1 0 0 0 0 0 0	PUNCT PROPN PROPN PROPN PROPN PROPN PROPN PROPN PROPN PROPN PUNCT PUNCT ADV PART VERB ADP PROPN PROPN PROPN VERB PRON VERB ADJ NOUN ADJ ADJ ADP PROPN PROPN PROPN PROPN PROPN
After being pipped for places in Italia 90 and Euro 92, they must be thinking ‘ third time lucky’.	0 0 0 0 0 0 0 0 0 0 0 0 0 0 0 0 1 1 1	third time lucky	figurative	dashes	ADP VERB VERB ADP NOUN ADP PROPN NUM CCONJ PROPN NUM PRON VERB VERB VERB ADJ ADJ NOUN NOUN	▁After ▁being ▁p i pped ▁for ▁places ▁in ▁Italia ▁90 ▁and ▁Euro ▁92 , ▁they ▁must ▁be ▁thinking ▁ ‘ ▁third ▁time ▁luck y ’ .	0 0 0 0 0 0 0 0 0 0 0 0 0 0 0 0 0 0 0 0 1 1 1 1 1 1	ADP VERB VERB VERB VERB ADP NOUN ADP PROPN NUM CCONJ PROPN NUM NUM PRON VERB VERB VERB ADJ ADJ ADJ NOUN NOUN NOUN NOUN NOUN
After two successive League defeats, Abingdon Town made it third time lucky today with an emphatic three nil win over Horsham here at the Culham Road.	0 0 0 0 0 0 0 0 0 1 1 1 0 0 0 0 0 0 0 0 0 0 0 0 0 0	third time lucky	figurative	identical	ADP NUM ADJ PROPN NOUN PROPN PROPN VERB PRON ADJ NOUN ADJ NOUN ADP DET ADJ NUM ADP NOUN ADP PROPN ADV ADP DET PROPN PROPN	▁After ▁two ▁successive ▁League ▁defeat s , ▁Ab ing don ▁Town ▁made ▁it ▁third ▁time ▁luck y ▁today ▁with ▁an ▁empha tic ▁three ▁nil ▁win ▁over ▁Ho rsham ▁here ▁at ▁the ▁C ul ham ▁Road .	0 0 0 0 0 0 0 0 0 0 0 0 0 1 1 1 1 0 0 0 0 0 0 0 0 0 0 0 0 0 0 0 0 0 0 0	ADP NUM ADJ PROPN NOUN NOUN NOUN PROPN PROPN PROPN PROPN VERB PRON ADJ NOUN ADJ ADJ NOUN ADP DET ADJ ADJ NUM ADP NOUN ADP PROPN PROPN ADV ADP DET PROPN PROPN PROPN PROPN PROPN
' Third time lucky? ' he said.	0 1 1 1 0 0 0	third time lucky	figurative	case	PUNCT ADJ NOUN ADJ PUNCT PRON VERB	▁' ▁Third ▁time ▁luck y ? ▁' ▁he ▁said .	0 1 1 1 1 1 0 0 0 0	PUNCT ADJ NOUN ADJ ADJ ADJ PUNCT PRON VERB VERB
Maybe he's out there thinking : third time lucky.	0 0 0 0 0 0 1 1 1	third time lucky	figurative	identical	ADV PRON ADV ADV VERB PUNCT ADJ NOUN ADJ	▁May be ▁he ' s ▁out ▁there ▁thinking ▁ : ▁third ▁time ▁luck y .	0 0 0 0 0 0 0 0 0 0 1 1 1 1 1	ADV ADV PRON PRON PRON ADV ADV VERB PUNCT PUNCT ADJ NOUN ADJ ADJ ADJ
BRITISH featherweight champion Sean Murphy is out to make it third time lucky when he challenges for the WBO world title next month.	0 0 0 0 0 0 0 0 0 0 1 1 1 0 0 0 0 0 0 0 0 0 0	third time lucky	figurative	identical	ADJ NOUN NOUN PROPN PROPN VERB ADV PART VERB PRON ADJ NOUN ADJ ADV PRON VERB ADP DET PROPN NOUN NOUN ADJ NOUN	▁BRIT ISH ▁feather weight ▁champion ▁Sea n ▁Mur phy ▁is ▁out ▁to ▁make ▁it ▁third ▁time ▁luck y ▁when ▁he ▁challenges ▁for ▁the ▁W BO ▁world ▁title ▁next ▁month .	0 0 0 0 0 0 0 0 0 0 0 0 0 0 1 1 1 1 0 0 0 0 0 0 0 0 0 0 0 0	ADJ ADJ NOUN NOUN NOUN PROPN PROPN PROPN PROPN VERB ADV PART VERB PRON ADJ NOUN ADJ ADJ ADV PRON VERB ADP DET PROPN PROPN NOUN NOUN ADJ NOUN NOUN
Back in January Dallas performed what started off as the demolition and ended up in the annihilation of the Bills ' hopes of making it third time lucky at Superbowl.	0 0 0 0 0 0 0 0 0 0 0 0 0 0 0 0 0 0 0 0 0 0 0 0 0 1 1 1 0 0	third time lucky	figurative	identical	ADV ADP PROPN PROPN VERB NOUN VERB PART ADP DET NOUN CCONJ VERB PART ADP DET NOUN ADP DET PROPN PART NOUN ADP VERB PRON ADJ NOUN ADJ ADP PROPN	▁Back ▁in ▁January ▁Dal las ▁performed ▁what ▁started ▁off ▁as ▁the ▁demolition ▁and ▁ended ▁up ▁in ▁the ▁anni hil ation ▁of ▁the ▁Bill s ▁' ▁hopes ▁of ▁making ▁it ▁third ▁time ▁luck y ▁at ▁Super bow l .	0 0 0 0 0 0 0 0 0 0 0 0 0 0 0 0 0 0 0 0 0 0 0 0 0 0 0 0 0 1 1 1 1 0 0 0 0 0	ADV ADP PROPN PROPN PROPN VERB NOUN VERB PART ADP DET NOUN CCONJ VERB PART ADP DET NOUN NOUN NOUN ADP DET PROPN PROPN PART NOUN ADP VERB PRON ADJ NOUN ADJ ADJ ADP PROPN PROPN PROPN PROPN
Third time lucky.	1 1 1	third time lucky	figurative	case	ADJ NOUN ADJ	▁Third ▁time ▁luck y .	1 1 1 1 1	ADJ NOUN ADJ ADJ ADJ
Be third time lucky.	0 1 1 1	third time lucky	figurative	identical	VERB ADJ NOUN ADJ	▁Be ▁third ▁time ▁luck y .	0 1 1 1 1 1	VERB ADJ NOUN ADJ ADJ ADJ
