She had been continually up the spout, or over the moon, about someone or something.	0 0 0 0 1 0 1 0 0 0 0 0 0 0 0	up the spout	figurative	identical	PRON VERB VERB ADV PART DET NOUN CCONJ ADP DET NOUN ADP NOUN CCONJ NOUN
While they went into the firing blackboards to fire your rounds and you, all you was allowed to fire was five five and then you had to wait, take your turn course everybody had got to go in, they 'd got to check them as everybody got had fired their five there weren't one left up the spout like there was before, course it took time see, and it took us a day, I would say a day, to fire five rounds of ammunition.	0 0 0 0 0 0 0 0 0 0 0 0 0 0 0 0 0 0 0 0 0 0 0 0 0 0 0 0 0 0 0 0 0 0 0 0 0 0 0 0 0 0 0 0 0 0 0 0 0 0 0 0 0 0 0 1 0 1 0 0 0 0 0 0 0 0 0 0 0 0 0 0 0 0 0 0 0 0 0 0 0 0 0 0	up the spout	figurative	identical	ADP PRON VERB ADP DET NOUN NOUN PART VERB ADJ NOUN CCONJ PRON DET PRON VERB VERB PART VERB VERB NUM NUM CCONJ ADV PRON VERB PART VERB VERB ADJ NOUN NOUN NOUN VERB VERB PART VERB ADV PRON VERB VERB PART VERB PRON ADP NOUN VERB VERB VERB ADJ NUM ADV VERB NUM VERB PART DET NOUN ADP ADV VERB ADV NOUN PRON VERB NOUN VERB CCONJ PRON VERB PRON DET NOUN PRON VERB VERB DET NOUN PART VERB NUM NOUN ADP NOUN
No insy winsy spider climbing up the spout, in	0 0 0 0 0 1 0 1 0	up the spout	literal	identical	DET DET NOUN NOUN VERB PART DET NOUN ADP
‘ Getting his daughter up the spout.’	0 0 0 0 1 0 1	up the spout	figurative	dashes	PUNCT VERB ADJ NOUN ADP DET NOUN
‘ That bloke must think his petrol consumption is up the spout,’ Gary remarked, looking at the gauge.	0 0 0 0 0 0 0 0 0 1 0 1 0 0 0 0 0 0	up the spout	figurative	dashes	PUNCT DET NOUN VERB VERB ADJ NOUN NOUN VERB ADP DET PROPN PROPN VERB VERB ADP DET NOUN
Yeah but what I 'm saying is that's my week up the spout like, innit?	0 0 0 0 0 0 0 0 0 0 1 0 1 0 0	up the spout	figurative	identical	INTJ CCONJ NOUN PRON VERB VERB VERB DET ADJ NOUN ADP DET NOUN INTJ ADJ
The spider went up the spout is me, down come the rain and out come the sun, all the sun came out in the rain, Insy Winsy spider climbed up again	0 0 0 1 0 1 0 0 0 0 0 0 0 0 0 0 0 0 0 0 0 0 0 0 0 0 0 0 0 0 0	up the spout	literal	identical	DET NOUN VERB PART DET NOUN VERB PRON ADV VERB DET NOUN CCONJ ADV VERB DET NOUN ADJ DET NOUN VERB PART ADP DET NOUN PROPN PROPN NOUN VERB ADV ADV