And as every greyhaired person knows by dint of experience, there is no black and white issue, only grey.	0 0 0 0 0 0 1 1 1 0 0 0 0 0 0 0 0 0 0	by dint of	figurative	identical	CCONJ ADP DET VERB NOUN VERB ADP NOUN ADP NOUN ADV VERB DET ADJ CCONJ ADJ NOUN ADV NOUN	▁And ▁as ▁every ▁grey hair ed ▁person ▁knows ▁by ▁din t ▁of ▁experience , ▁there ▁is ▁no ▁black ▁and ▁white ▁issue , ▁only ▁grey .	0 0 0 0 0 0 0 0 1 1 1 1 0 0 0 0 0 0 0 0 0 0 0 0 0	CCONJ ADP DET VERB VERB VERB NOUN VERB ADP NOUN NOUN ADP NOUN NOUN ADV VERB DET ADJ CCONJ ADJ NOUN NOUN ADV NOUN NOUN
By dint of merit, I 'll the Lawrel snatch ; I 'll not for it's reversion tamely Watch.	1 1 1 0 0 0 0 0 0 0 0 0 0 0 0 0 0 0	by dint of	figurative	case	ADP NOUN ADP NOUN PRON VERB DET PROPN VERB PUNCT PRON VERB ADV ADP PRON NOUN ADV VERB	▁By ▁din t ▁of ▁merit , ▁I ▁' ll ▁the ▁Law rel ▁s na tch ▁ ; ▁I ▁' ll ▁not ▁for ▁it ' s ▁re version ▁t ame ly ▁Watch .	1 1 1 1 0 0 0 0 0 0 0 0 0 0 0 0 0 0 0 0 0 0 0 0 0 0 0 0 0 0 0 0	ADP NOUN NOUN ADP NOUN NOUN PRON VERB VERB DET PROPN PROPN VERB VERB VERB PUNCT PUNCT PRON VERB VERB ADV ADP PRON PRON PRON NOUN NOUN ADV ADV ADV VERB VERB
This they have managed by dint of an almost wilful maintaining of standards ( or refusing to accept reality, depending on your point of view ).	0 0 0 0 1 1 1 0 0 0 0 0 0 0 0 0 0 0 0 0 0 0 0 0 0 0	by dint of	figurative	identical	DET PRON VERB VERB ADP NOUN ADP DET ADV ADJ NOUN ADP NOUN PUNCT CCONJ VERB PART VERB NOUN VERB ADP ADJ NOUN ADP NOUN PUNCT	▁This ▁they ▁have ▁managed ▁by ▁din t ▁of ▁an ▁almost ▁wilful ▁maintaining ▁of ▁standards ▁( ▁or ▁refus ing ▁to ▁accept ▁reality , ▁depending ▁on ▁your ▁point ▁of ▁view ▁ ).	0 0 0 0 1 1 1 1 0 0 0 0 0 0 0 0 0 0 0 0 0 0 0 0 0 0 0 0 0 0	DET PRON VERB VERB ADP NOUN NOUN ADP DET ADV ADJ NOUN ADP NOUN PUNCT CCONJ VERB VERB PART VERB NOUN NOUN VERB ADP ADJ NOUN ADP NOUN PUNCT PUNCT
Clinical need is as yet unquantifiable, but in time, by dint of hard thought, hard work and, maybe, with the help of computer Expert Systems it can surely be made measurable.	0 0 0 0 0 0 0 0 0 1 1 1 0 0 0 0 0 0 0 0 0 0 0 0 0 0 0 0 0 0 0	by dint of	figurative	identical	ADJ NOUN VERB ADV ADV ADJ CCONJ ADP NOUN ADP NOUN ADP ADJ VERB ADJ NOUN CCONJ ADV ADP DET NOUN ADP NOUN PROPN PROPN PRON VERB ADV VERB VERB ADJ	▁Clinical ▁need ▁is ▁as ▁yet ▁un quant ifi able , ▁but ▁in ▁time , ▁by ▁din t ▁of ▁hard ▁thought , ▁hard ▁work ▁and , ▁maybe , ▁with ▁the ▁help ▁of ▁computer ▁Expert ▁Systems ▁it ▁can ▁surely ▁be ▁made ▁measurable .	0 0 0 0 0 0 0 0 0 0 0 0 0 0 1 1 1 1 0 0 0 0 0 0 0 0 0 0 0 0 0 0 0 0 0 0 0 0 0 0 0	ADJ NOUN VERB ADV ADV ADJ ADJ ADJ ADJ ADJ CCONJ ADP NOUN NOUN ADP NOUN NOUN ADP ADJ VERB VERB ADJ NOUN CCONJ CCONJ ADV ADV ADP DET NOUN ADP NOUN PROPN PROPN PRON VERB ADV VERB VERB ADJ ADJ
An Indian federation would continue part of a transformed Empire by dint of becoming a self - governed nation.	0 0 0 0 0 0 0 0 0 0 1 1 1 0 0 0 0 0 0	by dint of	figurative	identical	DET ADJ NOUN VERB VERB NOUN ADP DET VERB NOUN ADP NOUN ADP VERB DET NOUN PUNCT VERB NOUN	▁An ▁Indian ▁federation ▁would ▁continue ▁part ▁of ▁a ▁transformed ▁Em pir e ▁by ▁din t ▁of ▁becoming ▁a ▁self ▁- ▁governed ▁nation .	0 0 0 0 0 0 0 0 0 0 0 0 1 1 1 1 0 0 0 0 0 0 0	DET ADJ NOUN VERB VERB NOUN ADP DET VERB NOUN NOUN NOUN ADP NOUN NOUN ADP VERB DET NOUN PUNCT VERB NOUN NOUN
The accepted wisdom that bulk car manufacturers buy exclusive marques ( Chrysler and Lamborghini, et cetera in the hope of garnering reflected glory is misplaced : any benefit that might accrue to the Escort by dint of its coming from the same stable as the Virage would be heavily outweighed by the damage done to the Virage by the Escort.	0 0 0 0 0 0 0 0 0 0 0 0 0 0 0 0 0 0 0 0 0 0 0 0 0 0 0 0 0 0 0 0 0 0 1 1 1 0 0 0 0 0 0 0 0 0 0 0 0 0 0 0 0 0 0 0 0 0 0 0	by dint of	figurative	identical	DET VERB NOUN ADP ADJ NOUN NOUN VERB ADJ NOUN PUNCT PROPN CCONJ PROPN NOUN NOUN ADP DET NOUN ADP VERB VERB NOUN VERB VERB PUNCT DET NOUN ADJ VERB VERB ADP DET PROPN ADP NOUN ADP ADJ VERB ADP DET ADJ NOUN ADP DET PROPN VERB VERB ADV VERB ADP DET NOUN VERB ADP DET PROPN ADP DET PROPN	▁The ▁accepted ▁wisdom ▁that ▁bulk ▁car ▁manufacturers ▁buy ▁exclusive ▁mar ques ▁( ▁Chr ys ler ▁and ▁Lamb or gh ini , ▁et ▁cet era ▁in ▁the ▁hope ▁of ▁gar ner ing ▁reflected ▁glory ▁is ▁mis place d ▁ : ▁any ▁benefit ▁that ▁might ▁accrue ▁to ▁the ▁E s cor t ▁by ▁din t ▁of ▁its ▁coming ▁from ▁the ▁same ▁stable ▁as ▁the ▁Vira ge ▁would ▁be ▁heavily ▁outweigh ed ▁by ▁the ▁damage ▁done ▁to ▁the ▁Vira ge ▁by ▁the ▁E s cor t .	0 0 0 0 0 0 0 0 0 0 0 0 0 0 0 0 0 0 0 0 0 0 0 0 0 0 0 0 0 0 0 0 0 0 0 0 0 0 0 0 0 0 0 0 0 0 0 0 0 0 1 1 1 1 0 0 0 0 0 0 0 0 0 0 0 0 0 0 0 0 0 0 0 0 0 0 0 0 0 0 0 0 0 0	DET VERB NOUN ADP ADJ NOUN NOUN VERB ADJ NOUN NOUN PUNCT PROPN PROPN PROPN CCONJ PROPN PROPN PROPN PROPN PROPN NOUN NOUN NOUN ADP DET NOUN ADP VERB VERB VERB VERB NOUN VERB VERB VERB VERB PUNCT PUNCT DET NOUN ADJ VERB VERB ADP DET PROPN PROPN PROPN PROPN ADP NOUN NOUN ADP ADJ VERB ADP DET ADJ NOUN ADP DET PROPN PROPN VERB VERB ADV VERB VERB ADP DET NOUN VERB ADP DET PROPN PROPN ADP DET PROPN PROPN PROPN PROPN PROPN
The drama was not quite over because all three players managed to hit the last green in two shots, and Harley, by dint of a nice kick forward when the ball pitched, was no more than six feet from the hole.	0 0 0 0 0 0 0 0 0 0 0 0 0 0 0 0 0 0 0 0 0 1 1 1 0 0 0 0 0 0 0 0 0 0 0 0 0 0 0 0 0	by dint of	figurative	identical	DET NOUN VERB ADV ADV ADV ADP DET NUM NOUN VERB PART VERB DET ADJ NOUN ADP NUM NOUN CCONJ PROPN ADP NOUN ADP DET ADJ NOUN ADV ADV DET NOUN VERB VERB DET ADJ ADP NUM NOUN ADP DET NOUN	▁The ▁drama ▁was ▁not ▁quite ▁over ▁because ▁all ▁three ▁players ▁managed ▁to ▁hit ▁the ▁last ▁green ▁in ▁two ▁shot s , ▁and ▁Har ley , ▁by ▁din t ▁of ▁a ▁nice ▁kick ▁forward ▁when ▁the ▁ball ▁pitch ed , ▁was ▁no ▁more ▁than ▁six ▁feet ▁from ▁the ▁hole .	0 0 0 0 0 0 0 0 0 0 0 0 0 0 0 0 0 0 0 0 0 0 0 0 0 1 1 1 1 0 0 0 0 0 0 0 0 0 0 0 0 0 0 0 0 0 0 0 0	DET NOUN VERB ADV ADV ADV ADP DET NUM NOUN VERB PART VERB DET ADJ NOUN ADP NUM NOUN NOUN NOUN CCONJ PROPN PROPN PROPN ADP NOUN NOUN ADP DET ADJ NOUN ADV ADV DET NOUN VERB VERB VERB VERB DET ADJ ADP NUM NOUN ADP DET NOUN NOUN
By dint of demanding £ 25,000 deposits up front, AML's order - book has not been hit by the ' 90s recession or the Gulf War ( some 30 % of Aston Martins go to Arabic buyers ), but some more permanent answer is clearly needed.	1 1 1 0 0 0 0 0 0 0 0 0 0 0 0 0 0 0 0 0 0 0 0 0 0 0 0 0 0 0 0 0 0 0 0 0 0 0 0 0 0 0 0 0 0 0	by dint of	figurative	case	ADP NOUN ADP VERB SYM NUM NOUN ADV ADV PROPN NOUN PUNCT NOUN VERB ADV VERB VERB ADP DET PUNCT NOUN NOUN CCONJ DET PROPN PROPN PUNCT DET NUM NOUN ADP PROPN PROPN VERB ADP ADJ NOUN PUNCT CCONJ DET ADV ADJ NOUN VERB ADV VERB	▁By ▁din t ▁of ▁demanding ▁£ ▁2 5,000 ▁deposits ▁up ▁front , ▁A ML ' s ▁order ▁- ▁book ▁has ▁not ▁been ▁hit ▁by ▁the ▁' ▁90 s ▁recession ▁or ▁the ▁Gulf ▁War ▁( ▁some ▁30 ▁% ▁of ▁As ton ▁Martin s ▁go ▁to ▁Arab ic ▁buyers ▁ ), ▁but ▁some ▁more ▁permanent ▁answer ▁is ▁clearly ▁needed .	1 1 1 1 0 0 0 0 0 0 0 0 0 0 0 0 0 0 0 0 0 0 0 0 0 0 0 0 0 0 0 0 0 0 0 0 0 0 0 0 0 0 0 0 0 0 0 0 0 0 0 0 0 0 0 0 0 0	ADP NOUN NOUN ADP VERB SYM NUM NUM NOUN ADV ADV ADV PROPN PROPN PROPN PROPN NOUN PUNCT NOUN VERB ADV VERB VERB ADP DET PUNCT NOUN NOUN NOUN CCONJ DET PROPN PROPN PUNCT DET NUM NOUN ADP PROPN PROPN PROPN PROPN VERB ADP ADJ ADJ NOUN PUNCT PUNCT CCONJ DET ADV ADJ NOUN VERB ADV VERB VERB
It was run by a couple of brothers who had started with one large pub in North London and had built the company, by dint of aggressive take - over tactics and shrewd property dealing, to a sizeable enterprise with a turnover of nearly forty million pounds.	0 0 0 0 0 0 0 0 0 0 0 0 0 0 0 0 0 0 0 0 0 0 0 1 1 1 0 0 0 0 0 0 0 0 0 0 0 0 0 0 0 0 0 0 0 0 0	by dint of	figurative	identical	PRON VERB VERB ADP DET NOUN ADP NOUN NOUN VERB VERB ADP NUM ADJ NOUN ADP PROPN PROPN CCONJ VERB VERB DET NOUN ADP NOUN ADP ADJ VERB PUNCT PART NOUN CCONJ ADJ NOUN NOUN ADP DET ADJ NOUN ADP DET NOUN ADP ADV NUM NUM NOUN	▁It ▁was ▁run ▁by ▁a ▁couple ▁of ▁brothers ▁who ▁had ▁started ▁with ▁one ▁large ▁pub ▁in ▁North ▁London ▁and ▁had ▁built ▁the ▁company , ▁by ▁din t ▁of ▁aggressive ▁take ▁- ▁over ▁tactic s ▁and ▁sh rew d ▁property ▁dealing , ▁to ▁a ▁sizeable ▁enterprise ▁with ▁a ▁turnover ▁of ▁nearly ▁forty ▁million ▁pounds .	0 0 0 0 0 0 0 0 0 0 0 0 0 0 0 0 0 0 0 0 0 0 0 0 1 1 1 1 0 0 0 0 0 0 0 0 0 0 0 0 0 0 0 0 0 0 0 0 0 0 0 0 0 0	PRON VERB VERB ADP DET NOUN ADP NOUN NOUN VERB VERB ADP NUM ADJ NOUN ADP PROPN PROPN CCONJ VERB VERB DET NOUN NOUN ADP NOUN NOUN ADP ADJ VERB PUNCT PART NOUN NOUN CCONJ ADJ ADJ ADJ NOUN NOUN NOUN ADP DET ADJ NOUN ADP DET NOUN ADP ADV NUM NUM NOUN NOUN
In fact it's sometimes said that it's one of the very great privileges of the public is that they can, by dint of writing something, and putting it in an envelope with a stamp on it, get it to arrive on an editor's desk, and have the editor at least give a cursory glance if not a more serious glance at what's going on, so it's a privilege and it's an opportunity in that case.	0 0 0 0 0 0 0 0 0 0 0 0 0 0 0 0 0 0 0 0 1 1 1 0 0 0 0 0 0 0 0 0 0 0 0 0 0 0 0 0 0 0 0 0 0 0 0 0 0 0 0 0 0 0 0 0 0 0 0 0 0 0 0 0 0 0 0 0 0 0 0 0 0 0 0	by dint of	figurative	identical	ADP NOUN PRON ADV VERB ADP PRON NUM ADP DET ADV ADJ NOUN ADP DET NOUN VERB ADP PRON VERB ADP NOUN ADP VERB NOUN CCONJ VERB PRON ADP DET NOUN ADP DET NOUN ADP PRON VERB PRON PART VERB ADP DET NOUN NOUN CCONJ VERB DET NOUN ADP ADJ VERB DET ADJ NOUN ADP ADV DET ADV ADJ NOUN ADP NOUN VERB PART CCONJ PRON DET NOUN CCONJ PRON DET NOUN ADP DET NOUN	▁In ▁fact ▁it ' s ▁sometimes ▁said ▁that ▁it ' s ▁one ▁of ▁the ▁very ▁great ▁privileges ▁of ▁the ▁public ▁is ▁that ▁they ▁can , ▁by ▁din t ▁of ▁writing ▁something , ▁and ▁putting ▁it ▁in ▁an ▁envelope ▁with ▁a ▁stamp ▁on ▁it , ▁get ▁it ▁to ▁arrive ▁on ▁an ▁editor ' s ▁desk , ▁and ▁have ▁the ▁editor ▁at ▁least ▁give ▁a ▁cur s ory ▁glance ▁if ▁not ▁a ▁more ▁serious ▁glance ▁at ▁what ' s ▁going ▁on , ▁so ▁it ' s ▁a ▁privilege ▁and ▁it ' s ▁an ▁opportunity ▁in ▁that ▁case .	0 0 0 0 0 0 0 0 0 0 0 0 0 0 0 0 0 0 0 0 0 0 0 0 0 1 1 1 1 0 0 0 0 0 0 0 0 0 0 0 0 0 0 0 0 0 0 0 0 0 0 0 0 0 0 0 0 0 0 0 0 0 0 0 0 0 0 0 0 0 0 0 0 0 0 0 0 0 0 0 0 0 0 0 0 0 0 0 0 0 0 0 0 0 0 0	ADP NOUN PRON PRON PRON ADV VERB ADP PRON PRON PRON NUM ADP DET ADV ADJ NOUN ADP DET NOUN VERB ADP PRON VERB VERB ADP NOUN NOUN ADP VERB NOUN NOUN CCONJ VERB PRON ADP DET NOUN ADP DET NOUN ADP PRON PRON VERB PRON PART VERB ADP DET NOUN NOUN NOUN NOUN NOUN CCONJ VERB DET NOUN ADP ADJ VERB DET ADJ ADJ ADJ NOUN ADP ADV DET ADV ADJ NOUN ADP NOUN NOUN NOUN VERB PART PART CCONJ PRON PRON PRON DET NOUN CCONJ PRON PRON PRON DET NOUN ADP DET NOUN NOUN
The 1824 Act repealing the Combination Laws had, as politicians and trade unionists were very well aware, been " smuggled through " the House by Place and the Radical MP Joseph Hume by dint of persistent lobbying and political manipulation.	0 0 0 0 0 0 0 0 0 0 0 0 0 0 0 0 0 0 0 0 0 0 0 0 0 0 0 0 0 0 0 0 1 1 1 0 0 0 0 0	by dint of	figurative	identical	DET NUM PROPN VERB DET PROPN PROPN VERB ADP NOUN CCONJ NOUN NOUN VERB ADV ADV ADJ VERB PUNCT VERB ADP PUNCT DET PROPN ADP PROPN CCONJ DET PROPN PROPN PROPN PROPN ADP NOUN ADP ADJ NOUN CCONJ ADJ NOUN	▁The ▁18 24 ▁Act ▁repeal ing ▁the ▁Combination ▁Law s ▁had , ▁as ▁politician s ▁and ▁trade ▁union ists ▁were ▁very ▁well ▁aware , ▁been ▁" ▁smuggl ed ▁through ▁" ▁the ▁House ▁by ▁Place ▁and ▁the ▁Radical ▁MP ▁Joseph ▁Hume ▁by ▁din t ▁of ▁persistent ▁lobb ying ▁and ▁political ▁manipulation .	0 0 0 0 0 0 0 0 0 0 0 0 0 0 0 0 0 0 0 0 0 0 0 0 0 0 0 0 0 0 0 0 0 0 0 0 0 0 0 0 1 1 1 1 0 0 0 0 0 0 0	DET NUM NUM PROPN VERB VERB DET PROPN PROPN PROPN VERB VERB ADP NOUN NOUN CCONJ NOUN NOUN NOUN VERB ADV ADV ADJ ADJ VERB PUNCT VERB VERB ADP PUNCT DET PROPN ADP PROPN CCONJ DET PROPN PROPN PROPN PROPN ADP NOUN NOUN ADP ADJ NOUN NOUN CCONJ ADJ NOUN NOUN
NT he considers a ported proprietary environment, but it will, by dint of its use of OSF's Distributed Computing Environment ‘ accelerate the take - up of open systems,’ he believes.	0 0 0 0 0 0 0 0 0 0 1 1 1 0 0 0 0 0 0 0 0 0 0 0 0 0 0 0 0 0 0	by dint of	figurative	identical	PROPN PRON VERB DET ADJ ADJ NOUN CCONJ PRON VERB ADP NOUN ADP ADJ NOUN ADP PROPN PROPN PROPN PROPN PUNCT VERB DET VERB PUNCT NOUN ADP ADJ NOUN PRON VERB	▁NT ▁he ▁considers ▁a ▁port ed ▁proprietary ▁environment , ▁but ▁it ▁will , ▁by ▁din t ▁of ▁its ▁use ▁of ▁O SF ' s ▁Dis tribu ted ▁Com put ing ▁Environment ▁ ‘ ▁accelerate ▁the ▁take ▁- ▁up ▁of ▁open ▁systems , ’ ▁he ▁believes .	0 0 0 0 0 0 0 0 0 0 0 0 0 1 1 1 1 0 0 0 0 0 0 0 0 0 0 0 0 0 0 0 0 0 0 0 0 0 0 0 0 0 0 0 0 0	PROPN PRON VERB DET ADJ ADJ ADJ NOUN NOUN CCONJ PRON VERB VERB ADP NOUN NOUN ADP ADJ NOUN ADP PROPN PROPN PROPN PROPN PROPN PROPN PROPN PROPN PROPN PROPN PROPN PUNCT PUNCT VERB DET VERB PUNCT NOUN ADP ADJ NOUN NOUN NOUN PRON VERB VERB
There was an outbreak of infection with this organism in Liverpool in 1976, which was thankfully controlled by dint of exhaustive contact - tracing, and there have only been sporadic single cases since then, mostly imported from abroad.	0 0 0 0 0 0 0 0 0 0 0 0 0 0 0 0 0 1 1 1 0 0 0 0 0 0 0 0 0 0 0 0 0 0 0 0 0 0	by dint of	figurative	identical	ADV VERB DET NOUN ADP NOUN ADP DET NOUN ADP PROPN ADP NUM ADJ VERB ADV VERB ADP NOUN ADP ADJ NOUN PUNCT VERB CCONJ ADV VERB ADV VERB ADJ ADJ NOUN ADP ADV ADV VERB ADP ADV	▁There ▁was ▁an ▁outbreak ▁of ▁infection ▁with ▁this ▁organism ▁in ▁Liverpool ▁in ▁1976, ▁which ▁was ▁thank fully ▁controlled ▁by ▁din t ▁of ▁exhaustive ▁contact ▁- ▁tracing , ▁and ▁there ▁have ▁only ▁been ▁sp or a dic ▁single ▁cases ▁since ▁then , ▁most ly ▁imported ▁from ▁abroad .	0 0 0 0 0 0 0 0 0 0 0 0 0 0 0 0 0 0 1 1 1 1 0 0 0 0 0 0 0 0 0 0 0 0 0 0 0 0 0 0 0 0 0 0 0 0 0	ADV VERB DET NOUN ADP NOUN ADP DET NOUN ADP PROPN ADP NUM ADJ VERB ADV ADV VERB ADP NOUN NOUN ADP ADJ NOUN PUNCT VERB VERB CCONJ ADV VERB ADV VERB ADJ ADJ ADJ ADJ ADJ NOUN ADP ADV ADV ADV ADV VERB ADP ADV ADV
It would work, I explained to him — and it is a demonstration of how something that is essentially simple can on that account have a firmer structure than a more complicated mechanism — by dint of borrowing from the banks a sufficient sum of money for the initial purchase.	0 0 0 0 0 0 0 0 0 0 0 0 0 0 0 0 0 0 0 0 0 0 0 0 0 0 0 0 0 0 0 0 0 0 1 1 1 0 0 0 0 0 0 0 0 0 0 0 0 0	by dint of	figurative	identical	PRON VERB VERB PRON VERB ADP PRON PUNCT CCONJ PRON VERB DET NOUN ADP ADV NOUN ADJ VERB ADV ADJ VERB ADP DET NOUN VERB DET ADJ NOUN ADP DET ADV ADJ NOUN PUNCT ADP NOUN ADP NOUN ADP DET NOUN DET ADJ NOUN ADP NOUN ADP DET ADJ NOUN	▁It ▁would ▁work , ▁I ▁explained ▁to ▁him ▁ — ▁and ▁it ▁is ▁a ▁demonstration ▁of ▁how ▁something ▁that ▁is ▁essentially ▁simple ▁can ▁on ▁that ▁account ▁have ▁a ▁firm er ▁structure ▁than ▁a ▁more ▁complicated ▁mechanism ▁ — ▁by ▁din t ▁of ▁borrowing ▁from ▁the ▁banks ▁a ▁sufficient ▁sum ▁of ▁money ▁for ▁the ▁initial ▁purchase .	0 0 0 0 0 0 0 0 0 0 0 0 0 0 0 0 0 0 0 0 0 0 0 0 0 0 0 0 0 0 0 0 0 0 0 0 0 0 1 1 1 1 0 0 0 0 0 0 0 0 0 0 0 0 0 0	PRON VERB VERB VERB PRON VERB ADP PRON PUNCT PUNCT CCONJ PRON VERB DET NOUN ADP ADV NOUN ADJ VERB ADV ADJ VERB ADP DET NOUN VERB DET ADJ ADJ NOUN ADP DET ADV ADJ NOUN PUNCT PUNCT ADP NOUN NOUN ADP NOUN ADP DET NOUN DET ADJ NOUN ADP NOUN ADP DET ADJ NOUN NOUN
Set against these deficiencies is the fact that psychiatry — if only by dint of the accumulated experience that comes from having to observe the more unusual among us — has developed a ‘ language of symptoms’ that can prove useful in throwing the features of that deviance into high relief.	0 0 0 0 0 0 0 0 0 0 0 0 1 1 1 0 0 0 0 0 0 0 0 0 0 0 0 0 0 0 0 0 0 0 0 0 0 0 0 0 0 0 0 0 0 0 0 0 0 0 0	by dint of	figurative	identical	VERB ADP DET NOUN VERB DET NOUN ADP NOUN PUNCT ADP ADV ADP NOUN ADP DET VERB NOUN ADJ VERB ADP VERB PART VERB DET ADV ADJ ADP PRON PUNCT VERB VERB DET ADJ NOUN ADP NOUN ADJ VERB VERB ADJ ADP VERB DET NOUN ADP DET NOUN ADP ADJ NOUN	▁Set ▁against ▁these ▁deficiencies ▁is ▁the ▁fact ▁that ▁p s ych ia try ▁ — ▁if ▁only ▁by ▁din t ▁of ▁the ▁accumulated ▁experience ▁that ▁comes ▁from ▁having ▁to ▁observe ▁the ▁more ▁unusual ▁among ▁us ▁ — ▁has ▁developed ▁a ▁ ‘ ▁language ▁of ▁symptoms ’ ▁that ▁can ▁prove ▁useful ▁in ▁throw ing ▁the ▁features ▁of ▁that ▁de vian ce ▁into ▁high ▁relief .	0 0 0 0 0 0 0 0 0 0 0 0 0 0 0 0 0 1 1 1 1 0 0 0 0 0 0 0 0 0 0 0 0 0 0 0 0 0 0 0 0 0 0 0 0 0 0 0 0 0 0 0 0 0 0 0 0 0 0 0 0 0 0 0	VERB ADP DET NOUN VERB DET NOUN ADP NOUN NOUN NOUN NOUN NOUN PUNCT PUNCT ADP ADV ADP NOUN NOUN ADP DET VERB NOUN ADJ VERB ADP VERB PART VERB DET ADV ADJ ADP PRON PUNCT PUNCT VERB VERB DET ADJ ADJ NOUN ADP NOUN NOUN ADJ VERB VERB ADJ ADP VERB VERB DET NOUN ADP DET NOUN NOUN NOUN ADP ADJ NOUN NOUN
This rapid growth has been achieved by dint of strong and imaginative leadership pushing the firm into new areas, reflecting an almost evangelical aim to break down the old - boy network and cut out the dead wood from British industry.	0 0 0 0 0 0 1 1 1 0 0 0 0 0 0 0 0 0 0 0 0 0 0 0 0 0 0 0 0 0 0 0 0 0 0 0 0 0 0 0 0	by dint of	figurative	identical	DET ADJ NOUN VERB VERB VERB ADP NOUN ADP ADJ CCONJ ADJ NOUN VERB DET NOUN ADP ADJ NOUN VERB DET ADV ADJ NOUN PART VERB PART DET ADJ PUNCT NOUN NOUN CCONJ VERB PART DET ADJ NOUN ADP ADJ NOUN	▁This ▁rapid ▁growth ▁has ▁been ▁achieved ▁by ▁din t ▁of ▁strong ▁and ▁imaginati ve ▁leadership ▁pushing ▁the ▁firm ▁into ▁new ▁areas , ▁reflecting ▁an ▁almost ▁e van gel ical ▁aim ▁to ▁break ▁down ▁the ▁old ▁- ▁boy ▁network ▁and ▁cut ▁out ▁the ▁dead ▁wood ▁from ▁British ▁industry .	0 0 0 0 0 0 1 1 1 1 0 0 0 0 0 0 0 0 0 0 0 0 0 0 0 0 0 0 0 0 0 0 0 0 0 0 0 0 0 0 0 0 0 0 0 0 0 0	DET ADJ NOUN VERB VERB VERB ADP NOUN NOUN ADP ADJ CCONJ ADJ ADJ NOUN VERB DET NOUN ADP ADJ NOUN NOUN VERB DET ADV ADJ ADJ ADJ ADJ NOUN PART VERB PART DET ADJ PUNCT NOUN NOUN CCONJ VERB PART DET ADJ NOUN ADP ADJ NOUN NOUN
Slow to make friends and disappointing academically, Marjorie had developed a perverse popularity by dint of an enterprise nicknamed ‘ rent - a - beating’ by her classmates.	0 0 0 0 0 0 0 0 0 0 0 0 0 1 1 1 0 0 0 0 0 0 0 0 0 0 0 0	by dint of	figurative	identical	ADJ PART VERB NOUN CCONJ ADJ ADV PROPN VERB VERB DET ADJ NOUN ADP NOUN ADP DET NOUN VERB PUNCT NOUN PUNCT DET PUNCT NOUN ADP ADJ NOUN	▁S low ▁to ▁make ▁friends ▁and ▁disappointing ▁academic ally , ▁Mar jo rie ▁had ▁developed ▁a ▁per verse ▁popular ity ▁by ▁din t ▁of ▁an ▁enterprise ▁n ick name d ▁ ‘ ▁rent ▁- ▁a ▁- ▁be ating ’ ▁by ▁her ▁class mate s .	0 0 0 0 0 0 0 0 0 0 0 0 0 0 0 0 0 0 0 0 1 1 1 1 0 0 0 0 0 0 0 0 0 0 0 0 0 0 0 0 0 0 0 0 0	ADJ ADJ PART VERB NOUN CCONJ ADJ ADV ADV ADV PROPN PROPN PROPN VERB VERB DET ADJ ADJ NOUN NOUN ADP NOUN NOUN ADP DET NOUN VERB VERB VERB VERB PUNCT PUNCT NOUN PUNCT DET PUNCT NOUN NOUN NOUN ADP ADJ NOUN NOUN NOUN NOUN
By dint of a couple of birdies and a fortunate eagle on the long fourteenth hole, Jack was looking good for a share of the prize money.	1 1 1 0 0 0 0 0 0 0 0 0 0 0 0 0 0 0 0 0 0 0 0 0 0 0 0	by dint of	figurative	case	ADP NOUN ADP DET NOUN ADP NOUN CCONJ DET ADJ NOUN ADP DET ADJ ADJ NOUN PROPN VERB VERB ADJ ADP DET NOUN ADP DET NOUN NOUN	▁By ▁din t ▁of ▁a ▁couple ▁of ▁bird ies ▁and ▁a ▁fortunate ▁e a gle ▁on ▁the ▁long ▁fourteen th ▁hole , ▁Jack ▁was ▁looking ▁good ▁for ▁a ▁share ▁of ▁the ▁prize ▁money .	1 1 1 1 0 0 0 0 0 0 0 0 0 0 0 0 0 0 0 0 0 0 0 0 0 0 0 0 0 0 0 0 0 0	ADP NOUN NOUN ADP DET NOUN ADP NOUN NOUN CCONJ DET ADJ NOUN NOUN NOUN ADP DET ADJ ADJ ADJ NOUN NOUN PROPN VERB VERB ADJ ADP DET NOUN ADP DET NOUN NOUN NOUN
He succeeded by dint of the radical policy of booking bands that were vaguely contemporary, at least moderately interesting and which common sense along suggested would pull a respectable crowd.	0 0 1 1 1 0 0 0 0 0 0 0 0 0 0 0 0 0 0 0 0 0 0 0 0 0 0 0 0 0	by dint of	figurative	identical	PRON VERB ADP NOUN ADP DET ADJ NOUN ADP VERB NOUN ADJ VERB ADV ADJ ADP ADV ADV ADJ CCONJ ADJ ADJ NOUN ADP VERB VERB VERB DET ADJ NOUN	▁He ▁succeeded ▁by ▁din t ▁of ▁the ▁radical ▁policy ▁of ▁booking ▁bands ▁that ▁were ▁vague ly ▁con temporary , ▁at ▁least ▁moderately ▁interesting ▁and ▁which ▁common ▁sense ▁along ▁suggested ▁would ▁pull ▁a ▁respect able ▁crowd .	0 0 1 1 1 1 0 0 0 0 0 0 0 0 0 0 0 0 0 0 0 0 0 0 0 0 0 0 0 0 0 0 0 0 0 0	PRON VERB ADP NOUN NOUN ADP DET ADJ NOUN ADP VERB NOUN ADJ VERB ADV ADV ADJ ADJ ADJ ADP ADV ADV ADJ CCONJ ADJ ADJ NOUN ADP VERB VERB VERB DET ADJ ADJ NOUN NOUN
The enthusiasm of official propaganda derived partly from the triumphalism inherent in a regime which had come into being by dint of a military victory, and partly from the need to conceal, or divert attention away from domestic problems.	0 0 0 0 0 0 0 0 0 0 0 0 0 0 0 0 0 0 0 1 1 1 0 0 0 0 0 0 0 0 0 0 0 0 0 0 0 0 0	by dint of	figurative	identical	DET NOUN ADP ADJ NOUN VERB ADV ADP DET NOUN ADJ ADP DET NOUN ADJ VERB VERB ADP VERB ADP NOUN ADP DET ADJ NOUN CCONJ ADV ADP DET NOUN PART VERB CCONJ VERB NOUN ADV ADP ADJ NOUN	▁The ▁enthusiasm ▁of ▁official ▁propaganda ▁derived ▁partly ▁from ▁the ▁triumph alism ▁inherent ▁in ▁a ▁regime ▁which ▁had ▁come ▁into ▁being ▁by ▁din t ▁of ▁a ▁military ▁victory , ▁and ▁partly ▁from ▁the ▁need ▁to ▁conceal , ▁or ▁divert ▁attention ▁away ▁from ▁domestic ▁problems .	0 0 0 0 0 0 0 0 0 0 0 0 0 0 0 0 0 0 0 0 1 1 1 1 0 0 0 0 0 0 0 0 0 0 0 0 0 0 0 0 0 0 0 0	DET NOUN ADP ADJ NOUN VERB ADV ADP DET NOUN NOUN ADJ ADP DET NOUN ADJ VERB VERB ADP VERB ADP NOUN NOUN ADP DET ADJ NOUN NOUN CCONJ ADV ADP DET NOUN PART VERB VERB CCONJ VERB NOUN ADV ADP ADJ NOUN NOUN
On this particular day Blind Io, by dint of constant vigilance the chief of the gods, sat with his chin on his hand and looked at the gaming board on the red marble table in front of him.	0 0 0 0 0 0 1 1 1 0 0 0 0 0 0 0 0 0 0 0 0 0 0 0 0 0 0 0 0 0 0 0 0 0 0 0 0 0	by dint of	figurative	identical	ADP DET ADJ NOUN PROPN PROPN ADP NOUN ADP ADJ NOUN DET NOUN ADP DET NOUN VERB ADP ADJ NOUN ADP ADJ NOUN CCONJ VERB ADP DET NOUN NOUN ADP DET ADJ NOUN NOUN ADP NOUN ADP PRON	▁On ▁this ▁particular ▁day ▁B lin d ▁I o , ▁by ▁din t ▁of ▁constant ▁vigilance ▁the ▁chief ▁of ▁the ▁gods , ▁sat ▁with ▁his ▁ chin ▁on ▁his ▁hand ▁and ▁looked ▁at ▁the ▁g am ing ▁board ▁on ▁the ▁red ▁marble ▁table ▁in ▁front ▁of ▁him .	0 0 0 0 0 0 0 0 0 0 1 1 1 1 0 0 0 0 0 0 0 0 0 0 0 0 0 0 0 0 0 0 0 0 0 0 0 0 0 0 0 0 0 0 0 0 0 0	ADP DET ADJ NOUN PROPN PROPN PROPN PROPN PROPN PROPN ADP NOUN NOUN ADP ADJ NOUN DET NOUN ADP DET NOUN NOUN VERB ADP ADJ NOUN NOUN ADP ADJ NOUN CCONJ VERB ADP DET NOUN NOUN NOUN NOUN ADP DET ADJ NOUN NOUN ADP NOUN ADP PRON PRON
He has had a very distinguished career and by dint of old - fashioned virtues and a marvellously warm personality has held the Party together on many occasions.	0 0 0 0 0 0 0 0 1 1 1 0 0 0 0 0 0 0 0 0 0 0 0 0 0 0 0 0	by dint of	figurative	identical	PRON VERB VERB DET ADV ADJ NOUN CCONJ ADP NOUN ADP ADJ PUNCT ADJ NOUN CCONJ DET ADV ADJ NOUN VERB VERB DET PROPN ADV ADP ADJ NOUN	▁He ▁has ▁had ▁a ▁very ▁distinguished ▁career ▁and ▁by ▁din t ▁of ▁old ▁- ▁fashion ed ▁virtue s ▁and ▁a ▁mar vel l ously ▁warm ▁personality ▁has ▁held ▁the ▁Party ▁together ▁on ▁many ▁occasions .	0 0 0 0 0 0 0 0 1 1 1 1 0 0 0 0 0 0 0 0 0 0 0 0 0 0 0 0 0 0 0 0 0 0 0	PRON VERB VERB DET ADV ADJ NOUN CCONJ ADP NOUN NOUN ADP ADJ PUNCT ADJ ADJ NOUN NOUN CCONJ DET ADV ADV ADV ADV ADJ NOUN VERB VERB DET PROPN ADV ADP ADJ NOUN NOUN
