General Galtieri's release underlines the fact that the Argentine armed forces may have learned nothing and forgotten nothing, but, by dint of constant pressure on Argentina's elected leaders, they have moved closer to their goal of rewriting history with themselves in the role of hero.	0 0 0 0 0 0 0 0 0 0 0 0 0 0 0 0 0 0 0 1 1 1 0 0 0 0 0 0 0 0 0 0 0 0 0 0 0 0 0 0 0 0 0 0 0	by dint of	figurative	identical	PROPN PROPN NOUN VERB DET NOUN ADP DET ADJ ADJ NOUN VERB VERB VERB NOUN CCONJ VERB NOUN CCONJ ADP NOUN ADP ADJ NOUN ADP PROPN VERB NOUN PRON VERB VERB ADV ADP ADJ NOUN ADP VERB NOUN ADP PRON ADP DET NOUN ADP NOUN	▁General ▁Gal tier i ' s ▁release ▁underlines ▁the ▁fact ▁that ▁the ▁Argentine ▁armed ▁forces ▁may ▁have ▁learned ▁nothing ▁and ▁forgotten ▁nothing , ▁but , ▁by ▁din t ▁of ▁constant ▁pressure ▁on ▁Argentina ' s ▁elected ▁leaders , ▁they ▁have ▁moved ▁closer ▁to ▁their ▁goal ▁of ▁re writing ▁history ▁with ▁themselves ▁in ▁the ▁role ▁of ▁her o .	0 0 0 0 0 0 0 0 0 0 0 0 0 0 0 0 0 0 0 0 0 0 0 0 0 1 1 1 1 0 0 0 0 0 0 0 0 0 0 0 0 0 0 0 0 0 0 0 0 0 0 0 0 0 0 0 0 0	PROPN PROPN PROPN PROPN PROPN PROPN NOUN VERB DET NOUN ADP DET ADJ ADJ NOUN VERB VERB VERB NOUN CCONJ VERB NOUN NOUN CCONJ CCONJ ADP NOUN NOUN ADP ADJ NOUN ADP PROPN PROPN PROPN VERB NOUN NOUN PRON VERB VERB ADV ADP ADJ NOUN ADP VERB VERB NOUN ADP PRON ADP DET NOUN ADP NOUN NOUN NOUN
Clerks too tend to be travellers, temporary incomers to the towns where they study or just stay ; they are indigent, and they are shown in the fabliaux to supply their wants, in terms of food, sex and entertainment, by dint of their wits.	0 0 0 0 0 0 0 0 0 0 0 0 0 0 0 0 0 0 0 0 0 0 0 0 0 0 0 0 0 0 0 0 0 0 0 0 0 0 0 1 1 1 0 0	by dint of	figurative	identical	NOUN ADV VERB PART VERB NOUN ADJ NOUN ADP DET NOUN ADV PRON VERB CCONJ ADV VERB PUNCT PRON VERB ADJ CCONJ PRON VERB VERB ADP DET NOUN PART VERB ADJ NOUN ADP NOUN ADP NOUN NOUN CCONJ NOUN ADP NOUN ADP ADJ NOUN	▁Cler ks ▁too ▁tend ▁to ▁be ▁travellers , ▁temporary ▁income rs ▁to ▁the ▁towns ▁where ▁they ▁study ▁or ▁just ▁stay ▁ ; ▁they ▁are ▁in dig ent , ▁and ▁they ▁are ▁shown ▁in ▁the ▁fa b lia ux ▁to ▁supply ▁their ▁wants , ▁in ▁terms ▁of ▁food , ▁sex ▁and ▁entertainment , ▁by ▁din t ▁of ▁their ▁wit s .	0 0 0 0 0 0 0 0 0 0 0 0 0 0 0 0 0 0 0 0 0 0 0 0 0 0 0 0 0 0 0 0 0 0 0 0 0 0 0 0 0 0 0 0 0 0 0 0 0 0 0 0 1 1 1 1 0 0 0 0	NOUN NOUN ADV VERB PART VERB NOUN NOUN ADJ NOUN NOUN ADP DET NOUN ADV PRON VERB CCONJ ADV VERB PUNCT PUNCT PRON VERB ADJ ADJ ADJ ADJ CCONJ PRON VERB VERB ADP DET NOUN NOUN NOUN NOUN PART VERB ADJ NOUN NOUN ADP NOUN ADP NOUN NOUN NOUN CCONJ NOUN NOUN ADP NOUN NOUN ADP ADJ NOUN NOUN NOUN
However, in 1989 things started to go all wrong as she developed a hook in the very week before she went to the English at Burnham and Berrow Much of the season, by her high standards, was bitterly disappointing but, by dint of " plugging away ", she began to rediscover her form during the week of the English Intermediate won by Lora Fairclough.	0 0 0 0 0 0 0 0 0 0 0 0 0 0 0 0 0 0 0 0 0 0 0 0 0 0 0 0 0 0 0 0 0 0 0 0 0 0 0 0 1 1 1 0 0 0 0 0 0 0 0 0 0 0 0 0 0 0 0 0 0 0 0 0	by dint of	figurative	identical	ADV ADP NUM NOUN VERB PART VERB ADV ADJ ADP PRON VERB DET NOUN ADP DET ADJ NOUN ADP PRON VERB ADP DET PROPN ADP PROPN CCONJ PROPN ADJ ADP DET NOUN ADP ADJ ADJ NOUN VERB ADV ADJ CCONJ ADP NOUN ADP PUNCT VERB PART PUNCT PRON VERB PART VERB ADJ NOUN ADP DET NOUN ADP DET PROPN PROPN VERB ADP PROPN PROPN	▁However , ▁in ▁1989 ▁things ▁started ▁to ▁go ▁all ▁wrong ▁as ▁she ▁developed ▁a ▁hook ▁in ▁the ▁very ▁week ▁before ▁she ▁went ▁to ▁the ▁English ▁at ▁Bur n ham ▁and ▁Ber row ▁Much ▁of ▁the ▁season , ▁by ▁her ▁high ▁standards , ▁was ▁bitter ly ▁disappointing ▁but , ▁by ▁din t ▁of ▁" ▁plug g ing ▁away ▁" , ▁she ▁began ▁to ▁re discover ▁her ▁form ▁during ▁the ▁week ▁of ▁the ▁English ▁Intermediate ▁won ▁by ▁Lo ra ▁Fair c lough .	0 0 0 0 0 0 0 0 0 0 0 0 0 0 0 0 0 0 0 0 0 0 0 0 0 0 0 0 0 0 0 0 0 0 0 0 0 0 0 0 0 0 0 0 0 0 0 0 1 1 1 1 0 0 0 0 0 0 0 0 0 0 0 0 0 0 0 0 0 0 0 0 0 0 0 0 0 0 0 0 0	ADV ADV ADP NUM NOUN VERB PART VERB ADV ADJ ADP PRON VERB DET NOUN ADP DET ADJ NOUN ADP PRON VERB ADP DET PROPN ADP PROPN PROPN PROPN CCONJ PROPN PROPN ADJ ADP DET NOUN NOUN ADP ADJ ADJ NOUN NOUN VERB ADV ADV ADJ CCONJ CCONJ ADP NOUN NOUN ADP PUNCT VERB VERB VERB PART PUNCT PUNCT PRON VERB PART VERB VERB ADJ NOUN ADP DET NOUN ADP DET PROPN PROPN VERB ADP PROPN PROPN PROPN PROPN PROPN PROPN
To my surprise, by dint of my putting down the front seat, it fitted inside the car, so the public was spared the probably unusual sight of a coffin on a roof - rack.	0 0 0 1 1 1 0 0 0 0 0 0 0 0 0 0 0 0 0 0 0 0 0 0 0 0 0 0 0 0 0 0 0 0	by dint of	figurative	identical	ADP ADJ NOUN ADP NOUN ADP ADJ VERB PART DET ADJ NOUN PRON VERB ADP DET NOUN CCONJ DET NOUN VERB VERB DET ADV ADJ NOUN ADP DET NOUN ADP DET ADJ PUNCT NOUN	▁To ▁my ▁surprise , ▁by ▁din t ▁of ▁my ▁putting ▁down ▁the ▁front ▁seat , ▁it ▁fitted ▁inside ▁the ▁car , ▁so ▁the ▁public ▁was ▁spare d ▁the ▁probably ▁unusual ▁sight ▁of ▁a ▁c off in ▁on ▁a ▁roof ▁- ▁ rack .	0 0 0 0 1 1 1 1 0 0 0 0 0 0 0 0 0 0 0 0 0 0 0 0 0 0 0 0 0 0 0 0 0 0 0 0 0 0 0 0 0 0 0	ADP ADJ NOUN NOUN ADP NOUN NOUN ADP ADJ VERB PART DET ADJ NOUN NOUN PRON VERB ADP DET NOUN NOUN CCONJ DET NOUN VERB VERB VERB DET ADV ADJ NOUN ADP DET NOUN NOUN NOUN ADP DET ADJ PUNCT NOUN NOUN NOUN
If Russell Reynolds ' position in world headhunting has become assured by its reputation for quality and its elite image, Korn / Ferry's premier standing is maintained by dint of sheer hard work, aggressive marketing and the building of a large volume of business.	0 0 0 0 0 0 0 0 0 0 0 0 0 0 0 0 0 0 0 0 0 0 0 0 0 0 0 1 1 1 0 0 0 0 0 0 0 0 0 0 0 0 0 0	by dint of	figurative	identical	ADP PROPN PROPN PART NOUN ADP NOUN NOUN VERB VERB VERB ADP ADJ NOUN ADP NOUN CCONJ ADJ ADJ NOUN PROPN SYM PROPN NOUN NOUN VERB VERB ADP NOUN ADP ADJ ADJ NOUN ADJ NOUN CCONJ DET NOUN ADP DET ADJ NOUN ADP NOUN	▁If ▁R usse ll ▁Re yn old s ▁' ▁position ▁in ▁world ▁head hun ting ▁has ▁become ▁assured ▁by ▁its ▁reputation ▁for ▁quality ▁and ▁its ▁e lite ▁image , ▁Ko rn ▁/ ▁Ferr y ' s ▁pre m ier ▁standing ▁is ▁maintained ▁by ▁din t ▁of ▁she er ▁hard ▁work , ▁aggressive ▁marketing ▁and ▁the ▁building ▁of ▁a ▁large ▁volume ▁of ▁business .	0 0 0 0 0 0 0 0 0 0 0 0 0 0 0 0 0 0 0 0 0 0 0 0 0 0 0 0 0 0 0 0 0 0 0 0 0 0 0 0 0 0 1 1 1 1 0 0 0 0 0 0 0 0 0 0 0 0 0 0 0 0 0	ADP PROPN PROPN PROPN PROPN PROPN PROPN PROPN PART NOUN ADP NOUN NOUN NOUN NOUN VERB VERB VERB ADP ADJ NOUN ADP NOUN CCONJ ADJ ADJ ADJ NOUN NOUN PROPN PROPN SYM PROPN PROPN PROPN PROPN NOUN NOUN NOUN NOUN VERB VERB ADP NOUN NOUN ADP ADJ ADJ ADJ NOUN NOUN ADJ NOUN CCONJ DET NOUN ADP DET ADJ NOUN ADP NOUN NOUN
By dint of pushing the words back to the beginning of the sentence, there only remained the two of them at the end : Mary, Tom.	1 1 1 0 0 0 0 0 0 0 0 0 0 0 0 0 0 0 0 0 0 0 0 0 0 0	by dint of	figurative	case	ADP NOUN ADP VERB DET NOUN ADV ADP DET NOUN ADP DET NOUN ADV ADV VERB DET NUM ADP PRON ADP DET NOUN PUNCT PROPN PROPN	▁By ▁din t ▁of ▁pushing ▁the ▁words ▁back ▁to ▁the ▁beginning ▁of ▁the ▁sentence , ▁there ▁only ▁remained ▁the ▁two ▁of ▁them ▁at ▁the ▁end ▁ : ▁Mary , ▁Tom .	1 1 1 1 0 0 0 0 0 0 0 0 0 0 0 0 0 0 0 0 0 0 0 0 0 0 0 0 0 0 0	ADP NOUN NOUN ADP VERB DET NOUN ADV ADP DET NOUN ADP DET NOUN NOUN ADV ADV VERB DET NUM ADP PRON ADP DET NOUN PUNCT PUNCT PROPN PROPN PROPN PROPN
An archmage, by dint of great effort and much expenditure of time, might eventually obtain a small staff made from the timber of the sapient peartree.	0 0 1 1 1 0 0 0 0 0 0 0 0 0 0 0 0 0 0 0 0 0 0 0 0 0	by dint of	figurative	identical	DET NOUN ADP NOUN ADP ADJ NOUN CCONJ ADJ NOUN ADP NOUN VERB ADV VERB DET ADJ NOUN VERB ADP DET NOUN ADP DET NOUN ADJ	▁An ▁arch m age , ▁by ▁din t ▁of ▁great ▁effort ▁and ▁much ▁expenditure ▁of ▁time , ▁might ▁eventually ▁obtain ▁a ▁small ▁staff ▁made ▁from ▁the ▁timber ▁of ▁the ▁sa p ient ▁pear tre e .	0 0 0 0 0 1 1 1 1 0 0 0 0 0 0 0 0 0 0 0 0 0 0 0 0 0 0 0 0 0 0 0 0 0 0 0	DET NOUN NOUN NOUN NOUN ADP NOUN NOUN ADP ADJ NOUN CCONJ ADJ NOUN ADP NOUN NOUN VERB ADV VERB DET ADJ NOUN VERB ADP DET NOUN ADP DET NOUN NOUN NOUN ADJ ADJ ADJ ADJ
Only 23 were classified as ‘ habitual offenders’ by dint of having one or more previous convictions of substance.	0 0 0 0 0 0 0 0 1 1 1 0 0 0 0 0 0 0 0	by dint of	figurative	identical	ADV NUM VERB VERB ADP PUNCT ADJ ADV ADP NOUN ADP VERB NUM CCONJ ADJ ADJ NOUN ADP NOUN	▁Only ▁23 ▁were ▁classified ▁as ▁ ‘ ▁habitual ▁of fender s ’ ▁by ▁din t ▁of ▁having ▁one ▁or ▁more ▁previous ▁convictions ▁of ▁substance .	0 0 0 0 0 0 0 0 0 0 0 0 1 1 1 1 0 0 0 0 0 0 0 0 0	ADV NUM VERB VERB ADP PUNCT PUNCT ADJ ADV ADV ADV ADV ADP NOUN NOUN ADP VERB NUM CCONJ ADJ ADJ NOUN ADP NOUN NOUN
Then I launched into the apology, the explanation and finally, by dint of superhuman endeavour, the jokes.	0 0 0 0 0 0 0 0 0 0 1 1 1 0 0 0 0	by dint of	figurative	identical	ADV PRON VERB ADP DET NOUN DET NOUN CCONJ ADV ADP NOUN ADP NOUN NOUN DET NOUN	▁Then ▁I ▁launched ▁into ▁the ▁apolog y , ▁the ▁explanation ▁and ▁finally , ▁by ▁din t ▁of ▁super human ▁endeavour , ▁the ▁joke s .	0 0 0 0 0 0 0 0 0 0 0 0 0 1 1 1 1 0 0 0 0 0 0 0 0	ADV PRON VERB ADP DET NOUN NOUN NOUN DET NOUN CCONJ ADV ADV ADP NOUN NOUN ADP NOUN NOUN NOUN NOUN DET NOUN NOUN NOUN
It was very basic indeed, and only by dint of preparation for the royal visitor did it have any carpeting on the stairs.	0 0 0 0 0 0 0 1 1 1 0 0 0 0 0 0 0 0 0 0 0 0 0	by dint of	figurative	identical	PRON VERB ADV ADJ ADV CCONJ ADV ADP NOUN ADP NOUN ADP DET ADJ NOUN VERB PRON VERB DET NOUN ADP DET NOUN	▁It ▁was ▁very ▁basic ▁indeed , ▁and ▁only ▁by ▁din t ▁of ▁preparation ▁for ▁the ▁royal ▁visit or ▁did ▁it ▁have ▁any ▁carpet ing ▁on ▁the ▁sta ir s .	0 0 0 0 0 0 0 0 1 1 1 1 0 0 0 0 0 0 0 0 0 0 0 0 0 0 0 0 0 0	PRON VERB ADV ADJ ADV ADV CCONJ ADV ADP NOUN NOUN ADP NOUN ADP DET ADJ NOUN NOUN VERB PRON VERB DET NOUN NOUN ADP DET NOUN NOUN NOUN NOUN
Neff built up the firm's business in the USA not by dint of one overwhelming individual personality, as Roche had done for Heidrick and Struggles, but by exemplifying the success of the Spencer Stuart method of problem - solving in management crises across a range of corporate sectors.	0 0 0 0 0 0 0 0 0 0 1 1 1 0 0 0 0 0 0 0 0 0 0 0 0 0 0 0 0 0 0 0 0 0 0 0 0 0 0 0 0 0 0 0 0 0 0 0	by dint of	figurative	identical	PROPN VERB PART DET NOUN NOUN ADP DET PROPN ADV ADP NOUN ADP NUM ADJ ADJ NOUN ADP PROPN VERB VERB ADP PROPN CCONJ PROPN CCONJ ADP VERB DET NOUN ADP DET PROPN PROPN NOUN ADP NOUN PUNCT VERB ADP NOUN NOUN ADP DET NOUN ADP ADJ NOUN	▁Ne ff ▁built ▁up ▁the ▁firm ' s ▁business ▁in ▁the ▁USA ▁not ▁by ▁din t ▁of ▁one ▁overwhelming ▁individual ▁personality , ▁as ▁Roche ▁had ▁done ▁for ▁He id rick ▁and ▁Str ug gle s , ▁but ▁by ▁ex em pl ifying ▁the ▁success ▁of ▁the ▁S pencer ▁S tu art ▁method ▁of ▁problem ▁- ▁solving ▁in ▁management ▁crises ▁across ▁a ▁range ▁of ▁corporate ▁sectors .	0 0 0 0 0 0 0 0 0 0 0 0 0 1 1 1 1 0 0 0 0 0 0 0 0 0 0 0 0 0 0 0 0 0 0 0 0 0 0 0 0 0 0 0 0 0 0 0 0 0 0 0 0 0 0 0 0 0 0 0 0 0 0 0 0 0	PROPN PROPN VERB PART DET NOUN NOUN NOUN NOUN ADP DET PROPN ADV ADP NOUN NOUN ADP NUM ADJ ADJ NOUN NOUN ADP PROPN VERB VERB ADP PROPN PROPN PROPN CCONJ PROPN PROPN PROPN PROPN PROPN CCONJ ADP VERB VERB VERB VERB DET NOUN ADP DET PROPN PROPN PROPN PROPN PROPN NOUN ADP NOUN PUNCT VERB ADP NOUN NOUN ADP DET NOUN ADP ADJ NOUN NOUN
The idea was to give everybody a reasonable chance of answering some questions, not merely by general railway knowledge, but by dint of having supported Society events.	0 0 0 0 0 0 0 0 0 0 0 0 0 0 0 0 0 0 0 0 1 1 1 0 0 0 0	by dint of	figurative	identical	DET NOUN VERB PART VERB NOUN DET ADJ NOUN ADP VERB DET NOUN ADV ADV ADP ADJ NOUN NOUN CCONJ ADP NOUN ADP VERB VERB PROPN NOUN	▁The ▁idea ▁was ▁to ▁give ▁everybody ▁a ▁reasonable ▁chance ▁of ▁answering ▁some ▁questions , ▁not ▁mere ly ▁by ▁general ▁railway ▁knowledge , ▁but ▁by ▁din t ▁of ▁having ▁supported ▁Society ▁events .	0 0 0 0 0 0 0 0 0 0 0 0 0 0 0 0 0 0 0 0 0 0 0 1 1 1 1 0 0 0 0 0	DET NOUN VERB PART VERB NOUN DET ADJ NOUN ADP VERB DET NOUN NOUN ADV ADV ADV ADP ADJ NOUN NOUN NOUN CCONJ ADP NOUN NOUN ADP VERB VERB PROPN NOUN NOUN
Gentlemen : It is with great regret that I see so many students labouring day after day in the Academy, as if they imagined that a liberal art, such as ours, was to be acquired like a mechanical trade, by dint of labour, or I may add the absurdity of supposing that it could be acquired by any means whatever.	0 0 0 0 0 0 0 0 0 0 0 0 0 0 0 0 0 0 0 0 0 0 0 0 0 0 0 0 0 0 0 0 0 0 0 0 0 0 0 1 1 1 0 0 0 0 0 0 0 0 0 0 0 0 0 0 0 0 0 0	by dint of	figurative	identical	NOUN PUNCT PRON VERB ADP ADJ NOUN ADJ PRON VERB ADV ADJ NOUN VERB NOUN ADP NOUN ADP DET PROPN ADP ADP PRON VERB ADP DET ADJ NOUN ADJ ADP PRON VERB PART VERB VERB ADP DET ADJ NOUN ADP NOUN ADP NOUN CCONJ PRON VERB VERB DET NOUN ADP VERB ADP PRON VERB VERB VERB ADP DET NOUN ADJ	▁Gentlemen ▁ : ▁It ▁is ▁with ▁great ▁regret ▁that ▁I ▁see ▁so ▁many ▁students ▁labour ing ▁day ▁after ▁day ▁in ▁the ▁Academy , ▁as ▁if ▁they ▁imagine d ▁that ▁a ▁liberal ▁art , ▁such ▁as ▁our s , ▁was ▁to ▁be ▁acquired ▁like ▁a ▁mechanical ▁trade , ▁by ▁din t ▁of ▁labour , ▁or ▁I ▁may ▁add ▁the ▁absurd ity ▁of ▁sup posing ▁that ▁it ▁could ▁be ▁acquired ▁by ▁any ▁means ▁whatever .	0 0 0 0 0 0 0 0 0 0 0 0 0 0 0 0 0 0 0 0 0 0 0 0 0 0 0 0 0 0 0 0 0 0 0 0 0 0 0 0 0 0 0 0 0 0 0 1 1 1 1 0 0 0 0 0 0 0 0 0 0 0 0 0 0 0 0 0 0 0 0 0 0	NOUN PUNCT PUNCT PRON VERB ADP ADJ NOUN ADJ PRON VERB ADV ADJ NOUN VERB VERB NOUN ADP NOUN ADP DET PROPN PROPN ADP ADP PRON VERB VERB ADP DET ADJ NOUN NOUN ADJ ADP PRON PRON PRON VERB PART VERB VERB ADP DET ADJ NOUN NOUN ADP NOUN NOUN ADP NOUN NOUN CCONJ PRON VERB VERB DET NOUN NOUN ADP VERB VERB ADP PRON VERB VERB VERB ADP DET NOUN ADJ ADJ
By dint of special effort, our Captain had managed to save the honour of the team by recruiting the services of the Baptist Minister's Son, down from university, and securing the participation of Miss Mack's Solicitor.	1 1 1 0 0 0 0 0 0 0 0 0 0 0 0 0 0 0 0 0 0 0 0 0 0 0 0 0 0 0 0 0 0 0 0 0	by dint of	figurative	case	ADP NOUN ADP ADJ NOUN ADJ PROPN VERB VERB PART VERB DET NOUN ADP DET NOUN ADP VERB DET NOUN ADP DET PROPN PROPN PROPN ADV ADP NOUN CCONJ VERB DET NOUN ADP PROPN PROPN PROPN	▁By ▁din t ▁of ▁special ▁effort , ▁our ▁Captain ▁had ▁managed ▁to ▁save ▁the ▁honour ▁of ▁the ▁team ▁by ▁recruiting ▁the ▁services ▁of ▁the ▁Ba pt ist ▁Minister ' s ▁Son , ▁down ▁from ▁university , ▁and ▁securing ▁the ▁participation ▁of ▁Miss ▁M ack ' s ▁So licit or .	1 1 1 1 0 0 0 0 0 0 0 0 0 0 0 0 0 0 0 0 0 0 0 0 0 0 0 0 0 0 0 0 0 0 0 0 0 0 0 0 0 0 0 0 0 0 0 0 0 0	ADP NOUN NOUN ADP ADJ NOUN NOUN ADJ PROPN VERB VERB PART VERB DET NOUN ADP DET NOUN ADP VERB DET NOUN ADP DET PROPN PROPN PROPN PROPN PROPN PROPN PROPN PROPN ADV ADP NOUN NOUN CCONJ VERB DET NOUN ADP PROPN PROPN PROPN PROPN PROPN PROPN PROPN PROPN PROPN
Paris is milling with women in this mould ; women who either, by dint of their own success or that of their husband's, can afford to have a favourite designer.	0 0 0 0 0 0 0 0 0 0 0 0 1 1 1 0 0 0 0 0 0 0 0 0 0 0 0 0 0 0	by dint of	figurative	identical	PROPN VERB VERB ADP NOUN ADP DET NOUN PUNCT NOUN NOUN CCONJ ADP NOUN ADP ADJ ADJ NOUN CCONJ DET ADP ADJ NOUN VERB VERB PART VERB DET ADJ NOUN	▁Paris ▁is ▁milling ▁with ▁women ▁in ▁this ▁mould ▁ ; ▁women ▁who ▁either , ▁by ▁din t ▁of ▁their ▁own ▁success ▁or ▁that ▁of ▁their ▁husband ' s , ▁can ▁afford ▁to ▁have ▁a ▁favour ite ▁design er .	0 0 0 0 0 0 0 0 0 0 0 0 0 0 1 1 1 1 0 0 0 0 0 0 0 0 0 0 0 0 0 0 0 0 0 0 0 0 0	PROPN VERB VERB ADP NOUN ADP DET NOUN PUNCT PUNCT NOUN NOUN CCONJ CCONJ ADP NOUN NOUN ADP ADJ ADJ NOUN CCONJ DET ADP ADJ NOUN NOUN NOUN NOUN VERB VERB PART VERB DET ADJ ADJ NOUN NOUN NOUN
To Leith's way of thinking, it was hardly polite to ask Travis to leave — especially when, by dint of having a small portion herself, she could manage to stretch the food to another plate.	0 0 0 0 0 0 0 0 0 0 0 0 0 0 0 0 0 1 1 1 0 0 0 0 0 0 0 0 0 0 0 0 0 0 0	by dint of	figurative	identical	ADP PROPN NOUN ADP NOUN PRON VERB ADV ADJ PART VERB PROPN PART VERB PUNCT ADV ADV ADP NOUN ADP VERB DET ADJ NOUN PRON PRON VERB VERB PART VERB DET NOUN ADP DET NOUN	▁To ▁Le ith ' s ▁way ▁of ▁thinking , ▁it ▁was ▁hardly ▁p olite ▁to ▁ask ▁Tra vis ▁to ▁leave ▁ — ▁especially ▁when , ▁by ▁din t ▁of ▁having ▁a ▁small ▁portion ▁herself , ▁she ▁could ▁manage ▁to ▁stretch ▁the ▁food ▁to ▁another ▁plate .	0 0 0 0 0 0 0 0 0 0 0 0 0 0 0 0 0 0 0 0 0 0 0 0 0 1 1 1 1 0 0 0 0 0 0 0 0 0 0 0 0 0 0 0 0 0	ADP PROPN PROPN PROPN PROPN NOUN ADP NOUN NOUN PRON VERB ADV ADJ ADJ PART VERB PROPN PROPN PART VERB PUNCT PUNCT ADV ADV ADV ADP NOUN NOUN ADP VERB DET ADJ NOUN PRON PRON PRON VERB VERB PART VERB DET NOUN ADP DET NOUN NOUN
By dint of careful and meticulous research she was able to provide the defence with evidence that every significant statement published in the Sunday Telegraph had been published somewhere already in a newspaper, a magazine or a book.	1 1 1 0 0 0 0 0 0 0 0 0 0 0 0 0 0 0 0 0 0 0 0 0 0 0 0 0 0 0 0 0 0 0 0 0 0 0	by dint of	figurative	case	ADP NOUN ADP ADJ CCONJ ADJ NOUN PRON VERB ADJ PART VERB DET NOUN ADP NOUN ADP DET ADJ NOUN VERB ADP DET PROPN PROPN VERB VERB VERB ADV ADV ADP DET NOUN DET NOUN CCONJ DET NOUN	▁By ▁din t ▁of ▁careful ▁and ▁meticulous ▁research ▁she ▁was ▁able ▁to ▁provide ▁the ▁defence ▁with ▁evidence ▁that ▁every ▁significant ▁statement ▁published ▁in ▁the ▁Sunday ▁Tele graph ▁had ▁been ▁published ▁somewhere ▁already ▁in ▁a ▁newspaper , ▁a ▁magazine ▁or ▁a ▁book .	1 1 1 1 0 0 0 0 0 0 0 0 0 0 0 0 0 0 0 0 0 0 0 0 0 0 0 0 0 0 0 0 0 0 0 0 0 0 0 0 0 0	ADP NOUN NOUN ADP ADJ CCONJ ADJ NOUN PRON VERB ADJ PART VERB DET NOUN ADP NOUN ADP DET ADJ NOUN VERB ADP DET PROPN PROPN PROPN VERB VERB VERB ADV ADV ADP DET NOUN NOUN DET NOUN CCONJ DET NOUN NOUN
At times, by dint of heroic effort, the Elves achieved a breathing space and cleared their lands.	0 0 1 1 1 0 0 0 0 0 0 0 0 0 0 0 0	by dint of	figurative	identical	ADP NOUN ADP NOUN ADP ADJ NOUN DET PROPN VERB DET NOUN NOUN CCONJ VERB ADJ NOUN	▁At ▁times , ▁by ▁din t ▁of ▁her o ic ▁effort , ▁the ▁El ves ▁achieved ▁a ▁breathing ▁space ▁and ▁cleared ▁their ▁lands .	0 0 0 1 1 1 1 0 0 0 0 0 0 0 0 0 0 0 0 0 0 0 0 0	ADP NOUN NOUN ADP NOUN NOUN ADP ADJ ADJ ADJ NOUN NOUN DET PROPN PROPN VERB DET NOUN NOUN CCONJ VERB ADJ NOUN NOUN
‘ The decision to do so was one of the hardest I have ever made : but now that I am committed ( by dint of posting the letter before I had time to change my mind ) I began to be afraid of opposite extremes — afraid that I am merely indulging in an orgy of egoism.’	0 0 0 0 0 0 0 0 0 0 0 0 0 0 0 0 0 0 0 0 0 0 0 1 1 1 0 0 0 0 0 0 0 0 0 0 0 0 0 0 0 0 0 0 0 0 0 0 0 0 0 0 0 0 0 0 0 0	by dint of	figurative	identical	PUNCT DET NOUN PART VERB ADV VERB NUM ADP DET ADJ PRON VERB ADV VERB PUNCT CCONJ ADV ADP PRON VERB ADJ PUNCT ADP NOUN ADP VERB DET NOUN ADP PRON VERB NOUN PART VERB ADJ NOUN PUNCT PRON VERB PART VERB ADJ ADP ADJ NOUN PUNCT ADJ ADP PRON VERB ADV VERB ADP DET NOUN ADP PROPN	▁ ‘ ▁The ▁decision ▁to ▁do ▁so ▁was ▁one ▁of ▁the ▁hard est ▁I ▁have ▁ever ▁made ▁ : ▁but ▁now ▁that ▁I ▁am ▁committed ▁( ▁by ▁din t ▁of ▁posting ▁the ▁letter ▁before ▁I ▁had ▁time ▁to ▁change ▁my ▁mind ▁ ) ▁I ▁began ▁to ▁be ▁afraid ▁of ▁opposite ▁extreme s ▁ — ▁afraid ▁that ▁I ▁am ▁mere ly ▁in du lg ing ▁in ▁an ▁or gy ▁of ▁ ego ism . ’	0 0 0 0 0 0 0 0 0 0 0 0 0 0 0 0 0 0 0 0 0 0 0 0 0 0 1 1 1 1 0 0 0 0 0 0 0 0 0 0 0 0 0 0 0 0 0 0 0 0 0 0 0 0 0 0 0 0 0 0 0 0 0 0 0 0 0 0 0 0 0 0 0 0	PUNCT PUNCT DET NOUN PART VERB ADV VERB NUM ADP DET ADJ ADJ PRON VERB ADV VERB PUNCT PUNCT CCONJ ADV ADP PRON VERB ADJ PUNCT ADP NOUN NOUN ADP VERB DET NOUN ADP PRON VERB NOUN PART VERB ADJ NOUN PUNCT PUNCT PRON VERB PART VERB ADJ ADP ADJ NOUN NOUN PUNCT PUNCT ADJ ADP PRON VERB ADV ADV VERB VERB VERB VERB ADP DET NOUN NOUN ADP PROPN PROPN PROPN PROPN PROPN
By dint of some speedy alterations by Taheb's dressmaker, Huy was able to wear a kilt and shirt that had belonged to Taheb's late husband, his friend Amotju.	1 1 1 0 0 0 0 0 0 0 0 0 0 0 0 0 0 0 0 0 0 0 0 0 0 0 0 0	by dint of	figurative	case	ADP NOUN ADP DET ADJ NOUN ADP PROPN NOUN PROPN VERB ADJ PART VERB DET NOUN CCONJ NOUN ADJ VERB VERB ADP PROPN ADJ NOUN ADJ NOUN PROPN	▁By ▁din t ▁of ▁some ▁speed y ▁alterations ▁by ▁Ta he b ' s ▁ dress maker , ▁Hu y ▁was ▁able ▁to ▁wear ▁a ▁ ki lt ▁and ▁sh ir t ▁that ▁had ▁belonged ▁to ▁Ta he b ' s ▁late ▁husband , ▁his ▁friend ▁Am ot ju .	1 1 1 1 0 0 0 0 0 0 0 0 0 0 0 0 0 0 0 0 0 0 0 0 0 0 0 0 0 0 0 0 0 0 0 0 0 0 0 0 0 0 0 0 0 0 0 0 0 0	ADP NOUN NOUN ADP DET ADJ ADJ NOUN ADP PROPN PROPN PROPN PROPN PROPN NOUN NOUN NOUN NOUN PROPN PROPN VERB ADJ PART VERB DET NOUN NOUN NOUN CCONJ NOUN NOUN NOUN ADJ VERB VERB ADP PROPN PROPN PROPN PROPN PROPN ADJ NOUN NOUN ADJ NOUN PROPN PROPN PROPN PROPN
Whether by dint of their boundless imagination or their unquestioned musical integrity, the Purcell Quartet continues to win the admiration of listeners.	0 1 1 1 0 0 0 0 0 0 0 0 0 0 0 0 0 0 0 0 0 0	by dint of	figurative	identical	ADP ADP NOUN ADP ADJ ADJ NOUN CCONJ ADJ ADJ ADJ NOUN DET PROPN PROPN VERB PART VERB DET NOUN ADP NOUN	▁W hether ▁by ▁din t ▁of ▁their ▁bound less ▁imagination ▁or ▁their ▁un question ed ▁music al ▁integrity , ▁the ▁Pur cell ▁Quar tet ▁continues ▁to ▁win ▁the ▁admiration ▁of ▁listen ers .	0 0 1 1 1 1 0 0 0 0 0 0 0 0 0 0 0 0 0 0 0 0 0 0 0 0 0 0 0 0 0 0 0	ADP ADP ADP NOUN NOUN ADP ADJ ADJ ADJ NOUN CCONJ ADJ ADJ ADJ ADJ ADJ ADJ NOUN NOUN DET PROPN PROPN PROPN PROPN VERB PART VERB DET NOUN ADP NOUN NOUN NOUN
The work at present obtained in Edinburgh was only by dint of " great energy and hard work by the employers ".	0 0 0 0 0 0 0 0 0 1 1 1 0 0 0 0 0 0 0 0 0 0	by dint of	figurative	identical	DET NOUN ADP ADJ VERB ADP PROPN VERB ADV ADP NOUN ADP PUNCT ADJ NOUN CCONJ ADJ NOUN ADP DET NOUN PUNCT	▁The ▁work ▁at ▁present ▁obtained ▁in ▁Edinburgh ▁was ▁only ▁by ▁din t ▁of ▁" ▁great ▁energy ▁and ▁hard ▁work ▁by ▁the ▁employers ▁" .	0 0 0 0 0 0 0 0 0 1 1 1 1 0 0 0 0 0 0 0 0 0 0 0	DET NOUN ADP ADJ VERB ADP PROPN VERB ADV ADP NOUN NOUN ADP PUNCT ADJ NOUN CCONJ ADJ NOUN ADP DET NOUN PUNCT PUNCT
The more competitors we have, the more the basic raw material of popular is presented in bland supermarket - commodity ways, the more the NME, by dint of the few extra degrees of vim, suss and humour it puts into its coverage, will seem different from everything else.	0 0 0 0 0 0 0 0 0 0 0 0 0 0 0 0 0 0 0 0 0 0 0 0 0 1 1 1 0 0 0 0 0 0 0 0 0 0 0 0 0 0 0 0 0 0 0 0	by dint of	figurative	identical	DET ADJ NOUN PRON VERB DET ADV DET ADJ ADJ NOUN ADP ADJ VERB VERB ADP ADJ NOUN PUNCT NOUN NOUN DET ADJ DET PROPN ADP NOUN ADP DET ADJ ADJ NOUN ADP NOUN VERB CCONJ VERB PRON VERB ADP ADJ NOUN VERB VERB ADJ ADP NOUN ADV	▁The ▁more ▁competitors ▁we ▁have , ▁the ▁more ▁the ▁basic ▁raw ▁material ▁of ▁popular ▁is ▁presented ▁in ▁b land ▁super market ▁- ▁commodity ▁ways , ▁the ▁more ▁the ▁N ME , ▁by ▁din t ▁of ▁the ▁few ▁extra ▁degrees ▁of ▁v im , ▁su s s ▁and ▁h umour ▁it ▁puts ▁into ▁its ▁coverage , ▁will ▁seem ▁different ▁from ▁everything ▁else .	0 0 0 0 0 0 0 0 0 0 0 0 0 0 0 0 0 0 0 0 0 0 0 0 0 0 0 0 0 0 0 1 1 1 1 0 0 0 0 0 0 0 0 0 0 0 0 0 0 0 0 0 0 0 0 0 0 0 0 0 0 0	DET ADJ NOUN PRON VERB VERB DET ADV DET ADJ ADJ NOUN ADP ADJ VERB VERB ADP ADJ ADJ NOUN NOUN PUNCT NOUN NOUN NOUN DET ADJ DET PROPN PROPN PROPN ADP NOUN NOUN ADP DET ADJ ADJ NOUN ADP NOUN NOUN NOUN VERB VERB VERB CCONJ VERB VERB PRON VERB ADP ADJ NOUN NOUN VERB VERB ADJ ADP NOUN ADV ADV
