She would lie, steal, cheat for Oliver : burning a few hundred pounds was chicken feed.	0 0 0 0 0 0 0 0 0 0 0 0 0 0 1 1	chicken feed	figurative	identical	PRON VERB VERB VERB VERB ADP PROPN PUNCT VERB DET ADJ NUM NOUN VERB NOUN NOUN
I 've got a number down here, er, seventy percent of total costs of egg production are var are variable costs, and essentially that's the feed, the chicken feed.	0 0 0 0 0 0 0 0 0 0 0 0 0 0 0 0 0 0 0 0 0 0 0 0 0 0 0 1 1	chicken feed	literal	identical	PRON VERB VERB DET NOUN ADV ADV INTJ NUM NOUN ADP ADJ NOUN ADP NOUN NOUN VERB NOUN VERB ADJ NOUN CCONJ ADV DET DET NOUN DET NOUN NOUN
Although clearly at odds with the ' socialist ' economy, all this is chicken - feed compared with a far more serious problem — nietroudovyie dokhody — or ' unearned income ' — as it is euphemistically called.	0 0 0 0 0 0 0 0 0 0 0 0 0 1 0 1 0 0 0 0 0 0 0 0 0 0 0 0 0 0 0 0 0 0 0 0 0 0	chicken feed	figurative	dashes	ADP ADV ADP NOUN ADP DET PUNCT ADJ PUNCT NOUN ADJ DET VERB NOUN PUNCT NOUN VERB ADP DET ADV ADV ADJ NOUN PUNCT NOUN NOUN PUNCT CCONJ PUNCT ADJ NOUN PUNCT PUNCT ADP PRON VERB ADV VERB
We 're going to make so much money out of oysters that the 5 million or so you 've got against me will look like chicken feed.	0 0 0 0 0 0 0 0 0 0 0 0 0 0 0 0 0 0 0 0 0 0 0 0 0 1 1	chicken feed	figurative	identical	PRON VERB VERB PART VERB ADV ADJ NOUN ADP ADP NOUN ADP DET NUM NUM CCONJ ADV PRON VERB VERB ADP PRON VERB VERB ADP NOUN NOUN
Turkey greatly reduced dolphin populations in the Black Sea to produce dolphin oil and chicken feed.	0 0 0 0 0 0 0 0 0 0 0 0 0 0 1 1	chicken feed	literal	identical	PROPN ADV VERB ADJ NOUN ADP DET PROPN PROPN PART VERB ADJ NOUN CCONJ NOUN NOUN
The man with golden goal touch at the County Ground is still Craig Maskell … the two hundred and fifty thousand pounds that Swindon gave Reading for him is beginning to look chicken feed … 15 goals this season … the last two came last week against Southend … tomorrow he's off to Ashton gate to shoot Bristol City down …	0 0 0 0 0 0 0 0 0 0 0 0 0 0 0 0 0 0 0 0 0 0 0 0 0 0 0 0 0 0 0 0 1 1 0 0 0 0 0 0 0 0 0 0 0 0 0 0 0 0 0 0 0 0 0 0 0 0 0 0 0	chicken feed	figurative	identical	DET NOUN ADP ADJ NOUN NOUN ADP DET PROPN PROPN VERB ADV PROPN PROPN PUNCT DET NUM NUM CCONJ NUM NUM NOUN ADJ PROPN VERB VERB ADP PRON VERB VERB PART VERB NOUN NOUN PUNCT NUM NOUN DET NOUN PUNCT DET ADJ NUM VERB ADJ NOUN ADP PROPN PROPN NOUN PRON ADP ADP PROPN NOUN PART VERB PROPN PROPN ADV PUNCT
The sum was chicken feed, and the more governmental corruption that went on there, the better.	0 0 0 1 1 0 0 0 0 0 0 0 0 0 0 0	chicken feed	figurative	identical	DET NOUN VERB NOUN NOUN CCONJ DET ADJ ADJ NOUN ADJ VERB ADV ADV DET ADJ
Hell, it's chicken - feed to him. "	0 0 1 0 1 0 0 0	chicken feed	figurative	dashes	NOUN PRON NOUN PUNCT NOUN ADP PRON PUNCT
And this was chicken - feed next to the revenues earned by government - connected Syrians and Syrian - backed terrorist groups actually engaged in the traffic.	0 0 0 1 0 1 0 0 0 0 0 0 0 0 0 0 0 0 0 0 0 0 0 0 0 0 0	chicken feed	figurative	dashes	CCONJ DET VERB NOUN PUNCT NOUN ADV ADP DET NOUN VERB ADP NOUN PUNCT VERB PROPN CCONJ PROPN PUNCT VERB ADJ NOUN ADV VERB ADP DET NOUN