Moreover, it is unlikely to be in such a position until it has come to grips with the broader contradictions underlying its current operation — its devotion to the Common Agricultural Policy on the one hand and its ambition to recruit the states of Central Europe as members on the other.	0 0 0 0 0 0 0 0 0 0 0 0 0 1 1 1 1 0 0 0 0 0 0 0 0 0 0 0 0 0 0 0 0 0 0 0 0 0 0 0 0 0 0 0 0 0 0 0 0 0 0	come to grips with	figurative	identical	ADV PRON VERB ADJ PART VERB ADP ADJ DET NOUN ADP PRON VERB VERB ADP NOUN ADP DET ADJ NOUN VERB ADJ ADJ NOUN PUNCT ADJ NOUN ADP DET PROPN PROPN PROPN ADP DET NUM NOUN CCONJ ADJ NOUN PART VERB DET NOUN ADP PROPN PROPN ADP NOUN ADP DET ADJ	▁Moreover , ▁it ▁is ▁unlikely ▁to ▁be ▁in ▁such ▁a ▁position ▁until ▁it ▁has ▁come ▁to ▁grips ▁with ▁the ▁broader ▁contradictions ▁underlying ▁its ▁current ▁operation ▁ — ▁its ▁devot ion ▁to ▁the ▁Common ▁Agricultural ▁Policy ▁on ▁the ▁one ▁hand ▁and ▁its ▁ambition ▁to ▁recruit ▁the ▁states ▁of ▁Central ▁Europe ▁as ▁members ▁on ▁the ▁other .	0 0 0 0 0 0 0 0 0 0 0 0 0 0 1 1 1 1 0 0 0 0 0 0 0 0 0 0 0 0 0 0 0 0 0 0 0 0 0 0 0 0 0 0 0 0 0 0 0 0 0 0 0 0 0	ADV ADV PRON VERB ADJ PART VERB ADP ADJ DET NOUN ADP PRON VERB VERB ADP NOUN ADP DET ADJ NOUN VERB ADJ ADJ NOUN PUNCT PUNCT ADJ NOUN NOUN ADP DET PROPN PROPN PROPN ADP DET NUM NOUN CCONJ ADJ NOUN PART VERB DET NOUN ADP PROPN PROPN ADP NOUN ADP DET ADJ ADJ
I suppose that I was influenced by the exploits of the great test pilots of the day, people like Peter Twiss, Neville Duke and John Derry, who were at the time just coming to grips with high - speed flight and what was called the ‘ sound - barrier’.	0 0 0 0 0 0 0 0 0 0 0 0 0 0 0 0 0 0 0 0 0 0 0 0 0 0 0 0 0 0 0 0 1 1 1 1 0 0 0 0 0 0 0 0 0 0 0 0 0	come to grips with	figurative	inflection	PRON VERB ADP PRON VERB VERB ADP DET NOUN ADP DET ADJ NOUN NOUN ADP DET NOUN NOUN ADP PROPN PROPN PROPN PROPN CCONJ PROPN PROPN NOUN VERB ADP DET NOUN ADV VERB ADP NOUN ADP ADJ PUNCT NOUN NOUN CCONJ NOUN VERB VERB DET PUNCT ADJ PUNCT NOUN	▁I ▁suppose ▁that ▁I ▁was ▁influenced ▁by ▁the ▁exploit s ▁of ▁the ▁great ▁test ▁pilot s ▁of ▁the ▁day , ▁people ▁like ▁Peter ▁T wi s s , ▁Ne ville ▁D uke ▁and ▁John ▁De rry , ▁who ▁were ▁at ▁the ▁time ▁just ▁coming ▁to ▁grips ▁with ▁high ▁- ▁speed ▁flight ▁and ▁what ▁was ▁called ▁the ▁ ‘ ▁sound ▁- ▁barrier ’ .	0 0 0 0 0 0 0 0 0 0 0 0 0 0 0 0 0 0 0 0 0 0 0 0 0 0 0 0 0 0 0 0 0 0 0 0 0 0 0 0 0 0 0 1 1 1 1 0 0 0 0 0 0 0 0 0 0 0 0 0 0 0 0	PRON VERB ADP PRON VERB VERB ADP DET NOUN NOUN ADP DET ADJ NOUN NOUN NOUN ADP DET NOUN NOUN NOUN ADP PROPN PROPN PROPN PROPN PROPN PROPN PROPN PROPN PROPN PROPN CCONJ PROPN PROPN PROPN PROPN NOUN VERB ADP DET NOUN ADV VERB ADP NOUN ADP ADJ PUNCT NOUN NOUN CCONJ NOUN VERB VERB DET PUNCT PUNCT ADJ PUNCT NOUN NOUN NOUN
‘ I 'd like to know it, all the same,’ he said, as if the knowledge could somehow enable him to come to grips with it and defeat it.	0 0 0 0 0 0 0 0 0 0 0 0 0 0 0 0 0 0 0 0 0 1 1 1 1 0 0 0 0	come to grips with	figurative	identical	PUNCT PRON VERB VERB PART VERB PRON ADJ DET NOUN PRON VERB ADP ADP DET NOUN VERB ADV VERB PRON PART VERB ADP NOUN ADP PRON CCONJ VERB PRON	▁ ‘ ▁I ▁' d ▁like ▁to ▁know ▁it , ▁all ▁the ▁same , ’ ▁he ▁said , ▁as ▁if ▁the ▁knowledge ▁could ▁somehow ▁enable ▁him ▁to ▁come ▁to ▁grips ▁with ▁it ▁and ▁defeat ▁it .	0 0 0 0 0 0 0 0 0 0 0 0 0 0 0 0 0 0 0 0 0 0 0 0 0 0 0 1 1 1 1 0 0 0 0 0	PUNCT PUNCT PRON VERB VERB VERB PART VERB PRON PRON ADJ DET NOUN NOUN NOUN PRON VERB VERB ADP ADP DET NOUN VERB ADV VERB PRON PART VERB ADP NOUN ADP PRON CCONJ VERB PRON PRON
It means that peasants do not have to learn a second language — French — before they come to grips with the written word.	0 0 0 0 0 0 0 0 0 0 0 0 0 0 0 0 0 1 1 1 1 0 0 0	come to grips with	figurative	identical	PRON VERB ADP NOUN VERB ADV VERB PART VERB DET ADJ NOUN PUNCT PROPN PUNCT ADP PRON VERB ADP NOUN ADP DET VERB NOUN	▁It ▁means ▁that ▁peas ants ▁do ▁not ▁have ▁to ▁learn ▁a ▁second ▁language ▁ — ▁French ▁ — ▁before ▁they ▁come ▁to ▁grips ▁with ▁the ▁written ▁word .	0 0 0 0 0 0 0 0 0 0 0 0 0 0 0 0 0 0 0 0 1 1 1 1 0 0 0 0	PRON VERB ADP NOUN NOUN VERB ADV VERB PART VERB DET ADJ NOUN PUNCT PUNCT PROPN PUNCT PUNCT ADP PRON VERB ADP NOUN ADP DET VERB NOUN NOUN
cos, as you say, if if they do have to come to grips with their fellow man, to be at least some of them who are going to be impressed by that.	0 0 0 0 0 0 0 0 0 0 1 1 1 1 0 0 0 0 0 0 0 0 0 0 0 0 0 0 0 0 0 0	come to grips with	figurative	identical	ADP ADP PRON VERB ADP ADP PRON VERB VERB PART VERB ADP NOUN ADP ADJ ADJ NOUN PART VERB ADP ADJ DET ADP PRON NOUN VERB VERB PART VERB VERB ADP DET	▁co s , ▁as ▁you ▁say , ▁if ▁if ▁they ▁do ▁have ▁to ▁come ▁to ▁grips ▁with ▁their ▁fellow ▁man , ▁to ▁be ▁at ▁least ▁some ▁of ▁them ▁who ▁are ▁going ▁to ▁be ▁impress ed ▁by ▁that .	0 0 0 0 0 0 0 0 0 0 0 0 0 1 1 1 1 0 0 0 0 0 0 0 0 0 0 0 0 0 0 0 0 0 0 0 0 0	ADP ADP ADP ADP PRON VERB VERB ADP ADP PRON VERB VERB PART VERB ADP NOUN ADP ADJ ADJ NOUN NOUN PART VERB ADP ADJ DET ADP PRON NOUN VERB VERB PART VERB VERB VERB ADP DET DET
The pre - tax figure was above City expectations and gave evidence that the bank is finally coming to grips with its bad - debt problem.	0 0 0 0 0 0 0 0 0 0 0 0 0 0 0 0 0 1 1 1 1 0 0 0 0 0	come to grips with	figurative	inflection	DET ADJ PUNCT NOUN NOUN VERB ADP PROPN NOUN CCONJ VERB NOUN ADP DET NOUN VERB ADV VERB ADP NOUN ADP ADJ ADJ PUNCT NOUN NOUN	▁The ▁pre ▁- ▁tax ▁figure ▁was ▁above ▁City ▁expectations ▁and ▁gave ▁evidence ▁that ▁the ▁bank ▁is ▁finally ▁coming ▁to ▁grips ▁with ▁its ▁bad ▁- ▁debt ▁problem .	0 0 0 0 0 0 0 0 0 0 0 0 0 0 0 0 0 1 1 1 1 0 0 0 0 0 0	DET ADJ PUNCT NOUN NOUN VERB ADP PROPN NOUN CCONJ VERB NOUN ADP DET NOUN VERB ADV VERB ADP NOUN ADP ADJ ADJ PUNCT NOUN NOUN NOUN
‘ The ecumenical spirit and composition of the group was a key element in the success of the participants coming to grips with the topic.	0 0 0 0 0 0 0 0 0 0 0 0 0 0 0 0 0 0 0 1 1 1 1 0 0	come to grips with	figurative	inflection	PUNCT DET ADJ NOUN CCONJ NOUN ADP DET NOUN VERB DET ADJ NOUN ADP DET NOUN ADP DET NOUN VERB ADP NOUN ADP DET NOUN	▁ ‘ ▁The ▁ ecu men ical ▁spirit ▁and ▁composition ▁of ▁the ▁group ▁was ▁a ▁key ▁element ▁in ▁the ▁success ▁of ▁the ▁participants ▁coming ▁to ▁grips ▁with ▁the ▁topic .	0 0 0 0 0 0 0 0 0 0 0 0 0 0 0 0 0 0 0 0 0 0 0 1 1 1 1 0 0 0	PUNCT PUNCT DET ADJ ADJ ADJ ADJ NOUN CCONJ NOUN ADP DET NOUN VERB DET ADJ NOUN ADP DET NOUN ADP DET NOUN VERB ADP NOUN ADP DET NOUN NOUN
However, it is possible to come to grips with the key factors to facilitate meaningful negotiation.	0 0 0 0 0 1 1 1 1 0 0 0 0 0 0 0	come to grips with	figurative	identical	ADV PRON VERB ADJ PART VERB ADP NOUN ADP DET ADJ NOUN PART VERB ADJ NOUN	▁However , ▁it ▁is ▁possible ▁to ▁come ▁to ▁grips ▁with ▁the ▁key ▁factors ▁to ▁facilitate ▁meaningful ▁negotiation .	0 0 0 0 0 0 1 1 1 1 0 0 0 0 0 0 0 0	ADV ADV PRON VERB ADJ PART VERB ADP NOUN ADP DET ADJ NOUN PART VERB ADJ NOUN NOUN
It was unable, however, to foresee or come to grips with what Habermas in Legitimation Crisis calls the rationality or planning crisis ( Arato and Gebhardt 1978 : xviii - xx )	0 0 0 0 0 0 0 1 1 1 1 0 0 0 0 0 0 0 0 0 0 0 0 0 0 0 0 0 0 0 0 0	come to grips with	figurative	identical	PRON VERB ADJ ADV PART VERB CCONJ VERB ADP NOUN ADP NOUN PROPN ADP PROPN PROPN VERB DET NOUN CCONJ NOUN NOUN PUNCT PROPN CCONJ PROPN NUM PUNCT NOUN PUNCT NUM PUNCT	▁It ▁was ▁unable , ▁however , ▁to ▁foresee ▁or ▁come ▁to ▁grips ▁with ▁what ▁Hab er mas ▁in ▁Le gi tim ation ▁Crisis ▁calls ▁the ▁rationality ▁or ▁planning ▁crisis ▁( ▁Ar ato ▁and ▁Ge b hard t ▁1978 ▁ : ▁x viii ▁- ▁ xx ▁ )	0 0 0 0 0 0 0 0 0 1 1 1 1 0 0 0 0 0 0 0 0 0 0 0 0 0 0 0 0 0 0 0 0 0 0 0 0 0 0 0 0 0 0 0 0 0 0	PRON VERB ADJ ADJ ADV ADV PART VERB CCONJ VERB ADP NOUN ADP NOUN PROPN PROPN PROPN ADP PROPN PROPN PROPN PROPN PROPN VERB DET NOUN CCONJ NOUN NOUN PUNCT PROPN PROPN CCONJ PROPN PROPN PROPN PROPN NUM PUNCT PUNCT NOUN NOUN PUNCT NUM NUM PUNCT PUNCT
Many experts believe the flow could become a torrent if the government ever comes to grips with the debt and property problems still hanging over the east.	0 0 0 0 0 0 0 0 0 0 0 0 0 1 1 1 1 0 0 0 0 0 0 0 0 0 0	come to grips with	figurative	inflection	ADJ NOUN VERB DET NOUN VERB VERB DET NOUN ADP DET NOUN ADV VERB ADP NOUN ADP DET NOUN CCONJ NOUN NOUN ADV VERB ADP DET NOUN	▁Many ▁experts ▁believe ▁the ▁flow ▁could ▁become ▁a ▁to r rent ▁if ▁the ▁government ▁ever ▁comes ▁to ▁grips ▁with ▁the ▁debt ▁and ▁property ▁problems ▁still ▁hanging ▁over ▁the ▁east .	0 0 0 0 0 0 0 0 0 0 0 0 0 0 0 1 1 1 1 0 0 0 0 0 0 0 0 0 0 0	ADJ NOUN VERB DET NOUN VERB VERB DET NOUN NOUN NOUN ADP DET NOUN ADV VERB ADP NOUN ADP DET NOUN CCONJ NOUN NOUN ADV VERB ADP DET NOUN NOUN
I had to come to grips with a lot of things in a hurry.	0 0 0 1 1 1 1 0 0 0 0 0 0 0	come to grips with	figurative	identical	PRON VERB PART VERB ADP NOUN ADP DET NOUN ADP NOUN ADP DET NOUN	▁I ▁had ▁to ▁come ▁to ▁grips ▁with ▁a ▁lot ▁of ▁things ▁in ▁a ▁hurry .	0 0 0 1 1 1 1 0 0 0 0 0 0 0 0	PRON VERB PART VERB ADP NOUN ADP DET NOUN ADP NOUN ADP DET NOUN NOUN
The environmentalists in their attempt to come to grips with ecological problems have focused on the latter contradiction points to the detriment of those between the social relations of production and the productive forces.	0 0 0 0 0 0 1 1 1 1 0 0 0 0 0 0 0 0 0 0 0 0 0 0 0 0 0 0 0 0 0 0 0 0	come to grips with	figurative	identical	DET NOUN ADP ADJ NOUN PART VERB ADP NOUN ADP ADJ NOUN VERB VERB ADP DET ADJ NOUN NOUN ADP DET NOUN ADP DET ADP DET ADJ NOUN ADP NOUN CCONJ DET ADJ NOUN	▁The ▁environmental ists ▁in ▁their ▁attempt ▁to ▁come ▁to ▁grips ▁with ▁ecological ▁problems ▁have ▁focused ▁on ▁the ▁latter ▁contradiction ▁points ▁to ▁the ▁detriment ▁of ▁those ▁between ▁the ▁social ▁relations ▁of ▁production ▁and ▁the ▁productive ▁forces .	0 0 0 0 0 0 0 1 1 1 1 0 0 0 0 0 0 0 0 0 0 0 0 0 0 0 0 0 0 0 0 0 0 0 0 0	DET NOUN NOUN ADP ADJ NOUN PART VERB ADP NOUN ADP ADJ NOUN VERB VERB ADP DET ADJ NOUN NOUN ADP DET NOUN ADP DET ADP DET ADJ NOUN ADP NOUN CCONJ DET ADJ NOUN NOUN
Members of this new authority will have to come to grips quickly with the dilemma that what a city needs, and what its people want, are often two different things.	0 0 0 0 0 0 0 0 1 1 1 0 1 0 0 0 0 0 0 0 0 0 0 0 0 0 0 0 0 0	come to grips with	figurative	insertion-other	NOUN ADP DET ADJ NOUN VERB VERB PART VERB ADP NOUN ADV ADP DET NOUN ADP NOUN DET NOUN VERB CCONJ NOUN ADJ NOUN VERB VERB ADV NUM ADJ NOUN	▁Members ▁of ▁this ▁new ▁authority ▁will ▁have ▁to ▁come ▁to ▁grips ▁quickly ▁with ▁the ▁dilemma ▁that ▁what ▁a ▁city ▁needs , ▁and ▁what ▁its ▁people ▁want , ▁are ▁often ▁two ▁different ▁things .	0 0 0 0 0 0 0 0 1 1 1 0 1 0 0 0 0 0 0 0 0 0 0 0 0 0 0 0 0 0 0 0 0	NOUN ADP DET ADJ NOUN VERB VERB PART VERB ADP NOUN ADV ADP DET NOUN ADP NOUN DET NOUN VERB VERB CCONJ NOUN ADJ NOUN VERB VERB VERB ADV NUM ADJ NOUN NOUN
Despite such claims, it is hard to avoid the conclusion that in both the USA and the UK, the audio - visual movement rarely came to grips with the need for an elaborated theory going beyond the use of audio - visual materials as decorative additions to the traditional lesson.	0 0 0 0 0 0 0 0 0 0 0 0 0 0 0 0 0 0 0 0 0 0 0 0 1 1 1 1 0 0 0 0 0 0 0 0 0 0 0 0 0 0 0 0 0 0 0 0 0 0	come to grips with	figurative	inflection	ADP ADJ NOUN PRON VERB ADJ PART VERB DET NOUN ADP ADP CCONJ DET PROPN CCONJ DET PROPN DET ADJ PUNCT ADJ NOUN ADV VERB ADP NOUN ADP DET NOUN ADP DET ADJ NOUN VERB ADP DET NOUN ADP ADJ PUNCT ADJ NOUN ADP ADJ NOUN ADP DET ADJ NOUN	▁D espite ▁such ▁claims , ▁it ▁is ▁hard ▁to ▁avoid ▁the ▁conclusion ▁that ▁in ▁both ▁the ▁USA ▁and ▁the ▁UK , ▁the ▁audio ▁- ▁visual ▁movement ▁rarely ▁came ▁to ▁grips ▁with ▁the ▁need ▁for ▁an ▁elaborated ▁theory ▁going ▁beyond ▁the ▁use ▁of ▁audio ▁- ▁visual ▁materials ▁as ▁decorative ▁additions ▁to ▁the ▁traditional ▁lesson .	0 0 0 0 0 0 0 0 0 0 0 0 0 0 0 0 0 0 0 0 0 0 0 0 0 0 0 1 1 1 1 0 0 0 0 0 0 0 0 0 0 0 0 0 0 0 0 0 0 0 0 0 0 0	ADP ADP ADJ NOUN NOUN PRON VERB ADJ PART VERB DET NOUN ADP ADP CCONJ DET PROPN CCONJ DET PROPN PROPN DET ADJ PUNCT ADJ NOUN ADV VERB ADP NOUN ADP DET NOUN ADP DET ADJ NOUN VERB ADP DET NOUN ADP ADJ PUNCT ADJ NOUN ADP ADJ NOUN ADP DET ADJ NOUN NOUN
If a teacher leaves it up to the pupils to work on their own initiative, will they miss out on essential skills while coming to grips with being responsible for their own learning?	0 0 0 0 0 0 0 0 0 0 0 0 0 0 0 0 0 0 0 0 0 0 0 1 1 1 1 0 0 0 0 0 0	come to grips with	figurative	inflection	ADP DET NOUN VERB PRON PART ADP DET NOUN PART VERB ADP ADJ ADJ NOUN VERB PRON VERB PART ADP ADJ NOUN ADP VERB ADP NOUN ADP VERB ADJ ADP ADJ ADJ NOUN	▁If ▁a ▁teacher ▁leaves ▁it ▁up ▁to ▁the ▁pupils ▁to ▁work ▁on ▁their ▁own ▁initiative , ▁will ▁they ▁miss ▁out ▁on ▁essential ▁skills ▁while ▁coming ▁to ▁grips ▁with ▁being ▁responsible ▁for ▁their ▁own ▁learning ?	0 0 0 0 0 0 0 0 0 0 0 0 0 0 0 0 0 0 0 0 0 0 0 0 1 1 1 1 0 0 0 0 0 0 0	ADP DET NOUN VERB PRON PART ADP DET NOUN PART VERB ADP ADJ ADJ NOUN NOUN VERB PRON VERB PART ADP ADJ NOUN ADP VERB ADP NOUN ADP VERB ADJ ADP ADJ ADJ NOUN NOUN
Through the daily use of our special knowledge of the counter - culture, we were forced to acknowledge and come to grips with many of the complex social factors surrounding some drug use, which a legal framework could never adequately encompass.	0 0 0 0 0 0 0 0 0 0 0 0 0 0 0 0 0 0 0 1 1 1 1 0 0 0 0 0 0 0 0 0 0 0 0 0 0 0 0 0 0	come to grips with	figurative	identical	ADP DET ADJ NOUN ADP ADJ ADJ NOUN ADP DET ADJ PUNCT NOUN PRON VERB VERB PART VERB CCONJ VERB ADP NOUN ADP ADJ ADP DET ADJ ADJ NOUN VERB DET NOUN NOUN ADJ DET ADJ NOUN VERB ADV ADV VERB	▁Through ▁the ▁daily ▁use ▁of ▁our ▁special ▁knowledge ▁of ▁the ▁counter ▁- ▁culture , ▁we ▁were ▁forced ▁to ▁acknowledge ▁and ▁come ▁to ▁grips ▁with ▁many ▁of ▁the ▁complex ▁social ▁factors ▁surrounding ▁some ▁drug ▁use , ▁which ▁a ▁legal ▁framework ▁could ▁never ▁adequately ▁encompass .	0 0 0 0 0 0 0 0 0 0 0 0 0 0 0 0 0 0 0 0 1 1 1 1 0 0 0 0 0 0 0 0 0 0 0 0 0 0 0 0 0 0 0 0	ADP DET ADJ NOUN ADP ADJ ADJ NOUN ADP DET ADJ PUNCT NOUN NOUN PRON VERB VERB PART VERB CCONJ VERB ADP NOUN ADP ADJ ADP DET ADJ ADJ NOUN VERB DET NOUN NOUN NOUN ADJ DET ADJ NOUN VERB ADV ADV VERB VERB
Such forecasting also requires an understanding of how advanced economies are coming to grips with that shift, and how the international monetary system will adjust as a result.	0 0 0 0 0 0 0 0 0 0 0 1 1 1 1 0 0 0 0 0 0 0 0 0 0 0 0 0	come to grips with	figurative	inflection	ADJ NOUN ADV VERB DET NOUN ADP ADV ADJ NOUN VERB VERB ADP NOUN ADP DET NOUN CCONJ ADV DET ADJ ADJ NOUN VERB VERB ADP DET NOUN	▁Such ▁forecasting ▁also ▁requires ▁an ▁understanding ▁of ▁how ▁advanced ▁economies ▁are ▁coming ▁to ▁grips ▁with ▁that ▁shift , ▁and ▁how ▁the ▁international ▁monetary ▁system ▁will ▁adjust ▁as ▁a ▁result .	0 0 0 0 0 0 0 0 0 0 0 1 1 1 1 0 0 0 0 0 0 0 0 0 0 0 0 0 0 0	ADJ NOUN ADV VERB DET NOUN ADP ADV ADJ NOUN VERB VERB ADP NOUN ADP DET NOUN NOUN CCONJ ADV DET ADJ ADJ NOUN VERB VERB ADP DET NOUN NOUN
For the history of the Soviet people during the last twenty or so years machine - readable data files are crucial and Moissenko argues contemporary historians need to come to grips with them now.	0 0 0 0 0 0 0 0 0 0 0 0 0 0 0 0 0 0 0 0 0 0 0 0 0 0 0 0 1 1 1 1 0 0	come to grips with	figurative	identical	ADP DET NOUN ADP DET ADJ NOUN ADP DET ADJ NUM CCONJ ADV NOUN NOUN PUNCT ADJ NOUN NOUN VERB ADJ CCONJ PROPN VERB ADJ NOUN VERB PART VERB ADP NOUN ADP PRON ADV	▁For ▁the ▁history ▁of ▁the ▁Soviet ▁people ▁during ▁the ▁last ▁twenty ▁or ▁so ▁years ▁machine ▁- ▁ readable ▁data ▁files ▁are ▁crucial ▁and ▁Mo i ssen ko ▁argues ▁con temporary ▁his tor ians ▁need ▁to ▁come ▁to ▁grips ▁with ▁them ▁now .	0 0 0 0 0 0 0 0 0 0 0 0 0 0 0 0 0 0 0 0 0 0 0 0 0 0 0 0 0 0 0 0 0 0 0 1 1 1 1 0 0 0	ADP DET NOUN ADP DET ADJ NOUN ADP DET ADJ NUM CCONJ ADV NOUN NOUN PUNCT ADJ ADJ NOUN NOUN VERB ADJ CCONJ PROPN PROPN PROPN PROPN VERB ADJ ADJ NOUN NOUN NOUN VERB PART VERB ADP NOUN ADP PRON ADV ADV
It failed really to come to grips with the contribution which voluntary organisations could make to a pattern of services.	0 0 0 0 1 1 1 1 0 0 0 0 0 0 0 0 0 0 0 0	come to grips with	figurative	identical	PRON VERB ADV PART VERB ADP NOUN ADP DET NOUN ADJ ADJ NOUN VERB VERB ADP DET NOUN ADP NOUN	▁It ▁failed ▁really ▁to ▁come ▁to ▁grips ▁with ▁the ▁contribution ▁which ▁voluntary ▁organisations ▁could ▁make ▁to ▁a ▁pattern ▁of ▁services .	0 0 0 0 1 1 1 1 0 0 0 0 0 0 0 0 0 0 0 0 0	PRON VERB ADV PART VERB ADP NOUN ADP DET NOUN ADJ ADJ NOUN VERB VERB ADP DET NOUN ADP NOUN NOUN
How did you come to grips with that?	0 0 0 1 1 1 1 0	come to grips with	figurative	identical	ADV VERB PRON VERB ADP NOUN ADP DET	▁How ▁did ▁you ▁come ▁to ▁grips ▁with ▁that ?	0 0 0 1 1 1 1 0 0	ADV VERB PRON VERB ADP NOUN ADP DET DET
More conservative because they clearly derive inspiration from the old WEA extra - mural model, of the tutorial class seriously, conscientiously, and at length coming to grips with conceptual insights and analytical frameworks which appear remote from the workplace, and because they insist upon the vital contribution of the professional educator.	0 0 0 0 0 0 0 0 0 0 0 0 0 0 0 0 0 0 0 0 0 0 0 0 1 1 1 1 0 0 0 0 0 0 0 0 0 0 0 0 0 0 0 0 0 0 0 0 0 0 0	come to grips with	figurative	inflection	ADV ADJ ADP PRON ADV VERB NOUN ADP DET ADJ PROPN ADJ PUNCT NOUN NOUN ADP DET ADJ NOUN ADV ADV CCONJ ADP NOUN VERB ADP NOUN ADP ADJ NOUN CCONJ ADJ NOUN ADJ VERB ADJ ADP DET NOUN CCONJ ADP PRON VERB ADP DET ADJ NOUN ADP DET ADJ NOUN	▁More ▁conservative ▁because ▁they ▁clearly ▁derive ▁inspiration ▁from ▁the ▁old ▁W EA ▁extra ▁- ▁m ural ▁model , ▁of ▁the ▁tu t orial ▁class ▁seriously , ▁conscientious ly , ▁and ▁at ▁length ▁coming ▁to ▁grips ▁with ▁conceptual ▁insight s ▁and ▁analytical ▁frameworks ▁which ▁appear ▁remote ▁from ▁the ▁workplace , ▁and ▁because ▁they ▁insist ▁upon ▁the ▁vital ▁contribution ▁of ▁the ▁professional ▁edu c ator .	0 0 0 0 0 0 0 0 0 0 0 0 0 0 0 0 0 0 0 0 0 0 0 0 0 0 0 0 0 0 0 0 1 1 1 1 0 0 0 0 0 0 0 0 0 0 0 0 0 0 0 0 0 0 0 0 0 0 0 0 0 0 0 0	ADV ADJ ADP PRON ADV VERB NOUN ADP DET ADJ PROPN PROPN ADJ PUNCT NOUN NOUN NOUN NOUN ADP DET ADJ ADJ ADJ NOUN ADV ADV ADV ADV ADV CCONJ ADP NOUN VERB ADP NOUN ADP ADJ NOUN NOUN CCONJ ADJ NOUN ADJ VERB ADJ ADP DET NOUN NOUN CCONJ ADP PRON VERB ADP DET ADJ NOUN ADP DET ADJ NOUN NOUN NOUN NOUN
I do not believe there will be any other joint tours until they come to grips with the problem.’	0 0 0 0 0 0 0 0 0 0 0 0 0 1 1 1 1 0 0	come to grips with	figurative	identical	PRON VERB ADV VERB ADV VERB VERB DET ADJ ADJ NOUN ADP PRON VERB ADP NOUN ADP DET NOUN	▁I ▁do ▁not ▁believe ▁there ▁will ▁be ▁any ▁other ▁joint ▁to urs ▁until ▁they ▁come ▁to ▁grips ▁with ▁the ▁problem . ’	0 0 0 0 0 0 0 0 0 0 0 0 0 0 1 1 1 1 0 0 0 0	PRON VERB ADV VERB ADV VERB VERB DET ADJ ADJ NOUN NOUN ADP PRON VERB ADP NOUN ADP DET NOUN NOUN NOUN
He thought of Beryl and the need to come to grips with the Garland set - up as it had been before the old man's death.	0 0 0 0 0 0 0 0 1 1 1 1 0 0 0 0 0 0 0 0 0 0 0 0 0 0	come to grips with	figurative	identical	PRON VERB ADP PROPN CCONJ DET NOUN PART VERB ADP NOUN ADP DET PROPN NOUN PUNCT PART ADP PRON VERB VERB ADP DET ADJ NOUN NOUN	▁He ▁thought ▁of ▁Ber yl ▁and ▁the ▁need ▁to ▁come ▁to ▁grips ▁with ▁the ▁Gar land ▁set ▁- ▁up ▁as ▁it ▁had ▁been ▁before ▁the ▁old ▁man ' s ▁death .	0 0 0 0 0 0 0 0 0 1 1 1 1 0 0 0 0 0 0 0 0 0 0 0 0 0 0 0 0 0 0	PRON VERB ADP PROPN PROPN CCONJ DET NOUN PART VERB ADP NOUN ADP DET PROPN PROPN NOUN PUNCT PART ADP PRON VERB VERB ADP DET ADJ NOUN NOUN NOUN NOUN NOUN
If, looking at the Mediterranean world from our Western and Northern viewpoint, we do no more than take note of the removal of North Africa from the scene of Latin Christianity, we shall scarcely have begun to come to grips with the size of the problem.	0 0 0 0 0 0 0 0 0 0 0 0 0 0 0 0 0 0 0 0 0 0 0 0 0 0 0 0 0 0 0 0 0 0 0 0 0 1 1 1 1 0 0 0 0 0	come to grips with	figurative	identical	ADP VERB ADP DET PROPN NOUN ADP ADJ ADJ CCONJ ADJ NOUN PRON VERB ADV ADV ADP VERB NOUN ADP DET NOUN ADP PROPN PROPN ADP DET NOUN ADP PROPN PROPN PRON VERB ADV VERB VERB PART VERB ADP NOUN ADP DET NOUN ADP DET NOUN	▁If , ▁looking ▁at ▁the ▁Mediterranean ▁world ▁from ▁our ▁Western ▁and ▁Northern ▁viewpoint , ▁we ▁do ▁no ▁more ▁than ▁take ▁note ▁of ▁the ▁removal ▁of ▁North ▁Africa ▁from ▁the ▁scene ▁of ▁Latin ▁Christian ity , ▁we ▁shall ▁scarcely ▁have ▁begun ▁to ▁come ▁to ▁grips ▁with ▁the ▁size ▁of ▁the ▁problem .	0 0 0 0 0 0 0 0 0 0 0 0 0 0 0 0 0 0 0 0 0 0 0 0 0 0 0 0 0 0 0 0 0 0 0 0 0 0 0 0 0 1 1 1 1 0 0 0 0 0 0	ADP ADP VERB ADP DET PROPN NOUN ADP ADJ ADJ CCONJ ADJ NOUN NOUN PRON VERB ADV ADV ADP VERB NOUN ADP DET NOUN ADP PROPN PROPN ADP DET NOUN ADP PROPN PROPN PROPN PROPN PRON VERB ADV VERB VERB PART VERB ADP NOUN ADP DET NOUN ADP DET NOUN NOUN
It was J. A. Hobson who made the most influential and original attempt to come to grips with the nature of the new imperialism.	0 0 0 0 0 0 0 0 0 0 0 0 0 0 1 1 1 1 0 0 0 0 0 0	come to grips with	figurative	identical	PRON VERB PROPN PROPN PROPN NOUN VERB DET ADV ADJ CCONJ ADJ NOUN PART VERB ADP NOUN ADP DET NOUN ADP DET ADJ NOUN	▁It ▁was ▁J . ▁A . ▁Ho b son ▁who ▁made ▁the ▁most ▁influent ial ▁and ▁original ▁attempt ▁to ▁come ▁to ▁grips ▁with ▁the ▁nature ▁of ▁the ▁new ▁imperialis m .	0 0 0 0 0 0 0 0 0 0 0 0 0 0 0 0 0 0 0 1 1 1 1 0 0 0 0 0 0 0 0	PRON VERB PROPN PROPN PROPN PROPN PROPN PROPN PROPN NOUN VERB DET ADV ADJ ADJ CCONJ ADJ NOUN PART VERB ADP NOUN ADP DET NOUN ADP DET ADJ NOUN NOUN NOUN
Those involved are attempting to come to grips with the injustices, the inequalities and the prejudices of a political system in which the practice of representative democracy appears to have little relevance to their plight as they battle against the social and economic problems briefly outlined above.	0 0 0 0 0 1 1 1 1 0 0 0 0 0 0 0 0 0 0 0 0 0 0 0 0 0 0 0 0 0 0 0 0 0 0 0 0 0 0 0 0 0 0 0 0 0 0	come to grips with	figurative	identical	DET VERB VERB VERB PART VERB ADP NOUN ADP DET NOUN DET NOUN CCONJ DET NOUN ADP DET ADJ NOUN ADP ADJ DET NOUN ADP ADJ NOUN VERB PART VERB ADJ NOUN ADP ADJ NOUN ADP PRON VERB ADP DET ADJ CCONJ ADJ NOUN ADV VERB ADV	▁T hose ▁involved ▁are ▁attempting ▁to ▁come ▁to ▁grips ▁with ▁the ▁injustice s , ▁the ▁inequalities ▁and ▁the ▁prejudice s ▁of ▁a ▁political ▁system ▁in ▁which ▁the ▁practice ▁of ▁representative ▁democracy ▁appears ▁to ▁have ▁little ▁relevance ▁to ▁their ▁p light ▁as ▁they ▁battle ▁against ▁the ▁social ▁and ▁economic ▁problems ▁briefly ▁outlined ▁above .	0 0 0 0 0 0 1 1 1 1 0 0 0 0 0 0 0 0 0 0 0 0 0 0 0 0 0 0 0 0 0 0 0 0 0 0 0 0 0 0 0 0 0 0 0 0 0 0 0 0 0 0 0	DET DET VERB VERB VERB PART VERB ADP NOUN ADP DET NOUN NOUN NOUN DET NOUN CCONJ DET NOUN NOUN ADP DET ADJ NOUN ADP ADJ DET NOUN ADP ADJ NOUN VERB PART VERB ADJ NOUN ADP ADJ NOUN NOUN ADP PRON VERB ADP DET ADJ CCONJ ADJ NOUN ADV VERB ADV ADV
Let me be personal here, for coming to grips with this has been an important milestone in my own life as a Christian.	0 0 0 0 0 0 1 1 1 1 0 0 0 0 0 0 0 0 0 0 0 0 0	come to grips with	figurative	inflection	VERB PRON VERB ADJ ADV ADP VERB ADP NOUN ADP DET VERB VERB DET ADJ NOUN ADP ADJ ADJ NOUN ADP DET PROPN	▁Let ▁me ▁be ▁personal ▁here , ▁for ▁coming ▁to ▁grips ▁with ▁this ▁has ▁been ▁an ▁important ▁milestone ▁in ▁my ▁own ▁life ▁as ▁a ▁Christian .	0 0 0 0 0 0 0 1 1 1 1 0 0 0 0 0 0 0 0 0 0 0 0 0 0	VERB PRON VERB ADJ ADV ADV ADP VERB ADP NOUN ADP DET VERB VERB DET ADJ NOUN ADP ADJ ADJ NOUN ADP DET PROPN PROPN
