After all, how can anyone sort out their problems if they haven't come to grips with themselves?’	0 0 0 0 0 0 0 0 0 0 0 0 1 1 1 1 0	come to grips with	figurative	identical	ADV ADV ADV VERB NOUN VERB PART ADJ NOUN ADP PRON VERB VERB ADP NOUN ADP NOUN	▁After ▁all , ▁how ▁can ▁anyone ▁sort ▁out ▁their ▁problems ▁if ▁they ▁have n ' t ▁come ▁to ▁grips ▁with ▁themselves ? ’	0 0 0 0 0 0 0 0 0 0 0 0 0 0 0 0 1 1 1 1 0 0 0	ADV ADV ADV ADV VERB NOUN VERB PART ADJ NOUN ADP PRON VERB VERB VERB VERB VERB ADP NOUN ADP NOUN NOUN NOUN
I don't regret it, of course— I might never have been a priest otherwise — but I often think that that's why I just don't seem able to come to grips with the modern world.’	0 0 0 0 0 0 0 0 0 0 0 0 0 0 0 0 0 0 0 0 0 0 0 0 0 0 0 0 1 1 1 1 0 0 0	come to grips with	figurative	identical	PRON VERB VERB PRON ADP NOUN PRON VERB ADV VERB VERB DET NOUN ADV PUNCT CCONJ PRON ADV VERB ADP DET ADV PRON ADV VERB VERB ADJ PART VERB ADP NOUN ADP DET ADJ NOUN	▁I ▁don ' t ▁regret ▁it , ▁of ▁course — ▁I ▁might ▁never ▁have ▁been ▁a ▁priest ▁otherwise ▁ — ▁but ▁I ▁often ▁think ▁that ▁that ' s ▁why ▁I ▁just ▁don ' t ▁seem ▁able ▁to ▁come ▁to ▁grips ▁with ▁the ▁modern ▁world . ’	0 0 0 0 0 0 0 0 0 0 0 0 0 0 0 0 0 0 0 0 0 0 0 0 0 0 0 0 0 0 0 0 0 0 0 0 0 1 1 1 1 0 0 0 0 0	PRON VERB VERB VERB VERB PRON PRON ADP NOUN NOUN PRON VERB ADV VERB VERB DET NOUN ADV PUNCT PUNCT CCONJ PRON ADV VERB ADP DET DET DET ADV PRON ADV VERB VERB VERB VERB ADJ PART VERB ADP NOUN ADP DET ADJ NOUN NOUN NOUN
Their own proposals for reform are aimed at restructuring the British press but it can be argued that even they fail to come to grips with the sort of major ‘ shortcomings’ of the press ( and media ) identified above.	0 0 0 0 0 0 0 0 0 0 0 0 0 0 0 0 0 0 0 0 0 0 1 1 1 1 0 0 0 0 0 0 0 0 0 0 0 0 0 0 0	come to grips with	figurative	identical	ADJ ADJ NOUN ADP NOUN VERB VERB ADP VERB DET ADJ NOUN CCONJ PRON VERB VERB VERB ADP ADV PRON VERB PART VERB ADP NOUN ADP DET NOUN ADP ADJ DET NOUN ADP DET NOUN PUNCT CCONJ NOUN PUNCT VERB ADV	▁The ir ▁own ▁proposals ▁for ▁reform ▁are ▁aimed ▁at ▁restructuring ▁the ▁British ▁press ▁but ▁it ▁can ▁be ▁argued ▁that ▁even ▁they ▁fail ▁to ▁come ▁to ▁grips ▁with ▁the ▁sort ▁of ▁major ▁ ‘ ▁shortcomings ’ ▁of ▁the ▁press ▁( ▁and ▁media ▁ ) ▁identified ▁above .	0 0 0 0 0 0 0 0 0 0 0 0 0 0 0 0 0 0 0 0 0 0 0 1 1 1 1 0 0 0 0 0 0 0 0 0 0 0 0 0 0 0 0 0 0 0	ADJ ADJ ADJ NOUN ADP NOUN VERB VERB ADP VERB DET ADJ NOUN CCONJ PRON VERB VERB VERB ADP ADV PRON VERB PART VERB ADP NOUN ADP DET NOUN ADP ADJ DET DET NOUN NOUN ADP DET NOUN PUNCT CCONJ NOUN PUNCT PUNCT VERB ADV ADV
Yes, Chair, I, I mean I support the criteria that's been laid out in five two there, I think it's very important that we do actually, important that we do actually highlight the issue of low pay, and where it's occurring, and in, in some way that then prevents companies, the, the unscrupulous type of companies that would come in to exploit that, from actually doing it, since most people would then be aware it, and I think that the last speaker's just suggested that it's an extremely cheap way of obtaining masses of information about Shropshire's erm, earnings levels, and I think that's very important that we are, and do come to grips with that, and clearly couldn't afford officer time to be spent on, on merely collating that all the time.	0 0 0 0 0 0 0 0 0 0 0 0 0 0 0 0 0 0 0 0 0 0 0 0 0 0 0 0 0 0 0 0 0 0 0 0 0 0 0 0 0 0 0 0 0 0 0 0 0 0 0 0 0 0 0 0 0 0 0 0 0 0 0 0 0 0 0 0 0 0 0 0 0 0 0 0 0 0 0 0 0 0 0 0 0 0 0 0 0 0 0 0 0 0 0 0 0 0 0 0 0 0 0 0 0 0 0 0 0 0 0 1 1 1 1 0 0 0 0 0 0 0 0 0 0 0 0 0 0 0 0 0 0	come to grips with	figurative	identical	INTJ PROPN PRON PRON VERB PRON VERB DET NOUN ADJ VERB VERB PART ADP NUM NUM ADV PRON VERB PRON ADV ADJ ADP PRON VERB ADV ADJ ADP PRON VERB ADV VERB DET NOUN ADP ADJ NOUN CCONJ ADV PRON VERB CCONJ ADV ADP DET NOUN ADJ ADV VERB NOUN DET DET ADJ NOUN ADP NOUN ADJ VERB VERB PART PART VERB DET ADP ADV VERB PRON ADP ADJ NOUN VERB ADV VERB ADJ PRON CCONJ PRON VERB ADP DET ADJ NOUN ADV VERB ADP PRON DET ADV ADJ NOUN ADP VERB NOUN ADP NOUN ADP PROPN NOUN NOUN NOUN CCONJ PRON VERB DET ADV ADJ ADP PRON VERB CCONJ VERB VERB ADP NOUN ADP DET CCONJ ADV VERB VERB NOUN NOUN PART VERB VERB ADP ADP ADV VERB ADP ADJ DET NOUN	▁Yes , ▁Chair , ▁I , ▁I ▁mean ▁I ▁support ▁the ▁criteria ▁that ' s ▁been ▁laid ▁out ▁in ▁five ▁two ▁there , ▁I ▁think ▁it ' s ▁very ▁important ▁that ▁we ▁do ▁actually , ▁important ▁that ▁we ▁do ▁actually ▁highlight ▁the ▁issue ▁of ▁low ▁pay , ▁and ▁where ▁it ' s ▁occurring , ▁and ▁in , ▁in ▁some ▁way ▁that ▁then ▁prevents ▁companies , ▁the , ▁the ▁un scrupulous ▁type ▁of ▁companies ▁that ▁would ▁come ▁in ▁to ▁exploit ▁that , ▁from ▁actually ▁doing ▁it , ▁since ▁most ▁people ▁would ▁then ▁be ▁aware ▁it , ▁and ▁I ▁think ▁that ▁the ▁last ▁speaker ' s ▁just ▁suggested ▁that ▁it ' s ▁an ▁extremely ▁cheap ▁way ▁of ▁obtaining ▁masses ▁of ▁information ▁about ▁S h rop shire ' s ▁er m , ▁earnings ▁levels , ▁and ▁I ▁think ▁that ' s ▁very ▁important ▁that ▁we ▁are , ▁and ▁do ▁come ▁to ▁grips ▁with ▁that , ▁and ▁clearly ▁could n ' t ▁afford ▁officer ▁time ▁to ▁be ▁spent ▁on , ▁on ▁mere ly ▁col lating ▁that ▁all ▁the ▁time .	0 0 0 0 0 0 0 0 0 0 0 0 0 0 0 0 0 0 0 0 0 0 0 0 0 0 0 0 0 0 0 0 0 0 0 0 0 0 0 0 0 0 0 0 0 0 0 0 0 0 0 0 0 0 0 0 0 0 0 0 0 0 0 0 0 0 0 0 0 0 0 0 0 0 0 0 0 0 0 0 0 0 0 0 0 0 0 0 0 0 0 0 0 0 0 0 0 0 0 0 0 0 0 0 0 0 0 0 0 0 0 0 0 0 0 0 0 0 0 0 0 0 0 0 0 0 0 0 0 0 0 0 0 0 0 0 0 0 0 0 0 0 0 0 0 0 1 1 1 1 0 0 0 0 0 0 0 0 0 0 0 0 0 0 0 0 0 0 0 0 0 0 0 0 0 0	INTJ INTJ PROPN PROPN PRON PRON PRON VERB PRON VERB DET NOUN ADJ ADJ ADJ VERB VERB PART ADP NUM NUM ADV ADV PRON VERB PRON PRON PRON ADV ADJ ADP PRON VERB ADV ADV ADJ ADP PRON VERB ADV VERB DET NOUN ADP ADJ NOUN NOUN CCONJ ADV PRON PRON PRON VERB VERB CCONJ ADV ADV ADP DET NOUN ADJ ADV VERB NOUN NOUN DET DET DET ADJ ADJ NOUN ADP NOUN ADJ VERB VERB PART PART VERB DET DET ADP ADV VERB PRON PRON ADP ADJ NOUN VERB ADV VERB ADJ PRON PRON CCONJ PRON VERB ADP DET ADJ NOUN NOUN NOUN ADV VERB ADP PRON PRON PRON DET ADV ADJ NOUN ADP VERB NOUN ADP NOUN ADP PROPN PROPN PROPN PROPN PROPN PROPN NOUN NOUN NOUN NOUN NOUN NOUN CCONJ PRON VERB DET DET DET ADV ADJ ADP PRON VERB VERB CCONJ VERB VERB ADP NOUN ADP DET DET CCONJ ADV VERB VERB VERB VERB VERB NOUN NOUN PART VERB VERB ADP ADP ADP ADV ADV VERB VERB ADP ADJ DET NOUN NOUN
He was well aware of the anthropomorphism and indeed found it satisfying ; it was as though, in the Britches, thigh - deep in lashing nettle and octopus strands of clutching bramble he was coming to grips at last with a great many things and, as often as not, getting the upper hand.	0 0 0 0 0 0 0 0 0 0 0 0 0 0 0 0 0 0 0 0 0 0 0 0 0 0 0 0 0 0 0 0 0 0 1 1 1 0 0 1 0 0 0 0 0 0 0 0 0 0 0 0 0	come to grips with	figurative	combined-inflection	PRON VERB ADV ADJ ADP DET NOUN CCONJ ADV VERB PRON VERB PUNCT PRON VERB ADV ADV ADP DET PROPN NOUN PUNCT ADJ ADP VERB ADJ CCONJ ADJ NOUN ADP VERB NOUN PRON VERB VERB ADP NOUN ADP ADV ADP DET ADJ ADJ NOUN CCONJ ADV ADV ADP ADV VERB DET ADJ NOUN	▁He ▁was ▁well ▁aware ▁of ▁the ▁a nthrop o morph ism ▁and ▁indeed ▁found ▁it ▁satisfying ▁ ; ▁it ▁was ▁as ▁though , ▁in ▁the ▁Brit ches , ▁thigh ▁- ▁deep ▁in ▁la shing ▁net tle ▁and ▁octo pus ▁strands ▁of ▁clutch ing ▁ bra mble ▁he ▁was ▁coming ▁to ▁grips ▁at ▁last ▁with ▁a ▁great ▁many ▁things ▁and , ▁as ▁often ▁as ▁not , ▁gett ing ▁the ▁upper ▁hand .	0 0 0 0 0 0 0 0 0 0 0 0 0 0 0 0 0 0 0 0 0 0 0 0 0 0 0 0 0 0 0 0 0 0 0 0 0 0 0 0 0 0 0 0 0 0 0 0 1 1 1 0 0 1 0 0 0 0 0 0 0 0 0 0 0 0 0 0 0 0 0	PRON VERB ADV ADJ ADP DET NOUN NOUN NOUN NOUN NOUN CCONJ ADV VERB PRON VERB PUNCT PUNCT PRON VERB ADV ADV ADV ADP DET PROPN PROPN PROPN NOUN PUNCT ADJ ADP VERB VERB ADJ ADJ CCONJ ADJ ADJ NOUN ADP VERB VERB NOUN NOUN NOUN PRON VERB VERB ADP NOUN ADP ADV ADP DET ADJ ADJ NOUN CCONJ CCONJ ADV ADV ADP ADV ADV VERB VERB DET ADJ NOUN NOUN
But it is also essential, because China ’s new leadership seems determined to come to grips with a vast array of internal imbalances that threaten the environment, promote destabilizing income inequality, and exacerbate regional disparities.	0 0 0 0 0 0 0 0 0 0 0 0 0 1 1 1 1 0 0 0 0 0 0 0 0 0 0 0 0 0 0 0 0 0 0	come to grips with	figurative	identical	CCONJ PRON VERB ADV ADJ ADP PROPN PART ADJ NOUN VERB ADJ PART VERB ADP NOUN ADP DET ADJ NOUN ADP ADJ NOUN ADJ VERB DET NOUN VERB ADJ NOUN NOUN CCONJ VERB ADJ NOUN	▁But ▁it ▁is ▁also ▁essential , ▁because ▁China ▁ ’ s ▁new ▁leadership ▁seems ▁determined ▁to ▁come ▁to ▁grips ▁with ▁a ▁vast ▁array ▁of ▁internal ▁imbalances ▁that ▁threaten ▁the ▁environment , ▁promote ▁de stabiliz ing ▁income ▁inequality , ▁and ▁exacerbate ▁regional ▁disparities .	0 0 0 0 0 0 0 0 0 0 0 0 0 0 0 0 1 1 1 1 0 0 0 0 0 0 0 0 0 0 0 0 0 0 0 0 0 0 0 0 0 0 0	CCONJ PRON VERB ADV ADJ ADJ ADP PROPN PART PART PART ADJ NOUN VERB ADJ PART VERB ADP NOUN ADP DET ADJ NOUN ADP ADJ NOUN ADJ VERB DET NOUN NOUN VERB ADJ ADJ ADJ NOUN NOUN NOUN CCONJ VERB ADJ NOUN NOUN
Either side of the Refuge, time closed in, with meetings, the children to be looked after, books to be read, until she felt light - headed with the sense of not coming to grips with anything, of being forced to spin like a top.	0 0 0 0 0 0 0 0 0 0 0 0 0 0 0 0 0 0 0 0 0 0 0 0 0 0 0 0 0 0 0 1 1 1 1 0 0 0 0 0 0 0 0 0	come to grips with	figurative	inflection	DET NOUN ADP DET PROPN NOUN VERB ADV ADP NOUN DET NOUN PART VERB VERB ADP NOUN PART VERB VERB ADP PRON VERB ADJ PUNCT VERB ADP DET NOUN ADP ADV VERB ADP NOUN ADP NOUN ADP VERB VERB PART VERB ADP DET NOUN	▁Either ▁side ▁of ▁the ▁Ref uge , ▁time ▁closed ▁in , ▁with ▁meetings , ▁the ▁children ▁to ▁be ▁looked ▁after , ▁books ▁to ▁be ▁read , ▁until ▁she ▁felt ▁light ▁- ▁headed ▁with ▁the ▁sense ▁of ▁not ▁coming ▁to ▁grips ▁with ▁anything , ▁of ▁being ▁forced ▁to ▁spin ▁like ▁a ▁top .	0 0 0 0 0 0 0 0 0 0 0 0 0 0 0 0 0 0 0 0 0 0 0 0 0 0 0 0 0 0 0 0 0 0 0 0 0 1 1 1 1 0 0 0 0 0 0 0 0 0 0 0	DET NOUN ADP DET PROPN PROPN PROPN NOUN VERB ADV ADV ADP NOUN NOUN DET NOUN PART VERB VERB ADP ADP NOUN PART VERB VERB VERB ADP PRON VERB ADJ PUNCT VERB ADP DET NOUN ADP ADV VERB ADP NOUN ADP NOUN NOUN ADP VERB VERB PART VERB ADP DET NOUN NOUN
in in coming to grips with this issue we have realised how particular they are met er and a number of members will prevent from getting to that meeting to to put their views on the table and for this reason er they decided to defer that.	0 0 1 1 1 1 0 0 0 0 0 0 0 0 0 0 0 0 0 0 0 0 0 0 0 0 0 0 0 0 0 0 0 0 0 0 0 0 0 0 0 0 0 0 0 0 0	come to grips with	figurative	inflection	ADP ADP VERB ADP NOUN ADP DET NOUN PRON VERB VERB ADV ADJ PRON VERB VERB INTJ CCONJ DET NOUN ADP NOUN VERB VERB ADP VERB ADP DET NOUN ADP PART VERB ADJ NOUN ADP DET NOUN CCONJ ADP DET NOUN INTJ PRON VERB PART VERB DET	▁in ▁in ▁coming ▁to ▁grips ▁with ▁this ▁issue ▁we ▁have ▁realised ▁how ▁particular ▁they ▁are ▁met ▁er ▁and ▁a ▁number ▁of ▁members ▁will ▁prevent ▁from ▁gett ing ▁to ▁that ▁meeting ▁to ▁to ▁put ▁their ▁views ▁on ▁the ▁table ▁and ▁for ▁this ▁reason ▁er ▁they ▁decided ▁to ▁defer ▁that .	0 0 1 1 1 1 0 0 0 0 0 0 0 0 0 0 0 0 0 0 0 0 0 0 0 0 0 0 0 0 0 0 0 0 0 0 0 0 0 0 0 0 0 0 0 0 0 0 0	ADP ADP VERB ADP NOUN ADP DET NOUN PRON VERB VERB ADV ADJ PRON VERB VERB INTJ CCONJ DET NOUN ADP NOUN VERB VERB ADP VERB VERB ADP DET NOUN ADP PART VERB ADJ NOUN ADP DET NOUN CCONJ ADP DET NOUN INTJ PRON VERB PART VERB DET DET
Their leaders seem unable to come to grips with the eurozone ’s debt crisis.	0 0 0 0 0 1 1 1 1 0 0 0 0 0	come to grips with	figurative	identical	ADJ NOUN VERB ADJ PART VERB ADP NOUN ADP DET NOUN PART NOUN NOUN	▁The ir ▁leaders ▁seem ▁unable ▁to ▁come ▁to ▁grips ▁with ▁the ▁euro zone ▁ ’ s ▁debt ▁crisis .	0 0 0 0 0 0 1 1 1 1 0 0 0 0 0 0 0 0 0	ADJ ADJ NOUN VERB ADJ PART VERB ADP NOUN ADP DET NOUN NOUN PART PART PART NOUN NOUN NOUN
They had a lot to come to grips with.	0 0 0 0 0 1 1 1 1	come to grips with	figurative	identical	PRON VERB DET NOUN PART VERB ADP NOUN ADP	▁They ▁had ▁a ▁lot ▁to ▁come ▁to ▁grips ▁with .	0 0 0 0 0 1 1 1 1 1	PRON VERB DET NOUN PART VERB ADP NOUN ADP ADP
As she describes in her book, she was an adolescent girl coming to grips with growing up and kicking against conventions ‘ but only in this rather middle - class way.	0 0 0 0 0 0 0 0 0 0 0 1 1 1 1 0 0 0 0 0 0 0 0 0 0 0 0 0 0 0 0	come to grips with	figurative	inflection	ADP PRON VERB ADP ADJ NOUN PRON VERB DET ADJ NOUN VERB ADP NOUN ADP VERB PART CCONJ VERB ADP NOUN PUNCT CCONJ ADV ADP DET ADV ADJ PUNCT NOUN NOUN	▁As ▁she ▁describes ▁in ▁her ▁book , ▁she ▁was ▁an ▁adolescent ▁girl ▁coming ▁to ▁grips ▁with ▁growing ▁up ▁and ▁kick ing ▁against ▁conventions ▁ ‘ ▁but ▁only ▁in ▁this ▁rather ▁middle ▁- ▁class ▁way .	0 0 0 0 0 0 0 0 0 0 0 0 1 1 1 1 0 0 0 0 0 0 0 0 0 0 0 0 0 0 0 0 0 0 0	ADP PRON VERB ADP ADJ NOUN NOUN PRON VERB DET ADJ NOUN VERB ADP NOUN ADP VERB PART CCONJ VERB VERB ADP NOUN PUNCT PUNCT CCONJ ADV ADP DET ADV ADJ PUNCT NOUN NOUN NOUN
With a mountain upbringing, Myles Horton developed the idea of Highlander in an attempt to come to grips with the problems which were really facing the mountain people of Appalachia and the rural south, the day to day problems which these communities perceived as being obstacles to them, rather than necessarily those which planners, developers and politicians were telling them about.	0 0 0 0 0 0 0 0 0 0 0 0 0 0 0 1 1 1 1 0 0 0 0 0 0 0 0 0 0 0 0 0 0 0 0 0 0 0 0 0 0 0 0 0 0 0 0 0 0 0 0 0 0 0 0 0 0 0 0 0 0	come to grips with	figurative	identical	ADP DET NOUN NOUN PROPN PROPN VERB DET NOUN ADP PROPN ADP DET NOUN PART VERB ADP NOUN ADP DET NOUN ADJ VERB ADV VERB DET NOUN NOUN ADP PROPN CCONJ DET ADJ NOUN DET NOUN ADP NOUN NOUN ADJ DET NOUN VERB ADP VERB NOUN ADP PRON ADV ADP ADV DET ADJ VERB NOUN CCONJ NOUN VERB VERB PRON ADP	▁With ▁a ▁mountain ▁up br ing ing , ▁My les ▁H or ton ▁developed ▁the ▁idea ▁of ▁High lander ▁in ▁an ▁attempt ▁to ▁come ▁to ▁grips ▁with ▁the ▁problems ▁which ▁were ▁really ▁facing ▁the ▁mountain ▁people ▁of ▁App al ach ia ▁and ▁the ▁rural ▁south , ▁the ▁day ▁to ▁day ▁problems ▁which ▁these ▁communities ▁perceived ▁as ▁being ▁obstacles ▁to ▁them , ▁rather ▁than ▁necessarily ▁those ▁which ▁plan ners , ▁develop ers ▁and ▁politician s ▁were ▁telling ▁them ▁about .	0 0 0 0 0 0 0 0 0 0 0 0 0 0 0 0 0 0 0 0 0 0 0 1 1 1 1 0 0 0 0 0 0 0 0 0 0 0 0 0 0 0 0 0 0 0 0 0 0 0 0 0 0 0 0 0 0 0 0 0 0 0 0 0 0 0 0 0 0 0 0 0 0 0 0 0 0 0 0	ADP DET NOUN NOUN NOUN NOUN NOUN NOUN PROPN PROPN PROPN PROPN PROPN VERB DET NOUN ADP PROPN PROPN ADP DET NOUN PART VERB ADP NOUN ADP DET NOUN ADJ VERB ADV VERB DET NOUN NOUN ADP PROPN PROPN PROPN PROPN CCONJ DET ADJ NOUN NOUN DET NOUN ADP NOUN NOUN ADJ DET NOUN VERB ADP VERB NOUN ADP PRON PRON ADV ADP ADV DET ADJ VERB VERB VERB NOUN NOUN CCONJ NOUN NOUN VERB VERB PRON ADP ADP
The easiest uses to come to grips with are exclamations such as(1 ) above, because they give a very clear impression of somehow looking at the infinitive event from a position before : they express a desire or longing to realize the infinitive event, so that ( 1 ) might be paraphrased"I would love to be in England …	0 0 0 0 1 1 1 1 0 0 0 0 0 0 0 0 0 0 0 0 0 0 0 0 0 0 0 0 0 0 0 0 0 0 0 0 0 0 0 0 0 0 0 0 0 0 0 0 0 0 0 0 0 0 0 0 0 0 0	come to grips with	figurative	identical	DET ADJ VERB PART VERB ADP NOUN ADP VERB NOUN ADJ NOUN PUNCT ADV ADP PRON VERB DET ADV ADJ NOUN ADP ADV VERB ADP DET ADJ NOUN ADP DET NOUN ADP PUNCT PRON VERB DET NOUN CCONJ NOUN PART VERB DET ADJ NOUN ADP DET PUNCT PUNCT PUNCT VERB VERB NOUN VERB VERB PART VERB ADP PROPN PUNCT	▁The ▁e as ies t ▁uses ▁to ▁come ▁to ▁grips ▁with ▁are ▁ excl am ations ▁such ▁as ( 1 ▁ ) ▁above , ▁because ▁they ▁give ▁a ▁very ▁clear ▁impression ▁of ▁somehow ▁looking ▁at ▁the ▁in fin i tive ▁event ▁from ▁a ▁position ▁before ▁ : ▁they ▁express ▁a ▁desire ▁or ▁long ing ▁to ▁realize ▁the ▁in fin i tive ▁event , ▁so ▁that ▁( ▁1 ▁ ) ▁might ▁be ▁para ph ras ed " I ▁would ▁love ▁to ▁be ▁in ▁England ▁...	0 0 0 0 0 0 0 1 1 1 1 0 0 0 0 0 0 0 0 0 0 0 0 0 0 0 0 0 0 0 0 0 0 0 0 0 0 0 0 0 0 0 0 0 0 0 0 0 0 0 0 0 0 0 0 0 0 0 0 0 0 0 0 0 0 0 0 0 0 0 0 0 0 0 0 0 0 0 0 0 0 0 0 0	DET ADJ ADJ ADJ ADJ VERB PART VERB ADP NOUN ADP VERB NOUN NOUN NOUN NOUN ADJ NOUN NOUN NOUN PUNCT PUNCT ADV ADV ADP PRON VERB DET ADV ADJ NOUN ADP ADV VERB ADP DET ADJ ADJ ADJ ADJ NOUN ADP DET NOUN ADP PUNCT PUNCT PRON VERB DET NOUN CCONJ NOUN NOUN PART VERB DET ADJ ADJ ADJ ADJ NOUN NOUN ADP DET PUNCT PUNCT PUNCT PUNCT VERB VERB NOUN NOUN NOUN NOUN NOUN NOUN VERB VERB PART VERB ADP PROPN PUNCT
President François Mitterrand had warned in December following the most recent city riots [ see p. 37869]that modern socialism had to come to grips with the management of urban society, and the worst affected local authorities had complained that they lacked resources and bore a heavy burden compared with more affluent areas.	0 0 0 0 0 0 0 0 0 0 0 0 0 0 0 0 0 0 0 0 0 1 1 1 1 0 0 0 0 0 0 0 0 0 0 0 0 0 0 0 0 0 0 0 0 0 0 0 0 0 0 0	come to grips with	figurative	identical	PROPN PROPN PROPN VERB VERB ADP PROPN VERB DET ADV ADJ NOUN NOUN PUNCT VERB NOUN ADP ADJ NOUN VERB PART VERB ADP NOUN ADP DET NOUN ADP ADJ NOUN CCONJ DET ADV ADJ ADJ NOUN VERB VERB ADP PRON VERB NOUN CCONJ VERB DET ADJ NOUN VERB ADP ADJ ADJ NOUN	▁President ▁François ▁Mitter rand ▁had ▁warned ▁in ▁December ▁following ▁the ▁most ▁recent ▁city ▁riot s ▁[ ▁see ▁p . ▁378 69 ] that ▁modern ▁social ism ▁had ▁to ▁come ▁to ▁grips ▁with ▁the ▁management ▁of ▁urban ▁society , ▁and ▁the ▁worst ▁affected ▁local ▁authorities ▁had ▁complained ▁that ▁they ▁lack ed ▁resources ▁and ▁bore ▁a ▁heavy ▁burden ▁compared ▁with ▁more ▁a f flu ent ▁areas .	0 0 0 0 0 0 0 0 0 0 0 0 0 0 0 0 0 0 0 0 0 0 0 0 0 0 0 0 1 1 1 1 0 0 0 0 0 0 0 0 0 0 0 0 0 0 0 0 0 0 0 0 0 0 0 0 0 0 0 0 0 0 0 0 0	PROPN PROPN PROPN PROPN VERB VERB ADP PROPN VERB DET ADV ADJ NOUN NOUN NOUN PUNCT VERB NOUN NOUN ADP ADP ADP ADP ADJ NOUN NOUN VERB PART VERB ADP NOUN ADP DET NOUN ADP ADJ NOUN NOUN CCONJ DET ADV ADJ ADJ NOUN VERB VERB ADP PRON VERB VERB NOUN CCONJ VERB DET ADJ NOUN VERB ADP ADJ ADJ ADJ ADJ ADJ NOUN NOUN
They believe that any newcomer would take months to come to grips with what has gone wrong at Ferranti and would as a consequence be worse placed to negotiate a rescue for the group.	0 0 0 0 0 0 0 0 0 1 1 1 1 0 0 0 0 0 0 0 0 0 0 0 0 0 0 0 0 0 0 0 0 0	come to grips with	figurative	identical	PRON VERB ADP DET NOUN VERB VERB NOUN PART VERB ADP NOUN ADP NOUN VERB VERB ADJ ADP PROPN CCONJ VERB ADP DET NOUN VERB ADV VERB PART VERB DET NOUN ADP DET NOUN	▁They ▁believe ▁that ▁any ▁new com er ▁would ▁take ▁months ▁to ▁come ▁to ▁grips ▁with ▁what ▁has ▁gone ▁wrong ▁at ▁Ferr anti ▁and ▁would ▁as ▁a ▁consequence ▁be ▁worse ▁placed ▁to ▁negotiate ▁a ▁rescue ▁for ▁the ▁group .	0 0 0 0 0 0 0 0 0 0 0 1 1 1 1 0 0 0 0 0 0 0 0 0 0 0 0 0 0 0 0 0 0 0 0 0 0 0	PRON VERB ADP DET NOUN NOUN NOUN VERB VERB NOUN PART VERB ADP NOUN ADP NOUN VERB VERB ADJ ADP PROPN PROPN CCONJ VERB ADP DET NOUN VERB ADV VERB PART VERB DET NOUN ADP DET NOUN NOUN
In the end, the analysis is gon na occur, it's the patient who, who really doesn't analyze their ego comes to grips with the unconscious.	0 0 0 0 0 0 0 0 0 0 0 0 0 0 0 0 0 0 0 1 1 1 1 0 0	come to grips with	figurative	inflection	ADP DET NOUN DET NOUN VERB VERB PART VERB PRON DET NOUN NOUN NOUN ADV VERB VERB ADJ NOUN VERB ADP NOUN ADP DET ADJ	▁In ▁the ▁end , ▁the ▁analysis ▁is ▁ gon ▁na ▁occur , ▁it ' s ▁the ▁patient ▁who , ▁who ▁really ▁does n ' t ▁analyze ▁their ▁ ego ▁comes ▁to ▁grips ▁with ▁the ▁unconscious .	0 0 0 0 0 0 0 0 0 0 0 0 0 0 0 0 0 0 0 0 0 0 0 0 0 0 0 0 0 1 1 1 1 0 0 0	ADP DET NOUN NOUN DET NOUN VERB VERB VERB PART VERB VERB PRON PRON PRON DET NOUN NOUN NOUN NOUN ADV VERB VERB VERB VERB VERB ADJ NOUN NOUN VERB ADP NOUN ADP DET ADJ ADJ
Cook had the afternoon off and she had been coming to grips with her occasional souffle, when the ‘ monster’ had started its cacophony.	0 0 0 0 0 0 0 0 0 1 1 1 1 0 0 0 0 0 0 0 0 0 0 0	come to grips with	figurative	inflection	PROPN VERB DET NOUN ADV CCONJ PRON VERB VERB VERB ADP NOUN ADP ADJ ADJ NOUN ADV DET PUNCT NOUN VERB VERB ADJ NOUN	▁Cook ▁had ▁the ▁afternoon ▁off ▁and ▁she ▁had ▁been ▁coming ▁to ▁grips ▁with ▁her ▁occasional ▁so uff le , ▁when ▁the ▁ ‘ ▁monster ’ ▁had ▁started ▁its ▁ca co phon y .	0 0 0 0 0 0 0 0 0 1 1 1 1 0 0 0 0 0 0 0 0 0 0 0 0 0 0 0 0 0 0 0 0	PROPN VERB DET NOUN ADV CCONJ PRON VERB VERB VERB ADP NOUN ADP ADJ ADJ NOUN NOUN NOUN NOUN ADV DET PUNCT PUNCT NOUN NOUN VERB VERB ADJ NOUN NOUN NOUN NOUN NOUN
Minton's sharpest critic was David Sylvester who, having admired his Painter and Model at the Contemporary Art Society exhibition earlier that year, damned the portraits at the Lefevre for their lack of reality ; Minton, he argued, had not come to grips with appearances because he had failed to detach his faculties of observation from his interest in the sitters ' personalities.	0 0 0 0 0 0 0 0 0 0 0 0 0 0 0 0 0 0 0 0 0 0 0 0 0 0 0 0 0 0 0 0 0 0 0 0 0 0 0 1 1 1 1 0 0 0 0 0 0 0 0 0 0 0 0 0 0 0 0 0 0 0	come to grips with	figurative	identical	PROPN ADJ NOUN VERB PROPN PROPN NOUN VERB VERB ADJ PROPN CCONJ PROPN ADP DET PROPN PROPN PROPN NOUN ADV DET NOUN VERB DET NOUN ADP DET PROPN ADP ADJ NOUN ADP NOUN PUNCT PROPN PRON VERB VERB ADV VERB ADP NOUN ADP NOUN ADP PRON VERB VERB PART VERB ADJ NOUN ADP NOUN ADP ADJ NOUN ADP DET NOUN PART NOUN	▁Min ton ' s ▁sharp est ▁critic ▁was ▁David ▁S yl ve ster ▁who , ▁having ▁admire d ▁his ▁Paint er ▁and ▁Model ▁at ▁the ▁Con temporary ▁Art ▁Society ▁exhibition ▁earlier ▁that ▁year , ▁dam ned ▁the ▁port ra its ▁at ▁the ▁L ef ev re ▁for ▁their ▁lack ▁of ▁reality ▁ ; ▁Min ton , ▁he ▁argued , ▁had ▁not ▁come ▁to ▁grips ▁with ▁appearance s ▁because ▁he ▁had ▁failed ▁to ▁de t ach ▁his ▁faculties ▁of ▁observation ▁from ▁his ▁interest ▁in ▁the ▁sit ters ▁' ▁personal ities .	0 0 0 0 0 0 0 0 0 0 0 0 0 0 0 0 0 0 0 0 0 0 0 0 0 0 0 0 0 0 0 0 0 0 0 0 0 0 0 0 0 0 0 0 0 0 0 0 0 0 0 0 0 0 0 0 0 0 0 0 0 1 1 1 1 0 0 0 0 0 0 0 0 0 0 0 0 0 0 0 0 0 0 0 0 0 0 0 0 0	PROPN PROPN PROPN PROPN ADJ ADJ NOUN VERB PROPN PROPN PROPN PROPN PROPN NOUN NOUN VERB VERB VERB ADJ PROPN PROPN CCONJ PROPN ADP DET PROPN PROPN PROPN PROPN NOUN ADV DET NOUN NOUN VERB VERB DET NOUN NOUN NOUN ADP DET PROPN PROPN PROPN PROPN ADP ADJ NOUN ADP NOUN PUNCT PUNCT PROPN PROPN PROPN PRON VERB VERB VERB ADV VERB ADP NOUN ADP NOUN NOUN ADP PRON VERB VERB PART VERB VERB VERB ADJ NOUN ADP NOUN ADP ADJ NOUN ADP DET NOUN NOUN PART NOUN NOUN NOUN
The 24-year - old David Stirling was no rough and ready brawling cut - throat though, in spite of his thirst for coming to grips with the enemy.	0 0 0 0 0 0 0 0 0 0 0 0 0 0 0 0 0 0 0 0 0 0 1 1 1 1 0 0	come to grips with	figurative	inflection	DET NUM PUNCT ADJ PROPN PROPN VERB DET ADJ CCONJ ADJ NOUN NOUN PUNCT NOUN ADV ADP NOUN ADP ADJ NOUN ADP VERB ADP NOUN ADP DET NOUN	▁The ▁24 - year ▁- ▁old ▁David ▁St ir ling ▁was ▁no ▁rough ▁and ▁ready ▁b raw ling ▁cut ▁- ▁throat ▁though , ▁in ▁spite ▁of ▁his ▁thirst ▁for ▁coming ▁to ▁grips ▁with ▁the ▁enemy .	0 0 0 0 0 0 0 0 0 0 0 0 0 0 0 0 0 0 0 0 0 0 0 0 0 0 0 0 0 1 1 1 1 0 0 0	DET NUM NUM NUM PUNCT ADJ PROPN PROPN PROPN PROPN VERB DET ADJ CCONJ ADJ NOUN NOUN NOUN NOUN PUNCT NOUN ADV ADV ADP NOUN ADP ADJ NOUN ADP VERB ADP NOUN ADP DET NOUN NOUN
‘ Tosca was the first score I came to grips with, and what a score!	0 0 0 0 0 0 0 1 1 1 1 0 0 0 0	come to grips with	figurative	inflection	PUNCT PROPN VERB DET ADJ NOUN PRON VERB ADP NOUN ADP CCONJ NOUN DET NOUN	▁ ‘ ▁To s ca ▁was ▁the ▁first ▁score ▁I ▁came ▁to ▁grips ▁with , ▁and ▁what ▁a ▁score !	0 0 0 0 0 0 0 0 0 0 1 1 1 1 1 0 0 0 0 0	PUNCT PUNCT PROPN PROPN PROPN VERB DET ADJ NOUN PRON VERB ADP NOUN ADP ADP CCONJ NOUN DET NOUN NOUN
