It took me only a few weeks to realise that the medical world would never come to grips with polio until it could isolate the virus which caused it.	0 0 0 0 0 0 0 0 0 0 0 0 0 0 0 1 1 1 1 0 0 0 0 0 0 0 0 0 0	come to grips with	figurative	identical	PRON VERB PRON ADV DET ADJ NOUN PART VERB ADP DET ADJ NOUN VERB ADV VERB ADP NOUN ADP NOUN ADP PRON VERB VERB DET NOUN ADJ VERB PRON	▁It ▁took ▁me ▁only ▁a ▁few ▁weeks ▁to ▁realise ▁that ▁the ▁medical ▁world ▁would ▁never ▁come ▁to ▁grips ▁with ▁poli o ▁until ▁it ▁could ▁isolate ▁the ▁virus ▁which ▁caused ▁it .	0 0 0 0 0 0 0 0 0 0 0 0 0 0 0 1 1 1 1 0 0 0 0 0 0 0 0 0 0 0 0	PRON VERB PRON ADV DET ADJ NOUN PART VERB ADP DET ADJ NOUN VERB ADV VERB ADP NOUN ADP NOUN NOUN ADP PRON VERB VERB DET NOUN ADJ VERB PRON PRON
Right, don't spend most of your time trying to come to grips with something that you just don't understand.	0 0 0 0 0 0 0 0 0 1 1 1 1 0 0 0 0 0 0	come to grips with	figurative	identical	INTJ VERB VERB ADJ ADP ADJ NOUN VERB PART VERB ADP NOUN ADP NOUN ADJ PRON ADV VERB VERB	▁Right , ▁don ' t ▁spend ▁most ▁of ▁your ▁time ▁trying ▁to ▁come ▁to ▁grips ▁with ▁something ▁that ▁you ▁just ▁don ' t ▁understand .	0 0 0 0 0 0 0 0 0 0 0 0 1 1 1 1 0 0 0 0 0 0 0 0 0	INTJ INTJ VERB VERB VERB VERB ADJ ADP ADJ NOUN VERB PART VERB ADP NOUN ADP NOUN ADJ PRON ADV VERB VERB VERB VERB VERB
This documentation of personal responsibility could, in my opinion, be an important factor in coming to grips with the current system of punitive damages sought from auditors for alleged negligence.	0 0 0 0 0 0 0 0 0 0 0 0 0 0 1 1 1 1 0 0 0 0 0 0 0 0 0 0 0 0	come to grips with	figurative	inflection	DET NOUN ADP ADJ NOUN VERB ADP ADJ NOUN VERB DET ADJ NOUN ADP VERB ADP NOUN ADP DET ADJ NOUN ADP ADJ NOUN VERB ADP NOUN ADP ADJ NOUN	▁This ▁documentation ▁of ▁personal ▁responsibility ▁could , ▁in ▁my ▁opinion , ▁be ▁an ▁important ▁factor ▁in ▁coming ▁to ▁grips ▁with ▁the ▁current ▁system ▁of ▁p unit ive ▁damages ▁sought ▁from ▁auditors ▁for ▁alleged ▁negligence .	0 0 0 0 0 0 0 0 0 0 0 0 0 0 0 0 1 1 1 1 0 0 0 0 0 0 0 0 0 0 0 0 0 0 0	DET NOUN ADP ADJ NOUN VERB VERB ADP ADJ NOUN NOUN VERB DET ADJ NOUN ADP VERB ADP NOUN ADP DET ADJ NOUN ADP ADJ ADJ ADJ NOUN VERB ADP NOUN ADP ADJ NOUN NOUN
That all thinking is grounded in analogization shows up especially clearly when we try to come to grips with the thought of another civilization.	0 0 0 0 0 0 0 0 0 0 0 0 0 0 0 1 1 1 1 0 0 0 0 0	come to grips with	figurative	identical	ADP DET NOUN VERB VERB ADP NOUN VERB PART ADV ADV ADV PRON VERB PART VERB ADP NOUN ADP DET NOUN ADP DET NOUN	▁That ▁all ▁thinking ▁is ▁ground ed ▁in ▁an alog ization ▁shows ▁up ▁especially ▁clearly ▁when ▁we ▁try ▁to ▁come ▁to ▁grips ▁with ▁the ▁thought ▁of ▁another ▁civilization .	0 0 0 0 0 0 0 0 0 0 0 0 0 0 0 0 0 0 1 1 1 1 0 0 0 0 0 0	ADP DET NOUN VERB VERB VERB ADP NOUN NOUN NOUN VERB PART ADV ADV ADV PRON VERB PART VERB ADP NOUN ADP DET NOUN ADP DET NOUN NOUN
Guillotining the Bill at this early stage shows that Ministers are frightened to come to grips with the legislation and face scrutiny of the details of their own Bill.	0 0 0 0 0 0 0 0 0 0 0 0 0 1 1 1 1 0 0 0 0 0 0 0 0 0 0 0 0	come to grips with	figurative	identical	VERB DET PROPN ADP DET ADJ NOUN VERB ADP PROPN VERB ADJ PART VERB ADP NOUN ADP DET NOUN CCONJ NOUN NOUN ADP DET NOUN ADP ADJ ADJ NOUN	▁Guill oti ning ▁the ▁Bill ▁at ▁this ▁early ▁stage ▁shows ▁that ▁Ministers ▁are ▁f right ened ▁to ▁come ▁to ▁grips ▁with ▁the ▁legislation ▁and ▁face ▁scrutiny ▁of ▁the ▁details ▁of ▁their ▁own ▁Bill .	0 0 0 0 0 0 0 0 0 0 0 0 0 0 0 0 0 1 1 1 1 0 0 0 0 0 0 0 0 0 0 0 0 0	VERB VERB VERB DET PROPN ADP DET ADJ NOUN VERB ADP PROPN VERB ADJ ADJ ADJ PART VERB ADP NOUN ADP DET NOUN CCONJ NOUN NOUN ADP DET NOUN ADP ADJ ADJ NOUN NOUN
Law firms have not come to grips with the issues,’ says Geraldine Cotton, chair of the 5,500-strong English Association of Women Solicitors.	0 0 0 0 1 1 1 1 0 0 0 0 0 0 0 0 0 0 0 0 0 0	come to grips with	figurative	identical	NOUN NOUN VERB ADV VERB ADP NOUN ADP DET NOUN VERB PROPN PROPN NOUN ADP DET NUM PROPN PROPN ADP PROPN PROPN	▁Law ▁firms ▁have ▁not ▁come ▁to ▁grips ▁with ▁the ▁issues , ’ ▁says ▁G erald ine ▁Cotton , ▁chair ▁of ▁the ▁5 , 500 - str ong ▁English ▁Association ▁of ▁Women ▁So licit ors .	0 0 0 0 1 1 1 1 0 0 0 0 0 0 0 0 0 0 0 0 0 0 0 0 0 0 0 0 0 0 0 0 0 0 0	NOUN NOUN VERB ADV VERB ADP NOUN ADP DET NOUN NOUN NOUN VERB PROPN PROPN PROPN PROPN PROPN NOUN ADP DET NUM NUM NUM NUM NUM NUM PROPN PROPN ADP PROPN PROPN PROPN PROPN PROPN
‘ As we come to grips with the communication process, we comprehend the human being.	0 0 0 1 1 1 1 0 0 0 0 0 0 0 0	come to grips with	figurative	identical	PUNCT ADP PRON VERB ADP NOUN ADP DET NOUN NOUN PRON VERB DET ADJ NOUN	▁ ‘ ▁As ▁we ▁come ▁to ▁grips ▁with ▁the ▁communication ▁process , ▁we ▁com pre hen d ▁the ▁human ▁being .	0 0 0 0 1 1 1 1 0 0 0 0 0 0 0 0 0 0 0 0 0	PUNCT PUNCT ADP PRON VERB ADP NOUN ADP DET NOUN NOUN NOUN PRON VERB VERB VERB VERB DET ADJ NOUN NOUN
I had to come to grips with how my understanding of the sovereignty of God applied in that situation.	0 0 0 1 1 1 1 0 0 0 0 0 0 0 0 0 0 0 0	come to grips with	figurative	identical	PRON VERB PART VERB ADP NOUN ADP ADV ADJ NOUN ADP DET NOUN ADP PROPN VERB ADP DET NOUN	▁I ▁had ▁to ▁come ▁to ▁grips ▁with ▁how ▁my ▁understanding ▁of ▁the ▁sovereignty ▁of ▁God ▁applied ▁in ▁that ▁situation .	0 0 0 1 1 1 1 0 0 0 0 0 0 0 0 0 0 0 0 0	PRON VERB PART VERB ADP NOUN ADP ADV ADJ NOUN ADP DET NOUN ADP PROPN VERB ADP DET NOUN NOUN
The apostle Peter comes to grips with this priority structure as he addresses our ability to explain the gospel : ‘ Always be prepared to give an answer to everyone who asks you.’	0 0 0 1 1 1 1 0 0 0 0 0 0 0 0 0 0 0 0 0 0 0 0 0 0 0 0 0 0 0 0 0 0	come to grips with	figurative	inflection	DET NOUN PROPN VERB ADP NOUN ADP DET NOUN NOUN ADP PRON VERB ADJ NOUN PART VERB DET NOUN PUNCT PUNCT ADV VERB VERB PART VERB DET NOUN ADP NOUN NOUN VERB NOUN	▁The ▁a post le ▁Peter ▁comes ▁to ▁grips ▁with ▁this ▁priority ▁structure ▁as ▁he ▁addresses ▁our ▁ability ▁to ▁explain ▁the ▁go s pel ▁ : ▁ ‘ ▁Always ▁be ▁prepared ▁to ▁give ▁an ▁answer ▁to ▁everyone ▁who ▁asks ▁you . ’	0 0 0 0 0 1 1 1 1 0 0 0 0 0 0 0 0 0 0 0 0 0 0 0 0 0 0 0 0 0 0 0 0 0 0 0 0 0 0 0 0	DET NOUN NOUN NOUN PROPN VERB ADP NOUN ADP DET NOUN NOUN ADP PRON VERB ADJ NOUN PART VERB DET NOUN NOUN NOUN PUNCT PUNCT PUNCT PUNCT ADV VERB VERB PART VERB DET NOUN ADP NOUN NOUN VERB NOUN NOUN NOUN
The sooner it comes to grips with its problem, the better.	0 0 0 1 1 1 1 0 0 0 0	come to grips with	figurative	inflection	DET ADV PRON VERB ADP NOUN ADP ADJ NOUN DET ADJ	▁The ▁sooner ▁it ▁comes ▁to ▁grips ▁with ▁its ▁problem , ▁the ▁better .	0 0 0 1 1 1 1 0 0 0 0 0 0	DET ADV PRON VERB ADP NOUN ADP ADJ NOUN NOUN DET ADJ ADJ
This afforded the opportunity for him both to become familiar with other music, and to come to grips with concerto movement forms unhampered by the need to create the thematic and harmonic material as well.	0 0 0 0 0 0 0 0 0 0 0 0 0 0 0 1 1 1 1 0 0 0 0 0 0 0 0 0 0 0 0 0 0 0 0	come to grips with	figurative	identical	DET VERB DET NOUN ADP PRON DET PART VERB ADJ ADP ADJ NOUN CCONJ PART VERB ADP NOUN ADP X NOUN NOUN VERB ADP DET NOUN PART VERB DET ADJ CCONJ ADJ NOUN ADV ADV	▁This ▁afforded ▁the ▁opportunity ▁for ▁him ▁both ▁to ▁become ▁familiar ▁with ▁other ▁music , ▁and ▁to ▁come ▁to ▁grips ▁with ▁concert o ▁movement ▁forms ▁un ham per ed ▁by ▁the ▁need ▁to ▁create ▁the ▁thematic ▁and ▁harm onic ▁material ▁as ▁well .	0 0 0 0 0 0 0 0 0 0 0 0 0 0 0 0 1 1 1 1 0 0 0 0 0 0 0 0 0 0 0 0 0 0 0 0 0 0 0 0 0 0	DET VERB DET NOUN ADP PRON DET PART VERB ADJ ADP ADJ NOUN NOUN CCONJ PART VERB ADP NOUN ADP X X NOUN NOUN VERB VERB VERB VERB ADP DET NOUN PART VERB DET ADJ CCONJ ADJ ADJ NOUN ADV ADV ADV
Above, Anthony Hopkins comes to grips with his part as Glass, Leonard's Cold War boss	0 0 0 1 1 1 1 0 0 0 0 0 0 0 0	come to grips with	figurative	inflection	ADV PROPN PROPN VERB ADP NOUN ADP ADJ NOUN ADP PROPN PROPN PROPN PROPN NOUN	▁Above , ▁An th ony ▁Ho pkins ▁comes ▁to ▁grips ▁with ▁his ▁part ▁as ▁Glass , ▁Leonard ' s ▁Cold ▁War ▁bo s s	0 0 0 0 0 0 0 1 1 1 1 0 0 0 0 0 0 0 0 0 0 0 0 0	ADV ADV PROPN PROPN PROPN PROPN PROPN VERB ADP NOUN ADP ADJ NOUN ADP PROPN PROPN PROPN PROPN PROPN PROPN PROPN NOUN NOUN NOUN
