It should aim at helping individuals to assess the cost to their former life - style, and either to fight the consequences realistically, or to accept and come to terms with them, whichever seems to be the most appropriate.	0 0 0 0 0 0 0 0 0 0 0 0 0 0 0 0 0 0 0 0 0 0 0 0 0 0 0 1 1 1 1 0 0 0 0 0 0 0 0	come to terms with	figurative	identical	PRON VERB VERB ADP VERB NOUN PART VERB DET NOUN ADP ADJ ADJ NOUN PUNCT NOUN CCONJ ADV PART VERB DET NOUN ADV CCONJ PART VERB CCONJ VERB ADP NOUN ADP PRON ADJ VERB PART VERB DET ADV ADJ	▁It ▁should ▁aim ▁at ▁help ing ▁individuals ▁to ▁assess ▁the ▁cost ▁to ▁their ▁former ▁life ▁- ▁style , ▁and ▁either ▁to ▁fight ▁the ▁consequences ▁realistically , ▁or ▁to ▁accept ▁and ▁come ▁to ▁terms ▁with ▁them , ▁which ever ▁seems ▁to ▁be ▁the ▁most ▁appropriate .	0 0 0 0 0 0 0 0 0 0 0 0 0 0 0 0 0 0 0 0 0 0 0 0 0 0 0 0 0 0 1 1 1 1 0 0 0 0 0 0 0 0 0 0 0	PRON VERB VERB ADP VERB VERB NOUN PART VERB DET NOUN ADP ADJ ADJ NOUN PUNCT NOUN NOUN CCONJ ADV PART VERB DET NOUN ADV ADV CCONJ PART VERB CCONJ VERB ADP NOUN ADP PRON PRON ADJ ADJ VERB PART VERB DET ADV ADJ ADJ
But as with physical wounds, it can sometimes run into complications caused by careless handling or the existence of unfavourable external or internal conditions which may delay recovery ; so the main concern of those caring for the bereaved should be to try to create the best possible conditions in which healing can take place, in which they feel loved and safe, and are permitted to take their time to absorb the fact of their loss and come to terms with it.	0 0 0 0 0 0 0 0 0 0 0 0 0 0 0 0 0 0 0 0 0 0 0 0 0 0 0 0 0 0 0 0 0 0 0 0 0 0 0 0 0 0 0 0 0 0 0 0 0 0 0 0 0 0 0 0 0 0 0 0 0 0 0 0 0 0 0 0 0 0 0 0 0 0 0 0 0 1 1 1 1 0	come to terms with	figurative	identical	CCONJ ADP ADP ADJ NOUN PRON VERB ADV VERB ADP NOUN VERB ADP ADJ NOUN CCONJ DET NOUN ADP ADJ ADJ CCONJ ADJ NOUN ADJ VERB VERB NOUN PUNCT CCONJ DET ADJ NOUN ADP DET VERB ADP DET NOUN VERB VERB PART VERB PART VERB DET ADJ ADJ NOUN ADP ADJ NOUN VERB VERB NOUN ADP ADJ PRON VERB ADJ CCONJ ADJ CCONJ VERB VERB PART VERB ADJ NOUN PART VERB DET NOUN ADP ADJ NOUN CCONJ VERB ADP NOUN ADP PRON	▁But ▁as ▁with ▁physical ▁wound s , ▁it ▁can ▁sometimes ▁run ▁into ▁complications ▁caused ▁by ▁care less ▁handling ▁or ▁the ▁existence ▁of ▁unfavourable ▁external ▁or ▁internal ▁conditions ▁which ▁may ▁delay ▁recovery ▁ ; ▁so ▁the ▁main ▁concern ▁of ▁those ▁caring ▁for ▁the ▁be rea ved ▁should ▁be ▁to ▁try ▁to ▁create ▁the ▁best ▁possible ▁conditions ▁in ▁which ▁healing ▁can ▁take ▁place , ▁in ▁which ▁they ▁feel ▁love d ▁and ▁safe , ▁and ▁are ▁permitted ▁to ▁take ▁their ▁time ▁to ▁absorb ▁the ▁fact ▁of ▁their ▁loss ▁and ▁come ▁to ▁terms ▁with ▁it .	0 0 0 0 0 0 0 0 0 0 0 0 0 0 0 0 0 0 0 0 0 0 0 0 0 0 0 0 0 0 0 0 0 0 0 0 0 0 0 0 0 0 0 0 0 0 0 0 0 0 0 0 0 0 0 0 0 0 0 0 0 0 0 0 0 0 0 0 0 0 0 0 0 0 0 0 0 0 0 0 0 0 0 0 0 0 1 1 1 1 0 0	CCONJ ADP ADP ADJ NOUN NOUN NOUN PRON VERB ADV VERB ADP NOUN VERB ADP ADJ ADJ NOUN CCONJ DET NOUN ADP ADJ ADJ CCONJ ADJ NOUN ADJ VERB VERB NOUN PUNCT PUNCT CCONJ DET ADJ NOUN ADP DET VERB ADP DET NOUN NOUN NOUN VERB VERB PART VERB PART VERB DET ADJ ADJ NOUN ADP ADJ NOUN VERB VERB NOUN NOUN ADP ADJ PRON VERB ADJ ADJ CCONJ ADJ ADJ CCONJ VERB VERB PART VERB ADJ NOUN PART VERB DET NOUN ADP ADJ NOUN CCONJ VERB ADP NOUN ADP PRON PRON
It tends to make life a bit dull at work and we 've tried to come to terms with that.	0 0 0 0 0 0 0 0 0 0 0 0 0 0 0 1 1 1 1 0	come to terms with	figurative	identical	PRON VERB PART VERB NOUN DET NOUN ADJ ADP NOUN CCONJ PRON VERB VERB PART VERB ADP NOUN ADP DET	▁It ▁tend s ▁to ▁make ▁life ▁a ▁bit ▁du ll ▁at ▁work ▁and ▁we ▁' ve ▁tried ▁to ▁come ▁to ▁terms ▁with ▁that .	0 0 0 0 0 0 0 0 0 0 0 0 0 0 0 0 0 0 1 1 1 1 0 0	PRON VERB VERB PART VERB NOUN DET NOUN ADJ ADJ ADP NOUN CCONJ PRON VERB VERB VERB PART VERB ADP NOUN ADP DET DET
The experience was a defining period in her life, one which ‘ really gave me a lotta confidence, and helped me come to terms with my womanhood’.	0 0 0 0 0 0 0 0 0 0 0 0 0 0 0 0 0 0 0 0 0 1 1 1 1 0 0	come to terms with	figurative	identical	DET NOUN VERB DET VERB NOUN ADP ADJ NOUN NUM ADJ PUNCT ADV VERB PRON DET NOUN NOUN CCONJ VERB PRON VERB ADP NOUN ADP ADJ NOUN	▁The ▁experience ▁was ▁a ▁defining ▁period ▁in ▁her ▁life , ▁one ▁which ▁ ‘ ▁really ▁gave ▁me ▁a ▁lot ta ▁confidence , ▁and ▁helped ▁me ▁come ▁to ▁terms ▁with ▁my ▁woman hood ’ .	0 0 0 0 0 0 0 0 0 0 0 0 0 0 0 0 0 0 0 0 0 0 0 0 0 1 1 1 1 0 0 0 0 0	DET NOUN VERB DET VERB NOUN ADP ADJ NOUN NOUN NUM ADJ PUNCT PUNCT ADV VERB PRON DET NOUN NOUN NOUN NOUN CCONJ VERB PRON VERB ADP NOUN ADP ADJ NOUN NOUN NOUN NOUN
Once aware of the source of the problem, the patient can come to terms with these emotions and the physical symptoms should then diminish.	0 0 0 0 0 0 0 0 0 0 0 1 1 1 1 0 0 0 0 0 0 0 0 0	come to terms with	figurative	identical	ADV ADJ ADP DET NOUN ADP DET NOUN DET NOUN VERB VERB ADP NOUN ADP DET NOUN CCONJ DET ADJ NOUN VERB ADV VERB	▁Once ▁aware ▁of ▁the ▁source ▁of ▁the ▁problem , ▁the ▁patient ▁can ▁come ▁to ▁terms ▁with ▁these ▁emotion s ▁and ▁the ▁physical ▁symptoms ▁should ▁then ▁diminish .	0 0 0 0 0 0 0 0 0 0 0 0 1 1 1 1 0 0 0 0 0 0 0 0 0 0 0	ADV ADJ ADP DET NOUN ADP DET NOUN NOUN DET NOUN VERB VERB ADP NOUN ADP DET NOUN NOUN CCONJ DET ADJ NOUN VERB ADV VERB VERB
Many of the people on my courses on dying, for example, had never really come to terms with the inevitability of death in their own lives, and many a time we had to stop to allow distressed and upset people to leave the room.	0 0 0 0 0 0 0 0 0 0 0 0 0 0 1 1 1 1 0 0 0 0 0 0 0 0 0 0 0 0 0 0 0 0 0 0 0 0 0 0 0 0 0 0	come to terms with	figurative	identical	ADJ ADP DET NOUN ADP ADJ NOUN ADP VERB ADP NOUN VERB ADV ADV VERB ADP NOUN ADP DET NOUN ADP NOUN ADP ADJ ADJ NOUN CCONJ ADJ DET NOUN PRON VERB PART VERB PART VERB ADJ CCONJ ADJ NOUN PART VERB DET NOUN	▁Many ▁of ▁the ▁people ▁on ▁my ▁courses ▁on ▁dying , ▁for ▁example , ▁had ▁never ▁really ▁come ▁to ▁terms ▁with ▁the ▁in e vit ability ▁of ▁death ▁in ▁their ▁own ▁lives , ▁and ▁many ▁a ▁time ▁we ▁had ▁to ▁stop ▁to ▁allow ▁distress ed ▁and ▁upset ▁people ▁to ▁leave ▁the ▁room .	0 0 0 0 0 0 0 0 0 0 0 0 0 0 0 0 1 1 1 1 0 0 0 0 0 0 0 0 0 0 0 0 0 0 0 0 0 0 0 0 0 0 0 0 0 0 0 0 0 0 0 0	ADJ ADP DET NOUN ADP ADJ NOUN ADP VERB VERB ADP NOUN NOUN VERB ADV ADV VERB ADP NOUN ADP DET NOUN NOUN NOUN NOUN ADP NOUN ADP ADJ ADJ NOUN NOUN CCONJ ADJ DET NOUN PRON VERB PART VERB PART VERB ADJ ADJ CCONJ ADJ NOUN PART VERB DET NOUN NOUN
My mother's religion helped her to come to terms with my father's death.	0 0 0 0 0 0 1 1 1 1 0 0 0	come to terms with	figurative	identical	ADJ NOUN NOUN VERB PRON PART VERB ADP NOUN ADP ADJ NOUN NOUN	▁My ▁mother ' s ▁religion ▁helped ▁her ▁to ▁come ▁to ▁terms ▁with ▁my ▁father ' s ▁death .	0 0 0 0 0 0 0 0 1 1 1 1 0 0 0 0 0 0	ADJ NOUN NOUN NOUN NOUN VERB PRON PART VERB ADP NOUN ADP ADJ NOUN NOUN NOUN NOUN NOUN
And to help mothers come to terms with their grief, cash from the Telethon appeal has bought a special leatherbound Book of Remembrance in which the names of their unborn babies can be recorded.	0 0 0 0 1 1 1 1 0 0 0 0 0 0 0 0 0 0 0 0 0 0 0 0 0 0 0 0 0 0 0 0 0 0	come to terms with	figurative	identical	CCONJ PART VERB NOUN VERB ADP NOUN ADP ADJ NOUN NOUN ADP DET PROPN NOUN VERB VERB DET ADJ NOUN PROPN ADP NOUN ADP ADJ DET NOUN ADP ADJ ADJ NOUN VERB VERB VERB	▁And ▁to ▁help ▁mothers ▁come ▁to ▁terms ▁with ▁their ▁grief , ▁cash ▁from ▁the ▁Tel eth on ▁appeal ▁has ▁bought ▁a ▁special ▁leather bound ▁Book ▁of ▁Re m emb rance ▁in ▁which ▁the ▁names ▁of ▁their ▁unborn ▁babies ▁can ▁be ▁recorded .	0 0 0 0 1 1 1 1 0 0 0 0 0 0 0 0 0 0 0 0 0 0 0 0 0 0 0 0 0 0 0 0 0 0 0 0 0 0 0 0 0 0	CCONJ PART VERB NOUN VERB ADP NOUN ADP ADJ NOUN NOUN NOUN ADP DET PROPN PROPN PROPN NOUN VERB VERB DET ADJ NOUN NOUN PROPN ADP NOUN NOUN NOUN NOUN ADP ADJ DET NOUN ADP ADJ ADJ NOUN VERB VERB VERB VERB
When Diana joined the Stewart - Richardsons they were just coming to terms with a family tragedy.	0 0 0 0 0 0 0 0 0 0 1 1 1 1 0 0 0	come to terms with	figurative	inflection	ADV PROPN VERB DET PROPN PUNCT PROPN PRON VERB ADV VERB ADP NOUN ADP DET NOUN NOUN	▁When ▁D iana ▁joined ▁the ▁Ste wart ▁- ▁Richard s ons ▁they ▁were ▁just ▁coming ▁to ▁terms ▁with ▁a ▁family ▁tragedy .	0 0 0 0 0 0 0 0 0 0 0 0 0 0 1 1 1 1 0 0 0 0	ADV PROPN PROPN VERB DET PROPN PROPN PUNCT PROPN PROPN PROPN PRON VERB ADV VERB ADP NOUN ADP DET NOUN NOUN NOUN
The union, which is currently coming to terms with 7,000 job losses among railway workers, accused BR bosses of going back on guarantees made in 1984.	0 0 0 0 0 1 1 1 1 0 0 0 0 0 0 0 0 0 0 0 0 0 0 0 0 0	come to terms with	figurative	inflection	DET NOUN ADJ VERB ADV VERB ADP NOUN ADP NUM NOUN NOUN ADP NOUN NOUN VERB PROPN NOUN ADP VERB ADV ADP NOUN VERB ADP NUM	▁The ▁union , ▁which ▁is ▁currently ▁coming ▁to ▁terms ▁with ▁7 , 000 ▁job ▁losses ▁among ▁railway ▁workers , ▁accused ▁B R ▁bo s ses ▁of ▁going ▁back ▁on ▁guarantees ▁made ▁in ▁1984 .	0 0 0 0 0 0 1 1 1 1 0 0 0 0 0 0 0 0 0 0 0 0 0 0 0 0 0 0 0 0 0 0 0 0	DET NOUN NOUN ADJ VERB ADV VERB ADP NOUN ADP NUM NUM NUM NOUN NOUN ADP NOUN NOUN NOUN VERB PROPN PROPN NOUN NOUN NOUN ADP VERB ADV ADP NOUN VERB ADP NUM NUM
I don't think the father can come to terms with it.	0 0 0 0 0 0 1 1 1 1 0	come to terms with	figurative	identical	PRON VERB VERB DET NOUN VERB VERB ADP NOUN ADP PRON	▁I ▁don ' t ▁think ▁the ▁father ▁can ▁come ▁to ▁terms ▁with ▁it .	0 0 0 0 0 0 0 0 1 1 1 1 0 0	PRON VERB VERB VERB VERB DET NOUN VERB VERB ADP NOUN ADP PRON PRON
At the end of April 1916, he is reputed to have expressed to General Gallwitz his readiness to come to terms with France, and even to hand back Metz.	0 0 0 0 0 0 0 0 0 0 0 0 0 0 0 0 0 0 1 1 1 1 0 0 0 0 0 0 0	come to terms with	figurative	identical	ADP DET NOUN ADP PROPN NUM PRON VERB VERB PART VERB VERB ADP PROPN PROPN ADJ NOUN PART VERB ADP NOUN ADP PROPN CCONJ ADV PART VERB PART PROPN	▁At ▁the ▁end ▁of ▁April ▁191 6, ▁he ▁is ▁repute d ▁to ▁have ▁expressed ▁to ▁General ▁Gall w itz ▁his ▁readiness ▁to ▁come ▁to ▁terms ▁with ▁France , ▁and ▁even ▁to ▁hand ▁back ▁Met z .	0 0 0 0 0 0 0 0 0 0 0 0 0 0 0 0 0 0 0 0 0 0 1 1 1 1 0 0 0 0 0 0 0 0 0 0	ADP DET NOUN ADP PROPN NUM NUM PRON VERB VERB VERB PART VERB VERB ADP PROPN PROPN PROPN PROPN ADJ NOUN PART VERB ADP NOUN ADP PROPN PROPN CCONJ ADV PART VERB PART PROPN PROPN PROPN
The reviews reflected this difficulty of critics to come to terms with Crawford in a production so different from his biggest successes.	0 0 0 0 0 0 0 0 1 1 1 1 0 0 0 0 0 0 0 0 0 0	come to terms with	figurative	identical	DET NOUN VERB DET NOUN ADP NOUN PART VERB ADP NOUN ADP PROPN ADP DET NOUN ADV ADJ ADP ADJ ADJ NOUN	▁The ▁reviews ▁reflected ▁this ▁difficulty ▁of ▁critic s ▁to ▁come ▁to ▁terms ▁with ▁Craw ford ▁in ▁a ▁production ▁so ▁different ▁from ▁his ▁biggest ▁successes .	0 0 0 0 0 0 0 0 0 1 1 1 1 0 0 0 0 0 0 0 0 0 0 0 0	DET NOUN VERB DET NOUN ADP NOUN NOUN PART VERB ADP NOUN ADP PROPN PROPN ADP DET NOUN ADV ADJ ADP ADJ ADJ NOUN NOUN
It is therefore possible for membership of a CU to lead to some countries experiencing long - term problems in coming to terms with the new competitive environment.	0 0 0 0 0 0 0 0 0 0 0 0 0 0 0 0 0 0 0 0 1 1 1 1 0 0 0 0	come to terms with	figurative	inflection	PRON VERB ADV ADJ ADP NOUN ADP DET PROPN PART VERB ADP DET NOUN VERB ADJ PUNCT NOUN NOUN ADP VERB ADP NOUN ADP DET ADJ ADJ NOUN	▁It ▁is ▁therefore ▁possible ▁for ▁membership ▁of ▁a ▁CU ▁to ▁lead ▁to ▁some ▁countries ▁experiencing ▁long ▁- ▁term ▁problems ▁in ▁coming ▁to ▁terms ▁with ▁the ▁new ▁competitive ▁environment .	0 0 0 0 0 0 0 0 0 0 0 0 0 0 0 0 0 0 0 0 1 1 1 1 0 0 0 0 0	PRON VERB ADV ADJ ADP NOUN ADP DET PROPN PART VERB ADP DET NOUN VERB ADJ PUNCT NOUN NOUN ADP VERB ADP NOUN ADP DET ADJ ADJ NOUN NOUN
The holiday was particularly useful for children who are still coming to terms with their conditions and may have been robbed of their self - confidence.	0 0 0 0 0 0 0 0 0 0 1 1 1 1 0 0 0 0 0 0 0 0 0 0 0 0	come to terms with	figurative	inflection	DET NOUN VERB ADV ADJ ADP NOUN NOUN VERB ADV VERB ADP NOUN ADP ADJ NOUN CCONJ VERB VERB VERB VERB ADP ADJ NOUN PUNCT NOUN	▁The ▁holiday ▁was ▁particularly ▁useful ▁for ▁children ▁who ▁are ▁still ▁coming ▁to ▁terms ▁with ▁their ▁conditions ▁and ▁may ▁have ▁been ▁ro bb ed ▁of ▁their ▁self ▁- ▁confidence .	0 0 0 0 0 0 0 0 0 0 1 1 1 1 0 0 0 0 0 0 0 0 0 0 0 0 0 0 0	DET NOUN VERB ADV ADJ ADP NOUN NOUN VERB ADV VERB ADP NOUN ADP ADJ NOUN CCONJ VERB VERB VERB VERB VERB VERB ADP ADJ NOUN PUNCT NOUN NOUN
With political change, the established constitutional authorities find themselves in a situation where they are forced to come to terms with new and emerging patterns of political power and practice that are outside ( but pressing in on ) the established constitution that is supposedly made sense of through their theories.	0 0 0 0 0 0 0 0 0 0 0 0 0 0 0 0 0 1 1 1 1 0 0 0 0 0 0 0 0 0 0 0 0 0 0 0 0 0 0 0 0 0 0 0 0 0 0 0 0 0 0	come to terms with	figurative	identical	ADP ADJ NOUN DET VERB ADJ NOUN VERB PRON ADP DET NOUN ADV PRON VERB VERB PART VERB ADP NOUN ADP ADJ CCONJ VERB NOUN ADP ADJ NOUN CCONJ NOUN ADJ VERB ADJ PUNCT CCONJ VERB ADV ADP PUNCT DET VERB NOUN ADJ VERB ADV VERB NOUN ADP ADP ADJ NOUN	▁With ▁political ▁change , ▁the ▁established ▁constitutional ▁authorities ▁find ▁themselves ▁in ▁a ▁situation ▁where ▁they ▁are ▁forced ▁to ▁come ▁to ▁terms ▁with ▁new ▁and ▁emerging ▁patterns ▁of ▁political ▁power ▁and ▁practice ▁that ▁are ▁outside ▁( ▁but ▁pressing ▁in ▁on ▁ ) ▁the ▁established ▁constitution ▁that ▁is ▁supposed ly ▁made ▁sense ▁of ▁through ▁their ▁the or ies .	0 0 0 0 0 0 0 0 0 0 0 0 0 0 0 0 0 0 1 1 1 1 0 0 0 0 0 0 0 0 0 0 0 0 0 0 0 0 0 0 0 0 0 0 0 0 0 0 0 0 0 0 0 0 0 0 0	ADP ADJ NOUN NOUN DET VERB ADJ NOUN VERB PRON ADP DET NOUN ADV PRON VERB VERB PART VERB ADP NOUN ADP ADJ CCONJ VERB NOUN ADP ADJ NOUN CCONJ NOUN ADJ VERB ADJ PUNCT CCONJ VERB ADV ADP PUNCT PUNCT DET VERB NOUN ADJ VERB ADV ADV VERB NOUN ADP ADP ADJ NOUN NOUN NOUN NOUN
limbo yeah, you 're coming together again in the house or whatever you have, a reception, and you need to go through that to come to terms with it or you can, you can need to go through that, but some people can't take the pressure emotional pressure of, you know, all the, hour, two hours, three, four hours before that it just, they	0 0 0 0 0 0 0 0 0 0 0 0 0 0 0 0 0 0 0 0 0 0 0 0 1 1 1 1 0 0 0 0 0 0 0 0 0 0 0 0 0 0 0 0 0 0 0 0 0 0 0 0 0 0 0 0 0 0 0 0 0 0 0 0	come to terms with	figurative	identical	NOUN INTJ PRON VERB VERB ADV ADV ADP DET NOUN CCONJ ADJ PRON VERB DET NOUN CCONJ PRON VERB PART VERB ADP DET PART VERB ADP NOUN ADP PRON CCONJ PRON VERB PRON VERB VERB PART VERB ADP DET CCONJ DET NOUN VERB VERB DET NOUN ADJ NOUN ADP PRON VERB ADJ DET NOUN NUM NOUN NUM NUM NOUN ADP ADP PRON ADV PRON	▁limb o ▁ye ah , ▁you ▁' re ▁coming ▁together ▁again ▁in ▁the ▁house ▁or ▁whatever ▁you ▁have , ▁a ▁reception , ▁and ▁you ▁need ▁to ▁go ▁through ▁that ▁to ▁come ▁to ▁terms ▁with ▁it ▁or ▁you ▁can , ▁you ▁can ▁need ▁to ▁go ▁through ▁that , ▁but ▁some ▁people ▁can ' t ▁take ▁the ▁pressure ▁emotion al ▁pressure ▁of , ▁you ▁know , ▁all ▁the , ▁hour , ▁two ▁hours , ▁three , ▁four ▁hours ▁before ▁that ▁it ▁just , ▁they	0 0 0 0 0 0 0 0 0 0 0 0 0 0 0 0 0 0 0 0 0 0 0 0 0 0 0 0 0 0 1 1 1 1 0 0 0 0 0 0 0 0 0 0 0 0 0 0 0 0 0 0 0 0 0 0 0 0 0 0 0 0 0 0 0 0 0 0 0 0 0 0 0 0 0 0 0 0 0 0 0 0	NOUN NOUN INTJ INTJ INTJ PRON VERB VERB VERB ADV ADV ADP DET NOUN CCONJ ADJ PRON VERB VERB DET NOUN NOUN CCONJ PRON VERB PART VERB ADP DET PART VERB ADP NOUN ADP PRON CCONJ PRON VERB VERB PRON VERB VERB PART VERB ADP DET DET CCONJ DET NOUN VERB VERB VERB VERB DET NOUN ADJ ADJ NOUN ADP ADP PRON VERB VERB ADJ DET DET NOUN NOUN NUM NOUN NOUN NUM NUM NUM NOUN ADP ADP PRON ADV ADV PRON
Now in a council bedsit, Barry and Diane Gammage are coming to terms with unemployment for the first time in their working lives.	0 0 0 0 0 0 0 0 0 0 1 1 1 1 0 0 0 0 0 0 0 0 0	come to terms with	figurative	inflection	ADV ADP DET NOUN NOUN PROPN CCONJ PROPN PROPN VERB VERB ADP NOUN ADP NOUN ADP DET ADJ NOUN ADP ADJ VERB NOUN	▁Now ▁in ▁a ▁council ▁beds it , ▁Bar ry ▁and ▁Di ane ▁Gam m age ▁are ▁coming ▁to ▁terms ▁with ▁unemployment ▁for ▁the ▁first ▁time ▁in ▁their ▁working ▁lives .	0 0 0 0 0 0 0 0 0 0 0 0 0 0 0 0 1 1 1 1 0 0 0 0 0 0 0 0 0 0	ADV ADP DET NOUN NOUN NOUN NOUN PROPN PROPN CCONJ PROPN PROPN PROPN PROPN PROPN VERB VERB ADP NOUN ADP NOUN ADP DET ADJ NOUN ADP ADJ VERB NOUN NOUN
It is a truism to say that we have not yet come to terms with it, or with the changes in relationships it has brought.	0 0 0 0 0 0 0 0 0 0 0 1 1 1 1 0 0 0 0 0 0 0 0 0 0	come to terms with	figurative	identical	PRON VERB DET NOUN PART VERB ADP PRON VERB ADV ADV VERB ADP NOUN ADP PRON CCONJ ADP DET NOUN ADP NOUN PRON VERB VERB	▁It ▁is ▁a ▁ tru ism ▁to ▁say ▁that ▁we ▁have ▁not ▁yet ▁come ▁to ▁terms ▁with ▁it , ▁or ▁with ▁the ▁changes ▁in ▁relationships ▁it ▁has ▁brought .	0 0 0 0 0 0 0 0 0 0 0 0 0 1 1 1 1 0 0 0 0 0 0 0 0 0 0 0 0	PRON VERB DET NOUN NOUN NOUN PART VERB ADP PRON VERB ADV ADV VERB ADP NOUN ADP PRON PRON CCONJ ADP DET NOUN ADP NOUN PRON VERB VERB VERB
One of the first things required in the practice of tai chi chuan is to come to terms with its slow, dreamlike movements.	0 0 0 0 0 0 0 0 0 0 0 0 0 0 0 1 1 1 1 0 0 0 0	come to terms with	figurative	identical	NUM ADP DET ADJ NOUN VERB ADP DET NOUN ADP NOUN NOUN NOUN VERB PART VERB ADP NOUN ADP ADJ ADJ VERB NOUN	▁One ▁of ▁the ▁first ▁things ▁required ▁in ▁the ▁practice ▁of ▁ tai ▁chi ▁ch uan ▁is ▁to ▁come ▁to ▁terms ▁with ▁its ▁slow , ▁dream like ▁movements .	0 0 0 0 0 0 0 0 0 0 0 0 0 0 0 0 0 1 1 1 1 0 0 0 0 0 0 0	NUM ADP DET ADJ NOUN VERB ADP DET NOUN ADP NOUN NOUN NOUN NOUN NOUN VERB PART VERB ADP NOUN ADP ADJ ADJ ADJ VERB VERB NOUN NOUN
The surgeon had sounded a note of amused condescension as though he were betraying a colleague's unfortunate weakness, wryly observed, which a more prudent man would have detected before beginning his medical training, or at least would have come to terms with before his second year.	0 0 0 0 0 0 0 0 0 0 0 0 0 0 0 0 0 0 0 0 0 0 0 0 0 0 0 0 0 0 0 0 0 0 0 0 0 0 1 1 1 1 0 0 0 0	come to terms with	figurative	identical	DET NOUN VERB VERB DET NOUN ADP ADJ NOUN ADP ADP PRON VERB VERB DET NOUN ADJ NOUN ADV VERB ADJ DET ADV ADJ NOUN VERB VERB VERB ADP VERB ADJ ADJ NOUN CCONJ ADP ADJ VERB VERB VERB ADP NOUN ADP ADP ADJ ADJ NOUN	▁The ▁surgeon ▁had ▁sound ed ▁a ▁note ▁of ▁am used ▁con des cen sion ▁as ▁though ▁he ▁were ▁betray ing ▁a ▁colleague ' s ▁unfortunate ▁weakness , ▁w ry ly ▁observed , ▁which ▁a ▁more ▁prudent ▁man ▁would ▁have ▁detected ▁before ▁beginning ▁his ▁medical ▁training , ▁or ▁at ▁least ▁would ▁have ▁come ▁to ▁terms ▁with ▁before ▁his ▁second ▁year .	0 0 0 0 0 0 0 0 0 0 0 0 0 0 0 0 0 0 0 0 0 0 0 0 0 0 0 0 0 0 0 0 0 0 0 0 0 0 0 0 0 0 0 0 0 0 0 0 0 0 0 1 1 1 1 0 0 0 0 0	DET NOUN VERB VERB VERB DET NOUN ADP ADJ ADJ NOUN NOUN NOUN NOUN ADP ADP PRON VERB VERB VERB DET NOUN NOUN NOUN ADJ NOUN NOUN ADV ADV ADV VERB VERB ADJ DET ADV ADJ NOUN VERB VERB VERB ADP VERB ADJ ADJ NOUN NOUN CCONJ ADP ADJ VERB VERB VERB ADP NOUN ADP ADP ADJ ADJ NOUN NOUN
She had come to terms with Newley's affair with Arabella ; she believed that she had her husband precisely where she wanted him.	0 0 1 1 1 1 0 0 0 0 0 0 0 0 0 0 0 0 0 0 0 0 0	come to terms with	figurative	identical	PRON VERB VERB ADP NOUN ADP PROPN NOUN ADP PROPN PUNCT PRON VERB ADP PRON VERB ADJ NOUN ADV ADV PRON VERB PRON	▁She ▁had ▁come ▁to ▁terms ▁with ▁New ley ' s ▁affair ▁with ▁Arab ella ▁ ; ▁she ▁believed ▁that ▁she ▁had ▁her ▁husband ▁precisely ▁where ▁she ▁wanted ▁him .	0 0 1 1 1 1 0 0 0 0 0 0 0 0 0 0 0 0 0 0 0 0 0 0 0 0 0 0 0	PRON VERB VERB ADP NOUN ADP PROPN PROPN PROPN PROPN NOUN ADP PROPN PROPN PUNCT PUNCT PRON VERB ADP PRON VERB ADJ NOUN ADV ADV PRON VERB PRON PRON
It was originally designed by space scientists in America to help astronauts to come to terms with weightlessness.	0 0 0 0 0 0 0 0 0 0 0 0 0 1 1 1 1 0	come to terms with	figurative	identical	PRON VERB ADV VERB ADP NOUN NOUN ADP PROPN PART VERB NOUN PART VERB ADP NOUN ADP NOUN	▁It ▁was ▁originally ▁designed ▁by ▁space ▁scientists ▁in ▁America ▁to ▁help ▁as tron aut s ▁to ▁come ▁to ▁terms ▁with ▁weight lessness .	0 0 0 0 0 0 0 0 0 0 0 0 0 0 0 0 1 1 1 1 0 0 0	PRON VERB ADV VERB ADP NOUN NOUN ADP PROPN PART VERB NOUN NOUN NOUN NOUN PART VERB ADP NOUN ADP NOUN NOUN NOUN
They have genuinely found it difficult to come to terms with the rout that has taken place — the complete volte - face.	0 0 0 0 0 0 0 1 1 1 1 0 0 0 0 0 0 0 0 0 0 0 0	come to terms with	figurative	identical	PRON VERB ADV VERB PRON ADJ PART VERB ADP NOUN ADP DET NOUN ADJ VERB VERB NOUN PUNCT DET ADJ ADJ PUNCT NOUN	▁They ▁have ▁genuine ly ▁found ▁it ▁difficult ▁to ▁come ▁to ▁terms ▁with ▁the ▁r out ▁that ▁has ▁taken ▁place ▁ — ▁the ▁complete ▁vol te ▁- ▁face .	0 0 0 0 0 0 0 0 1 1 1 1 0 0 0 0 0 0 0 0 0 0 0 0 0 0 0 0	PRON VERB ADV ADV VERB PRON ADJ PART VERB ADP NOUN ADP DET NOUN NOUN ADJ VERB VERB NOUN PUNCT PUNCT DET ADJ ADJ ADJ PUNCT NOUN NOUN
It took me years to come to terms with this.	0 0 0 0 0 1 1 1 1 0	come to terms with	figurative	identical	PRON VERB PRON NOUN PART VERB ADP NOUN ADP DET	▁It ▁took ▁me ▁years ▁to ▁come ▁to ▁terms ▁with ▁this .	0 0 0 0 0 1 1 1 1 0 0	PRON VERB PRON NOUN PART VERB ADP NOUN ADP DET DET
Tonight as the family of Mark Windram come to terms with his death police officers have again warned those who steal cars that their actions all too often end in tragedy.	0 0 0 0 0 0 0 1 1 1 1 0 0 0 0 0 0 0 0 0 0 0 0 0 0 0 0 0 0 0 0	come to terms with	figurative	identical	NOUN ADP DET NOUN ADP PROPN PROPN VERB ADP NOUN ADP ADJ NOUN NOUN NOUN VERB ADV VERB DET NOUN VERB NOUN ADJ ADJ NOUN ADV ADV ADV VERB ADP NOUN	▁To night ▁as ▁the ▁family ▁of ▁Mark ▁Wind ram ▁come ▁to ▁terms ▁with ▁his ▁death ▁police ▁officers ▁have ▁again ▁warned ▁those ▁who ▁ste al ▁cars ▁that ▁their ▁actions ▁all ▁too ▁often ▁end ▁in ▁tragedy .	0 0 0 0 0 0 0 0 0 1 1 1 1 0 0 0 0 0 0 0 0 0 0 0 0 0 0 0 0 0 0 0 0 0 0	NOUN NOUN ADP DET NOUN ADP PROPN PROPN PROPN VERB ADP NOUN ADP ADJ NOUN NOUN NOUN VERB ADV VERB DET NOUN VERB VERB NOUN ADJ ADJ NOUN ADV ADV ADV VERB ADP NOUN NOUN
I wasn't coming to terms with it and didn't know what to do.	0 0 1 1 1 1 0 0 0 0 0 0 0	come to terms with	figurative	inflection	PRON VERB VERB ADP NOUN ADP PRON CCONJ VERB VERB NOUN PART VERB	▁I ▁was n ' t ▁coming ▁to ▁terms ▁with ▁it ▁and ▁did n ' t ▁know ▁what ▁to ▁do .	0 0 0 0 0 1 1 1 1 0 0 0 0 0 0 0 0 0 0 0	PRON VERB VERB VERB VERB VERB ADP NOUN ADP PRON CCONJ VERB VERB VERB VERB VERB NOUN PART VERB VERB
Other indigenous elderly people with set ideas may find it hard to come to terms with living in a multiracial community, and being offered care by a member of a minority group.	0 0 0 0 0 0 0 0 0 0 0 0 1 1 1 1 0 0 0 0 0 0 0 0 0 0 0 0 0 0 0 0	come to terms with	figurative	identical	ADJ ADJ ADJ NOUN ADP VERB NOUN VERB VERB PRON ADJ PART VERB ADP NOUN ADP VERB ADP DET ADJ NOUN CCONJ VERB VERB NOUN ADP DET NOUN ADP DET NOUN NOUN	▁Other ▁indigenous ▁elderly ▁people ▁with ▁set ▁ideas ▁may ▁find ▁it ▁hard ▁to ▁come ▁to ▁terms ▁with ▁living ▁in ▁a ▁multi ra cial ▁community , ▁and ▁being ▁offered ▁care ▁by ▁a ▁member ▁of ▁a ▁minority ▁group .	0 0 0 0 0 0 0 0 0 0 0 0 1 1 1 1 0 0 0 0 0 0 0 0 0 0 0 0 0 0 0 0 0 0 0 0	ADJ ADJ ADJ NOUN ADP VERB NOUN VERB VERB PRON ADJ PART VERB ADP NOUN ADP VERB ADP DET ADJ ADJ ADJ NOUN NOUN CCONJ VERB VERB NOUN ADP DET NOUN ADP DET NOUN NOUN NOUN
