Staff are still coming to terms with the decision to close the main part of the Junction factory within two years, making 100 workers redundant.	0 0 0 1 1 1 1 0 0 0 0 0 0 0 0 0 0 0 0 0 0 0 0 0 0	come to terms with	figurative	inflection	NOUN VERB ADV VERB ADP NOUN ADP DET NOUN PART VERB DET ADJ NOUN ADP DET PROPN NOUN ADP NUM NOUN VERB NUM NOUN ADJ	▁Staff ▁are ▁still ▁coming ▁to ▁terms ▁with ▁the ▁decision ▁to ▁close ▁the ▁main ▁part ▁of ▁the ▁Jun ction ▁factory ▁within ▁two ▁years , ▁making ▁100 ▁workers ▁redundant .	0 0 0 1 1 1 1 0 0 0 0 0 0 0 0 0 0 0 0 0 0 0 0 0 0 0 0 0	NOUN VERB ADV VERB ADP NOUN ADP DET NOUN PART VERB DET ADJ NOUN ADP DET PROPN PROPN NOUN ADP NUM NOUN NOUN VERB NUM NOUN ADJ ADJ
Marilyn Monroe in the 1953 film ‘ How to Marry a Millionaire’ is seen in her cabin on board the Queen Mary trying to come to terms with her Travellers Letter of Credit.	0 0 0 0 0 0 0 0 0 0 0 0 0 0 0 0 0 0 0 0 0 0 0 0 1 1 1 1 0 0 0 0 0	come to terms with	figurative	identical	PROPN PROPN ADP DET NUM NOUN NOUN ADV PART VERB DET PROPN VERB VERB ADP ADJ NOUN ADP NOUN DET PROPN PROPN VERB PART VERB ADP NOUN ADP ADJ PROPN PROPN ADP PROPN	▁M arily n ▁Mon ro e ▁in ▁the ▁1953 ▁film ▁ ‘ ▁How ▁to ▁Mar ry ▁a ▁Million aire ’ ▁is ▁seen ▁in ▁her ▁cabin ▁on ▁board ▁the ▁Queen ▁Mary ▁trying ▁to ▁come ▁to ▁terms ▁with ▁her ▁Traveller s ▁Letter ▁of ▁Credit .	0 0 0 0 0 0 0 0 0 0 0 0 0 0 0 0 0 0 0 0 0 0 0 0 0 0 0 0 0 0 0 0 1 1 1 1 0 0 0 0 0 0 0	PROPN PROPN PROPN PROPN PROPN PROPN ADP DET NUM NOUN NOUN NOUN ADV PART VERB VERB DET PROPN PROPN PROPN VERB VERB ADP ADJ NOUN ADP NOUN DET PROPN PROPN VERB PART VERB ADP NOUN ADP ADJ PROPN PROPN PROPN ADP PROPN PROPN
But, by whichever door they enter they will then need to come to terms with the whole gospel, which applies equally to all.	0 0 0 0 0 0 0 0 0 0 0 1 1 1 1 0 0 0 0 0 0 0 0	come to terms with	figurative	identical	CCONJ ADP ADJ NOUN PRON VERB PRON VERB ADV VERB PART VERB ADP NOUN ADP DET ADJ NOUN ADJ VERB ADV ADP DET	▁But , ▁by ▁which ever ▁door ▁they ▁enter ▁they ▁will ▁then ▁need ▁to ▁come ▁to ▁terms ▁with ▁the ▁whole ▁go s pel , ▁which ▁applies ▁equally ▁to ▁all .	0 0 0 0 0 0 0 0 0 0 0 0 0 1 1 1 1 0 0 0 0 0 0 0 0 0 0 0 0	CCONJ CCONJ ADP ADJ ADJ NOUN PRON VERB PRON VERB ADV VERB PART VERB ADP NOUN ADP DET ADJ NOUN NOUN NOUN NOUN ADJ VERB ADV ADP DET DET
Merkel has come to terms with Germany ’s position – and that it must act to preserve the unity of the whole.	0 0 1 1 1 1 0 0 0 0 0 0 0 0 0 0 0 0 0 0 0 0	come to terms with	figurative	identical	NOUN VERB VERB ADP NOUN ADP PROPN PART NOUN PUNCT CCONJ ADP PRON VERB VERB PART VERB DET NOUN ADP DET NOUN	▁Mer kel ▁has ▁come ▁to ▁terms ▁with ▁Germany ▁ ’ s ▁position ▁ – ▁and ▁that ▁it ▁must ▁act ▁to ▁preserve ▁the ▁unity ▁of ▁the ▁whole .	0 0 0 1 1 1 1 0 0 0 0 0 0 0 0 0 0 0 0 0 0 0 0 0 0 0 0	NOUN NOUN VERB VERB ADP NOUN ADP PROPN PART PART PART NOUN PUNCT PUNCT CCONJ ADP PRON VERB VERB PART VERB DET NOUN ADP DET NOUN NOUN
Some of it is about coming to terms with reality.	0 0 0 0 0 1 1 1 1 0	come to terms with	figurative	inflection	DET ADP PRON VERB ADP VERB ADP NOUN ADP NOUN	▁Some ▁of ▁it ▁is ▁about ▁coming ▁to ▁terms ▁with ▁reality .	0 0 0 0 0 1 1 1 1 0 0	DET ADP PRON VERB ADP VERB ADP NOUN ADP NOUN NOUN
On the other hand, virtually all the demands which the Anglicans had been pressing for in their attempts to come to terms with James, such as those made by the bishops in their meeting with the King on 3 October, did.	0 0 0 0 0 0 0 0 0 0 0 0 0 0 0 0 0 0 0 1 1 1 1 0 0 0 0 0 0 0 0 0 0 0 0 0 0 0 0 0 0	come to terms with	figurative	identical	ADP DET ADJ NOUN ADV ADJ DET NOUN ADJ DET PROPN VERB VERB VERB ADP ADP ADJ NOUN PART VERB ADP NOUN ADP PROPN ADJ ADP DET VERB ADP DET NOUN ADP ADJ NOUN ADP DET PROPN ADP NUM PROPN VERB	▁On ▁the ▁other ▁hand , ▁virtual ly ▁all ▁the ▁demands ▁which ▁the ▁An gli can s ▁had ▁been ▁pressing ▁for ▁in ▁their ▁attempts ▁to ▁come ▁to ▁terms ▁with ▁James , ▁such ▁as ▁those ▁made ▁by ▁the ▁bis hop s ▁in ▁their ▁meeting ▁with ▁the ▁King ▁on ▁3 ▁October , ▁did .	0 0 0 0 0 0 0 0 0 0 0 0 0 0 0 0 0 0 0 0 0 0 0 0 1 1 1 1 0 0 0 0 0 0 0 0 0 0 0 0 0 0 0 0 0 0 0 0 0 0 0	ADP DET ADJ NOUN NOUN ADV ADV ADJ DET NOUN ADJ DET PROPN PROPN PROPN PROPN VERB VERB VERB ADP ADP ADJ NOUN PART VERB ADP NOUN ADP PROPN PROPN ADJ ADP DET VERB ADP DET NOUN NOUN NOUN ADP ADJ NOUN ADP DET PROPN ADP NUM PROPN PROPN VERB VERB
The local community is still coming to terms with the loss of the Trident contract four months ago.	0 0 0 0 0 1 1 1 1 0 0 0 0 0 0 0 0 0	come to terms with	figurative	inflection	DET ADJ NOUN VERB ADV VERB ADP NOUN ADP DET NOUN ADP DET PROPN NOUN NUM NOUN ADV	▁The ▁local ▁community ▁is ▁still ▁coming ▁to ▁terms ▁with ▁the ▁loss ▁of ▁the ▁Tri dent ▁contract ▁four ▁months ▁ago .	0 0 0 0 0 1 1 1 1 0 0 0 0 0 0 0 0 0 0 0	DET ADJ NOUN VERB ADV VERB ADP NOUN ADP DET NOUN ADP DET PROPN PROPN NOUN NUM NOUN ADV ADV
Since they have been in Brazil things have not been easy but they have settled in well and are slowly coming to terms with the language.	0 0 0 0 0 0 0 0 0 0 0 0 0 0 0 0 0 0 0 0 1 1 1 1 0 0	come to terms with	figurative	inflection	ADP PRON VERB VERB ADP PROPN NOUN VERB ADV VERB ADJ CCONJ PRON VERB VERB PART ADV CCONJ VERB ADV VERB ADP NOUN ADP DET NOUN	▁Since ▁they ▁have ▁been ▁in ▁Brazil ▁things ▁have ▁not ▁been ▁easy ▁but ▁they ▁have ▁settled ▁in ▁well ▁and ▁are ▁slowly ▁coming ▁to ▁terms ▁with ▁the ▁language .	0 0 0 0 0 0 0 0 0 0 0 0 0 0 0 0 0 0 0 0 1 1 1 1 0 0 0	ADP PRON VERB VERB ADP PROPN NOUN VERB ADV VERB ADJ CCONJ PRON VERB VERB PART ADV CCONJ VERB ADV VERB ADP NOUN ADP DET NOUN NOUN
It was, however, less strident in its opposition to African nationalism than its sister paper, the East African Standard of Nairobi, and when TANU won the elections in 1958, it shifted its ground, coming to terms with political change and lending its support to African nationalism as represented by what it regarded as the moderation of Nyerere.	0 0 0 0 0 0 0 0 0 0 0 0 0 0 0 0 0 0 0 0 0 0 0 0 0 0 0 0 0 0 0 0 0 1 1 1 1 0 0 0 0 0 0 0 0 0 0 0 0 0 0 0 0 0 0 0 0	come to terms with	figurative	inflection	PRON VERB ADV ADJ ADJ ADP ADJ NOUN ADP ADJ NOUN ADP ADJ NOUN NOUN DET PROPN PROPN PROPN ADP PROPN CCONJ ADV PROPN VERB DET NOUN ADP NUM PRON VERB ADJ NOUN VERB ADP NOUN ADP ADJ NOUN CCONJ VERB ADJ NOUN ADP ADJ NOUN ADP VERB ADP NOUN PRON VERB ADP DET NOUN ADP PROPN	▁It ▁was , ▁however , ▁less ▁str ident ▁in ▁its ▁opposition ▁to ▁African ▁national ism ▁than ▁its ▁sister ▁paper , ▁the ▁East ▁African ▁Standard ▁of ▁Nairobi , ▁and ▁when ▁ TAN U ▁won ▁the ▁elections ▁in ▁1958 , ▁it ▁shifted ▁its ▁ground , ▁coming ▁to ▁terms ▁with ▁political ▁change ▁and ▁lending ▁its ▁support ▁to ▁African ▁national ism ▁as ▁represented ▁by ▁what ▁it ▁regarded ▁as ▁the ▁moderation ▁of ▁Ny er ere .	0 0 0 0 0 0 0 0 0 0 0 0 0 0 0 0 0 0 0 0 0 0 0 0 0 0 0 0 0 0 0 0 0 0 0 0 0 0 0 0 0 0 0 1 1 1 1 0 0 0 0 0 0 0 0 0 0 0 0 0 0 0 0 0 0 0 0 0 0 0 0	PRON VERB VERB ADV ADV ADJ ADJ ADJ ADP ADJ NOUN ADP ADJ NOUN NOUN ADP ADJ NOUN NOUN NOUN DET PROPN PROPN PROPN ADP PROPN PROPN CCONJ ADV PROPN PROPN PROPN VERB DET NOUN ADP NUM NUM PRON VERB ADJ NOUN NOUN VERB ADP NOUN ADP ADJ NOUN CCONJ VERB ADJ NOUN ADP ADJ NOUN NOUN ADP VERB ADP NOUN PRON VERB ADP DET NOUN ADP PROPN PROPN PROPN PROPN
In a further attempt to come to terms with it, a number of social theorists have concentrated on exactly the sort of counterfactual analysis that we found used, but not discussed, by Poulantzas.	0 0 0 0 0 1 1 1 1 0 0 0 0 0 0 0 0 0 0 0 0 0 0 0 0 0 0 0 0 0 0 0 0	come to terms with	figurative	identical	ADP DET ADJ NOUN PART VERB ADP NOUN ADP PRON DET NOUN ADP ADJ NOUN VERB VERB ADP ADV DET NOUN ADP ADJ NOUN ADP PRON VERB VERB CCONJ ADV VERB ADP PROPN	▁In ▁a ▁further ▁attempt ▁to ▁come ▁to ▁terms ▁with ▁it , ▁a ▁number ▁of ▁social ▁the or ists ▁have ▁concentrated ▁on ▁exactly ▁the ▁sort ▁of ▁counter factual ▁analysis ▁that ▁we ▁found ▁used , ▁but ▁not ▁discussed , ▁by ▁P oul ant za s .	0 0 0 0 0 1 1 1 1 0 0 0 0 0 0 0 0 0 0 0 0 0 0 0 0 0 0 0 0 0 0 0 0 0 0 0 0 0 0 0 0 0 0 0	ADP DET ADJ NOUN PART VERB ADP NOUN ADP PRON PRON DET NOUN ADP ADJ NOUN NOUN NOUN VERB VERB ADP ADV DET NOUN ADP ADJ ADJ NOUN ADP PRON VERB VERB VERB CCONJ ADV VERB VERB ADP PROPN PROPN PROPN PROPN PROPN PROPN
The Euro - Left is now looking beyond traditional social democracy, while the Labour Party struggles to come to terms with the old model.	0 0 0 0 0 0 0 0 0 0 0 0 0 0 0 0 0 1 1 1 1 0 0 0	come to terms with	figurative	identical	DET PROPN PUNCT PROPN VERB ADV VERB ADP ADJ ADJ NOUN ADP DET PROPN PROPN VERB PART VERB ADP NOUN ADP DET ADJ NOUN	▁The ▁Euro ▁- ▁Left ▁is ▁now ▁looking ▁beyond ▁traditional ▁social ▁democracy , ▁while ▁the ▁Labour ▁Party ▁struggle s ▁to ▁come ▁to ▁terms ▁with ▁the ▁old ▁model .	0 0 0 0 0 0 0 0 0 0 0 0 0 0 0 0 0 0 0 1 1 1 1 0 0 0 0	DET PROPN PUNCT PROPN VERB ADV VERB ADP ADJ ADJ NOUN NOUN ADP DET PROPN PROPN VERB VERB PART VERB ADP NOUN ADP DET ADJ NOUN NOUN
Yet many of them come to terms with it magnificently, trying so hard not to add their pain to that of their children, in a situation that sometimes neither of them can alter.	0 0 0 0 1 1 1 1 0 0 0 0 0 0 0 0 0 0 0 0 0 0 0 0 0 0 0 0 0 0 0 0 0	come to terms with	figurative	identical	ADV ADJ ADP PRON VERB ADP NOUN ADP PRON ADV VERB ADV ADV ADV PART VERB ADJ NOUN ADP DET ADP ADJ NOUN ADP DET NOUN ADP ADV DET ADP PRON VERB VERB	▁Yet ▁many ▁of ▁them ▁come ▁to ▁terms ▁with ▁it ▁magnificent ly , ▁trying ▁so ▁hard ▁not ▁to ▁add ▁their ▁pain ▁to ▁that ▁of ▁their ▁children , ▁in ▁a ▁situation ▁that ▁sometimes ▁neither ▁of ▁them ▁can ▁alter .	0 0 0 0 1 1 1 1 0 0 0 0 0 0 0 0 0 0 0 0 0 0 0 0 0 0 0 0 0 0 0 0 0 0 0 0 0	ADV ADJ ADP PRON VERB ADP NOUN ADP PRON ADV ADV ADV VERB ADV ADV ADV PART VERB ADJ NOUN ADP DET ADP ADJ NOUN NOUN ADP DET NOUN ADP ADV DET ADP PRON VERB VERB VERB
To fully address the question of the moral and ethical base of a new form of Chinese governance, China ’s government and its people must be able to look back freely and come to terms with their recent history : the Great Leap Forward, the Cultural ~ Revolution, the events of 1989, Tibet, and other sensitive issues.	0 0 0 0 0 0 0 0 0 0 0 0 0 0 0 0 0 0 0 0 0 0 0 0 0 0 0 0 0 0 0 0 1 1 1 1 0 0 0 0 0 0 0 0 0 0 0 0 0 0 0 0 0 0 0 0 0	come to terms with	figurative	identical	PART ADV VERB DET NOUN ADP DET ADJ CCONJ ADJ NOUN ADP DET ADJ NOUN ADP ADJ NOUN PROPN PART NOUN CCONJ ADJ NOUN VERB VERB ADJ PART VERB ADV ADV CCONJ VERB ADP NOUN ADP ADJ ADJ NOUN PUNCT DET PROPN PROPN PROPN DET PROPN PUNCT PROPN DET NOUN ADP NUM PROPN CCONJ ADJ ADJ NOUN	▁To ▁fully ▁address ▁the ▁question ▁of ▁the ▁moral ▁and ▁ethical ▁base ▁of ▁a ▁new ▁form ▁of ▁Chinese ▁governance , ▁China ▁ ’ s ▁government ▁and ▁its ▁people ▁must ▁be ▁able ▁to ▁look ▁back ▁freely ▁and ▁come ▁to ▁terms ▁with ▁their ▁recent ▁history ▁ : ▁the ▁Great ▁Le ap ▁Forward , ▁the ▁Cultural ▁ ~ ▁Revolution , ▁the ▁events ▁of ▁1989, ▁Tibet , ▁and ▁other ▁sensitive ▁issues .	0 0 0 0 0 0 0 0 0 0 0 0 0 0 0 0 0 0 0 0 0 0 0 0 0 0 0 0 0 0 0 0 0 0 0 1 1 1 1 0 0 0 0 0 0 0 0 0 0 0 0 0 0 0 0 0 0 0 0 0 0 0 0 0 0 0 0	PART ADV VERB DET NOUN ADP DET ADJ CCONJ ADJ NOUN ADP DET ADJ NOUN ADP ADJ NOUN NOUN PROPN PART PART PART NOUN CCONJ ADJ NOUN VERB VERB ADJ PART VERB ADV ADV CCONJ VERB ADP NOUN ADP ADJ ADJ NOUN PUNCT PUNCT DET PROPN PROPN PROPN PROPN PROPN DET PROPN PUNCT PUNCT PROPN PROPN DET NOUN ADP NUM PROPN PROPN CCONJ ADJ ADJ NOUN NOUN
The Waterdance, which charts the struggles of a novelist trying to come to terms with sudden paralysis, also drew great praise.	0 0 0 0 0 0 0 0 0 0 0 1 1 1 1 0 0 0 0 0 0	come to terms with	figurative	identical	DET PROPN ADJ VERB DET NOUN ADP DET NOUN VERB PART VERB ADP NOUN ADP ADJ NOUN ADV VERB ADJ NOUN	▁The ▁Water d ance , ▁which ▁chart s ▁the ▁struggle s ▁of ▁a ▁novel ist ▁trying ▁to ▁come ▁to ▁terms ▁with ▁sudden ▁paralysis , ▁also ▁drew ▁great ▁praise .	0 0 0 0 0 0 0 0 0 0 0 0 0 0 0 0 0 1 1 1 1 0 0 0 0 0 0 0 0	DET PROPN PROPN PROPN PROPN ADJ VERB VERB DET NOUN NOUN ADP DET NOUN NOUN VERB PART VERB ADP NOUN ADP ADJ NOUN NOUN ADV VERB ADJ NOUN NOUN
In milder manifestations, counselling in its true sense may help the individual concerned either to overcome or to come to terms with the tendency.	0 0 0 0 0 0 0 0 0 0 0 0 0 0 0 0 0 0 1 1 1 1 0 0	come to terms with	figurative	identical	ADP NOUN NOUN VERB ADP ADJ ADJ NOUN VERB VERB DET NOUN ADJ ADV PART VERB CCONJ PART VERB ADP NOUN ADP DET NOUN	▁In ▁mild er ▁manifestations , ▁counselling ▁in ▁its ▁true ▁sense ▁may ▁help ▁the ▁individual ▁concerned ▁either ▁to ▁overcome ▁or ▁to ▁come ▁to ▁terms ▁with ▁the ▁tendency .	0 0 0 0 0 0 0 0 0 0 0 0 0 0 0 0 0 0 0 0 1 1 1 1 0 0 0	ADP NOUN NOUN NOUN NOUN VERB ADP ADJ ADJ NOUN VERB VERB DET NOUN ADJ ADV PART VERB CCONJ PART VERB ADP NOUN ADP DET NOUN NOUN
Finding the right form for the new extension presented Pei with a major challenge : he had to do justice to the architects ’ great name while coming to terms with the available space – a space overshadowed by the Zeughaus yet prominently conspicuous at the transition to Museum ~ Island.	0 0 0 0 0 0 0 0 0 0 0 0 0 0 0 0 0 0 0 0 0 0 0 0 0 0 0 1 1 1 1 0 0 0 0 0 0 0 0 0 0 0 0 0 0 0 0 0 0 0 0	come to terms with	figurative	inflection	VERB DET ADJ NOUN ADP DET ADJ NOUN VERB PROPN ADP DET ADJ NOUN PUNCT PRON VERB PART VERB NOUN ADP DET NOUN PART ADJ NOUN ADP VERB ADP NOUN ADP DET ADJ NOUN PUNCT DET NOUN VERB ADP DET PROPN CCONJ ADV ADJ ADP DET NOUN ADP PROPN PUNCT PROPN	▁Finding ▁the ▁right ▁form ▁for ▁the ▁new ▁extension ▁presented ▁Pe i ▁with ▁a ▁major ▁challenge ▁ : ▁he ▁had ▁to ▁do ▁justice ▁to ▁the ▁architect s ▁ ’ ▁great ▁name ▁while ▁coming ▁to ▁terms ▁with ▁the ▁available ▁space ▁ – ▁a ▁space ▁overshadow ed ▁by ▁the ▁Ze ugh au s ▁yet ▁prominent ly ▁conspicuous ▁at ▁the ▁transition ▁to ▁M use um ▁ ~ ▁Island .	0 0 0 0 0 0 0 0 0 0 0 0 0 0 0 0 0 0 0 0 0 0 0 0 0 0 0 0 0 0 0 1 1 1 1 0 0 0 0 0 0 0 0 0 0 0 0 0 0 0 0 0 0 0 0 0 0 0 0 0 0 0 0 0 0	VERB DET ADJ NOUN ADP DET ADJ NOUN VERB PROPN PROPN ADP DET ADJ NOUN PUNCT PUNCT PRON VERB PART VERB NOUN ADP DET NOUN NOUN PART PART ADJ NOUN ADP VERB ADP NOUN ADP DET ADJ NOUN PUNCT PUNCT DET NOUN VERB VERB ADP DET PROPN PROPN PROPN PROPN CCONJ ADV ADV ADJ ADP DET NOUN ADP PROPN PROPN PROPN PUNCT PUNCT PROPN PROPN
We 're articulate enough to fool ourselves that we 're nice people, but there's a strong undercurrent to our thinking that encourages us to view people with a disability as lesser, and until we come to terms with that, we will never have a proper support system.	0 0 0 0 0 0 0 0 0 0 0 0 0 0 0 0 0 0 0 0 0 0 0 0 0 0 0 0 0 0 0 0 0 0 1 1 1 1 0 0 0 0 0 0 0 0 0	come to terms with	figurative	identical	PRON VERB VERB ADJ PART VERB PRON ADP PRON VERB ADJ NOUN CCONJ ADV DET ADJ NOUN ADP ADJ NOUN ADJ VERB PRON PART VERB NOUN ADP DET NOUN ADP ADJ CCONJ ADP PRON VERB ADP NOUN ADP DET PRON VERB ADV VERB DET ADJ NOUN NOUN	▁We ▁' re ▁articulat e ▁enough ▁to ▁fool ▁ourselves ▁that ▁we ▁' re ▁nice ▁people , ▁but ▁there ' s ▁a ▁strong ▁under current ▁to ▁our ▁thinking ▁that ▁encourages ▁us ▁to ▁view ▁people ▁with ▁a ▁disability ▁as ▁lesser , ▁and ▁until ▁we ▁come ▁to ▁terms ▁with ▁that , ▁we ▁will ▁never ▁have ▁a ▁proper ▁support ▁system .	0 0 0 0 0 0 0 0 0 0 0 0 0 0 0 0 0 0 0 0 0 0 0 0 0 0 0 0 0 0 0 0 0 0 0 0 0 0 0 0 0 0 1 1 1 1 0 0 0 0 0 0 0 0 0 0 0	PRON VERB VERB VERB VERB ADJ PART VERB PRON ADP PRON VERB VERB ADJ NOUN NOUN CCONJ ADV ADV ADV DET ADJ NOUN NOUN ADP ADJ NOUN ADJ VERB PRON PART VERB NOUN ADP DET NOUN ADP ADJ ADJ CCONJ ADP PRON VERB ADP NOUN ADP DET DET PRON VERB ADV VERB DET ADJ NOUN NOUN NOUN
The hon. Gentleman will have to come to terms with the fact that there is an energy market to be supplied.	0 0 0 0 0 0 1 1 1 1 0 0 0 0 0 0 0 0 0 0 0	come to terms with	figurative	identical	DET NOUN PROPN VERB VERB PART VERB ADP NOUN ADP DET NOUN ADP ADV VERB DET NOUN NOUN PART VERB VERB	▁The ▁ hon . ▁Gen tle man ▁will ▁have ▁to ▁come ▁to ▁terms ▁with ▁the ▁fact ▁that ▁there ▁is ▁an ▁energy ▁market ▁to ▁be ▁supplied .	0 0 0 0 0 0 0 0 0 0 1 1 1 1 0 0 0 0 0 0 0 0 0 0 0 0	DET NOUN NOUN NOUN PROPN PROPN PROPN VERB VERB PART VERB ADP NOUN ADP DET NOUN ADP ADV VERB DET NOUN NOUN PART VERB VERB VERB
Would he be able to come to terms with them, as she, herself, had begun to, albeit reluctantly?	0 0 0 0 0 1 1 1 1 0 0 0 0 0 0 0 0 0	come to terms with	figurative	identical	VERB PRON VERB ADJ PART VERB ADP NOUN ADP PRON ADP PRON PRON VERB VERB PART ADP ADV	▁Would ▁he ▁be ▁able ▁to ▁come ▁to ▁terms ▁with ▁them , ▁as ▁she , ▁herself , ▁had ▁begun ▁to , ▁al beit ▁reluctant ly ?	0 0 0 0 0 1 1 1 1 0 0 0 0 0 0 0 0 0 0 0 0 0 0 0 0	VERB PRON VERB ADJ PART VERB ADP NOUN ADP PRON PRON ADP PRON PRON PRON PRON VERB VERB PART PART ADP ADP ADV ADV ADV
The leading Coalitionists in the Conservative Party - Austen Chamberlain and Birkenhead - had, perforce, to come to terms with Baldwin, and sustained him as unwillingly as Lloyd George accepted Asquith's leadership.	0 0 0 0 0 0 0 0 0 0 0 0 0 0 0 0 1 1 1 1 0 0 0 0 0 0 0 0 0 0 0 0	come to terms with	figurative	identical	DET VERB PROPN ADP DET PROPN PROPN PUNCT PROPN PROPN CCONJ PROPN PUNCT VERB NOUN PART VERB ADP NOUN ADP PROPN CCONJ VERB PRON ADV ADV ADP PROPN PROPN VERB PROPN NOUN	▁The ▁leading ▁Coal ition ists ▁in ▁the ▁C onservative ▁Party ▁- ▁A us ten ▁Chamber lain ▁and ▁B ir ken head ▁- ▁had , ▁per force , ▁to ▁come ▁to ▁terms ▁with ▁Bald win , ▁and ▁sustained ▁him ▁as ▁unwilling ly ▁as ▁Lloyd ▁George ▁accepted ▁As qui th ' s ▁leadership .	0 0 0 0 0 0 0 0 0 0 0 0 0 0 0 0 0 0 0 0 0 0 0 0 0 0 0 0 1 1 1 1 0 0 0 0 0 0 0 0 0 0 0 0 0 0 0 0 0 0 0 0	DET VERB PROPN PROPN PROPN ADP DET PROPN PROPN PROPN PUNCT PROPN PROPN PROPN PROPN PROPN CCONJ PROPN PROPN PROPN PROPN PUNCT VERB VERB NOUN NOUN NOUN PART VERB ADP NOUN ADP PROPN PROPN PROPN CCONJ VERB PRON ADV ADV ADV ADP PROPN PROPN VERB PROPN PROPN PROPN PROPN PROPN NOUN NOUN
Her sister's illness had taken its toll on her looks and they had all spent some very traumatic moments helping her to come to terms with the debilitating condition which had now rendered her legs virtually useless.	0 0 0 0 0 0 0 0 0 0 0 0 0 0 0 0 0 0 0 0 0 0 1 1 1 1 0 0 0 0 0 0 0 0 0 0 0	come to terms with	figurative	identical	ADJ NOUN NOUN VERB VERB ADJ NOUN ADP ADJ NOUN CCONJ PRON VERB DET VERB DET ADV ADJ NOUN VERB PRON PART VERB ADP NOUN ADP DET VERB NOUN ADJ VERB ADV VERB ADJ NOUN ADV ADJ	▁Her ▁sister ' s ▁illness ▁had ▁taken ▁its ▁toll ▁on ▁her ▁looks ▁and ▁they ▁had ▁all ▁spent ▁some ▁very ▁traumati c ▁moment s ▁help ing ▁her ▁to ▁come ▁to ▁terms ▁with ▁the ▁de bil it ating ▁condition ▁which ▁had ▁now ▁rendered ▁her ▁legs ▁virtual ly ▁useless .	0 0 0 0 0 0 0 0 0 0 0 0 0 0 0 0 0 0 0 0 0 0 0 0 0 0 0 1 1 1 1 0 0 0 0 0 0 0 0 0 0 0 0 0 0 0 0	ADJ NOUN NOUN NOUN NOUN VERB VERB ADJ NOUN ADP ADJ NOUN CCONJ PRON VERB DET VERB DET ADV ADJ ADJ NOUN NOUN VERB VERB PRON PART VERB ADP NOUN ADP DET VERB VERB VERB VERB NOUN ADJ VERB ADV VERB ADJ NOUN ADV ADV ADJ ADJ
They 've been trying to come to terms with what's happened ever since.	0 0 0 0 0 1 1 1 1 0 0 0 0	come to terms with	figurative	identical	PRON VERB VERB VERB PART VERB ADP NOUN ADP NOUN VERB ADV ADV	▁They ▁' ve ▁been ▁trying ▁to ▁come ▁to ▁terms ▁with ▁what ' s ▁happened ▁ever ▁since .	0 0 0 0 0 0 1 1 1 1 0 0 0 0 0 0 0	PRON VERB VERB VERB VERB PART VERB ADP NOUN ADP NOUN NOUN NOUN VERB ADV ADV ADV
In this situation he asks, how do we come to terms with the event, with continuities and discontinuities, in short with history as difference and not just the story of sameness?	0 0 0 0 0 0 0 0 1 1 1 1 0 0 0 0 0 0 0 0 0 0 0 0 0 0 0 0 0 0 0	come to terms with	figurative	identical	ADP DET NOUN PRON VERB ADV VERB PRON VERB ADP NOUN ADP DET NOUN ADP NOUN CCONJ NOUN ADP ADJ ADP NOUN ADP NOUN CCONJ ADV ADV DET NOUN ADP NOUN	▁In ▁this ▁situation ▁he ▁asks , ▁how ▁do ▁we ▁come ▁to ▁terms ▁with ▁the ▁event , ▁with ▁ continu ities ▁and ▁discontinu ities , ▁in ▁short ▁with ▁history ▁as ▁difference ▁and ▁not ▁just ▁the ▁story ▁of ▁same ness ?	0 0 0 0 0 0 0 0 0 1 1 1 1 0 0 0 0 0 0 0 0 0 0 0 0 0 0 0 0 0 0 0 0 0 0 0 0 0 0	ADP DET NOUN PRON VERB VERB ADV VERB PRON VERB ADP NOUN ADP DET NOUN NOUN ADP NOUN NOUN NOUN CCONJ NOUN NOUN NOUN ADP ADJ ADP NOUN ADP NOUN CCONJ ADV ADV DET NOUN ADP NOUN NOUN NOUN
Furthermore, he made real attempts to come to terms with the Emperor, and it seemed likely that the papal imperial conflict would now be resolved.	0 0 0 0 0 0 1 1 1 1 0 0 0 0 0 0 0 0 0 0 0 0 0 0 0	come to terms with	figurative	identical	ADV PRON VERB ADJ NOUN PART VERB ADP NOUN ADP DET PROPN CCONJ PRON VERB ADJ ADP DET ADJ ADJ NOUN VERB ADV VERB VERB	▁Furthermore , ▁he ▁made ▁real ▁attempts ▁to ▁come ▁to ▁terms ▁with ▁the ▁E mper or , ▁and ▁it ▁seemed ▁likely ▁that ▁the ▁p ap al ▁imp erial ▁conflict ▁would ▁now ▁be ▁resolved .	0 0 0 0 0 0 0 1 1 1 1 0 0 0 0 0 0 0 0 0 0 0 0 0 0 0 0 0 0 0 0 0 0	ADV ADV PRON VERB ADJ NOUN PART VERB ADP NOUN ADP DET PROPN PROPN PROPN PROPN CCONJ PRON VERB ADJ ADP DET ADJ ADJ ADJ ADJ ADJ NOUN VERB ADV VERB VERB VERB
For the English there are only two ways of coming to terms with the genius and the " great man " : either democratically in the manner of Buckle or religiously in the manner of Carlyle.	0 0 0 0 0 0 0 0 0 1 1 1 1 0 0 0 0 0 0 0 0 0 0 0 0 0 0 0 0 0 0 0 0 0 0 0	come to terms with	figurative	inflection	ADP DET PROPN ADV VERB ADV NUM NOUN ADP VERB ADP NOUN ADP DET NOUN CCONJ DET PUNCT ADJ NOUN PUNCT PUNCT CCONJ ADV ADP DET NOUN ADP PROPN CCONJ ADV ADP DET NOUN ADP PROPN	▁For ▁the ▁English ▁there ▁are ▁only ▁two ▁ways ▁of ▁coming ▁to ▁terms ▁with ▁the ▁g enius ▁and ▁the ▁" ▁great ▁man ▁" ▁ : ▁either ▁democratic ally ▁in ▁the ▁manner ▁of ▁B uck le ▁or ▁religious ly ▁in ▁the ▁manner ▁of ▁Car ly le .	0 0 0 0 0 0 0 0 0 1 1 1 1 0 0 0 0 0 0 0 0 0 0 0 0 0 0 0 0 0 0 0 0 0 0 0 0 0 0 0 0 0 0 0 0	ADP DET PROPN ADV VERB ADV NUM NOUN ADP VERB ADP NOUN ADP DET NOUN NOUN CCONJ DET PUNCT ADJ NOUN PUNCT PUNCT PUNCT CCONJ ADV ADV ADP DET NOUN ADP PROPN PROPN PROPN CCONJ ADV ADV ADP DET NOUN ADP PROPN PROPN PROPN PROPN
What I principally object to are all our dreary, smug books about growing up and coming to terms with oneself, that … are merely another brand of conformity ….	0 0 0 0 0 0 0 0 0 0 0 0 0 0 0 1 1 1 1 0 0 0 0 0 0 0 0 0 0	come to terms with	figurative	inflection	NOUN PRON ADV VERB PART VERB DET ADJ ADJ ADJ NOUN ADP VERB PART CCONJ VERB ADP NOUN ADP PRON ADP PUNCT VERB ADV DET NOUN ADP NOUN PUNCT	▁What ▁I ▁principally ▁object ▁to ▁are ▁all ▁our ▁d re ary , ▁sm ug ▁books ▁about ▁growing ▁up ▁and ▁coming ▁to ▁terms ▁with ▁one self , ▁that ▁... ▁are ▁mere ly ▁another ▁brand ▁of ▁conformity ▁... .	0 0 0 0 0 0 0 0 0 0 0 0 0 0 0 0 0 0 0 1 1 1 1 0 0 0 0 0 0 0 0 0 0 0 0 0 0	NOUN PRON ADV VERB PART VERB DET ADJ ADJ ADJ ADJ ADJ ADJ ADJ NOUN ADP VERB PART CCONJ VERB ADP NOUN ADP PRON PRON PRON ADP PUNCT VERB ADV ADV DET NOUN ADP NOUN PUNCT PUNCT
The above examples seek to reflect the magnitude of the changes in systems and procedures that local government is having to come to terms with under differing sets of recent legislation.	0 0 0 0 0 0 0 0 0 0 0 0 0 0 0 0 0 0 0 0 0 1 1 1 1 0 0 0 0 0 0	come to terms with	figurative	identical	DET ADJ NOUN VERB PART VERB DET NOUN ADP DET NOUN ADP NOUN CCONJ NOUN ADJ ADJ NOUN VERB VERB PART VERB ADP NOUN ADP ADP VERB NOUN ADP ADJ NOUN	▁The ▁above ▁examples ▁seek ▁to ▁reflect ▁the ▁magnitude ▁of ▁the ▁changes ▁in ▁systems ▁and ▁procedures ▁that ▁local ▁government ▁is ▁having ▁to ▁come ▁to ▁terms ▁with ▁under ▁differ ing ▁sets ▁of ▁recent ▁legislation .	0 0 0 0 0 0 0 0 0 0 0 0 0 0 0 0 0 0 0 0 0 1 1 1 1 0 0 0 0 0 0 0 0	DET ADJ NOUN VERB PART VERB DET NOUN ADP DET NOUN ADP NOUN CCONJ NOUN ADJ ADJ NOUN VERB VERB PART VERB ADP NOUN ADP ADP VERB VERB NOUN ADP ADJ NOUN NOUN
