Who says that London is more frantic than the provinces? she asked herself wryly, as she began to come to terms with the diversity of her work.	0 0 0 0 0 0 0 0 0 0 0 0 0 0 0 0 0 0 1 1 1 1 0 0 0 0 0	come to terms with	figurative	identical	NOUN VERB ADP PROPN VERB ADV ADJ ADP DET NOUN PRON VERB PRON ADV ADP PRON VERB PART VERB ADP NOUN ADP DET NOUN ADP ADJ NOUN	▁Who ▁says ▁that ▁London ▁is ▁more ▁fr ant ic ▁than ▁the ▁provinces ? ▁she ▁asked ▁herself ▁w ry ly , ▁as ▁she ▁began ▁to ▁come ▁to ▁terms ▁with ▁the ▁diversity ▁of ▁her ▁work .	0 0 0 0 0 0 0 0 0 0 0 0 0 0 0 0 0 0 0 0 0 0 0 0 1 1 1 1 0 0 0 0 0 0	NOUN VERB ADP PROPN VERB ADV ADJ ADJ ADJ ADP DET NOUN NOUN PRON VERB PRON ADV ADV ADV ADV ADP PRON VERB PART VERB ADP NOUN ADP DET NOUN ADP ADJ NOUN NOUN
He was potentially a useful ally and one with whom Edward needed to keep on good terms, if only because of his claim to the French throne ; but he proved unreliable and the expedition to Normandy was aborted when he suddenly came to terms with John II.	0 0 0 0 0 0 0 0 0 0 0 0 0 0 0 0 0 0 0 0 0 0 0 0 0 0 0 0 0 0 0 0 0 0 0 0 0 0 0 0 0 0 1 1 1 1 0 0	come to terms with	figurative	inflection	PRON VERB ADV DET ADJ NOUN CCONJ NUM ADP NOUN PROPN VERB PART VERB PART ADJ NOUN ADP ADV ADP ADP ADJ NOUN ADP DET ADJ NOUN PUNCT CCONJ PRON VERB ADJ CCONJ DET NOUN ADP PROPN VERB VERB ADV PRON ADV VERB ADP NOUN ADP PROPN PROPN	▁He ▁was ▁potentially ▁a ▁useful ▁ally ▁and ▁one ▁with ▁whom ▁Edward ▁needed ▁to ▁keep ▁on ▁good ▁terms , ▁if ▁only ▁because ▁of ▁his ▁claim ▁to ▁the ▁French ▁throne ▁ ; ▁but ▁he ▁proved ▁unreliable ▁and ▁the ▁expedit ion ▁to ▁Norman dy ▁was ▁a bor ted ▁when ▁he ▁suddenly ▁came ▁to ▁terms ▁with ▁John ▁II .	0 0 0 0 0 0 0 0 0 0 0 0 0 0 0 0 0 0 0 0 0 0 0 0 0 0 0 0 0 0 0 0 0 0 0 0 0 0 0 0 0 0 0 0 0 0 0 0 1 1 1 1 0 0 0	PRON VERB ADV DET ADJ NOUN CCONJ NUM ADP NOUN PROPN VERB PART VERB PART ADJ NOUN NOUN ADP ADV ADP ADP ADJ NOUN ADP DET ADJ NOUN PUNCT PUNCT CCONJ PRON VERB ADJ CCONJ DET NOUN NOUN ADP PROPN PROPN VERB VERB VERB VERB ADV PRON ADV VERB ADP NOUN ADP PROPN PROPN PROPN
But after reading reports magistrates were told the youth had had difficulty coming to terms with his father's recent death.	0 0 0 0 0 0 0 0 0 0 0 0 1 1 1 1 0 0 0 0	come to terms with	figurative	inflection	CCONJ ADP NOUN NOUN NOUN VERB VERB DET NOUN VERB VERB NOUN VERB ADP NOUN ADP ADJ NOUN ADJ NOUN	▁But ▁after ▁reading ▁reports ▁magistrate s ▁were ▁told ▁the ▁youth ▁had ▁had ▁difficulty ▁coming ▁to ▁terms ▁with ▁his ▁father ' s ▁recent ▁death .	0 0 0 0 0 0 0 0 0 0 0 0 0 1 1 1 1 0 0 0 0 0 0 0	CCONJ ADP NOUN NOUN NOUN NOUN VERB VERB DET NOUN VERB VERB NOUN VERB ADP NOUN ADP ADJ NOUN NOUN NOUN ADJ NOUN NOUN
This 28-day programme should have given you the opportunity to come to terms with your body.	0 0 0 0 0 0 0 0 0 0 1 1 1 1 0 0	come to terms with	figurative	identical	DET NUM NOUN VERB VERB VERB PRON DET NOUN PART VERB ADP NOUN ADP ADJ NOUN	▁This ▁28 - day ▁programme ▁should ▁have ▁given ▁you ▁the ▁opportunity ▁to ▁come ▁to ▁terms ▁with ▁your ▁body .	0 0 0 0 0 0 0 0 0 0 0 0 1 1 1 1 0 0 0	DET NUM NUM NUM NOUN VERB VERB VERB PRON DET NOUN PART VERB ADP NOUN ADP ADJ NOUN NOUN
Often counselling can help them come to terms with a lot of this and help them set out a means to try and change in the future.’	0 0 0 0 0 1 1 1 1 0 0 0 0 0 0 0 0 0 0 0 0 0 0 0 0 0 0	come to terms with	figurative	identical	ADV VERB VERB VERB PRON VERB ADP NOUN ADP DET NOUN ADP DET CCONJ VERB PRON VERB PART DET NOUN PART VERB CCONJ VERB ADP DET NOUN	▁Often ▁counselling ▁can ▁help ▁them ▁come ▁to ▁terms ▁with ▁a ▁lot ▁of ▁this ▁and ▁help ▁them ▁set ▁out ▁a ▁means ▁to ▁try ▁and ▁change ▁in ▁the ▁future . ’	0 0 0 0 0 1 1 1 1 0 0 0 0 0 0 0 0 0 0 0 0 0 0 0 0 0 0 0 0	ADV VERB VERB VERB PRON VERB ADP NOUN ADP DET NOUN ADP DET CCONJ VERB PRON VERB PART DET NOUN PART VERB CCONJ VERB ADP DET NOUN NOUN NOUN
While orthodox Marxist — Leninism of the Comintern period offered no serious accounts of liberal democratic practices and institutions, neo - Marxists have tried to come to terms with phenomena which classical Marxists did not anticipate, especially the advent of some form of mixed economy and the growth of an extended welfare state in every advanced capitalist society.	0 0 0 0 0 0 0 0 0 0 0 0 0 0 0 0 0 0 0 0 0 0 0 0 0 1 1 1 1 0 0 0 0 0 0 0 0 0 0 0 0 0 0 0 0 0 0 0 0 0 0 0 0 0 0 0 0 0	come to terms with	figurative	identical	ADP ADJ PROPN PUNCT NOUN ADP DET ADJ NOUN VERB DET ADJ NOUN ADP ADJ ADJ NOUN CCONJ NOUN NOUN PUNCT NOUN VERB VERB PART VERB ADP NOUN ADP NOUN ADJ ADJ PROPN VERB ADV VERB ADV DET NOUN ADP DET NOUN ADP ADJ NOUN CCONJ DET NOUN ADP DET ADJ NOUN NOUN ADP DET ADJ ADJ NOUN	▁While ▁o rthodox ▁Mar x ist ▁ — ▁Le nin ism ▁of ▁the ▁Com in tern ▁period ▁offered ▁no ▁serious ▁accounts ▁of ▁liberal ▁democratic ▁practices ▁and ▁institutions , ▁neo ▁- ▁Mar x ists ▁have ▁tried ▁to ▁come ▁to ▁terms ▁with ▁phenomena ▁which ▁classical ▁Mar x ists ▁did ▁not ▁anticipate , ▁especially ▁the ▁advent ▁of ▁some ▁form ▁of ▁mixed ▁economy ▁and ▁the ▁growth ▁of ▁an ▁extended ▁welfare ▁state ▁in ▁every ▁advanced ▁capital ist ▁society .	0 0 0 0 0 0 0 0 0 0 0 0 0 0 0 0 0 0 0 0 0 0 0 0 0 0 0 0 0 0 0 0 0 0 0 0 1 1 1 1 0 0 0 0 0 0 0 0 0 0 0 0 0 0 0 0 0 0 0 0 0 0 0 0 0 0 0 0 0 0 0 0 0 0	ADP ADJ ADJ PROPN PROPN PROPN PUNCT PUNCT NOUN NOUN NOUN ADP DET ADJ ADJ ADJ NOUN VERB DET ADJ NOUN ADP ADJ ADJ NOUN CCONJ NOUN NOUN NOUN PUNCT NOUN NOUN NOUN VERB VERB PART VERB ADP NOUN ADP NOUN ADJ ADJ PROPN PROPN PROPN VERB ADV VERB VERB ADV DET NOUN ADP DET NOUN ADP ADJ NOUN CCONJ DET NOUN ADP DET ADJ NOUN NOUN ADP DET ADJ ADJ ADJ NOUN NOUN
Merrill was still trying to come to terms with this reversal of her convictions.	0 0 0 0 0 1 1 1 1 0 0 0 0 0	come to terms with	figurative	identical	NOUN VERB ADV VERB PART VERB ADP NOUN ADP DET NOUN ADP ADJ NOUN	▁Mer rill ▁was ▁still ▁trying ▁to ▁come ▁to ▁terms ▁with ▁this ▁reversal ▁of ▁her ▁convictions .	0 0 0 0 0 0 1 1 1 1 0 0 0 0 0 0	NOUN NOUN VERB ADV VERB PART VERB ADP NOUN ADP DET NOUN ADP ADJ NOUN NOUN
What is meant by this is that people begin to come to terms with what has happened.	0 0 0 0 0 0 0 0 0 0 1 1 1 1 0 0 0	come to terms with	figurative	identical	NOUN VERB VERB ADP DET VERB ADP NOUN VERB PART VERB ADP NOUN ADP NOUN VERB VERB	▁What ▁is ▁meant ▁by ▁this ▁is ▁that ▁people ▁begin ▁to ▁come ▁to ▁terms ▁with ▁what ▁has ▁happened .	0 0 0 0 0 0 0 0 0 0 1 1 1 1 0 0 0 0	NOUN VERB VERB ADP DET VERB ADP NOUN VERB PART VERB ADP NOUN ADP NOUN VERB VERB VERB
In order to help them come to terms with the loss, the grief stricken couple and their close relatives were encouraged to go and see their dead baby and pay their last respects.	0 0 0 0 0 1 1 1 1 0 0 0 0 0 0 0 0 0 0 0 0 0 0 0 0 0 0 0 0 0 0 0 0	come to terms with	figurative	identical	ADP NOUN PART VERB PRON VERB ADP NOUN ADP DET NOUN DET NOUN VERB NOUN CCONJ ADJ ADJ NOUN VERB VERB PART VERB CCONJ VERB ADJ ADJ NOUN CCONJ VERB ADJ ADJ NOUN	▁In ▁order ▁to ▁help ▁them ▁come ▁to ▁terms ▁with ▁the ▁loss , ▁the ▁grief ▁ stricken ▁couple ▁and ▁their ▁close ▁relatives ▁were ▁encouraged ▁to ▁go ▁and ▁see ▁their ▁dead ▁baby ▁and ▁pay ▁their ▁last ▁respects .	0 0 0 0 0 1 1 1 1 0 0 0 0 0 0 0 0 0 0 0 0 0 0 0 0 0 0 0 0 0 0 0 0 0 0 0	ADP NOUN PART VERB PRON VERB ADP NOUN ADP DET NOUN NOUN DET NOUN VERB VERB NOUN CCONJ ADJ ADJ NOUN VERB VERB PART VERB CCONJ VERB ADJ ADJ NOUN CCONJ VERB ADJ ADJ NOUN NOUN
Now, slowly I began to come to terms with guilt.	0 0 0 0 0 1 1 1 1 0	come to terms with	figurative	identical	ADV ADV PRON VERB PART VERB ADP NOUN ADP NOUN	▁Now , ▁slowly ▁I ▁began ▁to ▁come ▁to ▁terms ▁with ▁guilt .	0 0 0 0 0 0 1 1 1 1 0 0	ADV ADV ADV PRON VERB PART VERB ADP NOUN ADP NOUN NOUN
For some years now, conveyancers have " exchanged contracts " by telephone ( as in Record v Bell above ), and the law of contract has had to come to terms with electronic mail in the form of faxes.	0 0 0 0 0 0 0 0 0 0 0 0 0 0 0 0 0 0 0 0 0 0 0 0 0 0 0 0 1 1 1 1 0 0 0 0 0 0 0	come to terms with	figurative	identical	ADP DET NOUN ADV NOUN VERB PUNCT VERB NOUN PUNCT ADP NOUN PUNCT ADP ADP PROPN ADP PROPN ADV PUNCT CCONJ DET NOUN ADP NOUN VERB VERB PART VERB ADP NOUN ADP ADJ NOUN ADP DET NOUN ADP NOUN	▁For ▁some ▁years ▁now , ▁conveyance rs ▁have ▁" ▁exchanged ▁contracts ▁" ▁by ▁telephone ▁( ▁as ▁in ▁Record ▁v ▁Bell ▁above ▁ ), ▁and ▁the ▁law ▁of ▁contract ▁has ▁had ▁to ▁come ▁to ▁terms ▁with ▁electronic ▁mail ▁in ▁the ▁form ▁of ▁fax es .	0 0 0 0 0 0 0 0 0 0 0 0 0 0 0 0 0 0 0 0 0 0 0 0 0 0 0 0 0 0 0 1 1 1 1 0 0 0 0 0 0 0 0 0	ADP DET NOUN ADV ADV NOUN NOUN VERB PUNCT VERB NOUN PUNCT ADP NOUN PUNCT ADP ADP PROPN ADP PROPN ADV PUNCT PUNCT CCONJ DET NOUN ADP NOUN VERB VERB PART VERB ADP NOUN ADP ADJ NOUN ADP DET NOUN ADP NOUN NOUN NOUN
Eldorado ( BBC1, 7 pm ) : Ingrid has to come to terms with a matter of life and death, while Marcus does the dirty on Alex.	0 0 0 0 0 0 0 0 0 0 1 1 1 1 0 0 0 0 0 0 0 0 0 0 0 0 0	come to terms with	figurative	identical	PROPN PUNCT PROPN NUM NOUN PUNCT PUNCT PROPN VERB PART VERB ADP NOUN ADP DET NOUN ADP NOUN CCONJ NOUN ADP PROPN VERB DET NOUN ADP PROPN	▁El d or ado ▁( ▁B BC 1, ▁7 ▁p m ▁ ) ▁ : ▁In g rid ▁has ▁to ▁come ▁to ▁terms ▁with ▁a ▁matter ▁of ▁life ▁and ▁death , ▁while ▁Marc us ▁does ▁the ▁dirty ▁on ▁Alex .	0 0 0 0 0 0 0 0 0 0 0 0 0 0 0 0 0 0 0 0 1 1 1 1 0 0 0 0 0 0 0 0 0 0 0 0 0 0 0 0	PROPN PROPN PROPN PROPN PUNCT PROPN PROPN PROPN NUM NOUN NOUN PUNCT PUNCT PUNCT PUNCT PROPN PROPN PROPN VERB PART VERB ADP NOUN ADP DET NOUN ADP NOUN CCONJ NOUN NOUN ADP PROPN PROPN VERB DET NOUN ADP PROPN PROPN
They say that I mean any changes any in temperature are very noticeable so w Like it is working in the middle of winter offshore would be something I would have to come to terms with but no I mean I don't think there's any problems work - wise.	0 0 0 0 0 0 0 0 0 0 0 0 0 0 0 0 0 0 0 0 0 0 0 0 0 0 0 0 0 0 0 0 1 1 1 1 0 0 0 0 0 0 0 0 0 0 0 0 0	come to terms with	figurative	identical	PRON VERB ADP PRON VERB DET NOUN DET ADP NOUN VERB ADV ADJ ADP INTJ INTJ PRON VERB VERB ADP DET NOUN ADP NOUN ADV VERB VERB NOUN PRON VERB VERB PART VERB ADP NOUN ADP CCONJ INTJ PRON VERB PRON VERB VERB ADV DET NOUN NOUN PUNCT ADJ	▁They ▁say ▁that ▁I ▁mean ▁any ▁changes ▁any ▁in ▁temperature ▁are ▁very ▁noticeable ▁so ▁w ▁Like ▁it ▁is ▁working ▁in ▁the ▁middle ▁of ▁winter ▁offshore ▁would ▁be ▁something ▁I ▁would ▁have ▁to ▁come ▁to ▁terms ▁with ▁but ▁no ▁I ▁mean ▁I ▁don ' t ▁think ▁there ' s ▁any ▁problems ▁work ▁- ▁wise .	0 0 0 0 0 0 0 0 0 0 0 0 0 0 0 0 0 0 0 0 0 0 0 0 0 0 0 0 0 0 0 0 1 1 1 1 0 0 0 0 0 0 0 0 0 0 0 0 0 0 0 0 0 0	PRON VERB ADP PRON VERB DET NOUN DET ADP NOUN VERB ADV ADJ ADP INTJ INTJ PRON VERB VERB ADP DET NOUN ADP NOUN ADV VERB VERB NOUN PRON VERB VERB PART VERB ADP NOUN ADP CCONJ INTJ PRON VERB PRON VERB VERB VERB VERB ADV ADV ADV DET NOUN NOUN PUNCT ADJ ADJ
( He found it difficult to come to terms with the fact -that the Roman Catholics were responsible for the Italian classical revival in the sixteenth and seventeenth centuries. )	0 0 0 0 0 0 1 1 1 1 0 0 0 0 0 0 0 0 0 0 0 0 0 0 0 0 0 0 0 0	come to terms with	figurative	identical	PUNCT PRON VERB PRON ADJ PART VERB ADP NOUN ADP DET NOUN ADP DET PROPN PROPN VERB ADJ ADP DET ADJ ADJ NOUN ADP DET ADJ CCONJ ADJ NOUN PUNCT	▁( ▁He ▁found ▁it ▁difficult ▁to ▁come ▁to ▁terms ▁with ▁the ▁fact ▁- that ▁the ▁Roman ▁Catholic s ▁were ▁responsible ▁for ▁the ▁Italian ▁classical ▁reviv al ▁in ▁the ▁sixteen th ▁and ▁seventeen th ▁centuries . ▁ )	0 0 0 0 0 0 1 1 1 1 0 0 0 0 0 0 0 0 0 0 0 0 0 0 0 0 0 0 0 0 0 0 0 0 0 0 0	PUNCT PRON VERB PRON ADJ PART VERB ADP NOUN ADP DET NOUN ADP ADP DET PROPN PROPN PROPN VERB ADJ ADP DET ADJ ADJ NOUN NOUN ADP DET ADJ ADJ CCONJ ADJ ADJ NOUN NOUN PUNCT PUNCT
If its post cold - war generation is not to be continually confused by unexpected developments then they will need to come to terms with the dynamics of change.	0 0 0 0 0 0 0 0 0 0 0 0 0 0 0 0 0 0 0 0 0 1 1 1 1 0 0 0 0	come to terms with	figurative	identical	ADP ADJ NOUN ADJ PUNCT NOUN NOUN VERB ADV PART VERB ADV VERB ADP ADJ NOUN ADV PRON VERB VERB PART VERB ADP NOUN ADP DET NOUN ADP NOUN	▁If ▁its ▁post ▁cold ▁- ▁war ▁generation ▁is ▁not ▁to ▁be ▁continually ▁confused ▁by ▁unexpected ▁developments ▁then ▁they ▁will ▁need ▁to ▁come ▁to ▁terms ▁with ▁the ▁dynamic s ▁of ▁change .	0 0 0 0 0 0 0 0 0 0 0 0 0 0 0 0 0 0 0 0 0 1 1 1 1 0 0 0 0 0 0	ADP ADJ NOUN ADJ PUNCT NOUN NOUN VERB ADV PART VERB ADV VERB ADP ADJ NOUN ADV PRON VERB VERB PART VERB ADP NOUN ADP DET NOUN NOUN ADP NOUN NOUN
I thought I 'd come to terms with it, but that little lad yesterday … ’	0 0 0 0 1 1 1 1 0 0 0 0 0 0 0 0	come to terms with	figurative	identical	PRON VERB PRON VERB VERB ADP NOUN ADP PRON CCONJ DET ADJ NOUN NOUN PUNCT PUNCT	▁I ▁thought ▁I ▁' d ▁come ▁to ▁terms ▁with ▁it , ▁but ▁that ▁little ▁la d ▁yesterday ▁... ▁ ’	0 0 0 0 0 1 1 1 1 0 0 0 0 0 0 0 0 0 0 0	PRON VERB PRON VERB VERB VERB ADP NOUN ADP PRON PRON CCONJ DET ADJ NOUN NOUN NOUN PUNCT PUNCT PUNCT
When I arrived on the scene, Joe was trying to come to terms with the situation but it was a difficult time all round.	0 0 0 0 0 0 0 0 0 0 1 1 1 1 0 0 0 0 0 0 0 0 0 0	come to terms with	figurative	identical	ADV PRON VERB ADP DET NOUN PROPN VERB VERB PART VERB ADP NOUN ADP DET NOUN CCONJ PRON VERB DET ADJ NOUN DET NOUN	▁When ▁I ▁arrived ▁on ▁the ▁scene , ▁Jo e ▁was ▁trying ▁to ▁come ▁to ▁terms ▁with ▁the ▁situation ▁but ▁it ▁was ▁a ▁difficult ▁time ▁all ▁round .	0 0 0 0 0 0 0 0 0 0 0 0 1 1 1 1 0 0 0 0 0 0 0 0 0 0 0	ADV PRON VERB ADP DET NOUN NOUN PROPN PROPN VERB VERB PART VERB ADP NOUN ADP DET NOUN CCONJ PRON VERB DET ADJ NOUN DET NOUN NOUN
A year ago, they joined Child, a registered self - help charity set up to assist couples in coming to terms with infertility.	0 0 0 0 0 0 0 0 0 0 0 0 0 0 0 0 0 0 1 1 1 1 0	come to terms with	figurative	inflection	DET NOUN ADV PRON VERB PROPN DET ADJ NOUN PUNCT NOUN NOUN VERB PART PART VERB NOUN ADP VERB ADP NOUN ADP NOUN	▁A ▁year ▁ago , ▁they ▁joined ▁Child , ▁a ▁registered ▁self ▁- ▁help ▁charity ▁set ▁up ▁to ▁assist ▁couple s ▁in ▁coming ▁to ▁terms ▁with ▁infertility .	0 0 0 0 0 0 0 0 0 0 0 0 0 0 0 0 0 0 0 0 0 1 1 1 1 0 0	DET NOUN ADV ADV PRON VERB PROPN PROPN DET ADJ NOUN PUNCT NOUN NOUN VERB PART PART VERB NOUN NOUN ADP VERB ADP NOUN ADP NOUN NOUN
One of the most famous examples concerns the Great Depression – an epoch that policymakers frequently drew upon in trying to come to terms with the post-2007 financial crisis.	0 0 0 0 0 0 0 0 0 0 0 0 0 0 0 0 0 0 0 0 0 1 1 1 1 0 0 0 0	come to terms with	figurative	identical	NUM ADP DET ADV ADJ NOUN VERB DET PROPN PROPN PUNCT DET NOUN ADJ NOUN ADV VERB ADP ADP VERB PART VERB ADP NOUN ADP DET ADJ ADJ NOUN	▁One ▁of ▁the ▁most ▁famous ▁examples ▁concerns ▁the ▁Great ▁Depression ▁ – ▁an ▁epo ch ▁that ▁policy makers ▁frequently ▁drew ▁upon ▁in ▁trying ▁to ▁come ▁to ▁terms ▁with ▁the ▁post -2007 ▁financial ▁crisis .	0 0 0 0 0 0 0 0 0 0 0 0 0 0 0 0 0 0 0 0 0 0 0 0 1 1 1 1 0 0 0 0 0 0	NUM ADP DET ADV ADJ NOUN VERB DET PROPN PROPN PUNCT PUNCT DET NOUN NOUN ADJ NOUN NOUN ADV VERB ADP ADP VERB PART VERB ADP NOUN ADP DET ADJ ADJ ADJ NOUN NOUN
Silvio is a very complex and tormented personality, someone who has great difficulty in coming to terms with the demands of life.	0 0 0 0 0 0 0 0 0 0 0 0 0 0 1 1 1 1 0 0 0 0	come to terms with	figurative	inflection	PROPN VERB DET ADV ADJ CCONJ ADJ NOUN NOUN NOUN VERB ADJ NOUN ADP VERB ADP NOUN ADP DET NOUN ADP NOUN	▁Sil vi o ▁is ▁a ▁very ▁complex ▁and ▁to r ment ed ▁personality , ▁someone ▁who ▁has ▁great ▁difficulty ▁in ▁coming ▁to ▁terms ▁with ▁the ▁demands ▁of ▁life .	0 0 0 0 0 0 0 0 0 0 0 0 0 0 0 0 0 0 0 0 1 1 1 1 0 0 0 0 0	PROPN PROPN PROPN VERB DET ADV ADJ CCONJ ADJ ADJ ADJ ADJ NOUN NOUN NOUN NOUN VERB ADJ NOUN ADP VERB ADP NOUN ADP DET NOUN ADP NOUN NOUN
J. M. Dent & Sons Ltd., 1972 ) she tells of her first meeting with the composer, of his influence on her technique and interpretation, of how she came to terms with the music, of Plante and other virtuosi, and gives a detailed analysis of various pieces.	0 0 0 0 0 0 0 0 0 0 0 0 0 0 0 0 0 0 0 0 0 0 0 0 0 0 0 0 1 1 1 1 0 0 0 0 0 0 0 0 0 0 0 0 0 0 0	come to terms with	figurative	inflection	PROPN PROPN PROPN CCONJ PROPN PROPN NUM PUNCT PRON VERB ADP ADJ ADJ NOUN ADP DET NOUN ADP ADJ NOUN ADP ADJ NOUN CCONJ NOUN ADP ADV PRON VERB ADP NOUN ADP DET NOUN ADP PROPN CCONJ ADJ NOUN CCONJ VERB DET ADJ NOUN ADP ADJ NOUN	▁J . ▁M . ▁D ent ▁& ▁Son s ▁Ltd . , ▁1972 ▁ ) ▁she ▁tells ▁of ▁her ▁first ▁meeting ▁with ▁the ▁com pos er , ▁of ▁his ▁influence ▁on ▁her ▁technique ▁and ▁interpretation , ▁of ▁how ▁she ▁came ▁to ▁terms ▁with ▁the ▁music , ▁of ▁Plant e ▁and ▁other ▁vir tu osi , ▁and ▁gives ▁a ▁detailed ▁analysis ▁of ▁various ▁pieces .	0 0 0 0 0 0 0 0 0 0 0 0 0 0 0 0 0 0 0 0 0 0 0 0 0 0 0 0 0 0 0 0 0 0 0 0 0 0 0 1 1 1 1 0 0 0 0 0 0 0 0 0 0 0 0 0 0 0 0 0 0 0 0 0	PROPN PROPN PROPN PROPN PROPN PROPN CCONJ PROPN PROPN PROPN PROPN PROPN NUM PUNCT PUNCT PRON VERB ADP ADJ ADJ NOUN ADP DET NOUN NOUN NOUN NOUN ADP ADJ NOUN ADP ADJ NOUN CCONJ NOUN NOUN ADP ADV PRON VERB ADP NOUN ADP DET NOUN NOUN ADP PROPN PROPN CCONJ ADJ NOUN NOUN NOUN NOUN CCONJ VERB DET ADJ NOUN ADP ADJ NOUN NOUN
But other shocks to the system followed in quick succession : a new language and culture ; the insensitivity, not always unintentional, of foster parents, teachers and hostel administrators ; the cruelty of other children ( and some adults ) who equated all things German with Nazism ; the coming - to - terms with the long - term or permanent loss of family and friends who had been left behind, and the awareness that refugees could not expect to be treated other than as second - class citizens — to mention only the common causes of illness and depression.	0 0 0 0 0 0 0 0 0 0 0 0 0 0 0 0 0 0 0 0 0 0 0 0 0 0 0 0 0 0 0 0 0 0 0 0 0 0 0 0 0 0 0 0 0 0 0 0 0 1 0 1 0 1 1 0 0 0 0 0 0 0 0 0 0 0 0 0 0 0 0 0 0 0 0 0 0 0 0 0 0 0 0 0 0 0 0 0 0 0 0 0 0 0 0 0 0 0 0 0	come to terms with	figurative	combined-inflection	CCONJ ADJ NOUN ADP DET NOUN VERB ADP ADJ NOUN PUNCT DET ADJ NOUN CCONJ NOUN PUNCT DET NOUN ADV ADV ADJ ADP ADJ NOUN NOUN CCONJ NOUN NOUN PUNCT DET NOUN ADP ADJ NOUN PUNCT CCONJ DET NOUN PUNCT NOUN VERB DET NOUN ADJ ADP NOUN PUNCT DET VERB PUNCT ADP PUNCT NOUN ADP DET ADJ PUNCT NOUN CCONJ ADJ NOUN ADP NOUN CCONJ NOUN NOUN VERB VERB VERB ADV CCONJ DET NOUN ADP NOUN VERB ADV VERB PART VERB VERB ADJ ADP ADV ADJ PUNCT NOUN NOUN PUNCT PART VERB ADV DET ADJ NOUN ADP NOUN CCONJ NOUN	▁But ▁other ▁shocks ▁to ▁the ▁system ▁followed ▁in ▁quick ▁succession ▁ : ▁a ▁new ▁language ▁and ▁culture ▁ ; ▁the ▁in sensitivity , ▁not ▁always ▁unintentional , ▁of ▁foster ▁parents , ▁teachers ▁and ▁host el ▁administrators ▁ ; ▁the ▁cruelty ▁of ▁other ▁children ▁( ▁and ▁some ▁adults ▁ ) ▁who ▁equate d ▁all ▁things ▁German ▁with ▁Nazi s m ▁ ; ▁the ▁coming ▁- ▁to ▁- ▁terms ▁with ▁the ▁long ▁- ▁term ▁or ▁permanent ▁loss ▁of ▁family ▁and ▁friends ▁who ▁had ▁been ▁left ▁behind , ▁and ▁the ▁awareness ▁that ▁refugees ▁could ▁not ▁expect ▁to ▁be ▁treated ▁other ▁than ▁as ▁second ▁- ▁class ▁citizens ▁ — ▁to ▁mention ▁only ▁the ▁common ▁causes ▁of ▁illness ▁and ▁depression .	0 0 0 0 0 0 0 0 0 0 0 0 0 0 0 0 0 0 0 0 0 0 0 0 0 0 0 0 0 0 0 0 0 0 0 0 0 0 0 0 0 0 0 0 0 0 0 0 0 0 0 0 0 0 0 0 0 0 0 0 0 0 1 0 1 0 1 1 0 0 0 0 0 0 0 0 0 0 0 0 0 0 0 0 0 0 0 0 0 0 0 0 0 0 0 0 0 0 0 0 0 0 0 0 0 0 0 0 0 0 0 0 0 0 0 0	CCONJ ADJ NOUN ADP DET NOUN VERB ADP ADJ NOUN PUNCT PUNCT DET ADJ NOUN CCONJ NOUN PUNCT PUNCT DET NOUN NOUN NOUN ADV ADV ADJ ADJ ADP ADJ NOUN NOUN NOUN CCONJ NOUN NOUN NOUN PUNCT PUNCT DET NOUN ADP ADJ NOUN PUNCT CCONJ DET NOUN PUNCT PUNCT NOUN VERB VERB DET NOUN ADJ ADP NOUN NOUN NOUN PUNCT PUNCT DET VERB PUNCT ADP PUNCT NOUN ADP DET ADJ PUNCT NOUN CCONJ ADJ NOUN ADP NOUN CCONJ NOUN NOUN VERB VERB VERB ADV ADV CCONJ DET NOUN ADP NOUN VERB ADV VERB PART VERB VERB ADJ ADP ADV ADJ PUNCT NOUN NOUN PUNCT PUNCT PART VERB ADV DET ADJ NOUN ADP NOUN CCONJ NOUN NOUN
Immediately there was a loud laugh of relief from the guests, who at once took it that the child had come to terms with her charges ' ultimate fate.	0 0 0 0 0 0 0 0 0 0 0 0 0 0 0 0 0 0 0 0 1 1 1 1 0 0 0 0 0	come to terms with	figurative	identical	ADV ADV VERB DET ADJ NOUN ADP NOUN ADP DET NOUN NOUN ADP ADV VERB PRON ADP DET NOUN VERB VERB ADP NOUN ADP ADJ NOUN PART ADJ NOUN	▁Immediately ▁there ▁was ▁a ▁loud ▁laugh ▁of ▁relief ▁from ▁the ▁guest s , ▁who ▁at ▁once ▁took ▁it ▁that ▁the ▁child ▁had ▁come ▁to ▁terms ▁with ▁her ▁charges ▁' ▁ultimate ▁fate .	0 0 0 0 0 0 0 0 0 0 0 0 0 0 0 0 0 0 0 0 0 0 1 1 1 1 0 0 0 0 0 0	ADV ADV VERB DET ADJ NOUN ADP NOUN ADP DET NOUN NOUN NOUN NOUN ADP ADV VERB PRON ADP DET NOUN VERB VERB ADP NOUN ADP ADJ NOUN PART ADJ NOUN NOUN
The 50-year - old actress is struggling to come to terms with a series of disasters that have brought her life crashing round her.	0 0 0 0 0 0 0 0 1 1 1 1 0 0 0 0 0 0 0 0 0 0 0 0	come to terms with	figurative	identical	DET NUM PUNCT ADJ NOUN VERB VERB PART VERB ADP NOUN ADP DET NOUN ADP NOUN ADJ VERB VERB ADJ NOUN VERB ADV PRON	▁The ▁50 - year ▁- ▁old ▁ac tress ▁is ▁struggling ▁to ▁come ▁to ▁terms ▁with ▁a ▁series ▁of ▁disasters ▁that ▁have ▁brought ▁her ▁life ▁crash ing ▁round ▁her .	0 0 0 0 0 0 0 0 0 0 0 1 1 1 1 0 0 0 0 0 0 0 0 0 0 0 0 0 0	DET NUM NUM NUM PUNCT ADJ NOUN NOUN VERB VERB PART VERB ADP NOUN ADP DET NOUN ADP NOUN ADJ VERB VERB ADJ NOUN VERB VERB ADV PRON PRON
For this reason we spend a lot of time with relatives trying to help them come to terms with the whole admission process.	0 0 0 0 0 0 0 0 0 0 0 0 0 0 0 1 1 1 1 0 0 0 0	come to terms with	figurative	identical	ADP DET NOUN PRON VERB DET NOUN ADP NOUN ADP NOUN VERB PART VERB PRON VERB ADP NOUN ADP DET ADJ NOUN NOUN	▁For ▁this ▁reason ▁we ▁spend ▁a ▁lot ▁of ▁time ▁with ▁relatives ▁trying ▁to ▁help ▁them ▁come ▁to ▁terms ▁with ▁the ▁whole ▁admission ▁process .	0 0 0 0 0 0 0 0 0 0 0 0 0 0 0 1 1 1 1 0 0 0 0 0	ADP DET NOUN PRON VERB DET NOUN ADP NOUN ADP NOUN VERB PART VERB PRON VERB ADP NOUN ADP DET ADJ NOUN NOUN NOUN
He was frightened that hostile readers of his theological work would be able to say that his religion could be ‘ explained’ in terms of the Oedipus complex ( or perhaps the Hippolytus complex ) ; and that he was only able to find peace for his heart by coming to terms with a Heavenly Father of his own projection when he had seen the last of his earthly father in Belfast.	0 0 0 0 0 0 0 0 0 0 0 0 0 0 0 0 0 0 0 0 0 0 0 0 0 0 0 0 0 0 0 0 0 0 0 0 0 0 0 0 0 0 0 0 0 0 0 0 0 1 1 1 1 0 0 0 0 0 0 0 0 0 0 0 0 0 0 0 0 0 0 0	come to terms with	figurative	inflection	PRON VERB VERB ADP ADJ NOUN ADP ADJ ADJ NOUN VERB VERB ADJ PART VERB ADP ADJ NOUN VERB VERB PUNCT ADJ ADP NOUN ADP DET PROPN NOUN PUNCT CCONJ ADV DET PROPN NOUN PUNCT PUNCT CCONJ ADP PRON VERB ADV ADJ PART VERB NOUN ADP ADJ NOUN ADP VERB ADP NOUN ADP DET PROPN PROPN ADP ADJ ADJ NOUN ADV PRON VERB VERB DET ADJ ADP ADJ ADJ NOUN ADP PROPN	▁He ▁was ▁f right ened ▁that ▁hostile ▁readers ▁of ▁his ▁the ological ▁work ▁would ▁be ▁able ▁to ▁say ▁that ▁his ▁religion ▁could ▁be ▁ ‘ ▁explained ’ ▁in ▁terms ▁of ▁the ▁O edip us ▁complex ▁( ▁or ▁perhaps ▁the ▁H ip poly tus ▁complex ▁ ) ▁ ; ▁and ▁that ▁he ▁was ▁only ▁able ▁to ▁find ▁peace ▁for ▁his ▁heart ▁by ▁coming ▁to ▁terms ▁with ▁a ▁He a ven ly ▁Father ▁of ▁his ▁own ▁projection ▁when ▁he ▁had ▁seen ▁the ▁last ▁of ▁his ▁earth ly ▁father ▁in ▁Belfast .	0 0 0 0 0 0 0 0 0 0 0 0 0 0 0 0 0 0 0 0 0 0 0 0 0 0 0 0 0 0 0 0 0 0 0 0 0 0 0 0 0 0 0 0 0 0 0 0 0 0 0 0 0 0 0 0 0 0 0 0 0 1 1 1 1 0 0 0 0 0 0 0 0 0 0 0 0 0 0 0 0 0 0 0 0 0 0 0 0	PRON VERB VERB VERB VERB ADP ADJ NOUN ADP ADJ ADJ ADJ NOUN VERB VERB ADJ PART VERB ADP ADJ NOUN VERB VERB PUNCT PUNCT ADJ ADJ ADP NOUN ADP DET PROPN PROPN PROPN NOUN PUNCT CCONJ ADV DET PROPN PROPN PROPN PROPN NOUN PUNCT PUNCT PUNCT PUNCT CCONJ ADP PRON VERB ADV ADJ PART VERB NOUN ADP ADJ NOUN ADP VERB ADP NOUN ADP DET PROPN PROPN PROPN PROPN PROPN ADP ADJ ADJ NOUN ADV PRON VERB VERB DET ADJ ADP ADJ ADJ ADJ NOUN ADP PROPN PROPN
