She believes we must all recognise and come to terms with our own ageism and seek to break down the barriers to understanding.	0 0 0 0 0 0 0 1 1 1 1 0 0 0 0 0 0 0 0 0 0 0 0	come to terms with	figurative	identical	PRON VERB PRON VERB ADV VERB CCONJ VERB ADP NOUN ADP ADJ ADJ NOUN CCONJ VERB PART VERB PART DET NOUN ADP NOUN	▁She ▁believes ▁we ▁must ▁all ▁recognise ▁and ▁come ▁to ▁terms ▁with ▁our ▁own ▁age ism ▁and ▁seek ▁to ▁break ▁down ▁the ▁barriers ▁to ▁understanding .	0 0 0 0 0 0 0 1 1 1 1 0 0 0 0 0 0 0 0 0 0 0 0 0 0	PRON VERB PRON VERB ADV VERB CCONJ VERB ADP NOUN ADP ADJ ADJ NOUN NOUN CCONJ VERB PART VERB PART DET NOUN ADP NOUN NOUN
And when they come to terms with the fact that they aren't, they have to think of the possibilities.’	0 0 0 1 1 1 1 0 0 0 0 0 0 0 0 0 0 0 0	come to terms with	figurative	identical	CCONJ ADV PRON VERB ADP NOUN ADP DET NOUN ADP PRON VERB PRON VERB PART VERB ADP DET NOUN	▁And ▁when ▁they ▁come ▁to ▁terms ▁with ▁the ▁fact ▁that ▁they ▁are n ' t , ▁they ▁have ▁to ▁think ▁of ▁the ▁possibilities . ’	0 0 0 1 1 1 1 0 0 0 0 0 0 0 0 0 0 0 0 0 0 0 0 0 0	CCONJ ADV PRON VERB ADP NOUN ADP DET NOUN ADP PRON VERB VERB VERB VERB VERB PRON VERB PART VERB ADP DET NOUN NOUN NOUN
I came to terms with that long before the accident.	0 1 1 1 1 0 0 0 0 0	come to terms with	figurative	inflection	PRON VERB ADP NOUN ADP DET ADV ADP DET NOUN	▁I ▁came ▁to ▁terms ▁with ▁that ▁long ▁before ▁the ▁accident .	0 1 1 1 1 0 0 0 0 0 0	PRON VERB ADP NOUN ADP DET ADV ADP DET NOUN NOUN
Anna, knowing nothing of this, and battling to come to terms with the violence of her surroundings, while The Friends seemed to expand and achieve by the month, succumbed every so often to the demon envy.	0 0 0 0 0 0 0 0 1 1 1 1 0 0 0 0 0 0 0 0 0 0 0 0 0 0 0 0 0 0 0 0 0 0 0 0	come to terms with	figurative	identical	PROPN VERB NOUN ADP DET CCONJ VERB PART VERB ADP NOUN ADP DET NOUN ADP ADJ NOUN ADP DET PROPN VERB PART VERB CCONJ VERB ADP DET NOUN VERB ADV ADV ADV ADP DET NOUN NOUN	▁An na , ▁knowing ▁nothing ▁of ▁this , ▁and ▁bat t ling ▁to ▁come ▁to ▁terms ▁with ▁the ▁violence ▁of ▁her ▁surrounding s , ▁while ▁The ▁Friend s ▁seemed ▁to ▁expand ▁and ▁achieve ▁by ▁the ▁month , ▁suc cum bed ▁every ▁so ▁often ▁to ▁the ▁demon ▁en vy .	0 0 0 0 0 0 0 0 0 0 0 0 0 1 1 1 1 0 0 0 0 0 0 0 0 0 0 0 0 0 0 0 0 0 0 0 0 0 0 0 0 0 0 0 0 0 0 0 0	PROPN PROPN PROPN VERB NOUN ADP DET DET CCONJ VERB VERB VERB PART VERB ADP NOUN ADP DET NOUN ADP ADJ NOUN NOUN NOUN ADP DET PROPN PROPN VERB PART VERB CCONJ VERB ADP DET NOUN NOUN VERB VERB VERB ADV ADV ADV ADP DET NOUN NOUN NOUN NOUN
In many instances, the mother of the child will wish to keep the child, but the father is unable to come to terms with the handicap, and the family is split up.	0 0 0 0 0 0 0 0 0 0 0 0 0 0 0 0 0 0 0 0 1 1 1 1 0 0 0 0 0 0 0 0	come to terms with	figurative	identical	ADP ADJ NOUN DET NOUN ADP DET NOUN VERB VERB PART VERB DET NOUN CCONJ DET NOUN VERB ADJ PART VERB ADP NOUN ADP DET NOUN CCONJ DET NOUN VERB VERB PART	▁In ▁many ▁instances , ▁the ▁mother ▁of ▁the ▁child ▁will ▁wish ▁to ▁keep ▁the ▁child , ▁but ▁the ▁father ▁is ▁unable ▁to ▁come ▁to ▁terms ▁with ▁the ▁handicap , ▁and ▁the ▁family ▁is ▁split ▁up .	0 0 0 0 0 0 0 0 0 0 0 0 0 0 0 0 0 0 0 0 0 0 1 1 1 1 0 0 0 0 0 0 0 0 0 0	ADP ADJ NOUN NOUN DET NOUN ADP DET NOUN VERB VERB PART VERB DET NOUN NOUN CCONJ DET NOUN VERB ADJ PART VERB ADP NOUN ADP DET NOUN NOUN CCONJ DET NOUN VERB VERB PART PART
‘ My guess is that she hadn't come to terms with the situation herself,’ she said.	0 0 0 0 0 0 0 1 1 1 1 0 0 0 0 0	come to terms with	figurative	identical	PUNCT ADJ NOUN VERB ADP PRON VERB VERB ADP NOUN ADP DET NOUN X PRON VERB	▁ ‘ ▁My ▁guess ▁is ▁that ▁she ▁had n ' t ▁come ▁to ▁terms ▁with ▁the ▁situation ▁herself , ’ ▁she ▁said .	0 0 0 0 0 0 0 0 0 0 0 1 1 1 1 0 0 0 0 0 0 0 0	PUNCT PUNCT ADJ NOUN VERB ADP PRON VERB VERB VERB VERB VERB ADP NOUN ADP DET NOUN X X X PRON VERB VERB
One of the functions of later life is dealing with and coming to terms with many earlier experiences to review life and evaluate it.	0 0 0 0 0 0 0 0 0 0 0 1 1 1 1 0 0 0 0 0 0 0 0 0	come to terms with	figurative	inflection	NUM ADP DET NOUN ADP ADJ NOUN VERB VERB ADP CCONJ VERB ADP NOUN ADP ADJ ADJ NOUN PART VERB NOUN CCONJ VERB PRON	▁One ▁of ▁the ▁functions ▁of ▁later ▁life ▁is ▁dealing ▁with ▁and ▁coming ▁to ▁terms ▁with ▁many ▁earlier ▁experiences ▁to ▁review ▁life ▁and ▁evaluate ▁it .	0 0 0 0 0 0 0 0 0 0 0 1 1 1 1 0 0 0 0 0 0 0 0 0 0	NUM ADP DET NOUN ADP ADJ NOUN VERB VERB ADP CCONJ VERB ADP NOUN ADP ADJ ADJ NOUN PART VERB NOUN CCONJ VERB PRON PRON
Today friends and colleagues were coming to terms with her murder.	0 0 0 0 0 1 1 1 1 0 0	come to terms with	figurative	inflection	NOUN NOUN CCONJ NOUN VERB VERB ADP NOUN ADP ADJ NOUN	▁Today ▁friends ▁and ▁colleagues ▁were ▁coming ▁to ▁terms ▁with ▁her ▁murder .	0 0 0 0 0 1 1 1 1 0 0 0	NOUN NOUN CCONJ NOUN VERB VERB ADP NOUN ADP ADJ NOUN NOUN
In the house tonight the Prescott's two sons and daughter are being comforted by friends as they all try and come to terms with last night's sad events.	0 0 0 0 0 0 0 0 0 0 0 0 0 0 0 0 0 0 0 0 1 1 1 1 0 0 0 0	come to terms with	figurative	identical	ADP DET NOUN NOUN DET PROPN NUM NOUN CCONJ NOUN VERB VERB VERB ADP NOUN ADP PRON DET VERB CCONJ VERB ADP NOUN ADP ADJ NOUN ADJ NOUN	▁In ▁the ▁house ▁tonight ▁the ▁Pre s cott ' s ▁two ▁sons ▁and ▁daughter ▁are ▁being ▁comfort ed ▁by ▁friends ▁as ▁they ▁all ▁try ▁and ▁come ▁to ▁terms ▁with ▁last ▁night ' s ▁sad ▁events .	0 0 0 0 0 0 0 0 0 0 0 0 0 0 0 0 0 0 0 0 0 0 0 0 0 1 1 1 1 0 0 0 0 0 0 0	ADP DET NOUN NOUN DET PROPN PROPN PROPN PROPN PROPN NUM NOUN CCONJ NOUN VERB VERB VERB VERB ADP NOUN ADP PRON DET VERB CCONJ VERB ADP NOUN ADP ADJ NOUN NOUN NOUN ADJ NOUN NOUN
Dawn Wright, 23, of Hollywell, who is still struggling to come to terms with her tragedy, believes the burglars must have known who she was.	0 0 0 0 0 0 0 0 0 0 1 1 1 1 0 0 0 0 0 0 0 0 0 0 0	come to terms with	figurative	identical	PROPN PROPN NUM ADP PROPN NOUN VERB ADV VERB PART VERB ADP NOUN ADP ADJ NOUN VERB DET NOUN VERB VERB VERB NOUN PRON VERB	▁Da wn ▁W right , ▁23 , ▁of ▁Hol ly well , ▁who ▁is ▁still ▁struggling ▁to ▁come ▁to ▁terms ▁with ▁her ▁tragedy , ▁believes ▁the ▁ burg lar s ▁must ▁have ▁known ▁who ▁she ▁was .	0 0 0 0 0 0 0 0 0 0 0 0 0 0 0 0 0 1 1 1 1 0 0 0 0 0 0 0 0 0 0 0 0 0 0 0 0	PROPN PROPN PROPN PROPN PROPN NUM NUM ADP PROPN PROPN PROPN PROPN NOUN VERB ADV VERB PART VERB ADP NOUN ADP ADJ NOUN NOUN VERB DET NOUN NOUN NOUN NOUN VERB VERB VERB NOUN PRON VERB VERB
The psychologist justified his own persuasive efforts with this belief that he was actually helping the parents to come to terms with a decision ‘ they really want to make ’.	0 0 0 0 0 0 0 0 0 0 0 0 0 0 0 0 0 0 1 1 1 1 0 0 0 0 0 0 0 0 0	come to terms with	figurative	identical	DET NOUN VERB ADJ ADJ ADJ NOUN ADP DET NOUN ADP PRON VERB ADV VERB DET NOUN PART VERB ADP NOUN ADP DET NOUN NUM PRON ADV VERB PART VERB PUNCT	▁The ▁psychologist ▁justified ▁his ▁own ▁per s ua sive ▁efforts ▁with ▁this ▁belief ▁that ▁he ▁was ▁actually ▁help ing ▁the ▁parents ▁to ▁come ▁to ▁terms ▁with ▁a ▁decision ▁ ‘ ▁they ▁really ▁want ▁to ▁make ▁ ’ .	0 0 0 0 0 0 0 0 0 0 0 0 0 0 0 0 0 0 0 0 0 0 1 1 1 1 0 0 0 0 0 0 0 0 0 0 0 0	DET NOUN VERB ADJ ADJ ADJ ADJ ADJ ADJ NOUN ADP DET NOUN ADP PRON VERB ADV VERB VERB DET NOUN PART VERB ADP NOUN ADP DET NOUN NUM NUM PRON ADV VERB PART VERB PUNCT PUNCT PUNCT
Everything here seemed so unreal that I had to come to terms with it as soon as possible, so that I can begin work.	0 0 0 0 0 0 0 0 0 1 1 1 1 0 0 0 0 0 0 0 0 0 0 0	come to terms with	figurative	identical	NOUN ADV VERB ADV ADJ ADP PRON VERB PART VERB ADP NOUN ADP PRON ADV ADV ADP ADJ ADP ADP PRON VERB VERB NOUN	▁Everything ▁here ▁seemed ▁so ▁un real ▁that ▁I ▁had ▁to ▁come ▁to ▁terms ▁with ▁it ▁as ▁soon ▁as ▁possible , ▁so ▁that ▁I ▁can ▁begin ▁work .	0 0 0 0 0 0 0 0 0 0 1 1 1 1 0 0 0 0 0 0 0 0 0 0 0 0 0	NOUN ADV VERB ADV ADJ ADJ ADP PRON VERB PART VERB ADP NOUN ADP PRON ADV ADV ADP ADJ ADJ ADP ADP PRON VERB VERB NOUN NOUN
However, for people with children, making a will means a lot more than coming to terms with you - know - what.	0 0 0 0 0 0 0 0 0 0 0 0 0 1 1 1 1 0 0 0 0 0	come to terms with	figurative	inflection	ADV ADP NOUN ADP NOUN VERB DET NOUN VERB DET NOUN ADJ ADP VERB ADP NOUN ADP PRON PUNCT NOUN PUNCT NOUN	▁However , ▁for ▁people ▁with ▁children , ▁making ▁a ▁will ▁means ▁a ▁lot ▁more ▁than ▁coming ▁to ▁terms ▁with ▁you ▁- ▁know ▁- ▁what .	0 0 0 0 0 0 0 0 0 0 0 0 0 0 0 1 1 1 1 0 0 0 0 0 0	ADV ADV ADP NOUN ADP NOUN NOUN VERB DET NOUN VERB DET NOUN ADJ ADP VERB ADP NOUN ADP PRON PUNCT NOUN PUNCT NOUN NOUN
They deserve a more sensitive environment that does not so harshly relegate them en masse to the category of ‘ old people’ and does not emphasize, in attitudes and actions, their increasing dependency ; many need help, too, in coming to terms with the process of ageing and the major adjustments it entails — to retirement, to relinquishing their home, etc.	0 0 0 0 0 0 0 0 0 0 0 0 0 0 0 0 0 0 0 0 0 0 0 0 0 0 0 0 0 0 0 0 0 0 0 0 0 0 0 1 1 1 1 0 0 0 0 0 0 0 0 0 0 0 0 0 0 0 0 0 0	come to terms with	figurative	inflection	PRON VERB DET ADV ADJ NOUN ADJ VERB ADV ADV ADV VERB PRON ADP X ADP DET NOUN ADP PUNCT ADJ NOUN CCONJ VERB ADV VERB ADP NOUN CCONJ NOUN ADJ VERB NOUN PUNCT ADJ VERB NOUN ADV ADP VERB ADP NOUN ADP DET NOUN ADP VERB CCONJ DET ADJ NOUN PRON VERB PUNCT PART NOUN ADP VERB ADJ NOUN X	▁They ▁deserve ▁a ▁more ▁sensitive ▁environment ▁that ▁does ▁not ▁so ▁harsh ly ▁relegat e ▁them ▁en ▁mass e ▁to ▁the ▁category ▁of ▁ ‘ ▁old ▁people ’ ▁and ▁does ▁not ▁emphasize , ▁in ▁attitudes ▁and ▁actions , ▁their ▁increasing ▁dependency ▁ ; ▁many ▁need ▁help , ▁too , ▁in ▁coming ▁to ▁terms ▁with ▁the ▁process ▁of ▁ageing ▁and ▁the ▁major ▁adjustments ▁it ▁entails ▁ — ▁to ▁retirement , ▁to ▁relinquish ing ▁their ▁home , ▁etc .	0 0 0 0 0 0 0 0 0 0 0 0 0 0 0 0 0 0 0 0 0 0 0 0 0 0 0 0 0 0 0 0 0 0 0 0 0 0 0 0 0 0 0 0 0 0 0 0 0 1 1 1 1 0 0 0 0 0 0 0 0 0 0 0 0 0 0 0 0 0 0 0 0 0 0 0	PRON VERB DET ADV ADJ NOUN ADJ VERB ADV ADV ADV ADV VERB VERB PRON ADP X X ADP DET NOUN ADP PUNCT PUNCT ADJ NOUN NOUN CCONJ VERB ADV VERB VERB ADP NOUN CCONJ NOUN NOUN ADJ VERB NOUN PUNCT PUNCT ADJ VERB NOUN NOUN ADV ADV ADP VERB ADP NOUN ADP DET NOUN ADP VERB CCONJ DET ADJ NOUN PRON VERB PUNCT PUNCT PART NOUN NOUN ADP VERB VERB ADJ NOUN NOUN X X
It took her a long time to come to terms with that presence ; the proximity of an armed police officer was the most potent reminder of the gilded cage she had now entered.	0 0 0 0 0 0 0 1 1 1 1 0 0 0 0 0 0 0 0 0 0 0 0 0 0 0 0 0 0 0 0 0 0 0	come to terms with	figurative	identical	PRON VERB PRON DET ADJ NOUN PART VERB ADP NOUN ADP DET NOUN PUNCT DET NOUN ADP DET ADJ NOUN NOUN VERB DET ADV ADJ NOUN ADP DET VERB NOUN PRON VERB ADV VERB	▁It ▁took ▁her ▁a ▁long ▁time ▁to ▁come ▁to ▁terms ▁with ▁that ▁presence ▁ ; ▁the ▁proximity ▁of ▁an ▁armed ▁police ▁officer ▁was ▁the ▁most ▁potent ▁reminder ▁of ▁the ▁g il d ed ▁cage ▁she ▁had ▁now ▁entered .	0 0 0 0 0 0 0 1 1 1 1 0 0 0 0 0 0 0 0 0 0 0 0 0 0 0 0 0 0 0 0 0 0 0 0 0 0 0 0	PRON VERB PRON DET ADJ NOUN PART VERB ADP NOUN ADP DET NOUN PUNCT PUNCT DET NOUN ADP DET ADJ NOUN NOUN VERB DET ADV ADJ NOUN ADP DET VERB VERB VERB VERB NOUN PRON VERB ADV VERB VERB
As she endeavoured to come to terms with the realities of her marriage and royal life, there were moments in those early years when Diana sensed that she actually could cope and could make a positive contribution to the royal family and the wider nation.	0 0 0 0 1 1 1 1 0 0 0 0 0 0 0 0 0 0 0 0 0 0 0 0 0 0 0 0 0 0 0 0 0 0 0 0 0 0 0 0 0 0 0 0 0	come to terms with	figurative	identical	ADP PRON VERB PART VERB ADP NOUN ADP DET NOUN ADP ADJ NOUN CCONJ ADJ NOUN ADV VERB NOUN ADP DET ADJ NOUN ADV PROPN VERB ADP PRON ADV VERB VERB CCONJ VERB VERB DET ADJ NOUN ADP DET ADJ NOUN CCONJ DET ADJ NOUN	▁As ▁she ▁endeavour ed ▁to ▁come ▁to ▁terms ▁with ▁the ▁realities ▁of ▁her ▁marriage ▁and ▁royal ▁life , ▁there ▁were ▁moment s ▁in ▁those ▁early ▁years ▁when ▁D iana ▁sense d ▁that ▁she ▁actually ▁could ▁cope ▁and ▁could ▁make ▁a ▁positive ▁contribution ▁to ▁the ▁royal ▁family ▁and ▁the ▁wider ▁nation .	0 0 0 0 0 1 1 1 1 0 0 0 0 0 0 0 0 0 0 0 0 0 0 0 0 0 0 0 0 0 0 0 0 0 0 0 0 0 0 0 0 0 0 0 0 0 0 0 0 0 0	ADP PRON VERB VERB PART VERB ADP NOUN ADP DET NOUN ADP ADJ NOUN CCONJ ADJ NOUN NOUN ADV VERB NOUN NOUN ADP DET ADJ NOUN ADV PROPN PROPN VERB VERB ADP PRON ADV VERB VERB CCONJ VERB VERB DET ADJ NOUN ADP DET ADJ NOUN CCONJ DET ADJ NOUN NOUN
However, while the resolution of the immediate crises in the user's life and the provision of a counselling service to help users think objectively about their position may provide the ‘ ideal conditions’ for coming off, users must still come to terms with their addiction, their lifestyle and whether the alternatives on offer hold sufficient promise.	0 0 0 0 0 0 0 0 0 0 0 0 0 0 0 0 0 0 0 0 0 0 0 0 0 0 0 0 0 0 0 0 0 0 0 0 0 0 0 1 1 1 1 0 0 0 0 0 0 0 0 0 0 0 0 0	come to terms with	figurative	identical	ADV ADP DET NOUN ADP DET ADJ NOUN ADP DET NOUN NOUN CCONJ DET NOUN ADP DET NOUN NOUN PART VERB NOUN VERB ADV ADP ADJ NOUN VERB VERB DET PUNCT ADJ NOUN ADP VERB PART NOUN VERB ADV VERB ADP NOUN ADP ADJ NOUN ADJ NOUN CCONJ ADP DET NOUN ADP NOUN VERB ADJ NOUN	▁However , ▁while ▁the ▁resolution ▁of ▁the ▁immediate ▁crises ▁in ▁the ▁user ' s ▁life ▁and ▁the ▁provision ▁of ▁a ▁counselling ▁service ▁to ▁help ▁users ▁think ▁objectively ▁about ▁their ▁position ▁may ▁provide ▁the ▁ ‘ ▁ideal ▁conditions ’ ▁for ▁coming ▁off , ▁users ▁must ▁still ▁come ▁to ▁terms ▁with ▁their ▁addiction , ▁their ▁lifestyle ▁and ▁whether ▁the ▁alternatives ▁on ▁offer ▁hold ▁sufficient ▁promise .	0 0 0 0 0 0 0 0 0 0 0 0 0 0 0 0 0 0 0 0 0 0 0 0 0 0 0 0 0 0 0 0 0 0 0 0 0 0 0 0 0 0 0 0 0 1 1 1 1 0 0 0 0 0 0 0 0 0 0 0 0 0 0 0	ADV ADV ADP DET NOUN ADP DET ADJ NOUN ADP DET NOUN NOUN NOUN NOUN CCONJ DET NOUN ADP DET NOUN NOUN PART VERB NOUN VERB ADV ADP ADJ NOUN VERB VERB DET PUNCT PUNCT ADJ NOUN NOUN ADP VERB PART PART NOUN VERB ADV VERB ADP NOUN ADP ADJ NOUN NOUN ADJ NOUN CCONJ ADP DET NOUN ADP NOUN VERB ADJ NOUN NOUN
The Apex conference must come to terms with the nature of that amalgamation and that said that the Apex conference would concern itself with matters of interest to white collar workers.	0 0 0 0 1 1 1 1 0 0 0 0 0 0 0 0 0 0 0 0 0 0 0 0 0 0 0 0 0 0 0	come to terms with	figurative	identical	DET PROPN NOUN VERB VERB ADP NOUN ADP DET NOUN ADP DET NOUN CCONJ ADJ VERB ADP DET PROPN NOUN VERB VERB PRON ADP NOUN ADP NOUN ADP ADJ NOUN NOUN	▁The ▁Ap ex ▁conference ▁must ▁come ▁to ▁terms ▁with ▁the ▁nature ▁of ▁that ▁amalgam ation ▁and ▁that ▁said ▁that ▁the ▁Ap ex ▁conference ▁would ▁concern ▁itself ▁with ▁matters ▁of ▁interest ▁to ▁white ▁collar ▁workers .	0 0 0 0 0 1 1 1 1 0 0 0 0 0 0 0 0 0 0 0 0 0 0 0 0 0 0 0 0 0 0 0 0 0 0	DET PROPN PROPN NOUN VERB VERB ADP NOUN ADP DET NOUN ADP DET NOUN NOUN CCONJ ADJ VERB ADP DET PROPN PROPN NOUN VERB VERB PRON ADP NOUN ADP NOUN ADP ADJ NOUN NOUN NOUN
The general level of pain and fear for all gay men who call is now higher and just below the surface, as many of them seek to come to terms with the virus and its effect on their lives.	0 0 0 0 0 0 0 0 0 0 0 0 0 0 0 0 0 0 0 0 0 0 0 0 0 0 0 1 1 1 1 0 0 0 0 0 0 0 0	come to terms with	figurative	identical	DET ADJ NOUN ADP NOUN CCONJ NOUN ADP DET ADJ NOUN NOUN VERB VERB ADV ADJ CCONJ ADV ADP DET NOUN ADP ADJ ADP PRON VERB PART VERB ADP NOUN ADP DET NOUN CCONJ ADJ NOUN ADP ADJ NOUN	▁The ▁general ▁level ▁of ▁pain ▁and ▁fear ▁for ▁all ▁g ay ▁men ▁who ▁call ▁is ▁now ▁higher ▁and ▁just ▁below ▁the ▁surface , ▁as ▁many ▁of ▁them ▁seek ▁to ▁come ▁to ▁terms ▁with ▁the ▁virus ▁and ▁its ▁effect ▁on ▁their ▁lives .	0 0 0 0 0 0 0 0 0 0 0 0 0 0 0 0 0 0 0 0 0 0 0 0 0 0 0 0 0 1 1 1 1 0 0 0 0 0 0 0 0 0	DET ADJ NOUN ADP NOUN CCONJ NOUN ADP DET ADJ ADJ NOUN NOUN VERB VERB ADV ADJ CCONJ ADV ADP DET NOUN NOUN ADP ADJ ADP PRON VERB PART VERB ADP NOUN ADP DET NOUN CCONJ ADJ NOUN ADP ADJ NOUN NOUN
This is a vulnerable moment in our lives and the way the funeral and its aftermath are handled can affect how people subsequently come to terms with their bereavement.	0 0 0 0 0 0 0 0 0 0 0 0 0 0 0 0 0 0 0 0 0 0 0 1 1 1 1 0 0	come to terms with	figurative	identical	DET VERB DET ADJ NOUN ADP ADJ NOUN CCONJ DET NOUN DET NOUN CCONJ ADJ NOUN VERB VERB VERB VERB ADV NOUN ADV VERB ADP NOUN ADP ADJ ADJ	▁This ▁is ▁a ▁vulnerable ▁moment ▁in ▁our ▁lives ▁and ▁the ▁way ▁the ▁funeral ▁and ▁its ▁aftermath ▁are ▁handled ▁can ▁affect ▁how ▁people ▁subsequently ▁come ▁to ▁terms ▁with ▁their ▁be re ave ment .	0 0 0 0 0 0 0 0 0 0 0 0 0 0 0 0 0 0 0 0 0 0 0 1 1 1 1 0 0 0 0 0 0	DET VERB DET ADJ NOUN ADP ADJ NOUN CCONJ DET NOUN DET NOUN CCONJ ADJ NOUN VERB VERB VERB VERB ADV NOUN ADV VERB ADP NOUN ADP ADJ ADJ ADJ ADJ ADJ ADJ
There have been earlier references to the changing and elastic notion of priorities which takes some time to come to terms with.	0 0 0 0 0 0 0 0 0 0 0 0 0 0 0 0 0 0 1 1 1 1	come to terms with	figurative	identical	ADV VERB VERB ADJ NOUN ADP DET VERB CCONJ ADJ NOUN ADP NOUN ADJ VERB DET NOUN PART VERB ADP NOUN ADP	▁There ▁have ▁been ▁earlier ▁references ▁to ▁the ▁changing ▁and ▁elastic ▁notion ▁of ▁priorities ▁which ▁takes ▁some ▁time ▁to ▁come ▁to ▁terms ▁with .	0 0 0 0 0 0 0 0 0 0 0 0 0 0 0 0 0 0 1 1 1 1 1	ADV VERB VERB ADJ NOUN ADP DET VERB CCONJ ADJ NOUN ADP NOUN ADJ VERB DET NOUN PART VERB ADP NOUN ADP ADP
All this has happened because enormous sums of public money available for drainage schemes since the War have combined with a revolution in technology which we have not yet fully come to terms with.	0 0 0 0 0 0 0 0 0 0 0 0 0 0 0 0 0 0 0 0 0 0 0 0 0 0 0 0 0 0 1 1 1 1	come to terms with	figurative	identical	ADJ DET VERB VERB ADP ADJ NOUN ADP ADJ NOUN ADJ ADP NOUN NOUN ADP DET PROPN VERB VERB ADP DET NOUN ADP NOUN ADJ PRON VERB ADV ADV ADV VERB ADP NOUN ADP	▁All ▁this ▁has ▁happened ▁because ▁enormous ▁sums ▁of ▁public ▁money ▁available ▁for ▁drainage ▁schemes ▁since ▁the ▁War ▁have ▁combined ▁with ▁a ▁revolution ▁in ▁technology ▁which ▁we ▁have ▁not ▁yet ▁fully ▁come ▁to ▁terms ▁with .	0 0 0 0 0 0 0 0 0 0 0 0 0 0 0 0 0 0 0 0 0 0 0 0 0 0 0 0 0 0 1 1 1 1 1	ADJ DET VERB VERB ADP ADJ NOUN ADP ADJ NOUN ADJ ADP NOUN NOUN ADP DET PROPN VERB VERB ADP DET NOUN ADP NOUN ADJ PRON VERB ADV ADV ADV VERB ADP NOUN ADP ADP
After it has killed one or more rabbits it will have to come to terms with its duties and thereafter it is fitted with a muzzle.	0 0 0 0 0 0 0 0 0 0 0 0 1 1 1 1 0 0 0 0 0 0 0 0 0 0	come to terms with	figurative	identical	ADP PRON VERB VERB NUM CCONJ ADJ NOUN PRON VERB VERB PART VERB ADP NOUN ADP ADJ NOUN CCONJ ADV PRON VERB VERB ADP DET NOUN	▁After ▁it ▁has ▁killed ▁one ▁or ▁more ▁rabbits ▁it ▁will ▁have ▁to ▁come ▁to ▁terms ▁with ▁its ▁duties ▁and ▁thereafter ▁it ▁is ▁fitted ▁with ▁a ▁mu zz le .	0 0 0 0 0 0 0 0 0 0 0 0 1 1 1 1 0 0 0 0 0 0 0 0 0 0 0 0 0	ADP PRON VERB VERB NUM CCONJ ADJ NOUN PRON VERB VERB PART VERB ADP NOUN ADP ADJ NOUN CCONJ ADV PRON VERB VERB ADP DET NOUN NOUN NOUN NOUN
Even after his death, when most of his servants had come to terms with the new regime, several remembered him with respect and affection.	0 0 0 0 0 0 0 0 0 0 1 1 1 1 0 0 0 0 0 0 0 0 0 0	come to terms with	figurative	identical	ADV ADP ADJ NOUN ADV ADJ ADP ADJ NOUN VERB VERB ADP NOUN ADP DET ADJ NOUN ADJ VERB PRON ADP NOUN CCONJ NOUN	▁Even ▁after ▁his ▁death , ▁when ▁most ▁of ▁his ▁servants ▁had ▁come ▁to ▁terms ▁with ▁the ▁new ▁regime , ▁several ▁remembered ▁him ▁with ▁respect ▁and ▁affect ion .	0 0 0 0 0 0 0 0 0 0 0 1 1 1 1 0 0 0 0 0 0 0 0 0 0 0 0 0	ADV ADP ADJ NOUN NOUN ADV ADJ ADP ADJ NOUN VERB VERB ADP NOUN ADP DET ADJ NOUN NOUN ADJ VERB PRON ADP NOUN CCONJ NOUN NOUN NOUN
I think the problem with a clear remit I can't really come to terms with that, precisely, competitive.	0 0 0 0 0 0 0 0 0 0 0 1 1 1 1 0 0 0	come to terms with	figurative	identical	PRON VERB DET NOUN ADP DET ADJ NOUN PRON VERB ADV VERB ADP NOUN ADP DET ADV ADJ	▁I ▁think ▁the ▁problem ▁with ▁a ▁clear ▁remit ▁I ▁can ' t ▁really ▁come ▁to ▁terms ▁with ▁that , ▁precisely , ▁competitive .	0 0 0 0 0 0 0 0 0 0 0 0 0 1 1 1 1 0 0 0 0 0 0	PRON VERB DET NOUN ADP DET ADJ NOUN PRON VERB VERB VERB ADV VERB ADP NOUN ADP DET DET ADV ADV ADJ ADJ
I hurt her pride and she was never able to come to terms with that.	0 0 0 0 0 0 0 0 0 0 1 1 1 1 0	come to terms with	figurative	identical	PRON VERB ADJ NOUN CCONJ PRON VERB ADV ADJ PART VERB ADP NOUN ADP DET	▁I ▁hurt ▁her ▁pride ▁and ▁she ▁was ▁never ▁able ▁to ▁come ▁to ▁terms ▁with ▁that .	0 0 0 0 0 0 0 0 0 0 1 1 1 1 0 0	PRON VERB ADJ NOUN CCONJ PRON VERB ADV ADJ PART VERB ADP NOUN ADP DET DET
Here, Joanna, her mother and father John tell Penny Wark of their struggle to come to terms with tragedy.	0 0 0 0 0 0 0 0 0 0 0 0 0 0 1 1 1 1 0	come to terms with	figurative	identical	ADV PROPN ADJ NOUN CCONJ NOUN PROPN VERB PROPN PROPN ADP ADJ NOUN PART VERB ADP NOUN ADP NOUN	▁Here , ▁Jo anna , ▁her ▁mother ▁and ▁father ▁John ▁tell ▁Pen ny ▁War k ▁of ▁their ▁struggle ▁to ▁come ▁to ▁terms ▁with ▁tragedy .	0 0 0 0 0 0 0 0 0 0 0 0 0 0 0 0 0 0 0 1 1 1 1 0 0	ADV ADV PROPN PROPN PROPN ADJ NOUN CCONJ NOUN PROPN VERB PROPN PROPN PROPN PROPN ADP ADJ NOUN PART VERB ADP NOUN ADP NOUN NOUN
Sixteen years later, it has become clear that the Israelis have made no effort to come to terms with Palestinian national aspirations – and that no effective effort has been made to convince them.	0 0 0 0 0 0 0 0 0 0 0 0 0 0 0 1 1 1 1 0 0 0 0 0 0 0 0 0 0 0 0 0 0 0	come to terms with	figurative	identical	NUM NOUN ADV PRON VERB VERB ADJ ADP DET PROPN VERB VERB DET NOUN PART VERB ADP NOUN ADP ADJ ADJ NOUN PUNCT CCONJ ADP DET ADJ NOUN VERB VERB VERB PART VERB PRON	▁Six te en ▁years ▁later , ▁it ▁has ▁become ▁clear ▁that ▁the ▁Israeli s ▁have ▁made ▁no ▁effort ▁to ▁come ▁to ▁terms ▁with ▁Palestinian ▁national ▁aspirations ▁ – ▁and ▁that ▁no ▁effective ▁effort ▁has ▁been ▁made ▁to ▁convince ▁them .	0 0 0 0 0 0 0 0 0 0 0 0 0 0 0 0 0 0 0 1 1 1 1 0 0 0 0 0 0 0 0 0 0 0 0 0 0 0 0 0	NUM NUM NUM NOUN ADV ADV PRON VERB VERB ADJ ADP DET PROPN PROPN VERB VERB DET NOUN PART VERB ADP NOUN ADP ADJ ADJ NOUN PUNCT PUNCT CCONJ ADP DET ADJ NOUN VERB VERB VERB PART VERB PRON PRON
WORKERS at a Merseyide firm were today coming to terms with the news that they will be out of work in the New Year.	0 0 0 0 0 0 0 1 1 1 1 0 0 0 0 0 0 0 0 0 0 0 0 0	come to terms with	figurative	inflection	NOUN ADP DET PROPN NOUN VERB NOUN VERB ADP NOUN ADP DET NOUN ADP PRON VERB VERB ADP ADP NOUN ADP DET PROPN PROPN	▁WORKERS ▁at ▁a ▁Mer s ey ide ▁firm ▁were ▁today ▁coming ▁to ▁terms ▁with ▁the ▁new s ▁that ▁they ▁will ▁be ▁out ▁of ▁work ▁in ▁the ▁New ▁Year .	0 0 0 0 0 0 0 0 0 0 1 1 1 1 0 0 0 0 0 0 0 0 0 0 0 0 0 0 0	NOUN ADP DET PROPN PROPN PROPN PROPN NOUN VERB NOUN VERB ADP NOUN ADP DET NOUN NOUN ADP PRON VERB VERB ADP ADP NOUN ADP DET PROPN PROPN PROPN
According to the testimony of Abbess Aelfflaed, it was Aldfrith's dying wish that his successor should come to terms with Wilfrid ( Vita Wilfridi, ch. 59 ).	0 0 0 0 0 0 0 0 0 0 0 0 0 0 0 0 1 1 1 1 0 0 0 0 0 0 0	come to terms with	figurative	identical	VERB ADP DET NOUN ADP PROPN PROPN PRON VERB PROPN VERB NOUN ADP ADJ NOUN VERB VERB ADP NOUN ADP PROPN PUNCT PROPN PROPN X NUM PUNCT	▁According ▁to ▁the ▁testimony ▁of ▁Ab bes s ▁A el ff la ed , ▁it ▁was ▁Al d fri th ' s ▁dying ▁wish ▁that ▁his ▁successor ▁should ▁come ▁to ▁terms ▁with ▁Wil fri d ▁( ▁V ita ▁Wil fri di , ▁ch . ▁59 ▁ ).	0 0 0 0 0 0 0 0 0 0 0 0 0 0 0 0 0 0 0 0 0 0 0 0 0 0 0 0 1 1 1 1 0 0 0 0 0 0 0 0 0 0 0 0 0 0 0	VERB ADP DET NOUN ADP PROPN PROPN PROPN PROPN PROPN PROPN PROPN PROPN PROPN PRON VERB PROPN PROPN PROPN PROPN PROPN PROPN VERB NOUN ADP ADJ NOUN VERB VERB ADP NOUN ADP PROPN PROPN PROPN PUNCT PROPN PROPN PROPN PROPN PROPN PROPN X X NUM PUNCT PUNCT
