A fortnight ago, she had been too taken aback by the idea to absorb what it could imply, but before anything was fixed there were matters which she and Vitor must discuss, parameters to be defined, agreements which needed to be cut and dried.	0 0 0 0 0 0 0 0 0 0 0 0 0 0 0 0 0 0 0 0 0 0 0 0 0 0 0 0 0 0 0 0 0 0 0 0 0 0 0 0 0 1 1 1	cut and dried	figurative	identical	DET NOUN ADV PRON VERB VERB ADV VERB ADV ADP DET NOUN PART VERB NOUN PRON VERB VERB CCONJ ADP NOUN VERB VERB ADV VERB NOUN ADJ PRON CCONJ PROPN VERB VERB NOUN PART VERB VERB NOUN ADJ VERB PART VERB VERB CCONJ VERB
Some of the universe is pretty much cut and dried.	0 0 0 0 0 0 0 1 1 1	cut and dried	figurative	identical	DET ADP DET NOUN VERB ADV ADV NOUN CCONJ VERB
While the Court of Appeal is ultimately responsible for establishing the tariff, this is far from being a cut - and - dried list of appropriate penalties.	0 0 0 0 0 0 0 0 0 0 0 0 0 0 0 0 0 0 1 0 1 0 1 0 0 0 0	cut and dried	figurative	dashes	ADP DET PROPN ADP PROPN VERB ADV ADJ ADP VERB DET NOUN DET VERB ADV ADP VERB DET VERB PUNCT CCONJ PUNCT VERB NOUN ADP ADJ NOUN
Perms, interestingly, don't vary in price quite as much but check before you go in clutching your pennies, if the perm includes the cut and blow dry as well, otherwise that could come as an expensive little shock.	0 0 0 0 0 0 0 0 0 0 0 0 0 0 0 0 0 0 0 0 0 0 0 1 1 0 1 0 0 0 0 0 0 0 0 0 0 0	cut and dried	literal	combined-inflection	NOUN ADV VERB VERB ADP NOUN ADV ADV ADJ CCONJ VERB ADP PRON VERB ADP VERB ADJ NOUN ADP DET NOUN VERB DET NOUN CCONJ VERB ADJ ADV ADV ADV ADJ VERB VERB ADP DET ADJ ADJ NOUN
The facts seem cut and dried, but I am afraid there has been a grave misunderstanding.	0 0 0 1 1 1 0 0 0 0 0 0 0 0 0 0	cut and dried	figurative	identical	DET NOUN VERB VERB CCONJ VERB CCONJ PRON VERB ADJ ADV VERB VERB DET ADJ NOUN
The loved one is an ice - cool blonde genius murder suspect ( Stone ), and the finale isn't quite as cut - and - dried as expected, which gives protestors a problem : in order to give away the ending, they 'll have to understand it first.	0 0 0 0 0 0 0 0 0 0 0 0 0 0 0 0 0 0 0 0 0 1 0 1 0 1 0 0 0 0 0 0 0 0 0 0 0 0 0 0 0 0 0 0 0 0 0 0	cut and dried	figurative	dashes	DET ADJ NOUN VERB DET NOUN PUNCT ADJ ADJ NOUN NOUN NOUN PUNCT NOUN PUNCT CCONJ DET NOUN VERB ADV ADP VERB PUNCT CCONJ PUNCT VERB ADP VERB ADJ VERB NOUN DET NOUN PUNCT ADP NOUN PART VERB PART DET NOUN PRON VERB VERB PART VERB PRON ADV
FLOWERING grasses in the garden and the seed heads of bulbous plants, like the ornamental onions ( Allium ), are ready to be cut and dried for winter flower arrangements.	0 0 0 0 0 0 0 0 0 0 0 0 0 0 0 0 0 0 0 0 0 0 0 1 1 1 0 0 0 0	cut and dried	literal	identical	VERB NOUN ADP DET NOUN CCONJ DET NOUN NOUN ADP ADJ NOUN ADP DET ADJ NOUN PUNCT PROPN PUNCT VERB ADJ PART VERB VERB CCONJ VERB ADP NOUN NOUN NOUN
Also the grass grows for only a short - season, and the amount of hay which can be cut and dried varies from one year to the next.	0 0 0 0 0 0 0 0 0 0 0 0 0 0 0 0 0 0 1 1 1 0 0 0 0 0 0 0	cut and dried	literal	identical	ADV DET NOUN VERB ADP ADV DET ADJ PUNCT NOUN CCONJ DET NOUN ADP NOUN ADJ VERB VERB VERB CCONJ VERB NOUN ADP NUM NOUN ADP DET ADJ
You could find that this is just the beginning and that your plans aren't quite as cut and dried as they appear.’	0 0 0 0 0 0 0 0 0 0 0 0 0 0 0 0 1 1 1 0 0 0	cut and dried	figurative	identical	PRON VERB VERB ADP DET VERB ADV DET NOUN CCONJ ADP ADJ NOUN VERB ADV ADP NOUN CCONJ VERB ADP PRON VERB
Yesterday's proceedings were not entirely cut and dried.	0 0 0 0 0 1 1 1	cut and dried	figurative	identical	NOUN NOUN VERB ADV ADV VERB CCONJ VERB
So the inquiry is by no means cut and dried and they 're now trying to piece together the last hours of the dead woman's life.	0 0 0 0 0 0 0 1 1 1 0 0 0 0 0 0 0 0 0 0 0 0 0 0 0 0	cut and dried	figurative	identical	ADV DET NOUN VERB ADP DET NOUN VERB CCONJ VERB CCONJ PRON VERB ADV VERB PART VERB ADV DET ADJ NOUN ADP DET ADJ NOUN NOUN
I was only trying to warn you that things aren't always cut and dried.	0 0 0 0 0 0 0 0 0 0 0 1 1 1	cut and dried	figurative	identical	PRON VERB ADV VERB PART VERB PRON ADP NOUN VERB ADV VERB CCONJ VERB
It was cut and dried.	0 0 1 1 1	cut and dried	figurative	identical	PRON VERB VERB CCONJ VERB
So it can be seen that what was originally a technical question of the definition of tolerable rates of soil loss is a crucial, and deeply ideological one, and therefore not amenable to the cut - and - dried standards of proof on empirical grounds.	0 0 0 0 0 0 0 0 0 0 0 0 0 0 0 0 0 0 0 0 0 0 0 0 0 0 0 0 0 0 0 0 0 0 1 0 1 0 1 0 0 0 0 0 0	cut and dried	figurative	dashes	ADV PRON VERB VERB VERB ADP NOUN VERB ADV DET ADJ NOUN ADP DET NOUN ADP ADJ NOUN ADP NOUN NOUN VERB DET ADJ CCONJ ADV ADJ NUM CCONJ ADV ADV ADJ ADP DET VERB PUNCT CCONJ PUNCT VERB NOUN ADP NOUN ADP ADJ NOUN
•There's no cut - and - dried answer to your question, but I can tell you that a great many people would disagree with you — both about your view of your own childhood and about smacking your children with a slipper.	0 0 1 0 1 0 1 0 0 0 0 0 0 0 0 0 0 0 0 0 0 0 0 0 0 0 0 0 0 0 0 0 0 0 0 0 0 0 0 0 0 0	cut and dried	figurative	dashes	PROPN DET NOUN PUNCT CCONJ PUNCT VERB NOUN ADP ADJ NOUN CCONJ PRON VERB VERB PRON ADP DET ADJ ADJ NOUN VERB VERB ADP PRON PUNCT CCONJ ADP ADJ NOUN ADP ADJ ADJ NOUN CCONJ ADP VERB ADJ NOUN ADP DET NOUN
' The French mistletoe ( exactly the same species ) is cut earlier and dries out more because of the distance it comes, ' he says.	0 0 0 0 0 0 0 0 0 0 0 1 0 1 1 0 0 0 0 0 0 0 0 0 0 0	cut and dried	literal	combined-inflection	PUNCT DET ADJ NOUN PUNCT ADV DET ADJ NOUN PUNCT VERB VERB ADV CCONJ VERB PART ADV ADP ADP DET NOUN PRON VERB PUNCT PRON VERB
A My hair is so thick, it's a hairdresser's nightmare — it takes ages to cut and blow - dry.	0 0 0 0 0 0 0 0 0 0 0 0 0 0 0 1 1 0 0 1	cut and dried	literal	combined-inflection	DET ADJ NOUN VERB ADV ADJ PRON DET NOUN NOUN PUNCT PRON VERB NOUN PART VERB CCONJ VERB PUNCT ADJ
There was only one stroke in it after the first round ( Thomson 68 ; Thomas 69 ), so it wasn't cut - and - dried.	0 0 0 0 0 0 0 0 0 0 0 0 0 0 0 0 0 0 0 0 0 1 0 1 0 1	cut and dried	figurative	dashes	ADV VERB ADV NUM NOUN ADP PRON ADP DET ADJ NOUN PUNCT PROPN NUM PUNCT PROPN NUM PUNCT CCONJ PRON VERB VERB PUNCT CCONJ PUNCT VERB
I knew it wouldn't be cut and dried vs Man City so I was pleased with the result.	0 0 0 0 0 1 1 1 0 0 0 0 0 0 0 0 0 0	cut and dried	figurative	identical	PRON VERB PRON VERB VERB VERB CCONJ VERB ADP PROPN PROPN ADV PRON VERB ADJ ADP DET NOUN
In second it's cut and dry	0 0 0 1 1 1	cut and dried	figurative	inflection	ADP ADJ PRON VERB CCONJ ADJ
Now the erm judging people want everything to be, well they prefer to have everything cut and dried, sorted out, closed off, decided.	0 0 0 0 0 0 0 0 0 0 0 0 0 0 0 1 1 1 0 0 0 0 0	cut and dried	figurative	identical	ADV DET NOUN VERB NOUN VERB NOUN PART VERB INTJ PRON VERB PART VERB NOUN VERB CCONJ VERB VERB PART VERB PART VERB
‘ You like your orders cut and dried.	0 0 0 0 0 1 1 1	cut and dried	figurative	identical	PUNCT PRON VERB ADJ NOUN VERB CCONJ VERB
Yes, let's call between appendix two, just to make it absolutely cut and dried.	0 0 0 0 0 0 0 0 0 0 0 1 1 1	cut and dried	figurative	identical	INTJ VERB VERB ADP NOUN NUM ADV PART VERB PRON ADV VERB CCONJ VERB
He preferred having his hair cut and blow - dried in a unisex salon, even if it was dearer.	0 0 0 0 0 1 1 0 0 1 0 0 0 0 0 0 0 0 0	cut and dried	literal	combined-other	PRON VERB VERB ADJ NOUN VERB CCONJ VERB PUNCT VERB ADP DET ADJ NOUN ADV ADP PRON VERB NOUN
Perms range from £ 18.50 to £ 22.50, not including cut and blow dry.	0 0 0 0 0 0 0 0 0 0 1 1 0 1	cut and dried	literal	combined-inflection	NOUN VERB ADP SYM NUM ADP SYM NUM ADV VERB VERB CCONJ VERB ADJ
( GMRB 4. 6. 1988 ) The case, it was said, was ‘ basically cut and dried’, thus publicly condemning the six before they were even tried.	0 0 0 0 0 0 0 0 0 0 0 0 0 0 1 1 1 0 0 0 0 0 0 0 0 0 0	cut and dried	figurative	dashes	PUNCT NOUN NUM NUM NUM PUNCT DET NOUN PRON VERB VERB VERB PUNCT ADV ADJ CCONJ ADJ ADV ADV VERB DET NUM ADP PRON VERB ADV VERB
A great deal more has to be learned in this area, but it will be evident that even in its genetic aspects ( and others also have an effect ) sex and gender are not an absolutely cut and dried business.	0 0 0 0 0 0 0 0 0 0 0 0 0 0 0 0 0 0 0 0 0 0 0 0 0 0 0 0 0 0 0 0 0 0 0 0 0 1 1 1 0	cut and dried	figurative	identical	DET ADJ NOUN ADJ VERB PART VERB VERB ADP DET NOUN CCONJ PRON VERB VERB ADJ ADP ADV ADP ADJ ADJ NOUN PUNCT CCONJ NOUN ADV VERB DET NOUN PUNCT NOUN CCONJ NOUN VERB ADV DET ADV VERB CCONJ VERB NOUN
‘ It is not as cut and dried as that,’ Bragg said evenly.	0 0 0 0 0 1 1 1 0 0 0 0 0	cut and dried	figurative	identical	PUNCT PRON VERB ADV ADV VERB CCONJ VERB ADP PROPN PROPN VERB ADV
Don't expect everything to be crystal clear, or cut and dried for Monday's one of those times when you have to take the lead and not wait for folk to spell things out in words of one syllable.	0 0 0 0 0 0 0 0 1 1 1 0 0 0 0 0 0 0 0 0 0 0 0 0 0 0 0 0 0 0 0 0 0 0 0 0 0 0	cut and dried	figurative	identical	VERB VERB NOUN PART VERB NOUN ADJ CCONJ VERB CCONJ VERB ADP PROPN NUM ADP DET NOUN ADV PRON VERB PART VERB DET NOUN CCONJ ADV VERB ADP NOUN PART VERB NOUN PART ADP NOUN ADP NUM NOUN
Episcopal power was not cut and dried, although the canons, the saints ' Lives and the epitaphs of bishops would like us to think that it was.	0 0 0 0 1 1 1 0 0 0 0 0 0 0 0 0 0 0 0 0 0 0 0 0 0 0 0	cut and dried	figurative	identical	ADJ NOUN VERB ADV VERB CCONJ VERB ADP DET NOUN DET NOUN PART NOUN CCONJ DET NOUN ADP NOUN VERB VERB PRON PART VERB ADP PRON VERB
That's the plot in cut and dried form, though there's the added twist of Keaton initially agreeing to undergo treatment only as a means of outmanouevring his creditors.	0 0 0 0 1 1 1 0 0 0 0 0 0 0 0 0 0 0 0 0 0 0 0 0 0 0 0 0	cut and dried	figurative	identical	DET DET NOUN ADP NOUN CCONJ VERB NOUN ADP ADV DET VERB NOUN ADP PROPN ADV VERB PART VERB NOUN ADV ADP DET NOUN ADP VERB ADJ NOUN
After 18 hours ' organ culture in medium with or without the addition of 1,25 ( OH)2 D 3 ( 100 pM ), paired mucosal explants were mounted and then 3 µm cryostat sections were cut and air dried before blocking in H 2 O 2 ( 0.22 % ) and methanol for 5 minutes.	0 0 0 0 0 0 0 0 0 0 0 0 0 0 0 0 0 0 0 0 0 0 0 0 0 0 0 0 0 0 0 0 0 0 0 1 1 0 1 0 0 0 0 0 0 0 0 0 0 0 0 0 0 0 0	cut and dried	literal	insertion-other	ADP NUM NOUN PART NOUN NOUN ADP NOUN ADP CCONJ ADP DET NOUN ADP NUM PUNCT ADP NOUN NUM PUNCT NUM NOUN PUNCT VERB NOUN NOUN VERB VERB CCONJ ADV NUM NOUN NOUN NOUN VERB VERB CCONJ NOUN VERB ADP VERB ADP NOUN NUM NOUN NUM PUNCT NUM NOUN PUNCT CCONJ NOUN ADP NUM NOUN
She had hoped to guide the early conversation along vaguer, more social channels, not to have this immediate plunge into medical details, definite decisions, not to face a situation already cut and dried by her opponent.	0 0 0 0 0 0 0 0 0 0 0 0 0 0 0 0 0 0 0 0 0 0 0 0 0 0 0 0 0 0 1 1 1 0 0 0	cut and dried	figurative	identical	PRON VERB VERB PART VERB DET ADJ NOUN ADP NOUN ADV ADJ NOUN ADV PART VERB DET ADJ NOUN ADP ADJ NOUN ADJ NOUN ADV PART VERB DET NOUN ADV VERB CCONJ VERB ADP ADJ NOUN
they think that it's all cut and dry, well they haven't got the then people will come round and investigate yet!	0 0 0 0 0 1 1 1 0 0 0 0 0 0 0 0 0 0 0 0 0	cut and dried	figurative	inflection	PRON VERB ADP PRON DET VERB CCONJ ADJ INTJ PRON VERB VERB DET ADV NOUN VERB VERB ADV CCONJ VERB ADV
‘ I have no cut and dry philosophy, but I can't believe that we just die and become dust.	0 0 0 0 1 1 1 0 0 0 0 0 0 0 0 0 0 0 0	cut and dried	figurative	inflection	PUNCT PRON VERB DET NOUN CCONJ ADJ NOUN CCONJ PRON VERB VERB ADP PRON ADV VERB CCONJ VERB NOUN
Erm, well my particular case was cut and dry, no medical miracles, as I say, could help me because I had lost a baby at six months during the labour and erm in order to save to my life I had a hysterectomy so there was no possibility of I V F, etcetera, etcetera.	0 0 0 0 0 0 1 1 1 0 0 0 0 0 0 0 0 0 0 0 0 0 0 0 0 0 0 0 0 0 0 0 0 0 0 0 0 0 0 0 0 0 0 0 0 0 0 0 0 0 0 0 0 0	cut and dried	figurative	inflection	INTJ INTJ ADJ ADJ NOUN VERB VERB CCONJ ADJ DET ADJ NOUN ADP PRON VERB VERB VERB PRON ADP PRON VERB VERB DET NOUN ADP NUM NOUN ADP DET NOUN CCONJ NOUN ADP NOUN PART VERB ADP ADJ NOUN PRON VERB DET NOUN ADV ADV VERB DET NOUN ADP NOUN PROPN NOUN NOUN NOUN
‘ There has been much talk that Rangers have the title sewn up but we still have 58 points to play for and that makes it ludicrously premature to suggest that the destination of the title is cut and dried,’ said Brady.	0 0 0 0 0 0 0 0 0 0 0 0 0 0 0 0 0 0 0 0 0 0 0 0 0 0 0 0 0 0 0 0 0 0 0 0 0 1 1 1 0 0	cut and dried	figurative	dashes	PUNCT ADV VERB VERB ADJ NOUN ADP NOUN VERB DET NOUN VERB PART CCONJ PRON ADV VERB NUM NOUN PART VERB ADP CCONJ DET VERB PRON ADV ADJ PART VERB ADP DET NOUN ADP DET NOUN VERB VERB CCONJ PROPN VERB PROPN
It isn't quite that cut and dried, but if you are signed to a small company with any degree of commitment, you can be sure that the company and their staff are in their weekly meetings pushing to get results from your music.	0 0 0 0 1 1 1 0 0 0 0 0 0 0 0 0 0 0 0 0 0 0 0 0 0 0 0 0 0 0 0 0 0 0 0 0 0 0 0 0 0 0 0	cut and dried	figurative	identical	PRON VERB ADV DET NOUN CCONJ VERB CCONJ ADP PRON VERB VERB ADP DET ADJ NOUN ADP DET NOUN ADP NOUN PRON VERB VERB ADJ ADP DET NOUN CCONJ ADJ NOUN VERB ADP ADJ ADJ NOUN VERB PART VERB NOUN ADP ADJ NOUN
Women's cut and blow dry £ 15.50.	0 1 1 0 1 0 0	cut and dried	literal	combined-inflection	PROPN NOUN CCONJ VERB ADJ SYM NUM
If we compare boys of 14 years of age who opt for science with other boys, we find that the former have very cut - and - dried views on many issues.	0 0 0 0 0 0 0 0 0 0 0 0 0 0 0 0 0 0 0 0 0 0 0 1 0 1 0 1 0 0 0 0	cut and dried	figurative	dashes	ADP PRON VERB NOUN ADP NUM NOUN ADP NOUN NOUN VERB ADP NOUN ADP ADJ NOUN PRON VERB ADP DET ADJ VERB ADV VERB PUNCT CCONJ PUNCT VERB NOUN ADP ADJ NOUN
If Seve Ballesteros had looked a winner all along in 1979, and certainly looked likely to lift the claret jug from a long way out, Dave's second Open success was not so cut - and - dried.	0 0 0 0 0 0 0 0 0 0 0 0 0 0 0 0 0 0 0 0 0 0 0 0 0 0 0 0 0 0 0 0 1 0 1 0 1	cut and dried	figurative	dashes	ADP PROPN PROPN VERB VERB DET NOUN ADV ADV ADP NUM CCONJ ADV VERB ADJ PART VERB DET NOUN NOUN ADP DET ADJ NOUN ADV PROPN ADJ ADJ NOUN VERB ADV ADV VERB PUNCT CCONJ PUNCT VERB