He is often hired to inform Fleet Street about client views or, less charitably, to dish the dirt on opponents.	0 0 0 0 0 0 0 0 0 0 0 0 0 0 0 1 0 1 0 0	dish the dirt	figurative	identical	PRON VERB ADV VERB PART VERB PROPN PROPN ADP NOUN NOUN CCONJ ADV ADV PART VERB DET NOUN ADP NOUN	▁He ▁is ▁often ▁hired ▁to ▁inform ▁Fleet ▁Street ▁about ▁client ▁views ▁or , ▁less ▁char i tably , ▁to ▁dish ▁the ▁dirt ▁on ▁opponents .	0 0 0 0 0 0 0 0 0 0 0 0 0 0 0 0 0 0 0 1 0 1 0 0 0	PRON VERB ADV VERB PART VERB PROPN PROPN ADP NOUN NOUN CCONJ CCONJ ADV ADV ADV ADV ADV PART VERB DET NOUN ADP NOUN NOUN
His death inspired crook Delroy ( Lennie James ) to dish the dirt on the gangsters : redemption and a tidy ending.	0 0 0 0 0 0 0 0 0 0 1 0 1 0 0 0 0 0 0 0 0 0	dish the dirt	figurative	identical	ADJ NOUN VERB NOUN PROPN PUNCT PROPN PROPN PUNCT PART VERB DET NOUN ADP DET NOUN PUNCT NOUN CCONJ DET ADJ VERB	▁His ▁death ▁inspired ▁cr ook ▁Del ro y ▁( ▁L en nie ▁James ▁ ) ▁to ▁dish ▁the ▁dirt ▁on ▁the ▁ gang sters ▁ : ▁redemption ▁and ▁a ▁ti dy ▁ending .	0 0 0 0 0 0 0 0 0 0 0 0 0 0 0 0 1 0 1 0 0 0 0 0 0 0 0 0 0 0 0 0 0	ADJ NOUN VERB NOUN NOUN PROPN PROPN PROPN PUNCT PROPN PROPN PROPN PROPN PUNCT PUNCT PART VERB DET NOUN ADP DET NOUN NOUN NOUN PUNCT PUNCT NOUN CCONJ DET ADJ ADJ VERB VERB
Playing at volume, the FGM proves itself capable of dishing out the dirt, the Dual Sound humbucker retaining its tone and not thinning out to a tuneless buzz.	0 0 0 0 0 0 0 0 0 1 0 0 1 0 0 0 0 0 0 0 0 0 0 0 0 0 0 0	dish the dirt	figurative	combined-inflection	VERB ADP NOUN DET PROPN VERB PRON ADJ ADP VERB PART DET NOUN DET PROPN NOUN NOUN VERB ADJ NOUN CCONJ ADV VERB PART ADP DET ADJ NOUN	▁P laying ▁at ▁volume , ▁the ▁F GM ▁proves ▁itself ▁capable ▁of ▁dish ing ▁out ▁the ▁dirt , ▁the ▁Dual ▁Sound ▁hum bu cker ▁retaining ▁its ▁to ne ▁and ▁not ▁thin ning ▁out ▁to ▁a ▁tune less ▁bu zz .	0 0 0 0 0 0 0 0 0 0 0 0 1 1 0 0 1 1 0 0 0 0 0 0 0 0 0 0 0 0 0 0 0 0 0 0 0 0 0 0	VERB VERB ADP NOUN NOUN DET PROPN PROPN VERB PRON ADJ ADP VERB VERB PART DET NOUN NOUN DET PROPN NOUN NOUN NOUN NOUN VERB ADJ NOUN NOUN CCONJ ADV VERB VERB PART ADP DET ADJ ADJ NOUN NOUN NOUN
Jolyon Jenkins and Sarah Baxter dish up the dirt	0 0 0 0 0 1 0 0 1	dish the dirt	figurative	insertion-other	PROPN PROPN CCONJ PROPN PROPN NOUN PART DET NOUN	▁Jo ly on ▁Jenkins ▁and ▁Sara h ▁Ba xter ▁dish ▁up ▁the ▁dirt	0 0 0 0 0 0 0 0 0 1 0 0 1	PROPN PROPN PROPN PROPN CCONJ PROPN PROPN PROPN PROPN NOUN PART DET NOUN
Since the beginning of your self - imposed exile we 've spoken to : Throwing Muses, Carter, The Wedding Present, The Icicle Works, That Petrol Emotion, Terry Bickers ( July ' 91 —four pages, dishing all the dirt on The House Of Love MkI ), Ocean Colour Scene, Spiritualised, Green On Red, The Pale Saints, Senseless Things, Lush, The Boo Radleys, The Blue Aeroplanes, The Happy Mondays, REM, Curve …	0 0 0 0 0 0 0 0 0 0 0 0 0 0 0 0 0 0 0 0 0 0 0 0 0 0 0 0 0 0 0 0 0 0 1 0 0 1 0 0 0 0 0 0 0 0 0 0 0 0 0 0 0 0 0 0 0 0 0 0 0 0 0 0 0 0 0 0 0 0	dish the dirt	figurative	combined-inflection	ADP DET NOUN ADP ADJ NOUN PUNCT VERB NOUN PRON VERB VERB ADP PUNCT VERB PROPN PROPN DET PROPN PROPN DET NOUN PROPN ADP PROPN PROPN PROPN PROPN PUNCT PROPN PART NUM PROPN NOUN VERB ADJ DET NOUN ADP DET PROPN ADP PROPN PROPN PUNCT PROPN PROPN PROPN PROPN PROPN ADP PROPN DET PROPN PROPN PROPN PROPN PROPN DET PROPN PROPN DET PROPN PROPN DET PROPN PROPN NOUN NOUN PUNCT	▁Since ▁the ▁beginning ▁of ▁your ▁self ▁- ▁imposed ▁exile ▁we ▁' ve ▁spoken ▁to ▁ : ▁Th row ing ▁M uses , ▁Car ter , ▁The ▁We dding ▁Present , ▁The ▁I c icle ▁Works , ▁That ▁Petro l ▁E motion , ▁Terr y ▁B ick ers ▁( ▁July ▁' ▁91 ▁ — four ▁pages , ▁dish ing ▁all ▁the ▁dirt ▁on ▁The ▁House ▁Of ▁Lo ve ▁M k I ▁ ), ▁Ocean ▁Colour ▁Sc ene , ▁Spirit ual ised , ▁Green ▁On ▁Red , ▁The ▁Pale ▁Saint s , ▁S ense less ▁Things , ▁Lu sh , ▁The ▁Bo o ▁Rad ley s , ▁The ▁Blue ▁Aeroplane s , ▁The ▁H app y ▁Monday s , ▁RE M , ▁Cur ve ▁...	0 0 0 0 0 0 0 0 0 0 0 0 0 0 0 0 0 0 0 0 0 0 0 0 0 0 0 0 0 0 0 0 0 0 0 0 0 0 0 0 0 0 0 0 0 0 0 0 0 0 0 0 0 0 0 0 1 1 0 0 1 0 0 0 0 0 0 0 0 0 0 0 0 0 0 0 0 0 0 0 0 0 0 0 0 0 0 0 0 0 0 0 0 0 0 0 0 0 0 0 0 0 0 0 0 0 0 0 0 0 0 0 0 0 0 0 0 0 0 0 0 0 0	ADP DET NOUN ADP ADJ NOUN PUNCT VERB NOUN PRON VERB VERB VERB ADP PUNCT PUNCT VERB VERB VERB PROPN PROPN PROPN PROPN PROPN PROPN DET PROPN PROPN PROPN PROPN DET NOUN NOUN NOUN PROPN PROPN ADP PROPN PROPN PROPN PROPN PROPN PROPN PROPN PROPN PROPN PROPN PUNCT PROPN PART NUM PROPN PROPN PROPN NOUN NOUN VERB VERB ADJ DET NOUN ADP DET PROPN ADP PROPN PROPN PROPN PROPN PROPN PUNCT PUNCT PROPN PROPN PROPN PROPN PROPN PROPN PROPN PROPN PROPN PROPN ADP PROPN PROPN DET PROPN PROPN PROPN PROPN PROPN PROPN PROPN PROPN PROPN PROPN PROPN PROPN DET PROPN PROPN PROPN PROPN PROPN PROPN DET PROPN PROPN PROPN PROPN DET PROPN PROPN PROPN PROPN PROPN PROPN NOUN NOUN NOUN NOUN NOUN PUNCT
International : Rivals dish the dirt in a weekend of malice	0 0 0 1 0 1 0 0 0 0 0	dish the dirt	figurative	identical	ADJ PUNCT NOUN VERB DET NOUN ADP DET NOUN ADP NOUN	▁International ▁ : ▁Riva ls ▁dish ▁the ▁dirt ▁in ▁a ▁weekend ▁of ▁mal ice	0 0 0 0 0 1 0 1 0 0 0 0 0 0	ADJ PUNCT PUNCT NOUN NOUN VERB DET NOUN ADP DET NOUN ADP NOUN NOUN
