Oh : car of menace, car of blight Cars the atmosphere ignite Greenhouse warming, Havoc forming Parkinson must see us right We 're au fait with entropy Gaia, Ecosphere, synergy Words for greening But their meaning's A linguistic mystery Oh : politicians must invent Worship of environment Genuflecting by reflecting Words of verdant bafflement Now our water's unfit to drink Too much aluminium and zinc No solution To pollution No - one can stand the stink Oh : public filth and pestilence Highlights private opulence Does the glitter, clear the litter All it needs is pounds and pence GOD REST YE MERRY God rest ye merry, gentle Greens Let nothing you dismay The much foretold apocalypse Is now well under way Not even Mr Gorbachev Can stop the world's decay Oh, tidings of comfort and joy, Oh, tidings of comfort and joy We can't eat meat or hens or fish The farming is too cruel The only food we now permit Is foul organic gruel Irradiated food and veg Now double up as fuel Oh tidings of comfort and joy, Oh tidings of comfort and joy Now everybody wants a car Though noise and fumes are vile The Iron Curtain fractures and The jams stretch back for miles Mobility and liberty Can not be reconciled Oh tidings of comfort and joy, Oh tidings of comfort and joy We think that greenhouse warming will Bring on the world's demise If forests burn it's not just trees but mankind too that fries But all this may be garbage Because scientists tell lies Oh tidings of comfort and joy, Oh tidings of comfort and joy Consumers must buy less to reach Sustainability For galloping consumption is More lethal than TB So much for Third World dreams of fleeing Grinding poverty Oh tidings of comfort and joy, Oh tidings of comfort and joy Unless we stop producing kids The planet will not cope No hope for birth controllers short of Kidnapping the Pope But since the Greens recycle people they May turn us into soap Oh tidings of comfort and joy, Oh tidings of comfort and joy In searching for clean energy The choice is pretty stark The floods that come when coal is burnt will keep us in the Ark But had Lord Marshall got his way We 'd all glow in the dark Oh tidings of comfort and joy, Oh tidings of comfort and joy Dumb animals are much preferrred To flawed humanity Ill - treatment of old people may Provoke insanity But culling seals and whales is judged The worst profanity Oh tidings of comfort and joy, Oh tidings of comfort and joy Now Mrs Thatcher goes bright green A highly suspect hue Her policies have after all Kept filth and squalor blue It's just another way she's found To tell us what to do Oh, tidings of comfort and joy, Oh tidings of comfort and joy With greenhouse gases, PCBs Sulphuric acid rain This fragile globe's environment Is going down the drain It is a cosmic punishment That we can't start again Oh, tidings of comfort and joy, Oh tidings of comfort and joy Melanie Phillips OVERNIGHT FILE	0 0 0 0 0 0 0 0 0 0 0 0 0 0 0 0 0 0 0 0 0 0 0 0 0 0 0 0 0 0 0 0 0 0 0 0 0 0 0 0 0 0 0 0 0 0 0 0 0 0 0 0 0 0 0 0 0 0 0 0 0 0 0 0 0 0 0 0 0 0 0 0 0 0 0 0 0 0 0 0 0 0 0 0 0 0 0 0 0 0 0 0 0 0 0 0 0 0 0 0 0 0 0 0 0 0 0 0 0 0 0 0 0 0 0 0 0 0 0 0 0 0 0 0 0 0 0 0 0 0 0 0 0 0 0 0 0 0 0 0 0 0 0 0 0 0 0 0 0 0 0 0 0 0 0 0 0 0 0 0 0 0 0 0 0 0 0 0 0 0 0 0 0 0 0 0 0 0 0 0 0 0 0 0 0 0 0 0 0 0 0 0 0 0 0 0 0 0 0 0 0 0 0 0 0 0 0 0 0 0 0 0 0 0 0 0 0 0 0 0 0 0 0 0 0 0 0 0 0 0 0 0 0 0 0 0 0 0 0 0 0 0 0 0 0 0 0 0 0 0 0 0 0 0 0 0 0 0 0 0 0 0 0 0 0 0 0 0 0 0 0 0 0 0 0 0 0 0 0 0 0 0 0 0 0 0 0 0 0 0 0 0 0 0 0 0 0 0 0 0 0 0 0 0 0 0 0 0 0 0 0 0 0 0 0 0 0 0 0 0 0 0 0 0 0 0 0 0 0 0 0 0 0 0 0 0 0 0 0 0 0 0 0 0 0 0 0 0 0 0 0 0 0 0 0 0 0 0 0 0 0 0 0 0 0 0 0 0 0 0 0 0 0 0 0 0 0 0 0 0 0 0 0 0 0 0 0 0 0 0 0 0 0 0 0 0 0 0 0 0 0 0 0 0 0 0 0 0 0 0 0 0 0 0 0 0 0 0 0 0 0 0 0 0 0 0 0 0 0 0 0 0 0 0 0 0 0 0 0 0 0 0 0 0 0 0 0 0 0 0 0 0 0 0 0 0 0 0 0 0 0 0 0 0 0 0 0 0 0 0 0 0 0 0 0 0 0 0 0 0 0 0 0 0 0 0 0 0 0 0 0 0 0 0 0 0 0 0 0 1 0 1 0 0 0 0 0 0 0 0 0 0 0 0 0 0 0 0 0 0 0 0 0 0 0 0 0 0	down the drain	figurative	identical	INTJ PUNCT NOUN ADP NOUN NOUN ADP NOUN PROPN DET NOUN VERB PROPN NOUN PROPN VERB PROPN VERB VERB PRON INTJ PRON VERB X X ADP NOUN PROPN PROPN NOUN NOUN ADP VERB CCONJ ADJ NOUN DET ADJ NOUN INTJ PUNCT NOUN VERB VERB PROPN ADP NOUN NOUN ADP VERB PROPN ADP NOUN NOUN ADV ADJ NOUN ADJ PART VERB ADV ADJ NOUN CCONJ NOUN DET NOUN PART VERB NOUN PUNCT NOUN VERB VERB DET NOUN INTJ PUNCT ADJ NOUN CCONJ NOUN NOUN ADJ NOUN VERB DET NOUN VERB DET NOUN DET PRON VERB VERB NOUN CCONJ NOUN PROPN PROPN PROPN PROPN PROPN VERB ADJ NOUN ADJ NOUN VERB NOUN PRON VERB DET ADJ ADJ NOUN VERB ADV ADV ADP NOUN ADV ADV PROPN PROPN VERB VERB DET NOUN NOUN PROPN NOUN ADP NOUN CCONJ NOUN INTJ NOUN ADP NOUN CCONJ NOUN PRON VERB VERB NOUN CCONJ VERB CCONJ VERB DET NOUN VERB ADV ADJ DET ADJ NOUN PRON ADV VERB VERB ADJ ADJ NOUN ADJ NOUN CCONJ NOUN ADV VERB PART ADP NOUN INTJ NOUN ADP NOUN CCONJ NOUN INTJ NOUN ADP NOUN CCONJ NOUN ADV NOUN VERB DET NOUN PROPN NOUN CCONJ NOUN VERB ADP DET PROPN PROPN NOUN CCONJ DET NOUN VERB ADV ADP NOUN PROPN CCONJ NOUN VERB ADV VERB VERB INTJ NOUN ADP NOUN CCONJ NOUN INTJ NOUN ADP NOUN CCONJ NOUN PRON VERB ADP NOUN NOUN VERB VERB PART DET NOUN NOUN ADP NOUN VERB PRON ADV ADV NOUN CCONJ NOUN ADV ADP NOUN CCONJ ADJ DET VERB VERB NOUN ADP NOUN VERB NOUN INTJ NOUN ADP NOUN CCONJ NOUN INTJ NOUN ADP NOUN CCONJ NOUN PROPN VERB VERB ADJ PART VERB PROPN ADP VERB NOUN VERB ADV ADJ ADP PROPN ADV ADJ ADP PROPN PROPN NOUN ADP VERB VERB NOUN PROPN NOUN ADP NOUN CCONJ NOUN INTJ NOUN ADP NOUN CCONJ NOUN ADP PRON VERB VERB NOUN DET NOUN VERB ADV VERB DET NOUN ADP NOUN NOUN ADJ ADP PROPN DET PROPN CCONJ ADP DET PROPN NOUN NOUN PRON VERB VERB PRON ADP NOUN INTJ NOUN ADP NOUN CCONJ NOUN INTJ NOUN ADP NOUN CCONJ NOUN ADP VERB ADP ADJ NOUN DET NOUN VERB ADV ADJ DET NOUN ADJ VERB ADV NOUN VERB VERB VERB VERB PRON ADP DET PROPN CCONJ VERB PROPN PROPN VERB ADJ NOUN PRON VERB ADV VERB ADP DET ADJ INTJ NOUN ADP NOUN CCONJ NOUN INTJ NOUN ADP NOUN CCONJ NOUN ADJ NOUN VERB ADV VERB PART VERB NOUN ADJ PUNCT NOUN ADP ADJ NOUN VERB VERB NOUN CCONJ VERB NOUN CCONJ NOUN VERB VERB DET ADJ NOUN INTJ NOUN ADP NOUN CCONJ NOUN INTJ NOUN ADP NOUN CCONJ NOUN ADV PROPN PROPN VERB ADJ ADJ DET ADV ADJ ADJ ADJ NOUN VERB ADP DET PROPN NOUN CCONJ VERB NOUN PRON ADV DET NOUN PRON VERB PART VERB PRON NOUN PART VERB INTJ NOUN ADP NOUN CCONJ NOUN INTJ NOUN ADP NOUN CCONJ NOUN ADP NOUN NOUN PROPN PROPN NOUN NOUN DET ADJ NOUN NOUN VERB VERB ADP DET NOUN PRON VERB DET ADJ NOUN ADJ PRON VERB VERB ADV INTJ NOUN ADP NOUN CCONJ NOUN INTJ NOUN ADP NOUN CCONJ NOUN PROPN PROPN PROPN PROPN	▁O h ▁ : ▁car ▁of ▁men ace , ▁car ▁of ▁b light ▁Car s ▁the ▁atmosphere ▁ignit e ▁Green house ▁warming , ▁Hav oc ▁forming ▁Parkinson ▁must ▁see ▁us ▁right ▁We ▁' re ▁au ▁fait ▁with ▁en trop y ▁Gai a , ▁E c osphere , ▁synergy ▁Word s ▁for ▁green ing ▁But ▁their ▁meaning ' s ▁A ▁linguistic ▁my s tery ▁O h ▁ : ▁politician s ▁must ▁in vent ▁W orship ▁of ▁environment ▁Gen uf lect ing ▁by ▁reflecting ▁Word s ▁of ▁ver d ant ▁b aff lement ▁Now ▁our ▁water ' s ▁unfit ▁to ▁drink ▁To o ▁much ▁aluminium ▁and ▁zinc ▁No ▁solution ▁To ▁pollution ▁No ▁- ▁one ▁can ▁stand ▁the ▁st ink ▁O h ▁ : ▁public ▁fil th ▁and ▁pest il ence ▁High light s ▁private ▁op ulence ▁Does ▁the ▁g l itter , ▁clear ▁the ▁litter ▁All ▁it ▁needs ▁is ▁pounds ▁and ▁p ence ▁GOD ▁ REST ▁Y E ▁MER RY ▁God ▁rest ▁ye ▁me rry , ▁gentle ▁Green s ▁Let ▁nothing ▁you ▁dismay ▁The ▁much ▁for et old ▁ap oca ly ps e ▁Is ▁now ▁well ▁under ▁way ▁Not ▁even ▁Mr ▁G orbach ev ▁Can ▁stop ▁the ▁world ' s ▁decay ▁O h , ▁ti d ing s ▁of ▁comfort ▁and ▁joy , ▁O h , ▁ti d ing s ▁of ▁comfort ▁and ▁joy ▁We ▁can ' t ▁eat ▁meat ▁or ▁hens ▁or ▁fish ▁The ▁farming ▁is ▁too ▁cruel ▁The ▁only ▁food ▁we ▁now ▁permit ▁Is ▁fo ul ▁organic ▁gr uel ▁I r radiated ▁food ▁and ▁ve g ▁Now ▁double ▁up ▁as ▁fuel ▁O h ▁ti d ing s ▁of ▁comfort ▁and ▁joy , ▁O h ▁ti d ing s ▁of ▁comfort ▁and ▁joy ▁Now ▁everybody ▁wants ▁a ▁car ▁Though ▁noise ▁and ▁fumes ▁are ▁vil e ▁The ▁Iron ▁Curtain ▁fractures ▁and ▁The ▁jams ▁stretch ▁back ▁for ▁miles ▁Mobility ▁and ▁liberty ▁Can ▁not ▁be ▁reconciled ▁O h ▁ti d ing s ▁of ▁comfort ▁and ▁joy , ▁O h ▁ti d ing s ▁of ▁comfort ▁and ▁joy ▁We ▁think ▁that ▁greenhouse ▁warming ▁will ▁Br ing ▁on ▁the ▁world ' s ▁dem ise ▁If ▁forests ▁burn ▁it ' s ▁not ▁just ▁trees ▁but ▁mankind ▁too ▁that ▁f ries ▁But ▁all ▁this ▁may ▁be ▁gar b age ▁Because ▁scientists ▁tell ▁lies ▁O h ▁ti d ing s ▁of ▁comfort ▁and ▁joy , ▁O h ▁ti d ing s ▁of ▁comfort ▁and ▁joy ▁Consumers ▁must ▁buy ▁less ▁to ▁reach ▁Sustain ability ▁For ▁gall op ing ▁consumption ▁is ▁More ▁lethal ▁than ▁T B ▁So ▁much ▁for ▁Third ▁World ▁dreams ▁of ▁flee ing ▁Gr ind ing ▁poverty ▁O h ▁ti d ing s ▁of ▁comfort ▁and ▁joy , ▁O h ▁ti d ing s ▁of ▁comfort ▁and ▁joy ▁Unless ▁we ▁stop ▁producing ▁kid s ▁The ▁planet ▁will ▁not ▁cope ▁No ▁hope ▁for ▁birth ▁controllers ▁short ▁of ▁K id n apping ▁the ▁Po pe ▁But ▁since ▁the ▁Green s ▁re cycle ▁people ▁they ▁May ▁turn ▁us ▁into ▁soap ▁O h ▁ti d ing s ▁of ▁comfort ▁and ▁joy , ▁O h ▁ti d ing s ▁of ▁comfort ▁and ▁joy ▁In ▁searching ▁for ▁clean ▁energy ▁The ▁choice ▁is ▁pretty ▁star k ▁The ▁floods ▁that ▁come ▁when ▁coal ▁is ▁burnt ▁will ▁keep ▁us ▁in ▁the ▁A rk ▁But ▁had ▁Lord ▁Marshall ▁got ▁his ▁way ▁We ▁' d ▁all ▁g low ▁in ▁the ▁dark ▁O h ▁ti d ing s ▁of ▁comfort ▁and ▁joy , ▁O h ▁ti d ing s ▁of ▁comfort ▁and ▁joy ▁Du mb ▁animals ▁are ▁much ▁prefer rr ed ▁To ▁flaw ed ▁humanity ▁Ill ▁- ▁treatment ▁of ▁old ▁people ▁may ▁Pro vo ke ▁in s an ity ▁But ▁cull ing ▁seals ▁and ▁wh al es ▁is ▁judged ▁The ▁worst ▁pro fan ity ▁O h ▁ti d ing s ▁of ▁comfort ▁and ▁joy , ▁O h ▁ti d ing s ▁of ▁comfort ▁and ▁joy ▁Now ▁Mrs ▁Thatcher ▁goes ▁bright ▁green ▁A ▁highly ▁suspect ▁hu e ▁Her ▁policies ▁have ▁after ▁all ▁Kep t ▁fil th ▁and ▁squa lor ▁blue ▁It ' s ▁just ▁another ▁way ▁she ' s ▁found ▁To ▁tell ▁us ▁what ▁to ▁do ▁O h , ▁ti d ing s ▁of ▁comfort ▁and ▁joy , ▁O h ▁ti d ing s ▁of ▁comfort ▁and ▁joy ▁With ▁greenhouse ▁gases , ▁PCBs ▁Sulphur ic ▁acid ▁rain ▁This ▁fragile ▁globe ' s ▁environment ▁Is ▁going ▁down ▁the ▁drain ▁It ▁is ▁a ▁co s mic ▁punishment ▁That ▁we ▁can ' t ▁start ▁again ▁O h , ▁ti d ing s ▁of ▁comfort ▁and ▁joy , ▁O h ▁ti d ing s ▁of ▁comfort ▁and ▁joy ▁Mel ani e ▁P hill ip s ▁OVER NI G HT ▁FIL E	0 0 0 0 0 0 0 0 0 0 0 0 0 0 0 0 0 0 0 0 0 0 0 0 0 0 0 0 0 0 0 0 0 0 0 0 0 0 0 0 0 0 0 0 0 0 0 0 0 0 0 0 0 0 0 0 0 0 0 0 0 0 0 0 0 0 0 0 0 0 0 0 0 0 0 0 0 0 0 0 0 0 0 0 0 0 0 0 0 0 0 0 0 0 0 0 0 0 0 0 0 0 0 0 0 0 0 0 0 0 0 0 0 0 0 0 0 0 0 0 0 0 0 0 0 0 0 0 0 0 0 0 0 0 0 0 0 0 0 0 0 0 0 0 0 0 0 0 0 0 0 0 0 0 0 0 0 0 0 0 0 0 0 0 0 0 0 0 0 0 0 0 0 0 0 0 0 0 0 0 0 0 0 0 0 0 0 0 0 0 0 0 0 0 0 0 0 0 0 0 0 0 0 0 0 0 0 0 0 0 0 0 0 0 0 0 0 0 0 0 0 0 0 0 0 0 0 0 0 0 0 0 0 0 0 0 0 0 0 0 0 0 0 0 0 0 0 0 0 0 0 0 0 0 0 0 0 0 0 0 0 0 0 0 0 0 0 0 0 0 0 0 0 0 0 0 0 0 0 0 0 0 0 0 0 0 0 0 0 0 0 0 0 0 0 0 0 0 0 0 0 0 0 0 0 0 0 0 0 0 0 0 0 0 0 0 0 0 0 0 0 0 0 0 0 0 0 0 0 0 0 0 0 0 0 0 0 0 0 0 0 0 0 0 0 0 0 0 0 0 0 0 0 0 0 0 0 0 0 0 0 0 0 0 0 0 0 0 0 0 0 0 0 0 0 0 0 0 0 0 0 0 0 0 0 0 0 0 0 0 0 0 0 0 0 0 0 0 0 0 0 0 0 0 0 0 0 0 0 0 0 0 0 0 0 0 0 0 0 0 0 0 0 0 0 0 0 0 0 0 0 0 0 0 0 0 0 0 0 0 0 0 0 0 0 0 0 0 0 0 0 0 0 0 0 0 0 0 0 0 0 0 0 0 0 0 0 0 0 0 0 0 0 0 0 0 0 0 0 0 0 0 0 0 0 0 0 0 0 0 0 0 0 0 0 0 0 0 0 0 0 0 0 0 0 0 0 0 0 0 0 0 0 0 0 0 0 0 0 0 0 0 0 0 0 0 0 0 0 0 0 0 0 0 0 0 0 0 0 0 0 0 0 0 0 0 0 0 0 0 0 0 0 0 0 0 0 0 0 0 0 0 0 0 0 0 0 0 0 0 0 0 0 0 0 0 0 0 0 0 0 0 0 0 0 0 0 0 0 0 0 0 0 0 0 0 0 0 0 0 0 0 0 0 0 0 0 0 0 0 0 0 0 0 0 0 0 0 0 0 0 0 0 0 0 0 0 0 0 0 0 0 0 0 0 0 0 0 0 0 0 0 0 0 0 0 0 0 0 0 0 0 0 0 0 0 0 0 0 0 0 0 0 0 0 0 0 0 0 0 0 0 0 0 0 0 0 0 0 0 0 0 0 0 0 0 0 0 0 0 0 0 0 0 0 0 0 0 0 0 0 0 0 0 0 0 0 0 0 0 0 0 0 1 0 1 0 0 0 0 0 0 0 0 0 0 0 0 0 0 0 0 0 0 0 0 0 0 0 0 0 0 0 0 0 0 0 0 0 0 0 0 0 0 0 0 0 0 0 0 0 0 0 0 0	INTJ INTJ PUNCT PUNCT NOUN ADP NOUN NOUN NOUN NOUN ADP NOUN NOUN PROPN PROPN DET NOUN VERB VERB PROPN PROPN NOUN NOUN PROPN PROPN VERB PROPN VERB VERB PRON INTJ PRON VERB VERB X X ADP NOUN NOUN NOUN PROPN PROPN PROPN PROPN PROPN PROPN PROPN NOUN NOUN NOUN ADP VERB VERB CCONJ ADJ NOUN NOUN NOUN DET ADJ NOUN NOUN NOUN INTJ INTJ PUNCT PUNCT NOUN NOUN VERB VERB VERB PROPN PROPN ADP NOUN NOUN NOUN NOUN NOUN ADP VERB PROPN PROPN ADP NOUN NOUN NOUN NOUN NOUN NOUN ADV ADJ NOUN NOUN NOUN ADJ PART VERB ADV ADV ADJ NOUN CCONJ NOUN DET NOUN PART VERB NOUN PUNCT NOUN VERB VERB DET NOUN NOUN INTJ INTJ PUNCT PUNCT ADJ NOUN NOUN CCONJ NOUN NOUN NOUN NOUN NOUN NOUN ADJ NOUN NOUN VERB DET NOUN NOUN NOUN NOUN VERB DET NOUN DET PRON VERB VERB NOUN CCONJ NOUN NOUN PROPN PROPN PROPN PROPN PROPN PROPN PROPN PROPN VERB ADJ NOUN NOUN NOUN ADJ NOUN NOUN VERB NOUN PRON VERB DET ADJ ADJ ADJ ADJ NOUN NOUN NOUN NOUN NOUN VERB ADV ADV ADP NOUN ADV ADV PROPN PROPN PROPN PROPN VERB VERB DET NOUN NOUN NOUN NOUN PROPN PROPN PROPN NOUN NOUN NOUN NOUN ADP NOUN CCONJ NOUN NOUN INTJ INTJ INTJ NOUN NOUN NOUN NOUN ADP NOUN CCONJ NOUN PRON VERB VERB VERB VERB NOUN CCONJ VERB CCONJ VERB DET NOUN VERB ADV ADJ DET ADJ NOUN PRON ADV VERB VERB ADJ ADJ ADJ NOUN NOUN ADJ ADJ ADJ NOUN CCONJ NOUN NOUN ADV VERB PART ADP NOUN INTJ INTJ NOUN NOUN NOUN NOUN ADP NOUN CCONJ NOUN NOUN INTJ INTJ NOUN NOUN NOUN NOUN ADP NOUN CCONJ NOUN ADV NOUN VERB DET NOUN PROPN NOUN CCONJ NOUN VERB ADP ADP DET PROPN PROPN NOUN CCONJ DET NOUN VERB ADV ADP NOUN PROPN CCONJ NOUN VERB ADV VERB VERB INTJ INTJ NOUN NOUN NOUN NOUN ADP NOUN CCONJ NOUN NOUN INTJ INTJ NOUN NOUN NOUN NOUN ADP NOUN CCONJ NOUN PRON VERB ADP NOUN NOUN VERB VERB VERB PART DET NOUN NOUN NOUN NOUN NOUN ADP NOUN VERB PRON PRON PRON ADV ADV NOUN CCONJ NOUN ADV ADP NOUN NOUN CCONJ ADJ DET VERB VERB NOUN NOUN NOUN ADP NOUN VERB NOUN INTJ INTJ NOUN NOUN NOUN NOUN ADP NOUN CCONJ NOUN NOUN INTJ INTJ NOUN NOUN NOUN NOUN ADP NOUN CCONJ NOUN PROPN VERB VERB ADJ PART VERB PROPN PROPN ADP VERB VERB VERB NOUN VERB ADV ADJ ADP PROPN PROPN ADV ADJ ADP PROPN PROPN NOUN ADP VERB VERB VERB VERB VERB NOUN PROPN PROPN NOUN NOUN NOUN NOUN ADP NOUN CCONJ NOUN NOUN INTJ INTJ NOUN NOUN NOUN NOUN ADP NOUN CCONJ NOUN ADP PRON VERB VERB NOUN NOUN DET NOUN VERB ADV VERB DET NOUN ADP NOUN NOUN ADJ ADP PROPN PROPN PROPN PROPN DET PROPN PROPN CCONJ ADP DET PROPN PROPN NOUN NOUN NOUN PRON VERB VERB PRON ADP NOUN INTJ INTJ NOUN NOUN NOUN NOUN ADP NOUN CCONJ NOUN NOUN INTJ INTJ NOUN NOUN NOUN NOUN ADP NOUN CCONJ NOUN ADP VERB ADP ADJ NOUN DET NOUN VERB ADV ADJ ADJ DET NOUN ADJ VERB ADV NOUN VERB VERB VERB VERB PRON ADP DET PROPN PROPN CCONJ VERB PROPN PROPN VERB ADJ NOUN PRON VERB VERB ADV VERB VERB ADP DET ADJ INTJ INTJ NOUN NOUN NOUN NOUN ADP NOUN CCONJ NOUN NOUN INTJ INTJ NOUN NOUN NOUN NOUN ADP NOUN CCONJ NOUN ADJ ADJ NOUN VERB ADV VERB VERB VERB PART VERB VERB NOUN ADJ PUNCT NOUN ADP ADJ NOUN VERB VERB VERB VERB NOUN NOUN NOUN NOUN CCONJ VERB VERB NOUN CCONJ NOUN NOUN NOUN VERB VERB DET ADJ NOUN NOUN NOUN INTJ INTJ NOUN NOUN NOUN NOUN ADP NOUN CCONJ NOUN NOUN INTJ INTJ NOUN NOUN NOUN NOUN ADP NOUN CCONJ NOUN ADV PROPN PROPN VERB ADJ ADJ DET ADV ADJ ADJ ADJ ADJ NOUN VERB ADP DET PROPN PROPN NOUN NOUN CCONJ VERB VERB NOUN PRON PRON PRON ADV DET NOUN PRON PRON PRON VERB PART VERB PRON NOUN PART VERB INTJ INTJ INTJ NOUN NOUN NOUN NOUN ADP NOUN CCONJ NOUN NOUN INTJ INTJ NOUN NOUN NOUN NOUN ADP NOUN CCONJ NOUN ADP NOUN NOUN NOUN PROPN PROPN PROPN NOUN NOUN DET ADJ NOUN NOUN NOUN NOUN VERB VERB ADP DET NOUN PRON VERB DET ADJ ADJ ADJ NOUN ADJ PRON VERB VERB VERB VERB ADV INTJ INTJ INTJ NOUN NOUN NOUN NOUN ADP NOUN CCONJ NOUN NOUN INTJ INTJ NOUN NOUN NOUN NOUN ADP NOUN CCONJ NOUN PROPN PROPN PROPN PROPN PROPN PROPN PROPN PROPN PROPN PROPN PROPN PROPN PROPN
Indeed, unless much more is quickly done, the West's $ 13 billion will go directly down the drain.	0 0 0 0 0 0 0 0 0 0 0 0 0 0 0 1 0 1	down the drain	figurative	identical	ADV ADP ADV ADJ VERB ADV VERB DET PROPN SYM NUM NUM VERB VERB ADV ADP DET NOUN	▁Indeed , ▁unless ▁much ▁more ▁is ▁quickly ▁done , ▁the ▁West ' s ▁$ ▁13 ▁billion ▁will ▁go ▁directly ▁down ▁the ▁drain .	0 0 0 0 0 0 0 0 0 0 0 0 0 0 0 0 0 0 0 1 0 1 1	ADV ADV ADP ADV ADJ VERB ADV VERB VERB DET PROPN PROPN PROPN SYM NUM NUM VERB VERB ADV ADP DET NOUN NOUN
This witticism was lost on him apparently, for without a pause he continued : ‘ It's just money down the drain, you know.	0 0 0 0 0 0 0 0 0 0 0 0 0 0 0 0 0 0 1 0 1 0 0	down the drain	figurative	identical	DET NOUN VERB VERB ADP PRON ADV ADP ADP DET NOUN PRON VERB PUNCT PUNCT PRON ADV NOUN ADP DET NOUN PRON VERB	▁This ▁wit tic ism ▁was ▁lost ▁on ▁him ▁apparently , ▁for ▁without ▁a ▁pause ▁he ▁continued ▁ : ▁ ‘ ▁It ' s ▁just ▁money ▁down ▁the ▁drain , ▁you ▁know .	0 0 0 0 0 0 0 0 0 0 0 0 0 0 0 0 0 0 0 0 0 0 0 0 0 1 0 1 1 0 0 0	DET NOUN NOUN NOUN VERB VERB ADP PRON ADV ADV ADP ADP DET NOUN PRON VERB PUNCT PUNCT PUNCT PUNCT PRON PRON PRON ADV NOUN ADP DET NOUN NOUN PRON VERB VERB
How much money is IBM pouring down the drain with OS/2?	0 0 0 0 0 0 1 0 1 0 0	down the drain	figurative	identical	ADV ADJ NOUN VERB PROPN VERB PART DET NOUN ADP PROPN	▁How ▁much ▁money ▁is ▁IBM ▁pour ing ▁down ▁the ▁drain ▁with ▁O S /2 ?	0 0 0 0 0 0 0 1 0 1 0 0 0 0 0	ADV ADJ NOUN VERB PROPN VERB VERB PART DET NOUN ADP PROPN PROPN PROPN PROPN
Yeah, just as a, as a side issue, I am interested that they 've been growing plum tomatoes because each year I hear of more and more people growing plum tomatoes successfully in this country and while we are just on the subject of diseases and things to control them, you may remember that a few weeks ago we were giving advice on how we should dispose of waste garden chemicals and, and we said you ought to pour it down an outside drain.	0 0 0 0 0 0 0 0 0 0 0 0 0 0 0 0 0 0 0 0 0 0 0 0 0 0 0 0 0 0 0 0 0 0 0 0 0 0 0 0 0 0 0 0 0 0 0 0 0 0 0 0 0 0 0 0 0 0 0 0 0 0 0 0 0 0 0 0 0 0 0 0 0 0 0 0 0 0 0 0 1 0 0 1	down the drain	literal	combined-other	INTJ ADV ADP DET ADP DET NOUN NOUN PRON VERB ADJ ADP PRON VERB VERB VERB NOUN NOUN ADP DET NOUN PRON VERB ADP ADJ CCONJ ADJ NOUN VERB NOUN NOUN ADV ADP DET NOUN CCONJ ADP PRON VERB ADV ADP DET NOUN ADP NOUN CCONJ NOUN PART VERB PRON PRON VERB VERB ADP DET ADJ NOUN ADV PRON VERB VERB NOUN ADP ADV PRON VERB VERB ADP NOUN NOUN NOUN CCONJ CCONJ PRON VERB PRON VERB PART VERB PRON ADP DET ADJ NOUN	▁Ye ah , ▁just ▁as ▁a , ▁as ▁a ▁side ▁issue , ▁I ▁am ▁interested ▁that ▁they ▁' ve ▁been ▁growing ▁plum ▁tomatoes ▁because ▁each ▁year ▁I ▁hear ▁of ▁more ▁and ▁more ▁people ▁growing ▁plum ▁tomatoes ▁successfully ▁in ▁this ▁country ▁and ▁while ▁we ▁are ▁just ▁on ▁the ▁subject ▁of ▁diseases ▁and ▁things ▁to ▁control ▁them , ▁you ▁may ▁remember ▁that ▁a ▁few ▁weeks ▁ago ▁we ▁were ▁giving ▁advice ▁on ▁how ▁we ▁should ▁dispose ▁of ▁waste ▁garden ▁chemicals ▁and , ▁and ▁we ▁said ▁you ▁ought ▁to ▁pour ▁it ▁down ▁an ▁outside ▁drain .	0 0 0 0 0 0 0 0 0 0 0 0 0 0 0 0 0 0 0 0 0 0 0 0 0 0 0 0 0 0 0 0 0 0 0 0 0 0 0 0 0 0 0 0 0 0 0 0 0 0 0 0 0 0 0 0 0 0 0 0 0 0 0 0 0 0 0 0 0 0 0 0 0 0 0 0 0 0 0 0 0 0 0 0 0 0 0 1 0 0 1 1	INTJ INTJ INTJ ADV ADP DET DET ADP DET NOUN NOUN NOUN PRON VERB ADJ ADP PRON VERB VERB VERB VERB NOUN NOUN ADP DET NOUN PRON VERB ADP ADJ CCONJ ADJ NOUN VERB NOUN NOUN ADV ADP DET NOUN CCONJ ADP PRON VERB ADV ADP DET NOUN ADP NOUN CCONJ NOUN PART VERB PRON PRON PRON VERB VERB ADP DET ADJ NOUN ADV PRON VERB VERB NOUN ADP ADV PRON VERB VERB ADP NOUN NOUN NOUN CCONJ CCONJ CCONJ PRON VERB PRON VERB PART VERB PRON ADP DET ADJ NOUN NOUN
The EC is already funding a management programme for the threatened wetlands, and according to the Royal Society for the Protection of Birds, the Commission would be " pouring its own money down the drain " if it were to decide to back the scheme.	0 0 0 0 0 0 0 0 0 0 0 0 0 0 0 0 0 0 0 0 0 0 0 0 0 0 0 0 0 0 0 0 1 0 1 0 0 0 0 0 0 0 0 0 0	down the drain	figurative	identical	DET PROPN VERB ADV VERB DET NOUN NOUN ADP DET VERB NOUN CCONJ VERB ADP DET PROPN PROPN ADP DET PROPN ADP PROPN DET PROPN VERB VERB PUNCT VERB ADJ ADJ NOUN ADP DET NOUN PUNCT ADP PRON VERB PART VERB PART VERB DET NOUN	▁The ▁EC ▁is ▁already ▁funding ▁a ▁management ▁programme ▁for ▁the ▁threatened ▁wet lands , ▁and ▁according ▁to ▁the ▁Royal ▁Society ▁for ▁the ▁Protection ▁of ▁Birds , ▁the ▁Commission ▁would ▁be ▁" ▁pour ing ▁its ▁own ▁money ▁down ▁the ▁drain ▁" ▁if ▁it ▁were ▁to ▁decide ▁to ▁back ▁the ▁scheme .	0 0 0 0 0 0 0 0 0 0 0 0 0 0 0 0 0 0 0 0 0 0 0 0 0 0 0 0 0 0 0 0 0 0 0 0 1 0 1 0 0 0 0 0 0 0 0 0 0 0	DET PROPN VERB ADV VERB DET NOUN NOUN ADP DET VERB NOUN NOUN NOUN CCONJ VERB ADP DET PROPN PROPN ADP DET PROPN ADP PROPN PROPN DET PROPN VERB VERB PUNCT VERB VERB ADJ ADJ NOUN ADP DET NOUN PUNCT ADP PRON VERB PART VERB PART VERB DET NOUN NOUN
Just before we leave, I go into the kitchen and turn on the tap so his hot water can run down the drain.	0 0 0 0 0 0 0 0 0 0 0 0 0 0 0 0 0 0 0 0 1 0 1	down the drain	literal	identical	ADV ADP PRON VERB PRON VERB ADP DET NOUN CCONJ VERB ADP DET NOUN ADP ADJ ADJ NOUN VERB VERB PART DET NOUN	▁Just ▁before ▁we ▁leave , ▁I ▁go ▁into ▁the ▁kitchen ▁and ▁turn ▁on ▁the ▁tap ▁so ▁his ▁hot ▁water ▁can ▁run ▁down ▁the ▁drain .	0 0 0 0 0 0 0 0 0 0 0 0 0 0 0 0 0 0 0 0 0 1 0 1 1	ADV ADP PRON VERB VERB PRON VERB ADP DET NOUN CCONJ VERB ADP DET NOUN ADP ADJ ADJ NOUN VERB VERB PART DET NOUN NOUN
18 months ' work down the drain,’ he said.	0 0 0 0 1 0 1 0 0	down the drain	figurative	dashes	NUM NOUN PART NOUN ADP DET NOUN PRON VERB	▁18 ▁months ▁' ▁work ▁down ▁the ▁drain , ’ ▁he ▁said .	0 0 0 0 1 0 1 1 1 0 0 0	NUM NOUN PART NOUN ADP DET NOUN NOUN NOUN PRON VERB VERB
Eight hundred quid just like that, down the drain!	0 0 0 0 0 0 1 0 1	down the drain	figurative	identical	NUM NUM NOUN ADV ADP DET ADP DET NOUN	▁Eight ▁hundred ▁qui d ▁just ▁like ▁that , ▁down ▁the ▁drain !	0 0 0 0 0 0 0 0 1 0 1 1	NUM NUM NOUN NOUN ADV ADP DET DET ADP DET NOUN NOUN
And then they all went down the drain when you came to Nottingham.	0 0 0 0 0 1 0 1 0 0 0 0 0	down the drain	figurative	identical	CCONJ ADV PRON DET VERB ADP DET NOUN ADV PRON VERB ADP PROPN	▁And ▁then ▁they ▁all ▁went ▁down ▁the ▁drain ▁when ▁you ▁came ▁to ▁Not ting ham .	0 0 0 0 0 1 0 1 0 0 0 0 0 0 0 0	CCONJ ADV PRON DET VERB ADP DET NOUN ADV PRON VERB ADP PROPN PROPN PROPN PROPN
That's an awful lot of training down the drain.’	0 0 0 0 0 0 1 0 1	down the drain	figurative	dashes	DET DET ADJ NOUN ADP NOUN PART DET NOUN	▁That ' s ▁an ▁awful ▁lot ▁of ▁training ▁down ▁the ▁drain . ’	0 0 0 0 0 0 0 0 1 0 1 1 1	DET DET DET DET ADJ NOUN ADP NOUN PART DET NOUN NOUN NOUN
On 31 August 1948 it seemed certain that another glorious Hollywood career was about to be poured down the drain when Robert Mitchum was arrested for smoking marijuana.	0 0 0 0 0 0 0 0 0 0 0 0 0 0 0 0 0 1 0 1 0 0 0 0 0 0 0 0	down the drain	figurative	identical	ADP NUM PROPN NUM PRON VERB ADJ ADP DET ADJ PROPN NOUN VERB ADJ PART VERB VERB PART DET NOUN ADV PROPN PROPN VERB VERB ADP VERB NOUN	▁On ▁31 ▁August ▁1948 ▁it ▁seemed ▁certain ▁that ▁another ▁g lor ious ▁Hol ly wood ▁career ▁was ▁about ▁to ▁be ▁poured ▁down ▁the ▁drain ▁when ▁Robert ▁M itch um ▁was ▁arrested ▁for ▁smoking ▁mar i ju ana .	0 0 0 0 0 0 0 0 0 0 0 0 0 0 0 0 0 0 0 0 0 1 0 1 0 0 0 0 0 0 0 0 0 0 0 0 0 0	ADP NUM PROPN NUM PRON VERB ADJ ADP DET ADJ ADJ ADJ PROPN PROPN PROPN NOUN VERB ADJ PART VERB VERB PART DET NOUN ADV PROPN PROPN PROPN PROPN VERB VERB ADP VERB NOUN NOUN NOUN NOUN NOUN
