Since the government's Autumn Statement we have seen increased health service charges, transport increases etcetera and now we hear in the recent Budget the result of Black Wednesday in September nineteen ninety two of which billions of pounds were thrown down the drain that workers will be expected to bear the burden once again.	0 0 0 0 0 0 0 0 0 0 0 0 0 0 0 0 0 0 0 0 0 0 0 0 0 0 0 0 0 0 0 0 0 0 0 0 0 0 0 0 1 0 1 0 0 0 0 0 0 0 0 0 0 0	down the drain	figurative	identical	ADP DET NOUN PROPN PROPN PRON VERB VERB VERB NOUN NOUN NOUN NOUN NOUN NOUN CCONJ ADV PRON VERB ADP DET ADJ PROPN DET NOUN ADP PROPN PROPN ADP PROPN NUM NUM NUM ADP ADJ NOUN ADP NOUN VERB VERB PART DET NOUN ADP NOUN VERB VERB VERB PART VERB DET NOUN ADV ADV	▁Since ▁the ▁government ' s ▁Autumn ▁Statement ▁we ▁have ▁seen ▁increased ▁health ▁service ▁charges , ▁transport ▁increases ▁etc eter a ▁and ▁now ▁we ▁hear ▁in ▁the ▁recent ▁Budget ▁the ▁result ▁of ▁Black ▁Wednesday ▁in ▁September ▁nine te en ▁nine ty ▁two ▁of ▁which ▁billion s ▁of ▁pounds ▁were ▁thrown ▁down ▁the ▁drain ▁that ▁workers ▁will ▁be ▁expected ▁to ▁bear ▁the ▁burden ▁once ▁again .	0 0 0 0 0 0 0 0 0 0 0 0 0 0 0 0 0 0 0 0 0 0 0 0 0 0 0 0 0 0 0 0 0 0 0 0 0 0 0 0 0 0 0 0 0 0 0 0 0 1 0 1 0 0 0 0 0 0 0 0 0 0 0 0	ADP DET NOUN NOUN NOUN PROPN PROPN PRON VERB VERB VERB NOUN NOUN NOUN NOUN NOUN NOUN NOUN NOUN NOUN CCONJ ADV PRON VERB ADP DET ADJ PROPN DET NOUN ADP PROPN PROPN ADP PROPN NUM NUM NUM NUM NUM NUM ADP ADJ NOUN NOUN ADP NOUN VERB VERB PART DET NOUN ADP NOUN VERB VERB VERB PART VERB DET NOUN ADV ADV ADV
‘ It is time ministers took steps to stop this public money going down the drain.’	0 0 0 0 0 0 0 0 0 0 0 0 0 1 0 1	down the drain	figurative	dashes	PUNCT PRON VERB NOUN NOUN VERB NOUN PART VERB DET ADJ NOUN VERB PART DET NOUN	▁ ‘ ▁It ▁is ▁time ▁ministers ▁took ▁steps ▁to ▁stop ▁this ▁public ▁money ▁going ▁down ▁the ▁drain . ’	0 0 0 0 0 0 0 0 0 0 0 0 0 0 1 0 1 1 1	PUNCT PUNCT PRON VERB NOUN NOUN VERB NOUN PART VERB DET ADJ NOUN VERB PART DET NOUN NOUN NOUN
Does not that remark demonstrate that we never had an independent nuclear deterrent, as neither President Yeltsin nor anyone else in the Soviet Union accepted it as a deterrent ; and that we have poured tens of billions of pounds down the drain trying to maintain that mystique?	0 0 0 0 0 0 0 0 0 0 0 0 0 0 0 0 0 0 0 0 0 0 0 0 0 0 0 0 0 0 0 0 0 0 0 0 0 0 0 0 1 0 1 0 0 0 0 0	down the drain	figurative	identical	VERB ADV DET NOUN VERB ADP PRON ADV VERB DET ADJ ADJ NOUN ADP DET PROPN PROPN CCONJ NOUN ADV ADP DET PROPN PROPN VERB PRON ADP DET NOUN PUNCT CCONJ ADP PRON VERB VERB NOUN ADP NOUN ADP NOUN ADP DET NOUN VERB PART VERB DET NOUN	▁Does ▁not ▁that ▁remark ▁demonstrate ▁that ▁we ▁never ▁had ▁an ▁independent ▁nuclear ▁deterrent , ▁as ▁neither ▁President ▁Y elts in ▁nor ▁anyone ▁else ▁in ▁the ▁Soviet ▁Union ▁accepted ▁it ▁as ▁a ▁deterrent ▁ ; ▁and ▁that ▁we ▁have ▁poured ▁ten s ▁of ▁billion s ▁of ▁pounds ▁down ▁the ▁drain ▁trying ▁to ▁maintain ▁that ▁my st ique ?	0 0 0 0 0 0 0 0 0 0 0 0 0 0 0 0 0 0 0 0 0 0 0 0 0 0 0 0 0 0 0 0 0 0 0 0 0 0 0 0 0 0 0 0 0 0 1 0 1 0 0 0 0 0 0 0 0	VERB ADV DET NOUN VERB ADP PRON ADV VERB DET ADJ ADJ NOUN NOUN ADP DET PROPN PROPN PROPN PROPN CCONJ NOUN ADV ADP DET PROPN PROPN VERB PRON ADP DET NOUN PUNCT PUNCT CCONJ ADP PRON VERB VERB NOUN NOUN ADP NOUN NOUN ADP NOUN ADP DET NOUN VERB PART VERB DET NOUN NOUN NOUN NOUN
Water quality campaigners say a new treatment works to take nitrates out of drinking water is just money poured down the drain.	0 0 0 0 0 0 0 0 0 0 0 0 0 0 0 0 0 0 0 1 0 1	down the drain	figurative	identical	NOUN NOUN NOUN VERB DET ADJ NOUN NOUN PART VERB NOUN ADP ADP NOUN NOUN VERB ADV NOUN VERB PART DET NOUN	▁Water ▁quality ▁campaign ers ▁say ▁a ▁new ▁treatment ▁works ▁to ▁take ▁nitrates ▁out ▁of ▁drinking ▁water ▁is ▁just ▁money ▁poured ▁down ▁the ▁drain .	0 0 0 0 0 0 0 0 0 0 0 0 0 0 0 0 0 0 0 0 1 0 1 1	NOUN NOUN NOUN NOUN VERB DET ADJ NOUN NOUN PART VERB NOUN ADP ADP NOUN NOUN VERB ADV NOUN VERB PART DET NOUN NOUN
experience down the drain is it's crazy.	0 1 0 1 0 0 0	down the drain	figurative	identical	VERB PART DET NOUN VERB PRON ADJ	▁experience ▁down ▁the ▁drain ▁is ▁it ' s ▁c raz y .	0 1 0 1 0 0 0 0 0 0 0 0	VERB PART DET NOUN VERB PRON PRON PRON ADJ ADJ ADJ ADJ
System security : neglect is money down the drain	0 0 0 0 0 0 1 0 1	down the drain	figurative	identical	NOUN NOUN PUNCT NOUN VERB NOUN ADP DET NOUN	▁System ▁security ▁ : ▁neglect ▁is ▁money ▁down ▁the ▁drain	0 0 0 0 0 0 0 1 0 1	NOUN NOUN PUNCT PUNCT NOUN VERB NOUN ADP DET NOUN
You might as well take money and shovel it down the drain.	0 0 0 0 0 0 0 0 0 1 0 1	down the drain	figurative	identical	PRON VERB ADV ADV VERB NOUN CCONJ VERB PRON ADP DET NOUN	▁You ▁might ▁as ▁well ▁take ▁money ▁and ▁shovel ▁it ▁down ▁the ▁drain .	0 0 0 0 0 0 0 0 0 1 0 1 1	PRON VERB ADV ADV VERB NOUN CCONJ VERB PRON ADP DET NOUN NOUN
I scowled at the thought of having to fork out the half - crown to cover his fine, which simply meant another day's profits down the drain.	0 0 0 0 0 0 0 0 0 0 0 0 0 0 0 0 0 0 0 0 0 0 0 0 1 0 1	down the drain	figurative	identical	PRON VERB ADP DET NOUN ADP VERB PART VERB PART DET ADJ PUNCT NOUN PART VERB ADJ NOUN ADJ ADV VERB DET NOUN NOUN ADP DET NOUN	▁I ▁sc owl ed ▁at ▁the ▁thought ▁of ▁having ▁to ▁for k ▁out ▁the ▁half ▁- ▁crown ▁to ▁cover ▁his ▁fine , ▁which ▁simply ▁meant ▁another ▁day ' s ▁profits ▁down ▁the ▁drain .	0 0 0 0 0 0 0 0 0 0 0 0 0 0 0 0 0 0 0 0 0 0 0 0 0 0 0 0 0 0 1 0 1 1	PRON VERB VERB VERB ADP DET NOUN ADP VERB PART VERB VERB PART DET ADJ PUNCT NOUN PART VERB ADJ NOUN NOUN ADJ ADV VERB DET NOUN NOUN NOUN NOUN ADP DET NOUN NOUN
He threw a bottleful of his pills into the kitchen sink and tried to get them to go down the drain with the handle of a dishmop.	0 0 0 0 0 0 0 0 0 0 0 0 0 0 0 0 0 0 1 0 1 0 0 0 0 0 0	down the drain	literal	identical	PRON VERB DET NOUN ADP ADJ NOUN ADP DET NOUN NOUN CCONJ VERB PART VERB PRON PART VERB ADP DET NOUN ADP DET NOUN ADP DET NOUN	▁He ▁threw ▁a ▁bottle ful ▁of ▁his ▁pill s ▁into ▁the ▁kitchen ▁sink ▁and ▁tried ▁to ▁get ▁them ▁to ▁go ▁down ▁the ▁drain ▁with ▁the ▁handle ▁of ▁a ▁dish m op .	0 0 0 0 0 0 0 0 0 0 0 0 0 0 0 0 0 0 0 0 1 0 1 0 0 0 0 0 0 0 0 0	PRON VERB DET NOUN NOUN ADP ADJ NOUN NOUN ADP DET NOUN NOUN CCONJ VERB PART VERB PRON PART VERB ADP DET NOUN ADP DET NOUN ADP DET NOUN NOUN NOUN NOUN
It is a pity the needs of users did not rank too highly before £ 400 m poured down the drain.	0 0 0 0 0 0 0 0 0 0 0 0 0 0 0 0 0 0 1 0 1	down the drain	figurative	identical	PRON VERB DET NOUN DET NOUN ADP NOUN VERB ADV VERB ADV ADV ADP SYM NUM NOUN VERB PART DET NOUN	▁It ▁is ▁a ▁pity ▁the ▁needs ▁of ▁users ▁did ▁not ▁rank ▁too ▁highly ▁before ▁£ ▁400 ▁m ▁poured ▁down ▁the ▁drain .	0 0 0 0 0 0 0 0 0 0 0 0 0 0 0 0 0 0 1 0 1 1	PRON VERB DET NOUN DET NOUN ADP NOUN VERB ADV VERB ADV ADV ADP SYM NUM NOUN VERB PART DET NOUN NOUN
It's £ 55,000 of poll tax payers’ money down the drain and, yet again, the bands and gig - goers have to suffer because of crazy council bureaucracy.	0 0 0 0 0 0 0 0 1 0 1 0 0 0 0 0 0 0 0 0 0 0 0 0 0 0 0 0	down the drain	figurative	identical	PRON SYM NUM ADP ADJ NOUN NOUN NOUN ADP DET NOUN CCONJ CCONJ ADV DET NOUN CCONJ NOUN PUNCT NOUN VERB PART VERB ADP ADP ADJ NOUN NOUN	▁It ' s ▁£ ▁5 5,000 ▁of ▁poll ▁tax ▁payer s ’ ▁money ▁down ▁the ▁drain ▁and , ▁yet ▁again , ▁the ▁bands ▁and ▁g ig ▁- ▁go ers ▁have ▁to ▁suffer ▁because ▁of ▁c raz y ▁council ▁bureaucra cy .	0 0 0 0 0 0 0 0 0 0 0 0 0 1 0 1 0 0 0 0 0 0 0 0 0 0 0 0 0 0 0 0 0 0 0 0 0 0 0 0 0	PRON PRON PRON SYM NUM NUM ADP ADJ NOUN NOUN NOUN NOUN NOUN ADP DET NOUN CCONJ CCONJ CCONJ ADV ADV DET NOUN CCONJ NOUN NOUN PUNCT NOUN NOUN VERB PART VERB ADP ADP ADJ ADJ ADJ NOUN NOUN NOUN NOUN
It may help to twist drain rods when pushing them down the drain.	0 0 0 0 0 0 0 0 0 0 1 0 1	down the drain	literal	identical	PRON VERB VERB PART VERB NOUN NOUN ADV VERB PRON ADP DET NOUN	▁It ▁may ▁help ▁to ▁twist ▁drain ▁rods ▁when ▁pushing ▁them ▁down ▁the ▁drain .	0 0 0 0 0 0 0 0 0 0 1 0 1 1	PRON VERB VERB PART VERB NOUN NOUN ADV VERB PRON ADP DET NOUN NOUN
These include plungers, wormscrews ( for boring into a blockage and pulling it out ), and scrapers for removing sludge and silt and either pushing it down the drain or pulling it back into the inspection chamber on which you are working.	0 0 0 0 0 0 0 0 0 0 0 0 0 0 0 0 0 0 0 0 0 0 0 0 0 0 1 0 1 0 0 0 0 0 0 0 0 0 0 0 0 0	down the drain	literal	identical	DET VERB NOUN VERB PUNCT ADP VERB ADP DET NOUN CCONJ VERB PRON PART PUNCT CCONJ NOUN ADP VERB NOUN CCONJ NOUN CCONJ CCONJ VERB PRON ADP DET NOUN CCONJ VERB PRON ADV ADP DET NOUN NOUN ADP ADJ PRON VERB VERB	▁These ▁include ▁plunger s , ▁worms c rew s ▁( ▁for ▁boring ▁into ▁a ▁block age ▁and ▁pull ing ▁it ▁out ▁ ), ▁and ▁scrap ers ▁for ▁removing ▁sludge ▁and ▁sil t ▁and ▁either ▁pushing ▁it ▁down ▁the ▁drain ▁or ▁pull ing ▁it ▁back ▁into ▁the ▁inspection ▁chamber ▁on ▁which ▁you ▁are ▁working .	0 0 0 0 0 0 0 0 0 0 0 0 0 0 0 0 0 0 0 0 0 0 0 0 0 0 0 0 0 0 0 0 0 0 0 0 1 0 1 0 0 0 0 0 0 0 0 0 0 0 0 0 0 0	DET VERB NOUN NOUN NOUN VERB VERB VERB VERB PUNCT ADP VERB ADP DET NOUN NOUN CCONJ VERB VERB PRON PART PUNCT PUNCT CCONJ NOUN NOUN ADP VERB NOUN CCONJ NOUN NOUN CCONJ CCONJ VERB PRON ADP DET NOUN CCONJ VERB VERB PRON ADV ADP DET NOUN NOUN ADP ADJ PRON VERB VERB VERB
Now, in the early morning privacy of the bathroom, Matilda unscrewed the cap of her father's OIL OF VIOLETS and tipped three - quarters of the contents down the drain.	0 0 0 0 0 0 0 0 0 0 0 0 0 0 0 0 0 0 0 0 0 0 0 0 0 0 0 1 0 1	down the drain	literal	identical	ADV ADP DET ADJ NOUN NOUN ADP DET NOUN PROPN VERB DET NOUN ADP ADJ NOUN PROPN ADP PROPN CCONJ VERB NUM PUNCT NOUN ADP DET NOUN ADP DET NOUN	▁Now , ▁in ▁the ▁early ▁morning ▁privacy ▁of ▁the ▁bath room , ▁Ma til da ▁un s c rew ed ▁the ▁cap ▁of ▁her ▁father ' s ▁OIL ▁OF ▁VI OLE TS ▁and ▁ tipped ▁three ▁- ▁quarters ▁of ▁the ▁contents ▁down ▁the ▁drain .	0 0 0 0 0 0 0 0 0 0 0 0 0 0 0 0 0 0 0 0 0 0 0 0 0 0 0 0 0 0 0 0 0 0 0 0 0 0 0 0 0 1 0 1 1	ADV ADV ADP DET ADJ NOUN NOUN ADP DET NOUN NOUN NOUN PROPN PROPN PROPN VERB VERB VERB VERB VERB DET NOUN ADP ADJ NOUN NOUN NOUN PROPN ADP PROPN PROPN PROPN CCONJ VERB VERB NUM PUNCT NOUN ADP DET NOUN ADP DET NOUN NOUN
My film adaptation of Anthony Delano's richly comic book slip - Up’ How Fleet Street caught Ronnie Biggs and Scotland Yard lost him’cost the not unastronomical sum of £ 600,000 to make, so should it turn out to be money down the drain the BBC will have to face some embarrassing questions about why it embarked on it in the first place if it thought the story might be defamatory.	0 0 0 0 0 0 0 0 0 0 0 0 0 0 0 0 0 0 0 0 0 0 0 0 0 0 0 0 0 0 0 0 0 0 0 0 0 0 0 0 1 0 1 0 0 0 0 0 0 0 0 0 0 0 0 0 0 0 0 0 0 0 0 0 0 0 0 0 0 0	down the drain	figurative	identical	ADJ NOUN NOUN ADP PROPN PROPN ADV ADJ NOUN NOUN PUNCT ADJ ADV PROPN PROPN VERB PROPN PROPN CCONJ PROPN PROPN VERB NOUN DET ADV ADJ NOUN ADP SYM NUM PART VERB ADV VERB PRON VERB PART PART VERB NOUN ADP DET NOUN DET PROPN VERB VERB PART VERB DET ADJ NOUN ADP ADV PRON VERB ADP PRON ADP DET ADJ NOUN ADP PRON VERB DET NOUN VERB VERB ADJ	▁My ▁film ▁adaptation ▁of ▁An th ony ▁Del ano ' s ▁rich ly ▁com ic ▁book ▁slip ▁- ▁Up ’ ▁How ▁Fleet ▁Street ▁caught ▁R on nie ▁Big g s ▁and ▁Scotland ▁Yar d ▁lost ▁him ’ cost ▁the ▁not ▁un as tron omic al ▁sum ▁of ▁£ ▁6 00,000 ▁to ▁make , ▁so ▁should ▁it ▁turn ▁out ▁to ▁be ▁money ▁down ▁the ▁drain ▁the ▁B BC ▁will ▁have ▁to ▁face ▁some ▁embarrass ing ▁questions ▁about ▁why ▁it ▁embarked ▁on ▁it ▁in ▁the ▁first ▁place ▁if ▁it ▁thought ▁the ▁story ▁might ▁be ▁def am atory .	0 0 0 0 0 0 0 0 0 0 0 0 0 0 0 0 0 0 0 0 0 0 0 0 0 0 0 0 0 0 0 0 0 0 0 0 0 0 0 0 0 0 0 0 0 0 0 0 0 0 0 0 0 0 0 0 0 0 0 0 0 1 0 1 0 0 0 0 0 0 0 0 0 0 0 0 0 0 0 0 0 0 0 0 0 0 0 0 0 0 0 0 0 0 0 0	ADJ NOUN NOUN ADP PROPN PROPN PROPN PROPN PROPN PROPN PROPN ADV ADV ADJ ADJ NOUN NOUN PUNCT ADJ ADJ ADV PROPN PROPN VERB PROPN PROPN PROPN PROPN PROPN PROPN CCONJ PROPN PROPN PROPN VERB NOUN NOUN NOUN DET ADV ADJ ADJ ADJ ADJ ADJ NOUN ADP SYM NUM NUM PART VERB VERB ADV VERB PRON VERB PART PART VERB NOUN ADP DET NOUN DET PROPN PROPN VERB VERB PART VERB DET ADJ ADJ NOUN ADP ADV PRON VERB ADP PRON ADP DET ADJ NOUN ADP PRON VERB DET NOUN VERB VERB ADJ ADJ ADJ ADJ
Oh God, another 10 years down the drain ; More damage for the mirror to explain : Those whisps of grey, new veins across the nose, The growing paunch that half obscures the toes …	0 0 0 0 0 1 0 1 0 0 0 0 0 0 0 0 0 0 0 0 0 0 0 0 0 0 0 0 0 0 0 0 0 0 0	down the drain	figurative	identical	INTJ PROPN DET NUM NOUN ADP DET NOUN PUNCT ADJ NOUN ADP DET NOUN PART VERB PUNCT DET NOUN ADP ADJ ADJ NOUN ADP DET NOUN DET VERB NOUN ADP NOUN VERB DET NOUN PUNCT	▁O h ▁God , ▁another ▁10 ▁years ▁down ▁the ▁drain ▁ ; ▁More ▁damage ▁for ▁the ▁mirror ▁to ▁explain ▁ : ▁T hose ▁whi s ps ▁of ▁grey , ▁new ▁vein s ▁across ▁the ▁nose , ▁The ▁growing ▁p a unch ▁that ▁half ▁obscure s ▁the ▁to es ▁...	0 0 0 0 0 0 0 1 0 1 0 0 0 0 0 0 0 0 0 0 0 0 0 0 0 0 0 0 0 0 0 0 0 0 0 0 0 0 0 0 0 0 0 0 0 0 0 0 0	INTJ INTJ PROPN PROPN DET NUM NOUN ADP DET NOUN PUNCT PUNCT ADJ NOUN ADP DET NOUN PART VERB PUNCT PUNCT DET DET NOUN NOUN NOUN ADP ADJ ADJ ADJ NOUN NOUN ADP DET NOUN NOUN DET VERB NOUN NOUN NOUN ADP NOUN VERB VERB DET NOUN NOUN PUNCT
Still to come on Central News, billions down the drain?	0 0 0 0 0 0 0 1 0 1	down the drain	figurative	identical	ADV PART VERB ADP PROPN PROPN NOUN ADP DET NOUN	▁Still ▁to ▁come ▁on ▁Central ▁News , ▁billion s ▁down ▁the ▁drain ?	0 0 0 0 0 0 0 0 0 1 0 1 1	ADV PART VERB ADP PROPN PROPN PROPN NOUN NOUN ADP DET NOUN NOUN
I fear that safety standards will go down the drain as people seek to make most profit.	0 0 0 0 0 0 0 1 0 1 0 0 0 0 0 0 0	down the drain	figurative	identical	PRON VERB ADP NOUN NOUN VERB VERB ADP DET NOUN ADP NOUN VERB PART VERB ADJ NOUN	▁I ▁fear ▁that ▁safety ▁standards ▁will ▁go ▁down ▁the ▁drain ▁as ▁people ▁seek ▁to ▁make ▁most ▁profit .	0 0 0 0 0 0 0 1 0 1 0 0 0 0 0 0 0 0	PRON VERB ADP NOUN NOUN VERB VERB ADP DET NOUN ADP NOUN VERB PART VERB ADJ NOUN NOUN
Do this in a clockwise direction, not anticlockwise or they will unscrew and you could have a length of drain rod stuck down the drain — as well as the original blockage!	0 0 0 0 0 0 0 0 0 0 0 0 0 0 0 0 0 0 0 0 0 0 1 0 1 0 0 0 0 0 0 0	down the drain	literal	identical	VERB DET ADP DET NOUN NOUN ADV VERB CCONJ PRON VERB VERB CCONJ PRON VERB VERB DET NOUN ADP NOUN NOUN VERB PART DET NOUN PUNCT ADV ADV ADP DET ADJ NOUN	▁Do ▁this ▁in ▁a ▁clock wise ▁direction , ▁not ▁anti clock wise ▁or ▁they ▁will ▁un s c rew ▁and ▁you ▁could ▁have ▁a ▁length ▁of ▁drain ▁rod ▁stuck ▁down ▁the ▁drain ▁ — ▁as ▁well ▁as ▁the ▁original ▁block age !	0 0 0 0 0 0 0 0 0 0 0 0 0 0 0 0 0 0 0 0 0 0 0 0 0 0 0 0 0 1 0 1 0 0 0 0 0 0 0 0 0 0	VERB DET ADP DET NOUN NOUN NOUN NOUN ADV VERB VERB VERB CCONJ PRON VERB VERB VERB VERB VERB CCONJ PRON VERB VERB DET NOUN ADP NOUN NOUN VERB PART DET NOUN PUNCT PUNCT ADV ADV ADP DET ADJ NOUN NOUN NOUN
Pour it down the drains if necessary.	0 0 1 0 1 0 0	down the drain	literal	inflection	VERB PRON ADP DET NOUN ADP ADJ	▁P our ▁it ▁down ▁the ▁drain s ▁if ▁necessary .	0 0 0 1 0 1 1 0 0 0	VERB VERB PRON ADP DET NOUN NOUN ADP ADJ ADJ
‘ Even your shiksas go down the drain when they don't tickle your fancy anymore.’	0 0 0 0 0 1 0 1 0 0 0 0 0 0 0	down the drain	figurative	identical	PUNCT ADV ADJ NOUN VERB ADP DET NOUN ADV PRON VERB VERB ADJ ADJ NOUN	▁ ‘ ▁Even ▁your ▁sh ik s as ▁go ▁down ▁the ▁drain ▁when ▁they ▁don ' t ▁tick le ▁your ▁f ancy ▁any more . ’	0 0 0 0 0 0 0 0 0 1 0 1 0 0 0 0 0 0 0 0 0 0 0 0 0 0	PUNCT PUNCT ADV ADJ NOUN NOUN NOUN NOUN VERB ADP DET NOUN ADV PRON VERB VERB VERB VERB VERB ADJ ADJ ADJ NOUN NOUN NOUN NOUN
The wastes that go down the drain come from two main sources, the textiles themselves and the residues of chemicals employed in treating them.	0 0 0 0 1 0 1 0 0 0 0 0 0 0 0 0 0 0 0 0 0 0 0 0	down the drain	literal	identical	DET NOUN ADJ VERB ADP DET NOUN VERB ADP NUM ADJ NOUN DET NOUN PRON CCONJ DET NOUN ADP NOUN VERB ADP VERB PRON	▁The ▁wastes ▁that ▁go ▁down ▁the ▁drain ▁come ▁from ▁two ▁main ▁sources , ▁the ▁textiles ▁themselves ▁and ▁the ▁residues ▁of ▁chemicals ▁employed ▁in ▁treating ▁them .	0 0 0 0 1 0 1 0 0 0 0 0 0 0 0 0 0 0 0 0 0 0 0 0 0 0	DET NOUN ADJ VERB ADP DET NOUN VERB ADP NUM ADJ NOUN NOUN DET NOUN PRON CCONJ DET NOUN ADP NOUN VERB ADP VERB PRON PRON
Yeah, talent going down the drain.	0 0 0 1 0 1	down the drain	figurative	identical	INTJ NOUN VERB ADP DET NOUN	▁Ye ah , ▁talent ▁going ▁down ▁the ▁drain .	0 0 0 0 0 1 0 1 1	INTJ INTJ INTJ NOUN VERB ADP DET NOUN NOUN
As the argument goes on, Roger Sanderson says the time he spends cleaning up instead of working in his factory is money down the drain.	0 0 0 0 0 0 0 0 0 0 0 0 0 0 0 0 0 0 0 0 0 0 1 0 1	down the drain	figurative	identical	ADP DET NOUN VERB PART PROPN PROPN VERB DET NOUN PRON VERB VERB PART ADV ADP VERB ADP ADJ NOUN VERB NOUN ADP DET NOUN	▁As ▁the ▁argument ▁goes ▁on , ▁Ro ger ▁Sand erson ▁says ▁the ▁time ▁he ▁spend s ▁cleaning ▁up ▁instead ▁of ▁working ▁in ▁his ▁factory ▁is ▁money ▁down ▁the ▁drain .	0 0 0 0 0 0 0 0 0 0 0 0 0 0 0 0 0 0 0 0 0 0 0 0 0 0 1 0 1 1	ADP DET NOUN VERB PART PART PROPN PROPN PROPN PROPN VERB DET NOUN PRON VERB VERB VERB PART ADV ADP VERB ADP ADJ NOUN VERB NOUN ADP DET NOUN NOUN
That's why this country's going down the drain.	0 0 0 0 0 1 0 1	down the drain	figurative	identical	DET ADV DET NOUN VERB ADP DET NOUN	▁That ' s ▁why ▁this ▁country ' s ▁going ▁down ▁the ▁drain .	0 0 0 0 0 0 0 0 0 1 0 1 1	DET DET DET ADV DET NOUN NOUN NOUN VERB ADP DET NOUN NOUN
In fact — he wants to leave school after O - levels. £ 6,000 a year down the drain!’ rather a loud voice)‘If he wants to be a sheep farmer in Australia?	0 0 0 0 0 0 0 0 0 0 0 0 0 0 0 0 1 0 1 0 0 0 0 0 0 0 0 0 0 0 0 0	down the drain	figurative	dashes	ADP NOUN PUNCT PRON VERB PART VERB NOUN ADP NOUN PUNCT NOUN SYM NUM DET NOUN ADP DET NOUN ADV DET ADJ NOUN PRON VERB PART VERB DET NOUN NOUN ADP PROPN	▁In ▁fact ▁ — ▁he ▁wants ▁to ▁leave ▁school ▁after ▁O ▁- ▁levels . ▁£ ▁ 6,000 ▁a ▁year ▁down ▁the ▁drain ! ’ ▁rather ▁a ▁loud ▁voice ) ‘ If ▁he ▁wants ▁to ▁be ▁a ▁sheep ▁farmer ▁in ▁Australia ?	0 0 0 0 0 0 0 0 0 0 0 0 0 0 0 0 0 0 0 1 0 1 1 1 0 0 0 0 0 0 0 0 0 0 0 0 0 0 0 0 0	ADP NOUN PUNCT PUNCT PRON VERB PART VERB NOUN ADP NOUN PUNCT NOUN NOUN SYM NUM NUM DET NOUN ADP DET NOUN NOUN NOUN ADV DET ADJ NOUN NOUN NOUN NOUN PRON VERB PART VERB DET NOUN NOUN ADP PROPN PROPN
Well, apparently that used to be the official advice er and, and we were correct in that but the authorities have now changed their minds and they no longer want us to pour waste chemical down the drains and I gather that the official advice now is that surplus diluted chemical should be poured, and I 'm quoting here, on to more or less level and bare soil in the garden or on to level gravelled paths, avoid disposal in areas around ponds, erm water courses and so forth, dishes and, and what have you and as far as undiluted chemicals are concerned, that's stuff still in the bottle, the advice there is to talk to your local authority cos they have different regulations in different areas.	0 0 0 0 0 0 0 0 0 0 0 0 0 0 0 0 0 0 0 0 0 0 0 0 0 0 0 0 0 0 0 0 0 0 0 1 0 1 0 0 0 0 0 0 0 0 0 0 0 0 0 0 0 0 0 0 0 0 0 0 0 0 0 0 0 0 0 0 0 0 0 0 0 0 0 0 0 0 0 0 0 0 0 0 0 0 0 0 0 0 0 0 0 0 0 0 0 0 0 0 0 0 0 0 0 0 0 0 0 0 0 0 0 0 0 0 0 0 0 0 0 0 0 0 0 0 0	down the drain	literal	inflection	INTJ ADV ADP VERB PART VERB DET ADJ NOUN INTJ CCONJ CCONJ PRON VERB ADJ ADP DET CCONJ DET NOUN VERB ADV VERB ADJ NOUN CCONJ PRON ADV ADV VERB PRON PART VERB NOUN NOUN ADP DET NOUN CCONJ PRON VERB ADP DET ADJ NOUN ADV VERB DET ADJ VERB NOUN VERB VERB VERB CCONJ PRON VERB VERB ADV ADP ADP ADV CCONJ ADJ NOUN CCONJ ADJ NOUN ADP DET NOUN CCONJ ADP PART VERB VERB NOUN VERB NOUN ADP NOUN ADP NOUN NOUN NOUN NOUN CCONJ ADV ADV NOUN CCONJ CCONJ NOUN VERB PRON CCONJ ADV ADV ADP ADJ NOUN VERB VERB DET NOUN ADV ADP DET NOUN DET NOUN ADV VERB PART VERB ADP ADJ ADJ NOUN ADP PRON VERB ADJ NOUN ADP ADJ NOUN	▁Well , ▁apparently ▁that ▁used ▁to ▁be ▁the ▁official ▁advice ▁er ▁and , ▁and ▁we ▁were ▁correct ▁in ▁that ▁but ▁the ▁authorities ▁have ▁now ▁changed ▁their ▁minds ▁and ▁they ▁no ▁longer ▁want ▁us ▁to ▁pour ▁waste ▁chemical ▁down ▁the ▁drain s ▁and ▁I ▁gather ▁that ▁the ▁official ▁advice ▁now ▁is ▁that ▁surplus ▁diluted ▁chemical ▁should ▁be ▁poured , ▁and ▁I ▁' m ▁quot ing ▁here , ▁on ▁to ▁more ▁or ▁less ▁level ▁and ▁bare ▁soil ▁in ▁the ▁garden ▁or ▁on ▁to ▁level ▁grave lled ▁paths , ▁avoid ▁disposal ▁in ▁areas ▁around ▁pond s , ▁er m ▁water ▁courses ▁and ▁so ▁forth , ▁dishes ▁and , ▁and ▁what ▁have ▁you ▁and ▁as ▁far ▁as ▁un di lut ed ▁chemicals ▁are ▁concerned , ▁that ' s ▁stuff ▁still ▁in ▁the ▁bottle , ▁the ▁advice ▁there ▁is ▁to ▁talk ▁to ▁your ▁local ▁authority ▁co s ▁they ▁have ▁different ▁regulations ▁in ▁different ▁areas .	0 0 0 0 0 0 0 0 0 0 0 0 0 0 0 0 0 0 0 0 0 0 0 0 0 0 0 0 0 0 0 0 0 0 0 0 0 1 0 1 1 0 0 0 0 0 0 0 0 0 0 0 0 0 0 0 0 0 0 0 0 0 0 0 0 0 0 0 0 0 0 0 0 0 0 0 0 0 0 0 0 0 0 0 0 0 0 0 0 0 0 0 0 0 0 0 0 0 0 0 0 0 0 0 0 0 0 0 0 0 0 0 0 0 0 0 0 0 0 0 0 0 0 0 0 0 0 0 0 0 0 0 0 0 0 0 0 0 0 0 0 0 0 0 0 0 0 0 0 0	INTJ INTJ ADV ADP VERB PART VERB DET ADJ NOUN INTJ CCONJ CCONJ CCONJ PRON VERB ADJ ADP DET CCONJ DET NOUN VERB ADV VERB ADJ NOUN CCONJ PRON ADV ADV VERB PRON PART VERB NOUN NOUN ADP DET NOUN NOUN CCONJ PRON VERB ADP DET ADJ NOUN ADV VERB DET ADJ VERB NOUN VERB VERB VERB VERB CCONJ PRON VERB VERB VERB VERB ADV ADV ADP ADP ADV CCONJ ADJ NOUN CCONJ ADJ NOUN ADP DET NOUN CCONJ ADP PART VERB VERB VERB NOUN NOUN VERB NOUN ADP NOUN ADP NOUN NOUN NOUN NOUN NOUN NOUN NOUN CCONJ ADV ADV ADV NOUN CCONJ CCONJ CCONJ NOUN VERB PRON CCONJ ADV ADV ADP ADJ ADJ ADJ ADJ NOUN VERB VERB VERB DET DET DET NOUN ADV ADP DET NOUN NOUN DET NOUN ADV VERB PART VERB ADP ADJ ADJ NOUN ADP ADP PRON VERB ADJ NOUN ADP ADJ NOUN NOUN
In fact, the more economical methods may have led to stronger liquors being discharged because the water has been the vehicle by which unwanted impurities have been removed from the textiles and put down the drain.	0 0 0 0 0 0 0 0 0 0 0 0 0 0 0 0 0 0 0 0 0 0 0 0 0 0 0 0 0 0 0 0 0 1 0 1	down the drain	literal	identical	ADP NOUN DET ADV ADJ NOUN VERB VERB VERB ADP ADJ NOUN VERB VERB ADP DET NOUN VERB VERB DET NOUN ADP ADJ ADJ NOUN VERB VERB VERB ADP DET NOUN CCONJ VERB PART DET NOUN	▁In ▁fact , ▁the ▁more ▁economic al ▁methods ▁may ▁have ▁led ▁to ▁stronger ▁liquor s ▁being ▁discharged ▁because ▁the ▁water ▁has ▁been ▁the ▁vehicle ▁by ▁which ▁unwanted ▁impurities ▁have ▁been ▁removed ▁from ▁the ▁textiles ▁and ▁put ▁down ▁the ▁drain .	0 0 0 0 0 0 0 0 0 0 0 0 0 0 0 0 0 0 0 0 0 0 0 0 0 0 0 0 0 0 0 0 0 0 0 0 1 0 1 1	ADP NOUN NOUN DET ADV ADJ ADJ NOUN VERB VERB VERB ADP ADJ NOUN NOUN VERB VERB ADP DET NOUN VERB VERB DET NOUN ADP ADJ ADJ NOUN VERB VERB VERB ADP DET NOUN CCONJ VERB PART DET NOUN NOUN
Renshaw's, in making non - marzipan, has washed hundreds of tonnes of laetrile down the drain.	0 0 0 0 0 0 0 0 0 0 0 0 0 1 0 1	down the drain	literal	identical	NOUN ADP VERB ADJ PUNCT NOUN VERB VERB NOUN ADP NOUN ADP NOUN ADP DET NOUN	▁Ren sh aw ' s , ▁in ▁making ▁non ▁- ▁mar zi pan , ▁has ▁washed ▁hundreds ▁of ▁tonnes ▁of ▁la e tri le ▁down ▁the ▁drain .	0 0 0 0 0 0 0 0 0 0 0 0 0 0 0 0 0 0 0 0 0 0 0 0 1 0 1 1	NOUN NOUN NOUN NOUN NOUN NOUN ADP VERB ADJ PUNCT NOUN NOUN NOUN NOUN VERB VERB NOUN ADP NOUN ADP NOUN NOUN NOUN NOUN ADP DET NOUN NOUN
She says it's going down the drain.	0 0 0 0 1 0 1	down the drain	figurative	identical	PRON VERB PRON VERB ADP DET NOUN	▁She ▁says ▁it ' s ▁going ▁down ▁the ▁drain .	0 0 0 0 0 0 1 0 1 1	PRON VERB PRON PRON PRON VERB ADP DET NOUN NOUN
