They had been afloat only a few hours when a seaman shouted down the hatch.	0 0 0 0 0 0 0 0 0 0 0 0 1 0 1	down the hatch	literal	identical	PRON VERB VERB ADV ADV DET ADJ NOUN ADV DET NOUN VERB ADP DET NOUN
After all, up the lads and down the hatch.	0 0 0 0 0 0 1 0 1	down the hatch	figurative	identical	ADV ADV ADP DET NOUN CCONJ ADP DET NOUN
' Down the hatch, Piper! ' said Taff, raising his mug.	0 1 0 1 0 0 0 0 0 0 0	down the hatch	figurative	case	PUNCT ADV DET NOUN PROPN PUNCT VERB PROPN VERB ADJ NOUN
Down the hatch.	1 0 1	down the hatch	figurative	case	ADP DET NOUN
Down the hatch, ' she says, swallowing deeply, ' happy days. '	1 0 1 0 0 0 0 0 0 0 0 0	down the hatch	figurative	case	ADP DET NOUN PUNCT PRON VERB VERB ADV PUNCT ADJ NOUN PUNCT
Whoever, or whatever was in the hold seemed unwilling or unable — they had battened down the hatch once more— to do battle in the open.	0 0 0 0 0 0 0 0 0 0 0 0 0 0 0 1 0 1 0 0 0 0 0 0 0 0	down the hatch	figurative	identical	NOUN CCONJ ADJ VERB ADP DET NOUN VERB ADJ CCONJ ADJ PUNCT PRON VERB VERB PART DET NOUN ADP NOUN PART VERB NOUN ADP DET NOUN
I scrambled back down the ratlines, rushed to the cockpit and down the companionway hatch.	0 0 0 0 0 0 0 0 0 0 0 1 0 0 1	down the hatch	literal	insertion-other	PRON VERB ADV ADP DET NOUN VERB ADP DET NOUN CCONJ ADP DET NOUN NOUN