' Well, you 're all dressed up to the nines! '	0 0 0 0 0 1 0 1 0 1 0	dressed to the nines	figurative	inflection	PUNCT INTJ PRON VERB DET VERB PART ADP DET NOUN PUNCT	▁' ▁Well , ▁you ▁' re ▁all ▁dressed ▁up ▁to ▁the ▁nine s ! ▁'	0 0 0 0 0 0 0 1 0 1 0 1 1 1 0	PUNCT INTJ INTJ PRON VERB VERB DET VERB PART ADP DET NOUN NOUN NOUN PUNCT
Evelyn was dressed up to the nines.	0 0 1 0 1 0 1	dressed to the nines	figurative	inflection	PROPN VERB VERB PART ADP DET NOUN	▁E vel yn ▁was ▁dressed ▁up ▁to ▁the ▁nine s .	0 0 0 0 1 0 1 0 1 1 1	PROPN PROPN PROPN VERB VERB PART ADP DET NOUN NOUN NOUN
She wouldn't be here now, dressed to the nines for an evening that would be about as thrilling as an attack of flu, if she hadn't again responded in anger to her emotions.	0 0 0 0 0 1 1 0 1 0 0 0 0 0 0 0 0 0 0 0 0 0 0 0 0 0 0 0 0 0 0 0 0	dressed to the nines	figurative	identical	PRON VERB VERB ADV ADV VERB ADP DET NOUN ADP DET NOUN ADJ VERB VERB ADP ADV ADJ ADP DET NOUN ADP NOUN ADP PRON VERB ADV VERB ADP NOUN ADP ADJ NOUN	▁She ▁would n ' t ▁be ▁here ▁now , ▁dressed ▁to ▁the ▁nine s ▁for ▁an ▁evening ▁that ▁would ▁be ▁about ▁as ▁th rill ing ▁as ▁an ▁attack ▁of ▁flu , ▁if ▁she ▁had n ' t ▁again ▁responded ▁in ▁anger ▁to ▁her ▁emotion s .	0 0 0 0 0 0 0 0 0 1 1 0 1 1 0 0 0 0 0 0 0 0 0 0 0 0 0 0 0 0 0 0 0 0 0 0 0 0 0 0 0 0 0 0 0 0	PRON VERB VERB VERB VERB VERB ADV ADV ADV VERB ADP DET NOUN NOUN ADP DET NOUN ADJ VERB VERB ADP ADV ADJ ADJ ADJ ADP DET NOUN ADP NOUN NOUN ADP PRON VERB VERB VERB VERB ADV VERB ADP NOUN ADP ADJ NOUN NOUN NOUN
In spite of this, it was half an hour before she came downstairs dressed up to the nines in a pin - striped trouser - suit, her hair caught up in a turban of white silk.	0 0 0 0 0 0 0 0 0 0 0 0 0 1 0 1 0 1 0 0 0 0 0 0 0 0 0 0 0 0 0 0 0 0 0 0	dressed to the nines	figurative	inflection	ADP NOUN ADP DET PRON VERB ADJ DET NOUN ADP PRON VERB ADV VERB PART ADP DET NOUN ADP DET ADV PUNCT VERB NOUN PUNCT NOUN ADJ NOUN VERB PART ADP DET NOUN ADP ADJ NOUN	▁In ▁spite ▁of ▁this , ▁it ▁was ▁half ▁an ▁hour ▁before ▁she ▁came ▁down st air s ▁dressed ▁up ▁to ▁the ▁nine s ▁in ▁a ▁pin ▁- ▁strip ed ▁tro user ▁- ▁suit , ▁her ▁hair ▁caught ▁up ▁in ▁a ▁t urban ▁of ▁white ▁silk .	0 0 0 0 0 0 0 0 0 0 0 0 0 0 0 0 0 1 0 1 0 1 1 0 0 0 0 0 0 0 0 0 0 0 0 0 0 0 0 0 0 0 0 0 0 0	ADP NOUN ADP DET DET PRON VERB ADJ DET NOUN ADP PRON VERB ADV ADV ADV ADV VERB PART ADP DET NOUN NOUN ADP DET ADV PUNCT VERB VERB NOUN NOUN PUNCT NOUN NOUN ADJ NOUN VERB PART ADP DET NOUN NOUN ADP ADJ NOUN NOUN
So I guess I owe you an apology, ' he said ruefully, ' although when you walked in through the kitchen door, all dressed up to the nines after being with Ryan, I wanted anything but to forgive you. '	0 0 0 0 0 0 0 0 0 0 0 0 0 0 0 0 0 0 0 0 0 0 0 1 0 1 0 1 0 0 0 0 0 0 0 0 0 0 0 0	dressed to the nines	figurative	inflection	ADV PRON VERB PRON VERB PRON DET NOUN PUNCT PRON VERB ADV PUNCT ADP ADV PRON VERB ADV ADP DET NOUN NOUN DET VERB PART ADP DET NOUN ADP VERB ADP PROPN PRON VERB NOUN ADP PART VERB PRON PUNCT	▁So ▁I ▁guess ▁I ▁owe ▁you ▁an ▁apolog y , ▁' ▁he ▁said ▁rue fully , ▁' ▁although ▁when ▁you ▁walked ▁in ▁through ▁the ▁kitchen ▁door , ▁all ▁dressed ▁up ▁to ▁the ▁nine s ▁after ▁being ▁with ▁R yan , ▁I ▁wanted ▁anything ▁but ▁to ▁forgive ▁you . ▁'	0 0 0 0 0 0 0 0 0 0 0 0 0 0 0 0 0 0 0 0 0 0 0 0 0 0 0 0 1 0 1 0 1 1 0 0 0 0 0 0 0 0 0 0 0 0 0 0 0	ADV PRON VERB PRON VERB PRON DET NOUN NOUN NOUN PUNCT PRON VERB ADV ADV ADV PUNCT ADP ADV PRON VERB ADV ADP DET NOUN NOUN NOUN DET VERB PART ADP DET NOUN NOUN ADP VERB ADP PROPN PROPN PROPN PRON VERB NOUN ADP PART VERB PRON PRON PUNCT
It was the time of day when the tables were mostly occupied by kids, all dressed to the nines, playing more with the Steve Davis ‘ cool’ than the St£e Davis ‘ skill’.	0 0 0 0 0 0 0 0 0 0 0 0 0 0 0 1 1 0 1 0 0 0 0 0 0 0 0 0 0 0 0 0 0	dressed to the nines	figurative	identical	PRON VERB DET NOUN ADP NOUN ADV DET NOUN VERB ADV VERB ADP NOUN DET ADJ ADP DET NOUN VERB ADV ADP DET PROPN PROPN PART NOUN ADP DET PROPN PROPN PUNCT NOUN	▁It ▁was ▁the ▁time ▁of ▁day ▁when ▁the ▁tables ▁were ▁most ly ▁occupied ▁by ▁kid s , ▁all ▁dressed ▁to ▁the ▁nine s , ▁playing ▁more ▁with ▁the ▁Ste ve ▁Davis ▁ ‘ ▁cool ’ ▁than ▁the ▁St £ e ▁Davis ▁ ‘ ▁skill ’ .	0 0 0 0 0 0 0 0 0 0 0 0 0 0 0 0 0 0 1 1 0 1 1 1 0 0 0 0 0 0 0 0 0 0 0 0 0 0 0 0 0 0 0 0 0 0	PRON VERB DET NOUN ADP NOUN ADV DET NOUN VERB ADV ADV VERB ADP NOUN NOUN NOUN DET ADJ ADP DET NOUN NOUN NOUN VERB ADV ADP DET PROPN PROPN PROPN PART PART NOUN NOUN ADP DET PROPN PROPN PROPN PROPN PUNCT PUNCT NOUN NOUN NOUN
But she, she could bleeding dress up to the nines.	0 0 0 0 0 1 0 1 0 1	dressed to the nines	figurative	inflection	CCONJ PRON PRON VERB VERB VERB PART ADP DET NOUN	▁But ▁she , ▁she ▁could ▁bleeding ▁ dress ▁up ▁to ▁the ▁nine s .	0 0 0 0 0 0 1 1 0 1 0 1 1 1	CCONJ PRON PRON PRON VERB VERB VERB VERB PART ADP DET NOUN NOUN NOUN
But generally the climate is comfortably warm — ideal for small children and perfect for the Spanish ritual of the paseo, the evening parade when grandmothers, mothers and their offspring, dressed up to the nines, ride their bikes, push prams, sip coffee, choose ice - creams, and gossip like a noisy flock of birds settling down before bedtime.	0 0 0 0 0 0 0 0 0 0 0 0 0 0 0 0 0 0 0 0 0 0 0 0 0 0 0 0 0 0 1 0 1 0 1 0 0 0 0 0 0 0 0 0 0 0 0 0 0 0 0 0 0 0 0 0 0 0	dressed to the nines	figurative	inflection	CCONJ ADV DET NOUN VERB ADV ADJ PUNCT NOUN ADP ADJ NOUN CCONJ ADJ ADP DET ADJ NOUN ADP DET NOUN DET NOUN NOUN ADV NOUN NOUN CCONJ ADJ NOUN VERB PART ADP DET NOUN VERB ADJ NOUN VERB NOUN VERB NOUN VERB NOUN PUNCT NOUN CCONJ NOUN ADP DET ADJ NOUN ADP NOUN VERB PART ADP NOUN	▁But ▁generally ▁the ▁climate ▁is ▁comfort ably ▁warm ▁ — ▁ideal ▁for ▁small ▁children ▁and ▁perfect ▁for ▁the ▁Spanish ▁ritual ▁of ▁the ▁p ase o , ▁the ▁evening ▁para de ▁when ▁grand m other s , ▁mothers ▁and ▁their ▁offspring , ▁dressed ▁up ▁to ▁the ▁nine s , ▁rid e ▁their ▁bi kes , ▁push ▁p ram s , ▁s ip ▁coffee , ▁choose ▁ice ▁- ▁cream s , ▁and ▁go s s ip ▁like ▁a ▁no is y ▁flock ▁of ▁birds ▁settling ▁down ▁before ▁be d time .	0 0 0 0 0 0 0 0 0 0 0 0 0 0 0 0 0 0 0 0 0 0 0 0 0 0 0 0 0 0 0 0 0 0 0 0 0 0 0 0 0 1 0 1 0 1 1 1 0 0 0 0 0 0 0 0 0 0 0 0 0 0 0 0 0 0 0 0 0 0 0 0 0 0 0 0 0 0 0 0 0 0 0 0 0 0 0 0 0	CCONJ ADV DET NOUN VERB ADV ADV ADJ PUNCT PUNCT NOUN ADP ADJ NOUN CCONJ ADJ ADP DET ADJ NOUN ADP DET NOUN NOUN NOUN NOUN DET NOUN NOUN NOUN ADV NOUN NOUN NOUN NOUN NOUN NOUN CCONJ ADJ NOUN NOUN VERB PART ADP DET NOUN NOUN NOUN VERB VERB ADJ NOUN NOUN NOUN VERB NOUN NOUN NOUN NOUN VERB VERB NOUN NOUN VERB NOUN PUNCT NOUN NOUN NOUN CCONJ NOUN NOUN NOUN NOUN ADP DET ADJ ADJ ADJ NOUN ADP NOUN VERB PART ADP NOUN NOUN NOUN NOUN
