Carefully he scraped every last vestige of ice - cream from his bowl, then stood up.	0 0 0 1 1 0 0 0 0 0 0 0 0 0 0 0	every last	figurative	identical	ADV PRON VERB DET ADJ NOUN ADP NOUN PUNCT NOUN ADP ADJ NOUN ADV VERB PART	▁Careful ly ▁he ▁scrap ed ▁every ▁last ▁v est ige ▁of ▁ice ▁- ▁cream ▁from ▁his ▁bowl , ▁then ▁stood ▁up .	0 0 0 0 0 1 1 0 0 0 0 0 0 0 0 0 0 0 0 0 0 0	ADV ADV PRON VERB VERB DET ADJ NOUN NOUN NOUN ADP NOUN PUNCT NOUN ADP ADJ NOUN NOUN ADV VERB PART PART
It would be no bad thing if a more subdued housing market made Britons less obsessive about investing every last penny in their homes in the quest for easy returns.	0 0 0 0 0 0 0 0 0 0 0 0 0 0 0 0 0 0 1 1 0 0 0 0 0 0 0 0 0 0	every last	figurative	identical	PRON VERB VERB DET ADJ NOUN ADP DET ADV ADJ NOUN NOUN VERB PROPN ADJ NOUN ADP VERB DET ADJ NOUN ADP ADJ NOUN ADP DET NOUN ADP ADJ NOUN	▁It ▁would ▁be ▁no ▁bad ▁thing ▁if ▁a ▁more ▁subdued ▁housing ▁market ▁made ▁Brit ons ▁less ▁ob ses sive ▁about ▁investing ▁every ▁last ▁pen ny ▁in ▁their ▁homes ▁in ▁the ▁quest ▁for ▁easy ▁returns .	0 0 0 0 0 0 0 0 0 0 0 0 0 0 0 0 0 0 0 0 0 1 1 0 0 0 0 0 0 0 0 0 0 0 0	PRON VERB VERB DET ADJ NOUN ADP DET ADV ADJ NOUN NOUN VERB PROPN PROPN ADJ NOUN NOUN NOUN ADP VERB DET ADJ NOUN NOUN ADP ADJ NOUN ADP DET NOUN ADP ADJ NOUN NOUN
Hoarse but buoyant, Clinton had roared towards the end of a marathon tour of eight states yesterday pleading for every last vote.	0 0 0 0 0 0 0 0 0 0 0 0 0 0 0 0 0 0 0 1 1 0	every last	figurative	identical	ADJ CCONJ ADJ PROPN VERB VERB ADP DET NOUN ADP DET ADJ NOUN ADP NUM NOUN NOUN VERB ADP DET ADJ NOUN	▁Ho ars e ▁but ▁buoy ant , ▁Clinton ▁had ▁ro ar ed ▁towards ▁the ▁end ▁of ▁a ▁mar ath on ▁to ur ▁of ▁eight ▁states ▁yesterday ▁plead ing ▁for ▁every ▁last ▁vote .	0 0 0 0 0 0 0 0 0 0 0 0 0 0 0 0 0 0 0 0 0 0 0 0 0 0 0 0 0 1 1 0 0	ADJ ADJ ADJ CCONJ ADJ ADJ ADJ PROPN VERB VERB VERB VERB ADP DET NOUN ADP DET ADJ ADJ ADJ NOUN NOUN ADP NUM NOUN NOUN VERB VERB ADP DET ADJ NOUN NOUN
Saw how he grasped every last detail of it and held that knowledge tight in his memory.	0 0 0 0 1 1 0 0 0 0 0 0 0 0 0 0 0	every last	figurative	identical	VERB ADV PRON VERB DET ADJ NOUN ADP PRON CCONJ VERB ADP NOUN ADV ADP ADJ NOUN	▁Saw ▁how ▁he ▁grasp ed ▁every ▁last ▁detail ▁of ▁it ▁and ▁held ▁that ▁knowledge ▁tight ▁in ▁his ▁memory .	0 0 0 0 0 1 1 0 0 0 0 0 0 0 0 0 0 0 0	VERB ADV PRON VERB VERB DET ADJ NOUN ADP PRON CCONJ VERB ADP NOUN ADV ADP ADJ NOUN NOUN
If Mr. Millan releases the money, every last penny of it will go to the coalfield areas.	0 0 0 0 0 0 1 1 0 0 0 0 0 0 0 0 0	every last	figurative	identical	ADP PROPN PROPN VERB DET NOUN DET ADJ NOUN ADP PRON VERB VERB ADP DET NOUN NOUN	▁If ▁Mr . ▁M illan ▁releases ▁the ▁money , ▁every ▁last ▁pen ny ▁of ▁it ▁will ▁go ▁to ▁the ▁coal field ▁areas .	0 0 0 0 0 0 0 0 0 1 1 0 0 0 0 0 0 0 0 0 0 0 0	ADP PROPN PROPN PROPN PROPN VERB DET NOUN NOUN DET ADJ NOUN NOUN ADP PRON VERB VERB ADP DET NOUN NOUN NOUN NOUN
On one of his recent trips they had frightened him so much that he dropped his food and had to watch helplessly while they devoured every last scrap of it.	0 0 0 0 0 0 0 0 0 0 0 0 0 0 0 0 0 0 0 0 0 0 0 0 0 1 1 0 0 0	every last	figurative	identical	ADP NUM ADP ADJ ADJ NOUN PRON VERB VERB PRON ADV ADV ADP PRON VERB ADJ NOUN CCONJ VERB PART VERB ADV ADP PRON VERB DET ADJ NOUN ADP PRON	▁On ▁one ▁of ▁his ▁recent ▁trips ▁they ▁had ▁f right ened ▁him ▁so ▁much ▁that ▁he ▁dropped ▁his ▁food ▁and ▁had ▁to ▁watch ▁help lessly ▁while ▁they ▁devour ed ▁every ▁last ▁scrap ▁of ▁it .	0 0 0 0 0 0 0 0 0 0 0 0 0 0 0 0 0 0 0 0 0 0 0 0 0 0 0 0 0 1 1 0 0 0 0	ADP NUM ADP ADJ ADJ NOUN PRON VERB VERB VERB VERB PRON ADV ADV ADP PRON VERB ADJ NOUN CCONJ VERB PART VERB ADV ADV ADP PRON VERB VERB DET ADJ NOUN ADP PRON PRON
You go before the Marshal and I 'll deny every last word.	0 0 0 0 0 0 0 0 0 1 1 0	every last	figurative	identical	PRON VERB ADP DET PROPN CCONJ PRON VERB VERB DET ADJ NOUN	▁You ▁go ▁before ▁the ▁Marsh al ▁and ▁I ▁' ll ▁deny ▁every ▁last ▁word .	0 0 0 0 0 0 0 0 0 0 0 1 1 0 0	PRON VERB ADP DET PROPN PROPN CCONJ PRON VERB VERB VERB DET ADJ NOUN NOUN
‘ It's a shocking situation, and I am spending every single minute of every single day and every last dollar of my father's money to correct this evil.’	0 0 0 0 0 0 0 0 0 0 0 0 0 0 0 0 0 1 1 0 0 0 0 0 0 0 0 0	every last	figurative	identical	PUNCT PRON DET ADJ NOUN CCONJ PRON VERB VERB DET ADJ NOUN ADP DET ADJ NOUN CCONJ DET ADJ NOUN ADP ADJ NOUN NOUN PART VERB DET NOUN	▁ ‘ ▁It ' s ▁a ▁shock ing ▁situation , ▁and ▁I ▁am ▁spending ▁every ▁single ▁minute ▁of ▁every ▁single ▁day ▁and ▁every ▁last ▁dollar ▁of ▁my ▁father ' s ▁money ▁to ▁correct ▁this ▁evil . ’	0 0 0 0 0 0 0 0 0 0 0 0 0 0 0 0 0 0 0 0 0 0 1 1 0 0 0 0 0 0 0 0 0 0 0 0 0	PUNCT PUNCT PRON PRON PRON DET ADJ ADJ NOUN NOUN CCONJ PRON VERB VERB DET ADJ NOUN ADP DET ADJ NOUN CCONJ DET ADJ NOUN ADP ADJ NOUN NOUN NOUN NOUN PART VERB DET NOUN NOUN NOUN
The mainstream critics ' thankless task ( their privilege ) is only completed when every last cultural product is herded into this universal corral of taste where, to quote Bourdieu once more, ‘ the most classifying privilege has the privilege of appearing to be the most natural one’.	0 0 0 0 0 0 0 0 0 0 0 0 0 0 1 1 0 0 0 0 0 0 0 0 0 0 0 0 0 0 0 0 0 0 0 0 0 0 0 0 0 0 0 0 0 0 0 0	every last	figurative	identical	DET NOUN NOUN PART ADJ NOUN PUNCT ADJ NOUN PUNCT VERB ADV VERB ADV DET ADJ ADJ NOUN VERB VERB ADP DET ADJ NOUN ADP NOUN ADV PART VERB PROPN ADV ADV PUNCT DET ADV ADJ NOUN VERB DET NOUN ADP VERB PART VERB DET ADV ADJ NOUN	▁The ▁mainstream ▁critic s ▁' ▁thank less ▁task ▁( ▁their ▁privilege ▁ ) ▁is ▁only ▁completed ▁when ▁every ▁last ▁cultural ▁product ▁is ▁herd ed ▁into ▁this ▁universal ▁cor ral ▁of ▁taste ▁where , ▁to ▁quote ▁Bour di eu ▁once ▁more , ▁ ‘ ▁the ▁most ▁classifying ▁privilege ▁has ▁the ▁privilege ▁of ▁appearing ▁to ▁be ▁the ▁most ▁natural ▁one ’ .	0 0 0 0 0 0 0 0 0 0 0 0 0 0 0 0 0 1 1 0 0 0 0 0 0 0 0 0 0 0 0 0 0 0 0 0 0 0 0 0 0 0 0 0 0 0 0 0 0 0 0 0 0 0 0 0 0 0 0 0	DET NOUN NOUN NOUN PART ADJ ADJ NOUN PUNCT ADJ NOUN PUNCT PUNCT VERB ADV VERB ADV DET ADJ ADJ NOUN VERB VERB VERB ADP DET ADJ NOUN NOUN ADP NOUN ADV ADV PART VERB PROPN PROPN PROPN ADV ADV ADV PUNCT PUNCT DET ADV ADJ NOUN VERB DET NOUN ADP VERB PART VERB DET ADV ADJ NOUN NOUN NOUN
The FLN won't rest until the French are out ; every last colon .’	0 0 0 0 0 0 0 0 0 0 1 1 0 0	every last	figurative	identical	DET PROPN VERB VERB ADP DET PROPN VERB ADV PUNCT DET ADJ NOUN PUNCT	▁The ▁FL N ▁won ' t ▁rest ▁until ▁the ▁French ▁are ▁out ▁ ; ▁every ▁last ▁colon ▁ . ’	0 0 0 0 0 0 0 0 0 0 0 0 0 0 1 1 0 0 0 0	DET PROPN PROPN VERB VERB VERB VERB ADP DET PROPN VERB ADV PUNCT PUNCT DET ADJ NOUN PUNCT PUNCT PUNCT
Once Tam darted a terrified glance over his shoulder and saw Kim sprawled across the writing - table ; white faced and trembling from head to toe, he had his eyes closed and his fists were clenched tight as he summoned up every last ounce of courage in his eleven - year - old body to endure his father's beating without weeping or crying out.	0 0 0 0 0 0 0 0 0 0 0 0 0 0 0 0 0 0 0 0 0 0 0 0 0 0 0 0 0 0 0 0 0 0 0 0 0 0 0 0 0 0 1 1 0 0 0 0 0 0 0 0 0 0 0 0 0 0 0 0 0 0 0 0 0	every last	figurative	identical	ADP PROPN VERB DET ADJ NOUN ADP ADJ NOUN CCONJ VERB PROPN VERB ADP DET NOUN PUNCT NOUN PUNCT ADJ VERB CCONJ VERB ADP NOUN ADP NOUN PRON VERB ADJ NOUN ADJ CCONJ ADJ NOUN VERB VERB ADV ADP PRON VERB PART DET ADJ NOUN ADP NOUN ADP ADJ NUM PUNCT NOUN PUNCT ADJ NOUN PART VERB ADJ NOUN NOUN ADP VERB CCONJ VERB PART	▁Once ▁T am ▁dar ted ▁a ▁terr ified ▁glance ▁over ▁his ▁shoulder ▁and ▁saw ▁K im ▁sp raw led ▁across ▁the ▁writing ▁- ▁table ▁ ; ▁white ▁faced ▁and ▁trembling ▁from ▁head ▁to ▁to e , ▁he ▁had ▁his ▁eyes ▁closed ▁and ▁his ▁f ists ▁were ▁cle nch ed ▁tight ▁as ▁he ▁summon ed ▁up ▁every ▁last ▁o unce ▁of ▁courage ▁in ▁his ▁eleven ▁- ▁year ▁- ▁old ▁body ▁to ▁endure ▁his ▁father ' s ▁be ating ▁without ▁we ep ing ▁or ▁cry ing ▁out .	0 0 0 0 0 0 0 0 0 0 0 0 0 0 0 0 0 0 0 0 0 0 0 0 0 0 0 0 0 0 0 0 0 0 0 0 0 0 0 0 0 0 0 0 0 0 0 0 0 0 0 0 0 0 0 1 1 0 0 0 0 0 0 0 0 0 0 0 0 0 0 0 0 0 0 0 0 0 0 0 0 0 0 0 0 0	ADP PROPN PROPN VERB VERB DET ADJ ADJ NOUN ADP ADJ NOUN CCONJ VERB PROPN PROPN VERB VERB VERB ADP DET NOUN PUNCT NOUN PUNCT PUNCT ADJ VERB CCONJ VERB ADP NOUN ADP NOUN NOUN NOUN PRON VERB ADJ NOUN ADJ CCONJ ADJ NOUN NOUN VERB VERB VERB VERB ADV ADP PRON VERB VERB PART DET ADJ NOUN NOUN ADP NOUN ADP ADJ NUM PUNCT NOUN PUNCT ADJ NOUN PART VERB ADJ NOUN NOUN NOUN NOUN NOUN ADP VERB VERB VERB CCONJ VERB VERB PART PART
Yet on an island where even nature conservationists seem bent on taming every last acre, I think that the time may be ripe for bringing the word — and the kind of land it refers to — back into currency.	0 0 0 0 0 0 0 0 0 0 0 0 1 1 0 0 0 0 0 0 0 0 0 0 0 0 0 0 0 0 0 0 0 0 0 0 0 0 0 0	every last	figurative	identical	ADV ADP DET NOUN ADV ADV NOUN NOUN VERB ADJ ADP VERB DET ADJ NOUN PRON VERB ADP DET NOUN VERB VERB ADJ ADP VERB DET NOUN PUNCT CCONJ DET NOUN ADP NOUN PRON VERB ADP PUNCT ADV ADP NOUN	▁Yet ▁on ▁an ▁island ▁where ▁even ▁nature ▁conservation ists ▁seem ▁be nt ▁on ▁ta ming ▁every ▁last ▁a cre , ▁I ▁think ▁that ▁the ▁time ▁may ▁be ▁ripe ▁for ▁bringing ▁the ▁word ▁ — ▁and ▁the ▁kind ▁of ▁land ▁it ▁refers ▁to ▁ — ▁back ▁into ▁currency .	0 0 0 0 0 0 0 0 0 0 0 0 0 0 0 1 1 0 0 0 0 0 0 0 0 0 0 0 0 0 0 0 0 0 0 0 0 0 0 0 0 0 0 0 0 0 0 0	ADV ADP DET NOUN ADV ADV NOUN NOUN NOUN VERB ADJ ADJ ADP VERB VERB DET ADJ NOUN NOUN NOUN PRON VERB ADP DET NOUN VERB VERB ADJ ADP VERB DET NOUN PUNCT PUNCT CCONJ DET NOUN ADP NOUN PRON VERB ADP PUNCT PUNCT ADV ADP NOUN NOUN
I 'm going to clear my mother's name, and the great M 'sieur Rohan —’ she almost spat the name ‘ — is going to eat every last insulting word.’	0 0 0 0 0 0 0 0 0 0 0 0 0 0 0 0 0 0 0 0 0 0 0 0 0 0 1 1 0 0	every last	figurative	identical	PRON VERB VERB PART VERB ADJ NOUN NOUN CCONJ DET ADJ PROPN NOUN PROPN ADV PRON ADV VERB DET NOUN PUNCT PUNCT VERB VERB PART VERB DET ADJ ADJ NOUN	▁I ▁' m ▁going ▁to ▁clear ▁my ▁mother ' s ▁name , ▁and ▁the ▁great ▁M ▁' si eur ▁Ro han ▁ —’ ▁she ▁almost ▁sp at ▁the ▁name ▁ ‘ ▁ — ▁is ▁going ▁to ▁eat ▁every ▁last ▁insult ing ▁word . ’	0 0 0 0 0 0 0 0 0 0 0 0 0 0 0 0 0 0 0 0 0 0 0 0 0 0 0 0 0 0 0 0 0 0 0 0 0 1 1 0 0 0 0 0	PRON VERB VERB VERB PART VERB ADJ NOUN NOUN NOUN NOUN NOUN CCONJ DET ADJ PROPN NOUN NOUN NOUN PROPN PROPN ADV ADV PRON ADV VERB VERB DET NOUN PUNCT PUNCT PUNCT PUNCT VERB VERB PART VERB DET ADJ ADJ ADJ NOUN NOUN NOUN
Since it arrived four days ago, every last word was beaten into her brain.	0 0 0 0 0 0 1 1 0 0 0 0 0 0	every last	figurative	identical	ADP PRON VERB NUM NOUN ADV DET ADJ NOUN VERB VERB ADP ADJ NOUN	▁Since ▁it ▁arrived ▁four ▁days ▁ago , ▁every ▁last ▁word ▁was ▁beat en ▁into ▁her ▁brain .	0 0 0 0 0 0 0 1 1 0 0 0 0 0 0 0 0	ADP PRON VERB NUM NOUN ADV ADV DET ADJ NOUN VERB VERB VERB ADP ADJ NOUN NOUN
BILL Clinton used every last drop of his charm and charisma to make the most important conquest of his life.	0 0 0 1 1 0 0 0 0 0 0 0 0 0 0 0 0 0 0 0	every last	figurative	identical	PROPN PROPN VERB DET ADJ NOUN ADP ADJ NOUN CCONJ VERB PART VERB DET ADV ADJ NOUN ADP ADJ NOUN	▁B IL L ▁Clinton ▁used ▁every ▁last ▁drop ▁of ▁his ▁char m ▁and ▁char isma ▁to ▁make ▁the ▁most ▁important ▁con quest ▁of ▁his ▁life .	0 0 0 0 0 1 1 0 0 0 0 0 0 0 0 0 0 0 0 0 0 0 0 0 0 0	PROPN PROPN PROPN PROPN VERB DET ADJ NOUN ADP ADJ NOUN NOUN CCONJ VERB VERB PART VERB DET ADV ADJ NOUN NOUN ADP ADJ NOUN NOUN
The editors revelled in the honour, ate their lunches and went back to their offices to continue publishing every last tit - bit they could find.	0 0 0 0 0 0 0 0 0 0 0 0 0 0 0 0 0 0 1 1 0 0 0 0 0 0	every last	figurative	identical	DET NOUN VERB ADP DET NOUN VERB ADJ NOUN CCONJ VERB ADV ADP ADJ NOUN PART VERB VERB DET ADJ NOUN PUNCT NOUN PRON VERB VERB	▁The ▁editor s ▁re vel led ▁in ▁the ▁honour , ▁at e ▁their ▁lunch es ▁and ▁went ▁back ▁to ▁their ▁offices ▁to ▁continue ▁publishing ▁every ▁last ▁ti t ▁- ▁bit ▁they ▁could ▁find .	0 0 0 0 0 0 0 0 0 0 0 0 0 0 0 0 0 0 0 0 0 0 0 0 1 1 0 0 0 0 0 0 0 0	DET NOUN NOUN VERB VERB VERB ADP DET NOUN NOUN VERB VERB ADJ NOUN NOUN CCONJ VERB ADV ADP ADJ NOUN PART VERB VERB DET ADJ NOUN NOUN PUNCT NOUN PRON VERB VERB VERB
Finishing every last morsel on your plate won't make your hair curl or do anything to help the starving children in India.	0 1 1 0 0 0 0 0 0 0 0 0 0 0 0 0 0 0 0 0 0 0	every last	figurative	identical	VERB DET ADJ NOUN ADP ADJ NOUN VERB VERB ADJ NOUN VERB CCONJ VERB NOUN PART VERB DET VERB NOUN ADP PROPN	▁Finish ing ▁every ▁last ▁mor sel ▁on ▁your ▁plate ▁won ' t ▁make ▁your ▁hair ▁curl ▁or ▁do ▁anything ▁to ▁help ▁the ▁starving ▁children ▁in ▁India .	0 0 1 1 0 0 0 0 0 0 0 0 0 0 0 0 0 0 0 0 0 0 0 0 0 0 0	VERB VERB DET ADJ NOUN NOUN ADP ADJ NOUN VERB VERB VERB VERB ADJ NOUN VERB CCONJ VERB NOUN PART VERB DET VERB NOUN ADP PROPN PROPN
I thought I knew everything about you all — every last tiny little, dirty little thing — but now you surprise me.	0 0 0 0 0 0 0 0 0 1 1 0 0 0 0 0 0 0 0 0 0 0	every last	figurative	identical	PRON VERB PRON VERB NOUN ADP PRON DET PUNCT DET ADJ ADJ ADJ ADJ ADJ NOUN PUNCT CCONJ ADV PRON VERB PRON	▁I ▁thought ▁I ▁knew ▁everything ▁about ▁you ▁all ▁ — ▁every ▁last ▁tiny ▁little , ▁dirty ▁little ▁thing ▁ — ▁but ▁now ▁you ▁surprise ▁me .	0 0 0 0 0 0 0 0 0 0 1 1 0 0 0 0 0 0 0 0 0 0 0 0 0 0	PRON VERB PRON VERB NOUN ADP PRON DET PUNCT PUNCT DET ADJ ADJ ADJ ADJ ADJ ADJ NOUN PUNCT PUNCT CCONJ ADV PRON VERB PRON PRON
The same schemes are celebrated repeatedly with the government squeezing out every last drop of credit from West Belfast projects.	0 0 0 0 0 0 0 0 0 0 0 1 1 0 0 0 0 0 0 0	every last	figurative	identical	DET ADJ NOUN VERB VERB ADV ADP DET NOUN VERB PART DET ADJ NOUN ADP NOUN ADP PROPN PROPN NOUN	▁The ▁same ▁schemes ▁are ▁celebrate d ▁repeatedly ▁with ▁the ▁government ▁s que ez ing ▁out ▁every ▁last ▁drop ▁of ▁credit ▁from ▁West ▁Belfast ▁projects .	0 0 0 0 0 0 0 0 0 0 0 0 0 0 0 1 1 0 0 0 0 0 0 0 0	DET ADJ NOUN VERB VERB VERB ADV ADP DET NOUN VERB VERB VERB VERB PART DET ADJ NOUN ADP NOUN ADP PROPN PROPN NOUN NOUN
He drank every last drop and then announced, ‘ I have finished my last glass.’	0 0 1 1 0 0 0 0 0 0 0 0 0 0 0	every last	figurative	identical	PRON VERB DET ADJ NOUN CCONJ ADV VERB PUNCT PRON VERB VERB ADJ ADJ NOUN	▁He ▁d rank ▁every ▁last ▁drop ▁and ▁then ▁announced , ▁ ‘ ▁I ▁have ▁finished ▁my ▁last ▁glass . ’	0 0 0 1 1 0 0 0 0 0 0 0 0 0 0 0 0 0 0 0	PRON VERB VERB DET ADJ NOUN CCONJ ADV VERB VERB PUNCT PUNCT PRON VERB VERB ADJ ADJ NOUN NOUN NOUN
He watched attentively, noting every frown, every look of puzzlement, every last betraying blink or twitch in the old man's face, anxious to gauge the depth of his feelings.	0 0 0 0 0 0 0 0 0 0 1 1 0 0 0 0 0 0 0 0 0 0 0 0 0 0 0 0 0	every last	figurative	identical	PRON VERB ADV VERB DET NOUN DET NOUN ADP NOUN DET ADJ NOUN NOUN CCONJ VERB ADP DET ADJ NOUN NOUN ADJ PART VERB DET NOUN ADP ADJ NOUN	▁He ▁watch ed ▁attentively , ▁not ing ▁every ▁fr own , ▁every ▁look ▁of ▁puzzle ment , ▁every ▁last ▁betray ing ▁b link ▁or ▁t w itch ▁in ▁the ▁old ▁man ' s ▁face , ▁anxious ▁to ▁gauge ▁the ▁depth ▁of ▁his ▁feelings .	0 0 0 0 0 0 0 0 0 0 0 0 0 0 0 0 0 1 1 0 0 0 0 0 0 0 0 0 0 0 0 0 0 0 0 0 0 0 0 0 0 0 0 0	PRON VERB VERB ADV ADV VERB VERB DET NOUN NOUN NOUN DET NOUN ADP NOUN NOUN NOUN DET ADJ NOUN NOUN NOUN NOUN CCONJ VERB VERB VERB ADP DET ADJ NOUN NOUN NOUN NOUN NOUN ADJ PART VERB DET NOUN ADP ADJ NOUN NOUN
Their unpicking of our trade union law reforms, which would deliberately make strikes easier, longer and more frequent, their support for every last dot and comma of the European Commission's social action programme, just one directive of which could add £ 5 billion to the costs of British employers —	0 0 0 0 0 0 0 0 0 0 0 0 0 0 0 0 0 0 0 0 0 1 1 0 0 0 0 0 0 0 0 0 0 0 0 0 0 0 0 0 0 0 0 0 0 0 0 0 0 0	every last	figurative	identical	ADJ NOUN ADP ADJ NOUN NOUN NOUN NOUN ADJ VERB ADV VERB NOUN ADJ ADV CCONJ ADV ADJ ADJ NOUN ADP DET ADJ NOUN CCONJ NOUN ADP DET PROPN PROPN ADJ NOUN NOUN ADV NUM NOUN ADP ADJ VERB VERB SYM NUM NUM ADP DET NOUN ADP ADJ NOUN PUNCT	▁The ir ▁un pic king ▁of ▁our ▁trade ▁union ▁law ▁reforms , ▁which ▁would ▁deliberately ▁make ▁strikes ▁easier , ▁longer ▁and ▁more ▁frequent , ▁their ▁support ▁for ▁every ▁last ▁do t ▁and ▁com ma ▁of ▁the ▁European ▁Commission ' s ▁social ▁action ▁programme , ▁just ▁one ▁directive ▁of ▁which ▁could ▁add ▁£ ▁5 ▁billion ▁to ▁the ▁costs ▁of ▁British ▁employers ▁ —	0 0 0 0 0 0 0 0 0 0 0 0 0 0 0 0 0 0 0 0 0 0 0 0 0 0 0 1 1 0 0 0 0 0 0 0 0 0 0 0 0 0 0 0 0 0 0 0 0 0 0 0 0 0 0 0 0 0 0 0 0 0	ADJ ADJ NOUN NOUN NOUN ADP ADJ NOUN NOUN NOUN NOUN NOUN ADJ VERB ADV VERB NOUN ADJ ADJ ADV CCONJ ADV ADJ ADJ ADJ NOUN ADP DET ADJ NOUN NOUN CCONJ NOUN NOUN ADP DET PROPN PROPN PROPN PROPN ADJ NOUN NOUN NOUN ADV NUM NOUN ADP ADJ VERB VERB SYM NUM NUM ADP DET NOUN ADP ADJ NOUN PUNCT PUNCT
We must not expend every last drop of sympathy on William Titford the cardmaker, for there are others who need some too ; William's brother Thomas was one.	0 0 0 0 1 1 0 0 0 0 0 0 0 0 0 0 0 0 0 0 0 0 0 0 0 0 0 0	every last	figurative	identical	PRON VERB ADV VERB DET ADJ NOUN ADP NOUN ADP PROPN PROPN DET NOUN ADP ADV VERB NOUN NOUN VERB DET ADV PUNCT PROPN NOUN PROPN VERB NUM	▁We ▁must ▁not ▁expen d ▁every ▁last ▁drop ▁of ▁sympathy ▁on ▁William ▁T it ford ▁the ▁card maker , ▁for ▁there ▁are ▁others ▁who ▁need ▁some ▁too ▁ ; ▁William ' s ▁brother ▁Thomas ▁was ▁one .	0 0 0 0 0 1 1 0 0 0 0 0 0 0 0 0 0 0 0 0 0 0 0 0 0 0 0 0 0 0 0 0 0 0 0 0 0	PRON VERB ADV VERB VERB DET ADJ NOUN ADP NOUN ADP PROPN PROPN PROPN PROPN DET NOUN NOUN NOUN ADP ADV VERB NOUN NOUN VERB DET ADV PUNCT PUNCT PROPN PROPN PROPN NOUN PROPN VERB NUM NUM
Income tax is not levied on every last penny of your money.	0 0 0 0 0 0 1 1 0 0 0 0	every last	figurative	identical	NOUN NOUN VERB ADV VERB ADP DET ADJ NOUN ADP ADJ NOUN	▁Income ▁tax ▁is ▁not ▁levied ▁on ▁every ▁last ▁pen ny ▁of ▁your ▁money .	0 0 0 0 0 0 1 1 0 0 0 0 0 0	NOUN NOUN VERB ADV VERB ADP DET ADJ NOUN NOUN ADP ADJ NOUN NOUN
Not that it had done Oliver Rattrie any good, since he 'd been caught the day after by those same Chartist women who had marched into Halifax singing the One Hundredth Psalm ; sheep no longer but howling Furies who had seized him, puny little thing that he was, and thrown him in the canal where, in his struggle to keep himself from drowning, he had lost every last shilling of the blood - money in his pockets.	0 0 0 0 0 0 0 0 0 0 0 0 0 0 0 0 0 0 0 0 0 0 0 0 0 0 0 0 0 0 0 0 0 0 0 0 0 0 0 0 0 0 0 0 0 0 0 0 0 0 0 0 0 0 0 0 0 0 0 0 0 0 0 0 0 0 0 1 1 0 0 0 0 0 0 0 0 0	every last	figurative	identical	ADV ADP PRON VERB VERB PROPN PROPN DET ADJ ADP PRON VERB VERB VERB DET NOUN ADV ADP DET ADJ ADJ NOUN NOUN VERB VERB ADP PROPN VERB DET NUM PROPN PROPN PUNCT NOUN ADV ADV CCONJ VERB NOUN NOUN VERB VERB PRON ADJ ADJ NOUN ADJ PRON VERB CCONJ VERB PRON ADP DET NOUN ADV ADP ADJ NOUN PART VERB PRON ADP VERB PRON VERB VERB DET ADJ NOUN ADP DET NOUN PUNCT NOUN ADP ADJ NOUN	▁Not ▁that ▁it ▁had ▁done ▁Olive r ▁R att rie ▁any ▁good , ▁since ▁he ▁' d ▁been ▁caught ▁the ▁day ▁after ▁by ▁those ▁same ▁Chart ist ▁women ▁who ▁had ▁march ed ▁into ▁H ali fax ▁s ing ing ▁the ▁One ▁H und red th ▁P s al m ▁ ; ▁sheep ▁no ▁longer ▁but ▁how ling ▁Fur ies ▁who ▁had ▁seized ▁him , ▁pu ny ▁little ▁thing ▁that ▁he ▁was , ▁and ▁thrown ▁him ▁in ▁the ▁can al ▁where , ▁in ▁his ▁struggle ▁to ▁keep ▁himself ▁from ▁dr own ing , ▁he ▁had ▁lost ▁every ▁last ▁s hill ing ▁of ▁the ▁blood ▁- ▁money ▁in ▁his ▁pocket s .	0 0 0 0 0 0 0 0 0 0 0 0 0 0 0 0 0 0 0 0 0 0 0 0 0 0 0 0 0 0 0 0 0 0 0 0 0 0 0 0 0 0 0 0 0 0 0 0 0 0 0 0 0 0 0 0 0 0 0 0 0 0 0 0 0 0 0 0 0 0 0 0 0 0 0 0 0 0 0 0 0 0 0 0 0 0 0 0 0 0 0 0 0 0 0 1 1 0 0 0 0 0 0 0 0 0 0 0 0 0	ADV ADP PRON VERB VERB PROPN PROPN PROPN PROPN PROPN DET ADJ ADJ ADP PRON VERB VERB VERB VERB DET NOUN ADV ADP DET ADJ ADJ ADJ NOUN NOUN VERB VERB VERB ADP PROPN PROPN PROPN VERB VERB VERB DET NUM PROPN PROPN PROPN PROPN PROPN PROPN PROPN PROPN PUNCT PUNCT NOUN ADV ADV CCONJ VERB VERB NOUN NOUN NOUN VERB VERB PRON PRON ADJ ADJ ADJ NOUN ADJ PRON VERB VERB CCONJ VERB PRON ADP DET NOUN NOUN ADV ADV ADP ADJ NOUN PART VERB PRON ADP VERB VERB VERB VERB PRON VERB VERB DET ADJ NOUN NOUN NOUN ADP DET NOUN PUNCT NOUN ADP ADJ NOUN NOUN NOUN
David and wife Catherine had scraped together every last penny to ensure their sons, Stuart, Richard, baby Thomas and Mark,(from left in picture ) would have the happiest Christmas possible.	0 0 0 0 0 0 0 1 1 0 0 0 0 0 0 0 0 0 0 0 0 0 0 0 0 0 0 0 0 0	every last	figurative	identical	PROPN CCONJ NOUN PROPN VERB VERB ADV DET ADJ NOUN PART VERB ADJ NOUN PROPN PROPN NOUN PROPN CCONJ PROPN VERB ADP NOUN PUNCT VERB VERB DET ADJ PROPN ADJ	▁David ▁and ▁wife ▁Cathe rine ▁had ▁scrap ed ▁together ▁every ▁last ▁pen ny ▁to ▁ensure ▁their ▁sons , ▁S tu art , ▁Richard , ▁baby ▁Thomas ▁and ▁Mark , ( from ▁left ▁in ▁picture ▁ ) ▁would ▁have ▁the ▁hap pi est ▁Christmas ▁possible .	0 0 0 0 0 0 0 0 0 1 1 0 0 0 0 0 0 0 0 0 0 0 0 0 0 0 0 0 0 0 0 0 0 0 0 0 0 0 0 0 0 0 0 0 0	PROPN CCONJ NOUN PROPN PROPN VERB VERB VERB ADV DET ADJ NOUN NOUN PART VERB ADJ NOUN NOUN PROPN PROPN PROPN PROPN PROPN PROPN NOUN PROPN CCONJ PROPN PROPN PROPN PROPN VERB ADP NOUN PUNCT PUNCT VERB VERB DET ADJ ADJ ADJ PROPN ADJ ADJ
I 'll pay every last penny.’	0 0 0 1 1 0	every last	figurative	identical	PRON VERB VERB DET ADJ NOUN	▁I ▁' ll ▁pay ▁every ▁last ▁pen ny . ’	0 0 0 0 1 1 0 0 0 0	PRON VERB VERB VERB DET ADJ NOUN NOUN NOUN NOUN
Her touch was so persuasive he almost succumbed to the idea of entering her again, taking her anonymity as carte blanche and indulging in the darkness every last desire he could dredge up.	0 0 0 0 0 0 0 0 0 0 0 0 0 0 0 0 0 0 0 0 0 0 0 0 0 0 1 1 0 0 0 0 0	every last	figurative	identical	ADJ NOUN VERB ADV ADJ PRON ADV VERB ADP DET NOUN ADP VERB PRON ADV VERB ADJ NOUN ADP NOUN NOUN CCONJ VERB ADP DET NOUN DET ADJ NOUN PRON VERB VERB PART	▁Her ▁touch ▁was ▁so ▁per s ua sive ▁he ▁almost ▁suc cum bed ▁to ▁the ▁idea ▁of ▁entering ▁her ▁again , ▁taking ▁her ▁anonymity ▁as ▁car te ▁b lan che ▁and ▁in du lg ing ▁in ▁the ▁darkness ▁every ▁last ▁desire ▁he ▁could ▁dr edge ▁up .	0 0 0 0 0 0 0 0 0 0 0 0 0 0 0 0 0 0 0 0 0 0 0 0 0 0 0 0 0 0 0 0 0 0 0 0 0 0 1 1 0 0 0 0 0 0 0	ADJ NOUN VERB ADV ADJ ADJ ADJ ADJ PRON ADV VERB VERB VERB ADP DET NOUN ADP VERB PRON ADV ADV VERB ADJ NOUN ADP NOUN NOUN NOUN NOUN NOUN CCONJ VERB VERB VERB VERB ADP DET NOUN DET ADJ NOUN PRON VERB VERB VERB PART PART
Erasing every last trace of the Project.	0 1 1 0 0 0 0	every last	figurative	identical	VERB DET ADJ NOUN ADP DET PROPN	▁E ras ing ▁every ▁last ▁trace ▁of ▁the ▁Project .	0 0 0 1 1 0 0 0 0 0	VERB VERB VERB DET ADJ NOUN ADP DET PROPN PROPN
Deliberately ignoring him, she began to pick straw out of her clothes, and only when she was satisfied that she had removed every last one, and had taken in all there was to take in about her immediate surroundings, did she look up at him.	0 0 0 0 0 0 0 0 0 0 0 0 0 0 0 0 0 0 0 0 0 0 1 1 0 0 0 0 0 0 0 0 0 0 0 0 0 0 0 0 0 0 0 0 0	every last	literal	identical	ADV VERB PRON PRON VERB PART VERB NOUN ADP ADP ADJ NOUN CCONJ ADV ADV PRON VERB ADJ ADP PRON VERB VERB DET ADJ NOUN CCONJ VERB VERB ADP DET ADV VERB PART VERB PART ADP ADJ ADJ NOUN VERB PRON VERB PART ADP PRON	▁Del iber ate ly ▁ignor ing ▁him , ▁she ▁began ▁to ▁pick ▁straw ▁out ▁of ▁her ▁clothes , ▁and ▁only ▁when ▁she ▁was ▁satisfied ▁that ▁she ▁had ▁removed ▁every ▁last ▁one , ▁and ▁had ▁taken ▁in ▁all ▁there ▁was ▁to ▁take ▁in ▁about ▁her ▁immediate ▁surrounding s , ▁did ▁she ▁look ▁up ▁at ▁him .	0 0 0 0 0 0 0 0 0 0 0 0 0 0 0 0 0 0 0 0 0 0 0 0 0 0 0 0 1 1 0 0 0 0 0 0 0 0 0 0 0 0 0 0 0 0 0 0 0 0 0 0 0 0 0	ADV ADV ADV ADV VERB VERB PRON PRON PRON VERB PART VERB NOUN ADP ADP ADJ NOUN NOUN CCONJ ADV ADV PRON VERB ADJ ADP PRON VERB VERB DET ADJ NOUN NOUN CCONJ VERB VERB ADP DET ADV VERB PART VERB PART ADP ADJ ADJ NOUN NOUN NOUN VERB PRON VERB PART ADP PRON PRON
