Their fall from grace will be meteoric.	0 1 1 1 0 0 0	fall from grace	figurative	identical	ADJ NOUN ADP NOUN VERB VERB ADJ	▁The ir ▁fall ▁from ▁grace ▁will ▁be ▁met eo ric .	0 0 1 1 1 0 0 0 0 0 0	ADJ ADJ NOUN ADP NOUN VERB VERB ADJ ADJ ADJ ADJ
The fall from grace of Heritage Secretary Mr Mellor earned him joint second place with the BBC's ratings disaster Eldorado.	0 1 1 1 0 0 0 0 0 0 0 0 0 0 0 0 0 0 0 0	fall from grace	figurative	identical	DET NOUN ADP NOUN ADP PROPN PROPN PROPN PROPN VERB PRON ADJ ADJ NOUN ADP DET PROPN NOUN NOUN PROPN	▁The ▁fall ▁from ▁grace ▁of ▁Heritage ▁Secretary ▁Mr ▁Mel lor ▁earned ▁him ▁joint ▁second ▁place ▁with ▁the ▁B BC ' s ▁ratings ▁disaster ▁El d or ado .	0 1 1 1 0 0 0 0 0 0 0 0 0 0 0 0 0 0 0 0 0 0 0 0 0 0 0 0	DET NOUN ADP NOUN ADP PROPN PROPN PROPN PROPN PROPN VERB PRON ADJ ADJ NOUN ADP DET PROPN PROPN PROPN PROPN NOUN NOUN PROPN PROPN PROPN PROPN PROPN
And early presenter Chris Trace, who died at the weekend, fell from grace when, during his last year on the show in 1967, he had an affair with a pretty Norwegian teenager.	0 0 0 0 0 0 0 0 0 0 1 1 1 0 0 0 0 0 0 0 0 0 0 0 0 0 0 0 0 0 0 0	fall from grace	figurative	inflection	CCONJ ADJ NOUN PROPN PROPN NOUN VERB ADP DET NOUN VERB ADP NOUN ADV ADP ADJ ADJ NOUN ADP DET NOUN ADP NUM PRON VERB DET NOUN ADP DET ADV ADJ NOUN	▁And ▁early ▁present er ▁Chr is ▁ Trace , ▁who ▁died ▁at ▁the ▁weekend , ▁fell ▁from ▁grace ▁when , ▁during ▁his ▁last ▁year ▁on ▁the ▁show ▁in ▁1967 , ▁he ▁had ▁an ▁affair ▁with ▁a ▁pretty ▁Norwegian ▁tee na ger .	0 0 0 0 0 0 0 0 0 0 0 0 0 0 0 1 1 1 0 0 0 0 0 0 0 0 0 0 0 0 0 0 0 0 0 0 0 0 0 0 0 0	CCONJ ADJ NOUN NOUN PROPN PROPN PROPN PROPN PROPN NOUN VERB ADP DET NOUN NOUN VERB ADP NOUN ADV ADV ADP ADJ ADJ NOUN ADP DET NOUN ADP NUM NUM PRON VERB DET NOUN ADP DET ADV ADJ NOUN NOUN NOUN NOUN
Such arguments perhaps illustrate the extent of the fall from grace to positivist criminology in recent years.	0 0 0 0 0 0 0 0 1 1 1 0 0 0 0 0 0	fall from grace	figurative	identical	ADJ NOUN ADV VERB DET NOUN ADP DET NOUN ADP NOUN ADP NOUN NOUN ADP ADJ NOUN	▁Such ▁arguments ▁perhaps ▁illustrate ▁the ▁extent ▁of ▁the ▁fall ▁from ▁grace ▁to ▁posi ti vist ▁cri min ology ▁in ▁recent ▁years .	0 0 0 0 0 0 0 0 1 1 1 0 0 0 0 0 0 0 0 0 0 0	ADJ NOUN ADV VERB DET NOUN ADP DET NOUN ADP NOUN ADP NOUN NOUN NOUN NOUN NOUN NOUN ADP ADJ NOUN NOUN
The Society prospered, although at its 1852 annual public tea it could hardly hold a Christmas cheese and wine party members were saddened by the numbers that had fallen from grace once the hay and corn harvests had been collected.	0 0 0 0 0 0 0 0 0 0 0 0 0 0 0 0 0 0 0 0 0 0 0 0 0 0 0 0 1 1 1 0 0 0 0 0 0 0 0 0	fall from grace	figurative	inflection	DET PROPN VERB ADP ADP ADJ NUM ADJ ADJ NOUN PRON VERB ADV VERB DET PROPN NOUN CCONJ NOUN NOUN NOUN VERB VERB ADP DET NOUN ADJ VERB VERB ADP NOUN ADP DET NOUN CCONJ NOUN NOUN VERB VERB VERB	▁The ▁Society ▁prosper ed , ▁although ▁at ▁its ▁18 52 ▁annual ▁public ▁tea ▁it ▁could ▁hardly ▁hold ▁a ▁Christmas ▁cheese ▁and ▁wine ▁party ▁members ▁were ▁sad den ed ▁by ▁the ▁numbers ▁that ▁had ▁fallen ▁from ▁grace ▁once ▁the ▁hay ▁and ▁corn ▁harvest s ▁had ▁been ▁collected .	0 0 0 0 0 0 0 0 0 0 0 0 0 0 0 0 0 0 0 0 0 0 0 0 0 0 0 0 0 0 0 0 0 1 1 1 0 0 0 0 0 0 0 0 0 0 0	DET PROPN VERB VERB VERB ADP ADP ADJ NUM NUM ADJ ADJ NOUN PRON VERB ADV VERB DET PROPN NOUN CCONJ NOUN NOUN NOUN VERB VERB VERB VERB ADP DET NOUN ADJ VERB VERB ADP NOUN ADP DET NOUN CCONJ NOUN NOUN NOUN VERB VERB VERB VERB
Much of the presumption that surrounds Ratner's fall from grace is baseless.	0 0 0 0 0 0 0 1 1 1 0 0	fall from grace	figurative	identical	ADJ ADP DET NOUN ADJ VERB PROPN NOUN ADP NOUN VERB ADJ	▁Much ▁of ▁the ▁presumption ▁that ▁surround s ▁R at ner ' s ▁fall ▁from ▁grace ▁is ▁base less .	0 0 0 0 0 0 0 0 0 0 0 0 1 1 1 0 0 0 0	ADJ ADP DET NOUN ADJ VERB VERB PROPN PROPN PROPN PROPN PROPN NOUN ADP NOUN VERB ADJ ADJ ADJ
That Reagan managed to escape public disgrace was probably only because Americans found it very hard so soon after Nixon to see another president fall from grace, since the presidency is the last moral totem pole the nation possesses.	0 0 0 0 0 0 0 0 0 0 0 0 0 0 0 0 0 0 0 0 0 0 0 0 1 1 1 0 0 0 0 0 0 0 0 0 0 0 0	fall from grace	figurative	identical	DET PROPN VERB PART VERB ADJ NOUN VERB ADV ADV ADP PROPN VERB PRON ADV ADV ADV ADV ADP PROPN PART VERB DET NOUN VERB ADP NOUN ADP DET NOUN VERB DET ADJ ADJ NOUN NOUN DET NOUN VERB	▁That ▁Re agan ▁managed ▁to ▁escape ▁public ▁disgrace ▁was ▁probably ▁only ▁because ▁Americans ▁found ▁it ▁very ▁hard ▁so ▁soon ▁after ▁N ix on ▁to ▁see ▁another ▁president ▁fall ▁from ▁grace , ▁since ▁the ▁presidency ▁is ▁the ▁last ▁moral ▁to tem ▁pole ▁the ▁nation ▁possesses .	0 0 0 0 0 0 0 0 0 0 0 0 0 0 0 0 0 0 0 0 0 0 0 0 0 0 0 1 1 1 1 0 0 0 0 0 0 0 0 0 0 0 0 0 0	DET PROPN PROPN VERB PART VERB ADJ NOUN VERB ADV ADV ADP PROPN VERB PRON ADV ADV ADV ADV ADP PROPN PROPN PROPN PART VERB DET NOUN VERB ADP NOUN NOUN ADP DET NOUN VERB DET ADJ ADJ NOUN NOUN NOUN DET NOUN VERB VERB
And its spectacular fall from grace should serve as a warning.	0 0 0 1 1 1 0 0 0 0 0	fall from grace	figurative	identical	CCONJ ADJ ADJ NOUN ADP NOUN VERB VERB ADP DET NOUN	▁And ▁its ▁spectacular ▁fall ▁from ▁grace ▁should ▁serve ▁as ▁a ▁warning .	0 0 0 1 1 1 0 0 0 0 0 0	CCONJ ADJ ADJ NOUN ADP NOUN VERB VERB ADP DET NOUN NOUN
In this period the Awlad Amira secretary of the Kufra Assembly executive committee fell from grace and left office, becoming night watchman in a school.	0 0 0 0 0 0 0 0 0 0 0 0 0 1 1 1 0 0 0 0 0 0 0 0 0	fall from grace	figurative	inflection	ADP DET NOUN DET PROPN PROPN NOUN ADP DET PROPN PROPN ADJ NOUN VERB ADP NOUN CCONJ ADJ NOUN VERB NOUN NOUN ADP DET NOUN	▁In ▁this ▁period ▁the ▁A w lad ▁Am ira ▁secretary ▁of ▁the ▁Ku fra ▁Assembly ▁executive ▁committee ▁fell ▁from ▁grace ▁and ▁left ▁office , ▁becoming ▁night ▁watch man ▁in ▁a ▁school .	0 0 0 0 0 0 0 0 0 0 0 0 0 0 0 0 0 1 1 1 0 0 0 0 0 0 0 0 0 0 0 0	ADP DET NOUN DET PROPN PROPN PROPN PROPN PROPN NOUN ADP DET PROPN PROPN PROPN ADJ NOUN VERB ADP NOUN CCONJ ADJ NOUN NOUN VERB NOUN NOUN NOUN ADP DET NOUN NOUN
RICHARD Lines ' fall from grace is almost complete.	0 0 0 1 1 1 0 0 0	fall from grace	figurative	identical	PROPN PROPN PART NOUN ADP NOUN VERB ADV ADJ	▁ RIC H ARD ▁Lines ▁' ▁fall ▁from ▁grace ▁is ▁almost ▁complete .	0 0 0 0 0 0 1 1 1 0 0 0 0	PROPN PROPN PROPN PROPN PROPN PART NOUN ADP NOUN VERB ADV ADJ ADJ
But despite his subsequent Phoenix - like rise from the ashes of defeat, he reflected that his fall from grace had been mainly due to the persistent interference of the private detective Grant.	0 0 0 0 0 0 0 0 0 0 0 0 0 0 0 0 0 1 1 1 0 0 0 0 0 0 0 0 0 0 0 0 0	fall from grace	figurative	identical	CCONJ ADP ADJ ADJ PROPN PUNCT PROPN NOUN ADP DET NOUN ADP NOUN PRON VERB ADP ADJ NOUN ADP NOUN VERB VERB ADV ADJ ADP DET ADJ NOUN ADP DET ADJ NOUN PROPN	▁But ▁despite ▁his ▁subsequent ▁P ho en ix ▁- ▁like ▁rise ▁from ▁the ▁ash es ▁of ▁defeat , ▁he ▁reflected ▁that ▁his ▁fall ▁from ▁grace ▁had ▁been ▁mainly ▁due ▁to ▁the ▁persistent ▁interference ▁of ▁the ▁private ▁detect ive ▁Grant .	0 0 0 0 0 0 0 0 0 0 0 0 0 0 0 0 0 0 0 0 0 0 1 1 1 0 0 0 0 0 0 0 0 0 0 0 0 0 0 0	CCONJ ADP ADJ ADJ PROPN PROPN PROPN PROPN PUNCT PROPN NOUN ADP DET NOUN NOUN ADP NOUN NOUN PRON VERB ADP ADJ NOUN ADP NOUN VERB VERB ADV ADJ ADP DET ADJ NOUN ADP DET ADJ NOUN NOUN PROPN PROPN
FOR JOHN BRYAN THE FALL FROM GRACE WAS JUST ONE WEEK AWAY NO LONGER WOULD HE BE ONE OF THE ROYAL FAMILY 'S ANOINTED.	0 0 0 0 1 1 1 0 0 0 0 0 0 0 0 0 0 0 0 0 0 0 0 0	fall from grace	figurative	case	ADP PROPN VERB DET NOUN ADP PROPN VERB ADV NUM NOUN ADV ADV ADV VERB PRON VERB NUM ADP DET PROPN PROPN PART NOUN	▁FOR ▁JO HN ▁B RY AN ▁THE ▁F ALL ▁FROM ▁G RACE ▁WA S ▁ JUST ▁ONE ▁W EEK ▁A W AY ▁NO ▁LONG ER ▁W OU LD ▁HE ▁BE ▁ONE ▁OF ▁THE ▁RO Y AL ▁FAMILY ▁' S ▁A NO INT ED .	0 0 0 0 0 0 0 1 1 1 1 1 0 0 0 0 0 0 0 0 0 0 0 0 0 0 0 0 0 0 0 0 0 0 0 0 0 0 0 0 0 0 0 0	ADP PROPN PROPN VERB VERB VERB DET NOUN NOUN ADP PROPN PROPN VERB VERB ADV ADV NUM NOUN NOUN ADV ADV ADV ADV ADV ADV VERB VERB VERB PRON VERB NUM ADP DET PROPN PROPN PROPN PROPN PART PART NOUN NOUN NOUN NOUN NOUN
This time around, most of the crowd stayed for the full set yet the number of people gathered at The Arena told its own story of one band's fall from grace.	0 0 0 0 0 0 0 0 0 0 0 0 0 0 0 0 0 0 0 0 0 0 0 0 0 0 0 0 1 1 1	fall from grace	figurative	identical	DET NOUN ADV ADJ ADP DET NOUN VERB ADP DET ADJ NOUN ADV DET NOUN ADP NOUN VERB ADP DET PROPN VERB ADJ ADJ NOUN ADP NUM NOUN NOUN ADP NOUN	▁This ▁time ▁around , ▁most ▁of ▁the ▁crowd ▁stayed ▁for ▁the ▁full ▁set ▁yet ▁the ▁number ▁of ▁people ▁gathered ▁at ▁The ▁Are na ▁told ▁its ▁own ▁story ▁of ▁one ▁band ' s ▁fall ▁from ▁grace .	0 0 0 0 0 0 0 0 0 0 0 0 0 0 0 0 0 0 0 0 0 0 0 0 0 0 0 0 0 0 0 0 1 1 1 1	DET NOUN ADV ADV ADJ ADP DET NOUN VERB ADP DET ADJ NOUN ADV DET NOUN ADP NOUN VERB ADP DET PROPN PROPN VERB ADJ ADJ NOUN ADP NUM NOUN NOUN NOUN NOUN ADP NOUN NOUN
But if Mrs Longhill felt better that her servant had fallen from grace in distant Barnswick, then let her think it.	0 0 0 0 0 0 0 0 0 0 1 1 1 0 0 0 0 0 0 0 0	fall from grace	figurative	inflection	CCONJ ADP PROPN PROPN VERB ADV ADP ADJ NOUN VERB VERB ADP NOUN ADP ADJ PROPN ADV VERB PRON VERB PRON	▁But ▁if ▁Mrs ▁Long hill ▁felt ▁better ▁that ▁her ▁servant ▁had ▁fallen ▁from ▁grace ▁in ▁distant ▁Bar ns wick , ▁then ▁let ▁her ▁think ▁it .	0 0 0 0 0 0 0 0 0 0 0 1 1 1 0 0 0 0 0 0 0 0 0 0 0 0	CCONJ ADP PROPN PROPN PROPN VERB ADV ADP ADJ NOUN VERB VERB ADP NOUN ADP ADJ PROPN PROPN PROPN PROPN ADV VERB PRON VERB PRON PRON
The 1991 Cheltenham hero has fallen from grace this season, showing a poor attitude and worse form, most recently when tailed off last behind Mole Board at Sandown a fortnight ago.	0 0 0 0 0 1 1 1 0 0 0 0 0 0 0 0 0 0 0 0 0 0 0 0 0 0 0 0 0 0 0	fall from grace	figurative	inflection	DET NUM PROPN NOUN VERB VERB ADP NOUN DET NOUN VERB DET ADJ NOUN CCONJ ADJ NOUN ADV ADV ADV VERB PART ADJ ADP PROPN PROPN ADP PROPN DET NOUN ADV	▁The ▁1991 ▁Che l ten ham ▁her o ▁has ▁fallen ▁from ▁grace ▁this ▁season , ▁showing ▁a ▁poor ▁attitude ▁and ▁worse ▁form , ▁most ▁recently ▁when ▁ tailed ▁off ▁last ▁behind ▁Mole ▁Board ▁at ▁San down ▁a ▁fortnight ▁ago .	0 0 0 0 0 0 0 0 0 1 1 1 0 0 0 0 0 0 0 0 0 0 0 0 0 0 0 0 0 0 0 0 0 0 0 0 0 0 0 0	DET NUM PROPN PROPN PROPN PROPN NOUN NOUN VERB VERB ADP NOUN DET NOUN NOUN VERB DET ADJ NOUN CCONJ ADJ NOUN NOUN ADV ADV ADV VERB VERB PART ADJ ADP PROPN PROPN ADP PROPN PROPN DET NOUN ADV ADV
‘ The bourgeois world was haunted by sex’, Hobsbawm has written, ‘ but not necessarily sexual promiscuity ; the characteristic nemesis of the bourgeois folk myth … followed a single fall from grace’.	0 0 0 0 0 0 0 0 0 0 0 0 0 0 0 0 0 0 0 0 0 0 0 0 0 0 0 0 0 0 1 1 1	fall from grace	figurative	dashes	PUNCT DET ADJ NOUN VERB VERB ADP ADV PROPN VERB VERB PUNCT CCONJ ADV ADV ADJ NOUN PUNCT DET ADJ NOUN ADP DET ADJ NOUN NOUN PUNCT VERB DET ADJ NOUN ADP NOUN	▁ ‘ ▁The ▁ bourg eo is ▁world ▁was ▁ha unt ed ▁by ▁sex ’ , ▁Ho b s b aw m ▁has ▁written , ▁ ‘ ▁but ▁not ▁necessarily ▁sexual ▁pro mis cu ity ▁ ; ▁the ▁characteristic ▁ne mesis ▁of ▁the ▁ bourg eo is ▁fol k ▁my th ▁... ▁followed ▁a ▁single ▁fall ▁from ▁grace ’ .	0 0 0 0 0 0 0 0 0 0 0 0 0 0 0 0 0 0 0 0 0 0 0 0 0 0 0 0 0 0 0 0 0 0 0 0 0 0 0 0 0 0 0 0 0 0 0 0 0 0 0 0 0 0 0 1 1 1 1 1	PUNCT PUNCT DET ADJ ADJ ADJ ADJ NOUN VERB VERB VERB VERB ADP ADV ADV ADV PROPN PROPN PROPN PROPN PROPN PROPN VERB VERB VERB PUNCT PUNCT CCONJ ADV ADV ADJ NOUN NOUN NOUN NOUN PUNCT PUNCT DET ADJ NOUN NOUN ADP DET ADJ ADJ ADJ ADJ NOUN NOUN NOUN NOUN PUNCT VERB DET ADJ NOUN ADP NOUN NOUN NOUN
I began to feel that this was a euphemism for " fall from grace ".	0 0 0 0 0 0 0 0 0 0 0 1 1 1 0	fall from grace	figurative	identical	PRON VERB PART VERB ADP DET VERB DET NOUN ADP PUNCT NOUN ADP NOUN PUNCT	▁I ▁began ▁to ▁feel ▁that ▁this ▁was ▁a ▁eu phem ism ▁for ▁" ▁fall ▁from ▁grace ▁" .	0 0 0 0 0 0 0 0 0 0 0 0 0 1 1 1 0 0	PRON VERB PART VERB ADP DET VERB DET NOUN NOUN NOUN ADP PUNCT NOUN ADP NOUN PUNCT PUNCT
For Arsenal, on the other hand, it seemed to be the night which confirmed their fall from grace as the Premier League's early season favourites.	0 0 0 0 0 0 0 0 0 0 0 0 0 0 0 1 1 1 0 0 0 0 0 0 0	fall from grace	figurative	identical	ADP PROPN ADP DET ADJ NOUN PRON VERB PART VERB DET NOUN ADJ VERB ADJ NOUN ADP NOUN ADP DET PROPN PROPN ADJ NOUN NOUN	▁For ▁Ar sen al , ▁on ▁the ▁other ▁hand , ▁it ▁seemed ▁to ▁be ▁the ▁night ▁which ▁confirmed ▁their ▁fall ▁from ▁grace ▁as ▁the ▁Pre m ier ▁League ' s ▁early ▁season ▁favour ites .	0 0 0 0 0 0 0 0 0 0 0 0 0 0 0 0 0 0 0 1 1 1 0 0 0 0 0 0 0 0 0 0 0 0 0	ADP PROPN PROPN PROPN PROPN ADP DET ADJ NOUN NOUN PRON VERB PART VERB DET NOUN ADJ VERB ADJ NOUN ADP NOUN ADP DET PROPN PROPN PROPN PROPN PROPN PROPN ADJ NOUN NOUN NOUN NOUN
In the years since her acrimonious divorce from the Earl of Cassillis, the Countess, 32, has suffered a much - publicised fall from grace.	0 0 0 0 0 0 0 0 0 0 0 0 0 0 0 0 0 0 0 0 0 1 1 1	fall from grace	figurative	identical	ADP DET NOUN ADP ADJ ADJ NOUN ADP DET PROPN ADP PROPN DET PROPN NUM VERB VERB DET ADV PUNCT VERB NOUN ADP NOUN	▁In ▁the ▁years ▁since ▁her ▁a cri mon ious ▁divorce ▁from ▁the ▁Ear l ▁of ▁Cassi lli s , ▁the ▁Coun tes s , ▁32, ▁has ▁suffered ▁a ▁much ▁- ▁public ised ▁fall ▁from ▁grace .	0 0 0 0 0 0 0 0 0 0 0 0 0 0 0 0 0 0 0 0 0 0 0 0 0 0 0 0 0 0 0 0 1 1 1 1	ADP DET NOUN ADP ADJ ADJ ADJ ADJ ADJ NOUN ADP DET PROPN PROPN ADP PROPN PROPN PROPN PROPN DET PROPN PROPN PROPN PROPN NUM VERB VERB DET ADV PUNCT VERB VERB NOUN ADP NOUN NOUN
But he fell from grace for the first time in 1985 when he was convicted of drink - driving at Weymouth, Dorset.	0 0 1 1 1 0 0 0 0 0 0 0 0 0 0 0 0 0 0 0 0 0	fall from grace	figurative	inflection	CCONJ PRON VERB ADP NOUN ADP DET ADJ NOUN ADP NUM ADV PRON VERB VERB ADP NOUN PUNCT NOUN ADP PROPN PROPN	▁But ▁he ▁fell ▁from ▁grace ▁for ▁the ▁first ▁time ▁in ▁1985 ▁when ▁he ▁was ▁convicted ▁of ▁drink ▁- ▁driving ▁at ▁We y mouth , ▁D or set .	0 0 1 1 1 0 0 0 0 0 0 0 0 0 0 0 0 0 0 0 0 0 0 0 0 0 0 0	CCONJ PRON VERB ADP NOUN ADP DET ADJ NOUN ADP NUM ADV PRON VERB VERB ADP NOUN PUNCT NOUN ADP PROPN PROPN PROPN PROPN PROPN PROPN PROPN PROPN
Have we fallen from grace?	0 0 1 1 1	fall from grace	figurative	inflection	VERB PRON VERB ADP NOUN	▁Have ▁we ▁fallen ▁from ▁grace ?	0 0 1 1 1 1	VERB PRON VERB ADP NOUN NOUN
There is a dread of falling from grace.	0 0 0 0 0 1 1 1	fall from grace	figurative	inflection	ADV VERB DET NOUN ADP VERB ADP NOUN	▁There ▁is ▁a ▁d read ▁of ▁falling ▁from ▁grace .	0 0 0 0 0 0 1 1 1 1	ADV VERB DET NOUN NOUN ADP VERB ADP NOUN NOUN
It also proved to be a fall from grace, as it transpired that he 'd stolen millions of pounds from his workers ' pension funds, to pay off mounting business debts.	0 0 0 0 0 0 1 1 1 0 0 0 0 0 0 0 0 0 0 0 0 0 0 0 0 0 0 0 0 0 0	fall from grace	figurative	identical	PRON ADV VERB PART VERB DET NOUN ADP NOUN ADP PRON VERB ADP PRON VERB VERB NOUN ADP NOUN ADP ADJ NOUN PART NOUN NOUN PART VERB PART VERB NOUN NOUN	▁It ▁also ▁proved ▁to ▁be ▁a ▁fall ▁from ▁grace , ▁as ▁it ▁transpire d ▁that ▁he ▁' d ▁stolen ▁millions ▁of ▁pounds ▁from ▁his ▁workers ▁' ▁pension ▁funds , ▁to ▁pay ▁off ▁mounting ▁business ▁debts .	0 0 0 0 0 0 1 1 1 1 0 0 0 0 0 0 0 0 0 0 0 0 0 0 0 0 0 0 0 0 0 0 0 0 0 0	PRON ADV VERB PART VERB DET NOUN ADP NOUN NOUN ADP PRON VERB VERB ADP PRON VERB VERB VERB NOUN ADP NOUN ADP ADJ NOUN PART NOUN NOUN NOUN PART VERB PART VERB NOUN NOUN NOUN
He had an uncharacteristic fall from grace in his match against Connell.	0 0 0 0 1 1 1 0 0 0 0 0	fall from grace	figurative	identical	PRON VERB DET ADJ NOUN ADP NOUN ADP ADJ NOUN ADP PROPN	▁He ▁had ▁an ▁un character istic ▁fall ▁from ▁grace ▁in ▁his ▁match ▁against ▁Con n ell .	0 0 0 0 0 0 1 1 1 0 0 0 0 0 0 0 0	PRON VERB DET ADJ ADJ ADJ NOUN ADP NOUN ADP ADJ NOUN ADP PROPN PROPN PROPN PROPN
The competition was soon simplified with the fall from grace of William Craig.	0 0 0 0 0 0 0 1 1 1 0 0 0	fall from grace	figurative	identical	DET NOUN VERB ADV VERB ADP DET NOUN ADP NOUN ADP PROPN PROPN	▁The ▁competition ▁was ▁soon ▁simplified ▁with ▁the ▁fall ▁from ▁grace ▁of ▁William ▁C ra ig .	0 0 0 0 0 0 0 1 1 1 0 0 0 0 0 0	DET NOUN VERB ADV VERB ADP DET NOUN ADP NOUN ADP PROPN PROPN PROPN PROPN PROPN
As works or good deeds played absolutely no part in this process, the elect were assured that they could never fall from grace, and derived great comfort from this ‘ assurance’.	0 0 0 0 0 0 0 0 0 0 0 0 0 0 0 0 0 0 0 0 1 1 1 0 0 0 0 0 0 0 0	fall from grace	figurative	identical	ADP NOUN CCONJ ADJ NOUN VERB ADV DET NOUN ADP DET NOUN DET NOUN VERB VERB ADP PRON VERB ADV VERB ADP NOUN CCONJ VERB ADJ NOUN ADP DET PUNCT NOUN	▁As ▁works ▁or ▁good ▁deeds ▁played ▁absolutely ▁no ▁part ▁in ▁this ▁process , ▁the ▁elect ▁were ▁assured ▁that ▁they ▁could ▁never ▁fall ▁from ▁grace , ▁and ▁derived ▁great ▁comfort ▁from ▁this ▁ ‘ ▁assurance ’ .	0 0 0 0 0 0 0 0 0 0 0 0 0 0 0 0 0 0 0 0 0 1 1 1 1 0 0 0 0 0 0 0 0 0 0 0	ADP NOUN CCONJ ADJ NOUN VERB ADV DET NOUN ADP DET NOUN NOUN DET NOUN VERB VERB ADP PRON VERB ADV VERB ADP NOUN NOUN CCONJ VERB ADJ NOUN ADP DET PUNCT PUNCT NOUN NOUN NOUN
After all, England have another chance to fall from grace when they meet Germany on Saturday.	0 0 0 0 0 0 0 1 1 1 0 0 0 0 0 0	fall from grace	figurative	identical	ADV ADV PROPN VERB DET NOUN PART VERB ADP NOUN ADV PRON VERB PROPN ADP PROPN	▁After ▁all , ▁England ▁have ▁another ▁chance ▁to ▁fall ▁from ▁grace ▁when ▁they ▁meet ▁Germany ▁on ▁Saturday .	0 0 0 0 0 0 0 0 1 1 1 0 0 0 0 0 0 0	ADV ADV ADV PROPN VERB DET NOUN PART VERB ADP NOUN ADV PRON VERB PROPN ADP PROPN PROPN
And this in spite of the fact that two - thirds of the ‘ excellent’ companies analysed had fallen from grace by 1987, when Peters himself brazenly opened his third book, Thriving on Chaos, with the statement : ‘ There are no excellent companies’.	0 0 0 0 0 0 0 0 0 0 0 0 0 0 0 0 0 0 1 1 1 0 0 0 0 0 0 0 0 0 0 0 0 0 0 0 0 0 0 0 0 0 0 0	fall from grace	figurative	inflection	CCONJ DET ADP NOUN ADP DET NOUN ADP NUM PUNCT NOUN ADP DET ADJ NOUN NOUN VERB VERB VERB ADP NOUN ADP NUM ADV PROPN PRON ADV VERB ADJ ADJ NOUN VERB ADP PROPN ADP DET NOUN PUNCT PUNCT ADV VERB DET ADJ NOUN	▁And ▁this ▁in ▁spite ▁of ▁the ▁fact ▁that ▁two ▁- ▁third s ▁of ▁the ▁ ‘ ▁excellent ’ ▁companies ▁analysed ▁had ▁fallen ▁from ▁grace ▁by ▁1987, ▁when ▁Peter s ▁himself ▁ bra zen ly ▁opened ▁his ▁third ▁book , ▁Th ri ving ▁on ▁Cha os , ▁with ▁the ▁statement ▁ : ▁ ‘ ▁There ▁are ▁no ▁excellent ▁companies ’ .	0 0 0 0 0 0 0 0 0 0 0 0 0 0 0 0 0 0 0 0 0 1 1 1 0 0 0 0 0 0 0 0 0 0 0 0 0 0 0 0 0 0 0 0 0 0 0 0 0 0 0 0 0 0 0 0 0 0 0 0	CCONJ DET ADP NOUN ADP DET NOUN ADP NUM PUNCT NOUN NOUN ADP DET ADJ ADJ NOUN NOUN NOUN VERB VERB VERB ADP NOUN ADP NUM ADV PROPN PROPN PRON ADV ADV ADV ADV VERB ADJ ADJ NOUN NOUN VERB VERB VERB ADP PROPN PROPN PROPN ADP DET NOUN PUNCT PUNCT PUNCT PUNCT ADV VERB DET ADJ NOUN NOUN NOUN
There are various historical reference points made available to us, by which it is said we can chart Britain's fall from grace.	0 0 0 0 0 0 0 0 0 0 0 0 0 0 0 0 0 0 0 1 1 1	fall from grace	figurative	identical	ADV VERB ADJ ADJ NOUN NOUN VERB ADJ ADP PRON ADP ADJ PRON VERB VERB PRON VERB VERB PROPN NOUN ADP NOUN	▁There ▁are ▁various ▁historical ▁reference ▁points ▁made ▁available ▁to ▁us , ▁by ▁which ▁it ▁is ▁said ▁we ▁can ▁chart ▁Britain ' s ▁fall ▁from ▁grace .	0 0 0 0 0 0 0 0 0 0 0 0 0 0 0 0 0 0 0 0 0 0 1 1 1 1	ADV VERB ADJ ADJ NOUN NOUN VERB ADJ ADP PRON PRON ADP ADJ PRON VERB VERB PRON VERB VERB PROPN PROPN PROPN NOUN ADP NOUN NOUN
There is no connection between it and my son's fall from grace as I 'm sure you will understand.	0 0 0 0 0 0 0 0 0 1 1 1 0 0 0 0 0 0 0	fall from grace	figurative	identical	ADV VERB DET NOUN ADP PRON CCONJ ADJ NOUN NOUN ADP NOUN ADP PRON VERB ADJ PRON VERB VERB	▁There ▁is ▁no ▁connection ▁between ▁it ▁and ▁my ▁son ' s ▁fall ▁from ▁grace ▁as ▁I ▁' m ▁sure ▁you ▁will ▁understand .	0 0 0 0 0 0 0 0 0 0 0 1 1 1 0 0 0 0 0 0 0 0 0	ADV VERB DET NOUN ADP PRON CCONJ ADJ NOUN NOUN NOUN NOUN ADP NOUN ADP PRON VERB VERB ADJ PRON VERB VERB VERB
Her father was kindness itself, but he was the sort of man who gave little credit to anyone who had fallen from grace.	0 0 0 0 0 0 0 0 0 0 0 0 0 0 0 0 0 0 0 0 1 1 1	fall from grace	figurative	inflection	ADJ NOUN VERB NOUN PRON CCONJ PRON VERB DET NOUN ADP NOUN NOUN VERB ADJ NOUN ADP NOUN NOUN VERB VERB ADP NOUN	▁Her ▁father ▁was ▁kind ness ▁itself , ▁but ▁he ▁was ▁the ▁sort ▁of ▁man ▁who ▁gave ▁little ▁credit ▁to ▁anyone ▁who ▁had ▁fallen ▁from ▁grace .	0 0 0 0 0 0 0 0 0 0 0 0 0 0 0 0 0 0 0 0 0 0 1 1 1 1	ADJ NOUN VERB NOUN NOUN PRON PRON CCONJ PRON VERB DET NOUN ADP NOUN NOUN VERB ADJ NOUN ADP NOUN NOUN VERB VERB ADP NOUN NOUN
As she descended the stairs, she appreciated for the first time how far she had fallen from grace.	0 0 0 0 0 0 0 0 0 0 0 0 0 0 0 1 1 1	fall from grace	figurative	inflection	ADP PRON VERB DET NOUN PRON VERB ADP DET ADJ NOUN ADV ADV PRON VERB VERB ADP NOUN	▁As ▁she ▁de scend ed ▁the ▁sta ir s , ▁she ▁appreciated ▁for ▁the ▁first ▁time ▁how ▁far ▁she ▁had ▁fallen ▁from ▁grace .	0 0 0 0 0 0 0 0 0 0 0 0 0 0 0 0 0 0 0 0 1 1 1 1	ADP PRON VERB VERB VERB DET NOUN NOUN NOUN NOUN PRON VERB ADP DET ADJ NOUN ADV ADV PRON VERB VERB ADP NOUN NOUN
It did not sound that serious to Edward, given the circumstances of Neville Chamberlain's fall from grace.	0 0 0 0 0 0 0 0 0 0 0 0 0 0 1 1 1	fall from grace	figurative	identical	PRON VERB ADV VERB DET ADJ ADP PROPN VERB DET NOUN ADP PROPN PROPN NOUN ADP NOUN	▁It ▁did ▁not ▁sound ▁that ▁serious ▁to ▁Edward , ▁given ▁the ▁circumstances ▁of ▁Ne ville ▁Chamber lain ' s ▁fall ▁from ▁grace .	0 0 0 0 0 0 0 0 0 0 0 0 0 0 0 0 0 0 0 1 1 1 1	PRON VERB ADV VERB DET ADJ ADP PROPN PROPN VERB DET NOUN ADP PROPN PROPN PROPN PROPN PROPN PROPN NOUN ADP NOUN NOUN
Now, shut out of the heavyweight division since Tyson's fall from grace, mired in lawsuits and under investigation by several state boxing commissions, the taxman and the FBI, Don King has had to lay off staff and is struggling to keep his empire from crumbling.	0 0 0 0 0 0 0 0 0 1 1 1 0 0 0 0 0 0 0 0 0 0 0 0 0 0 0 0 0 0 0 0 0 0 0 0 0 0 0 0 0 0 0 0 0	fall from grace	figurative	identical	ADV VERB ADP ADP DET ADJ NOUN ADP PROPN NOUN ADP NOUN VERB ADP NOUN CCONJ ADP NOUN ADP ADJ NOUN NOUN NOUN DET NOUN CCONJ DET PROPN PROPN PROPN VERB VERB PART VERB PART NOUN CCONJ VERB VERB PART VERB ADJ NOUN ADP VERB	▁Now , ▁shut ▁out ▁of ▁the ▁heavy weight ▁division ▁since ▁Ty son ' s ▁fall ▁from ▁grace , ▁mi red ▁in ▁law suits ▁and ▁under ▁investigation ▁by ▁several ▁state ▁box ing ▁commissions , ▁the ▁tax man ▁and ▁the ▁F BI , ▁Don ▁King ▁has ▁had ▁to ▁lay ▁off ▁staff ▁and ▁is ▁struggling ▁to ▁keep ▁his ▁empire ▁from ▁cru m bling .	0 0 0 0 0 0 0 0 0 0 0 0 0 0 1 1 1 1 0 0 0 0 0 0 0 0 0 0 0 0 0 0 0 0 0 0 0 0 0 0 0 0 0 0 0 0 0 0 0 0 0 0 0 0 0 0 0 0 0 0 0	ADV ADV VERB ADP ADP DET ADJ ADJ NOUN ADP PROPN PROPN PROPN PROPN NOUN ADP NOUN NOUN VERB VERB ADP NOUN NOUN CCONJ ADP NOUN ADP ADJ NOUN NOUN NOUN NOUN NOUN DET NOUN NOUN CCONJ DET PROPN PROPN PROPN PROPN PROPN VERB VERB PART VERB PART NOUN CCONJ VERB VERB PART VERB ADJ NOUN ADP VERB VERB VERB VERB
CAMBRIDGE – India's recent fall from macroeconomic grace is a lamentable turn of events.	0 0 0 0 1 1 0 1 0 0 0 0 0 0	fall from grace	figurative	insertion-other	PROPN PUNCT PROPN ADJ NOUN ADP ADJ NOUN VERB DET ADJ NOUN ADP NOUN	▁CA MBR ID GE ▁ – ▁India ' s ▁recent ▁fall ▁from ▁macroeconomic ▁grace ▁is ▁a ▁lament able ▁turn ▁of ▁events .	0 0 0 0 0 0 0 0 0 0 1 1 0 1 0 0 0 0 0 0 0 0	PROPN PROPN PROPN PROPN PUNCT PUNCT PROPN PROPN PROPN ADJ NOUN ADP ADJ NOUN VERB DET ADJ ADJ NOUN ADP NOUN NOUN
