The Heartbreakers were to fall from grace with violent rapidity towards the end of 1977, only to re - emerge as cult heroes in 1984.	0 0 0 0 1 1 1 0 0 0 0 0 0 0 0 0 0 0 0 0 0 0 0 0 0	fall from grace	figurative	identical	DET PROPN VERB PART VERB ADP NOUN ADP ADJ NOUN ADP DET NOUN ADP NUM ADV PART VERB PUNCT VERB ADP NOUN NOUN ADP NUM	▁The ▁Heart break ers ▁were ▁to ▁fall ▁from ▁grace ▁with ▁violent ▁rapid ity ▁towards ▁the ▁end ▁of ▁1977, ▁only ▁to ▁re ▁- ▁emerge ▁as ▁cult ▁her oes ▁in ▁1984 .	0 0 0 0 0 0 1 1 1 0 0 0 0 0 0 0 0 0 0 0 0 0 0 0 0 0 0 0 0 0	DET PROPN PROPN PROPN VERB PART VERB ADP NOUN ADP ADJ NOUN NOUN ADP DET NOUN ADP NUM ADV PART VERB PUNCT VERB ADP NOUN NOUN NOUN ADP NUM NUM
A number of people associated with the excesses of the past have already fallen from grace.	0 0 0 0 0 0 0 0 0 0 0 0 0 1 1 1	fall from grace	figurative	inflection	DET NOUN ADP NOUN VERB ADP DET NOUN ADP DET NOUN VERB ADV VERB ADP NOUN	▁A ▁number ▁of ▁people ▁associated ▁with ▁the ▁excess es ▁of ▁the ▁past ▁have ▁already ▁fallen ▁from ▁grace .	0 0 0 0 0 0 0 0 0 0 0 0 0 0 1 1 1 1	DET NOUN ADP NOUN VERB ADP DET NOUN NOUN ADP DET NOUN VERB ADV VERB ADP NOUN NOUN
With the smallest fall from grace, it is quickly turned into badness.	0 0 0 1 1 1 0 0 0 0 0 0	fall from grace	figurative	identical	ADP DET ADJ NOUN ADP NOUN PRON VERB ADV VERB ADP NOUN	▁With ▁the ▁smallest ▁fall ▁from ▁grace , ▁it ▁is ▁quickly ▁turned ▁into ▁bad ness .	0 0 0 1 1 1 1 0 0 0 0 0 0 0 0	ADP DET ADJ NOUN ADP NOUN NOUN PRON VERB ADV VERB ADP NOUN NOUN NOUN
Coaches are popular in the US but this, by my theory, is the reason for their fall from grace as the world's greatest players.	0 0 0 0 0 0 0 0 0 0 0 0 0 0 0 0 1 1 1 0 0 0 0 0	fall from grace	figurative	identical	NOUN VERB ADJ ADP DET PROPN CCONJ DET ADP ADJ NOUN VERB DET NOUN ADP ADJ NOUN ADP NOUN ADP DET NOUN ADJ NOUN	▁Co ach es ▁are ▁popular ▁in ▁the ▁US ▁but ▁this , ▁by ▁my ▁theory , ▁is ▁the ▁reason ▁for ▁their ▁fall ▁from ▁grace ▁as ▁the ▁world ' s ▁greatest ▁players .	0 0 0 0 0 0 0 0 0 0 0 0 0 0 0 0 0 0 0 0 1 1 1 0 0 0 0 0 0 0 0	NOUN NOUN NOUN VERB ADJ ADP DET PROPN CCONJ DET DET ADP ADJ NOUN NOUN VERB DET NOUN ADP ADJ NOUN ADP NOUN ADP DET NOUN NOUN NOUN ADJ NOUN NOUN
The second was the swift and inexplicable fall from grace of Kiwi superstar Chris Dickson who, with only four wins out of nine round - robin races, failed to make the semi - finals at an international event for the first time since 1987.	0 0 0 0 0 0 0 1 1 1 0 0 0 0 0 0 0 0 0 0 0 0 0 0 0 0 0 0 0 0 0 0 0 0 0 0 0 0 0 0 0 0 0 0	fall from grace	figurative	identical	DET ADJ VERB DET ADJ CCONJ ADJ NOUN ADP NOUN ADP PROPN NOUN PROPN PROPN NOUN ADP ADV NUM NOUN ADP ADP NUM ADJ PUNCT NOUN NOUN VERB PART VERB DET NOUN PUNCT NOUN ADP DET ADJ NOUN ADP DET ADJ NOUN ADP NUM	▁The ▁second ▁was ▁the ▁swift ▁and ▁in ex plic able ▁fall ▁from ▁grace ▁of ▁Kiwi ▁super s tar ▁Chr is ▁D ick son ▁who , ▁with ▁only ▁four ▁win s ▁out ▁of ▁nine ▁round ▁- ▁ro bin ▁race s , ▁failed ▁to ▁make ▁the ▁semi ▁- ▁final s ▁at ▁an ▁international ▁event ▁for ▁the ▁first ▁time ▁since ▁1987 .	0 0 0 0 0 0 0 0 0 0 1 1 1 0 0 0 0 0 0 0 0 0 0 0 0 0 0 0 0 0 0 0 0 0 0 0 0 0 0 0 0 0 0 0 0 0 0 0 0 0 0 0 0 0 0 0 0 0 0	DET ADJ VERB DET ADJ CCONJ ADJ ADJ ADJ ADJ NOUN ADP NOUN ADP PROPN NOUN NOUN NOUN PROPN PROPN PROPN PROPN PROPN NOUN NOUN ADP ADV NUM NOUN NOUN ADP ADP NUM ADJ PUNCT NOUN NOUN NOUN NOUN NOUN VERB PART VERB DET NOUN PUNCT NOUN NOUN ADP DET ADJ NOUN ADP DET ADJ NOUN ADP NUM NUM
He knew that the Genesis account of man's fall from grace could be read as an indictment of a thirst for knowledge.	0 0 0 0 0 0 0 0 1 1 1 0 0 0 0 0 0 0 0 0 0 0	fall from grace	figurative	identical	PRON VERB ADP DET PROPN NOUN ADP NOUN NOUN ADP NOUN VERB VERB VERB ADP DET NOUN ADP DET NOUN ADP NOUN	▁He ▁knew ▁that ▁the ▁Gen e sis ▁account ▁of ▁man ' s ▁fall ▁from ▁grace ▁could ▁be ▁read ▁as ▁an ▁indictment ▁of ▁a ▁thirst ▁for ▁knowledge .	0 0 0 0 0 0 0 0 0 0 0 0 1 1 1 0 0 0 0 0 0 0 0 0 0 0 0	PRON VERB ADP DET PROPN PROPN PROPN NOUN ADP NOUN NOUN NOUN NOUN ADP NOUN VERB VERB VERB ADP DET NOUN ADP DET NOUN ADP NOUN NOUN
The turmoil caused by IBM Corp's fall from grace, Burton explained, has presented Legent with an ideal opportunity.	0 0 0 0 0 0 1 1 1 0 0 0 0 0 0 0 0 0	fall from grace	figurative	identical	DET NOUN VERB ADP PROPN PROPN NOUN ADP NOUN PROPN VERB VERB VERB PROPN ADP DET ADJ NOUN	▁The ▁turmoil ▁caused ▁by ▁IBM ▁Corp ' s ▁fall ▁from ▁grace , ▁Bur ton ▁explained , ▁has ▁presented ▁Le gen t ▁with ▁an ▁ideal ▁opportunity .	0 0 0 0 0 0 0 0 1 1 1 1 0 0 0 0 0 0 0 0 0 0 0 0 0 0	DET NOUN VERB ADP PROPN PROPN PROPN PROPN NOUN ADP NOUN NOUN PROPN PROPN VERB VERB VERB VERB PROPN PROPN PROPN ADP DET ADJ NOUN NOUN
Suddenly, something happened – not an event in itself ( though it started with Hollande's first great public rally in mid January ), but rather something that may resemble an irresistible process that can be summarized as follows : a majority of the French want to punish a president who has fallen from their graces.	0 0 0 0 0 0 0 0 0 0 0 0 0 0 0 0 0 0 0 0 0 0 0 0 0 0 0 0 0 0 0 0 0 0 0 0 0 0 0 0 0 0 0 0 0 0 0 0 0 0 0 1 1 0 1	fall from grace	figurative	combined-inflection	ADV NOUN VERB PUNCT ADV DET NOUN ADP PRON PUNCT ADP PRON VERB ADP PROPN ADJ ADJ ADJ NOUN ADP ADJ PROPN PUNCT CCONJ ADV NOUN ADJ VERB VERB DET ADJ NOUN ADJ VERB VERB VERB ADP VERB PUNCT DET NOUN ADP DET PROPN VERB PART VERB DET NOUN NOUN VERB VERB ADP ADJ NOUN	▁Sudden ly , ▁something ▁happened ▁ – ▁not ▁an ▁event ▁in ▁itself ▁( ▁though ▁it ▁started ▁with ▁Holland e ' s ▁first ▁great ▁public ▁r ally ▁in ▁mid ▁January ▁ ), ▁but ▁rather ▁something ▁that ▁may ▁resembl e ▁an ▁irre s ist ible ▁process ▁that ▁can ▁be ▁summarize d ▁as ▁follows ▁ : ▁a ▁majority ▁of ▁the ▁French ▁want ▁to ▁punish ▁a ▁president ▁who ▁has ▁fallen ▁from ▁their ▁grace s .	0 0 0 0 0 0 0 0 0 0 0 0 0 0 0 0 0 0 0 0 0 0 0 0 0 0 0 0 0 0 0 0 0 0 0 0 0 0 0 0 0 0 0 0 0 0 0 0 0 0 0 0 0 0 0 0 0 0 0 0 0 0 0 0 0 1 1 0 1 1 1	ADV ADV ADV NOUN VERB PUNCT PUNCT ADV DET NOUN ADP PRON PUNCT ADP PRON VERB ADP PROPN PROPN PROPN PROPN ADJ ADJ ADJ NOUN NOUN ADP ADJ PROPN PUNCT PUNCT CCONJ ADV NOUN ADJ VERB VERB VERB DET ADJ ADJ ADJ ADJ NOUN ADJ VERB VERB VERB VERB ADP VERB PUNCT PUNCT DET NOUN ADP DET PROPN VERB PART VERB DET NOUN NOUN VERB VERB ADP ADJ NOUN NOUN NOUN
DOWN'N OUT POOR Mark Hughes slips up as he tries a shot in Moscow — and soon he had fallen from grace completely.	0 0 0 0 0 0 0 0 0 0 0 0 0 0 0 0 0 0 0 1 1 1 0	fall from grace	figurative	inflection	ADJ ADV NOUN PROPN PROPN VERB PART ADP PRON VERB DET NOUN ADP PROPN PUNCT CCONJ ADV PRON VERB VERB ADP NOUN ADV	▁D OW N ' N ▁OUT ▁PO OR ▁Mark ▁Hugh es ▁slip s ▁up ▁as ▁he ▁tries ▁a ▁shot ▁in ▁Moscow ▁ — ▁and ▁soon ▁he ▁had ▁fallen ▁from ▁grace ▁completely .	0 0 0 0 0 0 0 0 0 0 0 0 0 0 0 0 0 0 0 0 0 0 0 0 0 0 0 1 1 1 0 0	ADJ ADJ ADJ ADJ ADJ ADV NOUN NOUN PROPN PROPN PROPN VERB VERB PART ADP PRON VERB DET NOUN ADP PROPN PUNCT PUNCT CCONJ ADV PRON VERB VERB ADP NOUN ADV ADV
An Anglo - Catholic priest helped me accept the desert experiences of prayer — no - one had ever told me, after an experience of personal renewal, to expect the stripping and refining that was not a falling from grace but a growth in it.	0 0 0 0 0 0 0 0 0 0 0 0 0 0 0 0 0 0 0 0 0 0 0 0 0 0 0 0 0 0 0 0 0 0 0 0 0 1 1 1 0 0 0 0 0	fall from grace	figurative	inflection	DET ADJ PUNCT ADJ NOUN VERB PRON VERB DET NOUN NOUN ADP NOUN PUNCT DET PUNCT NOUN VERB ADV VERB PRON ADP DET NOUN ADP ADJ NOUN PART VERB DET NOUN CCONJ NOUN ADJ VERB ADV DET VERB ADP NOUN CCONJ DET NOUN ADP PRON	▁An ▁Anglo ▁- ▁Catholic ▁priest ▁helped ▁me ▁accept ▁the ▁desert ▁experiences ▁of ▁prayer ▁ — ▁no ▁- ▁one ▁had ▁ever ▁told ▁me , ▁after ▁an ▁experience ▁of ▁personal ▁renewal , ▁to ▁expect ▁the ▁stripping ▁and ▁refining ▁that ▁was ▁not ▁a ▁falling ▁from ▁grace ▁but ▁a ▁growth ▁in ▁it .	0 0 0 0 0 0 0 0 0 0 0 0 0 0 0 0 0 0 0 0 0 0 0 0 0 0 0 0 0 0 0 0 0 0 0 0 0 0 0 0 1 1 1 0 0 0 0 0 0	DET ADJ PUNCT ADJ NOUN VERB PRON VERB DET NOUN NOUN ADP NOUN PUNCT PUNCT DET PUNCT NOUN VERB ADV VERB PRON PRON ADP DET NOUN ADP ADJ NOUN NOUN PART VERB DET NOUN CCONJ NOUN ADJ VERB ADV DET VERB ADP NOUN CCONJ DET NOUN ADP PRON PRON
In the past the fall from grace of the flat roof was due to series of problems : inappropriate combinations of waterproofing material, insulation and decking ; low durability waterproofing materials ; poor design and detailing ; and low quality installation.	0 0 0 0 1 1 1 0 0 0 0 0 0 0 0 0 0 0 0 0 0 0 0 0 0 0 0 0 0 0 0 0 0 0 0 0 0 0 0 0 0	fall from grace	figurative	identical	ADP DET NOUN DET NOUN ADP NOUN ADP DET ADJ NOUN VERB ADJ ADP NOUN ADP NOUN PUNCT ADJ NOUN ADP VERB NOUN NOUN CCONJ NOUN PUNCT ADJ NOUN VERB NOUN PUNCT ADJ NOUN CCONJ NOUN PUNCT CCONJ ADJ NOUN NOUN	▁In ▁the ▁past ▁the ▁fall ▁from ▁grace ▁of ▁the ▁flat ▁roof ▁was ▁due ▁to ▁series ▁of ▁problems ▁ : ▁inappropriate ▁combinations ▁of ▁water proof ing ▁material , ▁insulation ▁and ▁deck ing ▁ ; ▁low ▁durability ▁water proof ing ▁materials ▁ ; ▁poor ▁design ▁and ▁detail ing ▁ ; ▁and ▁low ▁quality ▁installation .	0 0 0 0 1 1 1 0 0 0 0 0 0 0 0 0 0 0 0 0 0 0 0 0 0 0 0 0 0 0 0 0 0 0 0 0 0 0 0 0 0 0 0 0 0 0 0 0 0 0 0 0 0	ADP DET NOUN DET NOUN ADP NOUN ADP DET ADJ NOUN VERB ADJ ADP NOUN ADP NOUN PUNCT PUNCT ADJ NOUN ADP VERB VERB VERB NOUN NOUN NOUN CCONJ NOUN NOUN PUNCT PUNCT ADJ NOUN VERB VERB VERB NOUN PUNCT PUNCT ADJ NOUN CCONJ NOUN NOUN PUNCT PUNCT CCONJ ADJ NOUN NOUN NOUN
Johnstone has confronted his fall from grace with the kind of honest self - awareness that is rare in habitual drinkers.	0 0 0 0 1 1 1 0 0 0 0 0 0 0 0 0 0 0 0 0 0	fall from grace	figurative	identical	PROPN VERB VERB ADJ NOUN ADP NOUN ADP DET NOUN ADP ADJ NOUN PUNCT NOUN ADJ VERB ADJ ADP ADJ NOUN	▁John stone ▁has ▁confronted ▁his ▁fall ▁from ▁grace ▁with ▁the ▁kind ▁of ▁honest ▁self ▁- ▁awareness ▁that ▁is ▁rare ▁in ▁habitual ▁drink ers .	0 0 0 0 0 1 1 1 0 0 0 0 0 0 0 0 0 0 0 0 0 0 0 0	PROPN PROPN VERB VERB ADJ NOUN ADP NOUN ADP DET NOUN ADP ADJ NOUN PUNCT NOUN ADJ VERB ADJ ADP ADJ NOUN NOUN NOUN
As Durgnat himself put it, to explain the film's fall from grace, ‘ Jimmy Porter came along’.	0 0 0 0 0 0 0 0 0 1 1 1 0 0 0 0 0	fall from grace	figurative	identical	ADP PROPN PRON VERB PRON PART VERB DET NOUN NOUN ADP NOUN PUNCT PROPN PROPN VERB PART	▁As ▁Dur gna t ▁himself ▁put ▁it , ▁to ▁explain ▁the ▁film ' s ▁fall ▁from ▁grace , ▁ ‘ ▁J im my ▁Port er ▁came ▁along ’ .	0 0 0 0 0 0 0 0 0 0 0 0 0 0 1 1 1 1 0 0 0 0 0 0 0 0 0 0 0	ADP PROPN PROPN PROPN PRON VERB PRON PRON PART VERB DET NOUN NOUN NOUN NOUN ADP NOUN NOUN PUNCT PUNCT PROPN PROPN PROPN PROPN PROPN VERB PART PART PART
‘ Man’ and ‘ mankind’are terms used interchangeably, supposedly to refer to the whole of humanity, as in ‘ Mankind has fallen from grace’or ‘ Man is the most intelligent of the animals’.	0 0 0 0 0 0 0 0 0 0 0 0 0 0 0 0 0 0 0 0 0 1 1 1 0 0 0 0 0 0 0 0 0	fall from grace	figurative	misc	PUNCT NOUN CCONJ NUM PROPN NOUN VERB ADV ADV PART VERB ADP DET NOUN ADP NOUN ADP ADP PUNCT NOUN VERB VERB ADP NOUN PUNCT NOUN VERB DET ADV ADJ ADP DET NOUN	▁ ‘ ▁Man ’ ▁and ▁ ‘ ▁mankind ’ are ▁terms ▁used ▁interchange ably , ▁supposed ly ▁to ▁refer ▁to ▁the ▁whole ▁of ▁humanity , ▁as ▁in ▁ ‘ ▁Man kind ▁has ▁fallen ▁from ▁grace ’ or ▁ ‘ ▁Man ▁is ▁the ▁most ▁intelligent ▁of ▁the ▁animals ’ .	0 0 0 0 0 0 0 0 0 0 0 0 0 0 0 0 0 0 0 0 0 0 0 0 0 0 0 0 0 0 0 0 1 1 1 1 1 0 0 0 0 0 0 0 0 0 0 0 0	PUNCT PUNCT NOUN NOUN CCONJ NUM NUM PROPN PROPN PROPN NOUN VERB ADV ADV ADV ADV ADV PART VERB ADP DET NOUN ADP NOUN NOUN ADP ADP PUNCT PUNCT NOUN NOUN VERB VERB ADP NOUN NOUN NOUN PUNCT PUNCT NOUN VERB DET ADV ADJ ADP DET NOUN NOUN NOUN
Fall from grace.	1 1 1	fall from grace	figurative	case	VERB ADP NOUN	▁F all ▁from ▁grace .	1 1 1 1 1	VERB VERB ADP NOUN NOUN
Willi had revealed that, since the night of Madge's fall from grace, she actually socialized with him, accepted the occasional invitation for coffee and, whilst not exactly chatting effusively about herself or her private life, indulged in fairly normal conversation with him.	0 0 0 0 0 0 0 0 0 1 1 1 0 0 0 0 0 0 0 0 0 0 0 0 0 0 0 0 0 0 0 0 0 0 0 0 0 0 0 0 0 0	fall from grace	figurative	identical	PROPN VERB VERB ADP ADP DET NOUN ADP PROPN NOUN ADP NOUN PRON ADV VERB ADP PRON VERB DET ADJ NOUN ADP NOUN CCONJ ADP ADV ADV VERB ADV ADP PRON CCONJ ADJ ADJ NOUN VERB ADP ADV ADJ NOUN ADP PRON	▁Will i ▁had ▁revealed ▁that , ▁since ▁the ▁night ▁of ▁Mad ge ' s ▁fall ▁from ▁grace , ▁she ▁actually ▁social ized ▁with ▁him , ▁accepted ▁the ▁occasional ▁invitation ▁for ▁coffee ▁and , ▁whilst ▁not ▁exactly ▁cha t ting ▁effusi ve ly ▁about ▁herself ▁or ▁her ▁private ▁life , ▁indulge d ▁in ▁fairly ▁normal ▁conversation ▁with ▁him .	0 0 0 0 0 0 0 0 0 0 0 0 0 0 1 1 1 1 0 0 0 0 0 0 0 0 0 0 0 0 0 0 0 0 0 0 0 0 0 0 0 0 0 0 0 0 0 0 0 0 0 0 0 0 0 0 0 0	PROPN PROPN VERB VERB ADP ADP ADP DET NOUN ADP PROPN PROPN PROPN PROPN NOUN ADP NOUN NOUN PRON ADV VERB VERB ADP PRON PRON VERB DET ADJ NOUN ADP NOUN CCONJ CCONJ ADP ADV ADV VERB VERB VERB ADV ADV ADV ADP PRON CCONJ ADJ ADJ NOUN NOUN VERB VERB ADP ADV ADJ NOUN ADP PRON PRON
Much of his hatred and contempt of Bella must have stemmed from her involvement in Johnny's fall from grace.	0 0 0 0 0 0 0 0 0 0 0 0 0 0 0 0 1 1 1	fall from grace	figurative	identical	ADJ ADP ADJ NOUN CCONJ NOUN ADP PROPN VERB VERB VERB ADP ADJ NOUN ADP PROPN NOUN ADP NOUN	▁Much ▁of ▁his ▁hatred ▁and ▁contempt ▁of ▁B ella ▁must ▁have ▁stemm ed ▁from ▁her ▁involvement ▁in ▁John ny ' s ▁fall ▁from ▁grace .	0 0 0 0 0 0 0 0 0 0 0 0 0 0 0 0 0 0 0 0 0 1 1 1 1	ADJ ADP ADJ NOUN CCONJ NOUN ADP PROPN PROPN VERB VERB VERB VERB ADP ADJ NOUN ADP PROPN PROPN PROPN PROPN NOUN ADP NOUN NOUN
Perhaps the most dramatic fall from grace was the case of Hu Yaobang.	0 0 0 0 1 1 1 0 0 0 0 0 0	fall from grace	figurative	identical	ADV DET ADV ADJ NOUN ADP NOUN VERB DET NOUN ADP PROPN PROPN	▁Perhaps ▁the ▁most ▁dramatic ▁fall ▁from ▁grace ▁was ▁the ▁case ▁of ▁Hu ▁Ya ob ang .	0 0 0 0 1 1 1 0 0 0 0 0 0 0 0 0	ADV DET ADV ADJ NOUN ADP NOUN VERB DET NOUN ADP PROPN PROPN PROPN PROPN PROPN
Daddy fell from grace, poor dear.	0 1 1 1 0 0	fall from grace	figurative	inflection	NOUN VERB ADP NOUN ADJ NOUN	▁D add y ▁fell ▁from ▁grace , ▁poor ▁dear .	0 0 0 1 1 1 1 0 0 0	NOUN NOUN NOUN VERB ADP NOUN NOUN ADJ NOUN NOUN
No sooner had Mr Sharif fallen from grace than Manzoor Watoo, speaker of the assembly and an ally of the president's, set about getting himself installed as chief minister.	0 0 0 0 0 1 1 1 0 0 0 0 0 0 0 0 0 0 0 0 0 0 0 0 0 0 0 0 0	fall from grace	figurative	inflection	ADV ADV VERB PROPN PROPN VERB ADP NOUN ADP PROPN PROPN NOUN ADP DET NOUN CCONJ DET NOUN ADP DET NOUN VERB ADP VERB PRON VERB ADP ADJ NOUN	▁No ▁sooner ▁had ▁Mr ▁Shar if ▁fallen ▁from ▁grace ▁than ▁Man zo or ▁W ato o , ▁speaker ▁of ▁the ▁assembly ▁and ▁an ▁ally ▁of ▁the ▁president ' s , ▁set ▁about ▁gett ing ▁himself ▁installed ▁as ▁chief ▁minister .	0 0 0 0 0 0 1 1 1 0 0 0 0 0 0 0 0 0 0 0 0 0 0 0 0 0 0 0 0 0 0 0 0 0 0 0 0 0 0 0	ADV ADV VERB PROPN PROPN PROPN VERB ADP NOUN ADP PROPN PROPN PROPN PROPN PROPN PROPN PROPN NOUN ADP DET NOUN CCONJ DET NOUN ADP DET NOUN NOUN NOUN NOUN VERB ADP VERB VERB PRON VERB ADP ADJ NOUN NOUN
Gillian Harris reports on the fall from grace of the Countess of Cassillis from aristocrat by marriage to prostitute and drug addict	0 0 0 0 0 1 1 1 0 0 0 0 0 0 0 0 0 0 0 0 0 0	fall from grace	figurative	identical	PROPN PROPN VERB ADP DET NOUN ADP NOUN ADP DET PROPN ADP PROPN ADP NOUN ADP NOUN PART VERB CCONJ NOUN NOUN	▁Gill ian ▁Harris ▁reports ▁on ▁the ▁fall ▁from ▁grace ▁of ▁the ▁Coun tes s ▁of ▁Cassi lli s ▁from ▁ arist oc rat ▁by ▁marriage ▁to ▁pro stitute ▁and ▁drug ▁addict	0 0 0 0 0 0 1 1 1 0 0 0 0 0 0 0 0 0 0 0 0 0 0 0 0 0 0 0 0 0 0	PROPN PROPN PROPN VERB ADP DET NOUN ADP NOUN ADP DET PROPN PROPN PROPN ADP PROPN PROPN PROPN ADP NOUN NOUN NOUN NOUN ADP NOUN PART VERB VERB CCONJ NOUN NOUN
Sue Shaw charts the apple's spectacular fall from grace.	0 0 0 0 0 0 1 1 1	fall from grace	figurative	identical	PROPN PROPN VERB DET NOUN ADJ NOUN ADP NOUN	▁Su e ▁Sha w ▁chart s ▁the ▁apple ' s ▁spectacular ▁fall ▁from ▁grace .	0 0 0 0 0 0 0 0 0 0 0 1 1 1 1	PROPN PROPN PROPN PROPN VERB VERB DET NOUN NOUN NOUN ADJ NOUN ADP NOUN NOUN
For some of these parents the injunction against such feelings is not too strong and they can accept their falls from grace with a certain amount of equanimity.	0 0 0 0 0 0 0 0 0 0 0 0 0 0 0 0 0 0 0 1 1 1 0 0 0 0 0 0	fall from grace	figurative	inflection	ADP DET ADP DET NOUN DET NOUN ADP ADJ NOUN VERB ADV ADV ADJ CCONJ PRON VERB VERB ADJ NOUN ADP NOUN ADP DET ADJ NOUN ADP NOUN	▁For ▁some ▁of ▁these ▁parents ▁the ▁injunction ▁against ▁such ▁feelings ▁is ▁not ▁too ▁strong ▁and ▁they ▁can ▁accept ▁their ▁falls ▁from ▁grace ▁with ▁a ▁certain ▁amount ▁of ▁ equ an im ity .	0 0 0 0 0 0 0 0 0 0 0 0 0 0 0 0 0 0 0 1 1 1 0 0 0 0 0 0 0 0 0 0 0	ADP DET ADP DET NOUN DET NOUN ADP ADJ NOUN VERB ADV ADV ADJ CCONJ PRON VERB VERB ADJ NOUN ADP NOUN ADP DET ADJ NOUN ADP NOUN NOUN NOUN NOUN NOUN NOUN
He was head of the Military Intelligence Service ( MIS ) until his fall from grace in 1983, when it was thought that Ne Win, Burma's autocratic ruler since 1962, perceived him as a threat to his leadership.	0 0 0 0 0 0 0 0 0 0 0 0 0 1 1 1 0 0 0 0 0 0 0 0 0 0 0 0 0 0 0 0 0 0 0 0 0 0	fall from grace	figurative	identical	PRON VERB NOUN ADP DET PROPN PROPN PROPN PUNCT PROPN PUNCT ADP ADJ NOUN ADP NOUN ADP NUM ADV PRON VERB VERB ADP PROPN PROPN PROPN ADJ NOUN ADP NUM VERB PRON ADP DET NOUN ADP ADJ NOUN	▁He ▁was ▁head ▁of ▁the ▁Military ▁Intelligence ▁Service ▁( ▁ MIS ▁ ) ▁until ▁his ▁fall ▁from ▁grace ▁in ▁1983, ▁when ▁it ▁was ▁thought ▁that ▁Ne ▁Win , ▁Burma ' s ▁auto cratic ▁rule r ▁since ▁1962 , ▁perceived ▁him ▁as ▁a ▁threat ▁to ▁his ▁leadership .	0 0 0 0 0 0 0 0 0 0 0 0 0 0 0 1 1 1 0 0 0 0 0 0 0 0 0 0 0 0 0 0 0 0 0 0 0 0 0 0 0 0 0 0 0 0 0	PRON VERB NOUN ADP DET PROPN PROPN PROPN PUNCT PROPN PROPN PUNCT PUNCT ADP ADJ NOUN ADP NOUN ADP NUM ADV PRON VERB VERB ADP PROPN PROPN PROPN PROPN PROPN PROPN ADJ ADJ NOUN NOUN ADP NUM NUM VERB PRON ADP DET NOUN ADP ADJ NOUN NOUN
Isabel fell from grace, which is nothing new in our circles, let me tell you.	0 1 1 1 0 0 0 0 0 0 0 0 0 0 0	fall from grace	figurative	inflection	PROPN VERB ADP NOUN ADJ VERB NOUN ADJ ADP ADJ NOUN VERB PRON VERB PRON	▁Is abel ▁fell ▁from ▁grace , ▁which ▁is ▁nothing ▁new ▁in ▁our ▁circles , ▁let ▁me ▁tell ▁you .	0 0 1 1 1 1 0 0 0 0 0 0 0 0 0 0 0 0 0	PROPN PROPN VERB ADP NOUN NOUN ADJ VERB NOUN ADJ ADP ADJ NOUN NOUN VERB PRON VERB PRON PRON
Even if they were, they had not necessarily fallen from grace.	0 0 0 0 0 0 0 0 1 1 1	fall from grace	figurative	inflection	ADV ADP PRON VERB PRON VERB ADV ADV VERB ADP NOUN	▁Even ▁if ▁they ▁were , ▁they ▁had ▁not ▁necessarily ▁fallen ▁from ▁grace .	0 0 0 0 0 0 0 0 0 1 1 1 1	ADV ADP PRON VERB VERB PRON VERB ADV ADV VERB ADP NOUN NOUN
McLeish smiled to himself at the swift fall from grace in the postscript.	0 0 0 0 0 0 0 1 1 1 0 0 0	fall from grace	figurative	identical	PROPN VERB ADP PRON ADP DET ADJ NOUN ADP NOUN ADP DET NOUN	▁Mc Le ish ▁smile d ▁to ▁himself ▁at ▁the ▁swift ▁fall ▁from ▁grace ▁in ▁the ▁post script .	0 0 0 0 0 0 0 0 0 0 1 1 1 0 0 0 0 0	PROPN PROPN PROPN VERB VERB ADP PRON ADP DET ADJ NOUN ADP NOUN ADP DET NOUN NOUN NOUN
Suddenly Hari thought of the man who had escaped from the prison, he was the same sort as Emily Grenfell, no doubt before he fell from grace they would have met and socialized.	0 0 0 0 0 0 0 0 0 0 0 0 0 0 0 0 0 0 0 0 0 0 0 0 1 1 1 0 0 0 0 0 0	fall from grace	figurative	inflection	ADV PROPN NOUN ADP DET NOUN NOUN VERB VERB ADP DET NOUN PRON VERB DET ADJ NOUN ADP PROPN PROPN ADV NOUN ADP PRON VERB ADP NOUN PRON VERB VERB VERB CCONJ VERB	▁Sudden ly ▁Har i ▁thought ▁of ▁the ▁man ▁who ▁had ▁escaped ▁from ▁the ▁prison , ▁he ▁was ▁the ▁same ▁sort ▁as ▁Em ily ▁G ren f ell , ▁no ▁doubt ▁before ▁he ▁fell ▁from ▁grace ▁they ▁would ▁have ▁met ▁and ▁social ized .	0 0 0 0 0 0 0 0 0 0 0 0 0 0 0 0 0 0 0 0 0 0 0 0 0 0 0 0 0 0 0 0 1 1 1 0 0 0 0 0 0 0 0	ADV ADV PROPN PROPN NOUN ADP DET NOUN NOUN VERB VERB ADP DET NOUN NOUN PRON VERB DET ADJ NOUN ADP PROPN PROPN PROPN PROPN PROPN PROPN PROPN ADV NOUN ADP PRON VERB ADP NOUN PRON VERB VERB VERB CCONJ VERB VERB VERB
There is no watershed, or ‘ fall from grace’.	0 0 0 0 0 0 1 1 1	fall from grace	figurative	dashes	ADV VERB DET NOUN CCONJ NUM NOUN ADP NOUN	▁There ▁is ▁no ▁water shed , ▁or ▁ ‘ ▁fall ▁from ▁grace ’ .	0 0 0 0 0 0 0 0 0 1 1 1 1 1	ADV VERB DET NOUN NOUN NOUN CCONJ NUM NUM NOUN ADP NOUN NOUN NOUN
