' It's going to fit you like a glove.	0 0 0 0 1 0 1 0 1	fit like a glove	figurative	insertion-other	PUNCT PRON VERB PART VERB PRON ADP DET NOUN	▁' ▁It ' s ▁going ▁to ▁fit ▁you ▁like ▁a ▁g lov e .	0 0 0 0 0 0 1 0 1 0 1 1 1 1	PUNCT PRON PRON PRON VERB PART VERB PRON ADP DET NOUN NOUN NOUN NOUN
In performing calculations we know exactly what to do and the answers fit nature like a glove.	0 0 0 0 0 0 0 0 0 0 0 0 1 0 1 0 1	fit like a glove	figurative	insertion-other	ADP VERB NOUN PRON VERB ADV NOUN PART VERB CCONJ DET NOUN VERB NOUN ADP DET NOUN	▁In ▁performing ▁calculations ▁we ▁know ▁exactly ▁what ▁to ▁do ▁and ▁the ▁answers ▁fit ▁nature ▁like ▁a ▁g lov e .	0 0 0 0 0 0 0 0 0 0 0 0 1 0 1 0 1 1 1 1	ADP VERB NOUN PRON VERB ADV NOUN PART VERB CCONJ DET NOUN VERB NOUN ADP DET NOUN NOUN NOUN NOUN
And just Love Hurts just seemed to fit, just right like a glove, I wanted to do it.	0 0 0 0 0 0 0 1 0 0 1 0 1 0 0 0 0 0	fit like a glove	figurative	combined-other	CCONJ ADV VERB PROPN ADV VERB PART VERB ADV ADV INTJ DET NOUN PRON VERB PART VERB PRON	▁And ▁just ▁Lo ve ▁Hurt s ▁just ▁seemed ▁to ▁fit , ▁just ▁right ▁like ▁a ▁g lov e , ▁I ▁wanted ▁to ▁do ▁it .	0 0 0 0 0 0 0 0 0 1 1 0 0 1 0 1 1 1 1 0 0 0 0 0 0	CCONJ ADV VERB VERB PROPN PROPN ADV VERB PART VERB VERB ADV ADV INTJ DET NOUN NOUN NOUN NOUN PRON VERB PART VERB PRON PRON
And for a succinct description of that social nexus that fits the Zande like a glove we can go, for a change, to sixteenth - century Essex.	0 0 0 0 0 0 0 0 0 0 1 0 0 1 0 1 0 0 0 0 0 0 0 0 0 0 0	fit like a glove	figurative	misc	CCONJ ADP DET ADJ NOUN ADP DET ADJ NOUN ADJ VERB DET PROPN ADP DET NOUN PRON VERB VERB ADP DET NOUN ADP ADJ PUNCT NOUN PROPN	▁And ▁for ▁a ▁suc cin ct ▁description ▁of ▁that ▁social ▁n ex us ▁that ▁fits ▁the ▁Z and e ▁like ▁a ▁g lov e ▁we ▁can ▁go , ▁for ▁a ▁change , ▁to ▁sixteen th ▁- ▁century ▁E s s ex .	0 0 0 0 0 0 0 0 0 0 0 0 0 0 1 0 0 0 0 1 0 1 1 1 0 0 0 0 0 0 0 0 0 0 0 0 0 0 0 0 0 0	CCONJ ADP DET ADJ ADJ ADJ NOUN ADP DET ADJ NOUN NOUN NOUN ADJ VERB DET PROPN PROPN PROPN ADP DET NOUN NOUN NOUN PRON VERB VERB VERB ADP DET NOUN NOUN ADP ADJ ADJ PUNCT NOUN PROPN PROPN PROPN PROPN PROPN
Your heart fits me like a glove.	0 0 1 0 1 0 1	fit like a glove	figurative	misc	ADJ NOUN VERB PRON ADP DET NOUN	▁Your ▁heart ▁fits ▁me ▁like ▁a ▁g lov e .	0 0 1 0 1 0 1 1 1 1	ADJ NOUN VERB PRON ADP DET NOUN NOUN NOUN NOUN
Your heart fits me, like a glove so we 're gon na true blue baby I love you!	0 0 1 0 1 0 1 0 0 0 0 0 0 0 0 0 0 0	fit like a glove	figurative	misc	ADJ NOUN VERB PRON ADP DET NOUN ADP PRON VERB VERB ADP ADJ ADJ NOUN PRON VERB PRON	▁Your ▁heart ▁fits ▁me , ▁like ▁a ▁g lov e ▁so ▁we ▁' re ▁ gon ▁na ▁true ▁blue ▁baby ▁I ▁love ▁you !	0 0 1 0 0 1 0 1 1 1 0 0 0 0 0 0 0 0 0 0 0 0 0 0	ADJ NOUN VERB PRON PRON ADP DET NOUN NOUN NOUN ADP PRON VERB VERB VERB VERB ADP ADJ ADJ NOUN PRON VERB PRON PRON
I love beautiful lines, clothes that fit the body, and swing with the body, move, you know, but fit like a glove.	0 0 0 0 0 0 0 0 0 0 0 0 0 0 0 0 0 0 1 1 0 1	fit like a glove	figurative	identical	PRON VERB ADJ NOUN NOUN ADJ VERB DET NOUN CCONJ VERB ADP DET NOUN VERB PRON VERB CCONJ VERB ADP DET NOUN	▁I ▁love ▁beautiful ▁lines , ▁clothes ▁that ▁fit ▁the ▁body , ▁and ▁sw ing ▁with ▁the ▁body , ▁move , ▁you ▁know , ▁but ▁fit ▁like ▁a ▁g lov e .	0 0 0 0 0 0 0 0 0 0 0 0 0 0 0 0 0 0 0 0 0 0 0 0 1 1 0 1 1 1 1	PRON VERB ADJ NOUN NOUN NOUN ADJ VERB DET NOUN NOUN CCONJ VERB VERB ADP DET NOUN NOUN VERB VERB PRON VERB VERB CCONJ VERB ADP DET NOUN NOUN NOUN NOUN
True love you 're the one I 'm, dreaming of you 're heart fits me, like a glove, and I 'm gon na be true blue, baby I love you!	0 0 0 0 0 0 0 0 0 0 0 0 0 1 0 1 0 1 0 0 0 0 0 0 0 0 0 0 0 0	fit like a glove	figurative	misc	ADJ NOUN PRON VERB DET NOUN PRON NOUN VERB ADP PRON VERB NOUN VERB PRON ADP DET NOUN CCONJ PRON VERB VERB PART VERB ADJ ADJ NOUN PRON VERB PRON	▁True ▁love ▁you ▁' re ▁the ▁one ▁I ▁' m , ▁dream ing ▁of ▁you ▁' re ▁heart ▁fits ▁me , ▁like ▁a ▁g lov e , ▁and ▁I ▁' m ▁ gon ▁na ▁be ▁true ▁blue , ▁baby ▁I ▁love ▁you !	0 0 0 0 0 0 0 0 0 0 0 0 0 0 0 0 0 0 1 0 0 1 0 1 1 1 1 0 0 0 0 0 0 0 0 0 0 0 0 0 0 0 0	ADJ NOUN PRON VERB VERB DET NOUN PRON NOUN NOUN NOUN VERB VERB ADP PRON VERB VERB NOUN VERB PRON PRON ADP DET NOUN NOUN NOUN NOUN CCONJ PRON VERB VERB VERB VERB PART VERB ADJ ADJ ADJ NOUN PRON VERB PRON PRON
