I said if the transport get that load of L T M thrown back Robin is gon na get it right in the neck!	0 0 0 0 0 0 0 0 0 0 0 0 0 0 0 0 0 0 1 1 0 1 0 1	get it in the neck	figurative	insertion-other	PRON VERB ADP DET NOUN VERB DET NOUN ADP PROPN PROPN PROPN VERB PART PROPN VERB VERB PART VERB PRON ADJ ADP DET NOUN
Merymose might get it in the neck from Kenamun, but if this madman was to be nailed quickly, the odd official would have to sacrifice his dignity.	0 0 1 1 1 0 1 0 0 0 0 0 0 0 0 0 0 0 0 0 0 0 0 0 0 0 0	get it in the neck	figurative	identical	PROPN VERB VERB PRON ADP DET NOUN ADP PROPN CCONJ ADP DET NOUN VERB PART VERB VERB ADV DET ADJ NOUN VERB VERB PART VERB ADJ NOUN
James Bond gets it in the neck from Korean goon Oddjob	0 0 1 1 1 0 1 0 0 0 0	get it in the neck	figurative	inflection	PROPN PROPN VERB PRON ADP DET NOUN ADP ADJ NOUN NOUN
That's right, and it's no coincidence because people in the east of London on the whole get it in the neck whatever happens, and particularly with this government.	0 0 0 0 0 0 0 0 0 0 0 0 0 0 0 0 1 1 1 0 1 0 0 0 0 0 0 0	get it in the neck	figurative	identical	DET ADJ CCONJ PRON DET NOUN ADP NOUN ADP DET NOUN ADP PROPN ADP DET NOUN VERB PRON ADP DET NOUN ADJ VERB CCONJ ADV ADP DET NOUN
And if Robin gets it in the neck I shall get it in the neck and I shall be getting it in the neck because of you!	0 0 0 0 0 0 0 0 0 0 1 1 1 0 1 0 0 0 0 0 0 0 0 0 0 0 0	get it in the neck	figurative	identical	CCONJ ADP PROPN VERB PRON ADP DET NOUN PRON VERB VERB PRON ADP DET NOUN CCONJ PRON VERB VERB VERB PRON ADP DET NOUN ADP ADP PRON
Yet when I take a taxi back to the club, the driver tells me that the Indians will be getting it in the neck soon.	0 0 0 0 0 0 0 0 0 0 0 0 0 0 0 0 0 0 0 1 1 1 0 1 0	get it in the neck	figurative	inflection	CCONJ ADV PRON VERB DET NOUN ADV ADP DET NOUN DET NOUN VERB PRON ADP DET PROPN VERB VERB VERB PRON ADP DET NOUN ADV
I don't give a damn about Ivan's ridiculous rag, said Charles, but of course he did, he cared much more than she did, and with reason, for Ivan usually managed to deliver her some backhanded compliment, whereas Charles always got it in the neck : ‘ HEADLEAND CRASHES HEADLONG’ had been the headline of Ivan's latest piece of gossip, which had consisted of a dangerous account of Charles's behaviour at a meeting of a board of directors, laced with unfounded but inventive innuendo about a country house which he and Liz were said to be purchasing as a tax dodge.	0 0 0 0 0 0 0 0 0 0 0 0 0 0 0 0 0 0 0 0 0 0 0 0 0 0 0 0 0 0 0 0 0 0 0 0 0 0 0 1 1 1 0 1 0 0 0 0 0 0 0 0 0 0 0 0 0 0 0 0 0 0 0 0 0 0 0 0 0 0 0 0 0 0 0 0 0 0 0 0 0 0 0 0 0 0 0 0 0 0 0 0 0 0 0 0 0 0 0 0	get it in the neck	figurative	inflection	PRON VERB VERB DET NOUN ADP PROPN ADJ NOUN VERB PROPN CCONJ ADP NOUN PRON VERB PRON VERB ADV ADJ ADP PRON VERB CCONJ ADP NOUN ADP PROPN ADV VERB PART VERB PRON DET VERB NOUN ADP PROPN ADV VERB PRON ADP DET NOUN PUNCT PUNCT PROPN NOUN NOUN VERB VERB DET NOUN ADP PROPN ADJ NOUN ADP NOUN ADJ VERB VERB ADP DET ADJ NOUN ADP PROPN NOUN ADP DET NOUN ADP DET NOUN ADP NOUN VERB ADP ADJ CCONJ ADJ NOUN ADP DET NOUN NOUN ADJ PRON CCONJ PROPN VERB VERB PART VERB VERB ADP DET NOUN NOUN