Several times, Bernice thought she was getting the better of him, only to realise that he was toying with her expectations and reactions.	0 0 0 0 0 0 1 0 1 1 0 0 0 0 0 0 0 0 0 0 0 0 0	get the better of	figurative	inflection	ADJ NOUN PROPN VERB PRON VERB VERB DET ADJ ADP PRON ADV PART VERB ADP PRON VERB VERB ADP ADJ NOUN CCONJ NOUN	▁S everal ▁times , ▁Bern ice ▁thought ▁she ▁was ▁gett ing ▁the ▁better ▁of ▁him , ▁only ▁to ▁realise ▁that ▁he ▁was ▁to ying ▁with ▁her ▁expectations ▁and ▁reactions .	0 0 0 0 0 0 0 0 0 1 1 0 1 1 0 0 0 0 0 0 0 0 0 0 0 0 0 0 0 0	ADJ ADJ NOUN NOUN PROPN PROPN VERB PRON VERB VERB VERB DET ADJ ADP PRON PRON ADV PART VERB ADP PRON VERB VERB VERB ADP ADJ NOUN CCONJ NOUN NOUN
But pure animalistic lust gets the better of me.	0 0 0 0 1 0 1 1 0	get the better of	figurative	inflection	CCONJ ADJ ADJ NOUN VERB DET ADJ ADP PRON	▁But ▁pure ▁animal istic ▁lust ▁get s ▁the ▁better ▁of ▁me .	0 0 0 0 0 1 1 0 1 1 0 0	CCONJ ADJ ADJ ADJ NOUN VERB VERB DET ADJ ADP PRON PRON
Their likely opponents in the second round are Charterhouse, if they get the better of Highgate today, writes Ted Barrett.	0 0 0 0 0 0 0 0 0 0 0 1 0 1 1 0 0 0 0 0	get the better of	figurative	identical	ADJ ADJ NOUN ADP DET ADJ NOUN VERB PROPN ADP PRON VERB DET ADJ ADP PROPN NOUN VERB PROPN PROPN	▁The ir ▁likely ▁opponents ▁in ▁the ▁second ▁round ▁are ▁Charter house , ▁if ▁they ▁get ▁the ▁better ▁of ▁High gate ▁today , ▁write s ▁T ed ▁Barre tt .	0 0 0 0 0 0 0 0 0 0 0 0 0 0 1 0 1 1 0 0 0 0 0 0 0 0 0 0 0	ADJ ADJ ADJ NOUN ADP DET ADJ NOUN VERB PROPN PROPN PROPN ADP PRON VERB DET ADJ ADP PROPN PROPN NOUN NOUN VERB VERB PROPN PROPN PROPN PROPN PROPN
You couldn't beard the lion in his den if you let your fears get the best of you.	0 0 0 0 0 0 0 0 0 0 0 0 0 1 0 1 1 0	get the better of	figurative	misc	PRON VERB VERB DET NOUN ADP ADJ NOUN ADP PRON VERB ADJ NOUN VERB DET ADJ ADP PRON	▁You ▁could n ' t ▁be ard ▁the ▁lion ▁in ▁his ▁den ▁if ▁you ▁let ▁your ▁fears ▁get ▁the ▁best ▁of ▁you .	0 0 0 0 0 0 0 0 0 0 0 0 0 0 0 0 0 1 0 1 1 0 0	PRON VERB VERB VERB VERB VERB VERB DET NOUN ADP ADJ NOUN ADP PRON VERB ADJ NOUN VERB DET ADJ ADP PRON PRON
When Speelman seemed to be getting the better of it, Timman suddenly sacrificed two pieces to expose his opponent's king.	0 0 0 0 0 1 0 1 1 0 0 0 0 0 0 0 0 0 0 0	get the better of	figurative	inflection	ADV PROPN VERB PART VERB VERB DET ADJ ADP PRON PROPN ADV VERB NUM NOUN PART VERB ADJ NOUN NOUN	▁When ▁Sp eel man ▁seemed ▁to ▁be ▁gett ing ▁the ▁better ▁of ▁it , ▁T im man ▁suddenly ▁sacrificed ▁two ▁pieces ▁to ▁expose ▁his ▁opp on ent ' s ▁king .	0 0 0 0 0 0 0 1 1 0 1 1 0 0 0 0 0 0 0 0 0 0 0 0 0 0 0 0 0 0 0	ADV PROPN PROPN PROPN VERB PART VERB VERB VERB DET ADJ ADP PRON PRON PROPN PROPN PROPN ADV VERB NUM NOUN PART VERB ADJ NOUN NOUN NOUN NOUN NOUN NOUN NOUN
Over her supine body Andrew and Horatia's eyes met and she took the initiative, knowing she had to get the better of the marquis straight away.	0 0 0 0 0 0 0 0 0 0 0 0 0 0 0 0 0 0 1 0 1 1 0 0 0 0	get the better of	figurative	identical	ADP ADJ NOUN NOUN PROPN CCONJ PROPN NOUN VERB CCONJ PRON VERB DET NOUN VERB PRON VERB PART VERB DET ADJ ADP DET NOUN ADV ADV	▁Over ▁her ▁sup ine ▁body ▁Andrew ▁and ▁Ho rat ia ' s ▁eyes ▁met ▁and ▁she ▁took ▁the ▁initiative , ▁knowing ▁she ▁had ▁to ▁get ▁the ▁better ▁of ▁the ▁mar qui s ▁straight ▁away .	0 0 0 0 0 0 0 0 0 0 0 0 0 0 0 0 0 0 0 0 0 0 0 0 1 0 1 1 0 0 0 0 0 0 0	ADP ADJ NOUN NOUN NOUN PROPN CCONJ PROPN PROPN PROPN PROPN PROPN NOUN VERB CCONJ PRON VERB DET NOUN NOUN VERB PRON VERB PART VERB DET ADJ ADP DET NOUN NOUN NOUN ADV ADV ADV
‘ I 'm sure he 'll get in touch with you as soon as he can,’ said Melissa, trying not to allow her irritation to get the better of her.	0 0 0 0 0 0 0 0 0 0 0 0 0 0 0 0 0 0 0 0 0 0 0 0 0 1 0 1 1 0	get the better of	figurative	identical	PUNCT PRON VERB ADJ PRON VERB VERB ADP NOUN ADP PRON ADV ADV ADP PRON VERB VERB PROPN VERB ADV PART VERB ADJ NOUN PART VERB DET ADJ ADP PRON	▁ ‘ ▁I ▁' m ▁sure ▁he ▁' ll ▁get ▁in ▁touch ▁with ▁you ▁as ▁soon ▁as ▁he ▁can , ’ ▁said ▁Mel issa , ▁trying ▁not ▁to ▁allow ▁her ▁irritation ▁to ▁get ▁the ▁better ▁of ▁her .	0 0 0 0 0 0 0 0 0 0 0 0 0 0 0 0 0 0 0 0 0 0 0 0 0 0 0 0 0 0 0 0 1 0 1 1 0 0	PUNCT PUNCT PRON VERB VERB ADJ PRON VERB VERB VERB ADP NOUN ADP PRON ADV ADV ADP PRON VERB VERB VERB VERB PROPN PROPN PROPN VERB ADV PART VERB ADJ NOUN PART VERB DET ADJ ADP PRON PRON
But then her pride and her curiosity had got the better of her again, and she remembered why she had agreed to the meeting in the first place.	0 0 0 0 0 0 0 0 1 0 1 1 0 0 0 0 0 0 0 0 0 0 0 0 0 0 0 0	get the better of	figurative	inflection	CCONJ ADV ADJ NOUN CCONJ ADJ NOUN VERB VERB DET ADJ ADP PRON ADV CCONJ PRON VERB ADV PRON VERB VERB ADP DET NOUN ADP DET ADJ NOUN	▁But ▁then ▁her ▁pride ▁and ▁her ▁cur ios ity ▁had ▁got ▁the ▁better ▁of ▁her ▁again , ▁and ▁she ▁remembered ▁why ▁she ▁had ▁agreed ▁to ▁the ▁meeting ▁in ▁the ▁first ▁place .	0 0 0 0 0 0 0 0 0 0 1 0 1 1 0 0 0 0 0 0 0 0 0 0 0 0 0 0 0 0 0 0	CCONJ ADV ADJ NOUN CCONJ ADJ NOUN NOUN NOUN VERB VERB DET ADJ ADP PRON ADV ADV CCONJ PRON VERB ADV PRON VERB VERB ADP DET NOUN ADP DET ADJ NOUN NOUN
A Spanish driver let his fiery temper get the better of him when he was stopped by police.	0 0 0 0 0 0 0 1 0 1 1 0 0 0 0 0 0 0	get the better of	figurative	identical	DET ADJ NOUN VERB ADJ ADJ NOUN VERB DET ADJ ADP PRON ADV PRON VERB VERB ADP NOUN	▁A ▁Spanish ▁driver ▁let ▁his ▁fi ery ▁temper ▁get ▁the ▁better ▁of ▁him ▁when ▁he ▁was ▁stopped ▁by ▁police .	0 0 0 0 0 0 0 0 1 0 1 1 0 0 0 0 0 0 0 0	DET ADJ NOUN VERB ADJ ADJ ADJ NOUN VERB DET ADJ ADP PRON ADV PRON VERB VERB ADP NOUN NOUN
Bregawn's temperament got the better of him the following season, and on his racecourse appearances he displayed increasing sourness.	0 0 1 0 1 1 0 0 0 0 0 0 0 0 0 0 0 0 0	get the better of	figurative	inflection	PROPN NOUN VERB DET ADJ ADP PRON DET VERB NOUN CCONJ ADP ADJ NOUN NOUN PRON VERB VERB NOUN	▁Bre ga wn ' s ▁temper ament ▁got ▁the ▁better ▁of ▁him ▁the ▁following ▁season , ▁and ▁on ▁his ▁race course ▁appearance s ▁he ▁displayed ▁increasing ▁sour ness .	0 0 0 0 0 0 0 1 0 1 1 0 0 0 0 0 0 0 0 0 0 0 0 0 0 0 0 0 0	PROPN PROPN PROPN PROPN PROPN NOUN NOUN VERB DET ADJ ADP PRON DET VERB NOUN NOUN CCONJ ADP ADJ NOUN NOUN NOUN NOUN PRON VERB VERB NOUN NOUN NOUN
He doesn't look like the sort of man one can get the better of very often.’	0 0 0 0 0 0 0 0 0 0 1 0 1 1 0 0	get the better of	figurative	identical	PRON VERB VERB ADP DET NOUN ADP NOUN PRON VERB VERB DET ADJ ADP ADV NOUN	▁He ▁does n ' t ▁look ▁like ▁the ▁sort ▁of ▁man ▁one ▁can ▁get ▁the ▁better ▁of ▁very ▁often . ’	0 0 0 0 0 0 0 0 0 0 0 0 0 1 0 1 1 0 0 0 0	PRON VERB VERB VERB VERB VERB ADP DET NOUN ADP NOUN PRON VERB VERB DET ADJ ADP ADV NOUN NOUN NOUN
The High Court in Inverness heard that PC John Smith's curiosity had got the better of him when he learned that a Murdo MacIver from his home town of Stornoway was in custody.	0 0 0 0 0 0 0 0 0 0 0 0 1 0 1 1 0 0 0 0 0 0 0 0 0 0 0 0 0 0 0 0 0	get the better of	figurative	inflection	DET PROPN PROPN ADP PROPN VERB ADP PROPN PROPN PROPN NOUN VERB VERB DET ADJ ADP PRON ADV PRON VERB ADP DET PROPN PROPN ADP ADJ NOUN NOUN ADP PROPN VERB ADP NOUN	▁The ▁High ▁Court ▁in ▁In ver ness ▁heard ▁that ▁PC ▁John ▁Smith ' s ▁cur ios ity ▁had ▁got ▁the ▁better ▁of ▁him ▁when ▁he ▁learned ▁that ▁a ▁Mur do ▁Mac I ver ▁from ▁his ▁home ▁town ▁of ▁Stor no way ▁was ▁in ▁custody .	0 0 0 0 0 0 0 0 0 0 0 0 0 0 0 0 0 0 1 0 1 1 0 0 0 0 0 0 0 0 0 0 0 0 0 0 0 0 0 0 0 0 0 0 0	DET PROPN PROPN ADP PROPN PROPN PROPN VERB ADP PROPN PROPN PROPN PROPN PROPN NOUN NOUN NOUN VERB VERB DET ADJ ADP PRON ADV PRON VERB ADP DET PROPN PROPN PROPN PROPN PROPN ADP ADJ NOUN NOUN ADP PROPN PROPN PROPN VERB ADP NOUN NOUN
In competition with 800 other boys, he made it to the last five, but nerves got the better of him during a final audition at the Criterion Theatre, in London's West End.	0 0 0 0 0 0 0 0 0 0 0 0 0 0 0 1 0 1 1 0 0 0 0 0 0 0 0 0 0 0 0 0	get the better of	figurative	inflection	ADP NOUN ADP NUM ADJ NOUN PRON VERB PRON ADP DET ADJ NUM CCONJ NOUN VERB DET ADJ ADP PRON ADP DET ADJ NOUN ADP DET PROPN PROPN ADP PROPN PROPN PROPN	▁In ▁competition ▁with ▁800 ▁other ▁boys , ▁he ▁made ▁it ▁to ▁the ▁last ▁five , ▁but ▁nerve s ▁got ▁the ▁better ▁of ▁him ▁during ▁a ▁final ▁audit ion ▁at ▁the ▁Criterion ▁The a tre , ▁in ▁London ' s ▁West ▁End .	0 0 0 0 0 0 0 0 0 0 0 0 0 0 0 0 0 0 1 0 1 1 0 0 0 0 0 0 0 0 0 0 0 0 0 0 0 0 0 0 0 0	ADP NOUN ADP NUM ADJ NOUN NOUN PRON VERB PRON ADP DET ADJ NUM NUM CCONJ NOUN NOUN VERB DET ADJ ADP PRON ADP DET ADJ NOUN NOUN ADP DET PROPN PROPN PROPN PROPN PROPN ADP PROPN PROPN PROPN PROPN PROPN PROPN
When he said no more, curiosity got the better of her and she asked, ‘ So what is she?’	0 0 0 0 0 0 1 0 1 1 0 0 0 0 0 0 0 0 0	get the better of	figurative	inflection	ADV PRON VERB ADV ADJ NOUN VERB DET ADJ ADP PRON CCONJ PRON VERB PUNCT ADV NOUN VERB PROPN	▁When ▁he ▁said ▁no ▁more , ▁cur ios ity ▁got ▁the ▁better ▁of ▁her ▁and ▁she ▁asked , ▁ ‘ ▁So ▁what ▁is ▁she ? ’	0 0 0 0 0 0 0 0 0 1 0 1 1 0 0 0 0 0 0 0 0 0 0 0 0 0	ADV PRON VERB ADV ADJ ADJ NOUN NOUN NOUN VERB DET ADJ ADP PRON CCONJ PRON VERB VERB PUNCT PUNCT ADV NOUN VERB PROPN PROPN PROPN
‘ Then I know that I 've got the better of them.	0 0 0 0 0 0 0 1 0 1 1 0	get the better of	figurative	inflection	PUNCT ADV PRON VERB ADP PRON VERB VERB DET ADJ ADP PRON	▁ ‘ ▁Then ▁I ▁know ▁that ▁I ▁' ve ▁got ▁the ▁better ▁of ▁them .	0 0 0 0 0 0 0 0 0 1 0 1 1 0 0	PUNCT PUNCT ADV PRON VERB ADP PRON VERB VERB VERB DET ADJ ADP PRON PRON
I was well satisfied ; I had beaten what I considered to be a bogey track for me, determined not to let either the track or the stadium get the better of me.	0 0 0 0 0 0 0 0 0 0 0 0 0 0 0 0 0 0 0 0 0 0 0 0 0 0 0 0 1 0 1 1 0	get the better of	figurative	identical	PRON VERB ADV ADJ PUNCT PRON VERB VERB NOUN PRON VERB PART VERB DET ADJ NOUN ADP PRON VERB ADV PART VERB CCONJ DET NOUN CCONJ DET NOUN VERB DET ADJ ADP PRON	▁I ▁was ▁well ▁satisfied ▁ ; ▁I ▁had ▁beat en ▁what ▁I ▁considered ▁to ▁be ▁a ▁bog ey ▁track ▁for ▁me , ▁determined ▁not ▁to ▁let ▁either ▁the ▁track ▁or ▁the ▁stadium ▁get ▁the ▁better ▁of ▁me .	0 0 0 0 0 0 0 0 0 0 0 0 0 0 0 0 0 0 0 0 0 0 0 0 0 0 0 0 0 0 0 0 1 0 1 1 0 0	PRON VERB ADV ADJ PUNCT PUNCT PRON VERB VERB VERB NOUN PRON VERB PART VERB DET ADJ ADJ NOUN ADP PRON PRON VERB ADV PART VERB CCONJ DET NOUN CCONJ DET NOUN VERB DET ADJ ADP PRON PRON
They both took lookout positions on opposite sides of the roof, and although Charlie could still hear the sound of the battle, he was quite unable to make out who was getting the better of it on the other side of the forest.	0 0 0 0 0 0 0 0 0 0 0 0 0 0 0 0 0 0 0 0 0 0 0 0 0 0 0 0 0 0 0 1 0 1 1 0 0 0 0 0 0 0 0	get the better of	figurative	inflection	PRON DET VERB ADJ NOUN ADP ADJ NOUN ADP DET NOUN CCONJ ADP PROPN VERB ADV VERB DET NOUN ADP DET NOUN PRON VERB ADV ADJ PART VERB PART NOUN VERB VERB DET ADJ ADP PRON ADP DET ADJ NOUN ADP DET NOUN	▁They ▁both ▁took ▁look out ▁positions ▁on ▁opposite ▁sides ▁of ▁the ▁roof , ▁and ▁although ▁Char lie ▁could ▁still ▁hear ▁the ▁sound ▁of ▁the ▁battle , ▁he ▁was ▁quite ▁unable ▁to ▁make ▁out ▁who ▁was ▁gett ing ▁the ▁better ▁of ▁it ▁on ▁the ▁other ▁side ▁of ▁the ▁forest .	0 0 0 0 0 0 0 0 0 0 0 0 0 0 0 0 0 0 0 0 0 0 0 0 0 0 0 0 0 0 0 0 0 0 0 1 1 0 1 1 0 0 0 0 0 0 0 0 0	PRON DET VERB ADJ ADJ NOUN ADP ADJ NOUN ADP DET NOUN NOUN CCONJ ADP PROPN PROPN VERB ADV VERB DET NOUN ADP DET NOUN NOUN PRON VERB ADV ADJ PART VERB PART NOUN VERB VERB VERB DET ADJ ADP PRON ADP DET ADJ NOUN ADP DET NOUN NOUN
But when curiosity got the better of us we found ourselves almost immediately drawn to a highland community where, like a long - awaiting gift, we were invited to build a house for about a thousand pounds on a verdant piece of property.	0 0 0 1 0 1 1 0 0 0 0 0 0 0 0 0 0 0 0 0 0 0 0 0 0 0 0 0 0 0 0 0 0 0 0 0 0 0 0 0 0 0 0	get the better of	figurative	inflection	CCONJ ADV NOUN VERB DET ADJ ADP PRON PRON VERB PRON ADV ADV VERB ADP DET ADJ NOUN ADV ADP DET ADV PUNCT VERB NOUN PRON VERB VERB PART VERB DET NOUN ADP ADV DET NUM NOUN ADP DET NOUN NOUN ADP NOUN	▁But ▁when ▁cur ios ity ▁got ▁the ▁better ▁of ▁us ▁we ▁found ▁ourselves ▁almost ▁immediately ▁drawn ▁to ▁a ▁high land ▁community ▁where , ▁like ▁a ▁long ▁- ▁a waiting ▁gift , ▁we ▁were ▁invited ▁to ▁build ▁a ▁house ▁for ▁about ▁a ▁thousand ▁pounds ▁on ▁a ▁ver d ant ▁piece ▁of ▁property .	0 0 0 0 0 1 0 1 1 0 0 0 0 0 0 0 0 0 0 0 0 0 0 0 0 0 0 0 0 0 0 0 0 0 0 0 0 0 0 0 0 0 0 0 0 0 0 0 0 0 0 0	CCONJ ADV NOUN NOUN NOUN VERB DET ADJ ADP PRON PRON VERB PRON ADV ADV VERB ADP DET ADJ ADJ NOUN ADV ADV ADP DET ADV PUNCT VERB VERB NOUN NOUN PRON VERB VERB PART VERB DET NOUN ADP ADV DET NUM NOUN ADP DET NOUN NOUN NOUN NOUN ADP NOUN NOUN
overpower, you know, creep up on you, I, I 'd, it 'd just get the better of me Eric that's why I got really the other one you see and that, I, I haven't come to any harm not having it, and erm I 've just got to get rid of this because it's, I 'd do a lot more Eric if it weren't for the television, I know I 'll miss it when I get rid of it you see, it has been described as a plug - in drug	0 0 0 0 0 0 0 0 0 0 0 0 0 1 0 1 1 0 0 0 0 0 0 0 0 0 0 0 0 0 0 0 0 0 0 0 0 0 0 0 0 0 0 0 0 0 0 0 0 0 0 0 0 0 0 0 0 0 0 0 0 0 0 0 0 0 0 0 0 0 0 0 0 0 0 0 0 0 0 0 0 0 0 0 0 0 0 0 0 0 0	get the better of	figurative	identical	NOUN PRON VERB VERB PART ADP PRON PRON PRON VERB PRON VERB ADV VERB DET ADJ ADP PRON PROPN DET ADV PRON VERB ADV DET ADJ NOUN PRON VERB CCONJ DET PRON PRON VERB VERB ADP DET NOUN ADV VERB PRON CCONJ NOUN PRON VERB ADV VERB PART VERB VERB ADP DET ADP PRON PRON VERB VERB DET NOUN ADJ PROPN ADP PRON VERB ADP DET NOUN PRON VERB PRON VERB VERB PRON ADV PRON VERB VERB ADP PRON PRON VERB PRON VERB VERB VERB ADP DET NOUN PUNCT PART NOUN	▁over power , ▁you ▁know , ▁creep ▁up ▁on ▁you , ▁I , ▁I ▁' d , ▁it ▁' d ▁just ▁get ▁the ▁better ▁of ▁me ▁E ric ▁that ' s ▁why ▁I ▁got ▁really ▁the ▁other ▁one ▁you ▁see ▁and ▁that , ▁I , ▁I ▁have n ' t ▁come ▁to ▁any ▁harm ▁not ▁having ▁it , ▁and ▁er m ▁I ▁' ve ▁just ▁got ▁to ▁get ▁rid ▁of ▁this ▁because ▁it ' s , ▁I ▁' d ▁do ▁a ▁lot ▁more ▁E ric ▁if ▁it ▁were n ' t ▁for ▁the ▁television , ▁I ▁know ▁I ▁' ll ▁miss ▁it ▁when ▁I ▁get ▁rid ▁of ▁it ▁you ▁see , ▁it ▁has ▁been ▁described ▁as ▁a ▁plug ▁- ▁in ▁drug	0 0 0 0 0 0 0 0 0 0 0 0 0 0 0 0 0 0 0 0 0 1 0 1 1 0 0 0 0 0 0 0 0 0 0 0 0 0 0 0 0 0 0 0 0 0 0 0 0 0 0 0 0 0 0 0 0 0 0 0 0 0 0 0 0 0 0 0 0 0 0 0 0 0 0 0 0 0 0 0 0 0 0 0 0 0 0 0 0 0 0 0 0 0 0 0 0 0 0 0 0 0 0 0 0 0 0 0 0 0 0 0 0 0 0 0 0 0 0 0 0	NOUN NOUN NOUN PRON VERB VERB VERB PART ADP PRON PRON PRON PRON PRON VERB VERB VERB PRON VERB VERB ADV VERB DET ADJ ADP PRON PROPN PROPN DET DET DET ADV PRON VERB ADV DET ADJ NOUN PRON VERB CCONJ DET DET PRON PRON PRON VERB VERB VERB VERB VERB ADP DET NOUN ADV VERB PRON PRON CCONJ NOUN NOUN PRON VERB VERB ADV VERB PART VERB VERB ADP DET ADP PRON PRON PRON PRON PRON VERB VERB VERB DET NOUN ADJ PROPN PROPN ADP PRON VERB VERB VERB VERB ADP DET NOUN NOUN PRON VERB PRON VERB VERB VERB PRON ADV PRON VERB VERB ADP PRON PRON VERB VERB PRON VERB VERB VERB ADP DET NOUN PUNCT PART NOUN
Sometimes his passion gets the better of him.	0 0 0 1 0 1 1 0	get the better of	figurative	inflection	ADV ADJ NOUN VERB DET ADJ ADP PRON	▁Sometimes ▁his ▁passion ▁get s ▁the ▁better ▁of ▁him .	0 0 0 1 1 0 1 1 0 0	ADV ADJ NOUN VERB VERB DET ADJ ADP PRON PRON
PITTSBURGH – The Wall ~ Street ~ Journal recently ran a front - page article reporting that the monetary - policy “ doves, ” who had forecast low inflation in the United ~ States, have gotten the better of the “ hawks, ” who argued that the Fed ’s monthly purchases of long - term securities, or so - called quantitative easing ( QE ), would unleash faster price growth.	0 0 0 0 0 0 0 0 0 0 0 0 0 0 0 0 0 0 0 0 0 0 0 0 0 0 0 0 0 0 0 0 0 0 0 1 0 1 1 0 0 0 0 0 0 0 0 0 0 0 0 0 0 0 0 0 0 0 0 0 0 0 0 0 0 0 0 0 0 0	get the better of	figurative	inflection	NOUN PUNCT DET PROPN SYM PROPN PUNCT PROPN ADV VERB DET ADJ PUNCT NOUN NOUN VERB ADP DET ADJ PUNCT NOUN PUNCT VERB PUNCT NOUN VERB VERB ADJ NOUN ADP DET PROPN PUNCT PROPN VERB VERB DET ADJ ADP DET PUNCT NOUN PUNCT NOUN VERB ADP DET PROPN PART ADJ NOUN ADP ADJ PUNCT NOUN NOUN CCONJ ADV PUNCT VERB ADJ NOUN PUNCT PROPN PUNCT VERB VERB ADJ NOUN NOUN	▁P IT TS BURG H ▁ – ▁The ▁Wall ▁ ~ ▁Street ▁ ~ ▁Journal ▁recently ▁ran ▁a ▁front ▁- ▁page ▁article ▁reporting ▁that ▁the ▁monetary ▁- ▁policy ▁ “ ▁do ves , ▁ ” ▁who ▁had ▁forecast ▁low ▁inflation ▁in ▁the ▁United ▁ ~ ▁States , ▁have ▁got ten ▁the ▁better ▁of ▁the ▁ “ ▁h aw ks , ▁ ” ▁who ▁argued ▁that ▁the ▁F ed ▁ ’ s ▁monthly ▁purchases ▁of ▁long ▁- ▁term ▁securities , ▁or ▁so ▁- ▁called ▁quantitative ▁easing ▁( ▁Q E ▁ ), ▁would ▁unleash ▁faster ▁price ▁growth .	0 0 0 0 0 0 0 0 0 0 0 0 0 0 0 0 0 0 0 0 0 0 0 0 0 0 0 0 0 0 0 0 0 0 0 0 0 0 0 0 0 0 0 0 0 0 0 0 1 1 0 1 1 0 0 0 0 0 0 0 0 0 0 0 0 0 0 0 0 0 0 0 0 0 0 0 0 0 0 0 0 0 0 0 0 0 0 0 0 0 0 0 0 0 0 0	NOUN NOUN NOUN NOUN NOUN PUNCT PUNCT DET PROPN SYM SYM PROPN PUNCT PUNCT PROPN ADV VERB DET ADJ PUNCT NOUN NOUN VERB ADP DET ADJ PUNCT NOUN PUNCT PUNCT VERB VERB VERB PUNCT PUNCT NOUN VERB VERB ADJ NOUN ADP DET PROPN PUNCT PUNCT PROPN PROPN VERB VERB VERB DET ADJ ADP DET PUNCT PUNCT NOUN NOUN NOUN NOUN PUNCT PUNCT NOUN VERB ADP DET PROPN PROPN PART PART PART ADJ NOUN ADP ADJ PUNCT NOUN NOUN NOUN CCONJ ADV PUNCT VERB ADJ NOUN PUNCT PROPN PROPN PUNCT PUNCT VERB VERB ADJ NOUN NOUN NOUN
STEPHEN BROADBENT from Gloucester reminds us of a useful way of getting the best of both worlds.	0 0 0 0 0 0 0 0 0 0 0 1 0 1 1 0 0	get the better of	figurative	misc	PROPN PROPN ADP PROPN VERB PRON ADP DET ADJ NOUN ADP VERB DET ADJ ADP DET NOUN	▁STEP H EN ▁BRO AD B ENT ▁from ▁G lo uc ester ▁remind s ▁us ▁of ▁a ▁useful ▁way ▁of ▁gett ing ▁the ▁best ▁of ▁both ▁world s .	0 0 0 0 0 0 0 0 0 0 0 0 0 0 0 0 0 0 0 0 1 1 0 1 1 0 0 0 0	PROPN PROPN PROPN PROPN PROPN PROPN PROPN ADP PROPN PROPN PROPN PROPN VERB VERB PRON ADP DET ADJ NOUN ADP VERB VERB DET ADJ ADP DET NOUN NOUN NOUN
Or did Mr Lawson simply let his natural rudeness get the better of his judgment?	0 0 0 0 0 0 0 0 0 1 0 1 1 0 0	get the better of	figurative	identical	CCONJ VERB PROPN PROPN ADV VERB ADJ ADJ NOUN VERB DET ADJ ADP ADJ NOUN	▁Or ▁did ▁Mr ▁Law son ▁simply ▁let ▁his ▁natural ▁ru de ness ▁get ▁the ▁better ▁of ▁his ▁judgment ?	0 0 0 0 0 0 0 0 0 0 0 0 1 0 1 1 0 0 0	CCONJ VERB PROPN PROPN PROPN ADV VERB ADJ ADJ NOUN NOUN NOUN VERB DET ADJ ADP ADJ NOUN NOUN
‘ Open them, Donna,’ said Julie, her impatience getting the better of her.	0 0 0 0 0 0 0 0 1 0 1 1 0	get the better of	figurative	inflection	PUNCT VERB PRON PROPN VERB PROPN ADJ NOUN VERB DET ADJ ADP PRON	▁ ‘ ▁Open ▁them , ▁Don na , ’ ▁said ▁Jul ie , ▁her ▁imp ati ence ▁gett ing ▁the ▁better ▁of ▁her .	0 0 0 0 0 0 0 0 0 0 0 0 0 0 0 0 0 1 1 0 1 1 0 0	PUNCT PUNCT VERB PRON PRON PROPN PROPN PROPN PROPN VERB PROPN PROPN PROPN ADJ NOUN NOUN NOUN VERB VERB DET ADJ ADP PRON PRON
Besides, it seemed to be terribly important to get the better of one arrogant Frenchman.	0 0 0 0 0 0 0 0 1 0 1 1 0 0 0	get the better of	figurative	identical	ADV PRON VERB PART VERB ADV ADJ PART VERB DET ADJ ADP NUM ADJ NOUN	▁Besides , ▁it ▁seemed ▁to ▁be ▁terribly ▁important ▁to ▁get ▁the ▁better ▁of ▁one ▁ar rog ant ▁French man .	0 0 0 0 0 0 0 0 0 1 0 1 1 0 0 0 0 0 0 0	ADV ADV PRON VERB PART VERB ADV ADJ PART VERB DET ADJ ADP NUM ADJ ADJ ADJ NOUN NOUN NOUN
In the main, most hotels seem happy to let their concierges work the system to their advantage, providing their more entrepreneurial traits do not get the better of them, as they did in the case of those at the Heathrow Penta.	0 0 0 0 0 0 0 0 0 0 0 0 0 0 0 0 0 0 0 0 0 0 0 0 1 0 1 1 0 0 0 0 0 0 0 0 0 0 0 0 0	get the better of	figurative	identical	ADP DET ADJ ADJ NOUN VERB ADJ PART VERB ADJ NOUN VERB DET NOUN ADP ADJ NOUN VERB ADJ ADJ ADJ NOUN VERB ADV VERB DET ADJ ADP PRON ADP PRON VERB ADP DET NOUN ADP DET ADP DET PROPN PROPN	▁In ▁the ▁main , ▁most ▁hotels ▁seem ▁happy ▁to ▁let ▁their ▁con c ier ges ▁work ▁the ▁system ▁to ▁their ▁advantage , ▁providing ▁their ▁more ▁entrepreneur ial ▁tra its ▁do ▁not ▁get ▁the ▁better ▁of ▁them , ▁as ▁they ▁did ▁in ▁the ▁case ▁of ▁those ▁at ▁the ▁He ath row ▁Penta .	0 0 0 0 0 0 0 0 0 0 0 0 0 0 0 0 0 0 0 0 0 0 0 0 0 0 0 0 0 0 0 1 0 1 1 0 0 0 0 0 0 0 0 0 0 0 0 0 0 0 0 0	ADP DET ADJ ADJ ADJ NOUN VERB ADJ PART VERB ADJ NOUN NOUN NOUN NOUN VERB DET NOUN ADP ADJ NOUN NOUN VERB ADJ ADJ ADJ ADJ NOUN NOUN VERB ADV VERB DET ADJ ADP PRON PRON ADP PRON VERB ADP DET NOUN ADP DET ADP DET PROPN PROPN PROPN PROPN PROPN
After the war the number of readers who would laugh at pictures of seasick passengers, or bosuns getting the better of the second mate, diminished rapidly.	0 0 0 0 0 0 0 0 0 0 0 0 0 0 0 0 0 1 0 1 1 0 0 0 0 0	get the better of	figurative	inflection	ADP DET NOUN DET NOUN ADP NOUN NOUN VERB VERB ADP NOUN ADP NOUN NOUN CCONJ VERB VERB DET ADJ ADP DET ADJ NOUN VERB ADV	▁After ▁the ▁war ▁the ▁number ▁of ▁readers ▁who ▁would ▁laugh ▁at ▁pictures ▁of ▁seas ick ▁passengers , ▁or ▁bo s un s ▁gett ing ▁the ▁better ▁of ▁the ▁second ▁mate , ▁diminished ▁rapidly .	0 0 0 0 0 0 0 0 0 0 0 0 0 0 0 0 0 0 0 0 0 0 1 1 0 1 1 0 0 0 0 0 0 0	ADP DET NOUN DET NOUN ADP NOUN NOUN VERB VERB ADP NOUN ADP NOUN NOUN NOUN NOUN CCONJ VERB VERB VERB VERB VERB VERB DET ADJ ADP DET ADJ NOUN NOUN VERB ADV ADV
Games between the sides in the past have seen brawn get the better of brain, even in good conditions.	0 0 0 0 0 0 0 0 0 0 1 0 1 1 0 0 0 0 0	get the better of	figurative	identical	NOUN ADP DET NOUN ADP DET NOUN VERB VERB VERB VERB DET ADJ ADP NOUN ADV ADP ADJ NOUN	▁Games ▁between ▁the ▁sides ▁in ▁the ▁past ▁have ▁seen ▁ bra wn ▁get ▁the ▁better ▁of ▁brain , ▁even ▁in ▁good ▁conditions .	0 0 0 0 0 0 0 0 0 0 0 0 1 0 1 1 0 0 0 0 0 0 0	NOUN ADP DET NOUN ADP DET NOUN VERB VERB VERB VERB VERB VERB DET ADJ ADP NOUN NOUN ADV ADP ADJ NOUN NOUN
For a moment she wavered, torn between the desire to finally get the best of him in something, and the equally strong need to stick to her word.	0 0 0 0 0 0 0 0 0 0 0 1 0 1 1 0 0 0 0 0 0 0 0 0 0 0 0 0	get the better of	figurative	misc	ADP DET NOUN PRON VERB VERB ADP DET NOUN PART ADV VERB DET ADJ ADP PRON ADP NOUN CCONJ DET ADV ADJ NOUN PART VERB ADP ADJ NOUN	▁For ▁a ▁moment ▁she ▁wave red , ▁to rn ▁between ▁the ▁desire ▁to ▁finally ▁get ▁the ▁best ▁of ▁him ▁in ▁something , ▁and ▁the ▁equally ▁strong ▁need ▁to ▁stick ▁to ▁her ▁word .	0 0 0 0 0 0 0 0 0 0 0 0 0 0 1 0 1 1 0 0 0 0 0 0 0 0 0 0 0 0 0 0 0	ADP DET NOUN PRON VERB VERB VERB VERB VERB ADP DET NOUN PART ADV VERB DET ADJ ADP PRON ADP NOUN NOUN CCONJ DET ADV ADJ NOUN PART VERB ADP ADJ NOUN NOUN
I suspect that Okonjo - Iweala, with her enormous competence and renowned wit, would have gotten the better of Kim.	0 0 0 0 0 0 0 0 0 0 0 0 0 0 0 1 0 1 1 0	get the better of	figurative	inflection	PRON VERB ADP PROPN PUNCT PROPN ADP ADJ ADJ NOUN CCONJ ADJ NOUN VERB VERB VERB DET ADJ ADP PROPN	▁I ▁suspect ▁that ▁O kon jo ▁- ▁I we ala , ▁with ▁her ▁enormous ▁competence ▁and ▁ ren owned ▁wit , ▁would ▁have ▁got ten ▁the ▁better ▁of ▁K im .	0 0 0 0 0 0 0 0 0 0 0 0 0 0 0 0 0 0 0 0 0 0 0 1 1 0 1 1 0 0 0	PRON VERB ADP PROPN PROPN PROPN PUNCT PROPN PROPN PROPN PROPN ADP ADJ ADJ NOUN CCONJ ADJ ADJ ADJ NOUN NOUN VERB VERB VERB VERB DET ADJ ADP PROPN PROPN PROPN
This was the only time I heard anyone get the better of Wellington.	0 0 0 0 0 0 0 0 1 0 1 1 0	get the better of	figurative	identical	DET VERB DET ADJ NOUN PRON VERB NOUN VERB DET ADJ ADP PROPN	▁This ▁was ▁the ▁only ▁time ▁I ▁heard ▁anyone ▁get ▁the ▁better ▁of ▁Well ing ton .	0 0 0 0 0 0 0 0 1 0 1 1 0 0 0 0	DET VERB DET ADJ NOUN PRON VERB NOUN VERB DET ADJ ADP PROPN PROPN PROPN PROPN
