The visitors also got the better of the try count, scoring five tries to Worthing's four in a fast - moving match.	0 0 0 1 0 1 1 0 0 0 0 0 0 0 0 0 0 0 0 0 0 0	get the better of	figurative	inflection	DET NOUN ADV VERB DET ADJ ADP DET NOUN NOUN VERB NUM NOUN ADP PROPN NUM ADP DET ADV PUNCT VERB NOUN	▁The ▁visitors ▁also ▁got ▁the ▁better ▁of ▁the ▁try ▁count , ▁scoring ▁five ▁tries ▁to ▁W or thing ' s ▁four ▁in ▁a ▁fast ▁- ▁moving ▁match .	0 0 0 1 0 1 1 0 0 0 0 0 0 0 0 0 0 0 0 0 0 0 0 0 0 0 0 0	DET NOUN ADV VERB DET ADJ ADP DET NOUN NOUN NOUN VERB NUM NOUN ADP PROPN PROPN PROPN PROPN PROPN NUM ADP DET ADV PUNCT VERB NOUN NOUN
After a moment, curiosity and hunger got the better of it, and it walked easily, almost indifferently, towards the dark corner where the fresh meat beckoned.	0 0 0 0 0 0 1 0 1 1 0 0 0 0 0 0 0 0 0 0 0 0 0 0 0 0	get the better of	figurative	inflection	ADP DET NOUN NOUN CCONJ NOUN VERB DET ADJ ADP PRON CCONJ PRON VERB ADV ADV ADV ADP DET ADJ NOUN ADV DET ADJ NOUN VERB	▁After ▁a ▁moment , ▁cur ios ity ▁and ▁hunger ▁got ▁the ▁better ▁of ▁it , ▁and ▁it ▁walked ▁easily , ▁almost ▁in different ly , ▁towards ▁the ▁dark ▁corner ▁where ▁the ▁fresh ▁meat ▁be ck on ed .	0 0 0 0 0 0 0 0 0 1 0 1 1 0 0 0 0 0 0 0 0 0 0 0 0 0 0 0 0 0 0 0 0 0 0 0 0 0	ADP DET NOUN NOUN NOUN NOUN NOUN CCONJ NOUN VERB DET ADJ ADP PRON PRON CCONJ PRON VERB ADV ADV ADV ADV ADV ADV ADV ADP DET ADJ NOUN ADV DET ADJ NOUN VERB VERB VERB VERB VERB
Quickest winner was former St Teresa's amateur Andrew Jarvis, who got the better of a big - punching clash with Scunthorpe light - middle Sean Martin, with Martin counted out on the ring apron after being felled by a great left hook which landed seconds before the end of the second session.	0 0 0 0 0 0 0 0 0 0 1 0 1 1 0 0 0 0 0 0 0 0 0 0 0 0 0 0 0 0 0 0 0 0 0 0 0 0 0 0 0 0 0 0 0 0 0 0 0 0 0 0	get the better of	figurative	inflection	ADJ NOUN VERB ADJ PROPN PROPN NOUN PROPN PROPN NOUN VERB DET ADJ ADP DET ADJ PUNCT NOUN NOUN ADP PROPN ADJ PUNCT ADJ PROPN PROPN ADP PROPN VERB PART ADP DET NOUN NOUN ADP VERB VERB ADP DET ADJ ADJ NOUN ADJ VERB NOUN ADP DET NOUN ADP DET ADJ NOUN	▁Quick est ▁winner ▁was ▁former ▁St ▁Ter es a ' s ▁amateur ▁Andrew ▁Jar vis , ▁who ▁got ▁the ▁better ▁of ▁a ▁big ▁- ▁punch ing ▁clash ▁with ▁Sc unt hor pe ▁light ▁- ▁middle ▁Sea n ▁Martin , ▁with ▁Martin ▁counted ▁out ▁on ▁the ▁ring ▁apron ▁after ▁being ▁fell ed ▁by ▁a ▁great ▁left ▁hook ▁which ▁landed ▁seconds ▁before ▁the ▁end ▁of ▁the ▁second ▁session .	0 0 0 0 0 0 0 0 0 0 0 0 0 0 0 0 0 1 0 1 1 0 0 0 0 0 0 0 0 0 0 0 0 0 0 0 0 0 0 0 0 0 0 0 0 0 0 0 0 0 0 0 0 0 0 0 0 0 0 0 0 0 0 0 0 0 0	ADJ ADJ NOUN VERB ADJ PROPN PROPN PROPN PROPN PROPN PROPN NOUN PROPN PROPN PROPN PROPN NOUN VERB DET ADJ ADP DET ADJ PUNCT NOUN NOUN NOUN ADP PROPN PROPN PROPN PROPN ADJ PUNCT ADJ PROPN PROPN PROPN PROPN ADP PROPN VERB PART ADP DET NOUN NOUN ADP VERB VERB VERB ADP DET ADJ ADJ NOUN ADJ VERB NOUN ADP DET NOUN ADP DET ADJ NOUN NOUN
She was probably the only person who ever got the better of Flynn in a fight.	0 0 0 0 0 0 0 0 1 0 1 1 0 0 0 0	get the better of	figurative	inflection	PRON VERB ADV DET ADJ NOUN NOUN ADV VERB DET ADJ ADP PROPN ADP DET NOUN	▁She ▁was ▁probably ▁the ▁only ▁person ▁who ▁ever ▁got ▁the ▁better ▁of ▁Fly nn ▁in ▁a ▁fight .	0 0 0 0 0 0 0 0 1 0 1 1 0 0 0 0 0 0	PRON VERB ADV DET ADJ NOUN NOUN ADV VERB DET ADJ ADP PROPN PROPN ADP DET NOUN NOUN
‘ No one has ever got the better of her yet.’	0 0 0 0 0 1 0 1 1 0 0	get the better of	figurative	inflection	PUNCT DET NOUN VERB ADV VERB DET ADJ ADP ADJ PROPN	▁ ‘ ▁No ▁one ▁has ▁ever ▁got ▁the ▁better ▁of ▁her ▁yet . ’	0 0 0 0 0 0 1 0 1 1 0 0 0 0	PUNCT PUNCT DET NOUN VERB ADV VERB DET ADJ ADP ADJ PROPN PROPN PROPN
Curiosity got the better of her.	0 1 0 1 1 0	get the better of	figurative	inflection	NOUN VERB DET ADJ ADP PRON	▁Cur ios ity ▁got ▁the ▁better ▁of ▁her .	0 0 0 1 0 1 1 0 0	NOUN NOUN NOUN VERB DET ADJ ADP PRON PRON
Then she told herself he had only got the better of her because she was, as he had so rightly said, suffering from shock and exhaustion.	0 0 0 0 0 0 0 1 0 1 1 0 0 0 0 0 0 0 0 0 0 0 0 0 0 0	get the better of	figurative	inflection	ADV PRON VERB PRON PRON VERB ADV VERB DET ADJ ADP PRON ADP PRON VERB ADP PRON VERB ADV ADV VERB VERB ADP NOUN CCONJ NOUN	▁Then ▁she ▁told ▁herself ▁he ▁had ▁only ▁got ▁the ▁better ▁of ▁her ▁because ▁she ▁was , ▁as ▁he ▁had ▁so ▁rightly ▁said , ▁suffering ▁from ▁shock ▁and ▁exhaustion .	0 0 0 0 0 0 0 1 0 1 1 0 0 0 0 0 0 0 0 0 0 0 0 0 0 0 0 0 0	ADV PRON VERB PRON PRON VERB ADV VERB DET ADJ ADP PRON ADP PRON VERB VERB ADP PRON VERB ADV ADV VERB VERB VERB ADP NOUN CCONJ NOUN NOUN
Harvey's hunger got the better of him only fifty yards down the street and even though Signe was keen to go downtown Harvey had his way.	0 0 1 0 1 1 0 0 0 0 0 0 0 0 0 0 0 0 0 0 0 0 0 0 0 0	get the better of	figurative	inflection	PROPN NOUN VERB DET ADJ ADP PRON ADV NUM NOUN ADP DET NOUN CCONJ ADV ADP PROPN VERB ADJ PART VERB NOUN PROPN VERB ADJ NOUN	▁Har ve y ' s ▁hunger ▁got ▁the ▁better ▁of ▁him ▁only ▁fifty ▁yards ▁down ▁the ▁street ▁and ▁even ▁though ▁S ign e ▁was ▁keen ▁to ▁go ▁down town ▁Har ve y ▁had ▁his ▁way .	0 0 0 0 0 0 1 0 1 1 0 0 0 0 0 0 0 0 0 0 0 0 0 0 0 0 0 0 0 0 0 0 0 0 0 0	PROPN PROPN PROPN PROPN PROPN NOUN VERB DET ADJ ADP PRON ADV NUM NOUN ADP DET NOUN CCONJ ADV ADP PROPN PROPN PROPN VERB ADJ PART VERB NOUN NOUN PROPN PROPN PROPN VERB ADJ NOUN NOUN
In the time it takes to get the better of this slope, you could raise a family and marry them off.	0 0 0 0 0 0 1 0 1 1 0 0 0 0 0 0 0 0 0 0 0	get the better of	figurative	identical	ADP DET NOUN PRON VERB PART VERB DET ADJ ADP DET NOUN PRON VERB VERB DET NOUN CCONJ VERB PRON PART	▁In ▁the ▁time ▁it ▁takes ▁to ▁get ▁the ▁better ▁of ▁this ▁slope , ▁you ▁could ▁raise ▁a ▁family ▁and ▁mar ry ▁them ▁off .	0 0 0 0 0 0 1 0 1 1 0 0 0 0 0 0 0 0 0 0 0 0 0 0	ADP DET NOUN PRON VERB PART VERB DET ADJ ADP DET NOUN NOUN PRON VERB VERB DET NOUN CCONJ VERB VERB PRON PART PART
Fortunately, as it turned out, shyness got the better of me and I stayed put.	0 0 0 0 0 0 1 0 1 1 0 0 0 0 0	get the better of	figurative	inflection	ADV ADP PRON VERB PART NOUN VERB DET ADJ ADP PRON CCONJ PRON VERB VERB	▁Fortunately , ▁as ▁it ▁turned ▁out , ▁sh y ness ▁got ▁the ▁better ▁of ▁me ▁and ▁I ▁stayed ▁put .	0 0 0 0 0 0 0 0 0 0 1 0 1 1 0 0 0 0 0 0	ADV ADV ADP PRON VERB PART PART NOUN NOUN NOUN VERB DET ADJ ADP PRON CCONJ PRON VERB VERB VERB
This is another sign that, so far at least, the Opposition is rather getting the better of the ratings ' war.	0 0 0 0 0 0 0 0 0 0 0 0 0 1 0 1 1 0 0 0 0	get the better of	figurative	inflection	DET VERB DET NOUN ADP ADV ADV ADP ADJ DET NOUN VERB ADV VERB DET ADJ ADP DET NOUN PART NOUN	▁This ▁is ▁another ▁sign ▁that , ▁so ▁far ▁at ▁least , ▁the ▁Opposition ▁is ▁rather ▁gett ing ▁the ▁better ▁of ▁the ▁ratings ▁' ▁war .	0 0 0 0 0 0 0 0 0 0 0 0 0 0 0 1 1 0 1 1 0 0 0 0 0	DET VERB DET NOUN ADP ADP ADV ADV ADP ADJ ADJ DET NOUN VERB ADV VERB VERB DET ADJ ADP DET NOUN PART NOUN NOUN
To hell with her resolution not to let her temper get the better of her.	0 0 0 0 0 0 0 0 0 0 1 0 1 1 0	get the better of	figurative	identical	ADP NOUN ADP ADJ NOUN ADV PART VERB ADJ NOUN VERB DET ADJ ADP PRON	▁To ▁he ll ▁with ▁her ▁resolution ▁not ▁to ▁let ▁her ▁temper ▁get ▁the ▁better ▁of ▁her .	0 0 0 0 0 0 0 0 0 0 0 1 0 1 1 0 0	ADP NOUN NOUN ADP ADJ NOUN ADV PART VERB ADJ NOUN VERB DET ADJ ADP PRON PRON
With family honour at stake, his inquisitive nature just gets the better of him …	0 0 0 0 0 0 0 0 0 1 0 1 1 0 0	get the better of	figurative	inflection	ADP NOUN NOUN ADP NOUN ADJ ADJ NOUN ADV VERB DET ADJ ADP PRON PUNCT	▁With ▁family ▁honour ▁at ▁stake , ▁his ▁in quisit ive ▁nature ▁just ▁get s ▁the ▁better ▁of ▁him ▁...	0 0 0 0 0 0 0 0 0 0 0 0 1 1 0 1 1 0 0	ADP NOUN NOUN ADP NOUN NOUN ADJ ADJ ADJ ADJ NOUN ADV VERB VERB DET ADJ ADP PRON PUNCT
We have recently found out that we have now got the best of all of these or the worst of all of these in Anglo - Saxon Roman law whereby we set out was, is reasonable in law and then they hear from Saf Health and Safety Executive tell us they are not going to enforce it.	0 0 0 0 0 0 0 0 0 1 0 1 1 0 0 0 0 0 0 0 0 0 0 0 0 0 0 0 0 0 0 0 0 0 0 0 0 0 0 0 0 0 0 0 0 0 0 0 0 0 0 0 0 0 0 0 0	get the better of	figurative	misc	PRON VERB ADV VERB PART ADP PRON VERB ADV VERB DET ADJ ADP DET ADP DET CCONJ DET ADJ ADP DET ADP DET ADP PROPN PUNCT PROPN ADJ NOUN ADV PRON VERB PART VERB VERB ADJ ADP NOUN CCONJ ADV PRON VERB ADP PROPN PROPN CCONJ PROPN PROPN VERB PRON PRON VERB ADV VERB PART VERB PRON	▁We ▁have ▁recently ▁found ▁out ▁that ▁we ▁have ▁now ▁got ▁the ▁best ▁of ▁all ▁of ▁these ▁or ▁the ▁worst ▁of ▁all ▁of ▁these ▁in ▁Anglo ▁- ▁S ax on ▁Roman ▁law ▁whereby ▁we ▁set ▁out ▁was , ▁is ▁reasonable ▁in ▁law ▁and ▁then ▁they ▁hear ▁from ▁S af ▁Health ▁and ▁Safety ▁Executive ▁tell ▁us ▁they ▁are ▁not ▁going ▁to ▁enforce ▁it .	0 0 0 0 0 0 0 0 0 1 0 1 1 0 0 0 0 0 0 0 0 0 0 0 0 0 0 0 0 0 0 0 0 0 0 0 0 0 0 0 0 0 0 0 0 0 0 0 0 0 0 0 0 0 0 0 0 0 0 0 0 0	PRON VERB ADV VERB PART ADP PRON VERB ADV VERB DET ADJ ADP DET ADP DET CCONJ DET ADJ ADP DET ADP DET ADP PROPN PUNCT PROPN PROPN PROPN ADJ NOUN ADV PRON VERB PART VERB VERB VERB ADJ ADP NOUN CCONJ ADV PRON VERB ADP PROPN PROPN PROPN CCONJ PROPN PROPN VERB PRON PRON VERB ADV VERB PART VERB PRON PRON
But you haven't to let either of them get the better of you!	0 0 0 0 0 0 0 0 1 0 1 1 0	get the better of	figurative	identical	CCONJ PRON VERB PART VERB DET ADP PRON VERB DET ADJ ADP PRON	▁But ▁you ▁have n ' t ▁to ▁let ▁either ▁of ▁them ▁get ▁the ▁better ▁of ▁you !	0 0 0 0 0 0 0 0 0 0 0 1 0 1 1 0 0	CCONJ PRON VERB VERB VERB VERB PART VERB DET ADP PRON VERB DET ADJ ADP PRON PRON
You 've had to be like that all the time, otherwise you feel like you ain't getting there, they 're getting the better of you, like … ’ cos you listen, don't you, when you 've had the baby they are supposed to help you and advise you, so you take all their … but then you can only take so much, and you think these must be the mad ones, like.	0 0 0 0 0 0 0 0 0 0 0 0 0 0 0 0 0 0 0 0 1 0 1 1 0 0 0 0 0 0 0 0 0 0 0 0 0 0 0 0 0 0 0 0 0 0 0 0 0 0 0 0 0 0 0 0 0 0 0 0 0 0 0 0 0 0 0 0 0 0 0 0	get the better of	figurative	inflection	PRON VERB VERB PART VERB ADP DET ADJ DET NOUN ADV PRON VERB ADP PRON VERB VERB ADV PRON VERB VERB DET ADJ ADP PRON INTJ PUNCT PUNCT ADP PRON VERB VERB PRON ADV PRON VERB VERB DET NOUN PRON VERB VERB PART VERB PRON CCONJ VERB PRON ADV PRON VERB ADJ ADJ PUNCT CCONJ ADV PRON VERB ADV VERB ADV ADJ CCONJ PRON VERB DET VERB VERB DET ADJ NOUN ADP	▁You ▁' ve ▁had ▁to ▁be ▁like ▁that ▁all ▁the ▁time , ▁otherwise ▁you ▁feel ▁like ▁you ▁a in ' t ▁gett ing ▁there , ▁they ▁' re ▁gett ing ▁the ▁better ▁of ▁you , ▁like ▁... ▁ ’ ▁co s ▁you ▁listen , ▁don ' t ▁you , ▁when ▁you ▁' ve ▁had ▁the ▁baby ▁they ▁are ▁supposed ▁to ▁help ▁you ▁and ▁advise ▁you , ▁so ▁you ▁take ▁all ▁their ▁... ▁but ▁then ▁you ▁can ▁only ▁take ▁so ▁much , ▁and ▁you ▁think ▁these ▁must ▁be ▁the ▁mad ▁ones , ▁like .	0 0 0 0 0 0 0 0 0 0 0 0 0 0 0 0 0 0 0 0 0 0 0 0 0 0 0 0 1 1 0 1 1 0 0 0 0 0 0 0 0 0 0 0 0 0 0 0 0 0 0 0 0 0 0 0 0 0 0 0 0 0 0 0 0 0 0 0 0 0 0 0 0 0 0 0 0 0 0 0 0 0 0 0 0 0 0 0 0 0 0 0 0	PRON VERB VERB VERB PART VERB ADP DET ADJ DET NOUN NOUN ADV PRON VERB ADP PRON VERB VERB VERB VERB VERB VERB ADV ADV PRON VERB VERB VERB VERB DET ADJ ADP PRON PRON INTJ PUNCT PUNCT PUNCT ADP ADP PRON VERB VERB VERB VERB VERB PRON PRON ADV PRON VERB VERB VERB DET NOUN PRON VERB VERB PART VERB PRON CCONJ VERB PRON PRON ADV PRON VERB ADJ ADJ PUNCT CCONJ ADV PRON VERB ADV VERB ADV ADJ ADJ CCONJ PRON VERB DET VERB VERB DET ADJ NOUN NOUN ADP ADP
She knew perfectly well that it was not, but to her surprise nerves were getting the better of her.	0 0 0 0 0 0 0 0 0 0 0 0 0 0 1 0 1 1 0	get the better of	figurative	inflection	PRON VERB ADV ADV ADP PRON VERB ADV CCONJ ADP ADJ NOUN NOUN VERB VERB DET ADJ ADP PRON	▁She ▁knew ▁perfectly ▁well ▁that ▁it ▁was ▁not , ▁but ▁to ▁her ▁surprise ▁nerve s ▁were ▁gett ing ▁the ▁better ▁of ▁her .	0 0 0 0 0 0 0 0 0 0 0 0 0 0 0 0 1 1 0 1 1 0 0	PRON VERB ADV ADV ADP PRON VERB ADV ADV CCONJ ADP ADJ NOUN NOUN NOUN VERB VERB VERB DET ADJ ADP PRON PRON
That only added to Liverpool's misery, frustration getting the better of Marsh a minute earlier, his clattering challenge on Radchenko deserving of a red card.	0 0 0 0 0 0 0 1 0 1 1 0 0 0 0 0 0 0 0 0 0 0 0 0 0	get the better of	figurative	inflection	ADP ADV VERB ADP PROPN NOUN NOUN VERB DET ADJ ADP PROPN DET NOUN ADV ADJ NOUN NOUN ADP PROPN VERB ADP DET ADJ NOUN	▁That ▁only ▁added ▁to ▁Liverpool ' s ▁misery , ▁frustration ▁gett ing ▁the ▁better ▁of ▁Marsh ▁a ▁minute ▁earlier , ▁his ▁cl atter ing ▁challenge ▁on ▁Rad chen ko ▁de serv ing ▁of ▁a ▁red ▁card .	0 0 0 0 0 0 0 0 0 0 1 1 0 1 1 0 0 0 0 0 0 0 0 0 0 0 0 0 0 0 0 0 0 0 0 0 0	ADP ADV VERB ADP PROPN PROPN PROPN NOUN NOUN NOUN VERB VERB DET ADJ ADP PROPN DET NOUN ADV ADV ADJ NOUN NOUN NOUN NOUN ADP PROPN PROPN PROPN VERB VERB VERB ADP DET ADJ NOUN NOUN
If you can hold your feelings and examine them, force yourself to hear the voice and ask why it produces the response that it does, you are beginning to get the better of it, to break the fearful silence that surrounds it and, incidentally, to add another voice to your writing repertoire.	0 0 0 0 0 0 0 0 0 0 0 0 0 0 0 0 0 0 0 0 0 0 0 0 0 0 0 0 0 1 0 1 1 0 0 0 0 0 0 0 0 0 0 0 0 0 0 0 0 0 0 0	get the better of	figurative	identical	ADP PRON VERB VERB ADJ NOUN CCONJ VERB PRON VERB PRON PART VERB DET NOUN CCONJ VERB ADV PRON VERB DET NOUN ADP PRON VERB PRON VERB VERB PART VERB DET ADJ ADP PRON PART VERB DET ADJ NOUN ADJ VERB PRON CCONJ ADV PART VERB DET NOUN ADP ADJ NOUN NOUN	▁If ▁you ▁can ▁hold ▁your ▁feelings ▁and ▁examine ▁them , ▁force ▁yourself ▁to ▁hear ▁the ▁voice ▁and ▁ask ▁why ▁it ▁produces ▁the ▁response ▁that ▁it ▁does , ▁you ▁are ▁beginning ▁to ▁get ▁the ▁better ▁of ▁it , ▁to ▁break ▁the ▁fear ful ▁silence ▁that ▁surround s ▁it ▁and , ▁incidentally , ▁to ▁add ▁another ▁voice ▁to ▁your ▁writing ▁re per to ire .	0 0 0 0 0 0 0 0 0 0 0 0 0 0 0 0 0 0 0 0 0 0 0 0 0 0 0 0 0 0 0 1 0 1 1 0 0 0 0 0 0 0 0 0 0 0 0 0 0 0 0 0 0 0 0 0 0 0 0 0 0 0 0	ADP PRON VERB VERB ADJ NOUN CCONJ VERB PRON PRON VERB PRON PART VERB DET NOUN CCONJ VERB ADV PRON VERB DET NOUN ADP PRON VERB VERB PRON VERB VERB PART VERB DET ADJ ADP PRON PRON PART VERB DET ADJ ADJ NOUN ADJ VERB VERB PRON CCONJ CCONJ ADV ADV PART VERB DET NOUN ADP ADJ NOUN NOUN NOUN NOUN NOUN NOUN
If you believe our young fans the secret of the film's success — it broke box office records in the US by grossing £ 25 million in its first five days — is that it shows a mere kid getting the better of two witless adults.	0 0 0 0 0 0 0 0 0 0 0 0 0 0 0 0 0 0 0 0 0 0 0 0 0 0 0 0 0 0 0 0 0 0 0 0 0 0 0 1 0 1 1 0 0 0	get the better of	figurative	inflection	ADP PRON VERB ADJ ADJ NOUN DET NOUN ADP DET NOUN NOUN PUNCT PRON VERB NOUN NOUN NOUN ADP DET PROPN ADP VERB SYM NUM NUM ADP ADJ ADJ NUM NOUN PUNCT VERB ADP PRON VERB DET ADJ NOUN VERB DET ADJ ADP NUM ADJ NOUN	▁If ▁you ▁believe ▁our ▁young ▁fans ▁the ▁secret ▁of ▁the ▁film ' s ▁success ▁ — ▁it ▁broke ▁box ▁office ▁records ▁in ▁the ▁US ▁by ▁gross ing ▁£ ▁25 ▁million ▁in ▁its ▁first ▁five ▁days ▁ — ▁is ▁that ▁it ▁shows ▁a ▁mere ▁kid ▁gett ing ▁the ▁better ▁of ▁two ▁wit less ▁adults .	0 0 0 0 0 0 0 0 0 0 0 0 0 0 0 0 0 0 0 0 0 0 0 0 0 0 0 0 0 0 0 0 0 0 0 0 0 0 0 0 0 0 0 0 1 1 0 1 1 0 0 0 0 0	ADP PRON VERB ADJ ADJ NOUN DET NOUN ADP DET NOUN NOUN NOUN NOUN PUNCT PUNCT PRON VERB NOUN NOUN NOUN ADP DET PROPN ADP VERB VERB SYM NUM NUM ADP ADJ ADJ NUM NOUN PUNCT PUNCT VERB ADP PRON VERB DET ADJ NOUN VERB VERB DET ADJ ADP NUM ADJ ADJ NOUN NOUN
P. W. Conolly, when District Judge at Negombo, wrote that ' when parties quarrel and assault each other, it is no uncommon thing for the person who has got the best of the struggle to have an animal brought to the spot, and a charge of cattle stealing is preferred against the unfortunate man who has been assaulted. '	0 0 0 0 0 0 0 0 0 0 0 0 0 0 0 0 0 0 0 0 0 0 0 0 0 0 0 0 1 0 1 1 0 0 0 0 0 0 0 0 0 0 0 0 0 0 0 0 0 0 0 0 0 0 0 0 0 0 0	get the better of	figurative	misc	PROPN PROPN PROPN ADV PROPN PROPN ADP PROPN VERB DET PUNCT ADV NOUN VERB CCONJ VERB DET ADJ PRON VERB DET ADJ NOUN ADP DET NOUN NOUN VERB VERB DET ADJ ADP DET NOUN PART VERB DET NOUN VERB ADP DET NOUN CCONJ DET NOUN ADP NOUN VERB VERB VERB ADP DET ADJ NOUN NOUN VERB VERB VERB PUNCT	▁P . ▁W . ▁Con ol ly , ▁when ▁District ▁Judge ▁at ▁N ego m bo , ▁wrote ▁that ▁' ▁when ▁parties ▁quarrel ▁and ▁assault ▁each ▁other , ▁it ▁is ▁no ▁uncommon ▁thing ▁for ▁the ▁person ▁who ▁has ▁got ▁the ▁best ▁of ▁the ▁struggle ▁to ▁have ▁an ▁animal ▁brought ▁to ▁the ▁spot , ▁and ▁a ▁charge ▁of ▁cattle ▁ste al ing ▁is ▁preferred ▁against ▁the ▁unfortunate ▁man ▁who ▁has ▁been ▁assault ed . ▁'	0 0 0 0 0 0 0 0 0 0 0 0 0 0 0 0 0 0 0 0 0 0 0 0 0 0 0 0 0 0 0 0 0 0 0 0 0 0 1 0 1 1 0 0 0 0 0 0 0 0 0 0 0 0 0 0 0 0 0 0 0 0 0 0 0 0 0 0 0 0 0 0 0 0	PROPN PROPN PROPN PROPN PROPN PROPN PROPN PROPN ADV PROPN PROPN ADP PROPN PROPN PROPN PROPN PROPN VERB DET PUNCT ADV NOUN VERB CCONJ VERB DET ADJ ADJ PRON VERB DET ADJ NOUN ADP DET NOUN NOUN VERB VERB DET ADJ ADP DET NOUN PART VERB DET NOUN VERB ADP DET NOUN NOUN CCONJ DET NOUN ADP NOUN VERB VERB VERB VERB VERB ADP DET ADJ NOUN NOUN VERB VERB VERB VERB VERB PUNCT
To make the most of your longhaul holiday, why not combine a stay in one resort with a stay in another and really get the best of both worlds?	0 0 0 0 0 0 0 0 0 0 0 0 0 0 0 0 0 0 0 0 0 0 0 1 0 1 1 0 0	get the better of	figurative	misc	PART VERB DET ADJ ADP ADJ NOUN NOUN ADV ADV VERB DET NOUN ADP NUM NOUN ADP DET NOUN ADP DET CCONJ ADV VERB DET ADJ ADP DET NOUN	▁To ▁make ▁the ▁most ▁of ▁your ▁long haul ▁holiday , ▁why ▁not ▁combine ▁a ▁stay ▁in ▁one ▁resort ▁with ▁a ▁stay ▁in ▁another ▁and ▁really ▁get ▁the ▁best ▁of ▁both ▁world s ?	0 0 0 0 0 0 0 0 0 0 0 0 0 0 0 0 0 0 0 0 0 0 0 0 0 1 0 1 1 0 0 0 0	PART VERB DET ADJ ADP ADJ NOUN NOUN NOUN NOUN ADV ADV VERB DET NOUN ADP NUM NOUN ADP DET NOUN ADP DET CCONJ ADV VERB DET ADJ ADP DET NOUN NOUN NOUN
He seldom let his curiosity get the better of him again.	0 0 0 0 0 1 0 1 1 0 0	get the better of	figurative	identical	PRON ADV VERB ADJ NOUN VERB DET ADJ ADP PRON ADV	▁He ▁seldom ▁let ▁his ▁cur ios ity ▁get ▁the ▁better ▁of ▁him ▁again .	0 0 0 0 0 0 0 1 0 1 1 0 0 0	PRON ADV VERB ADJ NOUN NOUN NOUN VERB DET ADJ ADP PRON ADV ADV
Some movement, the barely audible sound of a door opening and closing, then the monkey's body clock got the better of it again and it fell asleep.	0 0 0 0 0 0 0 0 0 0 0 0 0 0 0 0 0 1 0 1 1 0 0 0 0 0 0	get the better of	figurative	inflection	DET NOUN DET ADV ADJ NOUN ADP DET NOUN NOUN CCONJ NOUN ADV DET NOUN NOUN NOUN VERB DET ADJ ADP PRON ADV CCONJ PRON VERB ADJ	▁Some ▁movement , ▁the ▁barely ▁audible ▁sound ▁of ▁a ▁door ▁opening ▁and ▁closing , ▁then ▁the ▁monkey ' s ▁body ▁clock ▁got ▁the ▁better ▁of ▁it ▁again ▁and ▁it ▁fell ▁asleep .	0 0 0 0 0 0 0 0 0 0 0 0 0 0 0 0 0 0 0 0 0 1 0 1 1 0 0 0 0 0 0 0	DET NOUN NOUN DET ADV ADJ NOUN ADP DET NOUN NOUN CCONJ NOUN NOUN ADV DET NOUN NOUN NOUN NOUN NOUN VERB DET ADJ ADP PRON ADV CCONJ PRON VERB ADJ ADJ
Often the glutton in Diana got the better of her and she was frequently told off for dipping her fingers into pans filled with gooey sauces.	0 0 0 0 0 1 0 1 1 0 0 0 0 0 0 0 0 0 0 0 0 0 0 0 0 0	get the better of	figurative	inflection	ADV DET NOUN ADP PROPN VERB DET ADJ ADP PRON CCONJ PRON VERB ADV VERB PART ADP VERB ADJ NOUN ADP NOUN VERB ADP NOUN NOUN	▁Often ▁the ▁g l utton ▁in ▁D iana ▁got ▁the ▁better ▁of ▁her ▁and ▁she ▁was ▁frequently ▁told ▁off ▁for ▁d ipping ▁her ▁fingers ▁into ▁pans ▁filled ▁with ▁go o ey ▁sauce s .	0 0 0 0 0 0 0 0 1 0 1 1 0 0 0 0 0 0 0 0 0 0 0 0 0 0 0 0 0 0 0 0 0 0	ADV DET NOUN NOUN NOUN ADP PROPN PROPN VERB DET ADJ ADP PRON CCONJ PRON VERB ADV VERB PART ADP VERB VERB ADJ NOUN ADP NOUN VERB ADP NOUN NOUN NOUN NOUN NOUN NOUN
Glyn's training suddenly got the better of him, but Jenna had no time to reply — the Frenchman did that smartly.	0 0 0 1 0 1 1 0 0 0 0 0 0 0 0 0 0 0 0 0 0	get the better of	figurative	inflection	PROPN NOUN ADV VERB DET ADJ ADP PRON CCONJ PROPN VERB DET NOUN PART VERB PUNCT DET PROPN VERB DET ADV	▁G ly n ' s ▁training ▁suddenly ▁got ▁the ▁better ▁of ▁him , ▁but ▁J enna ▁had ▁no ▁time ▁to ▁reply ▁ — ▁the ▁French man ▁did ▁that ▁smart ly .	0 0 0 0 0 0 0 1 0 1 1 0 0 0 0 0 0 0 0 0 0 0 0 0 0 0 0 0 0 0 0	PROPN PROPN PROPN PROPN PROPN NOUN ADV VERB DET ADJ ADP PRON PRON CCONJ PROPN PROPN VERB DET NOUN PART VERB PUNCT PUNCT DET PROPN PROPN VERB DET ADV ADV ADV
Frankie Dettori, smitten with his five - year - old mare, is expected to get the better of a battle for early supremacy with Willie Carson aboard inconsistent but occasionally very useful July Cup winner Hamas.	0 0 0 0 0 0 0 0 0 0 0 0 0 0 1 0 1 1 0 0 0 0 0 0 0 0 0 0 0 0 0 0 0 0 0 0	get the better of	figurative	identical	PROPN PROPN VERB ADP ADJ NUM PUNCT NOUN PUNCT ADJ NOUN VERB VERB PART VERB DET ADJ ADP DET NOUN ADP ADJ NOUN ADP PROPN PROPN ADP NOUN CCONJ ADV ADV ADJ PROPN PROPN NOUN PROPN	▁Frank ie ▁De t to ri , ▁s mit ten ▁with ▁his ▁five ▁- ▁year ▁- ▁old ▁mar e , ▁is ▁expected ▁to ▁get ▁the ▁better ▁of ▁a ▁battle ▁for ▁early ▁suprem acy ▁with ▁Will ie ▁Car son ▁a board ▁inconsistent ▁but ▁occasionally ▁very ▁useful ▁July ▁C up ▁winner ▁Hama s .	0 0 0 0 0 0 0 0 0 0 0 0 0 0 0 0 0 0 0 0 0 0 0 1 0 1 1 0 0 0 0 0 0 0 0 0 0 0 0 0 0 0 0 0 0 0 0 0 0 0 0 0	PROPN PROPN PROPN PROPN PROPN PROPN PROPN VERB VERB VERB ADP ADJ NUM PUNCT NOUN PUNCT ADJ NOUN NOUN NOUN VERB VERB PART VERB DET ADJ ADP DET NOUN ADP ADJ NOUN NOUN ADP PROPN PROPN PROPN PROPN ADP ADP NOUN CCONJ ADV ADV ADJ PROPN PROPN PROPN NOUN PROPN PROPN PROPN
We even got the better of the 6th at last, with almost a tap - in for birdie.	0 0 1 0 1 1 0 0 0 0 0 0 0 0 0 0 0 0	get the better of	figurative	inflection	PRON ADV VERB DET ADJ ADP DET NOUN ADP ADJ ADP ADV DET NOUN PUNCT NOUN ADP NOUN	▁We ▁even ▁got ▁the ▁better ▁of ▁the ▁6 th ▁at ▁last , ▁with ▁almost ▁a ▁tap ▁- ▁in ▁for ▁bird ie .	0 0 1 0 1 1 0 0 0 0 0 0 0 0 0 0 0 0 0 0 0 0	PRON ADV VERB DET ADJ ADP DET NOUN NOUN ADP ADJ ADJ ADP ADV DET NOUN PUNCT NOUN ADP NOUN NOUN NOUN
To get the best of the Arthurian sites of Snowdon ascend the mountain using the Watkin Path which starts at Nant Gwynant to the south.	0 1 0 1 1 0 0 0 0 0 0 0 0 0 0 0 0 0 0 0 0 0 0 0 0	get the better of	figurative	misc	PART VERB DET ADJ ADP DET ADJ NOUN ADP PROPN VERB DET NOUN VERB DET PROPN PROPN ADJ VERB ADP PROPN PROPN ADP DET NOUN	▁To ▁get ▁the ▁best ▁of ▁the ▁Art hur ian ▁sites ▁of ▁S now don ▁a scend ▁the ▁mountain ▁using ▁the ▁W at kin ▁Path ▁which ▁starts ▁at ▁N ant ▁G wyn ant ▁to ▁the ▁south .	0 1 0 1 1 0 0 0 0 0 0 0 0 0 0 0 0 0 0 0 0 0 0 0 0 0 0 0 0 0 0 0 0 0 0 0	PART VERB DET ADJ ADP DET ADJ ADJ ADJ NOUN ADP PROPN PROPN PROPN VERB VERB DET NOUN VERB DET PROPN PROPN PROPN PROPN ADJ VERB ADP PROPN PROPN PROPN PROPN PROPN ADP DET NOUN NOUN
A few minutes later, when Nelly was preoccupied, I 'm sorry to say my cowardice got the better of me and I crept out of the room, down the stairs and ran off home.	0 0 0 0 0 0 0 0 0 0 0 0 0 0 0 1 0 1 1 0 0 0 0 0 0 0 0 0 0 0 0 0 0 0	get the better of	figurative	inflection	DET ADJ NOUN ADV ADV PROPN VERB VERB PRON VERB ADJ PART VERB ADJ NOUN VERB DET ADJ ADP PRON CCONJ PRON VERB ADP ADP DET NOUN ADP DET NOUN CCONJ VERB PART ADV	▁A ▁few ▁minutes ▁later , ▁when ▁N el ly ▁was ▁pre occupied , ▁I ▁' m ▁sorry ▁to ▁say ▁my ▁co ward ice ▁got ▁the ▁better ▁of ▁me ▁and ▁I ▁cre pt ▁out ▁of ▁the ▁room , ▁down ▁the ▁sta ir s ▁and ▁ran ▁off ▁home .	0 0 0 0 0 0 0 0 0 0 0 0 0 0 0 0 0 0 0 0 0 0 0 1 0 1 1 0 0 0 0 0 0 0 0 0 0 0 0 0 0 0 0 0 0 0 0	DET ADJ NOUN ADV ADV ADV PROPN PROPN PROPN VERB VERB VERB VERB PRON VERB VERB ADJ PART VERB ADJ NOUN NOUN NOUN VERB DET ADJ ADP PRON CCONJ PRON VERB VERB ADP ADP DET NOUN NOUN ADP DET NOUN NOUN NOUN CCONJ VERB PART ADV ADV
