In the 1950 ’s and 1960s, after Sputnik, many thought that the Soviets might get the better of America ; in the 1980 ’s, it was the Japanese.	0 0 0 0 0 0 0 0 0 0 0 0 0 0 1 0 1 1 0 0 0 0 0 0 0 0 0 0	get the better of	figurative	identical	ADP DET NUM NOUN CCONJ NOUN ADP PROPN ADJ VERB ADP DET PROPN VERB VERB DET ADJ ADP PROPN PUNCT ADP DET NUM NOUN PRON VERB DET PROPN	▁In ▁the ▁1950 ▁ ’ s ▁and ▁1960 s , ▁after ▁S put nik , ▁many ▁thought ▁that ▁the ▁Soviet s ▁might ▁get ▁the ▁better ▁of ▁America ▁ ; ▁in ▁the ▁1980 ▁ ’ s , ▁it ▁was ▁the ▁Japanese .	0 0 0 0 0 0 0 0 0 0 0 0 0 0 0 0 0 0 0 0 0 0 1 0 1 1 0 0 0 0 0 0 0 0 0 0 0 0 0 0 0	ADP DET NUM NOUN NOUN NOUN CCONJ NOUN NOUN NOUN ADP PROPN PROPN PROPN PROPN ADJ VERB ADP DET PROPN PROPN VERB VERB DET ADJ ADP PROPN PUNCT PUNCT ADP DET NUM NOUN NOUN NOUN NOUN PRON VERB DET PROPN PROPN
Anthony Quinn's Mexican / Irish temper got the better of him on the day he married Katherine De Mille, daughter of the director Cecil B De Mille.	0 0 0 0 0 0 1 0 1 1 0 0 0 0 0 0 0 0 0 0 0 0 0 0 0 0 0	get the better of	figurative	inflection	PROPN PROPN ADJ SYM ADJ NOUN VERB DET ADJ ADP PRON ADP DET NOUN PRON VERB PROPN PROPN PROPN NOUN ADP DET NOUN PROPN PROPN PROPN PROPN	▁An th ony ▁Quin n ' s ▁Mexican ▁/ ▁Irish ▁temper ▁got ▁the ▁better ▁of ▁him ▁on ▁the ▁day ▁he ▁married ▁K ather ine ▁De ▁Mill e , ▁daughter ▁of ▁the ▁director ▁C e cil ▁B ▁De ▁Mill e .	0 0 0 0 0 0 0 0 0 0 0 1 0 1 1 0 0 0 0 0 0 0 0 0 0 0 0 0 0 0 0 0 0 0 0 0 0 0 0 0	PROPN PROPN PROPN PROPN PROPN PROPN PROPN ADJ SYM ADJ NOUN VERB DET ADJ ADP PRON ADP DET NOUN PRON VERB PROPN PROPN PROPN PROPN PROPN PROPN PROPN NOUN ADP DET NOUN PROPN PROPN PROPN PROPN PROPN PROPN PROPN PROPN
Tayside get the better of Aberdeen	0 1 0 1 1 0	get the better of	figurative	identical	NOUN VERB DET ADJ ADP PROPN	▁Ta y side ▁get ▁the ▁better ▁of ▁A ber de en	0 0 0 1 0 1 1 0 0 0 0	NOUN NOUN NOUN VERB DET ADJ ADP PROPN PROPN PROPN PROPN
Kathleen flushed and was angry with herself for it and for allowing her sister to get the better of her again.	0 0 0 0 0 0 0 0 0 0 0 0 0 0 0 1 0 1 1 0 0	get the better of	figurative	identical	PROPN VERB CCONJ VERB ADJ ADP PRON ADP PRON CCONJ ADP VERB ADJ NOUN PART VERB DET ADJ ADP PRON ADV	▁Kat hle en ▁flush ed ▁and ▁was ▁angry ▁with ▁herself ▁for ▁it ▁and ▁for ▁allowing ▁her ▁sister ▁to ▁get ▁the ▁better ▁of ▁her ▁again .	0 0 0 0 0 0 0 0 0 0 0 0 0 0 0 0 0 0 1 0 1 1 0 0 0	PROPN PROPN PROPN VERB VERB CCONJ VERB ADJ ADP PRON ADP PRON CCONJ ADP VERB ADJ NOUN PART VERB DET ADJ ADP PRON ADV ADV
I mean, you 're just in a cell, you 're locked up, it makes you think, ‘ Right, that was my mistake, but next time I 'm going to get further, I 'm going to get the better of them.	0 0 0 0 0 0 0 0 0 0 0 0 0 0 0 0 0 0 0 0 0 0 0 0 0 0 0 0 0 0 0 0 0 0 0 1 0 1 1 0	get the better of	figurative	identical	PRON VERB PRON VERB ADV ADP DET NOUN PRON VERB VERB PART PRON VERB PRON VERB PUNCT INTJ DET VERB ADJ NOUN CCONJ ADJ NOUN PRON VERB VERB PART VERB ADJ PRON VERB VERB PART VERB DET ADJ ADP PRON	▁I ▁mean , ▁you ▁' re ▁just ▁in ▁a ▁cell , ▁you ▁' re ▁locked ▁up , ▁it ▁makes ▁you ▁think , ▁ ‘ ▁Right , ▁that ▁was ▁my ▁mistake , ▁but ▁next ▁time ▁I ▁' m ▁going ▁to ▁get ▁further , ▁I ▁' m ▁going ▁to ▁get ▁the ▁better ▁of ▁them .	0 0 0 0 0 0 0 0 0 0 0 0 0 0 0 0 0 0 0 0 0 0 0 0 0 0 0 0 0 0 0 0 0 0 0 0 0 0 0 0 0 0 0 0 0 0 0 1 0 1 1 0 0	PRON VERB VERB PRON VERB VERB ADV ADP DET NOUN NOUN PRON VERB VERB VERB PART PART PRON VERB PRON VERB VERB PUNCT PUNCT INTJ INTJ DET VERB ADJ NOUN NOUN CCONJ ADJ NOUN PRON VERB VERB VERB PART VERB ADJ ADJ PRON VERB VERB VERB PART VERB DET ADJ ADP PRON PRON
Yes, in that sense, in that sense, the unconscious thought was expressed but the, but the point was, i the anxiety as it were got the better of the dream, didn't it, if you woke up?	0 0 0 0 0 0 0 0 0 0 0 0 0 0 0 0 0 0 0 0 0 0 0 0 1 0 1 1 0 0 0 0 0 0 0 0	get the better of	figurative	inflection	INTJ ADP DET NOUN ADP DET NOUN DET ADJ NOUN VERB VERB CCONJ DET CCONJ DET NOUN VERB PRON DET NOUN ADP PRON VERB VERB DET ADJ ADP DET NOUN VERB PRON ADP PRON VERB PART	▁Yes , ▁in ▁that ▁sense , ▁in ▁that ▁sense , ▁the ▁unconscious ▁thought ▁was ▁expressed ▁but ▁the , ▁but ▁the ▁point ▁was , ▁i ▁the ▁anxiety ▁as ▁it ▁were ▁got ▁the ▁better ▁of ▁the ▁dream , ▁did n ' t ▁it , ▁if ▁you ▁ wo ke ▁up ?	0 0 0 0 0 0 0 0 0 0 0 0 0 0 0 0 0 0 0 0 0 0 0 0 0 0 0 0 0 1 0 1 1 0 0 0 0 0 0 0 0 0 0 0 0 0 0 0 0	INTJ INTJ ADP DET NOUN NOUN ADP DET NOUN NOUN DET ADJ NOUN VERB VERB CCONJ DET DET CCONJ DET NOUN VERB VERB PRON DET NOUN ADP PRON VERB VERB DET ADJ ADP DET NOUN NOUN VERB VERB VERB VERB PRON PRON ADP PRON VERB VERB VERB PART PART
They have a superior front five, although the Pontypridd lock Mark Rowley had been getting the better of several big names lately and will relish the prospect of testing himself against Tony Copsey.	0 0 0 0 0 0 0 0 0 0 0 0 0 0 1 0 1 1 0 0 0 0 0 0 0 0 0 0 0 0 0 0 0	get the better of	figurative	inflection	PRON VERB DET ADJ NOUN NUM ADP DET PROPN NOUN PROPN PROPN VERB VERB VERB DET ADJ ADP ADJ ADJ NOUN ADV CCONJ VERB VERB DET NOUN ADP VERB PRON ADP PROPN PROPN	▁They ▁have ▁a ▁superior ▁front ▁five , ▁although ▁the ▁P on typ rid d ▁lock ▁Mark ▁Row ley ▁had ▁been ▁gett ing ▁the ▁better ▁of ▁several ▁big ▁names ▁late ly ▁and ▁will ▁re lish ▁the ▁prospect ▁of ▁testing ▁himself ▁against ▁To ny ▁Co ps ey .	0 0 0 0 0 0 0 0 0 0 0 0 0 0 0 0 0 0 0 0 1 1 0 1 1 0 0 0 0 0 0 0 0 0 0 0 0 0 0 0 0 0 0 0 0 0	PRON VERB DET ADJ NOUN NUM NUM ADP DET PROPN PROPN PROPN PROPN PROPN NOUN PROPN PROPN PROPN VERB VERB VERB VERB DET ADJ ADP ADJ ADJ NOUN ADV ADV CCONJ VERB VERB VERB DET NOUN ADP VERB PRON ADP PROPN PROPN PROPN PROPN PROPN PROPN
By the time ‘ Cobweb Soup’ grinds in on thin guitar it's already too late, as curiously gets the better of you.	0 0 0 0 0 0 0 0 0 0 0 0 0 0 0 0 0 1 0 1 1 0	get the better of	figurative	inflection	ADP DET NOUN PUNCT PROPN NOUN VERB PART ADP ADJ NOUN PRON ADV ADV ADJ ADP ADV VERB DET ADJ ADP PRON	▁By ▁the ▁time ▁ ‘ ▁Co b we b ▁So up ’ ▁grind s ▁in ▁on ▁thin ▁ gui tar ▁it ' s ▁already ▁too ▁late , ▁as ▁curious ly ▁get s ▁the ▁better ▁of ▁you .	0 0 0 0 0 0 0 0 0 0 0 0 0 0 0 0 0 0 0 0 0 0 0 0 0 0 0 0 0 0 1 1 0 1 1 0 0	ADP DET NOUN PUNCT PUNCT PROPN PROPN PROPN PROPN NOUN NOUN NOUN VERB VERB PART ADP ADJ NOUN NOUN NOUN PRON PRON PRON ADV ADV ADJ ADJ ADP ADV ADV VERB VERB DET ADJ ADP PRON PRON
He added : ‘ We 're in the midst of a critical floods situation but from what I hear we 're getting the better of it.	0 0 0 0 0 0 0 0 0 0 0 0 0 0 0 0 0 0 0 0 0 1 0 1 1 0	get the better of	figurative	inflection	PRON VERB PUNCT PUNCT PRON VERB ADP DET NOUN ADP DET ADJ NOUN NOUN CCONJ ADP NOUN PRON VERB PRON VERB VERB DET ADJ ADP PRON	▁He ▁added ▁ : ▁ ‘ ▁We ▁' re ▁in ▁the ▁midst ▁of ▁a ▁critical ▁floods ▁situation ▁but ▁from ▁what ▁I ▁hear ▁we ▁' re ▁gett ing ▁the ▁better ▁of ▁it .	0 0 0 0 0 0 0 0 0 0 0 0 0 0 0 0 0 0 0 0 0 0 0 0 0 1 1 0 1 1 0 0	PRON VERB PUNCT PUNCT PUNCT PUNCT PRON VERB VERB ADP DET NOUN ADP DET ADJ NOUN NOUN CCONJ ADP NOUN PRON VERB PRON VERB VERB VERB VERB DET ADJ ADP PRON PRON
Indeed, his work rate is so high that his players are inspired to perform if only so that the old so - and - so does not get the better of them.	0 0 0 0 0 0 0 0 0 0 0 0 0 0 0 0 0 0 0 0 0 0 0 0 0 0 0 1 0 1 1 0	get the better of	figurative	identical	ADV ADJ NOUN NOUN VERB ADV ADJ ADP ADJ NOUN VERB VERB PART VERB ADP ADV ADP ADP DET ADJ ADV PUNCT CCONJ PUNCT ADV VERB ADV VERB DET ADJ ADP PRON	▁Indeed , ▁his ▁work ▁rate ▁is ▁so ▁high ▁that ▁his ▁players ▁are ▁inspired ▁to ▁perform ▁if ▁only ▁so ▁that ▁the ▁old ▁so ▁- ▁and ▁- ▁so ▁does ▁not ▁get ▁the ▁better ▁of ▁them .	0 0 0 0 0 0 0 0 0 0 0 0 0 0 0 0 0 0 0 0 0 0 0 0 0 0 0 0 1 0 1 1 0 0	ADV ADV ADJ NOUN NOUN VERB ADV ADJ ADP ADJ NOUN VERB VERB PART VERB ADP ADV ADP ADP DET ADJ ADV PUNCT CCONJ PUNCT ADV VERB ADV VERB DET ADJ ADP PRON PRON
But her natural good manners got the better of her and she found herself saying ‘ good evening’ and reminding Penelope that they had met at the vicarage.	0 0 0 0 0 1 0 1 1 0 0 0 0 0 0 0 0 0 0 0 0 0 0 0 0 0 0 0	get the better of	figurative	inflection	CCONJ ADJ ADJ ADJ NOUN VERB DET ADJ ADP PRON CCONJ PRON VERB PRON VERB PUNCT ADJ ADV CCONJ VERB PROPN ADP PRON VERB VERB ADP DET NOUN	▁But ▁her ▁natural ▁good ▁manner s ▁got ▁the ▁better ▁of ▁her ▁and ▁she ▁found ▁herself ▁saying ▁ ‘ ▁good ▁evening ’ ▁and ▁remind ing ▁Pen e lop e ▁that ▁they ▁had ▁met ▁at ▁the ▁vi car age .	0 0 0 0 0 0 1 0 1 1 0 0 0 0 0 0 0 0 0 0 0 0 0 0 0 0 0 0 0 0 0 0 0 0 0 0 0 0	CCONJ ADJ ADJ ADJ NOUN NOUN VERB DET ADJ ADP PRON CCONJ PRON VERB PRON VERB PUNCT PUNCT ADJ ADV ADV CCONJ VERB VERB PROPN PROPN PROPN PROPN ADP PRON VERB VERB ADP DET NOUN NOUN NOUN NOUN
Blaise Cendrars witnessed a fight in which she was getting the better of Modigliani.	0 0 0 0 0 0 0 0 0 1 0 1 1 0	get the better of	figurative	inflection	PROPN PROPN VERB DET NOUN ADP ADJ PRON VERB VERB DET ADJ ADP PROPN	▁B la ise ▁C end ra rs ▁witness ed ▁a ▁fight ▁in ▁which ▁she ▁was ▁gett ing ▁the ▁better ▁of ▁M odi gli ani .	0 0 0 0 0 0 0 0 0 0 0 0 0 0 0 1 1 0 1 1 0 0 0 0 0	PROPN PROPN PROPN PROPN PROPN PROPN PROPN VERB VERB DET NOUN ADP ADJ PRON VERB VERB VERB DET ADJ ADP PROPN PROPN PROPN PROPN PROPN
The ploughs and gritters do their best, of course, but it's not at all uncommon for the elements to get the better of them for a little while.	0 0 0 0 0 0 0 0 0 0 0 0 0 0 0 0 0 0 0 1 0 1 1 0 0 0 0 0	get the better of	figurative	identical	DET NOUN CCONJ NOUN VERB ADJ ADJ ADP NOUN CCONJ PRON ADV ADV ADV ADJ ADP DET NOUN PART VERB DET ADJ ADP PRON ADP DET ADJ NOUN	▁The ▁plough s ▁and ▁gr itter s ▁do ▁their ▁best , ▁of ▁course , ▁but ▁it ' s ▁not ▁at ▁all ▁uncommon ▁for ▁the ▁elements ▁to ▁get ▁the ▁better ▁of ▁them ▁for ▁a ▁little ▁while .	0 0 0 0 0 0 0 0 0 0 0 0 0 0 0 0 0 0 0 0 0 0 0 0 0 0 1 0 1 1 0 0 0 0 0 0	DET NOUN NOUN CCONJ NOUN NOUN NOUN VERB ADJ ADJ ADJ ADP NOUN NOUN CCONJ PRON PRON PRON ADV ADV ADV ADJ ADP DET NOUN PART VERB DET ADJ ADP PRON ADP DET ADJ NOUN NOUN
Thereafter, however, a series of self - inflicted wounds proved costly, the turning point coming when Scott Stewart's long diagonal to Canada's left touchline saw only Tony Stanger retreat into his 22 at suitable speed, though John Graf and Chris Tynan then got the better of him, the former's delightful pick - up releasing the latter for a try.	0 0 0 0 0 0 0 0 0 0 0 0 0 0 0 0 0 0 0 0 0 0 0 0 0 0 0 0 0 0 0 0 0 0 0 0 0 0 0 0 0 0 1 0 1 1 0 0 0 0 0 0 0 0 0 0 0 0 0	get the better of	figurative	inflection	ADV ADV DET NOUN ADP NOUN PUNCT VERB NOUN VERB ADJ DET NOUN NOUN VERB ADV PROPN PROPN ADJ ADJ ADP PROPN ADJ NOUN VERB ADV PROPN PROPN VERB ADP ADJ NUM ADP ADJ NOUN ADP PROPN PROPN CCONJ PROPN PROPN ADV VERB DET ADJ ADP PRON DET ADJ ADJ NOUN PUNCT NOUN VERB DET ADJ ADP DET NOUN	▁Thereafter , ▁however , ▁a ▁series ▁of ▁self ▁- ▁in flicted ▁wound s ▁proved ▁costly , ▁the ▁turning ▁point ▁coming ▁when ▁Scott ▁Ste wart ' s ▁long ▁diagonal ▁to ▁Canada ' s ▁left ▁touch line ▁saw ▁only ▁To ny ▁St anger ▁retreat ▁into ▁his ▁22 ▁at ▁suitable ▁speed , ▁though ▁John ▁Gra f ▁and ▁Chr is ▁Ty nan ▁then ▁got ▁the ▁better ▁of ▁him , ▁the ▁former ' s ▁delight ful ▁pick ▁- ▁up ▁releas ing ▁the ▁latter ▁for ▁a ▁try .	0 0 0 0 0 0 0 0 0 0 0 0 0 0 0 0 0 0 0 0 0 0 0 0 0 0 0 0 0 0 0 0 0 0 0 0 0 0 0 0 0 0 0 0 0 0 0 0 0 0 0 0 0 0 0 0 0 0 0 1 0 1 1 0 0 0 0 0 0 0 0 0 0 0 0 0 0 0 0 0 0 0	ADV ADV ADV ADV DET NOUN ADP NOUN PUNCT VERB VERB NOUN NOUN VERB ADJ ADJ DET NOUN NOUN VERB ADV PROPN PROPN PROPN PROPN PROPN ADJ ADJ ADP PROPN PROPN PROPN ADJ NOUN NOUN VERB ADV PROPN PROPN PROPN PROPN VERB ADP ADJ NUM ADP ADJ NOUN NOUN ADP PROPN PROPN PROPN CCONJ PROPN PROPN PROPN PROPN ADV VERB DET ADJ ADP PRON PRON DET ADJ ADJ ADJ ADJ ADJ NOUN PUNCT NOUN VERB VERB DET ADJ ADP DET NOUN NOUN
Kevin ( Macaulay Culkin ) manages to get the better of a couple of adult villains.	0 0 0 0 0 0 0 1 0 1 1 0 0 0 0 0	get the better of	figurative	identical	PROPN PUNCT PROPN PROPN PUNCT VERB PART VERB DET ADJ ADP DET NOUN ADP NOUN NOUN	▁Ke vin ▁( ▁Mac au lay ▁C ul kin ▁ ) ▁manages ▁to ▁get ▁the ▁better ▁of ▁a ▁couple ▁of ▁adult ▁vil lain s .	0 0 0 0 0 0 0 0 0 0 0 0 0 1 0 1 1 0 0 0 0 0 0 0 0	PROPN PROPN PUNCT PROPN PROPN PROPN PROPN PROPN PROPN PUNCT PUNCT VERB PART VERB DET ADJ ADP DET NOUN ADP NOUN NOUN NOUN NOUN NOUN
Do we have the makings of a champion, or does stress and anxiety get the better of you?	0 0 0 0 0 0 0 0 0 0 0 0 0 1 0 1 1 0	get the better of	figurative	identical	VERB PRON VERB DET NOUN ADP DET NOUN CCONJ VERB NOUN CCONJ NOUN VERB DET ADJ ADP PRON	▁Do ▁we ▁have ▁the ▁making s ▁of ▁a ▁champion , ▁or ▁does ▁stress ▁and ▁anxiety ▁get ▁the ▁better ▁of ▁you ?	0 0 0 0 0 0 0 0 0 0 0 0 0 0 0 1 0 1 1 0 0	VERB PRON VERB DET NOUN NOUN ADP DET NOUN NOUN CCONJ VERB NOUN CCONJ NOUN VERB DET ADJ ADP PRON PRON
He gave up motorcycling in 1929 when his love of cars got the better of him.	0 0 0 0 0 0 0 0 0 0 0 1 0 1 1 0	get the better of	figurative	inflection	PRON VERB PART VERB ADP NUM ADV ADJ NOUN ADP NOUN VERB DET ADJ ADP PRON	▁He ▁gave ▁up ▁motor cycl ing ▁in ▁1929 ▁when ▁his ▁love ▁of ▁cars ▁got ▁the ▁better ▁of ▁him .	0 0 0 0 0 0 0 0 0 0 0 0 0 1 0 1 1 0 0	PRON VERB PART VERB VERB VERB ADP NUM ADV ADJ NOUN ADP NOUN VERB DET ADJ ADP PRON PRON
Of the other main contenders, Wasps got the better of Harlequins in their league opener, but neither looks sharp enough to worry Bath this year.	0 0 0 0 0 0 1 0 1 1 0 0 0 0 0 0 0 0 0 0 0 0 0 0 0	get the better of	figurative	inflection	ADP DET ADJ ADJ NOUN PROPN VERB DET ADJ ADP PROPN ADP ADJ NOUN NOUN CCONJ DET VERB ADJ ADV PART VERB PROPN DET NOUN	▁Of ▁the ▁other ▁main ▁contend ers , ▁Was ps ▁got ▁the ▁better ▁of ▁Har le quin s ▁in ▁their ▁league ▁open er , ▁but ▁neither ▁looks ▁sharp ▁enough ▁to ▁worry ▁B ath ▁this ▁year .	0 0 0 0 0 0 0 0 0 1 0 1 1 0 0 0 0 0 0 0 0 0 0 0 0 0 0 0 0 0 0 0 0 0 0	ADP DET ADJ ADJ NOUN NOUN NOUN PROPN PROPN VERB DET ADJ ADP PROPN PROPN PROPN PROPN ADP ADJ NOUN NOUN NOUN NOUN CCONJ DET VERB ADJ ADV PART VERB PROPN PROPN DET NOUN NOUN
A trio of English runners featured in the women's 1500 metres where the two 800 metres runners got the better of the specialist at the distance, Christina Cahill.	0 0 0 0 0 0 0 0 0 0 0 0 0 0 0 0 0 1 0 1 1 0 0 0 0 0 0 0	get the better of	figurative	inflection	DET NOUN ADP ADJ NOUN VERB ADP DET NOUN NUM NOUN ADV DET NUM NUM NOUN NOUN VERB DET ADJ ADP DET NOUN ADP DET NOUN PROPN PROPN	▁A ▁tri o ▁of ▁English ▁run ners ▁feature d ▁in ▁the ▁women ' s ▁1500 ▁metres ▁where ▁the ▁two ▁800 ▁metres ▁run ners ▁got ▁the ▁better ▁of ▁the ▁specialist ▁at ▁the ▁distance , ▁Christ ina ▁Ca hill .	0 0 0 0 0 0 0 0 0 0 0 0 0 0 0 0 0 0 0 0 0 0 0 1 0 1 1 0 0 0 0 0 0 0 0 0 0 0	DET NOUN NOUN ADP ADJ NOUN NOUN VERB VERB ADP DET NOUN NOUN NOUN NUM NOUN ADV DET NUM NUM NOUN NOUN NOUN VERB DET ADJ ADP DET NOUN ADP DET NOUN NOUN PROPN PROPN PROPN PROPN PROPN
It was marvellous when he rang, but since I can't have him ringing here again, I told him, in a moment of my feelings getting the better of me, that if he does have any message for me he could contact you, and you 'd pass it on.	0 0 0 0 0 0 0 0 0 0 0 0 0 0 0 0 0 0 0 0 0 0 0 0 1 0 1 1 0 0 0 0 0 0 0 0 0 0 0 0 0 0 0 0 0 0 0 0	get the better of	figurative	inflection	PRON VERB ADJ ADV PRON VERB CCONJ ADP PRON VERB VERB PRON VERB ADV ADV PRON VERB PRON ADP DET NOUN ADP ADJ NOUN VERB DET ADJ ADP PRON ADP ADP PRON VERB VERB DET NOUN ADP PRON PRON VERB VERB PRON CCONJ PRON VERB VERB PRON PART	▁It ▁was ▁mar vel l ous ▁when ▁he ▁ rang , ▁but ▁since ▁I ▁can ' t ▁have ▁him ▁ring ing ▁here ▁again , ▁I ▁told ▁him , ▁in ▁a ▁moment ▁of ▁my ▁feelings ▁gett ing ▁the ▁better ▁of ▁me , ▁that ▁if ▁he ▁does ▁have ▁any ▁message ▁for ▁me ▁he ▁could ▁contact ▁you , ▁and ▁you ▁' d ▁pass ▁it ▁on .	0 0 0 0 0 0 0 0 0 0 0 0 0 0 0 0 0 0 0 0 0 0 0 0 0 0 0 0 0 0 0 0 0 0 1 1 0 1 1 0 0 0 0 0 0 0 0 0 0 0 0 0 0 0 0 0 0 0 0 0 0 0 0	PRON VERB ADJ ADJ ADJ ADJ ADV PRON VERB VERB VERB CCONJ ADP PRON VERB VERB VERB VERB PRON VERB VERB ADV ADV ADV PRON VERB PRON PRON ADP DET NOUN ADP ADJ NOUN VERB VERB DET ADJ ADP PRON PRON ADP ADP PRON VERB VERB DET NOUN ADP PRON PRON VERB VERB PRON PRON CCONJ PRON VERB VERB VERB PRON PART PART
Of course, he would probably have to raise taxes to rebuild his ideal country, and shoot a few of his highest officers before jealousy got the better of them, but that was only natural.	0 0 0 0 0 0 0 0 0 0 0 0 0 0 0 0 0 0 0 0 0 0 0 0 1 0 1 1 0 0 0 0 0 0	get the better of	figurative	inflection	ADV ADV PRON VERB ADV VERB PART VERB NOUN PART VERB ADJ ADJ NOUN CCONJ VERB DET ADJ ADP ADJ ADJ NOUN ADP NOUN VERB DET ADJ ADP PRON CCONJ DET VERB ADV ADJ	▁Of ▁course , ▁he ▁would ▁probably ▁have ▁to ▁raise ▁taxes ▁to ▁rebuild ▁his ▁ideal ▁country , ▁and ▁shoot ▁a ▁few ▁of ▁his ▁highest ▁officers ▁before ▁jealous y ▁got ▁the ▁better ▁of ▁them , ▁but ▁that ▁was ▁only ▁natural .	0 0 0 0 0 0 0 0 0 0 0 0 0 0 0 0 0 0 0 0 0 0 0 0 0 0 0 1 0 1 1 0 0 0 0 0 0 0 0	ADV ADV ADV PRON VERB ADV VERB PART VERB NOUN PART VERB ADJ ADJ NOUN NOUN CCONJ VERB DET ADJ ADP ADJ ADJ NOUN ADP NOUN NOUN VERB DET ADJ ADP PRON PRON CCONJ DET VERB ADV ADJ ADJ
They were getting the best of it, too, for there were only serving - people left and a few armed men, since the rest went off north with the courier.	0 0 1 0 1 1 0 0 0 0 0 0 0 0 0 0 0 0 0 0 0 0 0 0 0 0 0 0 0 0	get the better of	figurative	misc	PRON VERB VERB DET ADJ ADP PRON ADV ADP ADV VERB ADV VERB PUNCT NOUN VERB CCONJ DET ADJ ADJ NOUN ADP DET NOUN VERB PART ADV ADP DET NOUN	▁They ▁were ▁gett ing ▁the ▁best ▁of ▁it , ▁too , ▁for ▁there ▁were ▁only ▁serving ▁- ▁people ▁left ▁and ▁a ▁few ▁armed ▁men , ▁since ▁the ▁rest ▁went ▁off ▁north ▁with ▁the ▁courier .	0 0 1 1 0 1 1 0 0 0 0 0 0 0 0 0 0 0 0 0 0 0 0 0 0 0 0 0 0 0 0 0 0 0 0	PRON VERB VERB VERB DET ADJ ADP PRON PRON ADV ADV ADP ADV VERB ADV VERB PUNCT NOUN VERB CCONJ DET ADJ ADJ NOUN NOUN ADP DET NOUN VERB PART ADV ADP DET NOUN NOUN
‘ What is it?’ she asked suspiciously, curiosity getting the better of her.	0 0 0 0 0 0 0 0 1 0 1 1 0	get the better of	figurative	inflection	PUNCT NOUN VERB NOUN PRON VERB ADV NOUN VERB DET ADJ ADP PRON	▁ ‘ ▁What ▁is ▁it ? ’ ▁she ▁asked ▁suspicious ly , ▁cur ios ity ▁gett ing ▁the ▁better ▁of ▁her .	0 0 0 0 0 0 0 0 0 0 0 0 0 0 0 1 1 0 1 1 0 0	PUNCT PUNCT NOUN VERB NOUN NOUN NOUN PRON VERB ADV ADV ADV NOUN NOUN NOUN VERB VERB DET ADJ ADP PRON PRON
Because your emotions got the better of you.	0 0 0 1 0 1 1 0	get the better of	figurative	inflection	ADP ADJ NOUN VERB DET ADJ ADP PRON	▁Because ▁your ▁emotion s ▁got ▁the ▁better ▁of ▁you .	0 0 0 0 1 0 1 1 0 0	ADP ADJ NOUN NOUN VERB DET ADJ ADP PRON PRON
Indeed, his work rate is so high that his players are inspired to perform if only so that the old so - and - so does not get the better of them.	0 0 0 0 0 0 0 0 0 0 0 0 0 0 0 0 0 0 0 0 0 0 0 0 0 0 0 1 0 1 1 0	get the better of	literal	identical	ADV ADJ NOUN NOUN VERB ADV ADJ ADP ADJ NOUN VERB VERB PART VERB ADP ADV ADP ADP DET ADJ ADV PUNCT CCONJ PUNCT ADV VERB ADV VERB DET ADJ ADP PRON	▁Indeed , ▁his ▁work ▁rate ▁is ▁so ▁high ▁that ▁his ▁players ▁are ▁inspired ▁to ▁perform ▁if ▁only ▁so ▁that ▁the ▁old ▁so ▁- ▁and ▁- ▁so ▁does ▁not ▁get ▁the ▁better ▁of ▁them .	0 0 0 0 0 0 0 0 0 0 0 0 0 0 0 0 0 0 0 0 0 0 0 0 0 0 0 0 1 0 1 1 0 0	ADV ADV ADJ NOUN NOUN VERB ADV ADJ ADP ADJ NOUN VERB VERB PART VERB ADP ADV ADP ADP DET ADJ ADV PUNCT CCONJ PUNCT ADV VERB ADV VERB DET ADJ ADP PRON PRON
There was another advantage late on a lunch - time in that there were always a few city slickers who had ventured north by north - west ( of the Barbican ) to try the Hoskin's or the Holden's bitter and found it had got the better of them, so needed a taxi back to civilization.	0 0 0 0 0 0 0 0 0 0 0 0 0 0 0 0 0 0 0 0 0 0 0 0 0 0 0 0 0 0 0 0 0 0 0 0 0 0 0 0 0 0 0 0 1 0 1 1 0 0 0 0 0 0 0 0	get the better of	figurative	inflection	ADV VERB DET NOUN ADV ADP DET NOUN PUNCT NOUN ADP ADP ADV VERB ADV DET ADJ NOUN NOUN NOUN VERB VERB ADV ADP NOUN PUNCT NOUN PUNCT ADP DET PROPN PUNCT PART VERB DET PROPN CCONJ DET PROPN ADJ CCONJ VERB PRON VERB VERB DET ADJ ADP PRON ADV VERB DET NOUN ADV ADP NOUN	▁There ▁was ▁another ▁advantage ▁late ▁on ▁a ▁lunch ▁- ▁time ▁in ▁that ▁there ▁were ▁always ▁a ▁few ▁city ▁s lick ers ▁who ▁had ▁venture d ▁north ▁by ▁north ▁- ▁west ▁( ▁of ▁the ▁Barbi can ▁ ) ▁to ▁try ▁the ▁Ho skin ' s ▁or ▁the ▁Hold en ' s ▁bitter ▁and ▁found ▁it ▁had ▁got ▁the ▁better ▁of ▁them , ▁so ▁needed ▁a ▁tax i ▁back ▁to ▁civilization .	0 0 0 0 0 0 0 0 0 0 0 0 0 0 0 0 0 0 0 0 0 0 0 0 0 0 0 0 0 0 0 0 0 0 0 0 0 0 0 0 0 0 0 0 0 0 0 0 0 0 0 0 0 0 0 1 0 1 1 0 0 0 0 0 0 0 0 0 0 0	ADV VERB DET NOUN ADV ADP DET NOUN PUNCT NOUN ADP ADP ADV VERB ADV DET ADJ NOUN NOUN NOUN NOUN NOUN VERB VERB VERB ADV ADP NOUN PUNCT NOUN PUNCT ADP DET PROPN PROPN PUNCT PUNCT PART VERB DET PROPN PROPN PROPN PROPN CCONJ DET PROPN PROPN PROPN PROPN ADJ CCONJ VERB PRON VERB VERB DET ADJ ADP PRON PRON ADV VERB DET NOUN NOUN ADV ADP NOUN NOUN
After that, age got the better of him, and both he and his efforts to modernise Egypt languished.	0 0 0 1 0 1 1 0 0 0 0 0 0 0 0 0 0 0	get the better of	figurative	inflection	ADP DET NOUN VERB DET ADJ ADP PRON CCONJ DET PRON CCONJ ADJ NOUN PART VERB PROPN VERB	▁After ▁that , ▁age ▁got ▁the ▁better ▁of ▁him , ▁and ▁both ▁he ▁and ▁his ▁efforts ▁to ▁modernise ▁Egypt ▁l angui shed .	0 0 0 0 1 0 1 1 0 0 0 0 0 0 0 0 0 0 0 0 0 0 0	ADP DET DET NOUN VERB DET ADJ ADP PRON PRON CCONJ DET PRON CCONJ ADJ NOUN PART VERB PROPN VERB VERB VERB VERB
I allowed my feelings to get the better of me.	0 0 0 0 0 1 0 1 1 0	get the better of	figurative	identical	PRON VERB ADJ NOUN PART VERB DET ADJ ADP PRON	▁I ▁allowed ▁my ▁feelings ▁to ▁get ▁the ▁better ▁of ▁me .	0 0 0 0 0 1 0 1 1 0 0	PRON VERB ADJ NOUN PART VERB DET ADJ ADP PRON PRON
Sydney shut - out : Martin Bayfield got the better of Wallaby John Eales this time, but discovered that there is more to winning line - out ball than being the tallest man on the park as Australia waltzed away 40–15.	0 0 0 0 0 0 0 1 0 1 1 0 0 0 0 0 0 0 0 0 0 0 0 0 0 0 0 0 0 0 0 0 0 0 0 0 0 0 0 0 0	get the better of	figurative	inflection	PROPN NOUN PUNCT PART PUNCT PROPN PROPN VERB DET ADJ ADP PROPN PROPN PROPN DET NOUN CCONJ VERB ADP ADV VERB ADJ ADP VERB NOUN PUNCT PART NOUN ADP VERB DET ADJ NOUN ADP DET NOUN ADP PROPN VERB ADV NUM	▁S y d ney ▁shut ▁- ▁out ▁ : ▁Martin ▁Bay field ▁got ▁the ▁better ▁of ▁Wall a by ▁John ▁E al es ▁this ▁time , ▁but ▁discovered ▁that ▁there ▁is ▁more ▁to ▁winning ▁line ▁- ▁out ▁ball ▁than ▁being ▁the ▁tall est ▁man ▁on ▁the ▁park ▁as ▁Australia ▁wa lt zed ▁away ▁40 – 15 .	0 0 0 0 0 0 0 0 0 0 0 0 1 0 1 1 0 0 0 0 0 0 0 0 0 0 0 0 0 0 0 0 0 0 0 0 0 0 0 0 0 0 0 0 0 0 0 0 0 0 0 0 0 0 0 0 0	PROPN PROPN PROPN PROPN NOUN PUNCT PART PUNCT PUNCT PROPN PROPN PROPN VERB DET ADJ ADP PROPN PROPN PROPN PROPN PROPN PROPN PROPN DET NOUN NOUN CCONJ VERB ADP ADV VERB ADJ ADP VERB NOUN PUNCT PART NOUN ADP VERB DET ADJ ADJ NOUN ADP DET NOUN ADP PROPN VERB VERB VERB ADV NUM NUM NUM NUM
But her anger and dislike were getting the better of her, and she wanted very much to have an argument with him — and win it.	0 0 0 0 0 0 1 0 1 1 0 0 0 0 0 0 0 0 0 0 0 0 0 0 0 0	get the better of	figurative	inflection	CCONJ ADJ NOUN CCONJ NOUN VERB VERB DET ADJ ADP PRON CCONJ PRON VERB ADV ADV PART VERB DET NOUN ADP PRON PUNCT CCONJ VERB PRON	▁But ▁her ▁anger ▁and ▁dis like ▁were ▁gett ing ▁the ▁better ▁of ▁her , ▁and ▁she ▁wanted ▁very ▁much ▁to ▁have ▁an ▁argument ▁with ▁him ▁ — ▁and ▁win ▁it .	0 0 0 0 0 0 0 1 1 0 1 1 0 0 0 0 0 0 0 0 0 0 0 0 0 0 0 0 0 0 0	CCONJ ADJ NOUN CCONJ NOUN NOUN VERB VERB VERB DET ADJ ADP PRON PRON CCONJ PRON VERB ADV ADV PART VERB DET NOUN ADP PRON PUNCT PUNCT CCONJ VERB PRON PRON
Nobody would get the better of him.	0 0 1 0 1 1 0	get the better of	figurative	identical	NOUN VERB VERB DET ADJ ADP PRON	▁Nobody ▁would ▁get ▁the ▁better ▁of ▁him .	0 0 1 0 1 1 0 0	NOUN VERB VERB DET ADJ ADP PRON PRON
