Call her Marge, you might as well call her butter and go the whole hog mightn't you really?	0 0 0 0 0 0 0 0 0 0 0 1 0 1 1 0 0 0	go the whole hog	figurative	identical	VERB ADJ PROPN PRON VERB ADV ADV VERB ADJ NOUN CCONJ VERB DET ADJ NOUN VERB PRON ADV
The only sheep around here are the sad bastards who walk around in Man Utd shirts ( particularly the fat bastard in Wakefield who has No.7 and Cantona stencilled on the back ) who were presumably sexually abused at a young age and hence feel the need to rebel — why not go the whole hog and dress up as a woman, you would nt look half as silly.	0 0 0 0 0 0 0 0 0 0 0 0 0 0 0 0 0 0 0 0 0 0 0 0 0 0 0 0 0 0 0 0 0 0 0 0 0 0 0 0 0 0 0 0 0 0 0 0 0 0 0 0 1 0 1 1 0 0 0 0 0 0 0 0 0 0 0 0 0	go the whole hog	figurative	identical	DET ADJ NOUN ADV ADV VERB DET ADJ NOUN NOUN VERB ADV ADP PROPN PROPN NOUN PUNCT ADV DET ADJ NOUN ADP PROPN NOUN VERB ADJ CCONJ PROPN VERB ADP DET NOUN PUNCT NOUN VERB ADV ADV VERB ADP DET ADJ NOUN CCONJ ADV VERB DET NOUN PART VERB PUNCT ADV ADV VERB DET ADJ NOUN CCONJ VERB PART ADP DET NOUN PRON VERB ADV VERB ADV ADV ADJ
A self - proclaimed poineer and the ' first man to go the whole hog ' with his business, the Wild Boar Company, he was all for setting the strictest standards of breeds, offering a product aimed at the ' luxury end'of the market.	0 0 0 0 0 0 0 0 0 0 0 1 0 1 1 0 0 0 0 0 0 0 0 0 0 0 0 0 0 0 0 0 0 0 0 0 0 0 0 0 0 0 0 0	go the whole hog	figurative	identical	DET NOUN PUNCT VERB NOUN CCONJ DET PUNCT ADJ NOUN PART VERB DET ADJ NOUN PUNCT ADP ADJ NOUN DET PROPN PROPN PROPN PRON VERB ADV ADP VERB DET ADJ NOUN ADP NOUN VERB DET NOUN VERB ADP DET PUNCT NOUN NOUN DET NOUN
When I fly to California for my final rethink, maybe I 'll go the whole hog and get my blood fixed too.	0 0 0 0 0 0 0 0 0 0 0 0 1 0 1 1 0 0 0 0 0 0	go the whole hog	figurative	identical	ADV PRON VERB ADP PROPN ADP ADJ ADJ NOUN ADV PRON VERB VERB DET ADJ NOUN CCONJ VERB ADJ NOUN VERB ADV
One is to go the whole atomist hog and turn women too into full - time contracting egoists, no less exploitative and solitary than the males.	0 0 0 1 0 1 0 1 0 0 0 0 0 0 0 0 0 0 0 0 0 0 0 0 0 0	go the whole hog	figurative	insertion-other	NUM VERB PART VERB DET ADJ NOUN NOUN CCONJ VERB NOUN ADV ADP ADJ PUNCT NOUN NOUN NOUN DET ADV ADJ CCONJ ADJ ADP DET NOUN
Two bread and butter, eh, your going the whole hog today.	0 0 0 0 0 0 1 0 1 1 0	go the whole hog	figurative	inflection	NUM NOUN CCONJ NOUN INTJ ADJ VERB DET ADJ NOUN NOUN
If I were you I 'd go the whole hog and set up a large invertebrate aquarium.	0 0 0 0 0 0 1 0 1 1 0 0 0 0 0 0 0	go the whole hog	figurative	identical	ADP PRON VERB PRON PRON VERB VERB DET ADJ NOUN CCONJ VERB PART DET ADJ NOUN NOUN
Currently the band have a repertoire of about 20 Hendrix tunes, with Slim occasionally going the whole hog playing guitar behind his head and often performing a full Woodstock style Star Spangled Banner, much to the delight of the crowd.	0 0 0 0 0 0 0 0 0 0 0 0 0 0 1 0 1 1 0 0 0 0 0 0 0 0 0 0 0 0 0 0 0 0 0 0 0 0 0 0	go the whole hog	figurative	inflection	ADV DET NOUN VERB DET NOUN ADP ADV NUM PROPN NOUN ADP PROPN ADV VERB DET ADJ NOUN VERB NOUN ADP ADJ NOUN CCONJ ADV VERB DET ADJ PROPN NOUN PROPN PROPN PROPN ADV ADP DET NOUN ADP DET NOUN
If the latter — why had she not gone the whole hog and burned it?	0 0 0 0 0 0 0 0 1 0 1 1 0 0 0	go the whole hog	figurative	inflection	ADP DET ADJ PUNCT ADV VERB PRON ADV VERB DET ADJ NOUN CCONJ VERB PRON
But it was felt that if we were to incorporate everything you wanted, why not go the whole hog and re - launch the mag?	0 0 0 0 0 0 0 0 0 0 0 0 0 0 0 1 0 1 1 0 0 0 0 0 0	go the whole hog	figurative	identical	CCONJ PRON VERB VERB ADP ADP PRON VERB PART VERB NOUN PRON VERB ADV ADV VERB DET ADJ NOUN CCONJ NOUN PUNCT VERB DET NOUN
Let's go the whole hog.	0 1 0 1 1	go the whole hog	figurative	identical	VERB VERB DET ADJ NOUN
Then you go the whole hog, have whatever else is available, then stop for a fish - and - chip take - away on the way home.	0 0 1 0 1 1 0 0 0 0 0 0 0 0 0 0 0 0 0 0 0 0 0 0 0 0 0	go the whole hog	figurative	identical	ADV PRON VERB DET ADJ NOUN VERB ADJ ADV VERB ADJ ADV VERB ADP DET NOUN PUNCT CCONJ PUNCT NOUN VERB PUNCT NOUN ADP DET NOUN ADV
Going the whole hog. '	1 0 1 1 0	go the whole hog	figurative	combined-inflection	VERB DET ADJ NOUN PUNCT
Or, if you really insist on going the whole hog in German cuisine ( and believe me, their culinary expertise with swine is fabled ) try Zum Schiffchen, a restaurant with absolutely no understanding of nouvelle disciplines.	0 0 0 0 0 0 1 0 1 1 0 0 0 0 0 0 0 0 0 0 0 0 0 0 0 0 0 0 0 0 0 0 0 0 0 0 0	go the whole hog	figurative	inflection	CCONJ ADP PRON ADV VERB ADP VERB DET ADJ NOUN ADP ADJ NOUN PUNCT CCONJ VERB PRON ADJ ADJ NOUN ADP NOUN VERB ADJ PUNCT VERB PROPN PROPN DET NOUN ADP ADV DET NOUN ADP NOUN NOUN
And so I er never went the whole hog that way with thumping the British, British and best and so on.	0 0 0 0 0 1 0 1 1 0 0 0 0 0 0 0 0 0 0 0 0	go the whole hog	figurative	inflection	CCONJ ADV PRON INTJ ADV VERB DET ADJ NOUN DET NOUN ADP VERB DET ADJ ADJ CCONJ ADJ CCONJ ADV ADV
Squeezed into an Islington drinking hole prior to an onstage engagement, Sam sips tentatively at a half of lager while the siblings go the whole hog and guzzle pints of water.	0 0 0 0 0 0 0 0 0 0 0 0 0 0 0 0 0 0 0 0 0 0 1 0 1 1 0 0 0 0 0	go the whole hog	figurative	identical	VERB ADP DET PROPN NOUN NOUN ADV ADP DET NOUN NOUN PROPN NOUN ADV ADP DET NOUN ADP NOUN ADP DET NOUN VERB DET ADJ NOUN CCONJ VERB NOUN ADP NOUN
Mind you, Ralph did go the whole hog with it : he got Gaby Sturmer as PR doing photographs and write - ups and turned out some lovely leaflets.	0 0 0 0 1 0 1 1 0 0 0 0 0 0 0 0 0 0 0 0 0 0 0 0 0 0 0 0 0	go the whole hog	figurative	identical	VERB PRON PROPN VERB VERB DET ADJ NOUN ADP PRON PUNCT PRON VERB PROPN PROPN ADP PROPN VERB NOUN CCONJ NOUN PUNCT NOUN CCONJ VERB PART DET ADJ NOUN
And when you 've claimed that much land, why not go the whole hog and put a roof over it as well.	0 0 0 0 0 0 0 0 0 0 1 0 1 1 0 0 0 0 0 0 0 0	go the whole hog	figurative	identical	CCONJ ADV PRON VERB VERB ADP ADJ NOUN ADV ADV VERB DET ADJ NOUN CCONJ VERB DET NOUN ADP PRON ADV ADV
He's gone the whole hog that guy hanging down to his	0 1 0 1 1 0 0 0 0 0 0	go the whole hog	figurative	inflection	PRON VERB DET ADJ NOUN DET NOUN VERB PART ADP ADJ