Other women took one look at them, and went green with envy.	0 0 0 0 0 0 0 0 0 1 1 1	green with envy	figurative	identical	ADJ NOUN VERB NUM NOUN ADP PRON CCONJ VERB ADJ ADP NOUN
It's what you were born for — to make men's heads turn and women's eyes grow green with envy for all that you have that they can never hope to achieve.’	0 0 0 0 0 0 0 0 0 0 0 0 0 0 0 0 1 1 1 0 0 0 0 0 0 0 0 0 0 0 0	green with envy	figurative	identical	PRON NOUN PRON VERB VERB ADP PUNCT PART VERB NOUN NOUN VERB CCONJ NOUN NOUN VERB ADJ ADP NOUN ADP DET ADJ PRON VERB ADP PRON VERB ADV VERB ADP PRON
And I know colleague directors in the country who are green with envy at some of the things that we 've been able to do even in these difficult times.	0 0 0 0 0 0 0 0 0 0 1 1 1 0 0 0 0 0 0 0 0 0 0 0 0 0 0 0 0 0	green with envy	figurative	identical	CCONJ PRON VERB NOUN NOUN ADP DET NOUN NOUN VERB ADJ ADP NOUN ADP DET ADP DET NOUN ADJ PRON VERB VERB ADJ PART VERB ADV ADP DET ADJ NOUN
The big problems for most of humanity will be to find enough conceptual puzzles and diversions in their work and leisure lives to avoid being bored, and enough relative status not to be green with envy of their fellows.	0 0 0 0 0 0 0 0 0 0 0 0 0 0 0 0 0 0 0 0 0 0 0 0 0 0 0 0 0 0 0 0 0 1 1 1 0 0 0	green with envy	figurative	identical	DET ADJ NOUN ADP ADJ ADP NOUN VERB VERB PART VERB ADJ ADJ NOUN CCONJ NOUN ADP ADJ NOUN CCONJ NOUN NOUN PART VERB VERB ADJ CCONJ ADJ ADJ NOUN ADV PART VERB ADJ ADP NOUN ADP ADJ NOUN
Many thanks for a first class mag, even if I do go green with envy at some of the kit!	0 0 0 0 0 0 0 0 0 0 0 0 1 1 1 0 0 0 0 0	green with envy	figurative	identical	ADJ NOUN ADP DET ADJ NOUN NOUN ADV ADP PRON VERB VERB ADJ ADP NOUN ADP DET ADP DET NOUN
The latest outpouring of new ideas for the shape of its services in the latter part of the decade from its erstwhile state - owned sibling British Telecommunications Plc, described here by Chris Rose, must leave Telekom green with envy.	0 0 0 0 0 0 0 0 0 0 0 0 0 0 0 0 0 0 0 0 0 0 0 0 0 0 0 0 0 0 0 0 0 0 0 0 0 1 1 1	green with envy	figurative	identical	DET ADJ NOUN ADP ADJ NOUN ADP DET NOUN ADP ADJ NOUN ADP DET ADJ NOUN ADP DET NOUN ADP ADJ ADJ NOUN PUNCT VERB VERB PROPN PROPN PROPN VERB ADV ADP PROPN PROPN VERB VERB PROPN ADJ ADP NOUN
The usual street - cars crawled past, citizens and soldiers clinging to the outside in a way to make Theodore ~ P .~ Shonts green with envy ....	0 0 0 0 0 0 0 0 0 0 0 0 0 0 0 0 0 0 0 0 0 0 0 0 1 1 1 0	green with envy	figurative	identical	DET ADJ NOUN PUNCT NOUN VERB NOUN NOUN CCONJ NOUN VERB ADP DET NOUN ADP DET NOUN PART VERB PROPN PUNCT NOUN PUNCT NOUN ADJ ADP NOUN PUNCT
Felton declines to comment on the cost of producing a magazine lavish enough to make many editors green with envy, but says Shell underwrites 50 to 70 per cent of it.	0 0 0 0 0 0 0 0 0 0 0 0 0 0 0 0 0 1 1 1 0 0 0 0 0 0 0 0 0 0 0	green with envy	figurative	identical	PROPN VERB PART VERB ADP DET NOUN ADP VERB DET NOUN ADJ ADV PART VERB ADJ NOUN ADJ ADP NOUN CCONJ VERB PROPN VERB NUM PART NUM ADP NOUN ADP PRON
PC Tools 8 is crammed with quality features, some of which could make MS - DOS go green with envy	0 0 0 0 0 0 0 0 0 0 0 0 0 0 0 0 0 1 1 1	green with envy	figurative	identical	PROPN PROPN NUM VERB VERB ADP NOUN NOUN DET ADP ADJ VERB VERB PROPN PUNCT PROPN VERB ADJ ADP NOUN
The ease with which it's possible to construct very professional looking presentations has to be experienced to be believed, and some of the tools it provides would make professional traditional animators green with envy.	0 0 0 0 0 0 0 0 0 0 0 0 0 0 0 0 0 0 0 0 0 0 0 0 0 0 0 0 0 0 0 1 1 1	green with envy	figurative	identical	DET NOUN ADP ADJ PRON ADJ PART VERB ADV ADJ VERB NOUN VERB PART VERB VERB PART VERB VERB CCONJ DET ADP DET NOUN PRON VERB VERB VERB ADJ ADJ NOUN ADJ ADP NOUN
there is not a single piece by anyone other than himself on these discs which he is not able to rattle off with the short of nonchalant ease that would probably make even ARgerich or Pollini green with envy.	0 0 0 0 0 0 0 0 0 0 0 0 0 0 0 0 0 0 0 0 0 0 0 0 0 0 0 0 0 0 0 0 0 0 0 0 1 1 1	green with envy	figurative	identical	ADV VERB ADV DET ADJ NOUN ADP NOUN ADJ ADP PRON ADP DET NOUN ADJ PRON VERB ADV ADJ PART VERB PART ADP DET NOUN ADP ADJ NOUN ADJ VERB ADV VERB ADV PROPN CCONJ PROPN ADJ ADP NOUN
Space is limited so fill in the coupon on page 188 ( before May 11 ) to book a place at the most entertaining and educational event of the year — or risk being Green with envy!	0 0 0 0 0 0 0 0 0 0 0 0 0 0 0 0 0 0 0 0 0 0 0 0 0 0 0 0 0 0 0 0 0 0 1 1 1	green with envy	figurative	case	NOUN VERB VERB ADP NOUN PART DET NOUN ADP NOUN NUM PUNCT ADP PROPN NUM PUNCT PART VERB DET NOUN ADP DET ADV ADJ CCONJ ADJ NOUN ADP DET NOUN PUNCT CCONJ NOUN VERB ADJ ADP NOUN
And Disney's current production run is being financed partly by $ 200 m given by a group of Japanese investors on terms that make other studios green with envy.	0 0 0 0 0 0 0 0 0 0 0 0 0 0 0 0 0 0 0 0 0 0 0 0 0 0 1 1 1	green with envy	figurative	identical	CCONJ PROPN ADJ NOUN NOUN VERB VERB VERB ADV ADP SYM NUM NOUN VERB ADP DET NOUN ADP ADJ NOUN ADP NOUN ADJ VERB ADJ NOUN ADJ ADP NOUN
In Rhodes he had seen a lot of her, right up to her thigh, and Nicholas was right : he was pea - green with envy.	0 0 0 0 0 0 0 0 0 0 0 0 0 0 0 0 0 0 0 0 0 0 0 1 1 1	green with envy	figurative	identical	ADP PROPN PRON VERB VERB DET NOUN ADP PRON ADV ADP ADP ADJ NOUN CCONJ PROPN VERB ADJ PUNCT PRON VERB NOUN PUNCT ADJ ADP NOUN
It's enough to turn your fellow board directors green with envy.	0 0 0 0 0 0 0 0 1 1 1	green with envy	figurative	identical	PRON ADJ PART VERB ADJ NOUN NOUN NOUN ADJ ADP NOUN