Funny thing, heredity ; hit and miss.	0 0 0 0 1 1 1	hit and miss	figurative	identical	ADJ NOUN NOUN PUNCT VERB CCONJ VERB	▁F un ny ▁thing , ▁here d ity ▁ ; ▁hit ▁and ▁miss .	0 0 0 0 0 0 0 0 0 0 1 1 1 1	ADJ ADJ ADJ NOUN NOUN NOUN NOUN NOUN PUNCT PUNCT VERB CCONJ VERB VERB
Sixth operation —(a ) finishers hang sliding doors, corridor parting and end doors, lavatory doors, fit squab and photo frames, compartment quarter panels, pillar facings, ' hit - and - miss ' vent regulators and compartment vent lights, and welt door mouldings ; also fit cornice mouldings.	0 0 0 0 0 0 0 0 0 0 0 0 0 0 0 0 0 0 0 0 0 0 0 0 0 0 1 0 1 0 1 0 0 0 0 0 0 0 0 0 0 0 0 0 0 0 0	hit and miss	figurative	dashes	ADJ NOUN ADV PUNCT NOUN VERB VERB NOUN NOUN NOUN CCONJ NOUN NOUN NOUN NOUN VERB NOUN CCONJ NOUN NOUN NOUN NOUN NOUN NOUN NOUN PUNCT VERB PUNCT CCONJ PUNCT VERB PUNCT NOUN NOUN CCONJ NOUN NOUN NOUN CCONJ NOUN NOUN NOUN PUNCT ADV VERB NOUN NOUN	▁Sixth ▁operation ▁ — ( a ▁ ) ▁finish ers ▁hang ▁sliding ▁doors , ▁corridor ▁part ing ▁and ▁end ▁doors , ▁ lav atory ▁doors , ▁fit ▁squa b ▁and ▁photo ▁frames , ▁compartment ▁quarter ▁panels , ▁pillar ▁facing s , ▁' ▁hit ▁- ▁and ▁- ▁miss ▁' ▁vent ▁regulators ▁and ▁compartment ▁vent ▁lights , ▁and ▁we lt ▁door ▁moulding s ▁ ; ▁also ▁fit ▁corn ice ▁moulding s .	0 0 0 0 0 0 0 0 0 0 0 0 0 0 0 0 0 0 0 0 0 0 0 0 0 0 0 0 0 0 0 0 0 0 0 0 0 0 0 0 0 0 1 0 1 0 1 0 0 0 0 0 0 0 0 0 0 0 0 0 0 0 0 0 0 0 0 0 0 0	ADJ NOUN ADV ADV ADV ADV PUNCT PUNCT NOUN NOUN VERB VERB NOUN NOUN NOUN NOUN NOUN CCONJ NOUN NOUN NOUN NOUN NOUN NOUN NOUN NOUN VERB NOUN NOUN CCONJ NOUN NOUN NOUN NOUN NOUN NOUN NOUN NOUN NOUN NOUN NOUN PUNCT VERB PUNCT CCONJ PUNCT VERB PUNCT NOUN NOUN CCONJ NOUN NOUN NOUN NOUN CCONJ NOUN NOUN NOUN NOUN NOUN PUNCT PUNCT ADV VERB NOUN NOUN NOUN NOUN NOUN
Even now, it can be hit and miss.	0 0 0 0 0 1 1 1	hit and miss	figurative	identical	ADV ADV PRON VERB VERB VERB CCONJ VERB	▁Even ▁now , ▁it ▁can ▁be ▁hit ▁and ▁miss .	0 0 0 0 0 0 1 1 1 1	ADV ADV ADV PRON VERB VERB VERB CCONJ VERB VERB
Babs was under too much of a strain trying to memorise her lines to be of help, and as for Dawn — well, unless the poor thing was actually wearing her glasses, the results could be decidedly hit and miss.	0 0 0 0 0 0 0 0 0 0 0 0 0 0 0 0 0 0 0 0 0 0 0 0 0 0 0 0 0 0 0 0 0 0 0 0 0 1 1 1	hit and miss	figurative	identical	NOUN VERB ADP ADV ADJ ADP DET NOUN VERB PART VERB ADJ NOUN PART VERB ADP NOUN CCONJ ADP ADP PROPN PUNCT INTJ ADP DET ADJ NOUN VERB ADV VERB ADJ NOUN DET NOUN VERB VERB ADV VERB CCONJ VERB	▁B ab s ▁was ▁under ▁too ▁much ▁of ▁a ▁strain ▁trying ▁to ▁memo rise ▁her ▁lines ▁to ▁be ▁of ▁help , ▁and ▁as ▁for ▁Da wn ▁ — ▁well , ▁unless ▁the ▁poor ▁thing ▁was ▁actually ▁wearing ▁her ▁glasses , ▁the ▁results ▁could ▁be ▁decided ly ▁hit ▁and ▁miss .	0 0 0 0 0 0 0 0 0 0 0 0 0 0 0 0 0 0 0 0 0 0 0 0 0 0 0 0 0 0 0 0 0 0 0 0 0 0 0 0 0 0 0 0 0 0 1 1 1 1	NOUN NOUN NOUN VERB ADP ADV ADJ ADP DET NOUN VERB PART VERB VERB ADJ NOUN PART VERB ADP NOUN NOUN CCONJ ADP ADP PROPN PROPN PUNCT PUNCT INTJ INTJ ADP DET ADJ NOUN VERB ADV VERB ADJ NOUN NOUN DET NOUN VERB VERB ADV ADV VERB CCONJ VERB VERB
Such methods are very time consuming, somewhat " hit and miss " and very costly.	0 0 0 0 0 0 0 0 1 1 1 0 0 0 0	hit and miss	figurative	identical	ADJ NOUN VERB ADV NOUN VERB ADV PUNCT VERB CCONJ VERB PUNCT CCONJ ADV ADJ	▁Such ▁methods ▁are ▁very ▁time ▁consuming , ▁somewhat ▁" ▁hit ▁and ▁miss ▁" ▁and ▁very ▁costly .	0 0 0 0 0 0 0 0 0 1 1 1 0 0 0 0 0	ADJ NOUN VERB ADV NOUN VERB VERB ADV PUNCT VERB CCONJ VERB PUNCT CCONJ ADV ADJ ADJ
Leicester are on a high though this season while Forest are very hit and miss.	0 0 0 0 0 0 0 0 0 0 0 0 1 1 1	hit and miss	figurative	identical	NOUN VERB ADP DET ADJ ADP DET NOUN ADP PROPN VERB ADV VERB CCONJ VERB	▁Le ic ester ▁are ▁on ▁a ▁high ▁though ▁this ▁season ▁while ▁Forest ▁are ▁very ▁hit ▁and ▁miss .	0 0 0 0 0 0 0 0 0 0 0 0 0 0 1 1 1 1	NOUN NOUN NOUN VERB ADP DET ADJ ADP DET NOUN ADP PROPN VERB ADV VERB CCONJ VERB VERB
Canvassing is usually done with a rather hit and miss approach.	0 0 0 0 0 0 0 1 1 1 0	hit and miss	figurative	identical	VERB VERB ADV VERB ADP DET ADV VERB CCONJ VERB NOUN	▁Can va s s ing ▁is ▁usually ▁done ▁with ▁a ▁rather ▁hit ▁and ▁miss ▁approach .	0 0 0 0 0 0 0 0 0 0 0 1 1 1 0 0	VERB VERB VERB VERB VERB VERB ADV VERB ADP DET ADV VERB CCONJ VERB NOUN NOUN
My experience tells me that we do not all have all the necessary skills to do all these jobs well — it is often a hit and miss affair, with much poor practice.	0 0 0 0 0 0 0 0 0 0 0 0 0 0 0 0 0 0 0 0 0 0 0 0 0 1 1 1 0 0 0 0 0	hit and miss	figurative	identical	ADJ NOUN VERB PRON ADP PRON VERB ADV ADV VERB ADJ DET ADJ NOUN PART VERB ADJ DET NOUN ADV PUNCT PRON VERB ADV DET NOUN CCONJ VERB NOUN ADP ADJ ADJ NOUN	▁My ▁experience ▁tells ▁me ▁that ▁we ▁do ▁not ▁all ▁have ▁all ▁the ▁necessary ▁skills ▁to ▁do ▁all ▁these ▁jobs ▁well ▁ — ▁it ▁is ▁often ▁a ▁hit ▁and ▁miss ▁affair , ▁with ▁much ▁poor ▁practice .	0 0 0 0 0 0 0 0 0 0 0 0 0 0 0 0 0 0 0 0 0 0 0 0 0 0 1 1 1 0 0 0 0 0 0 0	ADJ NOUN VERB PRON ADP PRON VERB ADV ADV VERB ADJ DET ADJ NOUN PART VERB ADJ DET NOUN ADV PUNCT PUNCT PRON VERB ADV DET NOUN CCONJ VERB NOUN NOUN ADP ADJ ADJ NOUN NOUN
There was no hit and miss about it as can happen today where you can put a camera virtually anywhere and zoom into the position for any shot you want.	0 0 0 1 1 1 0 0 0 0 0 0 0 0 0 0 0 0 0 0 0 0 0 0 0 0 0 0 0 0	hit and miss	figurative	identical	ADV VERB DET NOUN CCONJ VERB ADP PRON ADP VERB VERB NOUN ADV PRON VERB VERB DET NOUN ADV ADV CCONJ VERB ADP DET NOUN ADP DET NOUN PRON VERB	▁There ▁was ▁no ▁hit ▁and ▁miss ▁about ▁it ▁as ▁can ▁happen ▁today ▁where ▁you ▁can ▁put ▁a ▁camera ▁virtual ly ▁anywhere ▁and ▁zoo m ▁into ▁the ▁position ▁for ▁any ▁shot ▁you ▁want .	0 0 0 1 1 1 0 0 0 0 0 0 0 0 0 0 0 0 0 0 0 0 0 0 0 0 0 0 0 0 0 0 0	ADV VERB DET NOUN CCONJ VERB ADP PRON ADP VERB VERB NOUN ADV PRON VERB VERB DET NOUN ADV ADV ADV CCONJ VERB VERB ADP DET NOUN ADP DET NOUN PRON VERB VERB
We approach it in a hit - and - miss sort of way instead of through a systematic communication programme.	0 0 0 0 0 1 0 1 0 1 0 0 0 0 0 0 0 0 0 0	hit and miss	figurative	dashes	PRON VERB PRON ADP DET VERB PUNCT CCONJ PUNCT VERB NOUN ADP NOUN ADV ADP ADP DET ADJ NOUN NOUN	▁We ▁approach ▁it ▁in ▁a ▁hit ▁- ▁and ▁- ▁miss ▁sort ▁of ▁way ▁instead ▁of ▁through ▁a ▁systematic ▁communication ▁programme .	0 0 0 0 0 1 0 1 0 1 0 0 0 0 0 0 0 0 0 0 0	PRON VERB PRON ADP DET VERB PUNCT CCONJ PUNCT VERB NOUN ADP NOUN ADV ADP ADP DET ADJ NOUN NOUN NOUN
There is, of course, a difference between companionship and true mutual friendship and these schemes can be rather hit - and - miss in matching the ‘ befriender’ and the target.	0 0 0 0 0 0 0 0 0 0 0 0 0 0 0 0 0 0 1 0 1 0 1 0 0 0 0 0 0 0 0	hit and miss	figurative	dashes	ADV VERB ADP NOUN DET NOUN ADP NOUN CCONJ ADJ ADJ NOUN CCONJ DET NOUN VERB VERB ADV VERB PUNCT CCONJ PUNCT VERB ADP VERB DET ADJ NOUN CCONJ DET NOUN	▁There ▁is , ▁of ▁course , ▁a ▁difference ▁between ▁companion ship ▁and ▁true ▁mutual ▁friendship ▁and ▁these ▁schemes ▁can ▁be ▁rather ▁hit ▁- ▁and ▁- ▁miss ▁in ▁matching ▁the ▁ ‘ ▁be fri ender ’ ▁and ▁the ▁target .	0 0 0 0 0 0 0 0 0 0 0 0 0 0 0 0 0 0 0 0 0 1 0 1 0 1 0 0 0 0 0 0 0 0 0 0 0 0 0	ADV VERB VERB ADP NOUN NOUN DET NOUN ADP NOUN NOUN CCONJ ADJ ADJ NOUN CCONJ DET NOUN VERB VERB ADV VERB PUNCT CCONJ PUNCT VERB ADP VERB DET ADJ ADJ NOUN NOUN NOUN NOUN CCONJ DET NOUN NOUN
Whichever form of transport you use, your arrival on time is always hit and miss.	0 0 0 0 0 0 0 0 0 0 0 0 1 1 1	hit and miss	figurative	identical	ADJ NOUN ADP NOUN PRON VERB ADJ NOUN ADP NOUN VERB ADV VERB CCONJ VERB	▁Which ever ▁form ▁of ▁transport ▁you ▁use , ▁your ▁arrival ▁on ▁time ▁is ▁always ▁hit ▁and ▁miss .	0 0 0 0 0 0 0 0 0 0 0 0 0 0 1 1 1 1	ADJ ADJ NOUN ADP NOUN PRON VERB VERB ADJ NOUN ADP NOUN VERB ADV VERB CCONJ VERB VERB
HIT AND MISS FOR MORRISSEY	1 1 1 0 0	hit and miss	figurative	case	PROPN CCONJ PROPN ADP PROPN	▁H IT ▁AND ▁MI SS ▁FOR ▁M OR RIS S EY	1 1 1 1 1 0 0 0 0 0 0	PROPN PROPN CCONJ PROPN PROPN ADP PROPN PROPN PROPN PROPN PROPN
Their copulations can not be the somewhat hit - and - miss gropings practised by the millipedes.	0 0 0 0 0 0 0 1 0 1 0 1 0 0 0 0 0	hit and miss	figurative	dashes	ADJ NOUN VERB ADV VERB DET ADV VERB PUNCT CCONJ PUNCT ADJ NOUN VERB ADP DET NOUN	▁The ir ▁co pul ations ▁can ▁not ▁be ▁the ▁somewhat ▁hit ▁- ▁and ▁- ▁miss ▁gro ping s ▁practised ▁by ▁the ▁milli ped es .	0 0 0 0 0 0 0 0 0 0 1 0 1 0 1 0 0 0 0 0 0 0 0 0 0	ADJ ADJ NOUN NOUN NOUN VERB ADV VERB DET ADV VERB PUNCT CCONJ PUNCT ADJ NOUN NOUN NOUN VERB ADP DET NOUN NOUN NOUN NOUN
It was hit and miss, and it was more miss than hit.	0 0 1 1 1 0 0 0 0 0 0 0	hit and miss	figurative	identical	PRON VERB VERB CCONJ VERB CCONJ PRON VERB ADV ADJ ADP VERB	▁It ▁was ▁hit ▁and ▁miss , ▁and ▁it ▁was ▁more ▁miss ▁than ▁hit .	0 0 1 1 1 1 0 0 0 0 0 0 0 0	PRON VERB VERB CCONJ VERB VERB CCONJ PRON VERB ADV ADJ ADP VERB VERB
He says the basic idea is if you understand what's going wrong then you can design any therapy sensibly not on the hit and miss basis it's been done in the past.	0 0 0 0 0 0 0 0 0 0 0 0 0 0 0 0 0 0 0 0 0 0 1 1 1 0 0 0 0 0 0 0	hit and miss	figurative	identical	PRON VERB DET ADJ NOUN VERB ADP PRON VERB NOUN VERB ADJ ADV PRON VERB VERB DET NOUN ADV ADV ADP DET NOUN CCONJ VERB NOUN PRON VERB VERB ADP DET NOUN	▁He ▁says ▁the ▁basic ▁idea ▁is ▁if ▁you ▁understand ▁what ' s ▁going ▁wrong ▁then ▁you ▁can ▁design ▁any ▁therapy ▁sensibly ▁not ▁on ▁the ▁hit ▁and ▁miss ▁basis ▁it ' s ▁been ▁done ▁in ▁the ▁past .	0 0 0 0 0 0 0 0 0 0 0 0 0 0 0 0 0 0 0 0 0 0 0 0 1 1 1 0 0 0 0 0 0 0 0 0 0	PRON VERB DET ADJ NOUN VERB ADP PRON VERB NOUN NOUN NOUN VERB ADJ ADV PRON VERB VERB DET NOUN ADV ADV ADP DET NOUN CCONJ VERB NOUN PRON PRON PRON VERB VERB ADP DET NOUN NOUN
These appeals to distinctive class values are not hit - and - miss affairs, but are based on careful research into class preferences for particular goods and services.	0 0 0 0 0 0 0 0 1 0 1 0 1 0 0 0 0 0 0 0 0 0 0 0 0 0 0 0	hit and miss	figurative	dashes	DET NOUN PART VERB NOUN NOUN VERB ADV VERB PUNCT CCONJ PUNCT VERB NOUN CCONJ VERB VERB ADP ADJ NOUN ADP NOUN NOUN ADP ADJ NOUN CCONJ NOUN	▁These ▁appeals ▁to ▁distinctive ▁class ▁values ▁are ▁not ▁hit ▁- ▁and ▁- ▁miss ▁affairs , ▁but ▁are ▁based ▁on ▁careful ▁research ▁into ▁class ▁preferences ▁for ▁particular ▁goods ▁and ▁services .	0 0 0 0 0 0 0 0 1 0 1 0 1 0 0 0 0 0 0 0 0 0 0 0 0 0 0 0 0 0	DET NOUN PART VERB NOUN NOUN VERB ADV VERB PUNCT CCONJ PUNCT VERB NOUN NOUN CCONJ VERB VERB ADP ADJ NOUN ADP NOUN NOUN ADP ADJ NOUN CCONJ NOUN NOUN
When it did work, I was never sure what I 'd done right, and when it didn't, I was never sure what I had done wrong — it was very hit and miss.	0 0 0 0 0 0 0 0 0 0 0 0 0 0 0 0 0 0 0 0 0 0 0 0 0 0 0 0 0 0 1 1 1	hit and miss	figurative	identical	ADV PRON VERB NOUN PRON VERB ADV ADJ NOUN PRON VERB VERB ADV CCONJ ADV PRON VERB PRON VERB ADV ADJ NOUN PRON VERB VERB ADV PUNCT PRON VERB ADV VERB CCONJ VERB	▁When ▁it ▁did ▁work , ▁I ▁was ▁never ▁sure ▁what ▁I ▁' d ▁done ▁right , ▁and ▁when ▁it ▁did n ' t , ▁I ▁was ▁never ▁sure ▁what ▁I ▁had ▁done ▁wrong ▁ — ▁it ▁was ▁very ▁hit ▁and ▁miss .	0 0 0 0 0 0 0 0 0 0 0 0 0 0 0 0 0 0 0 0 0 0 0 0 0 0 0 0 0 0 0 0 0 0 0 0 0 0 1 1 1 1	ADV PRON VERB NOUN NOUN PRON VERB ADV ADJ NOUN PRON VERB VERB VERB ADV ADV CCONJ ADV PRON VERB VERB VERB VERB VERB PRON VERB ADV ADJ NOUN PRON VERB VERB ADV PUNCT PUNCT PRON VERB ADV VERB CCONJ VERB VERB
Why are the hospices and Macmillan nurses able to control pain with precision, while in general wards it is still sometimes a case of hit - and - miss?	0 0 0 0 0 0 0 0 0 0 0 0 0 0 0 0 0 0 0 0 0 0 0 0 1 0 1 0 1	hit and miss	figurative	dashes	ADV VERB DET NOUN CCONJ PROPN NOUN ADJ PART VERB NOUN ADP NOUN ADP ADP ADJ NOUN PRON VERB ADV ADV DET NOUN ADP NOUN PUNCT CCONJ PUNCT VERB	▁Why ▁are ▁the ▁ho spice s ▁and ▁Mac m illan ▁nurses ▁able ▁to ▁control ▁pain ▁with ▁precision , ▁while ▁in ▁general ▁ward s ▁it ▁is ▁still ▁sometimes ▁a ▁case ▁of ▁hit ▁- ▁and ▁- ▁miss ?	0 0 0 0 0 0 0 0 0 0 0 0 0 0 0 0 0 0 0 0 0 0 0 0 0 0 0 0 0 0 1 0 1 0 1 1	ADV VERB DET NOUN NOUN NOUN CCONJ PROPN PROPN PROPN NOUN ADJ PART VERB NOUN ADP NOUN NOUN ADP ADP ADJ NOUN NOUN PRON VERB ADV ADV DET NOUN ADP NOUN PUNCT CCONJ PUNCT VERB VERB
Some local authorities are arranging for pick - ups, but it is still a very hit and miss affair.	0 0 0 0 0 0 0 0 0 0 0 0 0 0 0 1 1 1 0	hit and miss	figurative	identical	DET ADJ NOUN VERB VERB ADP NOUN PUNCT NOUN CCONJ PRON VERB ADV DET ADV ADJ CCONJ VERB NOUN	▁Some ▁local ▁authorities ▁are ▁arranging ▁for ▁pick ▁- ▁up s , ▁but ▁it ▁is ▁still ▁a ▁very ▁hit ▁and ▁miss ▁affair .	0 0 0 0 0 0 0 0 0 0 0 0 0 0 0 0 0 1 1 1 0 0	DET ADJ NOUN VERB VERB ADP NOUN PUNCT NOUN NOUN NOUN CCONJ PRON VERB ADV DET ADV ADJ CCONJ VERB NOUN NOUN
The legal procedure is far too clumsy and hit - and - miss.	0 0 0 0 0 0 0 0 1 0 1 0 1	hit and miss	figurative	dashes	DET ADJ NOUN VERB ADV ADV ADJ CCONJ VERB PUNCT CCONJ PUNCT VERB	▁The ▁legal ▁procedure ▁is ▁far ▁too ▁cl um sy ▁and ▁hit ▁- ▁and ▁- ▁miss .	0 0 0 0 0 0 0 0 0 0 1 0 1 0 1 1	DET ADJ NOUN VERB ADV ADV ADJ ADJ ADJ CCONJ VERB PUNCT CCONJ PUNCT VERB VERB
It won't, for example, recognize joined - up writing and even with individual letters it's so hit and miss that you can't write at any speed because you have to go back to correct all the mistakes it makes.	0 0 0 0 0 0 0 0 0 0 0 0 0 0 0 0 1 1 1 0 0 0 0 0 0 0 0 0 0 0 0 0 0 0 0 0 0 0 0	hit and miss	figurative	identical	PRON VERB ADP NOUN VERB VERB PUNCT PART NOUN CCONJ ADV ADP ADJ NOUN PRON ADV VERB CCONJ VERB ADP PRON VERB VERB ADP DET NOUN ADP PRON VERB PART VERB ADV PART VERB ADJ DET NOUN PRON VERB	▁It ▁won ' t , ▁for ▁example , ▁recognize ▁joined ▁- ▁up ▁writing ▁and ▁even ▁with ▁individual ▁letters ▁it ' s ▁so ▁hit ▁and ▁miss ▁that ▁you ▁can ' t ▁write ▁at ▁any ▁speed ▁because ▁you ▁have ▁to ▁go ▁back ▁to ▁correct ▁all ▁the ▁mistakes ▁it ▁makes .	0 0 0 0 0 0 0 0 0 0 0 0 0 0 0 0 0 0 0 0 0 0 1 1 1 0 0 0 0 0 0 0 0 0 0 0 0 0 0 0 0 0 0 0 0 0 0 0	PRON VERB VERB VERB VERB ADP NOUN NOUN VERB VERB PUNCT PART NOUN CCONJ ADV ADP ADJ NOUN PRON PRON PRON ADV VERB CCONJ VERB ADP PRON VERB VERB VERB VERB ADP DET NOUN ADP PRON VERB PART VERB ADV PART VERB ADJ DET NOUN PRON VERB VERB
Quite often though, through various hit - and - miss applications, he would get one of the engines running.	0 0 0 0 0 1 0 1 0 1 0 0 0 0 0 0 0 0 0	hit and miss	figurative	dashes	ADV ADV ADV ADP ADJ NOUN PUNCT CCONJ PUNCT VERB NOUN PRON VERB VERB NUM ADP DET NOUN VERB	▁Quit e ▁often ▁though , ▁through ▁various ▁hit ▁- ▁and ▁- ▁miss ▁applications , ▁he ▁would ▁get ▁one ▁of ▁the ▁engines ▁running .	0 0 0 0 0 0 0 1 0 1 0 1 0 0 0 0 0 0 0 0 0 0 0	ADV ADV ADV ADV ADV ADP ADJ NOUN PUNCT CCONJ PUNCT VERB NOUN NOUN PRON VERB VERB NUM ADP DET NOUN VERB VERB
The jokes are copious, hit - and - miss and very broad ( the credits include a ' collapsing dunny specialist ' ) : we 're in Life of Brian territory, which may be more congenial here than in America, where the film failed to reproduce its massive success on home turf.	0 0 0 0 1 0 1 0 1 0 0 0 0 0 0 0 0 0 0 0 0 0 0 0 0 0 0 0 0 0 0 0 0 0 0 0 0 0 0 0 0 0 0 0 0 0 0 0 0 0 0 0	hit and miss	figurative	dashes	DET NOUN VERB ADJ VERB PUNCT CCONJ PUNCT VERB CCONJ ADV ADJ PUNCT DET NOUN VERB DET PUNCT VERB NOUN NOUN PUNCT PUNCT PUNCT PRON VERB ADP PROPN ADP PROPN NOUN ADJ VERB VERB ADV ADJ ADV ADP ADP PROPN ADV DET NOUN VERB PART VERB ADJ ADJ NOUN ADP NOUN NOUN	▁The ▁joke s ▁are ▁co p ious , ▁hit ▁- ▁and ▁- ▁miss ▁and ▁very ▁broad ▁( ▁the ▁credits ▁include ▁a ▁' ▁col lapsing ▁du nn y ▁specialist ▁' ▁ ) ▁ : ▁we ▁' re ▁in ▁Life ▁of ▁Brian ▁territory , ▁which ▁may ▁be ▁more ▁con gen ial ▁here ▁than ▁in ▁America , ▁where ▁the ▁film ▁failed ▁to ▁reproduce ▁its ▁massive ▁success ▁on ▁home ▁ tur f .	0 0 0 0 0 0 0 0 1 0 1 0 1 0 0 0 0 0 0 0 0 0 0 0 0 0 0 0 0 0 0 0 0 0 0 0 0 0 0 0 0 0 0 0 0 0 0 0 0 0 0 0 0 0 0 0 0 0 0 0 0 0 0 0 0 0 0 0 0	DET NOUN NOUN VERB ADJ ADJ ADJ ADJ VERB PUNCT CCONJ PUNCT VERB CCONJ ADV ADJ PUNCT DET NOUN VERB DET PUNCT VERB VERB NOUN NOUN NOUN NOUN PUNCT PUNCT PUNCT PUNCT PUNCT PRON VERB VERB ADP PROPN ADP PROPN NOUN NOUN ADJ VERB VERB ADV ADJ ADJ ADJ ADV ADP ADP PROPN PROPN ADV DET NOUN VERB PART VERB ADJ ADJ NOUN ADP NOUN NOUN NOUN NOUN NOUN
