‘ Oh, Mr Varna, I 'm so sorry … ’ she stuttered, even more horrified by her gaffe than she had been about letting a strange woman push her way into the holy of holies.	0 0 0 0 0 0 0 0 0 0 0 0 0 0 0 0 0 0 0 0 0 0 0 0 0 0 0 0 0 0 0 0 1 1 1	holy of holies	figurative	identical	PUNCT INTJ PROPN PROPN PRON VERB ADV ADJ PUNCT PUNCT PRON VERB ADV ADV ADJ ADP ADJ NOUN ADP PRON VERB VERB ADP VERB DET ADJ NOUN VERB ADJ NOUN ADP DET ADJ ADP NOUN	▁ ‘ ▁O h , ▁Mr ▁Var na , ▁I ▁' m ▁so ▁sorry ▁... ▁ ’ ▁she ▁st utter ed , ▁even ▁more ▁horr ified ▁by ▁her ▁g aff e ▁than ▁she ▁had ▁been ▁about ▁letting ▁a ▁strange ▁woman ▁push ▁her ▁way ▁into ▁the ▁holy ▁of ▁ hol ies .	0 0 0 0 0 0 0 0 0 0 0 0 0 0 0 0 0 0 0 0 0 0 0 0 0 0 0 0 0 0 0 0 0 0 0 0 0 0 0 0 0 0 0 0 0 1 1 1 1 1 1	PUNCT PUNCT INTJ INTJ INTJ PROPN PROPN PROPN PROPN PRON VERB VERB ADV ADJ PUNCT PUNCT PUNCT PRON VERB VERB VERB VERB ADV ADV ADJ ADJ ADP ADJ NOUN NOUN NOUN ADP PRON VERB VERB ADP VERB DET ADJ NOUN VERB ADJ NOUN ADP DET ADJ ADP NOUN NOUN NOUN NOUN
I knocked eventually on the door of the horse - car and, after inspection and formalities that would have done an Iron Curtain country proud, was admitted again by Ms Brown to the holy of holies.	0 0 0 0 0 0 0 0 0 0 0 0 0 0 0 0 0 0 0 0 0 0 0 0 0 0 0 0 0 0 0 0 0 1 1 1	holy of holies	figurative	identical	PRON VERB ADV ADP DET NOUN ADP DET NOUN PUNCT NOUN CCONJ ADP NOUN CCONJ NOUN ADJ VERB VERB VERB DET PROPN PROPN NOUN ADJ VERB VERB ADV ADP PROPN PROPN ADP DET ADJ ADP NOUN	▁I ▁knock ed ▁eventually ▁on ▁the ▁door ▁of ▁the ▁horse ▁- ▁car ▁and , ▁after ▁inspection ▁and ▁formalities ▁that ▁would ▁have ▁done ▁an ▁Iron ▁Curtain ▁country ▁proud , ▁was ▁admitted ▁again ▁by ▁Ms ▁Brown ▁to ▁the ▁holy ▁of ▁ hol ies .	0 0 0 0 0 0 0 0 0 0 0 0 0 0 0 0 0 0 0 0 0 0 0 0 0 0 0 0 0 0 0 0 0 0 0 0 1 1 1 1 1 1	PRON VERB VERB ADV ADP DET NOUN ADP DET NOUN PUNCT NOUN CCONJ CCONJ ADP NOUN CCONJ NOUN ADJ VERB VERB VERB DET PROPN PROPN NOUN ADJ ADJ VERB VERB ADV ADP PROPN PROPN ADP DET ADJ ADP NOUN NOUN NOUN NOUN
But any attempts by frustrated British dancers to persuade their public otherwise are hardly helped by the growing profile of Russian performers at the Royal Ballet itself, the holy of holies of English ballet.	0 0 0 0 0 0 0 0 0 0 0 0 0 0 0 0 0 0 0 0 0 0 0 0 0 0 0 0 1 1 1 0 0 0	holy of holies	figurative	identical	CCONJ DET NOUN ADP ADJ ADJ NOUN PART VERB ADJ NOUN ADV VERB ADV VERB ADP DET VERB NOUN ADP ADJ NOUN ADP DET PROPN PROPN PRON DET ADJ ADP NOUN ADP ADJ NOUN	▁But ▁any ▁attempts ▁by ▁frustrat ed ▁British ▁dance rs ▁to ▁persuade ▁their ▁public ▁otherwise ▁are ▁hardly ▁helped ▁by ▁the ▁growing ▁profile ▁of ▁Russian ▁perform ers ▁at ▁the ▁Royal ▁Ball et ▁itself , ▁the ▁holy ▁of ▁ hol ies ▁of ▁English ▁ball et .	0 0 0 0 0 0 0 0 0 0 0 0 0 0 0 0 0 0 0 0 0 0 0 0 0 0 0 0 0 0 0 0 0 1 1 1 1 1 0 0 0 0 0	CCONJ DET NOUN ADP ADJ ADJ ADJ NOUN NOUN PART VERB ADJ NOUN ADV VERB ADV VERB ADP DET VERB NOUN ADP ADJ NOUN NOUN ADP DET PROPN PROPN PROPN PRON PRON DET ADJ ADP NOUN NOUN NOUN ADP ADJ NOUN NOUN NOUN
Giscard claimed journalists did not distinguish sufficiently between fact and opinion ; ‘ shut up Elkabbach’, Marchais told a journalist portrayed as a Giscardian, who was questioning him closely ; on 10 May 1981, when Mitterrand ( finally ) won the presidential election, the crowd gathered in the revolutionary holy of holies, place de la Bastille, yelled abuse at Elkabbach.	0 0 0 0 0 0 0 0 0 0 0 0 0 0 0 0 0 0 0 0 0 0 0 0 0 0 0 0 0 0 0 0 0 0 0 0 0 0 0 0 0 0 0 0 0 0 0 0 0 1 1 1 0 0 0 0 0 0 0 0	holy of holies	figurative	identical	PROPN VERB NOUN VERB ADV VERB ADV ADP NOUN CCONJ NOUN PUNCT PUNCT NOUN PART PROPN PROPN VERB DET NOUN VERB ADP DET PROPN NOUN VERB VERB PRON ADV PUNCT ADP NUM PROPN NUM ADV PROPN PUNCT ADV PUNCT VERB DET ADJ NOUN DET NOUN VERB ADP DET ADJ NOUN ADP NOUN NOUN X X PROPN VERB NOUN ADP PROPN	▁G iscard ▁claimed ▁journalists ▁did ▁not ▁distinguish ▁sufficiently ▁between ▁fact ▁and ▁opinion ▁ ; ▁ ‘ ▁shut ▁up ▁El ka b bach ’ , ▁March ais ▁told ▁a ▁journalist ▁portray ed ▁as ▁a ▁G iscard ian , ▁who ▁was ▁question ing ▁him ▁closely ▁ ; ▁on ▁10 ▁May ▁1981, ▁when ▁Mitter rand ▁( ▁finally ▁ ) ▁won ▁the ▁presidential ▁election , ▁the ▁crowd ▁gathered ▁in ▁the ▁revolution ary ▁holy ▁of ▁ hol ies , ▁place ▁de ▁la ▁B ast ille , ▁ye lled ▁abuse ▁at ▁El ka b bach .	0 0 0 0 0 0 0 0 0 0 0 0 0 0 0 0 0 0 0 0 0 0 0 0 0 0 0 0 0 0 0 0 0 0 0 0 0 0 0 0 0 0 0 0 0 0 0 0 0 0 0 0 0 0 0 0 0 0 0 0 0 0 0 0 0 0 0 0 1 1 1 1 1 1 0 0 0 0 0 0 0 0 0 0 0 0 0 0 0 0	PROPN PROPN VERB NOUN VERB ADV VERB ADV ADP NOUN CCONJ NOUN PUNCT PUNCT PUNCT PUNCT NOUN PART PROPN PROPN PROPN PROPN PROPN PROPN PROPN PROPN VERB DET NOUN VERB VERB ADP DET PROPN PROPN PROPN PROPN NOUN VERB VERB VERB PRON ADV PUNCT PUNCT ADP NUM PROPN NUM ADV PROPN PROPN PUNCT ADV PUNCT PUNCT VERB DET ADJ NOUN NOUN DET NOUN VERB ADP DET ADJ ADJ NOUN ADP NOUN NOUN NOUN NOUN NOUN X X PROPN PROPN PROPN PROPN VERB VERB NOUN ADP PROPN PROPN PROPN PROPN PROPN
The permanent collections of the Reina Sofía opened officially on 10 September with Picasso's masterpiece as its holy of holies after its much contested transfer from the Prado in July.	0 0 0 0 0 0 0 0 0 0 0 0 0 0 0 0 0 1 1 1 0 0 0 0 0 0 0 0 0 0	holy of holies	figurative	identical	DET ADJ NOUN ADP DET PROPN PROPN VERB ADV ADP NUM PROPN ADP PROPN NOUN ADP ADJ ADJ ADP NOUN ADP ADJ ADJ VERB NOUN ADP DET PROPN ADP PROPN	▁The ▁permanent ▁collection s ▁of ▁the ▁Re ina ▁S of ía ▁opened ▁officially ▁on ▁10 ▁September ▁with ▁P ic asso ' s ▁master piece ▁as ▁its ▁holy ▁of ▁ hol ies ▁after ▁its ▁much ▁contested ▁transfer ▁from ▁the ▁Prad o ▁in ▁July .	0 0 0 0 0 0 0 0 0 0 0 0 0 0 0 0 0 0 0 0 0 0 0 0 0 0 1 1 1 1 1 0 0 0 0 0 0 0 0 0 0 0 0	DET ADJ NOUN NOUN ADP DET PROPN PROPN PROPN PROPN PROPN VERB ADV ADP NUM PROPN ADP PROPN PROPN PROPN PROPN PROPN NOUN NOUN ADP ADJ ADJ ADP NOUN NOUN NOUN ADP ADJ ADJ VERB NOUN ADP DET PROPN PROPN ADP PROPN PROPN
The patronesses of Almack's, Lady Castlereagh, Lady Jersey, Lady Cowper, Lady Sefton, Mrs Drummond Burrell, Princess Esterhazy and the Countess Lieven, accepted her entry into the holy of holies without question.	0 0 0 0 0 0 0 0 0 0 0 0 0 0 0 0 0 0 0 0 0 0 0 0 0 0 1 1 1 0 0	holy of holies	figurative	identical	DET NOUN ADP PROPN PROPN PROPN PROPN PROPN PROPN PROPN PROPN PROPN PROPN PROPN PROPN PROPN PROPN CCONJ DET PROPN PROPN VERB ADJ NOUN ADP DET ADJ ADP NOUN ADP NOUN	▁The ▁pat ro nesses ▁of ▁Al m ack ' s , ▁Lady ▁Castle re agh , ▁Lady ▁Jersey , ▁Lady ▁C ow per , ▁Lady ▁S ef ton , ▁Mrs ▁D rum mond ▁Bur re ll , ▁Prince s s ▁E ster haz y ▁and ▁the ▁Coun tes s ▁Li even , ▁accepted ▁her ▁entry ▁into ▁the ▁holy ▁of ▁ hol ies ▁without ▁question .	0 0 0 0 0 0 0 0 0 0 0 0 0 0 0 0 0 0 0 0 0 0 0 0 0 0 0 0 0 0 0 0 0 0 0 0 0 0 0 0 0 0 0 0 0 0 0 0 0 0 0 0 0 0 0 0 0 1 1 1 1 1 0 0 0	DET NOUN NOUN NOUN ADP PROPN PROPN PROPN PROPN PROPN PROPN PROPN PROPN PROPN PROPN PROPN PROPN PROPN PROPN PROPN PROPN PROPN PROPN PROPN PROPN PROPN PROPN PROPN PROPN PROPN PROPN PROPN PROPN PROPN PROPN PROPN PROPN PROPN PROPN PROPN PROPN PROPN PROPN PROPN CCONJ DET PROPN PROPN PROPN PROPN PROPN PROPN VERB ADJ NOUN ADP DET ADJ ADP NOUN NOUN NOUN ADP NOUN NOUN
