‘ Are acts of God designed to show us just how mortal we really are?’	0 0 1 1 1 0 0 0 0 0 0 0 0 0 0	act of god	figurative	inflection	PUNCT VERB NOUN ADP PROPN VERB PART VERB PRON ADV ADV ADJ PRON ADV VERB
He was sufficiently well - informed to be able to declare that it was a scandal that the town lacked any kind of orchestra, whereas Clara would have taken the lack of it as a simple act of God.	0 0 0 0 0 0 0 0 0 0 0 0 0 0 0 0 0 0 0 0 0 0 0 0 0 0 0 0 0 0 0 0 0 0 0 0 1 1 1	act of god	figurative	identical	PRON VERB ADV ADV PUNCT VERB PART VERB ADJ PART VERB ADP PRON VERB DET NOUN ADP DET NOUN VERB DET NOUN ADP NOUN ADP PROPN VERB VERB VERB DET NOUN ADP PRON ADP DET ADJ NOUN ADP PROPN
Instead of the Roman damnum fatalis, the common law carved out exceptions for inherent defects or vices of the goods, shipper's contributory negligence, and acts of God or of the King's enemies.	0 0 0 0 0 0 0 0 0 0 0 0 0 0 0 0 0 0 0 0 0 0 0 0 1 1 1 0 0 0 0 0	act of god	figurative	inflection	ADV ADP DET ADJ NOUN NOUN DET ADJ NOUN VERB PART NOUN ADP ADJ NOUN CCONJ NOUN ADP DET NOUN NOUN ADJ NOUN CCONJ NOUN ADP PROPN CCONJ ADP DET PROPN NOUN
Moreover, as a result of the defences of act of God, act of a third party and statutory authority, the courts must investigate not only the reasonableness of the accumulation, but also the defendant's responsibility for its actual escape.	0 0 0 0 0 0 0 0 1 1 1 0 0 0 0 0 0 0 0 0 0 0 0 0 0 0 0 0 0 0 0 0 0 0 0 0 0 0 0	act of god	figurative	identical	ADV ADP DET NOUN ADP DET NOUN ADP NOUN ADP PROPN NOUN ADP DET ADJ NOUN CCONJ ADJ NOUN DET NOUN VERB VERB ADV ADV DET NOUN ADP DET NOUN CCONJ ADV DET NOUN NOUN ADP ADJ ADJ NOUN
More generally, creation has always been understood as an act of God's grace, something He could perfectly well have chosen not to do, rather than some kind of necessary mechanism through which He ensured His own existence.	0 0 0 0 0 0 0 0 0 1 1 1 0 0 0 0 0 0 0 0 0 0 0 0 0 0 0 0 0 0 0 0 0 0 0 0 0	act of god	figurative	identical	ADV ADV NOUN VERB ADV VERB VERB ADP DET NOUN ADP PROPN NOUN NOUN PRON VERB ADV ADV VERB VERB ADV PART VERB ADV ADP DET NOUN ADP ADJ NOUN ADP ADJ PRON VERB ADJ ADJ NOUN
Conversion, which emphasises the human response, would be impossible without the accompanying initiative - taking and power - enabling act of God.	0 0 0 0 0 0 0 0 0 0 0 0 0 0 0 0 0 0 0 1 1 1	act of god	figurative	identical	NOUN ADJ VERB DET ADJ NOUN VERB VERB ADJ ADP DET VERB NOUN PUNCT NOUN CCONJ NOUN PUNCT VERB NOUN ADP PROPN
A factor which could be regarded as an act of God now intervened.	0 0 0 0 0 0 0 0 1 1 1 0 0	act of god	figurative	identical	DET NOUN ADJ VERB VERB VERB ADP DET NOUN ADP PROPN ADV VERB
People should have a bit of a think : economic depression, mad - cow - disease, wars and plane - crashes were not acts of God ( force majeure ) but rather tragic consequences of human error.	0 0 0 0 0 0 0 0 0 0 0 0 0 0 0 0 0 0 0 0 0 0 0 1 1 1 0 0 0 0 0 0 0 0 0 0 0	act of god	figurative	inflection	NOUN VERB VERB DET NOUN ADP DET NOUN PUNCT ADJ NOUN ADJ PUNCT NOUN PUNCT NOUN NOUN CCONJ NOUN PUNCT NOUN VERB ADV NOUN ADP PROPN PUNCT NOUN NOUN PUNCT CCONJ ADV ADJ NOUN ADP ADJ NOUN
But it is only when we see conversion as a miraculous, radical and gracious act of God, that there is an adequate basis and motivation for church growth.	0 0 0 0 0 0 0 0 0 0 0 0 0 0 1 1 1 0 0 0 0 0 0 0 0 0 0 0	act of god	figurative	identical	CCONJ PRON VERB ADV ADV PRON VERB NOUN ADP DET ADJ ADJ CCONJ ADJ NOUN ADP PROPN ADP ADV VERB DET ADJ NOUN CCONJ NOUN ADP NOUN NOUN
Kingdom membership was only possible through an act of God.	0 0 0 0 0 0 0 1 1 1	act of god	figurative	identical	PROPN NOUN VERB ADV ADJ ADP DET NOUN ADP PROPN
The Privy Council accepted that the defences of act of God and act of third party prevent a plaintiff from succeeding in a claim based on the rule in Rylands v. Fletcher but held the defendants liable for negligence.	0 0 0 0 0 0 0 0 1 1 1 0 0 0 0 0 0 0 0 0 0 0 0 0 0 0 0 0 0 0 0 0 0 0 0 0 0 0 0	act of god	figurative	identical	DET PROPN PROPN VERB ADP DET NOUN ADP NOUN ADP PROPN CCONJ NOUN ADP ADJ NOUN VERB DET NOUN ADP VERB ADP DET NOUN VERB ADP DET NOUN ADP PROPN CCONJ PROPN CCONJ VERB DET NOUN ADJ ADP NOUN
Many others might be described as acts of God — receiving a diagnosis of multiple sclerosis, for example.	0 0 0 0 0 0 1 1 1 0 0 0 0 0 0 0 0 0	act of god	figurative	inflection	ADJ NOUN VERB VERB VERB ADP NOUN ADP PROPN PUNCT VERB DET NOUN ADP ADJ NOUN ADP NOUN
Life itself is endangered, their enemy is the elements, their tragedy derives from forces greater than they, forces of nature and vengeful acts of God.	0 0 0 0 0 0 0 0 0 0 0 0 0 0 0 0 0 0 0 0 0 0 1 1 1	act of god	figurative	inflection	NOUN PRON VERB VERB ADJ NOUN VERB DET NOUN ADJ NOUN VERB ADP NOUN ADJ ADP PRON NOUN ADP NOUN CCONJ ADJ NOUN ADP PROPN
‘ Perhaps it was an act of God.’	0 0 0 0 0 1 1 1	act of god	figurative	dashes	PUNCT ADV PRON VERB DET NOUN ADP NOUN
This is a miraculous and supernatural act of God.	0 0 0 0 0 0 1 1 1	act of god	figurative	identical	DET VERB DET ADJ CCONJ ADJ NOUN ADP PROPN
‘ Sure and wasn't it an act of God that you came at all?’	0 0 0 0 0 0 1 1 1 0 0 0 0 0	act of god	figurative	identical	PUNCT INTJ CCONJ VERB PRON DET NOUN ADP PROPN ADJ PRON VERB ADP NOUN
Where the escape is caused directly by natural causes without human intervention in ‘ circumstances which no human foresight can provide against and of which human prudence is not bound to recognise the possibility,’ the defence of act of God applies.	0 0 0 0 0 0 0 0 0 0 0 0 0 0 0 0 0 0 0 0 0 0 0 0 0 0 0 0 0 0 0 0 0 0 0 0 0 1 1 1 0	act of god	figurative	identical	ADV DET NOUN VERB VERB ADV ADP ADJ NOUN ADP ADJ NOUN ADP ADJ NOUN ADJ DET ADJ NOUN VERB VERB ADP CCONJ ADP ADJ ADJ NOUN VERB ADV VERB PART VERB DET NOUN DET NOUN ADP NOUN ADP PROPN VERB
An act of God is usually held to have been the spark which ignited Ceauşescu's ambitions as a town - planner and architect of communism and spurred him to act on them.	0 1 1 1 0 0 0 0 0 0 0 0 0 0 0 0 0 0 0 0 0 0 0 0 0 0 0 0 0 0 0 0	act of god	figurative	identical	DET NOUN ADP PROPN VERB ADV VERB PART VERB VERB DET NOUN ADJ VERB PROPN NOUN ADP DET NOUN PUNCT NOUN CCONJ NOUN ADP NOUN CCONJ VERB PRON PART VERB ADP PRON
As an act of God, Easter is not accessible to the methods of historical investigation.	0 0 1 1 1 0 0 0 0 0 0 0 0 0 0	act of god	figurative	identical	ADP DET NOUN ADP PROPN PROPN VERB ADV ADJ ADP DET NOUN ADP ADJ NOUN
A long paragraph presented the acts of God in the Bible as like a mighty drama.	0 0 0 0 0 1 1 1 0 0 0 0 0 0 0 0	act of god	figurative	inflection	DET ADJ NOUN VERB DET NOUN ADP PROPN ADP DET PROPN ADP ADP DET ADJ NOUN
Lightning, earthquakes, cloudbursts and tornadoes may be acts of God but there seems to be no English decision in which they have been involved.	0 0 0 0 0 0 0 1 1 1 0 0 0 0 0 0 0 0 0 0 0 0 0 0	act of god	figurative	inflection	NOUN NOUN NOUN CCONJ NOUN VERB VERB NOUN ADP PROPN CCONJ ADV VERB PART VERB DET ADJ NOUN ADP ADJ PRON VERB VERB VERB
act of God	1 1 1	act of god	figurative	identical	NOUN ADP PROPN
They therefore adopted the view that faith was not a work because it was an act of God rather than of the human person.	0 0 0 0 0 0 0 0 0 0 0 0 0 0 0 1 1 1 0 0 0 0 0 0	act of god	figurative	identical	PRON ADV VERB DET NOUN ADP NOUN VERB ADV DET NOUN ADP PRON VERB DET NOUN ADP PROPN ADV ADP ADP DET ADJ NOUN
‘ What I want to grieve is the old Maurice before he was laid so humiliatingly low by whatever it was — a stroke, a deprivation of oxygen, an act of God — we 'll never know.	0 0 0 0 0 0 0 0 0 0 0 0 0 0 0 0 0 0 0 0 0 0 0 0 0 0 0 0 0 1 1 1 0 0 0 0 0	act of god	figurative	identical	PUNCT NOUN PRON VERB PART VERB VERB DET ADJ PROPN ADP PRON VERB VERB ADV ADV ADJ ADP ADJ PRON VERB PUNCT DET NOUN DET NOUN ADP NOUN DET NOUN ADP PROPN PUNCT PRON VERB ADV VERB
Both in peace and in war death came to man in every guise of terror, so that insurance companies declined to provide against acts of God or the King s enemies, as if these formed a single category.	0 0 0 0 0 0 0 0 0 0 0 0 0 0 0 0 0 0 0 0 0 0 0 1 1 1 0 0 0 0 0 0 0 0 0 0 0 0	act of god	figurative	inflection	DET ADP NOUN CCONJ ADP NOUN NOUN VERB PART NOUN ADP DET NOUN ADP NOUN ADP ADP NOUN NOUN VERB PART VERB ADP NOUN ADP PROPN CCONJ DET PROPN PART NOUN ADP ADP DET VERB DET ADJ NOUN
Obviously with so many having lost their lives on the disaster, you say that you don't feel it's maybe an act of God int hat sense, that you were picked to to be saved, but erm you don't feel any guilt as such either, o that you were one of the ones and er so many others had been lost?	0 0 0 0 0 0 0 0 0 0 0 0 0 0 0 0 0 0 0 0 1 1 1 0 0 0 0 0 0 0 0 0 0 0 0 0 0 0 0 0 0 0 0 0 0 0 0 0 0 0 0 0 0 0 0 0 0 0 0 0	act of god	figurative	identical	ADV ADP ADV ADJ VERB VERB ADJ NOUN ADP DET NOUN PRON VERB ADP PRON VERB VERB PRON ADV DET NOUN ADP PROPN NOUN NOUN NOUN ADP PRON VERB VERB PART PART VERB VERB CCONJ ADV PRON VERB VERB DET NOUN ADP ADJ ADV X ADP PRON VERB NUM ADP DET NOUN CCONJ INTJ ADV ADJ NOUN VERB VERB VERB
Physical security breaches cover occurrences such as theft of equipment, and a number of what might be called ‘ acts of God’— lightning, flood or fire for instance.	0 0 0 0 0 0 0 0 0 0 0 0 0 0 0 0 0 0 0 1 1 1 0 0 0 0 0 0	act of god	figurative	combined-inflection	ADJ NOUN NOUN VERB NOUN ADJ ADP NOUN ADP NOUN CCONJ DET NOUN ADP NOUN VERB VERB VERB ADJ NOUN ADP NOUN NOUN NOUN CCONJ NOUN ADP NOUN
Aircraft accidents are not caused by ‘ acts of God’.	0 0 0 0 0 0 0 1 1 1	act of god	figurative	combined-inflection	NOUN NOUN VERB ADV VERB ADP ADJ NOUN ADP NOUN
‘ He can excuse himself by showing that the escape was owing to the plaintiff's default ; or perhaps that the escape was the consequence of vis major, or the act of God ; but as nothing of this sort exists here, it is unnecessary to inquire what excuse would be sufficient.	0 0 0 0 0 0 0 0 0 0 0 0 0 0 0 0 0 0 0 0 0 0 0 0 0 0 0 0 0 0 1 1 1 0 0 0 0 0 0 0 0 0 0 0 0 0 0 0 0 0 0 0	act of god	figurative	identical	PUNCT PRON VERB VERB PRON ADP VERB ADP DET NOUN VERB VERB ADP DET NOUN NOUN PUNCT CCONJ ADV ADP DET NOUN VERB DET NOUN ADP X ADJ CCONJ DET NOUN ADP PROPN PUNCT CCONJ ADP NOUN ADP DET NOUN VERB ADV PRON VERB ADJ PART VERB ADJ NOUN VERB VERB ADJ