Beginning from the plant size with maximum capacity Q 0, in the long run society can gain the triangle ABE by expanding plant capacity until LMC equals social marginal benefit at E. At this plant size Q 2 the price is P 1 and still lies on the short - run marginal cost curve which is now SMC 2.	0 0 0 0 0 0 0 0 0 0 1 0 1 1 0 0 0 0 0 0 0 0 0 0 0 0 0 0 0 0 0 0 0 0 0 0 0 0 0 0 0 0 0 0 0 0 0 0 0 0 0 0 0 0 0 0 0 0 0	in the long run	figurative	identical	VERB ADP DET NOUN NOUN ADP ADJ NOUN PROPN NUM ADP DET ADJ NOUN NOUN VERB VERB DET NOUN NOUN ADP VERB NOUN NOUN ADP PROPN VERB ADJ ADJ NOUN ADP PROPN ADP DET NOUN NOUN PROPN NUM DET NOUN VERB NOUN NUM CCONJ ADV VERB ADP DET ADJ PUNCT VERB ADJ NOUN NOUN ADJ VERB ADV PROPN NUM	▁Be ginning ▁from ▁the ▁plant ▁size ▁with ▁maximum ▁capacity ▁Q ▁0 , ▁in ▁the ▁long ▁run ▁society ▁can ▁gain ▁the ▁triangle ▁A BE ▁by ▁expanding ▁plant ▁capacity ▁until ▁L MC ▁equal s ▁social ▁marginal ▁benefit ▁at ▁E . ▁At ▁this ▁plant ▁size ▁Q ▁2 ▁the ▁price ▁is ▁P ▁1 ▁and ▁still ▁lies ▁on ▁the ▁short ▁- ▁run ▁marginal ▁cost ▁curve ▁which ▁is ▁now ▁S MC ▁2.	0 0 0 0 0 0 0 0 0 0 0 0 1 0 1 1 0 0 0 0 0 0 0 0 0 0 0 0 0 0 0 0 0 0 0 0 0 0 0 0 0 0 0 0 0 0 0 0 0 0 0 0 0 0 0 0 0 0 0 0 0 0 0 0 0 0	VERB VERB ADP DET NOUN NOUN ADP ADJ NOUN PROPN NUM NUM ADP DET ADJ NOUN NOUN VERB VERB DET NOUN NOUN NOUN ADP VERB NOUN NOUN ADP PROPN PROPN VERB VERB ADJ ADJ NOUN ADP PROPN PROPN ADP DET NOUN NOUN PROPN NUM DET NOUN VERB NOUN NUM CCONJ ADV VERB ADP DET ADJ PUNCT VERB ADJ NOUN NOUN ADJ VERB ADV PROPN PROPN NUM
Yes, it used to be two and a half times the wage and in the long run rather than mess about taking the house off them	0 0 0 0 0 0 0 0 0 0 0 0 0 1 0 1 1 0 0 0 0 0 0 0 0 0	in the long run	figurative	identical	INTJ PRON VERB PART VERB NUM CCONJ DET NOUN NOUN DET NOUN CCONJ ADP DET ADJ NOUN ADV ADP NOUN ADP VERB DET NOUN ADP PRON	▁Yes , ▁it ▁used ▁to ▁be ▁two ▁and ▁a ▁half ▁times ▁the ▁wage ▁and ▁in ▁the ▁long ▁run ▁rather ▁than ▁me s s ▁about ▁taking ▁the ▁house ▁off ▁them	0 0 0 0 0 0 0 0 0 0 0 0 0 0 1 0 1 1 0 0 0 0 0 0 0 0 0 0 0	INTJ INTJ PRON VERB PART VERB NUM CCONJ DET NOUN NOUN DET NOUN CCONJ ADP DET ADJ NOUN ADV ADP NOUN NOUN NOUN ADP VERB DET NOUN ADP PRON
But, to balance the budget in the long run, either taxes have to go up or spending has to go down relative to some baseline, or both.	0 0 0 0 0 1 0 1 1 0 0 0 0 0 0 0 0 0 0 0 0 0 0 0 0 0 0	in the long run	figurative	identical	CCONJ PART VERB DET NOUN ADP DET ADJ NOUN CCONJ NOUN VERB PART VERB PART CCONJ NOUN VERB PART VERB ADV ADJ ADP DET NOUN CCONJ DET	▁But , ▁to ▁balance ▁the ▁budget ▁in ▁the ▁long ▁run , ▁either ▁taxes ▁have ▁to ▁go ▁up ▁or ▁spending ▁has ▁to ▁go ▁down ▁relative ▁to ▁some ▁baseline , ▁or ▁both .	0 0 0 0 0 0 1 0 1 1 1 0 0 0 0 0 0 0 0 0 0 0 0 0 0 0 0 0 0 0 0	CCONJ CCONJ PART VERB DET NOUN ADP DET ADJ NOUN NOUN CCONJ NOUN VERB PART VERB PART CCONJ NOUN VERB PART VERB ADV ADJ ADP DET NOUN NOUN CCONJ DET DET
On the other hand there may be industries within the national economy in which enterprises stand to be progressively undercut by their international competitors in the long run.	0 0 0 0 0 0 0 0 0 0 0 0 0 0 0 0 0 0 0 0 0 0 0 0 1 0 1 1	in the long run	figurative	identical	ADP DET ADJ NOUN ADV VERB VERB NOUN ADP DET ADJ NOUN ADP ADJ NOUN VERB PART VERB ADV ADJ ADP ADJ ADJ NOUN ADP DET ADJ NOUN	▁On ▁the ▁other ▁hand ▁there ▁may ▁be ▁industries ▁within ▁the ▁national ▁economy ▁in ▁which ▁enterprises ▁stand ▁to ▁be ▁progressively ▁undercut ▁by ▁their ▁international ▁competitors ▁in ▁the ▁long ▁run .	0 0 0 0 0 0 0 0 0 0 0 0 0 0 0 0 0 0 0 0 0 0 0 0 1 0 1 1 1	ADP DET ADJ NOUN ADV VERB VERB NOUN ADP DET ADJ NOUN ADP ADJ NOUN VERB PART VERB ADV ADJ ADP ADJ ADJ NOUN ADP DET ADJ NOUN NOUN
They do not understand how they are harming earnings in the long run.	0 0 0 0 0 0 0 0 0 1 0 1 1	in the long run	figurative	identical	PRON VERB ADV VERB ADV PRON VERB VERB NOUN ADP DET ADJ NOUN	▁They ▁do ▁not ▁understand ▁how ▁they ▁are ▁harm ing ▁earnings ▁in ▁the ▁long ▁run .	0 0 0 0 0 0 0 0 0 0 1 0 1 1 1	PRON VERB ADV VERB ADV PRON VERB VERB VERB NOUN ADP DET ADJ NOUN NOUN
It is only in the long run that a match gradually emerges between what is seen to happen and what is said to happen.	0 0 0 1 0 1 1 0 0 0 0 0 0 0 0 0 0 0 0 0 0 0 0 0	in the long run	figurative	identical	PRON VERB ADV ADP DET ADJ NOUN ADP DET NOUN ADV VERB ADP NOUN VERB VERB PART VERB CCONJ NOUN VERB VERB PART VERB	▁It ▁is ▁only ▁in ▁the ▁long ▁run ▁that ▁a ▁match ▁gradually ▁emerges ▁between ▁what ▁is ▁seen ▁to ▁happen ▁and ▁what ▁is ▁said ▁to ▁happen .	0 0 0 1 0 1 1 0 0 0 0 0 0 0 0 0 0 0 0 0 0 0 0 0 0	PRON VERB ADV ADP DET ADJ NOUN ADP DET NOUN ADV VERB ADP NOUN VERB VERB PART VERB CCONJ NOUN VERB VERB PART VERB VERB
If your household is likely to expand in any way it might be cheaper in the long run to buy a larger model than the more modest affair you had thought of first.	0 0 0 0 0 0 0 0 0 0 0 0 0 0 1 0 1 1 0 0 0 0 0 0 0 0 0 0 0 0 0 0 0	in the long run	figurative	identical	ADP ADJ NOUN VERB ADJ PART VERB ADP DET NOUN PRON VERB VERB ADJ ADP DET ADJ NOUN PART VERB DET ADJ NOUN ADP DET ADV ADJ NOUN PRON VERB VERB ADP ADV	▁If ▁your ▁household ▁is ▁likely ▁to ▁expand ▁in ▁any ▁way ▁it ▁might ▁be ▁cheaper ▁in ▁the ▁long ▁run ▁to ▁buy ▁a ▁larger ▁model ▁than ▁the ▁more ▁modest ▁affair ▁you ▁had ▁thought ▁of ▁first .	0 0 0 0 0 0 0 0 0 0 0 0 0 0 1 0 1 1 0 0 0 0 0 0 0 0 0 0 0 0 0 0 0 0	ADP ADJ NOUN VERB ADJ PART VERB ADP DET NOUN PRON VERB VERB ADJ ADP DET ADJ NOUN PART VERB DET ADJ NOUN ADP DET ADV ADJ NOUN PRON VERB VERB ADP ADV ADV
Thus we have Macdonald reporting on the " almost unanimous chorus of opinion that women's work as compositors is so inferior to men's that it does not pay in the long run " ( the chorus in question being from employers ) But the testimony of individual employers is far from unanimous or even consistent.	0 0 0 0 0 0 0 0 0 0 0 0 0 0 0 0 0 0 0 0 0 0 0 0 0 0 0 0 1 0 1 1 0 0 0 0 0 0 0 0 0 0 0 0 0 0 0 0 0 0 0 0 0 0 0	in the long run	figurative	identical	ADV PRON VERB PROPN VERB ADP DET PUNCT ADV ADJ NOUN ADP NOUN ADP NOUN NOUN ADP NOUN VERB ADV ADJ ADP NOUN ADP PRON VERB ADV VERB ADP DET ADJ NOUN PUNCT PUNCT DET NOUN ADP NOUN VERB ADP NOUN PUNCT CCONJ DET NOUN ADP ADJ NOUN VERB ADV ADP ADJ CCONJ ADV ADJ	▁Thus ▁we ▁have ▁Mac don ald ▁reporting ▁on ▁the ▁" ▁almost ▁unanimous ▁ch or us ▁of ▁opinion ▁that ▁women ' s ▁work ▁as ▁comp osi tors ▁is ▁so ▁inferior ▁to ▁men ' s ▁that ▁it ▁does ▁not ▁pay ▁in ▁the ▁long ▁run ▁" ▁( ▁the ▁ch or us ▁in ▁question ▁being ▁from ▁employers ▁ ) ▁But ▁the ▁testimony ▁of ▁individual ▁employers ▁is ▁far ▁from ▁unanimous ▁or ▁even ▁consistent .	0 0 0 0 0 0 0 0 0 0 0 0 0 0 0 0 0 0 0 0 0 0 0 0 0 0 0 0 0 0 0 0 0 0 0 0 0 0 1 0 1 1 0 0 0 0 0 0 0 0 0 0 0 0 0 0 0 0 0 0 0 0 0 0 0 0 0 0 0	ADV PRON VERB PROPN PROPN PROPN VERB ADP DET PUNCT ADV ADJ NOUN NOUN NOUN ADP NOUN ADP NOUN NOUN NOUN NOUN ADP NOUN NOUN NOUN VERB ADV ADJ ADP NOUN NOUN NOUN ADP PRON VERB ADV VERB ADP DET ADJ NOUN PUNCT PUNCT DET NOUN NOUN NOUN ADP NOUN VERB ADP NOUN PUNCT PUNCT CCONJ DET NOUN ADP ADJ NOUN VERB ADV ADP ADJ CCONJ ADV ADJ ADJ
This cultural contradiction, in the long run, is the deepest challenge to the society.	0 0 0 1 0 1 1 0 0 0 0 0 0 0	in the long run	figurative	identical	DET ADJ NOUN ADP DET ADJ NOUN VERB DET ADJ NOUN ADP DET NOUN	▁This ▁cultural ▁contradiction , ▁in ▁the ▁long ▁run , ▁is ▁the ▁deep est ▁challenge ▁to ▁the ▁society .	0 0 0 0 1 0 1 1 1 0 0 0 0 0 0 0 0 0	DET ADJ NOUN NOUN ADP DET ADJ NOUN NOUN VERB DET ADJ ADJ NOUN ADP DET NOUN NOUN
" Europe and America need one ~ another - today and in the future, but in the long run, it is neither in the interest of Europe nor of America that we have to call on our American friends for help, whenever there is a fire somewhere. "	0 0 0 0 0 0 0 0 0 0 0 0 0 0 0 1 0 1 1 0 0 0 0 0 0 0 0 0 0 0 0 0 0 0 0 0 0 0 0 0 0 0 0 0 0 0 0 0	in the long run	figurative	identical	PUNCT PROPN CCONJ PROPN VERB NUM PUNCT DET PUNCT NOUN CCONJ ADP DET NOUN CCONJ ADP DET ADJ NOUN PRON VERB CCONJ ADP DET NOUN ADP PROPN CCONJ ADP PROPN ADP PRON VERB PART VERB ADP ADJ ADJ NOUN ADP NOUN ADV ADV VERB DET NOUN ADV PUNCT	▁" ▁Europe ▁and ▁America ▁need ▁one ▁ ~ ▁another ▁- ▁today ▁and ▁in ▁the ▁future , ▁but ▁in ▁the ▁long ▁run , ▁it ▁is ▁neither ▁in ▁the ▁interest ▁of ▁Europe ▁nor ▁of ▁America ▁that ▁we ▁have ▁to ▁call ▁on ▁our ▁American ▁friends ▁for ▁help , ▁whenever ▁there ▁is ▁a ▁fire ▁somewhere . ▁"	0 0 0 0 0 0 0 0 0 0 0 0 0 0 0 0 0 1 0 1 1 1 0 0 0 0 0 0 0 0 0 0 0 0 0 0 0 0 0 0 0 0 0 0 0 0 0 0 0 0 0 0 0	PUNCT PROPN CCONJ PROPN VERB NUM PUNCT PUNCT DET PUNCT NOUN CCONJ ADP DET NOUN NOUN CCONJ ADP DET ADJ NOUN NOUN PRON VERB CCONJ ADP DET NOUN ADP PROPN CCONJ ADP PROPN ADP PRON VERB PART VERB ADP ADJ ADJ NOUN ADP NOUN NOUN ADV ADV VERB DET NOUN ADV ADV PUNCT
In the long run Dulles expected the superior economic strength of the United States to ensure its success against the USSR.	1 0 1 1 0 0 0 0 0 0 0 0 0 0 0 0 0 0 0 0 0	in the long run	figurative	case	ADP DET ADJ NOUN PROPN VERB DET ADJ ADJ NOUN ADP DET PROPN PROPN PART VERB ADJ NOUN ADP DET PROPN	▁In ▁the ▁long ▁run ▁Du lle s ▁expected ▁the ▁superior ▁economic ▁strength ▁of ▁the ▁United ▁States ▁to ▁ensure ▁its ▁success ▁against ▁the ▁USSR .	1 0 1 1 0 0 0 0 0 0 0 0 0 0 0 0 0 0 0 0 0 0 0 0	ADP DET ADJ NOUN PROPN PROPN PROPN VERB DET ADJ ADJ NOUN ADP DET PROPN PROPN PART VERB ADJ NOUN ADP DET PROPN PROPN
Whether that would have been, at that time, for the benefit of the mass of the Chinese people we 're talking about erm I don't think I, I rather think that the er turn that Mao took probably in the long run, in the long term, was to the benefit of the mass of people erm the peasantry, the workers in China because I think the alternative would have been erm international exploitation.	0 0 0 0 0 0 0 0 0 0 0 0 0 0 0 0 0 0 0 0 0 0 0 0 0 0 0 0 0 0 0 0 0 0 0 0 0 0 1 0 1 1 0 0 0 0 0 0 0 0 0 0 0 0 0 0 0 0 0 0 0 0 0 0 0 0 0 0 0 0 0 0 0	in the long run	figurative	identical	ADP DET VERB VERB VERB ADP DET NOUN ADP DET NOUN ADP DET NOUN ADP DET ADJ NOUN PRON VERB VERB ADP NOUN PRON VERB VERB PRON PRON ADV VERB ADP DET INTJ NOUN ADP PROPN VERB ADV ADP DET ADJ NOUN ADP DET ADJ NOUN VERB ADP DET NOUN ADP DET NOUN ADP NOUN ADJ DET NOUN DET NOUN ADP PROPN ADP PRON VERB DET NOUN VERB VERB VERB DET ADJ NOUN	▁W hether ▁that ▁would ▁have ▁been , ▁at ▁that ▁time , ▁for ▁the ▁benefit ▁of ▁the ▁mass ▁of ▁the ▁Chinese ▁people ▁we ▁' re ▁talking ▁about ▁er m ▁I ▁don ' t ▁think ▁I , ▁I ▁rather ▁think ▁that ▁the ▁er ▁turn ▁that ▁Ma o ▁took ▁probably ▁in ▁the ▁long ▁run , ▁in ▁the ▁long ▁term , ▁was ▁to ▁the ▁benefit ▁of ▁the ▁mass ▁of ▁people ▁er m ▁the ▁peas ant ry , ▁the ▁workers ▁in ▁China ▁because ▁I ▁think ▁the ▁alternative ▁would ▁have ▁been ▁er m ▁international ▁exploitation .	0 0 0 0 0 0 0 0 0 0 0 0 0 0 0 0 0 0 0 0 0 0 0 0 0 0 0 0 0 0 0 0 0 0 0 0 0 0 0 0 0 0 0 0 0 0 0 1 0 1 1 1 0 0 0 0 0 0 0 0 0 0 0 0 0 0 0 0 0 0 0 0 0 0 0 0 0 0 0 0 0 0 0 0 0 0 0 0 0 0	ADP ADP DET VERB VERB VERB VERB ADP DET NOUN NOUN ADP DET NOUN ADP DET NOUN ADP DET ADJ NOUN PRON VERB VERB VERB ADP NOUN NOUN PRON VERB VERB VERB VERB PRON PRON PRON ADV VERB ADP DET INTJ NOUN ADP PROPN PROPN VERB ADV ADP DET ADJ NOUN NOUN ADP DET ADJ NOUN NOUN VERB ADP DET NOUN ADP DET NOUN ADP NOUN ADJ ADJ DET NOUN NOUN NOUN NOUN DET NOUN ADP PROPN ADP PRON VERB DET NOUN VERB VERB VERB DET DET ADJ NOUN NOUN
However, I believe that in the longer run, as production processes become more automated, Kaplan's activity - based costing concepts will find their main application at the stage of product design and investment selection, although they might have a wider application in service industries, such as the Health Service, and in the control of non - manufacturing costs.	0 0 0 0 1 0 1 1 0 0 0 0 0 0 0 0 0 0 0 0 0 0 0 0 0 0 0 0 0 0 0 0 0 0 0 0 0 0 0 0 0 0 0 0 0 0 0 0 0 0 0 0 0 0 0 0 0 0	in the long run	figurative	misc	ADV PRON VERB ADP ADP DET ADJ VERB ADP NOUN NOUN VERB ADV VERB PROPN NOUN PUNCT VERB NOUN NOUN VERB VERB ADJ ADJ NOUN ADP DET NOUN ADP NOUN NOUN CCONJ NOUN NOUN ADP PRON VERB VERB DET ADJ NOUN ADP NOUN NOUN ADJ ADP DET PROPN PROPN CCONJ ADP DET NOUN ADP ADJ PUNCT NOUN NOUN	▁However , ▁I ▁believe ▁that ▁in ▁the ▁longer ▁run , ▁as ▁production ▁processes ▁become ▁more ▁automated , ▁Ka plan ' s ▁activity ▁- ▁based ▁costing ▁concepts ▁will ▁find ▁their ▁main ▁application ▁at ▁the ▁stage ▁of ▁product ▁design ▁and ▁investment ▁selection , ▁although ▁they ▁might ▁have ▁a ▁wider ▁application ▁in ▁service ▁industries , ▁such ▁as ▁the ▁Health ▁Service , ▁and ▁in ▁the ▁control ▁of ▁non ▁- ▁manufacturing ▁costs .	0 0 0 0 0 1 0 1 1 1 0 0 0 0 0 0 0 0 0 0 0 0 0 0 0 0 0 0 0 0 0 0 0 0 0 0 0 0 0 0 0 0 0 0 0 0 0 0 0 0 0 0 0 0 0 0 0 0 0 0 0 0 0 0 0 0 0 0	ADV ADV PRON VERB ADP ADP DET ADJ VERB VERB ADP NOUN NOUN VERB ADV VERB VERB PROPN PROPN PROPN PROPN NOUN PUNCT VERB NOUN NOUN VERB VERB ADJ ADJ NOUN ADP DET NOUN ADP NOUN NOUN CCONJ NOUN NOUN NOUN ADP PRON VERB VERB DET ADJ NOUN ADP NOUN NOUN NOUN ADJ ADP DET PROPN PROPN PROPN CCONJ ADP DET NOUN ADP ADJ PUNCT NOUN NOUN NOUN
Th the problem with suggestion therapy whether it be hypnosis or group therapy is it doesn't tend to last in the longer run after the person stopped going to the group or they haven't seen the the er hypnotist for reinforcement.	0 0 0 0 0 0 0 0 0 0 0 0 0 0 0 0 0 0 0 1 0 1 1 0 0 0 0 0 0 0 0 0 0 0 0 0 0 0 0 0 0	in the long run	figurative	misc	VERB DET NOUN ADP NOUN NOUN ADP PRON VERB NOUN CCONJ NOUN NOUN VERB PRON VERB VERB PART VERB ADP DET ADJ VERB ADP DET NOUN VERB VERB ADP DET NOUN CCONJ PRON VERB VERB DET DET INTJ NOUN ADP NOUN	▁Th ▁the ▁problem ▁with ▁suggestion ▁therapy ▁whether ▁it ▁be ▁hyp n osis ▁or ▁group ▁therapy ▁is ▁it ▁does n ' t ▁tend ▁to ▁last ▁in ▁the ▁longer ▁run ▁after ▁the ▁person ▁stopped ▁going ▁to ▁the ▁group ▁or ▁they ▁have n ' t ▁seen ▁the ▁the ▁er ▁hyp not ist ▁for ▁reinforcement .	0 0 0 0 0 0 0 0 0 0 0 0 0 0 0 0 0 0 0 0 0 0 0 0 1 0 1 1 0 0 0 0 0 0 0 0 0 0 0 0 0 0 0 0 0 0 0 0 0 0 0 0	VERB DET NOUN ADP NOUN NOUN ADP PRON VERB NOUN NOUN NOUN CCONJ NOUN NOUN VERB PRON VERB VERB VERB VERB VERB PART VERB ADP DET ADJ VERB ADP DET NOUN VERB VERB ADP DET NOUN CCONJ PRON VERB VERB VERB VERB VERB DET DET INTJ NOUN NOUN NOUN ADP NOUN NOUN
Although Q ' ; is the socially efficient output, society can not force the monopolist to produce here in the long run.	0 0 0 0 0 0 0 0 0 0 0 0 0 0 0 0 0 0 1 0 1 1	in the long run	figurative	identical	ADP PROPN PUNCT PUNCT VERB DET ADV ADJ NOUN NOUN VERB ADV VERB DET NOUN PART VERB ADV ADP DET ADJ NOUN	▁Although ▁Q ▁' ▁ ; ▁is ▁the ▁socially ▁efficient ▁output , ▁society ▁can ▁not ▁force ▁the ▁mono pol ist ▁to ▁produce ▁here ▁in ▁the ▁long ▁run .	0 0 0 0 0 0 0 0 0 0 0 0 0 0 0 0 0 0 0 0 0 0 1 0 1 1 1	ADP PROPN PUNCT PUNCT PUNCT VERB DET ADV ADJ NOUN NOUN NOUN VERB ADV VERB DET NOUN NOUN NOUN PART VERB ADV ADP DET ADJ NOUN NOUN
Premier League is not the finished article yet, but football will benefit in long run	0 0 0 0 0 0 0 0 0 0 0 0 1 1 1	in the long run	figurative	deletion-determiner	PROPN PROPN VERB ADV DET ADJ NOUN ADV CCONJ NOUN VERB VERB ADP ADJ NOUN	▁Pre m ier ▁League ▁is ▁not ▁the ▁finished ▁article ▁yet , ▁but ▁f ootball ▁will ▁benefit ▁in ▁long ▁run	0 0 0 0 0 0 0 0 0 0 0 0 0 0 0 0 1 1 1	PROPN PROPN PROPN PROPN VERB ADV DET ADJ NOUN ADV ADV CCONJ NOUN NOUN VERB VERB ADP ADJ NOUN
There would be a challenge to the present mood of contentment with its angry resentment of any intrusion, but, in the longer run, the general feeling of security in well - being would be deepened.	0 0 0 0 0 0 0 0 0 0 0 0 0 0 0 0 0 0 0 1 0 1 1 0 0 0 0 0 0 0 0 0 0 0 0	in the long run	figurative	misc	ADV VERB VERB DET NOUN ADP DET ADJ NOUN ADP NOUN ADP ADJ ADJ NOUN ADP DET NOUN CCONJ ADP DET ADJ VERB DET ADJ NOUN ADP NOUN ADP ADV PUNCT NOUN VERB VERB VERB	▁There ▁would ▁be ▁a ▁challenge ▁to ▁the ▁present ▁mood ▁of ▁content ment ▁with ▁its ▁angry ▁resent ment ▁of ▁any ▁intrusion , ▁but , ▁in ▁the ▁longer ▁run , ▁the ▁general ▁feeling ▁of ▁security ▁in ▁well ▁- ▁being ▁would ▁be ▁deepen ed .	0 0 0 0 0 0 0 0 0 0 0 0 0 0 0 0 0 0 0 0 0 0 0 1 0 1 1 1 0 0 0 0 0 0 0 0 0 0 0 0 0 0	ADV VERB VERB DET NOUN ADP DET ADJ NOUN ADP NOUN NOUN ADP ADJ ADJ NOUN NOUN ADP DET NOUN NOUN CCONJ CCONJ ADP DET ADJ VERB VERB DET ADJ NOUN ADP NOUN ADP ADV PUNCT NOUN VERB VERB VERB VERB VERB
Of course, she would have to get off smack in the long run.	0 0 0 0 0 0 0 0 0 1 0 1 1	in the long run	figurative	identical	ADV ADV PRON VERB VERB PART VERB PART NOUN ADP DET ADJ NOUN	▁Of ▁course , ▁she ▁would ▁have ▁to ▁get ▁off ▁sm ack ▁in ▁the ▁long ▁run .	0 0 0 0 0 0 0 0 0 0 0 1 0 1 1 1	ADV ADV ADV PRON VERB VERB PART VERB PART NOUN NOUN ADP DET ADJ NOUN NOUN
This breaks up the upper crust of the snow and produces, in the long run, a piste which is firmer, and therefore better able to withstand 140 racers.	0 0 0 0 0 0 0 0 0 0 0 1 0 1 1 0 0 0 0 0 0 0 0 0 0 0 0 0	in the long run	figurative	identical	DET VERB PART DET ADJ NOUN ADP DET NOUN CCONJ VERB ADP DET ADJ NOUN DET NOUN ADJ VERB ADJ CCONJ ADV ADV ADJ PART VERB NUM NOUN	▁This ▁breaks ▁up ▁the ▁upper ▁crust ▁of ▁the ▁snow ▁and ▁produces , ▁in ▁the ▁long ▁run , ▁a ▁p ist e ▁which ▁is ▁firm er , ▁and ▁therefore ▁better ▁able ▁to ▁withstand ▁140 ▁race rs .	0 0 0 0 0 0 0 0 0 0 0 0 1 0 1 1 1 0 0 0 0 0 0 0 0 0 0 0 0 0 0 0 0 0 0 0	DET VERB PART DET ADJ NOUN ADP DET NOUN CCONJ VERB VERB ADP DET ADJ NOUN NOUN DET NOUN NOUN NOUN ADJ VERB ADJ ADJ ADJ CCONJ ADV ADV ADJ PART VERB NUM NOUN NOUN NOUN
In particular, we have shown examples where a tax on capital income may be shifted completely, and have demonstrated that in less extreme cases the effective redistribution may be very much reduced in the long run as a result of adjustments in the capital stock.	0 0 0 0 0 0 0 0 0 0 0 0 0 0 0 0 0 0 0 0 0 0 0 0 0 0 0 0 0 0 0 0 1 0 1 1 0 0 0 0 0 0 0 0 0	in the long run	figurative	identical	ADP ADJ PRON VERB VERB NOUN ADV DET NOUN ADP NOUN NOUN VERB VERB VERB ADV CCONJ VERB VERB ADP ADP ADV ADJ NOUN DET ADJ NOUN VERB VERB ADV ADV VERB ADP DET ADJ NOUN ADP DET NOUN ADP NOUN ADP DET NOUN NOUN	▁In ▁particular , ▁we ▁have ▁shown ▁examples ▁where ▁a ▁tax ▁on ▁capital ▁income ▁may ▁be ▁shifted ▁completely , ▁and ▁have ▁demonstrated ▁that ▁in ▁less ▁extreme ▁cases ▁the ▁effective ▁redistribution ▁may ▁be ▁very ▁much ▁reduced ▁in ▁the ▁long ▁run ▁as ▁a ▁result ▁of ▁adjustments ▁in ▁the ▁capital ▁stock .	0 0 0 0 0 0 0 0 0 0 0 0 0 0 0 0 0 0 0 0 0 0 0 0 0 0 0 0 0 0 0 0 0 0 1 0 1 1 0 0 0 0 0 0 0 0 0 0	ADP ADJ ADJ PRON VERB VERB NOUN ADV DET NOUN ADP NOUN NOUN VERB VERB VERB ADV ADV CCONJ VERB VERB ADP ADP ADV ADJ NOUN DET ADJ NOUN VERB VERB ADV ADV VERB ADP DET ADJ NOUN ADP DET NOUN ADP NOUN ADP DET NOUN NOUN NOUN
A government which condones and orchestrates crime, racketeering and violence as a means of alienating and isolating terrorist or political opponents from their host populations will, in the long run, pay the price of alienating itself from the general public.	0 0 0 0 0 0 0 0 0 0 0 0 0 0 0 0 0 0 0 0 0 0 0 0 0 0 1 0 1 1 0 0 0 0 0 0 0 0 0 0	in the long run	figurative	identical	DET NOUN ADJ VERB CCONJ VERB NOUN NOUN CCONJ NOUN ADP DET NOUN ADP VERB CCONJ VERB ADJ CCONJ ADJ NOUN ADP ADJ NOUN NOUN VERB ADP DET ADJ NOUN VERB DET NOUN ADP VERB PRON ADP DET ADJ NOUN	▁A ▁government ▁which ▁con don es ▁and ▁orchestra tes ▁crime , ▁ rack et eering ▁and ▁violence ▁as ▁a ▁means ▁of ▁alien ating ▁and ▁isolat ing ▁terrorist ▁or ▁political ▁opponents ▁from ▁their ▁host ▁populations ▁will , ▁in ▁the ▁long ▁run , ▁pay ▁the ▁price ▁of ▁alien ating ▁itself ▁from ▁the ▁general ▁public .	0 0 0 0 0 0 0 0 0 0 0 0 0 0 0 0 0 0 0 0 0 0 0 0 0 0 0 0 0 0 0 0 0 0 0 0 1 0 1 1 1 0 0 0 0 0 0 0 0 0 0 0 0	DET NOUN ADJ VERB VERB VERB CCONJ VERB VERB NOUN NOUN NOUN NOUN NOUN NOUN CCONJ NOUN ADP DET NOUN ADP VERB VERB CCONJ VERB VERB ADJ CCONJ ADJ NOUN ADP ADJ NOUN NOUN VERB VERB ADP DET ADJ NOUN NOUN VERB DET NOUN ADP VERB VERB PRON ADP DET ADJ NOUN NOUN
We are convinced that the philosophy which was originally intended to predominate in the post - war UK child care legislation — namely that the work of public agencies was to provide supportive services to families, part of which could include admission to care as a means ultimately of preserving family relationships in the long run — has been lost from current practice.	0 0 0 0 0 0 0 0 0 0 0 0 0 0 0 0 0 0 0 0 0 0 0 0 0 0 0 0 0 0 0 0 0 0 0 0 0 0 0 0 0 0 0 0 0 0 0 0 0 0 0 0 1 0 1 1 0 0 0 0 0 0 0	in the long run	figurative	identical	PRON VERB VERB ADP DET NOUN ADJ VERB ADV VERB PART VERB ADP DET NOUN PUNCT NOUN PROPN NOUN NOUN NOUN PUNCT ADV ADP DET NOUN ADP ADJ NOUN VERB PART VERB ADJ NOUN ADP NOUN NOUN ADP ADJ VERB VERB NOUN PART VERB ADP DET NOUN ADV ADP VERB NOUN NOUN ADP DET ADJ NOUN PUNCT VERB VERB VERB ADP ADJ NOUN	▁We ▁are ▁convinced ▁that ▁the ▁philosophy ▁which ▁was ▁originally ▁intended ▁to ▁predominate ▁in ▁the ▁post ▁- ▁war ▁UK ▁child ▁care ▁legislation ▁ — ▁namely ▁that ▁the ▁work ▁of ▁public ▁agencies ▁was ▁to ▁provide ▁supportive ▁services ▁to ▁families , ▁part ▁of ▁which ▁could ▁include ▁admission ▁to ▁care ▁as ▁a ▁means ▁ultimately ▁of ▁preserving ▁family ▁relationships ▁in ▁the ▁long ▁run ▁ — ▁has ▁been ▁lost ▁from ▁current ▁practice .	0 0 0 0 0 0 0 0 0 0 0 0 0 0 0 0 0 0 0 0 0 0 0 0 0 0 0 0 0 0 0 0 0 0 0 0 0 0 0 0 0 0 0 0 0 0 0 0 0 0 0 0 0 0 1 0 1 1 0 0 0 0 0 0 0 0 0	PRON VERB VERB ADP DET NOUN ADJ VERB ADV VERB PART VERB ADP DET NOUN PUNCT NOUN PROPN NOUN NOUN NOUN PUNCT PUNCT ADV ADP DET NOUN ADP ADJ NOUN VERB PART VERB ADJ NOUN ADP NOUN NOUN NOUN ADP ADJ VERB VERB NOUN PART VERB ADP DET NOUN ADV ADP VERB NOUN NOUN ADP DET ADJ NOUN PUNCT PUNCT VERB VERB VERB ADP ADJ NOUN NOUN
Surely, in the in the long run	0 0 0 1 0 1 1	in the long run	figurative	identical	ADV ADP DET ADP DET ADJ NOUN	▁Surely , ▁in ▁the ▁in ▁the ▁long ▁run	0 0 0 0 1 0 1 1	ADV ADV ADP DET ADP DET ADJ NOUN
