All too often, students engage in study that only results in shallow or superficial learning of the first type — for example, the rote learning of names, dates, superficial factual data and characteristics that you hold in your short - term memory just long enough to pass an examination and that are then rapidly forgotten, because they have not been internalized — perhaps because our psyches know they are not of much use in the long run.	0 0 0 0 0 0 0 0 0 0 0 0 0 0 0 0 0 0 0 0 0 0 0 0 0 0 0 0 0 0 0 0 0 0 0 0 0 0 0 0 0 0 0 0 0 0 0 0 0 0 0 0 0 0 0 0 0 0 0 0 0 0 0 0 0 0 0 0 0 0 0 0 0 1 0 1 1	in the long run	figurative	identical	ADV ADV ADV NOUN VERB ADP NOUN ADJ ADV VERB ADP ADJ CCONJ ADJ NOUN ADP DET ADJ NOUN PUNCT ADP NOUN DET ADJ NOUN ADP NOUN NOUN ADJ ADJ NOUN CCONJ NOUN ADP PRON VERB PART ADJ ADJ PUNCT NOUN NOUN ADV ADV ADV PART VERB DET NOUN CCONJ ADJ VERB ADV ADV VERB ADP PRON VERB ADV VERB VERB PUNCT ADV ADP ADJ NOUN VERB PRON VERB ADV ADP ADJ NOUN ADP DET ADJ NOUN	▁All ▁too ▁often , ▁students ▁engage ▁in ▁study ▁that ▁only ▁results ▁in ▁shall ow ▁or ▁superficial ▁learning ▁of ▁the ▁first ▁type ▁ — ▁for ▁example , ▁the ▁rot e ▁learning ▁of ▁names , ▁dates , ▁superficial ▁factual ▁data ▁and ▁characteristics ▁that ▁you ▁hold ▁in ▁your ▁short ▁- ▁term ▁memory ▁just ▁long ▁enough ▁to ▁pass ▁an ▁examination ▁and ▁that ▁are ▁then ▁rapidly ▁forgotten , ▁because ▁they ▁have ▁not ▁been ▁internal ized ▁ — ▁perhaps ▁because ▁our ▁p sy ches ▁know ▁they ▁are ▁not ▁of ▁much ▁use ▁in ▁the ▁long ▁run .	0 0 0 0 0 0 0 0 0 0 0 0 0 0 0 0 0 0 0 0 0 0 0 0 0 0 0 0 0 0 0 0 0 0 0 0 0 0 0 0 0 0 0 0 0 0 0 0 0 0 0 0 0 0 0 0 0 0 0 0 0 0 0 0 0 0 0 0 0 0 0 0 0 0 0 0 0 0 0 0 0 0 0 0 0 1 0 1 1 1	ADV ADV ADV ADV NOUN VERB ADP NOUN ADJ ADV VERB ADP ADJ ADJ CCONJ ADJ NOUN ADP DET ADJ NOUN PUNCT PUNCT ADP NOUN NOUN DET ADJ ADJ NOUN ADP NOUN NOUN NOUN NOUN ADJ ADJ NOUN CCONJ NOUN ADP PRON VERB PART ADJ ADJ PUNCT NOUN NOUN ADV ADV ADV PART VERB DET NOUN CCONJ ADJ VERB ADV ADV VERB VERB ADP PRON VERB ADV VERB VERB VERB PUNCT PUNCT ADV ADP ADJ NOUN NOUN NOUN VERB PRON VERB ADV ADP ADJ NOUN ADP DET ADJ NOUN NOUN
Even if this is small, it means that the detailed behaviour becomes totally unforecastable in the long run.	0 0 0 0 0 0 0 0 0 0 0 0 0 0 1 0 1 1	in the long run	figurative	identical	ADV ADP DET VERB ADJ PRON VERB ADP DET ADJ NOUN VERB ADV ADJ ADP DET ADJ NOUN	▁Even ▁if ▁this ▁is ▁small , ▁it ▁means ▁that ▁the ▁detailed ▁behaviour ▁becomes ▁totally ▁un fore cast able ▁in ▁the ▁long ▁run .	0 0 0 0 0 0 0 0 0 0 0 0 0 0 0 0 0 0 1 0 1 1 1	ADV ADP DET VERB ADJ ADJ PRON VERB ADP DET ADJ NOUN VERB ADV ADJ ADJ ADJ ADJ ADP DET ADJ NOUN NOUN
Since form and function are related to living things, when the information in an illustration is incorrect it can take more work in the long run to get the thing to look right.	0 0 0 0 0 0 0 0 0 0 0 0 0 0 0 0 0 0 0 0 0 0 1 0 1 1 0 0 0 0 0 0 0	in the long run	figurative	identical	ADP NOUN CCONJ NOUN VERB VERB ADP VERB NOUN ADV DET NOUN ADP DET NOUN VERB ADJ PRON VERB VERB ADJ NOUN ADP DET ADJ NOUN PART VERB DET NOUN PART VERB ADJ	▁Since ▁form ▁and ▁function ▁are ▁related ▁to ▁living ▁things , ▁when ▁the ▁information ▁in ▁an ▁illustration ▁is ▁incorrect ▁it ▁can ▁take ▁more ▁work ▁in ▁the ▁long ▁run ▁to ▁get ▁the ▁thing ▁to ▁look ▁right .	0 0 0 0 0 0 0 0 0 0 0 0 0 0 0 0 0 0 0 0 0 0 0 1 0 1 1 0 0 0 0 0 0 0 0	ADP NOUN CCONJ NOUN VERB VERB ADP VERB NOUN NOUN ADV DET NOUN ADP DET NOUN VERB ADJ PRON VERB VERB ADJ NOUN ADP DET ADJ NOUN PART VERB DET NOUN PART VERB ADJ ADJ
… our assertion is that adequate preschool provision can improve the quality of life of young children and their families ; this conviction is given further support by the evidence we have presented in this book that pre - school education will in most circumstances aid the child's development, increase his educational potential and in the long run his overall performance.	0 0 0 0 0 0 0 0 0 0 0 0 0 0 0 0 0 0 0 0 0 0 0 0 0 0 0 0 0 0 0 0 0 0 0 0 0 0 0 0 0 0 0 0 0 0 0 0 0 0 0 0 0 0 1 0 1 1 0 0 0	in the long run	figurative	identical	PUNCT ADJ NOUN VERB ADP ADJ ADJ NOUN VERB VERB DET NOUN ADP NOUN ADP ADJ NOUN CCONJ ADJ NOUN PUNCT DET NOUN VERB VERB ADJ NOUN ADP DET NOUN PRON VERB VERB ADP DET NOUN ADP ADJ PUNCT NOUN NOUN VERB ADP ADJ NOUN VERB DET NOUN NOUN VERB ADJ ADJ NOUN CCONJ ADP DET ADJ NOUN ADJ ADJ NOUN	▁... ▁our ▁assertion ▁is ▁that ▁adequate ▁pre school ▁provision ▁can ▁improve ▁the ▁quality ▁of ▁life ▁of ▁young ▁children ▁and ▁their ▁families ▁ ; ▁this ▁conviction ▁is ▁given ▁further ▁support ▁by ▁the ▁evidence ▁we ▁have ▁presented ▁in ▁this ▁book ▁that ▁pre ▁- ▁school ▁education ▁will ▁in ▁most ▁circumstances ▁aid ▁the ▁child ' s ▁development , ▁increase ▁his ▁educational ▁potential ▁and ▁in ▁the ▁long ▁run ▁his ▁overall ▁performance .	0 0 0 0 0 0 0 0 0 0 0 0 0 0 0 0 0 0 0 0 0 0 0 0 0 0 0 0 0 0 0 0 0 0 0 0 0 0 0 0 0 0 0 0 0 0 0 0 0 0 0 0 0 0 0 0 0 0 0 1 0 1 1 0 0 0 0	PUNCT ADJ NOUN VERB ADP ADJ ADJ ADJ NOUN VERB VERB DET NOUN ADP NOUN ADP ADJ NOUN CCONJ ADJ NOUN PUNCT PUNCT DET NOUN VERB VERB ADJ NOUN ADP DET NOUN PRON VERB VERB ADP DET NOUN ADP ADJ PUNCT NOUN NOUN VERB ADP ADJ NOUN VERB DET NOUN NOUN NOUN NOUN NOUN VERB ADJ ADJ NOUN CCONJ ADP DET ADJ NOUN ADJ ADJ NOUN NOUN
At all events, John was singularly successful in the long run at turning his back on everything that smacked of Anglicanism ; he alone of all the Titford brothers managed to cold - shoulder St John's church for everything except his marriage.	0 0 0 0 0 0 0 1 0 1 1 0 0 0 0 0 0 0 0 0 0 0 0 0 0 0 0 0 0 0 0 0 0 0 0 0 0 0 0 0 0 0	in the long run	figurative	identical	ADP DET NOUN PROPN VERB ADV ADJ ADP DET ADJ NOUN ADP VERB ADJ NOUN ADP NOUN ADJ VERB ADP PROPN PUNCT PRON ADV ADP ADJ DET PROPN NOUN VERB PART ADJ PUNCT NOUN PROPN PROPN NOUN ADP NOUN ADP ADJ NOUN	▁At ▁all ▁events , ▁John ▁was ▁singular ly ▁successful ▁in ▁the ▁long ▁run ▁at ▁turning ▁his ▁back ▁on ▁everything ▁that ▁sm ack ed ▁of ▁An gli can ism ▁ ; ▁he ▁alone ▁of ▁all ▁the ▁T it ford ▁brothers ▁managed ▁to ▁cold ▁- ▁shoulder ▁St ▁John ' s ▁church ▁for ▁everything ▁except ▁his ▁marriage .	0 0 0 0 0 0 0 0 0 1 0 1 1 0 0 0 0 0 0 0 0 0 0 0 0 0 0 0 0 0 0 0 0 0 0 0 0 0 0 0 0 0 0 0 0 0 0 0 0 0 0 0 0 0 0	ADP DET NOUN NOUN PROPN VERB ADV ADV ADJ ADP DET ADJ NOUN ADP VERB ADJ NOUN ADP NOUN ADJ VERB VERB VERB ADP PROPN PROPN PROPN PROPN PUNCT PUNCT PRON ADV ADP ADJ DET PROPN PROPN PROPN NOUN VERB PART ADJ PUNCT NOUN PROPN PROPN PROPN PROPN NOUN ADP NOUN ADP ADJ NOUN NOUN
This was increasingly felt as an irksome and illogical limitation as the work of the Committee progressed, and prompted a somewhat disingenuous argument in its Report that in the long run the distinction would lose significance, because computers would sweep the board, and there would be no manual records anyway — an improbable outcome.	0 0 0 0 0 0 0 0 0 0 0 0 0 0 0 0 0 0 0 0 0 0 0 0 0 0 0 1 0 1 1 0 0 0 0 0 0 0 0 0 0 0 0 0 0 0 0 0 0 0 0 0 0 0	in the long run	figurative	identical	DET VERB ADV VERB ADP DET ADJ CCONJ ADJ NOUN ADP DET NOUN ADP DET PROPN VERB CCONJ VERB DET ADV ADJ NOUN ADP ADJ PROPN ADP ADP DET ADJ NOUN DET NOUN VERB VERB NOUN ADP NOUN VERB VERB DET NOUN CCONJ ADV VERB VERB DET ADJ NOUN ADV PUNCT DET ADJ NOUN	▁This ▁was ▁increasingly ▁felt ▁as ▁an ▁ir k some ▁and ▁il logical ▁limitation ▁as ▁the ▁work ▁of ▁the ▁Committee ▁progress ed , ▁and ▁prompted ▁a ▁somewhat ▁dis ing en uous ▁argument ▁in ▁its ▁Report ▁that ▁in ▁the ▁long ▁run ▁the ▁distinction ▁would ▁lose ▁significance , ▁because ▁computers ▁would ▁sweep ▁the ▁board , ▁and ▁there ▁would ▁be ▁no ▁manual ▁records ▁anyway ▁ — ▁an ▁im pro b able ▁outcome .	0 0 0 0 0 0 0 0 0 0 0 0 0 0 0 0 0 0 0 0 0 0 0 0 0 0 0 0 0 0 0 0 0 0 0 1 0 1 1 0 0 0 0 0 0 0 0 0 0 0 0 0 0 0 0 0 0 0 0 0 0 0 0 0 0 0 0 0 0	DET VERB ADV VERB ADP DET ADJ ADJ ADJ CCONJ ADJ ADJ NOUN ADP DET NOUN ADP DET PROPN VERB VERB VERB CCONJ VERB DET ADV ADJ ADJ ADJ ADJ NOUN ADP ADJ PROPN ADP ADP DET ADJ NOUN DET NOUN VERB VERB NOUN NOUN ADP NOUN VERB VERB DET NOUN NOUN CCONJ ADV VERB VERB DET ADJ NOUN ADV PUNCT PUNCT DET ADJ ADJ ADJ ADJ NOUN NOUN
Staying on in Denmark could only bring her further pain in the long run.	0 0 0 0 0 0 0 0 0 0 1 0 1 1	in the long run	figurative	identical	VERB PART ADP PROPN VERB ADV VERB PRON ADJ NOUN ADP DET ADJ NOUN	▁Sta ying ▁on ▁in ▁Denmark ▁could ▁only ▁bring ▁her ▁further ▁pain ▁in ▁the ▁long ▁run .	0 0 0 0 0 0 0 0 0 0 0 1 0 1 1 1	VERB VERB PART ADP PROPN VERB ADV VERB PRON ADJ NOUN ADP DET ADJ NOUN NOUN
He knows that what the economy needs in the short run is different from what needs to be done to manage public debt in the long run, but he is unable to provide decisive leadership.	0 0 0 0 0 0 0 0 0 0 0 0 0 0 0 0 0 0 0 0 0 0 0 1 0 1 1 0 0 0 0 0 0 0 0	in the long run	figurative	identical	PRON VERB ADP NOUN DET NOUN VERB ADP DET ADJ NOUN VERB ADJ ADP NOUN VERB PART VERB VERB PART VERB ADJ NOUN ADP DET ADJ NOUN CCONJ PRON VERB ADJ PART VERB ADJ NOUN	▁He ▁knows ▁that ▁what ▁the ▁economy ▁needs ▁in ▁the ▁short ▁run ▁is ▁different ▁from ▁what ▁needs ▁to ▁be ▁done ▁to ▁manage ▁public ▁debt ▁in ▁the ▁long ▁run , ▁but ▁he ▁is ▁unable ▁to ▁provide ▁decisive ▁leadership .	0 0 0 0 0 0 0 0 0 0 0 0 0 0 0 0 0 0 0 0 0 0 0 1 0 1 1 1 0 0 0 0 0 0 0 0 0	PRON VERB ADP NOUN DET NOUN VERB ADP DET ADJ NOUN VERB ADJ ADP NOUN VERB PART VERB VERB PART VERB ADJ NOUN ADP DET ADJ NOUN NOUN CCONJ PRON VERB ADJ PART VERB ADJ NOUN NOUN
His views were no less radical than those of Goldwater, but his mild, self - deprecating smiling manner was, in the long run, to make him a far more formidable advocate of conservatism.	0 0 0 0 0 0 0 0 0 0 0 0 0 0 0 0 0 0 0 1 0 1 1 0 0 0 0 0 0 0 0 0 0	in the long run	figurative	identical	ADJ NOUN VERB ADV ADV ADJ ADP DET ADP PROPN CCONJ ADJ ADJ NOUN PUNCT VERB NOUN NOUN VERB ADP DET ADJ NOUN PART VERB PRON DET ADV ADV ADJ NOUN ADP NOUN	▁His ▁views ▁were ▁no ▁less ▁radical ▁than ▁those ▁of ▁Gold water , ▁but ▁his ▁mild , ▁self ▁- ▁de pre c ating ▁s mil ing ▁manner ▁was , ▁in ▁the ▁long ▁run , ▁to ▁make ▁him ▁a ▁far ▁more ▁formidable ▁advocate ▁of ▁con serv at ism .	0 0 0 0 0 0 0 0 0 0 0 0 0 0 0 0 0 0 0 0 0 0 0 0 0 0 0 0 1 0 1 1 1 0 0 0 0 0 0 0 0 0 0 0 0 0 0	ADJ NOUN VERB ADV ADV ADJ ADP DET ADP PROPN PROPN PROPN CCONJ ADJ ADJ ADJ NOUN PUNCT VERB VERB VERB VERB NOUN NOUN NOUN NOUN VERB VERB ADP DET ADJ NOUN NOUN PART VERB PRON DET ADV ADV ADJ NOUN ADP NOUN NOUN NOUN NOUN NOUN
Try not to rely on Valium — it's highly addictive and will cause more problems in the long run.	0 0 0 0 0 0 0 0 0 0 0 0 0 0 0 1 0 1 1	in the long run	figurative	identical	VERB ADV PART VERB ADP PROPN PUNCT PRON ADV ADJ CCONJ VERB VERB ADJ NOUN ADP DET ADJ NOUN	▁T ry ▁not ▁to ▁rely ▁on ▁Val ium ▁ — ▁it ' s ▁highly ▁addict ive ▁and ▁will ▁cause ▁more ▁problems ▁in ▁the ▁long ▁run .	0 0 0 0 0 0 0 0 0 0 0 0 0 0 0 0 0 0 0 0 0 1 0 1 1 1	VERB VERB ADV PART VERB ADP PROPN PROPN PUNCT PUNCT PRON PRON PRON ADV ADJ ADJ CCONJ VERB VERB ADJ NOUN ADP DET ADJ NOUN NOUN
In the long run it was to create a new ' image ' of itself which was purposely devoid of politics, as well as left - wing politics.	1 0 1 1 0 0 0 0 0 0 0 0 0 0 0 0 0 0 0 0 0 0 0 0 0 0 0 0	in the long run	figurative	case	ADP DET ADJ NOUN PRON VERB PART VERB DET ADJ PUNCT NOUN PUNCT ADP PRON ADJ VERB ADV ADJ ADP NOUN ADV ADV ADP ADJ PUNCT NOUN NOUN	▁In ▁the ▁long ▁run ▁it ▁was ▁to ▁create ▁a ▁new ▁' ▁image ▁' ▁of ▁itself ▁which ▁was ▁purpose ly ▁de void ▁of ▁politics , ▁as ▁well ▁as ▁left ▁- ▁wing ▁politics .	1 0 1 1 0 0 0 0 0 0 0 0 0 0 0 0 0 0 0 0 0 0 0 0 0 0 0 0 0 0 0 0	ADP DET ADJ NOUN PRON VERB PART VERB DET ADJ PUNCT NOUN PUNCT ADP PRON ADJ VERB ADV ADV ADJ ADJ ADP NOUN NOUN ADV ADV ADP ADJ PUNCT NOUN NOUN NOUN
While the EV figures will only be guidelines for any individual project, the expected and actual cumulative figures will converge in the long run if the method is consistently applied, maximizing the productivity of the R&D function.	0 0 0 0 0 0 0 0 0 0 0 0 0 0 0 0 0 0 0 0 1 0 1 1 0 0 0 0 0 0 0 0 0 0 0 0 0	in the long run	figurative	identical	ADP DET PROPN NOUN VERB ADV VERB NOUN ADP DET ADJ NOUN DET VERB CCONJ ADJ ADJ NOUN VERB VERB ADP DET ADJ NOUN ADP DET NOUN VERB ADV VERB VERB DET NOUN ADP DET NOUN NOUN	▁While ▁the ▁EV ▁figures ▁will ▁only ▁be ▁guidelines ▁for ▁any ▁individual ▁project , ▁the ▁expected ▁and ▁actual ▁cumulative ▁figures ▁will ▁converge ▁in ▁the ▁long ▁run ▁if ▁the ▁method ▁is ▁consistently ▁applied , ▁maximiz ing ▁the ▁productivity ▁of ▁the ▁R & D ▁function .	0 0 0 0 0 0 0 0 0 0 0 0 0 0 0 0 0 0 0 0 0 1 0 1 1 0 0 0 0 0 0 0 0 0 0 0 0 0 0 0 0 0 0	ADP DET PROPN NOUN VERB ADV VERB NOUN ADP DET ADJ NOUN NOUN DET VERB CCONJ ADJ ADJ NOUN VERB VERB ADP DET ADJ NOUN ADP DET NOUN VERB ADV VERB VERB VERB VERB DET NOUN ADP DET NOUN NOUN NOUN NOUN NOUN
In the part of the universe that we know there is a great injustice, and often the good suffer, and often the wicked prosper, and one hardly knows which of those is the more annoying ; but if you are going to have justice in the universe as a whole you have to suppose a future life to redress the balance of life here on earth, and so they say that there must be a God, and that there must be Heaven and Hell in order that in the long run there may be justice.	0 0 0 0 0 0 0 0 0 0 0 0 0 0 0 0 0 0 0 0 0 0 0 0 0 0 0 0 0 0 0 0 0 0 0 0 0 0 0 0 0 0 0 0 0 0 0 0 0 0 0 0 0 0 0 0 0 0 0 0 0 0 0 0 0 0 0 0 0 0 0 0 0 0 0 0 0 0 0 0 0 0 0 0 0 0 0 1 0 1 1 0 0 0 0	in the long run	figurative	identical	ADP DET NOUN ADP DET NOUN ADJ PRON VERB ADV VERB DET ADJ NOUN CCONJ ADV DET ADJ NOUN CCONJ ADV DET ADJ NOUN CCONJ NOUN ADV VERB ADJ ADP DET VERB DET ADV ADJ PUNCT CCONJ ADP PRON VERB VERB PART VERB NOUN ADP DET NOUN ADP DET NOUN PRON VERB PART VERB DET ADJ NOUN PART VERB DET NOUN ADP NOUN ADV ADP NOUN CCONJ ADV PRON VERB ADP ADV VERB VERB DET PROPN CCONJ ADP ADV VERB VERB PROPN CCONJ PROPN ADP NOUN ADP ADP DET ADJ NOUN ADV VERB VERB NOUN	▁In ▁the ▁part ▁of ▁the ▁uni verse ▁that ▁we ▁know ▁there ▁is ▁a ▁great ▁injustice , ▁and ▁often ▁the ▁good ▁suffer , ▁and ▁often ▁the ▁wicked ▁prosper , ▁and ▁one ▁hardly ▁knows ▁which ▁of ▁those ▁is ▁the ▁more ▁an no ying ▁ ; ▁but ▁if ▁you ▁are ▁going ▁to ▁have ▁justice ▁in ▁the ▁uni verse ▁as ▁a ▁whole ▁you ▁have ▁to ▁suppose ▁a ▁future ▁life ▁to ▁redress ▁the ▁balance ▁of ▁life ▁here ▁on ▁earth , ▁and ▁so ▁they ▁say ▁that ▁there ▁must ▁be ▁a ▁God , ▁and ▁that ▁there ▁must ▁be ▁He a ven ▁and ▁He ll ▁in ▁order ▁that ▁in ▁the ▁long ▁run ▁there ▁may ▁be ▁justice .	0 0 0 0 0 0 0 0 0 0 0 0 0 0 0 0 0 0 0 0 0 0 0 0 0 0 0 0 0 0 0 0 0 0 0 0 0 0 0 0 0 0 0 0 0 0 0 0 0 0 0 0 0 0 0 0 0 0 0 0 0 0 0 0 0 0 0 0 0 0 0 0 0 0 0 0 0 0 0 0 0 0 0 0 0 0 0 0 0 0 0 0 0 0 0 0 0 0 0 0 1 0 1 1 0 0 0 0 0	ADP DET NOUN ADP DET NOUN NOUN ADJ PRON VERB ADV VERB DET ADJ NOUN NOUN CCONJ ADV DET ADJ NOUN NOUN CCONJ ADV DET ADJ NOUN NOUN CCONJ NOUN ADV VERB ADJ ADP DET VERB DET ADV ADJ ADJ ADJ PUNCT PUNCT CCONJ ADP PRON VERB VERB PART VERB NOUN ADP DET NOUN NOUN ADP DET NOUN PRON VERB PART VERB DET ADJ NOUN PART VERB DET NOUN ADP NOUN ADV ADP NOUN NOUN CCONJ ADV PRON VERB ADP ADV VERB VERB DET PROPN PROPN CCONJ ADP ADV VERB VERB PROPN PROPN PROPN CCONJ PROPN PROPN ADP NOUN ADP ADP DET ADJ NOUN ADV VERB VERB NOUN NOUN
There is nothing in the long run that is more damaging to investment than inflation.	0 0 0 1 0 1 1 0 0 0 0 0 0 0 0	in the long run	figurative	identical	ADV VERB NOUN ADP DET ADJ NOUN ADJ VERB ADV ADJ ADP NOUN ADP NOUN	▁There ▁is ▁nothing ▁in ▁the ▁long ▁run ▁that ▁is ▁more ▁damaging ▁to ▁investment ▁than ▁inflation .	0 0 0 1 0 1 1 0 0 0 0 0 0 0 0 0	ADV VERB NOUN ADP DET ADJ NOUN ADJ VERB ADV ADJ ADP NOUN ADP NOUN NOUN
Although Congressional ~ Republicans rightly object to raising tax rates, they appear willing to raise revenue through tax reform if that is part of a deal that also includes reductions in the long - run cost of the major entitlement programs, Medicare and Social ~ Security.	0 0 0 0 0 0 0 0 0 0 0 0 0 0 0 0 0 0 0 0 0 0 0 0 0 0 0 0 0 0 1 0 1 0 1 0 0 0 0 0 0 0 0 0 0 0	in the long run	figurative	dashes	ADP ADJ PUNCT PROPN ADV VERB ADP VERB NOUN NOUN PRON VERB ADJ PART VERB NOUN ADP NOUN NOUN ADP DET VERB NOUN ADP DET NOUN ADJ ADV VERB NOUN ADP DET ADJ PUNCT NOUN NOUN ADP DET ADJ NOUN NOUN PROPN CCONJ PROPN PUNCT NOUN	▁Although ▁Congress ional ▁ ~ ▁Republic ans ▁rightly ▁object ▁to ▁raising ▁tax ▁rates , ▁they ▁appear ▁willing ▁to ▁raise ▁revenue ▁through ▁tax ▁reform ▁if ▁that ▁is ▁part ▁of ▁a ▁deal ▁that ▁also ▁includes ▁reductions ▁in ▁the ▁long ▁- ▁run ▁cost ▁of ▁the ▁major ▁entitlement ▁programs , ▁Medi care ▁and ▁Social ▁ ~ ▁Security .	0 0 0 0 0 0 0 0 0 0 0 0 0 0 0 0 0 0 0 0 0 0 0 0 0 0 0 0 0 0 0 0 0 0 1 0 1 0 1 0 0 0 0 0 0 0 0 0 0 0 0 0 0 0	ADP ADJ ADJ PUNCT PUNCT PROPN PROPN ADV VERB ADP VERB NOUN NOUN NOUN PRON VERB ADJ PART VERB NOUN ADP NOUN NOUN ADP DET VERB NOUN ADP DET NOUN ADJ ADV VERB NOUN ADP DET ADJ PUNCT NOUN NOUN ADP DET ADJ NOUN NOUN NOUN PROPN PROPN CCONJ PROPN PUNCT PUNCT NOUN NOUN
Even though the pools of workers may be somewhat segmented, there is enough overlap that it forces service - intensive industries to pay higher wages, at ~ least in the long run.	0 0 0 0 0 0 0 0 0 0 0 0 0 0 0 0 0 0 0 0 0 0 0 0 0 0 0 0 1 0 1 1	in the long run	figurative	identical	ADV ADP DET NOUN ADP NOUN VERB VERB ADV VERB ADV VERB ADJ NOUN ADP PRON VERB NOUN PUNCT ADJ NOUN PART VERB ADJ NOUN ADP PUNCT ADJ ADP DET ADJ NOUN	▁Even ▁though ▁the ▁pools ▁of ▁workers ▁may ▁be ▁somewhat ▁segment ed , ▁there ▁is ▁enough ▁overlap ▁that ▁it ▁forces ▁service ▁- ▁intensive ▁industries ▁to ▁pay ▁higher ▁wages , ▁at ▁ ~ ▁least ▁in ▁the ▁long ▁run .	0 0 0 0 0 0 0 0 0 0 0 0 0 0 0 0 0 0 0 0 0 0 0 0 0 0 0 0 0 0 0 0 1 0 1 1 1	ADV ADP DET NOUN ADP NOUN VERB VERB ADV VERB VERB VERB ADV VERB ADJ NOUN ADP PRON VERB NOUN PUNCT ADJ NOUN PART VERB ADJ NOUN NOUN ADP PUNCT PUNCT ADJ ADP DET ADJ NOUN NOUN
Their end is to secure that Parliament, or the cabinet which is indirectly appointed by Parliament, shall in the long run give effect to the will of that power which in England is the true political sovereign of the state — the majority of the electors. "	0 0 0 0 0 0 0 0 0 0 0 0 0 0 0 0 0 1 0 1 1 0 0 0 0 0 0 0 0 0 0 0 0 0 0 0 0 0 0 0 0 0 0 0 0 0 0	in the long run	figurative	identical	ADJ NOUN VERB PART VERB ADP PROPN CCONJ DET NOUN ADJ VERB ADV VERB ADP PROPN VERB ADP DET ADJ NOUN VERB NOUN ADP DET NOUN ADP DET NOUN ADJ ADP PROPN VERB DET ADJ ADJ NOUN ADP DET NOUN PUNCT DET NOUN ADP DET NOUN PUNCT	▁The ir ▁end ▁is ▁to ▁secure ▁that ▁Parliament , ▁or ▁the ▁cabinet ▁which ▁is ▁indirectly ▁appointed ▁by ▁Parliament , ▁shall ▁in ▁the ▁long ▁run ▁give ▁effect ▁to ▁the ▁will ▁of ▁that ▁power ▁which ▁in ▁England ▁is ▁the ▁true ▁political ▁sovereign ▁of ▁the ▁state ▁ — ▁the ▁majority ▁of ▁the ▁elector s . ▁"	0 0 0 0 0 0 0 0 0 0 0 0 0 0 0 0 0 0 0 0 1 0 1 1 0 0 0 0 0 0 0 0 0 0 0 0 0 0 0 0 0 0 0 0 0 0 0 0 0 0 0 0 0	ADJ ADJ NOUN VERB PART VERB ADP PROPN PROPN CCONJ DET NOUN ADJ VERB ADV VERB ADP PROPN PROPN VERB ADP DET ADJ NOUN VERB NOUN ADP DET NOUN ADP DET NOUN ADJ ADP PROPN VERB DET ADJ ADJ NOUN ADP DET NOUN PUNCT PUNCT DET NOUN ADP DET NOUN NOUN NOUN PUNCT
Economics ~ Minister Ringsdorf, SPD, did not directly demand the Finance ~ Minister's resignation but said that a co - operation were impossible in the long run.	0 0 0 0 0 0 0 0 0 0 0 0 0 0 0 0 0 0 0 0 0 0 0 1 0 1 1	in the long run	figurative	identical	NOUN PUNCT PROPN PROPN PROPN VERB ADV ADV VERB DET PROPN PUNCT PROPN NOUN CCONJ VERB ADP DET NOUN PUNCT NOUN VERB ADJ ADP DET ADJ NOUN	▁Economic s ▁ ~ ▁Minister ▁R ing s dorf , ▁SPD , ▁did ▁not ▁directly ▁demand ▁the ▁Finance ▁ ~ ▁Minister ' s ▁resignation ▁but ▁said ▁that ▁a ▁co ▁- ▁operation ▁were ▁impossible ▁in ▁the ▁long ▁run .	0 0 0 0 0 0 0 0 0 0 0 0 0 0 0 0 0 0 0 0 0 0 0 0 0 0 0 0 0 0 0 0 0 1 0 1 1 1	NOUN NOUN PUNCT PUNCT PROPN PROPN PROPN PROPN PROPN PROPN PROPN PROPN VERB ADV ADV VERB DET PROPN PUNCT PUNCT PROPN PROPN PROPN NOUN CCONJ VERB ADP DET NOUN PUNCT NOUN VERB ADJ ADP DET ADJ NOUN NOUN
Schrempp said in verbatim : " In the long run, we can not afford parasites.	0 0 0 0 0 0 1 0 1 1 0 0 0 0 0	in the long run	figurative	case	PROPN VERB ADP NOUN PUNCT PUNCT ADP DET ADJ NOUN PRON VERB ADV VERB NOUN	▁Sch rem pp ▁said ▁in ▁v erbatim ▁ : ▁" ▁In ▁the ▁long ▁run , ▁we ▁can ▁not ▁afford ▁parasites .	0 0 0 0 0 0 0 0 0 0 1 0 1 1 1 0 0 0 0 0 0	PROPN PROPN PROPN VERB ADP NOUN NOUN PUNCT PUNCT PUNCT ADP DET ADJ NOUN NOUN PRON VERB ADV VERB NOUN NOUN
Yet, in the long run, it is the latter who matter most, and their importance persists when other preoccupations turn out to be transitory.	0 1 0 1 1 0 0 0 0 0 0 0 0 0 0 0 0 0 0 0 0 0 0 0	in the long run	figurative	identical	ADV ADP DET ADJ NOUN PRON VERB DET ADJ NOUN VERB ADV CCONJ ADJ NOUN VERB ADV ADJ NOUN VERB PART PART VERB ADJ	▁Yet , ▁in ▁the ▁long ▁run , ▁it ▁is ▁the ▁latter ▁who ▁matter ▁most , ▁and ▁their ▁importance ▁persists ▁when ▁other ▁preoccupation s ▁turn ▁out ▁to ▁be ▁transit ory .	0 0 1 0 1 1 1 0 0 0 0 0 0 0 0 0 0 0 0 0 0 0 0 0 0 0 0 0 0 0	ADV ADV ADP DET ADJ NOUN NOUN PRON VERB DET ADJ NOUN VERB ADV ADV CCONJ ADJ NOUN VERB ADV ADJ NOUN NOUN VERB PART PART VERB ADJ ADJ ADJ
Organising your financial well - being, however, will prove more relaxing in the long run.	0 0 0 0 0 0 0 0 0 0 0 1 0 1 1	in the long run	figurative	identical	VERB ADJ ADJ NOUN PUNCT NOUN ADV VERB VERB ADV ADJ ADP DET ADJ NOUN	▁Organis ing ▁your ▁financial ▁well ▁- ▁being , ▁however , ▁will ▁prove ▁more ▁relax ing ▁in ▁the ▁long ▁run .	0 0 0 0 0 0 0 0 0 0 0 0 0 0 0 1 0 1 1 1	VERB VERB ADJ ADJ NOUN PUNCT NOUN NOUN ADV ADV VERB VERB ADV ADJ ADJ ADP DET ADJ NOUN NOUN
In the longer run, if Thailand is to sustain its growth rate it will need to create more jobs in higher - value - added industries.	1 0 1 1 0 0 0 0 0 0 0 0 0 0 0 0 0 0 0 0 0 0 0 0 0 0	in the long run	figurative	misc	ADP DET ADJ VERB ADP PROPN VERB PART VERB ADJ NOUN NOUN PRON VERB VERB PART VERB ADJ NOUN ADP ADJ PUNCT NOUN PUNCT VERB NOUN	▁In ▁the ▁longer ▁run , ▁if ▁Thailand ▁is ▁to ▁sustain ▁its ▁growth ▁rate ▁it ▁will ▁need ▁to ▁create ▁more ▁jobs ▁in ▁higher ▁- ▁value ▁- ▁added ▁industries .	1 0 1 1 1 0 0 0 0 0 0 0 0 0 0 0 0 0 0 0 0 0 0 0 0 0 0 0	ADP DET ADJ VERB VERB ADP PROPN VERB PART VERB ADJ NOUN NOUN PRON VERB VERB PART VERB ADJ NOUN ADP ADJ PUNCT NOUN PUNCT VERB NOUN NOUN
Although the difficult situation on the financial markets is likely to force a painful process of consolidation, industry experts are confident that this process will, in the long run, yield a strong core of new, innovative companies.	0 0 0 0 0 0 0 0 0 0 0 0 0 0 0 0 0 0 0 0 0 0 0 0 0 1 0 1 1 0 0 0 0 0 0 0 0	in the long run	figurative	identical	ADP DET ADJ NOUN ADP DET ADJ NOUN VERB ADJ PART VERB DET ADJ NOUN ADP NOUN NOUN NOUN VERB ADJ ADP DET NOUN VERB ADP DET ADJ NOUN VERB DET ADJ NOUN ADP ADJ ADJ NOUN	▁Although ▁the ▁difficult ▁situation ▁on ▁the ▁financial ▁markets ▁is ▁likely ▁to ▁force ▁a ▁painful ▁process ▁of ▁consolidation , ▁industry ▁experts ▁are ▁confident ▁that ▁this ▁process ▁will , ▁in ▁the ▁long ▁run , ▁yield ▁a ▁strong ▁core ▁of ▁new , ▁innovative ▁companies .	0 0 0 0 0 0 0 0 0 0 0 0 0 0 0 0 0 0 0 0 0 0 0 0 0 0 0 1 0 1 1 1 0 0 0 0 0 0 0 0 0 0	ADP DET ADJ NOUN ADP DET ADJ NOUN VERB ADJ PART VERB DET ADJ NOUN ADP NOUN NOUN NOUN NOUN VERB ADJ ADP DET NOUN VERB VERB ADP DET ADJ NOUN NOUN VERB DET ADJ NOUN ADP ADJ ADJ ADJ NOUN NOUN
