Mr Lamont forecasts that the economy will be growing at the rate of three per cent per year in 12 months ' time ; he would have carried more conviction, if he had not made the same ‘ jam tomorrow’ forecast a year ago.	0 0 0 0 0 0 0 0 0 0 0 0 0 0 0 0 0 0 0 0 0 0 0 0 0 0 0 0 0 0 0 0 0 0 0 0 0 0 1 1 0 0 0 0	jam tomorrow	figurative	dashes	PROPN PROPN VERB ADP DET NOUN VERB VERB VERB ADP DET NOUN ADP NUM NOUN NOUN ADP NOUN ADP NUM NOUN PART NOUN PUNCT PRON VERB VERB VERB ADJ NOUN ADP PRON VERB ADV VERB DET ADJ NUM NOUN NOUN VERB DET NOUN ADV	▁Mr ▁La mont ▁forecasts ▁that ▁the ▁economy ▁will ▁be ▁growing ▁at ▁the ▁rate ▁of ▁three ▁per ▁cent ▁per ▁year ▁in ▁12 ▁months ▁' ▁time ▁ ; ▁he ▁would ▁have ▁carried ▁more ▁conviction , ▁if ▁he ▁had ▁not ▁made ▁the ▁same ▁ ‘ ▁ jam ▁tomorrow ’ ▁forecast ▁a ▁year ▁ago .	0 0 0 0 0 0 0 0 0 0 0 0 0 0 0 0 0 0 0 0 0 0 0 0 0 0 0 0 0 0 0 0 0 0 0 0 0 0 0 0 0 0 1 1 1 1 0 0 0 0 0	PROPN PROPN PROPN VERB ADP DET NOUN VERB VERB VERB ADP DET NOUN ADP NUM NOUN NOUN ADP NOUN ADP NUM NOUN PART NOUN PUNCT PUNCT PRON VERB VERB VERB ADJ NOUN NOUN ADP PRON VERB ADV VERB DET ADJ NUM NUM NOUN NOUN NOUN NOUN VERB DET NOUN ADV ADV
Reports from London continued to promise " jam tomorrow ", but never " jam today ".	0 0 0 0 0 0 0 1 1 0 0 0 0 0 0 0	jam tomorrow	figurative	identical	NOUN ADP PROPN VERB PART VERB PUNCT NOUN NOUN PUNCT CCONJ ADV PUNCT NOUN NOUN PUNCT	▁Reports ▁from ▁London ▁continued ▁to ▁promise ▁" ▁ jam ▁tomorrow ▁" , ▁but ▁never ▁" ▁ jam ▁today ▁" .	0 0 0 0 0 0 0 1 1 1 0 0 0 0 0 0 0 0 0 0	NOUN ADP PROPN VERB PART VERB PUNCT NOUN NOUN NOUN PUNCT PUNCT CCONJ ADV PUNCT NOUN NOUN NOUN PUNCT PUNCT
Jam yesterday, jam tomorrow but never jam today.	0 0 1 1 0 0 0 0	jam tomorrow	figurative	identical	PROPN NOUN NOUN NOUN CCONJ ADV NOUN NOUN	▁ Jam ▁yesterday , ▁ jam ▁tomorrow ▁but ▁never ▁ jam ▁today .	0 0 0 0 1 1 1 0 0 0 0 0 0	PROPN PROPN NOUN NOUN NOUN NOUN NOUN CCONJ ADV NOUN NOUN NOUN NOUN
Lord Marshall had once said about the old Magnox stations that, even if they weren't economic now, there would still be ‘ jam tomorrow’.	0 0 0 0 0 0 0 0 0 0 0 0 0 0 0 0 0 0 0 0 0 0 1 1	jam tomorrow	figurative	dashes	PROPN PROPN VERB ADV VERB ADP DET ADJ PROPN NOUN ADP ADV ADP PRON VERB ADJ ADV ADV VERB ADV VERB NUM NOUN NOUN	▁Lord ▁Marshall ▁had ▁once ▁said ▁about ▁the ▁old ▁Magn ox ▁stations ▁that , ▁even ▁if ▁they ▁were n ' t ▁economic ▁now , ▁there ▁would ▁still ▁be ▁ ‘ ▁ jam ▁tomorrow ’ .	0 0 0 0 0 0 0 0 0 0 0 0 0 0 0 0 0 0 0 0 0 0 0 0 0 0 0 0 0 1 1 1 1 1	PROPN PROPN VERB ADV VERB ADP DET ADJ PROPN PROPN NOUN ADP ADP ADV ADP PRON VERB VERB VERB VERB ADJ ADV ADV ADV VERB ADV VERB NUM NUM NOUN NOUN NOUN NOUN NOUN
But a promise of jam tomorrow wasn't enough to satisfy the Commission, which issued a Reasoned Opinion against the UK's implementation of the Drinking Water Directive in April.	0 0 0 0 1 1 0 0 0 0 0 0 0 0 0 0 0 0 0 0 0 0 0 0 0 0 0 0	jam tomorrow	figurative	identical	CCONJ DET NOUN ADP NOUN NOUN VERB ADJ PART VERB DET PROPN ADJ VERB DET PROPN PROPN ADP DET PROPN NOUN ADP DET PROPN PROPN PROPN ADP PROPN	▁But ▁a ▁promise ▁of ▁ jam ▁tomorrow ▁was n ' t ▁enough ▁to ▁satisfy ▁the ▁Commission , ▁which ▁issued ▁a ▁Reason ed ▁Opinion ▁against ▁the ▁UK ' s ▁implementation ▁of ▁the ▁Dr ink ing ▁Water ▁Directive ▁in ▁April .	0 0 0 0 1 1 1 0 0 0 0 0 0 0 0 0 0 0 0 0 0 0 0 0 0 0 0 0 0 0 0 0 0 0 0 0 0 0 0	CCONJ DET NOUN ADP NOUN NOUN NOUN VERB VERB VERB VERB ADJ PART VERB DET PROPN PROPN ADJ VERB DET PROPN PROPN PROPN ADP DET PROPN PROPN PROPN NOUN ADP DET PROPN PROPN PROPN PROPN PROPN ADP PROPN PROPN
This ‘ seeing God’, a project not just for the afterlife, not just ‘ jam tomorrow’, was the high ambition of anyone who took up a penitential life.	0 0 0 0 0 0 0 0 0 0 0 0 0 0 1 1 0 0 0 0 0 0 0 0 0 0 0 0	jam tomorrow	figurative	dashes	DET ADJ VERB NOUN DET NOUN ADV ADV ADP DET NOUN ADV ADV NUM NOUN NOUN VERB DET ADJ NOUN ADP NOUN NOUN VERB PART DET ADJ NOUN	▁This ▁ ‘ ▁seeing ▁God ’ , ▁a ▁project ▁not ▁just ▁for ▁the ▁after life , ▁not ▁just ▁ ‘ ▁ jam ▁tomorrow ’ , ▁was ▁the ▁high ▁ambition ▁of ▁anyone ▁who ▁took ▁up ▁a ▁pen it ential ▁life .	0 0 0 0 0 0 0 0 0 0 0 0 0 0 0 0 0 0 0 0 1 1 1 1 1 0 0 0 0 0 0 0 0 0 0 0 0 0 0 0	DET ADJ ADJ VERB NOUN NOUN NOUN DET NOUN ADV ADV ADP DET NOUN NOUN NOUN ADV ADV NUM NUM NOUN NOUN NOUN NOUN NOUN VERB DET ADJ NOUN ADP NOUN NOUN VERB PART DET ADJ ADJ ADJ NOUN NOUN
This is because, to quote HM Treasury ( 1984, p. 14 ), ‘ jam today is worth jam tomorrow’ because, just as in the private sector, ‘ more weight is given to earlier than to later costs and benefits’.	0 0 0 0 0 0 0 0 0 0 0 0 0 0 0 0 0 1 1 0 0 0 0 0 0 0 0 0 0 0 0 0 0 0 0 0 0 0 0	jam tomorrow	figurative	dashes	DET VERB ADP PART VERB PROPN PROPN PUNCT NUM NOUN NUM PUNCT NUM NOUN NOUN VERB ADJ NOUN NOUN ADP ADV ADP ADP DET ADJ NOUN PUNCT ADJ NOUN VERB VERB ADP ADJ ADP PART ADJ NOUN CCONJ NOUN	▁This ▁is ▁because , ▁to ▁quote ▁H M ▁Treasury ▁( ▁1984, ▁p . ▁14 ▁ ), ▁ ‘ ▁ jam ▁today ▁is ▁worth ▁ jam ▁tomorrow ’ ▁because , ▁just ▁as ▁in ▁the ▁private ▁sector , ▁ ‘ ▁more ▁weight ▁is ▁given ▁to ▁earlier ▁than ▁to ▁later ▁costs ▁and ▁benefits ’ .	0 0 0 0 0 0 0 0 0 0 0 0 0 0 0 0 0 0 0 0 0 0 0 1 1 1 1 0 0 0 0 0 0 0 0 0 0 0 0 0 0 0 0 0 0 0 0 0 0 0 0 0	DET VERB ADP ADP PART VERB PROPN PROPN PROPN PUNCT NUM NOUN NOUN NUM PUNCT PUNCT NUM NUM NOUN NOUN NOUN VERB ADJ NOUN NOUN NOUN NOUN ADP ADP ADV ADP ADP DET ADJ NOUN NOUN PUNCT PUNCT ADJ NOUN VERB VERB ADP ADJ ADP PART ADJ NOUN CCONJ NOUN NOUN NOUN
Not for him the promise of jam tomorrow or a brave, new world waiting just around the next bank overdraft.	0 0 0 0 0 0 1 1 0 0 0 0 0 0 0 0 0 0 0 0	jam tomorrow	figurative	identical	ADV ADP PRON DET NOUN ADP NOUN NOUN CCONJ DET ADJ ADJ NOUN VERB ADV ADP DET ADJ NOUN NOUN	▁Not ▁for ▁him ▁the ▁promise ▁of ▁ jam ▁tomorrow ▁or ▁a ▁brave , ▁new ▁world ▁waiting ▁just ▁around ▁the ▁next ▁bank ▁over draft .	0 0 0 0 0 0 1 1 1 0 0 0 0 0 0 0 0 0 0 0 0 0 0 0	ADV ADP PRON DET NOUN ADP NOUN NOUN NOUN CCONJ DET ADJ ADJ ADJ NOUN VERB ADV ADP DET ADJ NOUN NOUN NOUN NOUN
In some circumstances delaying the sale by six or more months may produce a significantly higher price ( for example, where substantial profits growth in anticipated but not yet realised ), although the temptation of ‘ jam tomorrow’ should be resisted.	0 0 0 0 0 0 0 0 0 0 0 0 0 0 0 0 0 0 0 0 0 0 0 0 0 0 0 0 0 0 0 0 0 0 0 0 1 1 0 0 0	jam tomorrow	figurative	dashes	ADP DET NOUN VERB DET NOUN ADP NUM CCONJ ADJ NOUN VERB VERB DET ADV ADJ NOUN PUNCT ADP NOUN ADV ADJ NOUN NOUN ADP VERB CCONJ ADV ADV VERB PUNCT ADP DET NOUN ADP NUM NOUN NOUN VERB VERB VERB	▁In ▁some ▁circumstances ▁delaying ▁the ▁sale ▁by ▁six ▁or ▁more ▁months ▁may ▁produce ▁a ▁significantly ▁higher ▁price ▁( ▁for ▁example , ▁where ▁substantial ▁profits ▁growth ▁in ▁anticipated ▁but ▁not ▁yet ▁realised ▁ ), ▁although ▁the ▁temptation ▁of ▁ ‘ ▁ jam ▁tomorrow ’ ▁should ▁be ▁resist ed .	0 0 0 0 0 0 0 0 0 0 0 0 0 0 0 0 0 0 0 0 0 0 0 0 0 0 0 0 0 0 0 0 0 0 0 0 0 0 0 1 1 1 1 0 0 0 0 0	ADP DET NOUN VERB DET NOUN ADP NUM CCONJ ADJ NOUN VERB VERB DET ADV ADJ NOUN PUNCT ADP NOUN NOUN ADV ADJ NOUN NOUN ADP VERB CCONJ ADV ADV VERB PUNCT PUNCT ADP DET NOUN ADP NUM NUM NOUN NOUN NOUN NOUN VERB VERB VERB VERB VERB
