It's hard to keep your head above water if you play chess with Sergei Martyn Harris learns the secrets of a Russian atomic submarine officer	0 0 0 1 1 1 0 0 0 0 0 0 0 0 0 0 0 0 0 0 0 0 0 0 0	keep your head	figurative	identical	PRON ADJ PART VERB ADJ NOUN ADP NOUN ADP PRON VERB NOUN ADP PROPN PROPN PROPN VERB DET NOUN ADP DET ADJ ADJ NOUN NOUN
' Keep your head down! '	0 1 1 1 0 0	keep your head	literal	case	PUNCT VERB ADJ NOUN PART PUNCT
If you don't have the time or inclination, remember one thing : when you fall or are pushed onto your back, front or side, always keep your head raised as you hit the ground.	0 0 0 0 0 0 0 0 0 0 0 0 0 0 0 0 0 0 0 0 0 0 0 0 0 1 1 1 0 0 0 0 0 0	keep your head	figurative	identical	ADP PRON VERB VERB DET NOUN CCONJ NOUN VERB NUM NOUN PUNCT ADV PRON VERB CCONJ VERB VERB ADP ADJ NOUN NOUN CCONJ NOUN ADV VERB ADJ NOUN VERB ADP PRON VERB DET NOUN
Simply turn 90 degrees each way with the shoulders, concentrating on maintaining your spine angle and keeping your head steady.	0 0 0 0 0 0 0 0 0 0 0 0 0 0 0 0 1 1 1 0	keep your head	literal	inflection	ADV VERB NUM NOUN DET NOUN ADP DET NOUN VERB ADP VERB ADJ NOUN NOUN CCONJ VERB ADJ NOUN ADJ
‘ You two remember to keep your heads down.	0 0 0 0 0 1 1 1 0	keep your head	literal	inflection	PUNCT PRON NUM VERB PART VERB ADJ NOUN PART
The release of power is triggered by ( a ) keeping the knees and toes aligned throughout the backswing and ( b ) by keeping your head just inside your right foot to guard against falling into a reverse pivot.	0 0 0 0 0 0 0 0 0 0 0 0 0 0 0 0 0 0 0 0 0 0 0 0 1 1 1 0 0 0 0 0 0 0 0 0 0 0 0 0	keep your head	literal	inflection	DET NOUN ADP NOUN VERB VERB ADP PUNCT PUNCT PUNCT VERB DET NOUN CCONJ NOUN VERB ADP DET NOUN CCONJ PUNCT PUNCT PUNCT ADP VERB ADJ NOUN ADV ADP ADJ ADJ NOUN PART VERB ADP VERB ADP DET ADJ NOUN