Wouldn't it be better to let sleeping dogs lie?’	0 0 0 0 0 1 1 1 1	let sleeping dogs lie	figurative	dashes	VERB PRON VERB ADJ PART VERB VERB NOUN VERB
‘ I know, doctor, but you see I 'm all this time without pain and I think I 'll let sleeping dogs lie.	0 0 0 0 0 0 0 0 0 0 0 0 0 0 0 0 0 0 0 1 1 1 1	let sleeping dogs lie	figurative	identical	PUNCT PRON VERB NOUN CCONJ PRON VERB PRON VERB ADJ DET NOUN ADP NOUN CCONJ PRON VERB PRON VERB VERB VERB NOUN VERB
Though he never forgave me, or my mother for having helped me, both into his world and out of it, he was sufficiently my father to let sleeping dogs lie.	0 0 0 0 0 0 0 0 0 0 0 0 0 0 0 0 0 0 0 0 0 0 0 0 0 0 1 1 1 1	let sleeping dogs lie	figurative	identical	ADP PRON ADV VERB PRON CCONJ ADJ NOUN ADP VERB VERB PRON DET ADP ADJ NOUN CCONJ ADP ADP PRON PRON VERB ADV ADJ NOUN PART VERB VERB NOUN VERB
There's a ‘ chat - and - pat’ service ; staff call your hound by name, and tiptoe past your room at night so as to let sleeping dogs lie ; your dog's photograph is taken in the hotel ; the hotel manager appears for a final ‘ wave - and - wag’ ; there's a VIP service for show - winning dogs ; and a discount for families whose dogs are better behaved than the owners!	0 0 0 0 0 0 0 0 0 0 0 0 0 0 0 0 0 0 0 0 0 0 0 0 0 0 1 1 1 1 0 0 0 0 0 0 0 0 0 0 0 0 0 0 0 0 0 0 0 0 0 0 0 0 0 0 0 0 0 0 0 0 0 0 0 0 0 0 0 0 0 0 0 0 0 0 0	let sleeping dogs lie	figurative	identical	ADV DET ADJ NOUN PUNCT CCONJ PUNCT NOUN NOUN PUNCT NOUN VERB ADJ NOUN ADP NOUN CCONJ ADJ ADP ADJ NOUN ADP NOUN ADP ADP PART VERB VERB NOUN VERB PUNCT ADJ NOUN NOUN VERB VERB ADP DET NOUN PUNCT DET NOUN NOUN VERB ADP DET ADJ ADJ NOUN PUNCT CCONJ PUNCT NOUN PUNCT ADV DET NOUN NOUN ADP NOUN PUNCT VERB NOUN PUNCT CCONJ DET NOUN ADP NOUN ADJ NOUN VERB ADV VERB ADP DET NOUN
For many years, Japanese governments have taken a “ let - sleeping - dogs - lie ” approach to territorial disputes over the islands, ignoring repeated provocations by China ( and Taiwan ).	0 0 0 0 0 0 0 0 0 1 0 1 0 1 0 1 0 0 0 0 0 0 0 0 0 0 0 0 0 0 0 0 0	let sleeping dogs lie	figurative	dashes	ADP ADJ NOUN ADJ NOUN VERB VERB DET PUNCT VERB PUNCT VERB PUNCT NOUN PUNCT VERB PUNCT NOUN ADP ADJ NOUN ADP DET NOUN VERB VERB NOUN ADP PROPN PUNCT CCONJ PROPN PUNCT
It didn't occur to you to let sleeping dogs lie, if you 'll forgive the cliché?’	0 0 0 0 0 0 1 1 1 1 0 0 0 0 0 0	let sleeping dogs lie	figurative	identical	PRON VERB VERB ADP PRON PART VERB VERB NOUN VERB ADP PRON VERB VERB DET NOUN
He was quite determined to let sleeping dogs lie.	0 0 0 0 0 1 1 1 1	let sleeping dogs lie	figurative	identical	PRON VERB ADV ADJ PART VERB VERB NOUN VERB
Well all sorts, let sleeping dogs lie, the ones that underline them as I 've underlined in biro.	0 0 0 1 1 1 1 0 0 0 0 0 0 0 0 0 0 0	let sleeping dogs lie	figurative	identical	INTJ DET NOUN VERB VERB NOUN VERB DET NOUN ADJ VERB PRON ADP PRON VERB VERB ADP NOUN