Sometimes I wake early to beat the clock.	0 0 0 0 0 1 0 1	beat the clock	figurative	identical	ADV PRON VERB ADV PART VERB DET NOUN	▁Sometimes ▁I ▁wake ▁early ▁to ▁beat ▁the ▁clock .	0 0 0 0 0 1 0 1 1	ADV PRON VERB ADV PART VERB DET NOUN NOUN
Hewlett - Packard Co has managed to beat the clock on delivering its new single - chip 7100-based workstations.	0 0 0 0 0 0 0 1 0 1 0 0 0 0 0 0 0 0 0	beat the clock	figurative	identical	PROPN PUNCT PROPN PROPN VERB VERB PART VERB DET NOUN ADP VERB ADJ ADJ ADJ PUNCT NOUN NUM NOUN	▁He wl ett ▁- ▁Pack ard ▁Co ▁has ▁managed ▁to ▁beat ▁the ▁clock ▁on ▁delivering ▁its ▁new ▁single ▁- ▁ chip ▁7 100 - based ▁workstations .	0 0 0 0 0 0 0 0 0 0 1 0 1 0 0 0 0 0 0 0 0 0 0 0 0 0 0	PROPN PROPN PROPN PUNCT PROPN PROPN PROPN VERB VERB PART VERB DET NOUN ADP VERB ADJ ADJ ADJ PUNCT NOUN NOUN NUM NUM NUM NUM NOUN NOUN
10.28:Persuaded P to get dressed and beat the clock — 3½ minutes, then back to coaxing him to finish some colouring.	0 0 0 0 0 0 1 0 1 0 0 0 0 0 0 0 0 0 0 0 0	beat the clock	figurative	identical	VERB NOUN PART VERB VERB CCONJ VERB DET NOUN PUNCT NUM NOUN ADV ADV ADP VERB PRON PART VERB DET NOUN	▁10 .28 : Per su ad ed ▁P ▁to ▁get ▁dressed ▁and ▁beat ▁the ▁clock ▁ — ▁3 1⁄ 2 ▁minutes , ▁then ▁back ▁to ▁co ax ing ▁him ▁to ▁finish ▁some ▁colouring .	0 0 0 0 0 0 0 0 0 0 0 0 1 0 1 0 0 0 0 0 0 0 0 0 0 0 0 0 0 0 0 0 0 0	VERB VERB VERB VERB VERB VERB VERB NOUN PART VERB VERB CCONJ VERB DET NOUN PUNCT PUNCT NUM NUM NUM NOUN NOUN ADV ADV ADP VERB VERB VERB PRON PART VERB DET NOUN NOUN
Secondly, it has to beat the clock.	0 0 0 0 1 0 1	beat the clock	figurative	identical	ADV PRON VERB PART VERB DET NOUN	▁Secondly , ▁it ▁has ▁to ▁beat ▁the ▁clock .	0 0 0 0 0 1 0 1 1	ADV ADV PRON VERB PART VERB DET NOUN NOUN
‘ We wouldn't have to try and beat the clock,’ she informed him, looking away, ‘ if that car of yours wasn't so slow.	0 0 0 0 0 0 0 1 0 1 0 0 0 0 0 0 0 0 0 0 0 0 0 0	beat the clock	figurative	dashes	PUNCT PRON VERB VERB PART VERB CCONJ VERB DET NOUN PRON VERB PRON VERB ADV PUNCT ADP DET NOUN ADP PRON VERB ADV ADJ	▁ ‘ ▁We ▁would n ' t ▁have ▁to ▁try ▁and ▁beat ▁the ▁clock , ’ ▁she ▁informed ▁him , ▁looking ▁away , ▁ ‘ ▁if ▁that ▁car ▁of ▁your s ▁was n ' t ▁so ▁slow .	0 0 0 0 0 0 0 0 0 0 0 1 0 1 1 1 0 0 0 0 0 0 0 0 0 0 0 0 0 0 0 0 0 0 0 0 0 0	PUNCT PUNCT PRON VERB VERB VERB VERB VERB PART VERB CCONJ VERB DET NOUN NOUN NOUN PRON VERB PRON PRON VERB ADV ADV PUNCT PUNCT ADP DET NOUN ADP PRON PRON VERB VERB VERB VERB ADV ADJ ADJ
Records look set to crash in the National after Double Silk beat the clock on his majestic winning march over the Aintree fences.	0 0 0 0 0 0 0 0 0 0 0 1 0 1 0 0 0 0 0 0 0 0 0	beat the clock	figurative	identical	NOUN VERB VERB ADP VERB ADP DET PROPN ADP PROPN PROPN VERB DET NOUN ADP ADJ ADJ NOUN NOUN ADP DET PROPN NOUN	▁Records ▁look ▁set ▁to ▁crash ▁in ▁the ▁National ▁after ▁Double ▁Silk ▁beat ▁the ▁clock ▁on ▁his ▁ma je s tic ▁winning ▁march ▁over ▁the ▁A in tre e ▁fence s .	0 0 0 0 0 0 0 0 0 0 0 1 0 1 0 0 0 0 0 0 0 0 0 0 0 0 0 0 0 0 0	NOUN VERB VERB ADP VERB ADP DET PROPN ADP PROPN PROPN VERB DET NOUN ADP ADJ ADJ ADJ ADJ ADJ NOUN NOUN ADP DET PROPN PROPN PROPN PROPN NOUN NOUN NOUN
