The shoulder belays and cricket sweaters were intended to look the part.	0 0 0 0 0 0 0 0 0 1 0 1	look the part	figurative	identical	DET NOUN NOUN CCONJ NOUN NOUN VERB VERB PART VERB DET NOUN	▁The ▁shoulder ▁be lay s ▁and ▁cri cke t ▁sweat ers ▁were ▁intended ▁to ▁look ▁the ▁part .	0 0 0 0 0 0 0 0 0 0 0 0 0 0 1 0 1 1	DET NOUN NOUN NOUN NOUN CCONJ NOUN NOUN NOUN NOUN NOUN VERB VERB PART VERB DET NOUN NOUN
I thought maybe he 'd convinced Malcolm that he was overweight — which he wasn't — and Malcolm had this real thing about us looking the part.	0 0 0 0 0 0 0 0 0 0 0 0 0 0 0 0 0 0 0 0 0 0 0 0 1 0 1	look the part	figurative	inflection	PRON VERB ADV PRON VERB VERB PROPN ADP PRON VERB ADJ PUNCT ADJ PRON VERB PUNCT CCONJ PROPN VERB DET ADJ NOUN ADP PRON VERB DET NOUN	▁I ▁thought ▁maybe ▁he ▁' d ▁convinced ▁Mal col m ▁that ▁he ▁was ▁over weight ▁ — ▁which ▁he ▁was n ' t ▁ — ▁and ▁Mal col m ▁had ▁this ▁real ▁thing ▁about ▁us ▁looking ▁the ▁part .	0 0 0 0 0 0 0 0 0 0 0 0 0 0 0 0 0 0 0 0 0 0 0 0 0 0 0 0 0 0 0 0 0 0 0 1 0 1 1	PRON VERB ADV PRON VERB VERB VERB PROPN PROPN PROPN ADP PRON VERB ADJ ADJ PUNCT PUNCT ADJ PRON VERB VERB VERB VERB PUNCT PUNCT CCONJ PROPN PROPN PROPN VERB DET ADJ NOUN ADP PRON VERB DET NOUN NOUN
It may pay to be early at Catford where Dromina Duke looks the part in the second race.	0 0 0 0 0 0 0 0 0 0 0 1 0 1 0 0 0 0	look the part	figurative	inflection	PRON VERB VERB PART VERB ADJ ADP PROPN ADV PROPN PROPN VERB DET NOUN ADP DET ADJ NOUN	▁It ▁may ▁pay ▁to ▁be ▁early ▁at ▁Cat ford ▁where ▁D rom ina ▁D uke ▁looks ▁the ▁part ▁in ▁the ▁second ▁race .	0 0 0 0 0 0 0 0 0 0 0 0 0 0 0 1 0 1 0 0 0 0 0	PRON VERB VERB PART VERB ADJ ADP PROPN PROPN ADV PROPN PROPN PROPN PROPN PROPN VERB DET NOUN ADP DET ADJ NOUN NOUN
Flowers, a surprise call - up a month ago when the squads for the World Cup double in Poland and Norway were announced, so much looked the part as Chris Woods's stand - in that he may have leapfrogged up the goalkeeping queue.	0 0 0 0 0 0 0 0 0 0 0 0 0 0 0 0 0 0 0 0 0 0 0 0 0 1 0 1 0 0 0 0 0 0 0 0 0 0 0 0 0 0 0	look the part	figurative	inflection	NOUN DET NOUN NOUN PUNCT NOUN DET NOUN ADV ADV DET NOUN ADP DET PROPN PROPN ADJ ADP PROPN CCONJ PROPN VERB VERB ADV ADV VERB DET NOUN ADP PROPN PROPN NOUN PUNCT NOUN ADP PRON VERB VERB VERB PART DET VERB NOUN	▁Flower s , ▁a ▁surprise ▁call ▁- ▁up ▁a ▁month ▁ago ▁when ▁the ▁squa ds ▁for ▁the ▁World ▁C up ▁double ▁in ▁Poland ▁and ▁Norway ▁were ▁announced , ▁so ▁much ▁looked ▁the ▁part ▁as ▁Chr is ▁Wood s ' s ▁stand ▁- ▁in ▁that ▁he ▁may ▁have ▁leap fr ogged ▁up ▁the ▁goal keeping ▁queue .	0 0 0 0 0 0 0 0 0 0 0 0 0 0 0 0 0 0 0 0 0 0 0 0 0 0 0 0 0 0 1 0 1 0 0 0 0 0 0 0 0 0 0 0 0 0 0 0 0 0 0 0 0 0 0 0	NOUN NOUN NOUN DET NOUN NOUN PUNCT NOUN DET NOUN ADV ADV DET NOUN NOUN ADP DET PROPN PROPN PROPN ADJ ADP PROPN CCONJ PROPN VERB VERB VERB ADV ADV VERB DET NOUN ADP PROPN PROPN PROPN PROPN PROPN PROPN NOUN PUNCT NOUN ADP PRON VERB VERB VERB VERB VERB PART DET VERB VERB NOUN NOUN
This has recently reached Volume 4 and now really looks the part.	0 0 0 0 0 0 0 0 0 1 0 1	look the part	figurative	inflection	DET VERB ADV VERB NOUN NUM CCONJ ADV ADV VERB DET NOUN	▁This ▁has ▁recently ▁reached ▁Volume ▁4 ▁and ▁now ▁really ▁looks ▁the ▁part .	0 0 0 0 0 0 0 0 0 1 0 1 1	DET VERB ADV VERB NOUN NUM CCONJ ADV ADV VERB DET NOUN NOUN
Harry Foy as Needle Nugent looked the part and always stayed in character.	0 0 0 0 0 1 0 1 0 0 0 0 0	look the part	figurative	inflection	PROPN PROPN ADP PROPN PROPN VERB DET NOUN CCONJ ADV VERB ADP NOUN	▁H arry ▁Fo y ▁as ▁Needle ▁N ug ent ▁looked ▁the ▁part ▁and ▁always ▁stayed ▁in ▁character .	0 0 0 0 0 0 0 0 0 1 0 1 0 0 0 0 0 0	PROPN PROPN PROPN PROPN ADP PROPN PROPN PROPN PROPN VERB DET NOUN CCONJ ADV VERB ADP NOUN NOUN
Black silk skirt maroon blouse her hair done up in a bun draped with gold jewellery oh talk about looking the part!	0 0 0 0 0 0 0 0 0 0 0 0 0 0 0 0 0 0 0 1 0 1	look the part	figurative	inflection	ADJ NOUN NOUN NOUN ADP ADJ NOUN VERB PART ADP DET NOUN VERB ADP NOUN NOUN INTJ VERB ADP VERB DET NOUN	▁Black ▁silk ▁skirt ▁mar oon ▁bl ous e ▁her ▁hair ▁done ▁up ▁in ▁a ▁b un ▁d rap ed ▁with ▁gold ▁jewellery ▁ oh ▁talk ▁about ▁looking ▁the ▁part !	0 0 0 0 0 0 0 0 0 0 0 0 0 0 0 0 0 0 0 0 0 0 0 0 0 0 1 0 1 1	ADJ NOUN NOUN NOUN NOUN ADP ADP ADP ADJ NOUN VERB PART ADP DET NOUN NOUN VERB VERB VERB ADP NOUN NOUN INTJ INTJ VERB ADP VERB DET NOUN NOUN
That apart Derby are unstoppable at home and it must be some consolation to Arthur Cox that the twelve million pound team he assembled at last looks the part.	0 0 0 0 0 0 0 0 0 0 0 0 0 0 0 0 0 0 0 0 0 0 0 0 0 0 1 0 1	look the part	figurative	inflection	ADP ADV PROPN VERB ADJ ADP NOUN CCONJ PRON VERB VERB DET NOUN ADP PROPN PROPN ADP DET NUM NUM NOUN NOUN PRON VERB ADP ADJ VERB DET NOUN	▁That ▁apart ▁D er by ▁are ▁un stop p able ▁at ▁home ▁and ▁it ▁must ▁be ▁some ▁con so lation ▁to ▁Art hur ▁Cox ▁that ▁the ▁twelve ▁million ▁pound ▁team ▁he ▁assembled ▁at ▁last ▁looks ▁the ▁part .	0 0 0 0 0 0 0 0 0 0 0 0 0 0 0 0 0 0 0 0 0 0 0 0 0 0 0 0 0 0 0 0 0 0 1 0 1 1	ADP ADV PROPN PROPN PROPN VERB ADJ ADJ ADJ ADJ ADP NOUN CCONJ PRON VERB VERB DET NOUN NOUN NOUN ADP PROPN PROPN PROPN ADP DET NUM NUM NOUN NOUN PRON VERB ADP ADJ VERB DET NOUN NOUN
Guitarist Warren De Martini looks the part — skinny, cocky, codpiece screaming, is all tart and no voice.	0 0 0 0 1 0 1 0 0 0 0 0 0 0 0 0 0 0	look the part	figurative	inflection	PROPN PROPN PROPN PROPN VERB DET NOUN PUNCT NOUN ADJ NOUN VERB VERB DET ADJ CCONJ DET NOUN	▁Gui tar ist ▁War ren ▁De ▁Martin i ▁looks ▁the ▁part ▁ — ▁skin ny , ▁ cock y , ▁cod piece ▁s cream ing , ▁is ▁all ▁tar t ▁and ▁no ▁voice .	0 0 0 0 0 0 0 0 1 0 1 0 0 0 0 0 0 0 0 0 0 0 0 0 0 0 0 0 0 0 0 0 0 0	PROPN PROPN PROPN PROPN PROPN PROPN PROPN PROPN VERB DET NOUN PUNCT PUNCT NOUN NOUN NOUN ADJ ADJ ADJ ADJ NOUN NOUN VERB VERB VERB VERB VERB DET ADJ ADJ CCONJ DET NOUN NOUN
Only seven years later the pope recovered this stone in the new tiara presented to him to make him look the part while anointing Napoleon as self - crowned Emperor.	0 0 0 0 0 0 0 0 0 0 0 0 0 0 0 0 0 0 0 1 0 1 0 0 0 0 0 0 0 0	look the part	figurative	identical	ADV NUM NOUN ADV DET NOUN VERB DET NOUN ADP DET ADJ NOUN VERB ADP PRON PART VERB PRON VERB DET NOUN ADP VERB PROPN ADP NOUN PUNCT VERB PROPN	▁Only ▁seven ▁years ▁later ▁the ▁po pe ▁recovered ▁this ▁stone ▁in ▁the ▁new ▁ti ara ▁presented ▁to ▁him ▁to ▁make ▁him ▁look ▁the ▁part ▁while ▁an o int ing ▁Napol e on ▁as ▁self ▁- ▁crown ed ▁E mper or .	0 0 0 0 0 0 0 0 0 0 0 0 0 0 0 0 0 0 0 0 0 1 0 1 0 0 0 0 0 0 0 0 0 0 0 0 0 0 0 0 0	ADV NUM NOUN ADV DET NOUN NOUN VERB DET NOUN ADP DET ADJ NOUN NOUN VERB ADP PRON PART VERB PRON VERB DET NOUN ADP VERB VERB VERB VERB PROPN PROPN PROPN ADP NOUN PUNCT VERB VERB PROPN PROPN PROPN PROPN
Flabbergasted experts who overlooked Lin have been saying things like “ he just did n’t look the part. ”	0 0 0 0 0 0 0 0 0 0 0 0 0 0 0 1 0 1 0	look the part	figurative	identical	ADJ NOUN NOUN VERB PROPN VERB VERB VERB NOUN ADP PUNCT PRON ADV VERB ADV VERB DET NOUN PUNCT	▁F lab berg ast ed ▁experts ▁who ▁overlooked ▁L in ▁have ▁been ▁saying ▁things ▁like ▁ “ ▁he ▁just ▁did ▁n ’ t ▁look ▁the ▁part . ▁ ”	0 0 0 0 0 0 0 0 0 0 0 0 0 0 0 0 0 0 0 0 0 0 0 1 0 1 1 0 0	ADJ ADJ ADJ ADJ ADJ NOUN NOUN VERB PROPN PROPN VERB VERB VERB NOUN ADP PUNCT PUNCT PRON ADV VERB ADV ADV ADV VERB DET NOUN NOUN PUNCT PUNCT
Nick Cave looks the part.	0 0 1 0 1	look the part	figurative	inflection	PROPN PROPN VERB DET NOUN	▁N ick ▁C ave ▁looks ▁the ▁part .	0 0 0 0 1 0 1 1	PROPN PROPN PROPN PROPN VERB DET NOUN NOUN
‘ I just don't look the part.	0 0 0 0 1 0 1	look the part	figurative	identical	PUNCT PRON ADV VERB VERB DET NOUN	▁ ‘ ▁I ▁just ▁don ' t ▁look ▁the ▁part .	0 0 0 0 0 0 0 1 0 1 1	PUNCT PUNCT PRON ADV VERB VERB VERB VERB DET NOUN NOUN
It was, she discovered, easier to look the part than to feel it.	0 0 0 0 0 0 1 0 1 0 0 0 0	look the part	figurative	identical	PRON VERB PRON VERB ADJ PART VERB DET NOUN ADP PART VERB PRON	▁It ▁was , ▁she ▁discovered , ▁easier ▁to ▁look ▁the ▁part ▁than ▁to ▁feel ▁it .	0 0 0 0 0 0 0 0 1 0 1 0 0 0 0 0	PRON VERB VERB PRON VERB VERB ADJ PART VERB DET NOUN ADP PART VERB PRON PRON
The bride might have been educated, might have travelled, might speak English well, but she would wear gold and henna, she would dress and look the part of an Al Ain bride.	0 0 0 0 0 0 0 0 0 0 0 0 0 0 0 0 0 0 0 0 0 0 0 0 1 0 1 0 0 0 0 0	look the part	figurative	identical	DET NOUN VERB VERB VERB VERB VERB VERB VERB VERB VERB PROPN ADV CCONJ PRON VERB VERB NOUN CCONJ NOUN PRON VERB VERB CCONJ VERB DET NOUN ADP DET PROPN PROPN ADV	▁The ▁br ide ▁might ▁have ▁been ▁educated , ▁might ▁have ▁travelled , ▁might ▁speak ▁English ▁well , ▁but ▁she ▁would ▁wear ▁gold ▁and ▁h enna , ▁she ▁would ▁ dress ▁and ▁look ▁the ▁part ▁of ▁an ▁Al ▁A in ▁br ide .	0 0 0 0 0 0 0 0 0 0 0 0 0 0 0 0 0 0 0 0 0 0 0 0 0 0 0 0 0 0 0 1 0 1 0 0 0 0 0 0 0 0	DET NOUN NOUN VERB VERB VERB VERB VERB VERB VERB VERB VERB VERB VERB PROPN ADV ADV CCONJ PRON VERB VERB NOUN CCONJ NOUN NOUN NOUN PRON VERB VERB VERB CCONJ VERB DET NOUN ADP DET PROPN PROPN PROPN ADV ADV ADV
But I have to look the part.	0 0 0 0 1 0 1	look the part	figurative	identical	CCONJ PRON VERB PART VERB DET NOUN	▁But ▁I ▁have ▁to ▁look ▁the ▁part .	0 0 0 0 1 0 1 1	CCONJ PRON VERB PART VERB DET NOUN NOUN
Bajan Blues looks the part in the Sportsman Hunter Chase, Fly By North may solve the Maze Handicap Hurdle and Carton may take the Moira Novice Chase.	0 0 1 0 1 0 0 0 0 0 0 0 0 0 0 0 0 0 0 0 0 0 0 0 0 0 0	look the part	figurative	inflection	PROPN PROPN VERB DET NOUN ADP DET PROPN PROPN PROPN VERB ADP PROPN VERB VERB DET PROPN PROPN PROPN CCONJ PROPN VERB VERB DET PROPN PROPN PROPN	▁Ba jan ▁Blue s ▁looks ▁the ▁part ▁in ▁the ▁Sport sman ▁Hun ter ▁Ch ase , ▁Fly ▁By ▁North ▁may ▁solve ▁the ▁M aze ▁Hand i cap ▁ Hurd le ▁and ▁Carton ▁may ▁take ▁the ▁Mo ira ▁No vice ▁Ch ase .	0 0 0 0 1 0 1 0 0 0 0 0 0 0 0 0 0 0 0 0 0 0 0 0 0 0 0 0 0 0 0 0 0 0 0 0 0 0 0 0 0 0	PROPN PROPN PROPN PROPN VERB DET NOUN ADP DET PROPN PROPN PROPN PROPN PROPN PROPN PROPN VERB ADP PROPN VERB VERB DET PROPN PROPN PROPN PROPN PROPN PROPN PROPN PROPN CCONJ PROPN VERB VERB DET PROPN PROPN PROPN PROPN PROPN PROPN PROPN
Holders look the part	0 1 0 1	look the part	figurative	identical	NOUN VERB DET NOUN	▁Holder s ▁look ▁the ▁part	0 0 1 0 1	NOUN NOUN VERB DET NOUN
I do prefer to wear smart clothes for work ; it's still not easy for women in business to be taken seriously — I like to look the part.	0 0 0 0 0 0 0 0 0 0 0 0 0 0 0 0 0 0 0 0 0 0 0 0 0 0 1 0 1	look the part	figurative	identical	PRON VERB VERB PART VERB ADJ NOUN ADP NOUN PUNCT PRON ADV ADV ADJ ADP NOUN ADP NOUN PART VERB VERB ADV PUNCT PRON VERB PART VERB DET NOUN	▁I ▁do ▁prefer ▁to ▁wear ▁smart ▁clothes ▁for ▁work ▁ ; ▁it ' s ▁still ▁not ▁easy ▁for ▁women ▁in ▁business ▁to ▁be ▁taken ▁seriously ▁ — ▁I ▁like ▁to ▁look ▁the ▁part .	0 0 0 0 0 0 0 0 0 0 0 0 0 0 0 0 0 0 0 0 0 0 0 0 0 0 0 0 0 0 1 0 1 1	PRON VERB VERB PART VERB ADJ NOUN ADP NOUN PUNCT PUNCT PRON PRON PRON ADV ADV ADJ ADP NOUN ADP NOUN PART VERB VERB ADV PUNCT PUNCT PRON VERB PART VERB DET NOUN NOUN
Teamed with plain or multi - print shirts they look the part whether you are going for a meal, to the pub or to work.	0 0 0 0 0 0 0 0 0 1 0 1 0 0 0 0 0 0 0 0 0 0 0 0 0	look the part	figurative	identical	VERB ADP ADJ CCONJ ADJ PUNCT NOUN NOUN PRON VERB DET NOUN ADP PRON VERB VERB ADP DET NOUN ADP DET NOUN CCONJ PART VERB	▁Team ed ▁with ▁plain ▁or ▁multi ▁- ▁print ▁ shirts ▁they ▁look ▁the ▁part ▁whether ▁you ▁are ▁going ▁for ▁a ▁meal , ▁to ▁the ▁pub ▁or ▁to ▁work .	0 0 0 0 0 0 0 0 0 0 0 1 0 1 0 0 0 0 0 0 0 0 0 0 0 0 0 0 0	VERB VERB ADP ADJ CCONJ ADJ PUNCT NOUN NOUN NOUN PRON VERB DET NOUN ADP PRON VERB VERB ADP DET NOUN NOUN ADP DET NOUN CCONJ PART VERB VERB
SMOOTH OPERATOR Sean Connery certainly looked the part of secret agent 007 — but he was no real - life hero	0 0 0 0 0 1 0 1 0 0 0 0 0 0 0 0 0 0 0 0 0	look the part	figurative	inflection	ADJ NOUN PROPN PROPN ADV VERB DET NOUN ADP ADJ NOUN NUM PUNCT CCONJ PRON VERB DET ADJ PUNCT NOUN NOUN	▁S MO OTH ▁OPERAT OR ▁Sea n ▁C onne ry ▁certainly ▁looked ▁the ▁part ▁of ▁secret ▁agent ▁007 ▁ — ▁but ▁he ▁was ▁no ▁real ▁- ▁life ▁her o	0 0 0 0 0 0 0 0 0 0 0 1 0 1 0 0 0 0 0 0 0 0 0 0 0 0 0 0 0	ADJ ADJ ADJ NOUN NOUN PROPN PROPN PROPN PROPN PROPN ADV VERB DET NOUN ADP ADJ NOUN NUM PUNCT PUNCT CCONJ PRON VERB DET ADJ PUNCT NOUN NOUN NOUN
on form Crewe look the part … but they have to run out of steam sometime	0 0 0 1 0 1 0 0 0 0 0 0 0 0 0 0	look the part	figurative	identical	ADP NOUN PROPN VERB DET NOUN PUNCT CCONJ PRON VERB PART VERB ADP ADP NOUN ADV	▁on ▁form ▁C rew e ▁look ▁the ▁part ▁... ▁but ▁they ▁have ▁to ▁run ▁out ▁of ▁steam ▁some time	0 0 0 0 0 1 0 1 0 0 0 0 0 0 0 0 0 0 0	ADP NOUN PROPN PROPN PROPN VERB DET NOUN PUNCT CCONJ PRON VERB PART VERB ADP ADP NOUN ADV ADV
Silk Slippers certainly looks the part, being a staying filly with speed in the mould of Midway Lady, who took the 1,000 and Oaks three years ago.	0 0 0 1 0 1 0 0 0 0 0 0 0 0 0 0 0 0 0 0 0 0 0 0 0 0 0	look the part	figurative	inflection	PROPN PROPN ADV VERB DET NOUN VERB DET VERB ADV ADP NOUN ADP DET NOUN ADP PROPN PROPN NOUN VERB DET NUM CCONJ PROPN NUM NOUN ADV	▁Silk ▁S lip pers ▁certainly ▁looks ▁the ▁part , ▁being ▁a ▁staying ▁fil ly ▁with ▁speed ▁in ▁the ▁mould ▁of ▁Mid way ▁Lady , ▁who ▁took ▁the ▁1,000 ▁and ▁O ak s ▁three ▁years ▁ago .	0 0 0 0 0 1 0 1 1 0 0 0 0 0 0 0 0 0 0 0 0 0 0 0 0 0 0 0 0 0 0 0 0 0 0 0	PROPN PROPN PROPN PROPN ADV VERB DET NOUN NOUN VERB DET VERB ADV ADV ADP NOUN ADP DET NOUN ADP PROPN PROPN PROPN PROPN NOUN VERB DET NUM CCONJ PROPN PROPN PROPN NUM NOUN ADV ADV
Some cite the success of Raves and warehouse parties, for which it's essential to look the part.	0 0 0 0 0 0 0 0 0 0 0 0 0 0 1 0 1	look the part	figurative	identical	DET VERB DET NOUN ADP PROPN CCONJ NOUN NOUN ADP ADJ PRON ADJ PART VERB DET NOUN	▁Some ▁cite ▁the ▁success ▁of ▁Ra ves ▁and ▁warehouse ▁parties , ▁for ▁which ▁it ' s ▁essential ▁to ▁look ▁the ▁part .	0 0 0 0 0 0 0 0 0 0 0 0 0 0 0 0 0 0 1 0 1 1	DET VERB DET NOUN ADP PROPN PROPN CCONJ NOUN NOUN NOUN ADP ADJ PRON PRON PRON ADJ PART VERB DET NOUN NOUN
Only Morrissey looked the part, ensconced as he was in a wild celebration of his now successful madness.	0 0 1 0 1 0 0 0 0 0 0 0 0 0 0 0 0 0	look the part	figurative	inflection	ADV PROPN VERB DET NOUN VERB ADP PRON VERB ADP DET ADJ NOUN ADP ADJ ADV ADJ NOUN	▁Only ▁Morris s ey ▁looked ▁the ▁part , ▁en s co nced ▁as ▁he ▁was ▁in ▁a ▁wild ▁celebration ▁of ▁his ▁now ▁successful ▁mad ness .	0 0 0 0 1 0 1 1 0 0 0 0 0 0 0 0 0 0 0 0 0 0 0 0 0 0	ADV PROPN PROPN PROPN VERB DET NOUN NOUN VERB VERB VERB VERB ADP PRON VERB ADP DET ADJ NOUN ADP ADJ ADV ADJ NOUN NOUN NOUN
Poise was going to be the order of the day — poise and sophistication ; she had taken great care to look the part, now all she had to do was feel that way too.	0 0 0 0 0 0 0 0 0 0 0 0 0 0 0 0 0 0 0 0 0 1 0 1 0 0 0 0 0 0 0 0 0 0 0	look the part	figurative	identical	PROPN VERB VERB PART VERB DET NOUN ADP DET NOUN PUNCT NOUN CCONJ NOUN PUNCT PRON VERB VERB ADJ NOUN PART VERB DET NOUN ADV DET PRON VERB PART VERB VERB VERB DET NOUN ADV	▁Po ise ▁was ▁going ▁to ▁be ▁the ▁order ▁of ▁the ▁day ▁ — ▁po ise ▁and ▁so ph istic ation ▁ ; ▁she ▁had ▁taken ▁great ▁care ▁to ▁look ▁the ▁part , ▁now ▁all ▁she ▁had ▁to ▁do ▁was ▁feel ▁that ▁way ▁too .	0 0 0 0 0 0 0 0 0 0 0 0 0 0 0 0 0 0 0 0 0 0 0 0 0 0 0 0 1 0 1 1 0 0 0 0 0 0 0 0 0 0 0 0	PROPN PROPN VERB VERB PART VERB DET NOUN ADP DET NOUN PUNCT PUNCT NOUN NOUN CCONJ NOUN NOUN NOUN NOUN PUNCT PUNCT PRON VERB VERB ADJ NOUN PART VERB DET NOUN NOUN ADV DET PRON VERB PART VERB VERB VERB DET NOUN ADV ADV
James Spicer had been a major in an infantry regiment and looked the part in a well - cut tweed suit, burnished brown brogues and his regimental tie.	0 0 0 0 0 0 0 0 0 0 0 1 0 1 0 0 0 0 0 0 0 0 0 0 0 0 0 0	look the part	figurative	inflection	PROPN PROPN VERB VERB DET NOUN ADP DET NOUN NOUN CCONJ VERB DET NOUN ADP DET ADV PUNCT VERB NOUN NOUN VERB ADJ NOUN CCONJ ADJ ADJ NOUN	▁James ▁Sp ic er ▁had ▁been ▁a ▁major ▁in ▁an ▁infant ry ▁regimen t ▁and ▁looked ▁the ▁part ▁in ▁a ▁well ▁- ▁cut ▁ twe ed ▁suit , ▁bur nished ▁brown ▁br ogue s ▁and ▁his ▁regimen tal ▁tie .	0 0 0 0 0 0 0 0 0 0 0 0 0 0 0 1 0 1 0 0 0 0 0 0 0 0 0 0 0 0 0 0 0 0 0 0 0 0 0 0	PROPN PROPN PROPN PROPN VERB VERB DET NOUN ADP DET NOUN NOUN NOUN NOUN CCONJ VERB DET NOUN ADP DET ADV PUNCT VERB NOUN NOUN NOUN NOUN NOUN VERB VERB ADJ NOUN NOUN NOUN CCONJ ADJ ADJ ADJ NOUN NOUN
But not content with just looking the part, Spotted Eagle has spent thirty years studying the history and culture of the native American Indian.	0 0 0 0 0 1 0 1 0 0 0 0 0 0 0 0 0 0 0 0 0 0 0 0	look the part	figurative	inflection	CCONJ ADV ADJ ADP ADV VERB DET NOUN PROPN PROPN VERB VERB NUM NOUN VERB DET NOUN CCONJ NOUN ADP DET ADJ PROPN PROPN	▁But ▁not ▁content ▁with ▁just ▁looking ▁the ▁part , ▁Spot ted ▁E a gle ▁has ▁spent ▁thirty ▁years ▁studying ▁the ▁history ▁and ▁culture ▁of ▁the ▁native ▁American ▁Indian .	0 0 0 0 0 1 0 1 1 0 0 0 0 0 0 0 0 0 0 0 0 0 0 0 0 0 0 0 0	CCONJ ADV ADJ ADP ADV VERB DET NOUN NOUN PROPN PROPN PROPN PROPN PROPN VERB VERB NUM NOUN VERB DET NOUN CCONJ NOUN ADP DET ADJ PROPN PROPN PROPN
IF you want to look the part in the nineties, don't wear make - up.	0 0 0 0 1 0 1 0 0 0 0 0 0 0 0	look the part	figurative	identical	ADP PRON VERB PART VERB DET NOUN ADP DET NOUN VERB VERB VERB PUNCT NOUN	▁IF ▁you ▁want ▁to ▁look ▁the ▁part ▁in ▁the ▁nine ties , ▁don ' t ▁wear ▁make ▁- ▁up .	0 0 0 0 1 0 1 0 0 0 0 0 0 0 0 0 0 0 0 0	ADP PRON VERB PART VERB DET NOUN ADP DET NOUN NOUN NOUN VERB VERB VERB VERB VERB PUNCT NOUN NOUN
Might as well look the part, since all artists were considered crazy and bohemian.	0 0 0 1 0 1 0 0 0 0 0 0 0 0	look the part	figurative	identical	VERB ADV ADV VERB DET NOUN ADP DET NOUN VERB VERB ADJ CCONJ ADJ	▁M ight ▁as ▁well ▁look ▁the ▁part , ▁since ▁all ▁artists ▁were ▁considered ▁c raz y ▁and ▁bo hem ian .	0 0 0 0 1 0 1 1 0 0 0 0 0 0 0 0 0 0 0 0 0	VERB VERB ADV ADV VERB DET NOUN NOUN ADP DET NOUN VERB VERB ADJ ADJ ADJ CCONJ ADJ ADJ ADJ ADJ
She removed the clinging pink sweater, made famous by the Hollywood Oomph Girl, Lana Turner but which made Sylvia look the part of a streetwalker, and stripped herself of the gaudy, lace - edged cami - knickers she wore beneath.	0 0 0 0 0 0 0 0 0 0 0 0 0 0 0 0 0 0 0 1 0 1 0 0 0 0 0 0 0 0 0 0 0 0 0 0 0 0 0 0	look the part	figurative	identical	PRON VERB DET VERB ADJ NOUN VERB ADJ ADP DET PROPN PROPN PROPN PROPN PROPN CCONJ ADJ VERB PROPN VERB DET NOUN ADP DET NOUN CCONJ VERB PRON ADP DET ADJ NOUN PUNCT VERB NOUN PUNCT NOUN PRON VERB ADV	▁She ▁removed ▁the ▁cl ing ing ▁pink ▁sweat er , ▁made ▁famous ▁by ▁the ▁Hol ly wood ▁O om ph ▁Gi rl , ▁L ana ▁Turner ▁but ▁which ▁made ▁S yl via ▁look ▁the ▁part ▁of ▁a ▁street wal ker , ▁and ▁stripped ▁herself ▁of ▁the ▁ gau dy , ▁lace ▁- ▁edge d ▁cam i ▁- ▁k nic kers ▁she ▁w ore ▁beneath .	0 0 0 0 0 0 0 0 0 0 0 0 0 0 0 0 0 0 0 0 0 0 0 0 0 0 0 0 0 0 0 0 1 0 1 0 0 0 0 0 0 0 0 0 0 0 0 0 0 0 0 0 0 0 0 0 0 0 0 0 0 0 0 0 0	PRON VERB DET VERB VERB VERB ADJ NOUN NOUN NOUN VERB ADJ ADP DET PROPN PROPN PROPN PROPN PROPN PROPN PROPN PROPN PROPN PROPN PROPN PROPN CCONJ ADJ VERB PROPN PROPN PROPN VERB DET NOUN ADP DET NOUN NOUN NOUN NOUN CCONJ VERB PRON ADP DET ADJ ADJ ADJ ADJ NOUN PUNCT VERB VERB NOUN NOUN PUNCT NOUN NOUN NOUN PRON VERB VERB ADV ADV
Women tend to look for three to four things, your shoes, your fingernails, ties and socks, okay so make sure you look the part.	0 0 0 0 0 0 0 0 0 0 0 0 0 0 0 0 0 0 0 0 0 1 0 1	look the part	figurative	identical	NOUN VERB PART VERB ADP NUM PART NUM NOUN ADJ NOUN ADJ NOUN NOUN CCONJ NOUN INTJ ADV VERB ADJ PRON VERB DET NOUN	▁Women ▁tend ▁to ▁look ▁for ▁three ▁to ▁four ▁things , ▁your ▁shoes , ▁your ▁finger na ils , ▁ties ▁and ▁socks , ▁o ka y ▁so ▁make ▁sure ▁you ▁look ▁the ▁part .	0 0 0 0 0 0 0 0 0 0 0 0 0 0 0 0 0 0 0 0 0 0 0 0 0 0 0 0 0 1 0 1 1	NOUN VERB PART VERB ADP NUM PART NUM NOUN NOUN ADJ NOUN NOUN ADJ NOUN NOUN NOUN NOUN NOUN CCONJ NOUN NOUN INTJ INTJ INTJ ADV VERB ADJ PRON VERB DET NOUN NOUN
‘ Please look the part’ says the man with a grunt,	0 0 1 0 1 0 0 0 0 0 0	look the part	figurative	dashes	PUNCT INTJ VERB DET NOUN VERB DET NOUN ADP DET NOUN	▁ ‘ ▁Please ▁look ▁the ▁part ’ ▁says ▁the ▁man ▁with ▁a ▁gr unt ,	0 0 0 1 0 1 1 0 0 0 0 0 0 0 0	PUNCT PUNCT INTJ VERB DET NOUN NOUN VERB DET NOUN ADP DET NOUN NOUN NOUN
She looks the part and no doubt would enjoy every minute of it.’	0 1 0 1 0 0 0 0 0 0 0 0 0	look the part	figurative	inflection	PRON VERB DET NOUN CCONJ DET NOUN VERB VERB DET NOUN ADP NOUN	▁She ▁looks ▁the ▁part ▁and ▁no ▁doubt ▁would ▁enjoy ▁every ▁minute ▁of ▁it . ’	0 1 0 1 0 0 0 0 0 0 0 0 0 0 0	PRON VERB DET NOUN CCONJ DET NOUN VERB VERB DET NOUN ADP NOUN NOUN NOUN
Teamed with plain or multi - print shirts they look the part whether you are going for a meal, to the pub or to work.	0 0 0 0 0 0 0 0 0 1 0 1 0 0 0 0 0 0 0 0 0 0 0 0 0	look the part	figurative	identical	VERB ADP ADJ CCONJ ADJ PUNCT NOUN NOUN PRON VERB DET NOUN ADP PRON VERB VERB ADP DET NOUN ADP DET NOUN CCONJ PART VERB	▁Team ed ▁with ▁plain ▁or ▁multi ▁- ▁print ▁ shirts ▁they ▁look ▁the ▁part ▁whether ▁you ▁are ▁going ▁for ▁a ▁meal , ▁to ▁the ▁pub ▁or ▁to ▁work .	0 0 0 0 0 0 0 0 0 0 0 1 0 1 0 0 0 0 0 0 0 0 0 0 0 0 0 0 0	VERB VERB ADP ADJ CCONJ ADJ PUNCT NOUN NOUN NOUN PRON VERB DET NOUN ADP PRON VERB VERB ADP DET NOUN NOUN ADP DET NOUN CCONJ PART VERB VERB
He looks the part at centre back as well.	0 1 0 1 0 0 0 0 0	look the part	figurative	inflection	PRON VERB DET NOUN ADP NOUN ADV ADV ADV	▁He ▁looks ▁the ▁part ▁at ▁centre ▁back ▁as ▁well .	0 1 0 1 0 0 0 0 0 0	PRON VERB DET NOUN ADP NOUN ADV ADV ADV ADV
As a young romeo, Crawford had to look the part.	0 0 0 0 0 0 0 1 0 1	look the part	figurative	identical	ADP DET ADJ NOUN PROPN VERB PART VERB DET NOUN	▁As ▁a ▁young ▁rom eo , ▁Craw ford ▁had ▁to ▁look ▁the ▁part .	0 0 0 0 0 0 0 0 0 0 1 0 1 1	ADP DET ADJ NOUN NOUN NOUN PROPN PROPN VERB PART VERB DET NOUN NOUN
ABS Computers Ltd, formerly the Allied Business Systems small business computer manufacturer, has long looked a vestigial part of the Trafalgar House Plc empire, too small to turn up in the annual report, and giving the impression that top management was unaware of its existence.	0 0 0 0 0 0 0 0 0 0 0 0 0 0 1 0 0 1 0 0 0 0 0 0 0 0 0 0 0 0 0 0 0 0 0 0 0 0 0 0 0 0 0 0 0	look the part	figurative	combined-inflection	NOUN NOUN PROPN ADV DET PROPN PROPN PROPN ADJ NOUN NOUN NOUN VERB ADV VERB DET ADJ NOUN ADP DET PROPN PROPN PROPN NOUN ADV ADJ PART VERB PART ADP DET ADJ NOUN CCONJ VERB DET NOUN ADP ADJ NOUN VERB ADJ ADP ADJ NOUN	▁ABS ▁Computer s ▁Ltd , ▁formerly ▁the ▁All ied ▁Business ▁Systems ▁small ▁business ▁computer ▁manufacturer , ▁has ▁long ▁looked ▁a ▁v est igi al ▁part ▁of ▁the ▁Tra fal gar ▁House ▁P lc ▁empire , ▁too ▁small ▁to ▁turn ▁up ▁in ▁the ▁annual ▁report , ▁and ▁giving ▁the ▁impression ▁that ▁top ▁management ▁was ▁unaware ▁of ▁its ▁existence .	0 0 0 0 0 0 0 0 0 0 0 0 0 0 0 0 0 0 1 0 0 0 0 0 1 0 0 0 0 0 0 0 0 0 0 0 0 0 0 0 0 0 0 0 0 0 0 0 0 0 0 0 0 0 0 0 0 0	NOUN NOUN NOUN PROPN PROPN ADV DET PROPN PROPN PROPN PROPN ADJ NOUN NOUN NOUN NOUN VERB ADV VERB DET ADJ ADJ ADJ ADJ NOUN ADP DET PROPN PROPN PROPN PROPN PROPN PROPN NOUN NOUN ADV ADJ PART VERB PART ADP DET ADJ NOUN NOUN CCONJ VERB DET NOUN ADP ADJ NOUN VERB ADJ ADP ADJ NOUN NOUN
