But the general proposition that human affairs must be understood from within does not require the assumption that individuals make history, except perhaps as a convenient device for identifying what calls for deeper understanding.	0 0 0 0 0 0 0 0 0 0 0 0 0 0 0 0 0 0 0 1 1 0 0 0 0 0 0 0 0 0 0 0 0 0	make history	figurative	identical	CCONJ DET ADJ NOUN ADP ADJ NOUN VERB VERB VERB ADP ADP VERB ADV VERB DET NOUN ADP NOUN VERB NOUN ADP ADV ADP DET ADJ NOUN ADP VERB NOUN VERB ADP ADJ NOUN	▁But ▁the ▁general ▁proposition ▁that ▁human ▁affairs ▁must ▁be ▁understood ▁from ▁within ▁does ▁not ▁require ▁the ▁assumption ▁that ▁individuals ▁make ▁history , ▁except ▁perhaps ▁as ▁a ▁convenient ▁device ▁for ▁identifying ▁what ▁calls ▁for ▁deeper ▁understanding .	0 0 0 0 0 0 0 0 0 0 0 0 0 0 0 0 0 0 0 1 1 1 0 0 0 0 0 0 0 0 0 0 0 0 0 0	CCONJ DET ADJ NOUN ADP ADJ NOUN VERB VERB VERB ADP ADP VERB ADV VERB DET NOUN ADP NOUN VERB NOUN NOUN ADP ADV ADP DET ADJ NOUN ADP VERB NOUN VERB ADP ADJ NOUN NOUN
It is necessary to consider how tribesmen made history and what social relations underlay their production of knowledge about the past.	0 0 0 0 0 0 0 1 1 0 0 0 0 0 0 0 0 0 0 0 0	make history	figurative	inflection	PRON VERB ADJ PART VERB ADV NOUN VERB NOUN CCONJ NOUN ADJ NOUN VERB ADJ NOUN ADP NOUN ADP DET NOUN	▁It ▁is ▁necessary ▁to ▁consider ▁how ▁tribe s men ▁made ▁history ▁and ▁what ▁social ▁relations ▁under lay ▁their ▁production ▁of ▁knowledge ▁about ▁the ▁past .	0 0 0 0 0 0 0 0 0 1 1 0 0 0 0 0 0 0 0 0 0 0 0 0 0	PRON VERB ADJ PART VERB ADV NOUN NOUN NOUN VERB NOUN CCONJ NOUN ADJ NOUN VERB VERB ADJ NOUN ADP NOUN ADP DET NOUN NOUN
This New ~ Year ’s Eve, Sweden made history in a small way by ending the last rotating foreign and security policy presidency of the European ~ Union.	0 0 0 0 0 0 0 1 1 0 0 0 0 0 0 0 0 0 0 0 0 0 0 0 0 0 0 0	make history	figurative	inflection	DET PROPN PUNCT NOUN PART PROPN PROPN VERB NOUN ADP DET ADJ NOUN ADP VERB DET ADJ VERB ADJ CCONJ NOUN NOUN NOUN ADP DET PROPN PUNCT PROPN	▁This ▁New ▁ ~ ▁Year ▁ ’ s ▁E ve , ▁Sweden ▁made ▁history ▁in ▁a ▁small ▁way ▁by ▁ending ▁the ▁last ▁rotat ing ▁foreign ▁and ▁security ▁policy ▁presidency ▁of ▁the ▁European ▁ ~ ▁Union .	0 0 0 0 0 0 0 0 0 0 0 0 1 1 0 0 0 0 0 0 0 0 0 0 0 0 0 0 0 0 0 0 0 0 0 0	DET PROPN PUNCT PUNCT NOUN PART PART PART PROPN PROPN PROPN PROPN VERB NOUN ADP DET ADJ NOUN ADP VERB DET ADJ VERB VERB ADJ CCONJ NOUN NOUN NOUN ADP DET PROPN PUNCT PUNCT PROPN PROPN
We have made history.	0 0 1 1	make history	figurative	inflection	PRON VERB VERB NOUN	▁We ▁have ▁made ▁history .	0 0 1 1 1	PRON VERB VERB NOUN NOUN
ONE of Britain's most prestigious stores, Selfridges, made history yesterday by opening on a Sunday.	0 0 0 0 0 0 0 1 1 0 0 0 0 0 0	make history	figurative	inflection	NUM ADP PROPN ADJ ADJ NOUN PROPN VERB NOUN NOUN ADP VERB ADP DET PROPN	▁ONE ▁of ▁Britain ' s ▁most ▁prestig ious ▁stores , ▁Self rid ges , ▁made ▁history ▁yesterday ▁by ▁opening ▁on ▁a ▁Sunday .	0 0 0 0 0 0 0 0 0 0 0 0 0 0 1 1 0 0 0 0 0 0 0	NUM ADP PROPN PROPN PROPN ADJ ADJ ADJ NOUN NOUN PROPN PROPN PROPN PROPN VERB NOUN NOUN ADP VERB ADP DET PROPN PROPN
Teenager's battle is poised to make legal history in High Court chambers	0 0 0 0 0 1 0 1 0 0 0 0	make history	figurative	insertion-other	PROPN NOUN VERB VERB PART VERB ADJ NOUN ADP PROPN PROPN NOUN	▁Te ena ger ' s ▁battle ▁is ▁po ised ▁to ▁make ▁legal ▁history ▁in ▁High ▁Court ▁chambers	0 0 0 0 0 0 0 0 0 0 1 0 1 0 0 0 0	PROPN PROPN PROPN PROPN PROPN NOUN VERB VERB VERB PART VERB ADJ NOUN ADP PROPN PROPN NOUN
For instance, there is usually a starting assumption that individuals make history, at least by the sum of their actions and even if not quite as they intended it to be.	0 0 0 0 0 0 0 0 0 0 1 1 0 0 0 0 0 0 0 0 0 0 0 0 0 0 0 0 0 0 0	make history	figurative	identical	ADP NOUN ADV VERB ADV DET VERB NOUN ADP NOUN VERB NOUN ADP ADJ ADP DET NOUN ADP ADJ NOUN CCONJ ADV ADP ADV ADV ADP PRON VERB PRON PART VERB	▁For ▁instance , ▁there ▁is ▁usually ▁a ▁starting ▁assumption ▁that ▁individuals ▁make ▁history , ▁at ▁least ▁by ▁the ▁sum ▁of ▁their ▁actions ▁and ▁even ▁if ▁not ▁quite ▁as ▁they ▁intended ▁it ▁to ▁be .	0 0 0 0 0 0 0 0 0 0 0 1 1 1 0 0 0 0 0 0 0 0 0 0 0 0 0 0 0 0 0 0 0 0	ADP NOUN NOUN ADV VERB ADV DET VERB NOUN ADP NOUN VERB NOUN NOUN ADP ADJ ADP DET NOUN ADP ADJ NOUN CCONJ ADV ADP ADV ADV ADP PRON VERB PRON PART VERB VERB
The Queen will make history tomorrow when she attends a unique church dedication service.	0 0 0 1 1 0 0 0 0 0 0 0 0 0	make history	figurative	identical	DET PROPN VERB VERB NOUN NOUN ADV PRON VERB DET ADJ NOUN NOUN NOUN	▁The ▁Queen ▁will ▁make ▁history ▁tomorrow ▁when ▁she ▁attend s ▁a ▁unique ▁church ▁dedication ▁service .	0 0 0 1 1 0 0 0 0 0 0 0 0 0 0 0	DET PROPN VERB VERB NOUN NOUN ADV PRON VERB VERB DET ADJ NOUN NOUN NOUN NOUN
Those present on this unique occasion were well aware they were making history in riding a steam train on the electric line, the first time since a steam engine was used on the construction of the line in the last century!	0 0 0 0 0 0 0 0 0 0 0 1 1 0 0 0 0 0 0 0 0 0 0 0 0 0 0 0 0 0 0 0 0 0 0 0 0 0 0 0 0	make history	figurative	inflection	DET ADJ ADP DET ADJ NOUN VERB ADV ADJ PRON VERB VERB NOUN ADP VERB DET NOUN NOUN ADP DET ADJ NOUN DET ADJ NOUN ADP DET NOUN NOUN VERB VERB ADP DET NOUN ADP DET NOUN ADP DET ADJ NOUN	▁T hose ▁present ▁on ▁this ▁unique ▁occasion ▁were ▁well ▁aware ▁they ▁were ▁making ▁history ▁in ▁rid ing ▁a ▁steam ▁train ▁on ▁the ▁electric ▁line , ▁the ▁first ▁time ▁since ▁a ▁steam ▁engine ▁was ▁used ▁on ▁the ▁construction ▁of ▁the ▁line ▁in ▁the ▁last ▁century !	0 0 0 0 0 0 0 0 0 0 0 0 1 1 0 0 0 0 0 0 0 0 0 0 0 0 0 0 0 0 0 0 0 0 0 0 0 0 0 0 0 0 0 0 0	DET DET ADJ ADP DET ADJ NOUN VERB ADV ADJ PRON VERB VERB NOUN ADP VERB VERB DET NOUN NOUN ADP DET ADJ NOUN NOUN DET ADJ NOUN ADP DET NOUN NOUN VERB VERB ADP DET NOUN ADP DET NOUN ADP DET ADJ NOUN NOUN
Then, with some breaks ( nothing from 1918, 1922 and 1923 ), we go through to 1924, when at Covent Garden she sang her first Marschallin on stage, making history and her house début at the same time.	0 0 0 0 0 0 0 0 0 0 0 0 0 0 0 0 0 0 0 0 0 0 0 0 0 0 0 0 1 1 0 0 0 0 0 0 0 0	make history	figurative	inflection	ADV ADP DET NOUN PUNCT NOUN ADP NUM NUM CCONJ NUM PUNCT PRON VERB ADV ADP NUM ADV ADP PROPN PROPN PRON VERB ADJ ADJ PROPN ADP NOUN VERB NOUN CCONJ ADJ NOUN NOUN ADP DET ADJ NOUN	▁Then , ▁with ▁some ▁breaks ▁( ▁nothing ▁from ▁191 8, ▁19 22 ▁and ▁19 23 ▁ ), ▁we ▁go ▁through ▁to ▁192 4, ▁when ▁at ▁Co vent ▁Garden ▁she ▁s ang ▁her ▁first ▁Mar sch all in ▁on ▁stage , ▁making ▁history ▁and ▁her ▁house ▁dé but ▁at ▁the ▁same ▁time .	0 0 0 0 0 0 0 0 0 0 0 0 0 0 0 0 0 0 0 0 0 0 0 0 0 0 0 0 0 0 0 0 0 0 0 0 0 0 0 0 1 1 0 0 0 0 0 0 0 0 0 0	ADV ADV ADP DET NOUN PUNCT NOUN ADP NUM NUM NUM NUM CCONJ NUM NUM PUNCT PUNCT PRON VERB ADV ADP NUM NUM ADV ADP PROPN PROPN PROPN PRON VERB VERB ADJ ADJ PROPN PROPN PROPN PROPN ADP NOUN NOUN VERB NOUN CCONJ ADJ NOUN NOUN NOUN ADP DET ADJ NOUN NOUN
This is unfortunate, because Europe is in the process of making history.	0 0 0 0 0 0 0 0 0 0 1 1	make history	figurative	inflection	DET VERB ADJ ADP PROPN VERB ADP DET NOUN ADP VERB NOUN	▁This ▁is ▁unfortunate , ▁because ▁Europe ▁is ▁in ▁the ▁process ▁of ▁making ▁history .	0 0 0 0 0 0 0 0 0 0 0 1 1 1	DET VERB ADJ ADJ ADP PROPN VERB ADP DET NOUN ADP VERB NOUN NOUN
In 1981, however, this fundamental right was challenged for the second time in another case to make legal history.	0 0 0 0 0 0 0 0 0 0 0 0 0 0 0 0 1 0 1	make history	figurative	insertion-other	ADP NUM ADV DET ADJ NOUN VERB VERB ADP DET ADJ NOUN ADP DET NOUN PART VERB ADJ NOUN	▁In ▁1981, ▁however , ▁this ▁fundamental ▁right ▁was ▁challenged ▁for ▁the ▁second ▁time ▁in ▁another ▁case ▁to ▁make ▁legal ▁history .	0 0 0 0 0 0 0 0 0 0 0 0 0 0 0 0 0 1 0 1 1	ADP NUM ADV ADV DET ADJ NOUN VERB VERB ADP DET ADJ NOUN ADP DET NOUN PART VERB ADJ NOUN NOUN
Therefore, in history it is not nature and technology which makes human society but it is man himself, who in terms of his already existing ideas and values, makes his own history, as he encounters nature and the problems it poses.	0 0 0 0 0 0 0 0 0 0 0 0 0 0 0 0 0 0 0 0 0 0 0 0 0 0 0 0 1 0 0 1 0 0 0 0 0 0 0 0 0	make history	figurative	combined-inflection	ADV ADP NOUN PRON VERB ADV NOUN CCONJ NOUN ADJ VERB ADJ NOUN CCONJ PRON VERB NOUN PRON NOUN ADP NOUN ADP ADJ ADV VERB NOUN CCONJ NOUN VERB ADJ ADJ NOUN ADP PRON VERB NOUN CCONJ DET NOUN PRON VERB	▁Therefore , ▁in ▁history ▁it ▁is ▁not ▁nature ▁and ▁technology ▁which ▁makes ▁human ▁society ▁but ▁it ▁is ▁man ▁himself , ▁who ▁in ▁terms ▁of ▁his ▁already ▁existing ▁ideas ▁and ▁values , ▁makes ▁his ▁own ▁history , ▁as ▁he ▁encounter s ▁nature ▁and ▁the ▁problems ▁it ▁poses .	0 0 0 0 0 0 0 0 0 0 0 0 0 0 0 0 0 0 0 0 0 0 0 0 0 0 0 0 0 0 0 1 0 0 1 1 0 0 0 0 0 0 0 0 0 0 0	ADV ADV ADP NOUN PRON VERB ADV NOUN CCONJ NOUN ADJ VERB ADJ NOUN CCONJ PRON VERB NOUN PRON PRON NOUN ADP NOUN ADP ADJ ADV VERB NOUN CCONJ NOUN NOUN VERB ADJ ADJ NOUN NOUN ADP PRON VERB VERB NOUN CCONJ DET NOUN PRON VERB VERB
Its distinguishing characteristics are first the view that a class is partly constituted by the perceptions of its members, and second the belief, held either tacitly or openly, that the passage of history is marked by the growth of class consciousness, until a point in the future when an enlightened proletariat will be able to grasp its real interests and make its own history.	0 0 0 0 0 0 0 0 0 0 0 0 0 0 0 0 0 0 0 0 0 0 0 0 0 0 0 0 0 0 0 0 0 0 0 0 0 0 0 0 0 0 0 0 0 0 0 0 0 0 0 0 0 0 0 0 0 0 0 0 1 0 0 1	make history	literal	insertion-other	ADJ ADJ NOUN VERB ADV DET NOUN ADP DET NOUN VERB ADV VERB ADP DET NOUN ADP ADJ NOUN CCONJ ADV DET NOUN VERB CCONJ ADV CCONJ ADV ADP DET NOUN ADP NOUN VERB VERB ADP DET NOUN ADP NOUN NOUN ADP DET NOUN ADP DET NOUN ADV DET ADJ NOUN VERB VERB ADJ PART VERB ADJ ADJ NOUN CCONJ VERB ADJ ADJ NOUN	▁It s ▁distinguishing ▁characteristics ▁are ▁first ▁the ▁view ▁that ▁a ▁class ▁is ▁partly ▁constituted ▁by ▁the ▁perception s ▁of ▁its ▁members , ▁and ▁second ▁the ▁belief , ▁held ▁either ▁tacitly ▁or ▁openly , ▁that ▁the ▁passage ▁of ▁history ▁is ▁marked ▁by ▁the ▁growth ▁of ▁class ▁consciousness , ▁until ▁a ▁point ▁in ▁the ▁future ▁when ▁an ▁enlighten ed ▁pro let ariat ▁will ▁be ▁able ▁to ▁grasp ▁its ▁real ▁interests ▁and ▁make ▁its ▁own ▁history .	0 0 0 0 0 0 0 0 0 0 0 0 0 0 0 0 0 0 0 0 0 0 0 0 0 0 0 0 0 0 0 0 0 0 0 0 0 0 0 0 0 0 0 0 0 0 0 0 0 0 0 0 0 0 0 0 0 0 0 0 0 0 0 0 0 0 0 0 0 1 0 0 1 1	ADJ ADJ ADJ NOUN VERB ADV DET NOUN ADP DET NOUN VERB ADV VERB ADP DET NOUN NOUN ADP ADJ NOUN NOUN CCONJ ADV DET NOUN NOUN VERB CCONJ ADV CCONJ ADV ADV ADP DET NOUN ADP NOUN VERB VERB ADP DET NOUN ADP NOUN NOUN NOUN ADP DET NOUN ADP DET NOUN ADV DET ADJ ADJ NOUN NOUN NOUN VERB VERB ADJ PART VERB ADJ ADJ NOUN CCONJ VERB ADJ ADJ NOUN NOUN
The diversity of skills it develops makes history graduates particularly attractive to employers who seek flexibility of mind rather than specialised expertise in a single discipline.	0 0 0 0 0 0 1 1 0 0 0 0 0 0 0 0 0 0 0 0 0 0 0 0 0 0	make history	figurative	inflection	DET NOUN ADP NOUN PRON VERB VERB NOUN NOUN ADV ADJ ADP NOUN NOUN VERB NOUN ADP NOUN ADV ADP ADJ NOUN ADP DET ADJ NOUN	▁The ▁diversity ▁of ▁skills ▁it ▁develops ▁makes ▁history ▁graduates ▁particularly ▁attractive ▁to ▁employers ▁who ▁seek ▁flexibility ▁of ▁mind ▁rather ▁than ▁specialised ▁expertise ▁in ▁a ▁single ▁discipline .	0 0 0 0 0 0 1 1 0 0 0 0 0 0 0 0 0 0 0 0 0 0 0 0 0 0 0	DET NOUN ADP NOUN PRON VERB VERB NOUN NOUN ADV ADJ ADP NOUN NOUN VERB NOUN ADP NOUN ADV ADP ADJ NOUN ADP DET ADJ NOUN NOUN
The first combine harvester ever used in England was in service here and, in 1935, agricultural history was made when bread was eaten from wheat harvested, dried, milled and baked in the same day.	0 0 0 0 0 0 0 0 0 0 0 0 0 0 0 0 1 0 1 0 0 0 0 0 0 0 0 0 0 0 0 0 0 0	make history	figurative	misc	DET ADJ NOUN NOUN ADV VERB ADP PROPN VERB ADP NOUN ADV CCONJ ADP NUM ADJ NOUN VERB VERB ADV NOUN VERB VERB ADP NOUN VERB VERB VERB CCONJ VERB ADP DET ADJ NOUN	▁The ▁first ▁combine ▁harvest er ▁ever ▁used ▁in ▁England ▁was ▁in ▁service ▁here ▁and , ▁in ▁193 5, ▁agricultural ▁history ▁was ▁made ▁when ▁bread ▁was ▁eaten ▁from ▁wheat ▁harvested , ▁dried , ▁milled ▁and ▁ba ked ▁in ▁the ▁same ▁day .	0 0 0 0 0 0 0 0 0 0 0 0 0 0 0 0 0 0 0 1 0 1 0 0 0 0 0 0 0 0 0 0 0 0 0 0 0 0 0 0 0	DET ADJ NOUN NOUN NOUN ADV VERB ADP PROPN VERB ADP NOUN ADV CCONJ CCONJ ADP NUM NUM ADJ NOUN VERB VERB ADV NOUN VERB VERB ADP NOUN VERB VERB VERB VERB VERB CCONJ VERB VERB ADP DET ADJ NOUN NOUN
He himself made history when, in 1984, he donated over 1,200 pictures and objects to a foundation he established in Warsaw the first such institution since the war.	0 0 1 1 0 0 0 0 0 0 0 0 0 0 0 0 0 0 0 0 0 0 0 0 0 0 0 0	make history	figurative	inflection	PRON PRON VERB NOUN ADV ADP NUM PRON VERB ADP NUM NOUN CCONJ VERB ADP DET NOUN PRON VERB ADP PROPN DET ADJ ADJ NOUN ADP DET NOUN	▁He ▁himself ▁made ▁history ▁when , ▁in ▁1984, ▁he ▁do nated ▁over ▁1 , 200 ▁pictures ▁and ▁objects ▁to ▁a ▁foundation ▁he ▁established ▁in ▁Warsaw ▁the ▁first ▁such ▁institution ▁since ▁the ▁war .	0 0 1 1 0 0 0 0 0 0 0 0 0 0 0 0 0 0 0 0 0 0 0 0 0 0 0 0 0 0 0 0 0	PRON PRON VERB NOUN ADV ADV ADP NUM PRON VERB VERB ADP NUM NUM NUM NOUN CCONJ VERB ADP DET NOUN PRON VERB ADP PROPN DET ADJ ADJ NOUN ADP DET NOUN NOUN
Here Lévi - Strauss argues that behind the original question from which Sartre began — how can man make history if history makes him?— lurks another : if it is man who makes history, how does ‘ History’ gain its exorbitant status as the desired, unachievable object of Sartre's text?	0 0 0 0 0 0 0 0 0 0 0 0 0 0 0 0 0 0 0 0 0 0 0 0 0 0 0 0 0 0 0 0 1 1 0 0 0 0 0 0 0 0 0 0 0 0 0 0 0 0	make history	figurative	inflection	ADV PROPN PUNCT PROPN VERB ADP ADP DET ADJ NOUN ADP ADJ PROPN VERB PUNCT ADV VERB VERB VERB NOUN ADP NOUN VERB NOUN VERB DET PUNCT ADP PRON VERB NOUN NOUN VERB NOUN ADV VERB PRON PROPN VERB ADJ ADJ NOUN ADP DET VERB ADJ NOUN ADP PROPN NOUN	▁Here ▁L é vi ▁- ▁Stra us s ▁argues ▁that ▁behind ▁the ▁original ▁question ▁from ▁which ▁Sar tre ▁began ▁ — ▁how ▁can ▁man ▁make ▁history ▁if ▁history ▁makes ▁him ? — ▁lu rk s ▁another ▁ : ▁if ▁it ▁is ▁man ▁who ▁makes ▁history , ▁how ▁does ▁ ‘ ▁History ’ ▁gain ▁its ▁ex or bit ant ▁status ▁as ▁the ▁desired , ▁un ach iev able ▁object ▁of ▁Sar tre ' s ▁text ?	0 0 0 0 0 0 0 0 0 0 0 0 0 0 0 0 0 0 0 0 0 0 0 0 0 0 0 0 0 0 0 0 0 0 0 0 0 0 0 0 0 0 0 1 1 1 0 0 0 0 0 0 0 0 0 0 0 0 0 0 0 0 0 0 0 0 0 0 0 0 0 0 0 0 0	ADV PROPN PROPN PROPN PUNCT PROPN PROPN PROPN VERB ADP ADP DET ADJ NOUN ADP ADJ PROPN PROPN VERB PUNCT PUNCT ADV VERB VERB VERB NOUN ADP NOUN VERB NOUN NOUN NOUN VERB VERB VERB DET PUNCT PUNCT ADP PRON VERB NOUN NOUN VERB NOUN NOUN ADV VERB PRON PRON PROPN PROPN VERB ADJ ADJ ADJ ADJ ADJ NOUN ADP DET VERB VERB ADJ ADJ ADJ ADJ NOUN ADP PROPN PROPN PROPN PROPN NOUN NOUN
Marx's famous dictum in the opening page of The Eighteenth Brumaire of Louis Bonaparte is not structuralist in Althusser's sense : ' Men make their own history, but they do not make it just as they please'(Marx, 1977, p. 300 ).	0 0 0 0 0 0 0 0 0 0 0 0 0 0 0 0 0 0 0 0 0 0 0 1 0 0 1 0 0 0 0 0 0 0 0 0 0 0 0 0 0	make history	figurative	insertion-other	PROPN ADJ NOUN ADP DET NOUN NOUN ADP DET PROPN PROPN ADP PROPN PROPN VERB ADV ADJ ADP PROPN NOUN PUNCT PUNCT NOUN VERB ADJ ADJ NOUN CCONJ PRON VERB ADV VERB PRON ADV ADP PRON VERB NUM NOUN NUM PUNCT	▁Mar x ' s ▁famous ▁dic tum ▁in ▁the ▁opening ▁page ▁of ▁The ▁Eighteen th ▁B rum aire ▁of ▁Louis ▁Bon a part e ▁is ▁not ▁structural ist ▁in ▁Al th us ser ' s ▁sense ▁ : ▁' ▁Men ▁make ▁their ▁own ▁history , ▁but ▁they ▁do ▁not ▁make ▁it ▁just ▁as ▁they ▁please ' ( Mar x , ▁1977, ▁p . ▁300 ▁ ).	0 0 0 0 0 0 0 0 0 0 0 0 0 0 0 0 0 0 0 0 0 0 0 0 0 0 0 0 0 0 0 0 0 0 0 0 0 0 0 0 1 0 0 1 1 0 0 0 0 0 0 0 0 0 0 0 0 0 0 0 0 0 0 0 0 0	PROPN PROPN PROPN PROPN ADJ NOUN NOUN ADP DET NOUN NOUN ADP DET PROPN PROPN PROPN PROPN PROPN ADP PROPN PROPN PROPN PROPN PROPN VERB ADV ADJ ADJ ADP PROPN PROPN PROPN PROPN PROPN PROPN NOUN PUNCT PUNCT PUNCT NOUN VERB ADJ ADJ NOUN NOUN CCONJ PRON VERB ADV VERB PRON ADV ADP PRON VERB VERB VERB VERB VERB VERB NUM NOUN NOUN NUM PUNCT PUNCT
That the winning of a British Open championship is a two - man team even can best be illustrated by two of the great tournament's champions of the past — two immortals who owe a little of their immortality to the men who strode beside them when they made history : when Henry Cotton won his first Open in 1934, he paid tribute to Ernest Butler of Sandwich, a caddie who was ‘ uncanny with his advice concerning the line of the hole’.	0 0 0 0 0 0 0 0 0 0 0 0 0 0 0 0 0 0 0 0 0 0 0 0 0 0 0 0 0 0 0 0 0 0 0 0 0 0 0 0 0 0 0 0 0 0 0 0 1 1 0 0 0 0 0 0 0 0 0 0 0 0 0 0 0 0 0 0 0 0 0 0 0 0 0 0 0 0 0 0 0 0 0	make history	figurative	inflection	ADP DET NOUN ADP DET ADJ PROPN NOUN VERB DET NUM PUNCT NOUN NOUN ADV VERB ADV VERB VERB ADP NUM ADP DET ADJ NOUN NOUN ADP DET ADJ PUNCT NUM NOUN NOUN VERB DET ADJ ADP ADJ NOUN ADP DET NOUN NOUN VERB ADP PRON ADV PRON VERB NOUN PUNCT ADV PROPN PROPN VERB ADJ ADJ PROPN ADP NUM PRON VERB NOUN ADP PROPN PROPN ADP PROPN DET NOUN NOUN VERB PUNCT NOUN ADP ADJ NOUN VERB DET NOUN ADP DET NOUN	▁That ▁the ▁winning ▁of ▁a ▁British ▁Open ▁champion ship ▁is ▁a ▁two ▁- ▁man ▁team ▁even ▁can ▁best ▁be ▁illustrated ▁by ▁two ▁of ▁the ▁great ▁to urn ament ' s ▁champion s ▁of ▁the ▁past ▁ — ▁two ▁im mor tal s ▁who ▁owe ▁a ▁little ▁of ▁their ▁im mor t ality ▁to ▁the ▁men ▁who ▁str ode ▁be side ▁them ▁when ▁they ▁made ▁history ▁ : ▁when ▁Henry ▁Cotton ▁won ▁his ▁first ▁Open ▁in ▁193 4, ▁he ▁paid ▁tribute ▁to ▁E rn est ▁But ler ▁of ▁S andwich , ▁a ▁c add ie ▁who ▁was ▁ ‘ ▁un can ny ▁with ▁his ▁advice ▁concerning ▁the ▁line ▁of ▁the ▁hole ’ .	0 0 0 0 0 0 0 0 0 0 0 0 0 0 0 0 0 0 0 0 0 0 0 0 0 0 0 0 0 0 0 0 0 0 0 0 0 0 0 0 0 0 0 0 0 0 0 0 0 0 0 0 0 0 0 0 0 0 0 0 0 0 0 1 1 0 0 0 0 0 0 0 0 0 0 0 0 0 0 0 0 0 0 0 0 0 0 0 0 0 0 0 0 0 0 0 0 0 0 0 0 0 0 0 0 0 0 0 0 0 0 0	ADP DET NOUN ADP DET ADJ PROPN NOUN NOUN VERB DET NUM PUNCT NOUN NOUN ADV VERB ADV VERB VERB ADP NUM ADP DET ADJ NOUN NOUN NOUN NOUN NOUN NOUN NOUN ADP DET ADJ PUNCT PUNCT NUM NOUN NOUN NOUN NOUN NOUN VERB DET ADJ ADP ADJ NOUN NOUN NOUN NOUN ADP DET NOUN NOUN VERB VERB ADP ADP PRON ADV PRON VERB NOUN PUNCT PUNCT ADV PROPN PROPN VERB ADJ ADJ PROPN ADP NUM NUM PRON VERB NOUN ADP PROPN PROPN PROPN PROPN PROPN ADP PROPN PROPN PROPN DET NOUN NOUN NOUN NOUN VERB PUNCT PUNCT NOUN NOUN NOUN ADP ADJ NOUN VERB DET NOUN ADP DET NOUN NOUN NOUN
NEW ~ YORK – Now that Barack ~ Obama has made history by being elected President of the United ~ States, people throughout the Asia - Pacific region fervently hope he will focus on Asia in a way that he did not during the election season.	0 0 0 0 0 0 0 0 0 0 1 1 0 0 0 0 0 0 0 0 0 0 0 0 0 0 0 0 0 0 0 0 0 0 0 0 0 0 0 0 0 0 0 0 0 0	make history	figurative	inflection	ADJ PUNCT NOUN PUNCT ADV ADP PROPN PUNCT PROPN VERB VERB NOUN ADP VERB VERB PROPN ADP DET PROPN PUNCT PROPN NOUN ADP DET PROPN PUNCT PROPN NOUN ADV VERB PRON VERB VERB ADP PROPN ADP DET NOUN ADJ PRON VERB ADV ADP DET NOUN NOUN	▁NEW ▁ ~ ▁Y OR K ▁ – ▁Now ▁that ▁Bar ack ▁ ~ ▁Ob ama ▁has ▁made ▁history ▁by ▁being ▁elected ▁President ▁of ▁the ▁United ▁ ~ ▁States , ▁people ▁throughout ▁the ▁Asia ▁- ▁Pacific ▁region ▁fer vent ly ▁hope ▁he ▁will ▁focus ▁on ▁Asia ▁in ▁a ▁way ▁that ▁he ▁did ▁not ▁during ▁the ▁election ▁season .	0 0 0 0 0 0 0 0 0 0 0 0 0 0 0 0 0 1 1 0 0 0 0 0 0 0 0 0 0 0 0 0 0 0 0 0 0 0 0 0 0 0 0 0 0 0 0 0 0 0 0 0 0 0 0 0 0 0	ADJ PUNCT PUNCT NOUN NOUN NOUN PUNCT PUNCT ADV ADP PROPN PROPN PUNCT PUNCT PROPN PROPN VERB VERB NOUN ADP VERB VERB PROPN ADP DET PROPN PUNCT PUNCT PROPN PROPN NOUN ADP DET PROPN PUNCT PROPN NOUN ADV ADV ADV VERB PRON VERB VERB ADP PROPN ADP DET NOUN ADJ PRON VERB ADV ADP DET NOUN NOUN NOUN
When Richard Burnell made a little sporting history.	0 0 0 1 0 0 0 1	make history	figurative	combined-inflection	ADV PROPN PROPN VERB DET ADJ NOUN NOUN	▁When ▁Richard ▁Bur n ell ▁made ▁a ▁little ▁sporting ▁history .	0 0 0 0 0 1 0 0 0 1 1	ADV PROPN PROPN PROPN PROPN VERB DET ADJ NOUN NOUN NOUN
I made history — remember.	0 1 1 0 0	make history	figurative	inflection	PRON VERB NOUN PUNCT VERB	▁I ▁made ▁history ▁ — ▁remember .	0 1 1 0 0 0 0	PRON VERB NOUN PUNCT PUNCT VERB VERB
Marx is deeply opposed to the idea that a theory has a ‘ starting - point’, and in particular to the claim that social phenomena can be explained as the result of universal properties of individuals, and Althusser sums up his scepticism with an epigrammatic flourish : the classical idea that man makes his own history must be countered with the question ‘ How is the man who makes history made?’	0 0 0 0 0 0 0 0 0 0 0 0 0 0 0 0 0 0 0 0 0 0 0 0 0 0 0 0 0 0 0 0 0 0 0 0 0 0 0 0 0 0 0 0 0 0 0 0 0 0 0 0 0 0 0 0 0 0 0 0 0 0 0 0 0 0 0 0 1 1 0	make history	figurative	inflection	PROPN VERB ADV ADJ ADP DET NOUN ADP DET NOUN VERB DET PUNCT NOUN PUNCT ADV CCONJ ADP ADJ ADP DET NOUN ADP ADJ NOUN VERB VERB VERB ADP DET NOUN ADP ADJ NOUN ADP NOUN CCONJ PROPN VERB PART ADJ NOUN ADP DET ADJ NOUN PUNCT DET ADJ NOUN ADP NOUN VERB ADJ ADJ NOUN VERB VERB VERB ADP DET NOUN PUNCT ADV VERB DET NOUN NOUN VERB NOUN NOUN	▁Mar x ▁is ▁deeply ▁opposed ▁to ▁the ▁idea ▁that ▁a ▁theory ▁has ▁a ▁ ‘ ▁starting ▁- ▁point ’ , ▁and ▁in ▁particular ▁to ▁the ▁claim ▁that ▁social ▁phenomena ▁can ▁be ▁explained ▁as ▁the ▁result ▁of ▁universal ▁properties ▁of ▁individuals , ▁and ▁Al th us ser ▁sums ▁up ▁his ▁sceptic ism ▁with ▁an ▁epi gram matic ▁flourish ▁ : ▁the ▁classical ▁idea ▁that ▁man ▁makes ▁his ▁own ▁history ▁must ▁be ▁counter ed ▁with ▁the ▁question ▁ ‘ ▁How ▁is ▁the ▁man ▁who ▁makes ▁history ▁made ? ’	0 0 0 0 0 0 0 0 0 0 0 0 0 0 0 0 0 0 0 0 0 0 0 0 0 0 0 0 0 0 0 0 0 0 0 0 0 0 0 0 0 0 0 0 0 0 0 0 0 0 0 0 0 0 0 0 0 0 0 0 0 0 0 0 0 0 0 0 0 0 0 0 0 0 0 0 0 0 0 0 0 0 1 1 0 0 0	PROPN PROPN VERB ADV ADJ ADP DET NOUN ADP DET NOUN VERB DET PUNCT PUNCT NOUN PUNCT ADV ADV ADV CCONJ ADP ADJ ADP DET NOUN ADP ADJ NOUN VERB VERB VERB ADP DET NOUN ADP ADJ NOUN ADP NOUN NOUN CCONJ PROPN PROPN PROPN PROPN VERB PART ADJ NOUN NOUN ADP DET ADJ ADJ ADJ NOUN PUNCT PUNCT DET ADJ NOUN ADP NOUN VERB ADJ ADJ NOUN VERB VERB VERB VERB ADP DET NOUN PUNCT PUNCT ADV VERB DET NOUN NOUN VERB NOUN NOUN NOUN NOUN
It was always likely that this would happen again this year, given that the Walker Cup team were making history whereas Faldo, for all his brilliance, was the second Briton and the fourth European in the Eighties to win at Augusta.	0 0 0 0 0 0 0 0 0 0 0 0 0 0 0 0 0 0 1 1 0 0 0 0 0 0 0 0 0 0 0 0 0 0 0 0 0 0 0 0 0	make history	figurative	inflection	PRON VERB ADV ADJ ADP DET VERB VERB ADV DET NOUN VERB ADP DET PROPN PROPN NOUN VERB VERB NOUN ADP PROPN ADP ADJ ADJ NOUN VERB DET ADJ PROPN CCONJ DET ADJ PROPN ADP DET PROPN PART VERB ADP PROPN	▁It ▁was ▁always ▁likely ▁that ▁this ▁would ▁happen ▁again ▁this ▁year , ▁given ▁that ▁the ▁W al ker ▁C up ▁team ▁were ▁making ▁history ▁whereas ▁F al do , ▁for ▁all ▁his ▁br il liance , ▁was ▁the ▁second ▁Brit on ▁and ▁the ▁fourth ▁European ▁in ▁the ▁Eight ies ▁to ▁win ▁at ▁August a .	0 0 0 0 0 0 0 0 0 0 0 0 0 0 0 0 0 0 0 0 0 0 1 1 0 0 0 0 0 0 0 0 0 0 0 0 0 0 0 0 0 0 0 0 0 0 0 0 0 0 0 0 0 0 0	PRON VERB ADV ADJ ADP DET VERB VERB ADV DET NOUN NOUN VERB ADP DET PROPN PROPN PROPN PROPN PROPN NOUN VERB VERB NOUN ADP PROPN PROPN PROPN PROPN ADP ADJ ADJ NOUN NOUN NOUN NOUN VERB DET ADJ PROPN PROPN CCONJ DET ADJ PROPN ADP DET PROPN PROPN PART VERB ADP PROPN PROPN PROPN
