Nevertheless, Hall's show has made US TV history.	0 0 0 0 1 0 0 1	make history	figurative	combined-inflection	ADV PROPN NOUN VERB VERB PROPN NOUN NOUN	▁Nevertheless , ▁Hall ' s ▁show ▁has ▁made ▁US ▁TV ▁history .	0 0 0 0 0 0 0 1 0 0 1 1	ADV ADV PROPN PROPN PROPN NOUN VERB VERB PROPN NOUN NOUN NOUN
ONE hundred years ago theatre history was made in Bury St Edmonds.	0 0 0 0 0 1 0 1 0 0 0 0	make history	figurative	misc	NUM NUM NOUN ADV NOUN NOUN VERB VERB ADP PROPN PROPN PROPN	▁ONE ▁hundred ▁years ▁ago ▁theatre ▁history ▁was ▁made ▁in ▁Bur y ▁St ▁E d mond s .	0 0 0 0 0 1 0 1 0 0 0 0 0 0 0 0 0	NUM NUM NOUN ADV NOUN NOUN VERB VERB ADP PROPN PROPN PROPN PROPN PROPN PROPN PROPN PROPN
But while their cricketing cousins were making history at the Calcutta Eden Garden pitch, rugby was still embroiled in the hard world of politics.	0 0 0 0 0 0 1 1 0 0 0 0 0 0 0 0 0 0 0 0 0 0 0 0	make history	figurative	inflection	CCONJ ADP ADJ NOUN NOUN VERB VERB NOUN ADP DET PROPN PROPN PROPN NOUN NOUN VERB ADV VERB ADP DET ADJ NOUN ADP NOUN	▁But ▁while ▁their ▁cri cke ting ▁co us ins ▁were ▁making ▁history ▁at ▁the ▁Cal cut ta ▁E den ▁Garden ▁pitch , ▁ rug by ▁was ▁still ▁em bro il ed ▁in ▁the ▁hard ▁world ▁of ▁politics .	0 0 0 0 0 0 0 0 0 0 1 1 0 0 0 0 0 0 0 0 0 0 0 0 0 0 0 0 0 0 0 0 0 0 0 0 0 0	CCONJ ADP ADJ NOUN NOUN NOUN NOUN NOUN NOUN VERB VERB NOUN ADP DET PROPN PROPN PROPN PROPN PROPN PROPN NOUN NOUN NOUN NOUN NOUN VERB ADV VERB VERB VERB VERB ADP DET ADJ NOUN ADP NOUN NOUN
THIS is the moment history was made.	0 0 0 0 1 0 1	make history	figurative	misc	DET VERB DET NOUN NOUN VERB VERB	▁THIS ▁is ▁the ▁moment ▁history ▁was ▁made .	0 0 0 0 1 0 1 1	DET VERB DET NOUN NOUN VERB VERB VERB
THE Labour leader, Mr Neil Kinnock, made history yesterday when he appointed Mr Paul Boateng to his front bench Treasury team, the first black MP to be given a front bench post in Parliament.	0 0 0 0 0 0 1 1 0 0 0 0 0 0 0 0 0 0 0 0 0 0 0 0 0 0 0 0 0 0 0 0 0 0	make history	figurative	inflection	DET PROPN NOUN PROPN PROPN PROPN VERB NOUN NOUN ADV PRON VERB PROPN PROPN PROPN ADP ADJ ADJ NOUN PROPN NOUN DET ADJ ADJ PROPN PART VERB VERB DET ADJ NOUN NOUN ADP PROPN	▁THE ▁Labour ▁leader , ▁Mr ▁ Neil ▁Kin nock , ▁made ▁history ▁yesterday ▁when ▁he ▁appointed ▁Mr ▁Paul ▁B oate ng ▁to ▁his ▁front ▁bench ▁Treasury ▁team , ▁the ▁first ▁black ▁MP ▁to ▁be ▁given ▁a ▁front ▁bench ▁post ▁in ▁Parliament .	0 0 0 0 0 0 0 0 0 0 1 1 0 0 0 0 0 0 0 0 0 0 0 0 0 0 0 0 0 0 0 0 0 0 0 0 0 0 0 0 0 0	DET PROPN NOUN NOUN PROPN PROPN PROPN PROPN PROPN PROPN VERB NOUN NOUN ADV PRON VERB PROPN PROPN PROPN PROPN PROPN ADP ADJ ADJ NOUN PROPN NOUN NOUN DET ADJ ADJ PROPN PART VERB VERB DET ADJ NOUN NOUN ADP PROPN PROPN
And Sheffield Crown Court has heard how a man allegedly kidnapped and raped his wife ; the man who can't be named for legal reasons, was separated from her at the time of the supposed attack, and the case is making legal history.	0 0 0 0 0 0 0 0 0 0 0 0 0 0 0 0 0 0 0 0 0 0 0 0 0 0 0 0 0 0 0 0 0 0 0 0 0 0 0 0 1 0 1	make history	figurative	combined-inflection	CCONJ PROPN PROPN PROPN VERB VERB ADV DET NOUN ADV VERB CCONJ VERB ADJ NOUN PUNCT DET NOUN NOUN VERB VERB VERB ADP ADJ NOUN VERB VERB ADP PRON ADP DET NOUN ADP DET VERB NOUN CCONJ DET NOUN VERB VERB ADJ NOUN	▁And ▁She f field ▁Crown ▁Court ▁has ▁heard ▁how ▁a ▁man ▁allegedly ▁kid na pped ▁and ▁rape d ▁his ▁wife ▁ ; ▁the ▁man ▁who ▁can ' t ▁be ▁named ▁for ▁legal ▁reasons , ▁was ▁separated ▁from ▁her ▁at ▁the ▁time ▁of ▁the ▁supposed ▁attack , ▁and ▁the ▁case ▁is ▁making ▁legal ▁history .	0 0 0 0 0 0 0 0 0 0 0 0 0 0 0 0 0 0 0 0 0 0 0 0 0 0 0 0 0 0 0 0 0 0 0 0 0 0 0 0 0 0 0 0 0 0 0 0 0 0 1 0 1 1	CCONJ PROPN PROPN PROPN PROPN PROPN VERB VERB ADV DET NOUN ADV VERB VERB VERB CCONJ VERB VERB ADJ NOUN PUNCT PUNCT DET NOUN NOUN VERB VERB VERB VERB VERB ADP ADJ NOUN NOUN VERB VERB ADP PRON ADP DET NOUN ADP DET VERB NOUN NOUN CCONJ DET NOUN VERB VERB ADJ NOUN NOUN
A 14-YEAR - OLD girl will make British legal history tomorrow when she defends her right to ' divorce ' her parents.	0 0 0 0 0 0 1 0 0 1 0 0 0 0 0 0 0 0 0 0 0 0	make history	figurative	insertion-other	DET NUM PUNCT PROPN NOUN VERB VERB ADJ ADJ NOUN NOUN ADV PRON VERB PRON NOUN ADP PUNCT NOUN PUNCT ADJ NOUN	▁A ▁14 - Y EAR ▁- ▁ OLD ▁girl ▁will ▁make ▁British ▁legal ▁history ▁tomorrow ▁when ▁she ▁defend s ▁her ▁right ▁to ▁' ▁divorce ▁' ▁her ▁parents .	0 0 0 0 0 0 0 0 0 0 1 0 0 1 0 0 0 0 0 0 0 0 0 0 0 0 0 0	DET NUM NUM NUM NUM PUNCT PROPN PROPN NOUN VERB VERB ADJ ADJ NOUN NOUN ADV PRON VERB VERB PRON NOUN ADP PUNCT NOUN PUNCT ADJ NOUN NOUN
It is blueish in colour, six times larger than a chicken's egg, and about to make ornithological history.	0 0 0 0 0 0 0 0 0 0 0 0 0 0 0 1 0 1	make history	figurative	insertion-other	PRON VERB ADJ ADP NOUN NUM NOUN ADJ ADP DET NOUN NOUN CCONJ ADV PART VERB ADJ NOUN	▁It ▁is ▁blue ish ▁in ▁colour , ▁six ▁times ▁larger ▁than ▁a ▁chicken ' s ▁egg , ▁and ▁about ▁to ▁make ▁or ni th ological ▁history .	0 0 0 0 0 0 0 0 0 0 0 0 0 0 0 0 0 0 0 0 1 0 0 0 0 1 1	PRON VERB ADJ ADJ ADP NOUN NOUN NUM NOUN ADJ ADP DET NOUN NOUN NOUN NOUN NOUN CCONJ ADV PART VERB ADJ ADJ ADJ ADJ NOUN NOUN
A boat called Dodo's Delight sailed out of Falmouth harbour this week … on board a crew of old boys from Kingham Hill School in Oxfordshire … they're off to make history as the first school group to sail around the world … they'll be gone for twenty months … so we 're waving them goodbye in our Friday Feature	0 0 0 0 0 0 0 0 0 0 0 0 0 0 0 0 0 0 0 0 0 0 0 0 0 0 0 0 0 0 1 1 0 0 0 0 0 0 0 0 0 0 0 0 0 0 0 0 0 0 0 0 0 0 0 0 0 0 0 0	make history	figurative	identical	DET NOUN VERB PROPN NOUN VERB ADP ADP PROPN NOUN DET NOUN PUNCT ADP NOUN DET NOUN ADP ADJ NOUN ADP PROPN PROPN PROPN ADP PROPN PUNCT PRON PART PART VERB NOUN ADP DET ADJ NOUN NOUN PART VERB ADP DET NOUN PUNCT PRON VERB VERB ADP NUM NOUN PUNCT ADV PRON VERB VERB PRON NOUN ADP ADJ PROPN NOUN	▁A ▁boat ▁called ▁Do do ' s ▁De light ▁sail ed ▁out ▁of ▁F al mouth ▁harbour ▁this ▁week ▁... ▁on ▁board ▁a ▁crew ▁of ▁old ▁boys ▁from ▁King ham ▁Hill ▁School ▁in ▁Ox fordshire ▁... ▁they ' re ▁off ▁to ▁make ▁history ▁as ▁the ▁first ▁school ▁group ▁to ▁sail ▁around ▁the ▁world ▁... ▁they ' ll ▁be ▁gone ▁for ▁twenty ▁months ▁... ▁so ▁we ▁' re ▁wa ving ▁them ▁good by e ▁in ▁our ▁Friday ▁ Feature	0 0 0 0 0 0 0 0 0 0 0 0 0 0 0 0 0 0 0 0 0 0 0 0 0 0 0 0 0 0 0 0 0 0 0 0 0 0 0 0 0 1 1 0 0 0 0 0 0 0 0 0 0 0 0 0 0 0 0 0 0 0 0 0 0 0 0 0 0 0 0 0 0 0 0 0 0 0	DET NOUN VERB PROPN PROPN PROPN PROPN NOUN NOUN VERB VERB ADP ADP PROPN PROPN PROPN NOUN DET NOUN PUNCT ADP NOUN DET NOUN ADP ADJ NOUN ADP PROPN PROPN PROPN PROPN ADP PROPN PROPN PUNCT PRON PRON PRON PART PART VERB NOUN ADP DET ADJ NOUN NOUN PART VERB ADP DET NOUN PUNCT PRON PRON PRON VERB VERB ADP NUM NOUN PUNCT ADV PRON VERB VERB VERB VERB PRON NOUN NOUN NOUN ADP ADJ PROPN NOUN NOUN
This is how history is made, thought Lydia despairingly.	0 0 0 1 0 1 0 0 0	make history	figurative	misc	DET VERB ADV NOUN VERB VERB VERB PROPN ADV	▁This ▁is ▁how ▁history ▁is ▁made , ▁thought ▁L y dia ▁despair ing ly .	0 0 0 1 0 1 1 0 0 0 0 0 0 0 0	DET VERB ADV NOUN VERB VERB VERB VERB PROPN PROPN PROPN ADV ADV ADV ADV
Nomads did not have addresses, did not make the history of territories.	0 0 0 0 0 0 0 1 0 1 0 0	make history	figurative	insertion-determiner	NOUN VERB ADV VERB NOUN VERB ADV VERB DET NOUN ADP NOUN	▁No mad s ▁did ▁not ▁have ▁addresses , ▁did ▁not ▁make ▁the ▁history ▁of ▁territories .	0 0 0 0 0 0 0 0 0 0 1 0 1 0 0 0	NOUN NOUN NOUN VERB ADV VERB NOUN NOUN VERB ADV VERB DET NOUN ADP NOUN NOUN
Everyone felt that history was being made.	0 0 0 1 0 0 1	make history	figurative	misc	NOUN VERB ADP NOUN VERB VERB VERB	▁Every one ▁felt ▁that ▁history ▁was ▁being ▁made .	0 0 0 0 1 0 0 1 1	NOUN NOUN VERB ADP NOUN VERB VERB VERB VERB
Dayflower made history last week at York when she became the first Dubai trained runner to win in England and 31-year - old trainer Indian Satish Seewar will be hoping for a similar landmark in Ireland.	0 1 1 0 0 0 0 0 0 0 0 0 0 0 0 0 0 0 0 0 0 0 0 0 0 0 0 0 0 0 0 0 0 0 0 0	make history	figurative	inflection	PROPN VERB NOUN ADJ NOUN ADP PROPN ADV PRON VERB DET ADJ PROPN VERB NOUN PART VERB ADP PROPN CCONJ NUM PUNCT ADJ NOUN PROPN PROPN PROPN VERB VERB VERB ADP DET ADJ NOUN ADP PROPN	▁Day flower ▁made ▁history ▁last ▁week ▁at ▁York ▁when ▁she ▁became ▁the ▁first ▁Dubai ▁trained ▁ runner ▁to ▁win ▁in ▁England ▁and ▁31 - year ▁- ▁old ▁train er ▁Indian ▁S at ish ▁See war ▁will ▁be ▁hoping ▁for ▁a ▁similar ▁land mark ▁in ▁Ireland .	0 0 1 1 0 0 0 0 0 0 0 0 0 0 0 0 0 0 0 0 0 0 0 0 0 0 0 0 0 0 0 0 0 0 0 0 0 0 0 0 0 0 0 0 0 0	PROPN PROPN VERB NOUN ADJ NOUN ADP PROPN ADV PRON VERB DET ADJ PROPN VERB NOUN NOUN PART VERB ADP PROPN CCONJ NUM NUM NUM PUNCT ADJ NOUN NOUN PROPN PROPN PROPN PROPN PROPN PROPN VERB VERB VERB ADP DET ADJ NOUN NOUN ADP PROPN PROPN
For instrumentalists this is what Marx meant by his classic statement about men making history but not in circumstances of their own choosing.	0 0 0 0 0 0 0 0 0 0 0 0 0 1 1 0 0 0 0 0 0 0 0	make history	figurative	inflection	ADP NOUN DET VERB NOUN PROPN VERB ADP ADJ ADJ NOUN ADP NOUN VERB NOUN CCONJ ADV ADP NOUN ADP ADJ ADJ NOUN	▁For ▁instrument al ists ▁this ▁is ▁what ▁Mar x ▁meant ▁by ▁his ▁classic ▁statement ▁about ▁men ▁making ▁history ▁but ▁not ▁in ▁circumstances ▁of ▁their ▁own ▁choosing .	0 0 0 0 0 0 0 0 0 0 0 0 0 0 0 0 1 1 0 0 0 0 0 0 0 0 0	ADP NOUN NOUN NOUN DET VERB NOUN PROPN PROPN VERB ADP ADJ ADJ NOUN ADP NOUN VERB NOUN CCONJ ADV ADP NOUN ADP ADJ ADJ NOUN NOUN
How can man make history if at the same time it is history which makes him?	0 0 0 1 1 0 0 0 0 0 0 0 0 0 0 0	make history	figurative	identical	ADV VERB VERB VERB NOUN ADP ADP DET ADJ NOUN PRON VERB NOUN ADJ VERB PRON	▁How ▁can ▁man ▁make ▁history ▁if ▁at ▁the ▁same ▁time ▁it ▁is ▁history ▁which ▁makes ▁him ?	0 0 0 1 1 0 0 0 0 0 0 0 0 0 0 0 0	ADV VERB VERB VERB NOUN ADP ADP DET ADJ NOUN PRON VERB NOUN ADJ VERB PRON PRON
The first admissions were two months ago, but Mrs Hymes will today make history by becoming the oldest woman to hold the title.	0 0 0 0 0 0 0 0 0 0 0 0 1 1 0 0 0 0 0 0 0 0 0	make history	figurative	identical	DET ADJ NOUN VERB NUM NOUN ADV CCONJ PROPN PROPN VERB NOUN VERB NOUN ADP VERB DET ADJ NOUN PART VERB DET NOUN	▁The ▁first ▁admission s ▁were ▁two ▁months ▁ago , ▁but ▁Mrs ▁Hy mes ▁will ▁today ▁make ▁history ▁by ▁becoming ▁the ▁oldest ▁woman ▁to ▁hold ▁the ▁title .	0 0 0 0 0 0 0 0 0 0 0 0 0 0 0 1 1 0 0 0 0 0 0 0 0 0 0	DET ADJ NOUN NOUN VERB NUM NOUN ADV ADV CCONJ PROPN PROPN PROPN VERB NOUN VERB NOUN ADP VERB DET ADJ NOUN PART VERB DET NOUN NOUN
AN ORGY of steam traction comes to Dorset on the weekend of September 19 and 20 with history being made as six locomotives steam at once during a special fund - raising Grand Steam Gala — the most locos ever seen in the Isle of Purbeck.	0 0 0 0 0 0 0 0 0 0 0 0 0 0 0 0 0 1 0 1 0 0 0 0 0 0 0 0 0 0 0 0 0 0 0 0 0 0 0 0 0 0 0 0 0 0	make history	figurative	misc	DET NOUN ADP NOUN NOUN VERB ADP PROPN ADP DET NOUN ADP PROPN NUM CCONJ NUM ADP NOUN VERB VERB ADP NUM NOUN VERB ADP ADV ADP DET ADJ NOUN PUNCT VERB PROPN PROPN PROPN PUNCT DET ADJ VERB ADV VERB ADP DET PROPN ADP PROPN	▁AN ▁OR GY ▁of ▁steam ▁traction ▁comes ▁to ▁D or set ▁on ▁the ▁weekend ▁of ▁September ▁19 ▁and ▁20 ▁with ▁history ▁being ▁made ▁as ▁six ▁locomotives ▁steam ▁at ▁once ▁during ▁a ▁special ▁fund ▁- ▁raising ▁Grand ▁Steam ▁Gal a ▁ — ▁the ▁most ▁lo cos ▁ever ▁seen ▁in ▁the ▁Isle ▁of ▁Pur beck .	0 0 0 0 0 0 0 0 0 0 0 0 0 0 0 0 0 0 0 0 1 0 1 0 0 0 0 0 0 0 0 0 0 0 0 0 0 0 0 0 0 0 0 0 0 0 0 0 0 0 0 0 0 0	DET NOUN NOUN ADP NOUN NOUN VERB ADP PROPN PROPN PROPN ADP DET NOUN ADP PROPN NUM CCONJ NUM ADP NOUN VERB VERB ADP NUM NOUN VERB ADP ADV ADP DET ADJ NOUN PUNCT VERB PROPN PROPN PROPN PROPN PUNCT PUNCT DET ADJ VERB VERB ADV VERB ADP DET PROPN ADP PROPN PROPN PROPN
The Zuwaya did have two relatively specialized kinds of historian : older men tended to make more history than younger ones, and some poets included historical subjects in their repertoire as well as amorous and religious ones.	0 0 0 0 0 0 0 0 0 0 0 0 0 0 0 1 0 1 0 0 0 0 0 0 0 0 0 0 0 0 0 0 0 0 0 0 0	make history	figurative	insertion-other	DET PROPN VERB VERB NUM ADV ADJ NOUN ADP NOUN PUNCT ADJ NOUN VERB PART VERB ADJ NOUN ADP ADJ NOUN CCONJ DET NOUN VERB ADJ NOUN ADP ADJ NOUN ADV ADV ADP ADJ CCONJ ADJ NOUN	▁The ▁Zu way a ▁did ▁have ▁two ▁relatively ▁ specialized ▁kinds ▁of ▁his tor ian ▁ : ▁older ▁men ▁tended ▁to ▁make ▁more ▁history ▁than ▁younger ▁ones , ▁and ▁some ▁poet s ▁included ▁historical ▁subjects ▁in ▁their ▁re per to ire ▁as ▁well ▁as ▁am or ous ▁and ▁religious ▁ones .	0 0 0 0 0 0 0 0 0 0 0 0 0 0 0 0 0 0 0 0 0 1 0 1 0 0 0 0 0 0 0 0 0 0 0 0 0 0 0 0 0 0 0 0 0 0 0 0 0 0 0	DET PROPN PROPN PROPN VERB VERB NUM ADV ADJ ADJ NOUN ADP NOUN NOUN NOUN PUNCT PUNCT ADJ NOUN VERB PART VERB ADJ NOUN ADP ADJ NOUN NOUN CCONJ DET NOUN NOUN VERB ADJ NOUN ADP ADJ NOUN NOUN NOUN NOUN ADV ADV ADP ADJ ADJ ADJ CCONJ ADJ NOUN NOUN
In fact, it's a philosophy that's making history and leading the way into Europe.	0 0 0 0 0 0 1 1 0 0 0 0 0 0	make history	figurative	inflection	ADP NOUN PRON DET NOUN ADJ VERB NOUN CCONJ VERB DET NOUN ADP PROPN	▁In ▁fact , ▁it ' s ▁a ▁philosophy ▁that ' s ▁making ▁history ▁and ▁leading ▁the ▁way ▁into ▁Europe .	0 0 0 0 0 0 0 0 0 0 0 1 1 0 0 0 0 0 0 0	ADP NOUN NOUN PRON PRON PRON DET NOUN ADJ ADJ ADJ VERB NOUN CCONJ VERB DET NOUN ADP PROPN PROPN
The star of this anniversary show, however, will be the National Railway Museum 4 - 4 - 0 ' City of Truro ' No. 3440 which made world history in 1904 as the first steam locomotive to attain 100 miles per hour while descending nearby Wellington Bank!	0 0 0 0 0 0 0 0 0 0 0 0 0 0 0 0 0 0 0 0 0 0 0 0 0 0 1 0 1 0 0 0 0 0 0 0 0 0 0 0 0 0 0 0 0 0 0	make history	figurative	combined-inflection	DET NOUN ADP DET NOUN NOUN ADV VERB VERB DET PROPN PROPN PROPN NUM SYM NUM SYM NUM PUNCT PROPN ADP PROPN PUNCT NOUN NUM ADJ VERB NOUN NOUN ADP NUM ADP DET ADJ NOUN NOUN PART VERB NUM NOUN ADP NOUN ADP VERB ADV PROPN PROPN	▁The ▁star ▁of ▁this ▁anni versary ▁show , ▁however , ▁will ▁be ▁the ▁National ▁Railway ▁M use um ▁4 ▁- ▁4 ▁- ▁0 ▁' ▁City ▁of ▁Tru ro ▁' ▁No . ▁34 40 ▁which ▁made ▁world ▁history ▁in ▁19 04 ▁as ▁the ▁first ▁steam ▁locomotive ▁to ▁attain ▁100 ▁miles ▁per ▁hour ▁while ▁descending ▁nearby ▁Well ing ton ▁Bank !	0 0 0 0 0 0 0 0 0 0 0 0 0 0 0 0 0 0 0 0 0 0 0 0 0 0 0 0 0 0 0 0 0 0 1 0 1 0 0 0 0 0 0 0 0 0 0 0 0 0 0 0 0 0 0 0 0 0 0	DET NOUN ADP DET NOUN NOUN NOUN NOUN ADV ADV VERB VERB DET PROPN PROPN PROPN PROPN PROPN NUM SYM NUM SYM NUM PUNCT PROPN ADP PROPN PROPN PUNCT NOUN NOUN NUM NUM ADJ VERB NOUN NOUN ADP NUM NUM ADP DET ADJ NOUN NOUN PART VERB NUM NOUN ADP NOUN ADP VERB ADV PROPN PROPN PROPN PROPN PROPN
TO THE poignant music of the ' Last Post ', InterCity made railway history on May 20 by celebrating the centenary of the completion of the GWR's transition from Brunel's seven - foot broad gauge to Stephenson's narrower standard gauge.	0 0 0 0 0 0 0 0 0 0 0 1 0 1 0 0 0 0 0 0 0 0 0 0 0 0 0 0 0 0 0 0 0 0 0 0 0 0 0 0	make history	figurative	combined-inflection	ADP DET ADJ NOUN ADP DET PUNCT ADJ NOUN PUNCT PROPN VERB NOUN NOUN ADP PROPN NUM ADP VERB DET NOUN ADP DET NOUN ADP DET PROPN NOUN ADP PROPN NUM PUNCT NOUN ADJ NOUN ADP PROPN ADJ ADJ NOUN	▁TO ▁THE ▁ poi gnant ▁music ▁of ▁the ▁' ▁Last ▁Post ▁' , ▁Inter C ity ▁made ▁railway ▁history ▁on ▁May ▁20 ▁by ▁celebrat ing ▁the ▁cent en ary ▁of ▁the ▁completion ▁of ▁the ▁G WR ' s ▁transition ▁from ▁Brun el ' s ▁seven ▁- ▁foot ▁broad ▁gauge ▁to ▁Step hen son ' s ▁narrow er ▁standard ▁gauge .	0 0 0 0 0 0 0 0 0 0 0 0 0 0 0 0 1 0 1 0 0 0 0 0 0 0 0 0 0 0 0 0 0 0 0 0 0 0 0 0 0 0 0 0 0 0 0 0 0 0 0 0 0 0 0 0 0 0 0 0	ADP DET ADJ ADJ ADJ NOUN ADP DET PUNCT ADJ NOUN PUNCT PUNCT PROPN PROPN PROPN VERB NOUN NOUN ADP PROPN NUM ADP VERB VERB DET NOUN NOUN NOUN ADP DET NOUN ADP DET PROPN PROPN PROPN PROPN NOUN ADP PROPN PROPN PROPN PROPN NUM PUNCT NOUN ADJ NOUN ADP PROPN PROPN PROPN PROPN PROPN ADJ ADJ ADJ NOUN NOUN
One CD manufacturing plant set up just seven years ago today produced its one hundred millionth disc … the band Go West were there to see their music make history.	0 0 0 0 0 0 0 0 0 0 0 0 0 0 0 0 0 0 0 0 0 0 0 0 0 0 0 0 1 1	make history	figurative	identical	NUM NOUN NOUN NOUN VERB PART ADV NUM NOUN ADV NOUN VERB ADJ NUM NUM NOUN NOUN PUNCT DET NOUN PROPN PROPN VERB ADV PART VERB ADJ NOUN VERB NOUN	▁One ▁CD ▁manufacturing ▁plant ▁set ▁up ▁just ▁seven ▁years ▁ago ▁today ▁produced ▁its ▁one ▁hundred ▁million th ▁disc ▁... ▁the ▁band ▁Go ▁West ▁were ▁there ▁to ▁see ▁their ▁music ▁make ▁history .	0 0 0 0 0 0 0 0 0 0 0 0 0 0 0 0 0 0 0 0 0 0 0 0 0 0 0 0 0 1 1 1	NUM NOUN NOUN NOUN VERB PART ADV NUM NOUN ADV NOUN VERB ADJ NUM NUM NOUN NOUN NOUN PUNCT DET NOUN PROPN PROPN VERB ADV PART VERB ADJ NOUN VERB NOUN NOUN
Kamara had no great love for Scottish strikers ; in April 1988 he made legal history as the first English League player to be fined in court for an on - pitch assault.	0 0 0 0 0 0 0 0 0 0 0 0 0 1 0 1 0 0 0 0 0 0 0 0 0 0 0 0 0 0 0 0 0	make history	figurative	combined-inflection	PROPN VERB DET ADJ NOUN ADP ADJ NOUN PUNCT ADP PROPN NUM PRON VERB ADJ NOUN ADP DET ADJ PROPN PROPN NOUN PART VERB VERB ADP NOUN ADP DET ADP PUNCT NOUN NOUN	▁Ka mara ▁had ▁no ▁great ▁love ▁for ▁Scottish ▁strike rs ▁ ; ▁in ▁April ▁1988 ▁he ▁made ▁legal ▁history ▁as ▁the ▁first ▁English ▁League ▁player ▁to ▁be ▁fined ▁in ▁court ▁for ▁an ▁on ▁- ▁pitch ▁assault .	0 0 0 0 0 0 0 0 0 0 0 0 0 0 0 0 1 0 1 0 0 0 0 0 0 0 0 0 0 0 0 0 0 0 0 0 0	PROPN PROPN VERB DET ADJ NOUN ADP ADJ NOUN NOUN PUNCT PUNCT ADP PROPN NUM PRON VERB ADJ NOUN ADP DET ADJ PROPN PROPN NOUN PART VERB VERB ADP NOUN ADP DET ADP PUNCT NOUN NOUN NOUN
But if there is to be an Oxford mafia in Washington, it won't be the first time former University College students have made history.	0 0 0 0 0 0 0 0 0 0 0 0 0 0 0 0 0 0 0 0 0 0 1 1	make history	figurative	inflection	CCONJ ADP ADV VERB PART VERB DET PROPN NOUN ADP PROPN PRON VERB VERB DET ADJ NOUN ADJ PROPN PROPN NOUN VERB VERB NOUN	▁But ▁if ▁there ▁is ▁to ▁be ▁an ▁Oxford ▁m afia ▁in ▁Washington , ▁it ▁won ' t ▁be ▁the ▁first ▁time ▁former ▁University ▁College ▁students ▁have ▁made ▁history .	0 0 0 0 0 0 0 0 0 0 0 0 0 0 0 0 0 0 0 0 0 0 0 0 0 0 1 1 1	CCONJ ADP ADV VERB PART VERB DET PROPN NOUN NOUN ADP PROPN PROPN PRON VERB VERB VERB VERB DET ADJ NOUN ADJ PROPN PROPN NOUN VERB VERB NOUN NOUN
Considering that this was just the period when women were making history, Thompson has got it very wrong indeed.	0 0 0 0 0 0 0 0 0 0 1 1 0 0 0 0 0 0 0	make history	figurative	inflection	VERB ADP DET VERB ADV DET NOUN ADV NOUN VERB VERB NOUN PROPN VERB VERB PRON ADV ADJ ADV	▁Consider ing ▁that ▁this ▁was ▁just ▁the ▁period ▁when ▁women ▁were ▁making ▁history , ▁T hom ps on ▁has ▁got ▁it ▁very ▁wrong ▁indeed .	0 0 0 0 0 0 0 0 0 0 0 1 1 1 0 0 0 0 0 0 0 0 0 0 0	VERB VERB ADP DET VERB ADV DET NOUN ADV NOUN VERB VERB NOUN NOUN PROPN PROPN PROPN PROPN VERB VERB PRON ADV ADJ ADV ADV
A PUBLIC inquiry today could make legal history as the Nature Conservancy Council attempts for the first time to purchase compulsorily a farmer's land to protect a rich wildlife habitat.	0 0 0 0 0 1 0 1 0 0 0 0 0 0 0 0 0 0 0 0 0 0 0 0 0 0 0 0 0 0	make history	figurative	insertion-other	DET ADJ NOUN NOUN VERB VERB ADJ NOUN ADP DET PROPN PROPN PROPN VERB ADP DET ADJ NOUN PART VERB ADV DET NOUN NOUN PART VERB DET ADJ NOUN NOUN	▁A ▁PUBLIC ▁inquiry ▁today ▁could ▁make ▁legal ▁history ▁as ▁the ▁Nature ▁Con serv ancy ▁Council ▁attempts ▁for ▁the ▁first ▁time ▁to ▁purchase ▁compulsor ily ▁a ▁farmer ' s ▁land ▁to ▁protect ▁a ▁rich ▁wildlife ▁habitat .	0 0 0 0 0 1 0 1 0 0 0 0 0 0 0 0 0 0 0 0 0 0 0 0 0 0 0 0 0 0 0 0 0 0 0 0	DET ADJ NOUN NOUN VERB VERB ADJ NOUN ADP DET PROPN PROPN PROPN PROPN PROPN VERB ADP DET ADJ NOUN PART VERB ADV ADV DET NOUN NOUN NOUN NOUN PART VERB DET ADJ NOUN NOUN NOUN
A flagrant breach of truce in 1596 made history, and led to the creation of one of the most famous of the Border Ballads collected by Sir Walter Scott and others : the tale of Kinmont Willie.	0 0 0 0 0 0 0 1 1 0 0 0 0 0 0 0 0 0 0 0 0 0 0 0 0 0 0 0 0 0 0 0 0 0 0 0 0	make history	figurative	inflection	DET ADJ NOUN ADP NOUN ADP NUM VERB NOUN CCONJ VERB ADP DET NOUN ADP NUM ADP DET ADV ADJ ADP DET PROPN PROPN VERB ADP PROPN PROPN PROPN CCONJ NOUN PUNCT DET NOUN ADP PROPN PROPN	▁A ▁flag rant ▁breach ▁of ▁tr uce ▁in ▁15 96 ▁made ▁history , ▁and ▁led ▁to ▁the ▁creation ▁of ▁one ▁of ▁the ▁most ▁famous ▁of ▁the ▁Border ▁Ball ad s ▁collected ▁by ▁Sir ▁Walter ▁Scott ▁and ▁others ▁ : ▁the ▁ tale ▁of ▁Kin mont ▁Will ie .	0 0 0 0 0 0 0 0 0 0 1 1 1 0 0 0 0 0 0 0 0 0 0 0 0 0 0 0 0 0 0 0 0 0 0 0 0 0 0 0 0 0 0 0 0 0 0 0	DET ADJ ADJ NOUN ADP NOUN NOUN ADP NUM NUM VERB NOUN NOUN CCONJ VERB ADP DET NOUN ADP NUM ADP DET ADV ADJ ADP DET PROPN PROPN PROPN PROPN VERB ADP PROPN PROPN PROPN CCONJ NOUN PUNCT PUNCT DET NOUN NOUN ADP PROPN PROPN PROPN PROPN PROPN
