A man has made medical history by having four organ transplants. In two operations he was given a new heart, two lungs and a kidney. It was the first time in Europe so many organs had been replaced successfully. Richard Barnett reports :	0 0 0 1 0 1 0 0 0 0 0 0 0 0 0 0 0 0 0 0 0 0 0 0 0 0 0 0 0 0 0 0 0 0 0 0 0 0 0 0 0 0 0	make history	figurative	combined-inflection	DET NOUN VERB VERB ADJ NOUN ADP VERB NUM NOUN NOUN ADP NUM NOUN PRON VERB VERB DET ADJ NOUN NUM NOUN CCONJ DET NOUN PRON VERB DET ADJ NOUN ADP PROPN ADV ADJ NOUN VERB VERB VERB ADV PROPN PROPN VERB PUNCT	▁A ▁man ▁has ▁made ▁medical ▁history ▁by ▁having ▁four ▁organ ▁transplant s . ▁In ▁two ▁operations ▁he ▁was ▁given ▁a ▁new ▁heart , ▁two ▁lungs ▁and ▁a ▁kidney . ▁It ▁was ▁the ▁first ▁time ▁in ▁Europe ▁so ▁many ▁organs ▁had ▁been ▁replaced ▁successfully . ▁Richard ▁Bar net t ▁reports ▁ :	0 0 0 1 0 1 0 0 0 0 0 0 0 0 0 0 0 0 0 0 0 0 0 0 0 0 0 0 0 0 0 0 0 0 0 0 0 0 0 0 0 0 0 0 0 0 0 0 0 0 0	DET NOUN VERB VERB ADJ NOUN ADP VERB NUM NOUN NOUN NOUN NOUN ADP NUM NOUN PRON VERB VERB DET ADJ NOUN NOUN NUM NOUN CCONJ DET NOUN NOUN PRON VERB DET ADJ NOUN ADP PROPN ADV ADJ NOUN VERB VERB VERB ADV ADV PROPN PROPN PROPN PROPN VERB PUNCT PUNCT
' ' Men make their own history, ' to quote the master, ' but they do not make it under circumstances chosen by themselves, but under circumstances directly encountered, given and transmitted from the past.	0 0 0 1 0 0 1 0 0 0 0 0 0 0 0 0 0 0 0 0 0 0 0 0 0 0 0 0 0 0 0 0 0 0 0	make history	figurative	insertion-other	PUNCT PUNCT NOUN VERB ADJ ADJ NOUN PUNCT PART VERB DET NOUN PUNCT CCONJ PRON VERB ADV VERB PRON ADP NOUN VERB ADP PRON CCONJ ADP NOUN ADV VERB VERB CCONJ VERB ADP DET NOUN	▁' ▁' ▁Men ▁make ▁their ▁own ▁history , ▁' ▁to ▁quote ▁the ▁master , ▁' ▁but ▁they ▁do ▁not ▁make ▁it ▁under ▁circumstances ▁chosen ▁by ▁themselves , ▁but ▁under ▁circumstances ▁directly ▁encountered , ▁given ▁and ▁transmitted ▁from ▁the ▁past .	0 0 0 1 0 0 1 1 0 0 0 0 0 0 0 0 0 0 0 0 0 0 0 0 0 0 0 0 0 0 0 0 0 0 0 0 0 0 0 0	PUNCT PUNCT NOUN VERB ADJ ADJ NOUN NOUN PUNCT PART VERB DET NOUN NOUN PUNCT CCONJ PRON VERB ADV VERB PRON ADP NOUN VERB ADP PRON PRON CCONJ ADP NOUN ADV VERB VERB VERB CCONJ VERB ADP DET NOUN NOUN
Zola … about to make history or just history?	0 0 0 0 1 1 0 0 0	make history	figurative	identical	NOUN PUNCT ADJ PART VERB NOUN CCONJ ADV NOUN	▁Z ola ▁... ▁about ▁to ▁make ▁history ▁or ▁just ▁history ?	0 0 0 0 0 1 1 0 0 0 0	NOUN NOUN PUNCT ADJ PART VERB NOUN CCONJ ADV NOUN NOUN
The Lithuanians believe that their history will soon be made in it.	0 0 0 0 0 1 0 0 0 1 0 0	make history	figurative	misc	DET PROPN VERB ADP ADJ NOUN VERB ADV VERB VERB ADP PRON	▁The ▁Lithuanian s ▁believe ▁that ▁their ▁history ▁will ▁soon ▁be ▁made ▁in ▁it .	0 0 0 0 0 0 1 0 0 0 1 0 0 0	DET PROPN PROPN VERB ADP ADJ NOUN VERB ADV VERB VERB ADP PRON PRON
A similar view was expressed by Mr Lee Wing - Tat, the radical local council leader, who made history by heckling the former Foreign Secretary, Sir Geoffrey Howe, at a lunch last July.	0 0 0 0 0 0 0 0 0 0 0 0 0 0 0 0 0 1 1 0 0 0 0 0 0 0 0 0 0 0 0 0 0	make history	figurative	inflection	DET ADJ NOUN VERB VERB ADP PROPN PROPN PROPN PUNCT PROPN DET ADJ ADJ NOUN NOUN NOUN VERB NOUN ADP VERB DET ADJ PROPN PROPN PROPN PROPN PROPN ADP DET NOUN ADJ PROPN	▁A ▁similar ▁view ▁was ▁expressed ▁by ▁Mr ▁Le e ▁W ing ▁- ▁T at , ▁the ▁radical ▁local ▁council ▁leader , ▁who ▁made ▁history ▁by ▁he ck ling ▁the ▁former ▁Foreign ▁Secretary , ▁Sir ▁Geo ffre y ▁How e , ▁at ▁a ▁lunch ▁last ▁July .	0 0 0 0 0 0 0 0 0 0 0 0 0 0 0 0 0 0 0 0 0 0 1 1 0 0 0 0 0 0 0 0 0 0 0 0 0 0 0 0 0 0 0 0 0 0	DET ADJ NOUN VERB VERB ADP PROPN PROPN PROPN PROPN PROPN PUNCT PROPN PROPN PROPN DET ADJ ADJ NOUN NOUN NOUN NOUN VERB NOUN ADP VERB VERB VERB DET ADJ PROPN PROPN PROPN PROPN PROPN PROPN PROPN PROPN PROPN PROPN ADP DET NOUN ADJ PROPN PROPN
A SEVEN - month - old Scots baby is set to make medical history by undergoing Britain's first genetic transplant in a pioneering operation.	0 0 0 0 0 0 0 0 0 0 0 1 0 1 0 0 0 0 0 0 0 0 0 0	make history	figurative	insertion-other	DET NUM PUNCT NOUN PUNCT ADJ NOUN NOUN VERB VERB PART VERB ADJ NOUN ADP VERB PROPN ADJ ADJ NOUN ADP DET ADJ NOUN	▁A ▁SE VEN ▁- ▁month ▁- ▁old ▁Sc ots ▁baby ▁is ▁set ▁to ▁make ▁medical ▁history ▁by ▁undergoing ▁Britain ' s ▁first ▁genetic ▁transplant ▁in ▁a ▁pioneer ing ▁operation .	0 0 0 0 0 0 0 0 0 0 0 0 0 1 0 1 0 0 0 0 0 0 0 0 0 0 0 0 0 0	DET NUM NUM PUNCT NOUN PUNCT ADJ NOUN NOUN NOUN VERB VERB PART VERB ADJ NOUN ADP VERB PROPN PROPN PROPN ADJ ADJ NOUN ADP DET ADJ ADJ NOUN NOUN
AN EIGHT - MONTH - OLD girl from Lennoxtown, Stirlingshire, made British medical history yesterday when she became the first person to start gene therapy to combat a potentially fatal deficiency.	0 0 0 0 0 0 0 0 0 0 1 0 0 1 0 0 0 0 0 0 0 0 0 0 0 0 0 0 0 0 0	make history	figurative	combined-inflection	DET NUM PUNCT NOUN PUNCT PROPN NOUN ADP PROPN PROPN VERB ADJ ADJ NOUN NOUN ADV PRON VERB DET ADJ NOUN PART VERB NOUN NOUN PART VERB DET ADV ADJ NOUN	▁AN ▁ EIGH T ▁- ▁MON TH ▁- ▁ OLD ▁girl ▁from ▁Le nn ox town , ▁St ir ling shire , ▁made ▁British ▁medical ▁history ▁yesterday ▁when ▁she ▁became ▁the ▁first ▁person ▁to ▁start ▁gene ▁therapy ▁to ▁combat ▁a ▁potentially ▁fatal ▁deficiency .	0 0 0 0 0 0 0 0 0 0 0 0 0 0 0 0 0 0 0 0 0 0 1 0 0 1 0 0 0 0 0 0 0 0 0 0 0 0 0 0 0 0 0 0	DET NUM NUM NUM PUNCT NOUN NOUN PUNCT PROPN PROPN NOUN ADP PROPN PROPN PROPN PROPN PROPN PROPN PROPN PROPN PROPN PROPN VERB ADJ ADJ NOUN NOUN ADV PRON VERB DET ADJ NOUN PART VERB NOUN NOUN PART VERB DET ADV ADJ NOUN NOUN
And when he made history, he did so by speaking, mostly for members of his own line and for close collaterals.	0 0 0 1 1 0 0 0 0 0 0 0 0 0 0 0 0 0 0 0 0	make history	figurative	inflection	CCONJ ADV PRON VERB NOUN PRON VERB ADV ADP VERB ADV ADP NOUN ADP ADJ ADJ NOUN CCONJ ADP ADJ NOUN	▁And ▁when ▁he ▁made ▁history , ▁he ▁did ▁so ▁by ▁speaking , ▁most ly ▁for ▁members ▁of ▁his ▁own ▁line ▁and ▁for ▁close ▁collateral s .	0 0 0 1 1 1 0 0 0 0 0 0 0 0 0 0 0 0 0 0 0 0 0 0 0 0	CCONJ ADV PRON VERB NOUN NOUN PRON VERB ADV ADP VERB VERB ADV ADV ADP NOUN ADP ADJ ADJ NOUN CCONJ ADP ADJ NOUN NOUN NOUN
Four weeks ago Richard made medical history by having a kidney transplant in the Queen Elizabeth hospital in Birmingham.	0 0 0 0 1 0 1 0 0 0 0 0 0 0 0 0 0 0 0	make history	figurative	combined-inflection	NUM NOUN ADV PROPN VERB ADJ NOUN ADP VERB DET NOUN NOUN ADP DET PROPN PROPN NOUN ADP PROPN	▁Four ▁weeks ▁ago ▁Richard ▁made ▁medical ▁history ▁by ▁having ▁a ▁kidney ▁transplant ▁in ▁the ▁Queen ▁Eli za b eth ▁hospital ▁in ▁Birmingham .	0 0 0 0 1 0 1 0 0 0 0 0 0 0 0 0 0 0 0 0 0 0 0	NUM NOUN ADV PROPN VERB ADJ NOUN ADP VERB DET NOUN NOUN ADP DET PROPN PROPN PROPN PROPN PROPN NOUN ADP PROPN PROPN
ON SUNDAY 17TH MARCH 1991 HISTORY WILL BE MADE WHEN EXTRAORDINARY GENERAL MEETINGS OF THE A.A.A., W.A.A.A., AND B.A.A.B. WILL BRING INTO BEING A BRITISH ATHLETICS FEDERATION AND AN A.A.A. OF ENGLAND.	0 0 0 0 0 1 0 0 1 0 0 0 0 0 0 0 0 0 0 0 0 0 0 0 0 0 0 0 0 0 0 0	make history	figurative	misc	ADP PROPN NUM PROPN NUM NOUN VERB VERB VERB ADV PROPN PROPN PROPN ADP DET PROPN PROPN CCONJ PROPN VERB VERB ADP VERB DET ADJ PROPN PROPN CCONJ DET PROPN ADP PROPN	▁ON ▁S UN DAY ▁17 TH ▁MARCH ▁1991 ▁H ISTOR Y ▁W IL L ▁BE ▁MA DE ▁W H EN ▁EX TRA ORD IN ARY ▁GENERAL ▁MEETING S ▁OF ▁THE ▁A . A . A . , ▁W . A . A . A . , ▁AND ▁B . A . A . B . ▁W IL L ▁BRI NG ▁INTO ▁BE ING ▁A ▁BRIT ISH ▁A TH LET IC S ▁FE DE RATION ▁AND ▁AN ▁A . A . A . ▁OF ▁EN G LAND .	0 0 0 0 0 0 0 0 1 1 1 0 0 0 0 1 1 0 0 0 0 0 0 0 0 0 0 0 0 0 0 0 0 0 0 0 0 0 0 0 0 0 0 0 0 0 0 0 0 0 0 0 0 0 0 0 0 0 0 0 0 0 0 0 0 0 0 0 0 0 0 0 0 0 0 0 0 0 0 0 0 0 0 0 0 0 0	ADP PROPN PROPN PROPN NUM NUM PROPN NUM NOUN NOUN NOUN VERB VERB VERB VERB VERB VERB ADV ADV ADV PROPN PROPN PROPN PROPN PROPN PROPN PROPN PROPN ADP DET PROPN PROPN PROPN PROPN PROPN PROPN PROPN PROPN PROPN PROPN PROPN PROPN PROPN PROPN PROPN PROPN CCONJ PROPN PROPN PROPN PROPN PROPN PROPN PROPN PROPN VERB VERB VERB VERB VERB ADP VERB VERB DET ADJ ADJ PROPN PROPN PROPN PROPN PROPN PROPN PROPN PROPN CCONJ DET PROPN PROPN PROPN PROPN PROPN PROPN ADP PROPN PROPN PROPN PROPN
The first sailing from the port after midnight on the New Year was taken as the official start of the Single Market ; the first piece of freight on board was actually an unidentified light van and trailer — the driver no doubt blissfully unaware that he had made history — which, along with several vehicles turning round from the inbound convoy, sneaked back on board the 01.00 return sailing of the Pride of Kent while the official welcoming party was still in progress at the other end of the port.	0 0 0 0 0 0 0 0 0 0 0 0 0 0 0 0 0 0 0 0 0 0 0 0 0 0 0 0 0 0 0 0 0 0 0 0 0 0 0 0 0 0 0 0 0 0 0 0 1 1 0 0 0 0 0 0 0 0 0 0 0 0 0 0 0 0 0 0 0 0 0 0 0 0 0 0 0 0 0 0 0 0 0 0 0 0 0 0 0 0 0	make history	figurative	inflection	DET ADJ NOUN ADP DET NOUN ADP NOUN ADP DET PROPN PROPN VERB VERB ADP DET ADJ NOUN ADP DET PROPN PROPN PUNCT DET ADJ NOUN ADP NOUN ADP NOUN VERB ADV DET ADJ NOUN NOUN CCONJ NOUN PUNCT DET NOUN ADV ADV ADV ADJ ADP PRON VERB VERB NOUN PUNCT ADJ ADP ADP ADJ NOUN VERB ADV ADP DET ADJ NOUN VERB ADV ADP NOUN DET NUM NOUN NOUN ADP DET PROPN ADP PROPN ADP DET ADJ VERB NOUN VERB ADV ADP NOUN ADP DET ADJ NOUN ADP DET NOUN	▁The ▁first ▁sailing ▁from ▁the ▁port ▁after ▁midnight ▁on ▁the ▁New ▁Year ▁was ▁taken ▁as ▁the ▁official ▁start ▁of ▁the ▁Single ▁Market ▁ ; ▁the ▁first ▁piece ▁of ▁freight ▁on ▁board ▁was ▁actually ▁an ▁un ident ified ▁light ▁van ▁and ▁trailer ▁ — ▁the ▁driver ▁no ▁doubt ▁b lis s fully ▁unaware ▁that ▁he ▁had ▁made ▁history ▁ — ▁which , ▁along ▁with ▁several ▁vehicles ▁turning ▁round ▁from ▁the ▁in bound ▁convoy , ▁sn ea ked ▁back ▁on ▁board ▁the ▁0 1.00 ▁return ▁sailing ▁of ▁the ▁Pr ide ▁of ▁Kent ▁while ▁the ▁official ▁welcoming ▁party ▁was ▁still ▁in ▁progress ▁at ▁the ▁other ▁end ▁of ▁the ▁port .	0 0 0 0 0 0 0 0 0 0 0 0 0 0 0 0 0 0 0 0 0 0 0 0 0 0 0 0 0 0 0 0 0 0 0 0 0 0 0 0 0 0 0 0 0 0 0 0 0 0 0 0 0 0 0 1 1 0 0 0 0 0 0 0 0 0 0 0 0 0 0 0 0 0 0 0 0 0 0 0 0 0 0 0 0 0 0 0 0 0 0 0 0 0 0 0 0 0 0 0 0 0 0 0 0 0 0	DET ADJ NOUN ADP DET NOUN ADP NOUN ADP DET PROPN PROPN VERB VERB ADP DET ADJ NOUN ADP DET PROPN PROPN PUNCT PUNCT DET ADJ NOUN ADP NOUN ADP NOUN VERB ADV DET ADJ ADJ ADJ NOUN NOUN CCONJ NOUN PUNCT PUNCT DET NOUN ADV ADV ADV ADV ADV ADV ADJ ADP PRON VERB VERB NOUN PUNCT PUNCT ADJ ADJ ADP ADP ADJ NOUN VERB ADV ADP DET ADJ ADJ NOUN NOUN VERB VERB VERB ADV ADP NOUN DET NUM NUM NOUN NOUN ADP DET PROPN PROPN ADP PROPN ADP DET ADJ VERB NOUN VERB ADV ADP NOUN ADP DET ADJ NOUN ADP DET NOUN NOUN
In so doing he may come as near as he can ever hope to an understanding of war as people of the late Middle Ages knew it, no easy task even in the most favourable conditions, but one which can not be attempted with any hope of success without a proper appreciation of the many threads which make up history.	0 0 0 0 0 0 0 0 0 0 0 0 0 0 0 0 0 0 0 0 0 0 0 0 0 0 0 0 0 0 0 0 0 0 0 0 0 0 0 0 0 0 0 0 0 0 0 0 0 0 0 0 0 0 0 0 0 1 0 1	make history	literal	insertion-other	ADP ADV VERB PRON VERB VERB ADV ADV ADP PRON VERB ADV VERB ADP DET NOUN ADP NOUN ADP NOUN ADP DET ADJ PROPN PROPN VERB PRON DET ADJ NOUN ADV ADP DET ADV ADJ NOUN CCONJ NUM ADJ VERB ADV VERB VERB ADP DET NOUN ADP NOUN ADP DET ADJ NOUN ADP DET ADJ NOUN ADJ VERB PART NOUN	▁In ▁so ▁doing ▁he ▁may ▁come ▁as ▁near ▁as ▁he ▁can ▁ever ▁hope ▁to ▁an ▁understanding ▁of ▁war ▁as ▁people ▁of ▁the ▁late ▁Middle ▁Age s ▁knew ▁it , ▁no ▁easy ▁task ▁even ▁in ▁the ▁most ▁favourable ▁conditions , ▁but ▁one ▁which ▁can ▁not ▁be ▁attempted ▁with ▁any ▁hope ▁of ▁success ▁without ▁a ▁proper ▁appreciation ▁of ▁the ▁many ▁thread s ▁which ▁make ▁up ▁history .	0 0 0 0 0 0 0 0 0 0 0 0 0 0 0 0 0 0 0 0 0 0 0 0 0 0 0 0 0 0 0 0 0 0 0 0 0 0 0 0 0 0 0 0 0 0 0 0 0 0 0 0 0 0 0 0 0 0 0 0 0 1 0 1 1	ADP ADV VERB PRON VERB VERB ADV ADV ADP PRON VERB ADV VERB ADP DET NOUN ADP NOUN ADP NOUN ADP DET ADJ PROPN PROPN PROPN VERB PRON PRON DET ADJ NOUN ADV ADP DET ADV ADJ NOUN NOUN CCONJ NUM ADJ VERB ADV VERB VERB ADP DET NOUN ADP NOUN ADP DET ADJ NOUN ADP DET ADJ NOUN NOUN ADJ VERB PART NOUN NOUN
We were making history.’	0 0 1 1	make history	figurative	combined-inflection	PRON VERB VERB X	▁We ▁were ▁making ▁history . ’	0 0 1 1 1 1	PRON VERB VERB X X X
Rather than being regarded as actors who make their own history, individuals are to be seen as the ' supports ' of social practices who maintain and reproduce them.	0 0 0 0 0 0 0 1 0 0 1 0 0 0 0 0 0 0 0 0 0 0 0 0 0 0 0 0 0	make history	figurative	insertion-other	ADV ADP VERB VERB ADP NOUN NOUN VERB ADJ ADJ NOUN NOUN VERB PART VERB VERB ADP DET PUNCT NOUN PUNCT ADP ADJ NOUN NOUN VERB CCONJ VERB PRON	▁Rather ▁than ▁being ▁regarded ▁as ▁actors ▁who ▁make ▁their ▁own ▁history , ▁individuals ▁are ▁to ▁be ▁seen ▁as ▁the ▁' ▁supports ▁' ▁of ▁social ▁practices ▁who ▁maintain ▁and ▁reproduce ▁them .	0 0 0 0 0 0 0 1 0 0 1 1 0 0 0 0 0 0 0 0 0 0 0 0 0 0 0 0 0 0 0	ADV ADP VERB VERB ADP NOUN NOUN VERB ADJ ADJ NOUN NOUN NOUN VERB PART VERB VERB ADP DET PUNCT NOUN PUNCT ADP ADJ NOUN NOUN VERB CCONJ VERB PRON PRON
Both pulls are strong and theories which purport to reconcile them tend to be fragile, even though they capture a stout commonsense conviction that, as Marx put it, ' Men make their own history but they do not make it just as they please ; they do not make it under circumstances chosen by themselves. '	0 0 0 0 0 0 0 0 0 0 0 0 0 0 0 0 0 0 0 0 0 0 0 0 0 0 0 0 0 0 1 0 0 1 0 0 0 0 0 0 0 0 0 0 0 0 0 0 0 0 0 0 0 0 0 0	make history	figurative	insertion-other	DET NOUN VERB ADJ CCONJ NOUN ADJ VERB PART VERB PRON VERB PART VERB ADJ ADV ADP PRON VERB DET ADJ ADJ NOUN ADP ADP PROPN VERB PRON PUNCT NOUN VERB ADJ ADJ NOUN CCONJ PRON VERB ADV VERB PRON ADV ADP PRON VERB PUNCT PRON VERB ADV VERB PRON ADP NOUN VERB ADP PRON PUNCT	▁Both ▁pull s ▁are ▁strong ▁and ▁the or ies ▁which ▁purport ▁to ▁reconcile ▁them ▁tend ▁to ▁be ▁fragile , ▁even ▁though ▁they ▁capture ▁a ▁st out ▁common s ense ▁conviction ▁that , ▁as ▁Mar x ▁put ▁it , ▁' ▁Men ▁make ▁their ▁own ▁history ▁but ▁they ▁do ▁not ▁make ▁it ▁just ▁as ▁they ▁please ▁ ; ▁they ▁do ▁not ▁make ▁it ▁under ▁circumstances ▁chosen ▁by ▁themselves . ▁'	0 0 0 0 0 0 0 0 0 0 0 0 0 0 0 0 0 0 0 0 0 0 0 0 0 0 0 0 0 0 0 0 0 0 0 0 0 0 0 0 1 0 0 1 0 0 0 0 0 0 0 0 0 0 0 0 0 0 0 0 0 0 0 0 0 0 0 0	DET NOUN NOUN VERB ADJ CCONJ NOUN NOUN NOUN ADJ VERB PART VERB PRON VERB PART VERB ADJ ADJ ADV ADP PRON VERB DET ADJ ADJ ADJ ADJ ADJ NOUN ADP ADP ADP PROPN PROPN VERB PRON PRON PUNCT NOUN VERB ADJ ADJ NOUN CCONJ PRON VERB ADV VERB PRON ADV ADP PRON VERB PUNCT PUNCT PRON VERB ADV VERB PRON ADP NOUN VERB ADP PRON PRON PUNCT
The man who ran the world's first sub - four minute mile has been back to the track where he made history nearly thirty five years ago.	0 0 0 0 0 0 0 0 0 0 0 0 0 0 0 0 0 0 0 0 1 1 0 0 0 0 0	make history	figurative	inflection	DET NOUN NOUN VERB DET NOUN ADJ NOUN PUNCT NUM NOUN NOUN VERB VERB ADV ADP DET NOUN ADV PRON VERB NOUN ADV NUM NUM NOUN ADV	▁The ▁man ▁who ▁ran ▁the ▁world ' s ▁first ▁sub ▁- ▁four ▁minute ▁ mile ▁has ▁been ▁back ▁to ▁the ▁track ▁where ▁he ▁made ▁history ▁nearly ▁thirty ▁five ▁years ▁ago .	0 0 0 0 0 0 0 0 0 0 0 0 0 0 0 0 0 0 0 0 0 0 0 1 1 0 0 0 0 0 0	DET NOUN NOUN VERB DET NOUN NOUN NOUN ADJ NOUN PUNCT NUM NOUN NOUN NOUN VERB VERB ADV ADP DET NOUN ADV PRON VERB NOUN ADV NUM NUM NOUN ADV ADV
Maybe they knew this was their big moment, their chance to make history.	0 0 0 0 0 0 0 0 0 0 0 1 1	make history	figurative	identical	ADV PRON VERB DET VERB ADJ ADJ NOUN ADJ NOUN PART VERB NOUN	▁May be ▁they ▁knew ▁this ▁was ▁their ▁big ▁moment , ▁their ▁chance ▁to ▁make ▁history .	0 0 0 0 0 0 0 0 0 0 0 0 0 1 1 1	ADV ADV PRON VERB DET VERB ADJ ADJ NOUN NOUN ADJ NOUN PART VERB NOUN NOUN
Perhaps above all, Gramsci injected a sense of humanism into Marxism : for him, history was made by human beings.	0 0 0 0 0 0 0 0 0 0 0 0 0 0 1 0 1 0 0 0	make history	figurative	misc	ADV ADP DET PROPN VERB DET NOUN ADP NOUN ADP PROPN PUNCT ADP PRON NOUN VERB VERB ADP ADJ NOUN	▁Perhaps ▁above ▁all , ▁Gram s ci ▁injected ▁a ▁sense ▁of ▁human ism ▁into ▁Mar x ism ▁ : ▁for ▁him , ▁history ▁was ▁made ▁by ▁human ▁beings .	0 0 0 0 0 0 0 0 0 0 0 0 0 0 0 0 0 0 0 0 0 0 1 0 1 0 0 0 0	ADV ADP DET DET PROPN PROPN PROPN VERB DET NOUN ADP NOUN NOUN ADP PROPN PROPN PROPN PUNCT PUNCT ADP PRON PRON NOUN VERB VERB ADP ADJ NOUN NOUN
And history was made when the light - blues Toby Backhouse, a giant of a man, stepped onto the scales.	0 1 0 1 0 0 0 0 0 0 0 0 0 0 0 0 0 0 0 0	make history	figurative	misc	CCONJ NOUN VERB VERB ADV DET ADJ PUNCT NOUN DET NOUN DET NOUN ADP DET NOUN VERB ADP DET NOUN	▁And ▁history ▁was ▁made ▁when ▁the ▁light ▁- ▁blue s ▁To by ▁Back house , ▁a ▁giant ▁of ▁a ▁man , ▁stepped ▁onto ▁the ▁scales .	0 1 0 1 0 0 0 0 0 0 0 0 0 0 0 0 0 0 0 0 0 0 0 0 0 0	CCONJ NOUN VERB VERB ADV DET ADJ PUNCT NOUN NOUN DET DET NOUN NOUN NOUN DET NOUN ADP DET NOUN NOUN VERB ADP DET NOUN NOUN
We were the first British team ever to play in St Thomas and Tortoal ; in Anguilla we made history again because we played the first ever ‘ first - class’ in England but it certainly will in Anguilla!	0 0 0 0 0 0 0 0 0 0 0 0 0 0 0 0 0 0 1 1 0 0 0 0 0 0 0 0 0 0 0 0 0 0 0 0 0 0 0	make history	figurative	inflection	PRON VERB DET ADJ ADJ NOUN ADV PART VERB ADP PROPN PROPN CCONJ PROPN PUNCT ADP PROPN PRON VERB NOUN ADV ADP PRON VERB DET ADJ ADV ADJ ADJ PUNCT NOUN ADP PROPN CCONJ PRON ADV VERB ADP PROPN	▁We ▁were ▁the ▁first ▁British ▁team ▁ever ▁to ▁play ▁in ▁St ▁Thomas ▁and ▁T or to al ▁ ; ▁in ▁ Anguilla ▁we ▁made ▁history ▁again ▁because ▁we ▁played ▁the ▁first ▁ever ▁ ‘ ▁first ▁- ▁class ’ ▁in ▁England ▁but ▁it ▁certainly ▁will ▁in ▁ Anguilla !	0 0 0 0 0 0 0 0 0 0 0 0 0 0 0 0 0 0 0 0 0 0 0 1 1 0 0 0 0 0 0 0 0 0 0 0 0 0 0 0 0 0 0 0 0 0 0 0	PRON VERB DET ADJ ADJ NOUN ADV PART VERB ADP PROPN PROPN CCONJ PROPN PROPN PROPN PROPN PUNCT PUNCT ADP PROPN PROPN PRON VERB NOUN ADV ADP PRON VERB DET ADJ ADV ADJ ADJ ADJ PUNCT NOUN NOUN ADP PROPN CCONJ PRON ADV VERB ADP PROPN PROPN PROPN
BRITAIN 'S dressage riders made history today when they took a European Championship team silver medal in Lipica, Slovenia.	0 0 0 0 1 1 0 0 0 0 0 0 0 0 0 0 0 0 0	make history	figurative	inflection	PROPN PART ADJ NOUN VERB NOUN NOUN ADV PRON VERB DET PROPN PROPN NOUN NOUN NOUN ADP PROPN PROPN	▁BRI TAIN ▁' S ▁ dress age ▁rid ers ▁made ▁history ▁today ▁when ▁they ▁took ▁a ▁European ▁Cham p ion ship ▁team ▁silver ▁med al ▁in ▁Lip ica , ▁Slovenia .	0 0 0 0 0 0 0 0 0 1 1 0 0 0 0 0 0 0 0 0 0 0 0 0 0 0 0 0 0 0 0	PROPN PROPN PART PART ADJ ADJ ADJ NOUN NOUN VERB NOUN NOUN ADV PRON VERB DET PROPN PROPN PROPN PROPN PROPN NOUN NOUN NOUN NOUN ADP PROPN PROPN PROPN PROPN PROPN
Above all, Thompson insists that history is made, not by the inevitable operation of impersonal structures, but by the actions of real human beings.	0 0 0 0 0 1 0 1 0 0 0 0 0 0 0 0 0 0 0 0 0 0 0 0	make history	figurative	misc	ADP DET PROPN VERB ADP NOUN VERB VERB ADV ADP DET ADJ NOUN ADP ADJ NOUN CCONJ ADP DET NOUN ADP ADJ ADJ NOUN	▁Above ▁all , ▁T hom ps on ▁insist s ▁that ▁history ▁is ▁made , ▁not ▁by ▁the ▁inevitable ▁operation ▁of ▁im personal ▁structures , ▁but ▁by ▁the ▁actions ▁of ▁real ▁human ▁beings .	0 0 0 0 0 0 0 0 0 0 1 0 1 1 0 0 0 0 0 0 0 0 0 0 0 0 0 0 0 0 0 0 0	ADP DET DET PROPN PROPN PROPN PROPN VERB VERB ADP NOUN VERB VERB VERB ADV ADP DET ADJ NOUN ADP ADJ ADJ NOUN NOUN CCONJ ADP DET NOUN ADP ADJ ADJ NOUN NOUN
As a child I had watched history being made.	0 0 0 0 0 0 1 0 1	make history	figurative	misc	ADP DET NOUN PRON VERB VERB NOUN VERB VERB	▁As ▁a ▁child ▁I ▁had ▁watch ed ▁history ▁being ▁made .	0 0 0 0 0 0 0 1 0 1 1	ADP DET NOUN PRON VERB VERB VERB NOUN VERB VERB VERB
The case made Scottish legal history as it was the first prosecution under Section 3A of the Road Traffic Act 1988.	0 0 1 0 0 1 0 0 0 0 0 0 0 0 0 0 0 0 0 0 0	make history	figurative	combined-inflection	DET NOUN VERB ADJ ADJ NOUN ADP PRON VERB DET ADJ NOUN ADP PROPN NOUN ADP DET PROPN PROPN PROPN NUM	▁The ▁case ▁made ▁Scottish ▁legal ▁history ▁as ▁it ▁was ▁the ▁first ▁prosecution ▁under ▁Section ▁3 A ▁of ▁the ▁Road ▁Traffic ▁Act ▁1988.	0 0 1 0 0 1 0 0 0 0 0 0 0 0 0 0 0 0 0 0 0 0	DET NOUN VERB ADJ ADJ NOUN ADP PRON VERB DET ADJ NOUN ADP PROPN NOUN NOUN ADP DET PROPN PROPN PROPN NUM
LEICESTER are set to make club history by appointing a paid director of coaching.	0 0 0 0 1 0 1 0 0 0 0 0 0 0	make history	figurative	insertion-other	NOUN VERB VERB PART VERB NOUN NOUN ADP VERB DET VERB NOUN ADP NOUN	▁LE ICES TER ▁are ▁set ▁to ▁make ▁club ▁history ▁by ▁a ppointing ▁a ▁paid ▁director ▁of ▁coach ing .	0 0 0 0 0 0 1 0 1 0 0 0 0 0 0 0 0 0 0	NOUN NOUN NOUN VERB VERB PART VERB NOUN NOUN ADP VERB VERB DET VERB NOUN ADP NOUN NOUN NOUN
Over the next few seasons debts continued to mount and in an unprecedented move Athletico again made history, becoming the first club to introduce the £ 1 pork pie.	0 0 0 0 0 0 0 0 0 0 0 0 0 0 0 0 1 1 0 0 0 0 0 0 0 0 0 0 0	make history	figurative	inflection	ADP DET ADJ ADJ NOUN NOUN VERB PART VERB CCONJ ADP DET ADJ NOUN PROPN ADV VERB NOUN VERB DET ADJ NOUN PART VERB DET SYM NUM NOUN NOUN	▁Over ▁the ▁next ▁few ▁season s ▁debts ▁continued ▁to ▁mount ▁and ▁in ▁an ▁unprecedented ▁move ▁A th let ico ▁again ▁made ▁history , ▁becoming ▁the ▁first ▁club ▁to ▁introduce ▁the ▁£ ▁1 ▁por k ▁p ie .	0 0 0 0 0 0 0 0 0 0 0 0 0 0 0 0 0 0 0 0 1 1 1 0 0 0 0 0 0 0 0 0 0 0 0 0 0	ADP DET ADJ ADJ NOUN NOUN NOUN VERB PART VERB CCONJ ADP DET ADJ NOUN PROPN PROPN PROPN PROPN ADV VERB NOUN NOUN VERB DET ADJ NOUN PART VERB DET SYM NUM NOUN NOUN NOUN NOUN NOUN
SOUTH AFRICA 'S David Frost yesterday made history by becoming the first golfer to win the Million Dollar Challenge three times.	0 0 0 0 0 0 1 1 0 0 0 0 0 0 0 0 0 0 0 0 0	make history	figurative	inflection	PROPN PROPN PART PROPN PROPN NOUN VERB NOUN ADP VERB DET ADJ NOUN PART VERB DET PROPN PROPN PROPN NUM NOUN	▁SO UTH ▁A FR ICA ▁' S ▁David ▁Fr ost ▁yesterday ▁made ▁history ▁by ▁becoming ▁the ▁first ▁golf er ▁to ▁win ▁the ▁Million ▁D ol lar ▁Challenge ▁three ▁times .	0 0 0 0 0 0 0 0 0 0 0 1 1 0 0 0 0 0 0 0 0 0 0 0 0 0 0 0 0 0	PROPN PROPN PROPN PROPN PROPN PART PART PROPN PROPN PROPN NOUN VERB NOUN ADP VERB DET ADJ NOUN NOUN PART VERB DET PROPN PROPN PROPN PROPN PROPN NUM NOUN NOUN
Like peoples everywhere we are making history.	0 0 0 0 0 1 1	make history	figurative	inflection	ADP NOUN ADV PRON VERB VERB NOUN	▁Like ▁peoples ▁everywhere ▁we ▁are ▁making ▁history .	0 0 0 0 0 1 1 1	ADP NOUN ADV PRON VERB VERB NOUN NOUN
The case made Scottish legal history as it was the first prosecution brought under the new Section 3A of the Road Traffic Act 1988.	0 0 1 0 0 1 0 0 0 0 0 0 0 0 0 0 0 0 0 0 0 0 0 0	make history	figurative	combined-inflection	DET NOUN VERB ADJ ADJ NOUN ADP PRON VERB DET ADJ NOUN VERB ADP DET ADJ PROPN NOUN ADP DET PROPN PROPN PROPN NUM	▁The ▁case ▁made ▁Scottish ▁legal ▁history ▁as ▁it ▁was ▁the ▁first ▁prosecution ▁brought ▁under ▁the ▁new ▁Section ▁3 A ▁of ▁the ▁Road ▁Traffic ▁Act ▁1988.	0 0 1 0 0 1 0 0 0 0 0 0 0 0 0 0 0 0 0 0 0 0 0 0 0	DET NOUN VERB ADJ ADJ NOUN ADP PRON VERB DET ADJ NOUN VERB ADP DET ADJ PROPN NOUN NOUN ADP DET PROPN PROPN PROPN NUM
History's being made me people hav paid	1 0 1 0 0 0 0	make history	figurative	misc	NOUN VERB VERB PRON NOUN VERB VERB	▁History ' s ▁being ▁made ▁me ▁people ▁hav ▁paid	1 1 1 0 1 0 0 0 0	NOUN NOUN NOUN VERB VERB PRON NOUN VERB VERB
History is being made.	1 0 0 1	make history	figurative	misc	NOUN VERB VERB VERB	▁History ▁is ▁being ▁made .	1 0 0 1 1	NOUN VERB VERB VERB VERB
