The TUC General Council made history by failing to urge members to vote Labour, and a march in Birmingham yesterday headed by Bill Jordan, president of the AEU, and Mr Lyons was one of the rare occasions when trade union support has been out in force on the streets.	0 0 0 0 1 1 0 0 0 0 0 0 0 0 0 0 0 0 0 0 0 0 0 0 0 0 0 0 0 0 0 0 0 0 0 0 0 0 0 0 0 0 0 0 0 0 0 0 0	make history	figurative	inflection	DET PROPN PROPN PROPN VERB NOUN ADP VERB PART VERB NOUN PART VERB PROPN CCONJ DET NOUN ADP PROPN NOUN VERB ADP PROPN PROPN NOUN ADP DET PROPN CCONJ PROPN PROPN VERB NUM ADP DET ADJ NOUN ADV NOUN NOUN NOUN VERB VERB PART ADP NOUN ADP DET NOUN	▁The ▁TU C ▁General ▁Council ▁made ▁history ▁by ▁failing ▁to ▁urge ▁members ▁to ▁vote ▁Labour , ▁and ▁a ▁march ▁in ▁Birmingham ▁yesterday ▁headed ▁by ▁Bill ▁Jordan , ▁president ▁of ▁the ▁A EU , ▁and ▁Mr ▁Lyon s ▁was ▁one ▁of ▁the ▁rare ▁occasions ▁when ▁trade ▁union ▁support ▁has ▁been ▁out ▁in ▁force ▁on ▁the ▁streets .	0 0 0 0 0 1 1 0 0 0 0 0 0 0 0 0 0 0 0 0 0 0 0 0 0 0 0 0 0 0 0 0 0 0 0 0 0 0 0 0 0 0 0 0 0 0 0 0 0 0 0 0 0 0 0 0	DET PROPN PROPN PROPN PROPN VERB NOUN ADP VERB PART VERB NOUN PART VERB PROPN PROPN CCONJ DET NOUN ADP PROPN NOUN VERB ADP PROPN PROPN PROPN NOUN ADP DET PROPN PROPN PROPN CCONJ PROPN PROPN PROPN VERB NUM ADP DET ADJ NOUN ADV NOUN NOUN NOUN VERB VERB PART ADP NOUN ADP DET NOUN NOUN
He's the hottest thing in America, the ghetto kid making TV history.	0 0 0 0 0 0 0 0 0 1 0 1	make history	figurative	combined-inflection	PRON DET ADJ NOUN ADP PROPN DET NOUN NOUN VERB NOUN NOUN	▁He ' s ▁the ▁hot test ▁thing ▁in ▁America , ▁the ▁g het to ▁kid ▁making ▁TV ▁history .	0 0 0 0 0 0 0 0 0 0 0 0 0 0 0 1 0 1 1	PRON PRON PRON DET ADJ ADJ NOUN ADP PROPN PROPN DET NOUN NOUN NOUN NOUN VERB NOUN NOUN NOUN
Over at Cheltenham racecourse yesterday history was made as the runners and riders came to post for the first - ever Sunday National Hunt meeting … around thirteen thousand people turned out to watch … and racing hopes, of course, that steeplechasing on Sunday will become a firm fixture …	0 0 0 0 0 1 0 1 0 0 0 0 0 0 0 0 0 0 0 0 0 0 0 0 0 0 0 0 0 0 0 0 0 0 0 0 0 0 0 0 0 0 0 0 0 0 0 0 0 0	make history	literal	misc	ADP ADP PROPN NOUN NOUN NOUN VERB VERB ADP DET NOUN CCONJ NOUN VERB PART VERB ADP DET ADJ PUNCT ADV PROPN PROPN PROPN NOUN PUNCT ADV NUM NUM NOUN VERB PART PART VERB PUNCT CCONJ VERB NOUN ADP NOUN ADP VERB PART PROPN VERB VERB DET ADJ NOUN PUNCT	▁Over ▁at ▁Che l ten ham ▁race course ▁yesterday ▁history ▁was ▁made ▁as ▁the ▁run ners ▁and ▁rid ers ▁came ▁to ▁post ▁for ▁the ▁first ▁- ▁ever ▁Sunday ▁National ▁Hun t ▁meeting ▁... ▁around ▁thirteen ▁thousand ▁people ▁turned ▁out ▁to ▁watch ▁... ▁and ▁racing ▁hopes , ▁of ▁course , ▁that ▁steep le cha s ing ▁on ▁Sunday ▁will ▁become ▁a ▁firm ▁fixture ▁...	0 0 0 0 0 0 0 0 0 1 0 1 0 0 0 0 0 0 0 0 0 0 0 0 0 0 0 0 0 0 0 0 0 0 0 0 0 0 0 0 0 0 0 0 0 0 0 0 0 0 0 0 0 0 0 0 0 0 0 0 0 0 0	ADP ADP PROPN PROPN PROPN PROPN NOUN NOUN NOUN NOUN VERB VERB ADP DET NOUN NOUN CCONJ NOUN NOUN VERB PART VERB ADP DET ADJ PUNCT ADV PROPN PROPN PROPN PROPN NOUN PUNCT ADV NUM NUM NOUN VERB PART PART VERB PUNCT CCONJ VERB NOUN NOUN ADP NOUN NOUN ADP VERB VERB VERB VERB VERB PART PROPN VERB VERB DET ADJ NOUN PUNCT
Worcestershire's cricket team is making history by flying to Johannesburg to help the reunion of South African cricket with the rest of the world.	0 0 0 0 1 1 0 0 0 0 0 0 0 0 0 0 0 0 0 0 0 0 0 0	make history	figurative	inflection	PROPN NOUN NOUN VERB VERB NOUN ADP VERB ADP PROPN PART VERB DET NOUN ADP ADJ ADJ NOUN ADP DET NOUN ADP DET NOUN	▁Wo rc ester shire ' s ▁cri cke t ▁team ▁is ▁making ▁history ▁by ▁flying ▁to ▁Johan ne sburg ▁to ▁help ▁the ▁re union ▁of ▁South ▁African ▁cri cke t ▁with ▁the ▁rest ▁of ▁the ▁world .	0 0 0 0 0 0 0 0 0 0 0 1 1 0 0 0 0 0 0 0 0 0 0 0 0 0 0 0 0 0 0 0 0 0 0 0 0	PROPN PROPN PROPN PROPN PROPN PROPN NOUN NOUN NOUN NOUN VERB VERB NOUN ADP VERB ADP PROPN PROPN PROPN PART VERB DET NOUN NOUN ADP ADJ ADJ NOUN NOUN NOUN ADP DET NOUN ADP DET NOUN NOUN
The trial made legal history when child witnesses gave evidence using closed circuit television cameras.	0 0 1 0 1 0 0 0 0 0 0 0 0 0 0	make history	figurative	combined-inflection	DET NOUN VERB ADJ NOUN ADV NOUN NOUN VERB NOUN VERB VERB NOUN NOUN NOUN	▁The ▁trial ▁made ▁legal ▁history ▁when ▁child ▁witnesses ▁gave ▁evidence ▁using ▁closed ▁circuit ▁television ▁cameras .	0 0 1 0 1 0 0 0 0 0 0 0 0 0 0 0	DET NOUN VERB ADJ NOUN ADV NOUN NOUN VERB NOUN VERB VERB NOUN NOUN NOUN NOUN
The lenders, whose objects were left in embarrassing limbo when the show made museum history and went bankrupt a month early, may have asked themselves whether they would have been prepared to lend had it not been held at the V&A, and, in fact, it was the V&A which was left with the unbudgeted task of getting the exhibits back to the owners.	0 0 0 0 0 0 0 0 0 0 0 0 1 0 1 0 0 0 0 0 0 0 0 0 0 0 0 0 0 0 0 0 0 0 0 0 0 0 0 0 0 0 0 0 0 0 0 0 0 0 0 0 0 0 0 0 0 0 0 0 0 0 0	make history	figurative	combined-inflection	DET NOUN ADJ NOUN VERB VERB ADP ADJ NOUN ADV DET NOUN VERB NOUN NOUN CCONJ VERB ADJ DET NOUN ADV VERB VERB VERB PRON ADP PRON VERB VERB VERB VERB PART VERB VERB PRON ADV VERB VERB ADP DET PROPN CCONJ ADP NOUN PRON VERB DET PROPN ADJ VERB VERB ADP DET ADJ NOUN ADP VERB DET NOUN ADV ADP DET NOUN	▁The ▁lender s , ▁whose ▁objects ▁were ▁left ▁in ▁embarrass ing ▁limb o ▁when ▁the ▁show ▁made ▁museum ▁history ▁and ▁went ▁bankrupt ▁a ▁month ▁early , ▁may ▁have ▁asked ▁themselves ▁whether ▁they ▁would ▁have ▁been ▁prepared ▁to ▁lend ▁had ▁it ▁not ▁been ▁held ▁at ▁the ▁V & A , ▁and , ▁in ▁fact , ▁it ▁was ▁the ▁V & A ▁which ▁was ▁left ▁with ▁the ▁un budget ed ▁task ▁of ▁gett ing ▁the ▁exhibit s ▁back ▁to ▁the ▁owners .	0 0 0 0 0 0 0 0 0 0 0 0 0 0 0 0 1 0 1 0 0 0 0 0 0 0 0 0 0 0 0 0 0 0 0 0 0 0 0 0 0 0 0 0 0 0 0 0 0 0 0 0 0 0 0 0 0 0 0 0 0 0 0 0 0 0 0 0 0 0 0 0 0 0 0 0 0 0 0 0	DET NOUN NOUN NOUN ADJ NOUN VERB VERB ADP ADJ ADJ NOUN NOUN ADV DET NOUN VERB NOUN NOUN CCONJ VERB ADJ DET NOUN ADV ADV VERB VERB VERB PRON ADP PRON VERB VERB VERB VERB PART VERB VERB PRON ADV VERB VERB ADP DET PROPN PROPN PROPN PROPN CCONJ CCONJ ADP NOUN NOUN PRON VERB DET PROPN PROPN PROPN ADJ VERB VERB ADP DET ADJ ADJ ADJ NOUN ADP VERB VERB DET NOUN NOUN ADV ADP DET NOUN NOUN
In general, these private archives served to make lineage history : a man kept his own papers, and his father's and grandfather's if he inherited them.	0 0 0 0 0 0 0 1 0 1 0 0 0 0 0 0 0 0 0 0 0 0 0 0 0 0	make history	figurative	insertion-other	ADP ADJ DET ADJ NOUN VERB PART VERB NOUN NOUN PUNCT DET NOUN VERB ADJ ADJ NOUN CCONJ ADJ NOUN CCONJ NOUN ADP PRON VERB PRON	▁In ▁general , ▁these ▁private ▁archives ▁served ▁to ▁make ▁line age ▁history ▁ : ▁a ▁man ▁kept ▁his ▁own ▁papers , ▁and ▁his ▁father ' s ▁and ▁grandfather ' s ▁if ▁he ▁inherited ▁them .	0 0 0 0 0 0 0 0 1 0 0 1 0 0 0 0 0 0 0 0 0 0 0 0 0 0 0 0 0 0 0 0 0 0 0	ADP ADJ ADJ DET ADJ NOUN VERB PART VERB NOUN NOUN NOUN PUNCT PUNCT DET NOUN VERB ADJ ADJ NOUN NOUN CCONJ ADJ NOUN NOUN NOUN CCONJ NOUN NOUN NOUN ADP PRON VERB PRON PRON
On June 29, 1995, the Space ~ Shuttle Atlantis made history when it docked with the Russian Mir space ~ station, as shown in this photograph.	0 0 0 0 0 0 0 0 0 1 1 0 0 0 0 0 0 0 0 0 0 0 0 0 0 0	make history	figurative	inflection	ADP PROPN NUM NUM DET PROPN PUNCT PROPN PROPN VERB NOUN ADV PRON VERB ADP DET ADJ PROPN NOUN PUNCT NOUN ADP VERB ADP DET NOUN	▁On ▁June ▁29 , ▁1995, ▁the ▁Space ▁ ~ ▁Shu ttle ▁At lan tis ▁made ▁history ▁when ▁it ▁dock ed ▁with ▁the ▁Russian ▁Mir ▁space ▁ ~ ▁station , ▁as ▁shown ▁in ▁this ▁photograph .	0 0 0 0 0 0 0 0 0 0 0 0 0 0 1 1 0 0 0 0 0 0 0 0 0 0 0 0 0 0 0 0 0 0 0	ADP PROPN NUM NUM NUM DET PROPN PUNCT PUNCT PROPN PROPN PROPN PROPN PROPN VERB NOUN ADV PRON VERB VERB ADP DET ADJ PROPN NOUN PUNCT PUNCT NOUN NOUN ADP VERB ADP DET NOUN NOUN
He also made history as the first judicial nominee to be confirmed without the recommendation of the Senate judiciary committee, which held confirmation hearings on Sept. 10 - 27, but deadlocked seven to seven when it finally voted on the motion to recommend the nomination, and then voted 13 to one to pass along the nomination to the entire Senate with no recommendation.	0 0 1 1 0 0 0 0 0 0 0 0 0 0 0 0 0 0 0 0 0 0 0 0 0 0 0 0 0 0 0 0 0 0 0 0 0 0 0 0 0 0 0 0 0 0 0 0 0 0 0 0 0 0 0 0 0 0 0 0 0 0 0	make history	figurative	inflection	PRON ADV VERB NOUN ADP DET ADJ ADJ NOUN PART VERB VERB ADP DET NOUN ADP DET PROPN NOUN NOUN ADJ VERB NOUN NOUN ADP PROPN NUM SYM NUM CCONJ VERB NUM ADP NUM ADV PRON ADV VERB ADP DET NOUN PART VERB DET NOUN CCONJ ADV VERB NUM ADP NUM PART VERB PART DET NOUN ADP DET ADJ PROPN ADP DET NOUN	▁He ▁also ▁made ▁history ▁as ▁the ▁first ▁judicial ▁nominee ▁to ▁be ▁confirmed ▁without ▁the ▁recommendation ▁of ▁the ▁Senate ▁judiciary ▁committee , ▁which ▁held ▁confirmation ▁hearings ▁on ▁Sep t . ▁10 ▁- ▁27 , ▁but ▁deadlock ed ▁seven ▁to ▁seven ▁when ▁it ▁finally ▁voted ▁on ▁the ▁motion ▁to ▁recommend ▁the ▁nomination , ▁and ▁then ▁voted ▁13 ▁to ▁one ▁to ▁pass ▁along ▁the ▁nomination ▁to ▁the ▁entire ▁Senate ▁with ▁no ▁recommendation .	0 0 1 1 0 0 0 0 0 0 0 0 0 0 0 0 0 0 0 0 0 0 0 0 0 0 0 0 0 0 0 0 0 0 0 0 0 0 0 0 0 0 0 0 0 0 0 0 0 0 0 0 0 0 0 0 0 0 0 0 0 0 0 0 0 0 0 0 0 0	PRON ADV VERB NOUN ADP DET ADJ ADJ NOUN PART VERB VERB ADP DET NOUN ADP DET PROPN NOUN NOUN NOUN ADJ VERB NOUN NOUN ADP PROPN PROPN PROPN NUM SYM NUM NUM CCONJ VERB VERB NUM ADP NUM ADV PRON ADV VERB ADP DET NOUN PART VERB DET NOUN NOUN CCONJ ADV VERB NUM ADP NUM PART VERB PART DET NOUN ADP DET ADJ PROPN ADP DET NOUN NOUN
It is therefore, Sartre argues, our historical task to make it known, promoting not just the historical process as such, but also the general recognition whereby the plurality of the meanings of individual histories can be seen to combine to make one history, with one meaning — the ' Truth of humanity'(I, 822 ).	0 0 0 0 0 0 0 0 0 0 0 0 0 0 0 0 0 0 0 0 0 0 0 0 0 0 0 0 0 0 0 0 0 0 0 0 0 0 0 0 1 0 1 0 0 0 0 0 0 0 0 0 0 0	make history	literal	insertion-other	PRON VERB ADV PROPN VERB ADJ ADJ NOUN PART VERB PRON VERB VERB ADV ADV DET ADJ NOUN ADP ADJ CCONJ ADV DET ADJ NOUN ADV DET NOUN ADP DET NOUN ADP ADJ NOUN VERB VERB VERB PART VERB PART VERB NUM NOUN ADP NUM NOUN PUNCT DET PUNCT PROPN ADP PROPN NUM PUNCT	▁It ▁is ▁therefore , ▁Sar tre ▁argues , ▁our ▁historical ▁task ▁to ▁make ▁it ▁known , ▁promoting ▁not ▁just ▁the ▁historical ▁process ▁as ▁such , ▁but ▁also ▁the ▁general ▁recognition ▁whereby ▁the ▁p l ural ity ▁of ▁the ▁meaning s ▁of ▁individual ▁his to ries ▁can ▁be ▁seen ▁to ▁combine ▁to ▁make ▁one ▁history , ▁with ▁one ▁meaning ▁ — ▁the ▁' ▁Tru th ▁of ▁humanity ' ( I , ▁82 2 ▁ ).	0 0 0 0 0 0 0 0 0 0 0 0 0 0 0 0 0 0 0 0 0 0 0 0 0 0 0 0 0 0 0 0 0 0 0 0 0 0 0 0 0 0 0 0 0 0 0 0 0 0 0 1 0 1 1 0 0 0 0 0 0 0 0 0 0 0 0 0 0 0 0 0 0 0	PRON VERB ADV ADV PROPN PROPN VERB VERB ADJ ADJ NOUN PART VERB PRON VERB VERB VERB ADV ADV DET ADJ NOUN ADP ADJ ADJ CCONJ ADV DET ADJ NOUN ADV DET NOUN NOUN NOUN NOUN ADP DET NOUN NOUN ADP ADJ NOUN NOUN NOUN VERB VERB VERB PART VERB PART VERB NUM NOUN NOUN ADP NUM NOUN PUNCT PUNCT DET PUNCT PROPN PROPN ADP PROPN PROPN PROPN PROPN PROPN NUM NUM PUNCT PUNCT
And all the undertakings we might speak of reduce themselves to a single one, that of making history.	0 0 0 0 0 0 0 0 0 0 0 0 0 0 0 0 1 1	make history	figurative	inflection	CCONJ ADJ DET NOUN PRON VERB VERB ADP VERB PRON ADP DET ADJ NOUN ADP ADP VERB NOUN	▁And ▁all ▁the ▁undertakings ▁we ▁might ▁speak ▁of ▁reduce ▁themselves ▁to ▁a ▁single ▁one , ▁that ▁of ▁making ▁history .	0 0 0 0 0 0 0 0 0 0 0 0 0 0 0 0 0 1 1 1	CCONJ ADJ DET NOUN PRON VERB VERB ADP VERB PRON ADP DET ADJ NOUN NOUN ADP ADP VERB NOUN NOUN
At the moment, ' history is made without being known ( l'histoire se fait sans se connâitre ) ' —history constitutes, we might say today, a political unconscious.	0 0 0 0 1 0 1 0 0 0 0 0 0 0 0 0 0 0 0 0 0 0 0 0 0 0 0 0	make history	figurative	misc	ADP DET NOUN PUNCT NOUN VERB VERB ADP VERB VERB PUNCT NOUN X X NOUN X NOUN PUNCT PUNCT NOUN VERB PRON VERB VERB NOUN DET ADJ ADJ	▁At ▁the ▁moment , ▁' ▁history ▁is ▁made ▁without ▁being ▁known ▁( ▁l ' his to ire ▁se ▁fait ▁san s ▁se ▁con n â it re ▁ ) ▁' ▁ — his tory ▁constitutes , ▁we ▁might ▁say ▁today , ▁a ▁political ▁unconscious .	0 0 0 0 0 1 0 1 0 0 0 0 0 0 0 0 0 0 0 0 0 0 0 0 0 0 0 0 0 0 0 0 0 0 0 0 0 0 0 0 0 0 0 0 0	ADP DET NOUN NOUN PUNCT NOUN VERB VERB ADP VERB VERB PUNCT NOUN NOUN NOUN NOUN NOUN X X NOUN NOUN X NOUN NOUN NOUN NOUN NOUN PUNCT PUNCT PUNCT NOUN NOUN NOUN NOUN VERB VERB PRON VERB VERB NOUN NOUN DET ADJ ADJ ADJ
Present Laughter would have made theatre history as the first production to go from Belfast into the West End.	0 0 0 0 1 0 1 0 0 0 0 0 0 0 0 0 0 0 0	make history	figurative	combined-inflection	PROPN PROPN VERB VERB VERB NOUN NOUN ADP DET ADJ NOUN PART VERB ADP PROPN ADP DET PROPN NOUN	▁Present ▁L aughter ▁would ▁have ▁made ▁theatre ▁history ▁as ▁the ▁first ▁production ▁to ▁go ▁from ▁Belfast ▁into ▁the ▁West ▁End .	0 0 0 0 0 1 0 1 0 0 0 0 0 0 0 0 0 0 0 0 0	PROPN PROPN PROPN VERB VERB VERB NOUN NOUN ADP DET ADJ NOUN PART VERB ADP PROPN ADP DET PROPN NOUN NOUN
Brave Gregory Kingsley made legal history after calmly telling a hushed court : ' I don't love her and I don't want to live with her. '	0 0 0 1 0 1 0 0 0 0 0 0 0 0 0 0 0 0 0 0 0 0 0 0 0 0 0	make history	figurative	combined-inflection	PROPN PROPN PROPN VERB ADJ NOUN ADP ADV VERB DET ADJ NOUN PUNCT PUNCT PRON VERB VERB PRON CCONJ PRON VERB VERB PART VERB ADP PRON PUNCT	▁Bra ve ▁Gre g ory ▁King sley ▁made ▁legal ▁history ▁after ▁calm ly ▁telling ▁a ▁hu shed ▁court ▁ : ▁' ▁I ▁don ' t ▁love ▁her ▁and ▁I ▁don ' t ▁want ▁to ▁live ▁with ▁her . ▁'	0 0 0 0 0 0 0 1 0 1 0 0 0 0 0 0 0 0 0 0 0 0 0 0 0 0 0 0 0 0 0 0 0 0 0 0 0 0 0	PROPN PROPN PROPN PROPN PROPN PROPN PROPN VERB ADJ NOUN ADP ADV ADV VERB DET ADJ ADJ NOUN PUNCT PUNCT PUNCT PRON VERB VERB VERB VERB PRON CCONJ PRON VERB VERB VERB VERB PART VERB ADP PRON PRON PUNCT
On November 2, 1982, television history was made with the birth of Channel 4.	0 0 0 0 0 1 0 1 0 0 0 0 0 0	make history	figurative	misc	ADP PROPN NUM NUM NOUN NOUN VERB VERB ADP DET NOUN ADP PROPN NUM	▁On ▁November ▁2, ▁1982, ▁television ▁history ▁was ▁made ▁with ▁the ▁birth ▁of ▁Channel ▁4.	0 0 0 0 0 1 0 1 0 0 0 0 0 0	ADP PROPN NUM NUM NOUN NOUN VERB VERB ADP DET NOUN ADP PROPN NUM
Though this neatly solves the problem of how man can make history while at the same time history makes him, it does not answer the larger question of how a multiplicity of the products of individual acts, ‘ totalizations’, can themselves be totalized into the overall totalization required by the logic of dialectical rationality — rather than being the arbitrary, blind and self - cancelling movements of, say, Hardy's immanent will.	0 0 0 0 0 0 0 0 0 0 1 1 0 0 0 0 0 0 0 0 0 0 0 0 0 0 0 0 0 0 0 0 0 0 0 0 0 0 0 0 0 0 0 0 0 0 0 0 0 0 0 0 0 0 0 0 0 0 0 0 0 0 0 0 0 0 0 0 0 0 0	make history	figurative	identical	ADP DET ADV VERB DET NOUN ADP ADV NOUN VERB VERB NOUN ADP ADP DET ADJ NOUN NOUN VERB PRON PRON VERB ADV VERB DET ADJ NOUN ADP ADV DET NOUN ADP DET NOUN ADP ADJ NOUN PUNCT NOUN VERB PRON VERB VERB ADP DET ADJ NOUN VERB ADP DET NOUN ADP ADJ NOUN PUNCT ADV ADP VERB DET ADJ ADJ CCONJ NOUN PUNCT VERB NOUN ADP VERB PROPN ADJ NOUN	▁Though ▁this ▁ne at ly ▁solve s ▁the ▁problem ▁of ▁how ▁man ▁can ▁make ▁history ▁while ▁at ▁the ▁same ▁time ▁history ▁makes ▁him , ▁it ▁does ▁not ▁answer ▁the ▁larger ▁question ▁of ▁how ▁a ▁multiplicity ▁of ▁the ▁products ▁of ▁individual ▁acts , ▁ ‘ ▁total ization s ’ , ▁can ▁themselves ▁be ▁total ized ▁into ▁the ▁overall ▁total ization ▁required ▁by ▁the ▁logic ▁of ▁dial ect ical ▁rationality ▁ — ▁rather ▁than ▁being ▁the ▁arbitrary , ▁blind ▁and ▁self ▁- ▁cancelling ▁movements ▁of , ▁say , ▁Hard y ' s ▁im man ent ▁will .	0 0 0 0 0 0 0 0 0 0 0 0 0 1 1 0 0 0 0 0 0 0 0 0 0 0 0 0 0 0 0 0 0 0 0 0 0 0 0 0 0 0 0 0 0 0 0 0 0 0 0 0 0 0 0 0 0 0 0 0 0 0 0 0 0 0 0 0 0 0 0 0 0 0 0 0 0 0 0 0 0 0 0 0 0 0 0 0 0 0 0 0 0 0 0	ADP DET ADV ADV ADV VERB VERB DET NOUN ADP ADV NOUN VERB VERB NOUN ADP ADP DET ADJ NOUN NOUN VERB PRON PRON PRON VERB ADV VERB DET ADJ NOUN ADP ADV DET NOUN ADP DET NOUN ADP ADJ NOUN NOUN PUNCT PUNCT NOUN NOUN NOUN NOUN NOUN VERB PRON VERB VERB VERB ADP DET ADJ NOUN NOUN VERB ADP DET NOUN ADP ADJ ADJ ADJ NOUN PUNCT PUNCT ADV ADP VERB DET ADJ ADJ ADJ CCONJ NOUN PUNCT VERB NOUN ADP ADP VERB VERB PROPN PROPN PROPN PROPN ADJ ADJ ADJ NOUN NOUN
Past champions also watched, wondering if history would be made on this day.	0 0 0 0 0 0 1 0 0 1 0 0 0	make history	figurative	misc	ADJ NOUN ADV VERB VERB ADP NOUN VERB VERB VERB ADP DET NOUN	▁Past ▁champion s ▁also ▁watch ed , ▁wonder ing ▁if ▁history ▁would ▁be ▁made ▁on ▁this ▁day .	0 0 0 0 0 0 0 0 0 0 1 0 0 1 0 0 0 0	ADJ NOUN NOUN ADV VERB VERB VERB VERB VERB ADP NOUN VERB VERB VERB ADP DET NOUN NOUN
History is still being made with antiviral agents from the same laboratories.	1 0 0 0 1 0 0 0 0 0 0 0	make history	figurative	misc	NOUN VERB ADV VERB VERB ADP ADJ NOUN ADP DET ADJ NOUN	▁History ▁is ▁still ▁being ▁made ▁with ▁antiviral ▁agents ▁from ▁the ▁same ▁laboratories .	1 0 0 0 1 0 0 0 0 0 0 0 0	NOUN VERB ADV VERB VERB ADP ADJ NOUN ADP DET ADJ NOUN NOUN
Supersonic Barbara makes Concorde history	0 0 1 0 1	make history	figurative	combined-inflection	PROPN PROPN VERB PROPN NOUN	▁Super s onic ▁Barbar a ▁makes ▁Con cord e ▁history	0 0 0 0 0 1 0 0 0 1	PROPN PROPN PROPN PROPN PROPN VERB PROPN PROPN PROPN NOUN
A female deacon has made history by becoming the first woman to be put in charge of a parish in the Gloucester Diocese.	0 0 0 0 1 1 0 0 0 0 0 0 0 0 0 0 0 0 0 0 0 0 0	make history	figurative	inflection	DET ADJ NOUN VERB VERB NOUN ADP VERB DET ADJ NOUN PART VERB VERB ADP NOUN ADP DET NOUN ADP DET PROPN PROPN	▁A ▁female ▁de a con ▁has ▁made ▁history ▁by ▁becoming ▁the ▁first ▁woman ▁to ▁be ▁put ▁in ▁charge ▁of ▁a ▁par ish ▁in ▁the ▁G lo uc ester ▁Di oc ese .	0 0 0 0 0 0 1 1 0 0 0 0 0 0 0 0 0 0 0 0 0 0 0 0 0 0 0 0 0 0 0 0	DET ADJ NOUN NOUN NOUN VERB VERB NOUN ADP VERB DET ADJ NOUN PART VERB VERB ADP NOUN ADP DET NOUN NOUN ADP DET PROPN PROPN PROPN PROPN PROPN PROPN PROPN PROPN
Making history at 91 oldest female Freeman Sophia Hymes Picture : CLIFF BRETT	1 1 0 0 0 0 0 0 0 0 0 0 0	make history	figurative	combined-inflection	VERB NOUN ADP NUM ADJ ADJ PROPN PROPN PROPN PROPN PUNCT PROPN NOUN	▁Making ▁history ▁at ▁91 ▁oldest ▁female ▁Free man ▁So phi a ▁Hy mes ▁Picture ▁ : ▁CLI FF ▁B R ETT	1 1 0 0 0 0 0 0 0 0 0 0 0 0 0 0 0 0 0 0 0	VERB NOUN ADP NUM ADJ ADJ PROPN PROPN PROPN PROPN PROPN PROPN PROPN PROPN PUNCT PUNCT PROPN PROPN NOUN NOUN NOUN
We think that a coherent radical pluralism can be constructed on the basis of a humanism which accepts, as Marx put it, that human beings ' make their own history, but they do not make it just as they please ; they do not make it under circumstances chosen by themselves'(Marx, 1977 : 300 ).	0 0 0 0 0 0 0 0 0 0 0 0 0 0 0 0 0 0 0 0 0 0 0 0 0 0 1 0 0 1 0 0 0 0 0 0 0 0 0 0 0 0 0 0 0 0 0 0 0 0 0 0 0 0 0	make history	figurative	insertion-other	PRON VERB ADP DET ADJ ADJ NOUN VERB VERB VERB ADP DET NOUN ADP DET NOUN ADJ VERB ADP PROPN VERB PRON ADP ADJ NOUN PART VERB ADJ ADJ NOUN CCONJ PRON VERB ADV VERB PRON ADV ADP PRON VERB PUNCT PRON VERB ADV VERB PRON ADP NOUN VERB ADP PUNCT NUM PUNCT NUM PUNCT	▁We ▁think ▁that ▁a ▁coherent ▁radical ▁pluralism ▁can ▁be ▁constructed ▁on ▁the ▁basis ▁of ▁a ▁human ism ▁which ▁accepts , ▁as ▁Mar x ▁put ▁it , ▁that ▁human ▁beings ▁' ▁make ▁their ▁own ▁history , ▁but ▁they ▁do ▁not ▁make ▁it ▁just ▁as ▁they ▁please ▁ ; ▁they ▁do ▁not ▁make ▁it ▁under ▁circumstances ▁chosen ▁by ▁themselves ' ( Mar x , ▁1977 ▁ : ▁300 ▁ ).	0 0 0 0 0 0 0 0 0 0 0 0 0 0 0 0 0 0 0 0 0 0 0 0 0 0 0 0 0 0 1 0 0 1 1 0 0 0 0 0 0 0 0 0 0 0 0 0 0 0 0 0 0 0 0 0 0 0 0 0 0 0 0 0 0 0 0 0	PRON VERB ADP DET ADJ ADJ NOUN VERB VERB VERB ADP DET NOUN ADP DET NOUN NOUN ADJ VERB VERB ADP PROPN PROPN VERB PRON PRON ADP ADJ NOUN PART VERB ADJ ADJ NOUN NOUN CCONJ PRON VERB ADV VERB PRON ADV ADP PRON VERB PUNCT PUNCT PRON VERB ADV VERB PRON ADP NOUN VERB ADP PUNCT PUNCT PUNCT PUNCT PUNCT PUNCT NUM PUNCT PUNCT NUM PUNCT PUNCT
Banbury's library and museum though are hoping to record your views, and they 're going to, hopefully, make some history.	0 0 0 0 0 0 0 0 0 0 0 0 0 0 0 0 0 1 0 1	make history	figurative	insertion-other	PROPN NOUN CCONJ NOUN ADV VERB VERB PART VERB ADJ NOUN CCONJ PRON VERB VERB PART ADV VERB DET NOUN	▁Ban bur y ' s ▁library ▁and ▁museum ▁though ▁are ▁hoping ▁to ▁record ▁your ▁views , ▁and ▁they ▁' re ▁going ▁to , ▁hopeful ly , ▁make ▁some ▁history .	0 0 0 0 0 0 0 0 0 0 0 0 0 0 0 0 0 0 0 0 0 0 0 0 0 0 1 0 1 1	PROPN PROPN PROPN PROPN PROPN NOUN CCONJ NOUN ADV VERB VERB PART VERB ADJ NOUN NOUN CCONJ PRON VERB VERB VERB PART PART ADV ADV ADV VERB DET NOUN NOUN
The two men, who by their election made history and fulfilled the dreams of Francis Maginn, the founder of the BDA, were John McDonald Young and Murray Holmes.	0 0 0 0 0 0 0 1 1 0 0 0 0 0 0 0 0 0 0 0 0 0 0 0 0 0 0 0	make history	figurative	inflection	DET NUM NOUN NOUN ADP ADJ NOUN VERB NOUN CCONJ VERB DET NOUN ADP PROPN PROPN DET NOUN ADP DET PROPN VERB PROPN PROPN PROPN CCONJ PROPN PROPN	▁The ▁two ▁men , ▁who ▁by ▁their ▁election ▁made ▁history ▁and ▁fulfilled ▁the ▁dreams ▁of ▁Franc is ▁Mag in n , ▁the ▁founder ▁of ▁the ▁B DA , ▁were ▁John ▁Mc D on ald ▁Young ▁and ▁Mur ray ▁Holm es .	0 0 0 0 0 0 0 0 1 1 0 0 0 0 0 0 0 0 0 0 0 0 0 0 0 0 0 0 0 0 0 0 0 0 0 0 0 0 0 0 0	DET NUM NOUN NOUN NOUN ADP ADJ NOUN VERB NOUN CCONJ VERB DET NOUN ADP PROPN PROPN PROPN PROPN PROPN PROPN DET NOUN ADP DET PROPN PROPN PROPN VERB PROPN PROPN PROPN PROPN PROPN PROPN CCONJ PROPN PROPN PROPN PROPN PROPN
For just as Marx, when faced with the problem ‘ How does man make his history?’ replied with another question, ‘ How is the man who makes history made?’, so the proposal that the economic organisation of a society determines its superstructure should prompt us to ask how the base itself is determined.	0 0 0 0 0 0 0 0 0 0 0 0 0 0 0 0 0 0 0 0 0 0 0 0 0 0 1 1 0 0 0 0 0 0 0 0 0 0 0 0 0 0 0 0 0 0 0 0 0 0 0 0 0	make history	figurative	inflection	ADP ADV ADP PROPN ADV VERB ADP DET NOUN PUNCT ADV VERB NOUN VERB ADJ NOUN VERB ADP DET NOUN PUNCT ADV VERB DET NOUN NOUN VERB NOUN NOUN CCONJ DET NOUN ADP DET ADJ NOUN ADP DET NOUN VERB ADJ NOUN VERB VERB PRON PART VERB ADV DET NOUN PRON VERB VERB	▁For ▁just ▁as ▁Mar x , ▁when ▁faced ▁with ▁the ▁problem ▁ ‘ ▁How ▁does ▁man ▁make ▁his ▁history ? ’ ▁replied ▁with ▁another ▁question , ▁ ‘ ▁How ▁is ▁the ▁man ▁who ▁makes ▁history ▁made ? ’ , ▁so ▁the ▁proposal ▁that ▁the ▁economic ▁organisation ▁of ▁a ▁society ▁determines ▁its ▁superstructure ▁should ▁prompt ▁us ▁to ▁ask ▁how ▁the ▁base ▁itself ▁is ▁determined .	0 0 0 0 0 0 0 0 0 0 0 0 0 0 0 0 0 0 0 0 0 0 0 0 0 0 0 0 0 0 0 0 0 1 1 0 0 0 0 0 0 0 0 0 0 0 0 0 0 0 0 0 0 0 0 0 0 0 0 0 0 0 0 0	ADP ADV ADP PROPN PROPN PROPN ADV VERB ADP DET NOUN PUNCT PUNCT ADV VERB NOUN VERB ADJ NOUN NOUN NOUN VERB ADP DET NOUN NOUN PUNCT PUNCT ADV VERB DET NOUN NOUN VERB NOUN NOUN NOUN NOUN NOUN CCONJ DET NOUN ADP DET ADJ NOUN ADP DET NOUN VERB ADJ NOUN VERB VERB PRON PART VERB ADV DET NOUN PRON VERB VERB VERB
PORTADOWN centre - forward Stevie Cowan made history today at Shamrock Park as his club defeated Cliftonville to remain a point behind Linfield in this fascinating Irish League championship.	0 0 0 0 0 0 1 1 0 0 0 0 0 0 0 0 0 0 0 0 0 0 0 0 0 0 0 0 0	make history	figurative	inflection	PROPN NOUN PUNCT NOUN PROPN PROPN VERB NOUN NOUN ADP PROPN PROPN ADP ADJ NOUN VERB PROPN PART VERB DET NOUN ADP PROPN ADP DET ADJ PROPN PROPN NOUN	▁ PORT ADO W N ▁centre ▁- ▁forward ▁Ste vie ▁C owan ▁made ▁history ▁today ▁at ▁Sham rock ▁Park ▁as ▁his ▁club ▁defeat ed ▁C lift on ville ▁to ▁remain ▁a ▁point ▁behind ▁L in field ▁in ▁this ▁fascinating ▁Irish ▁League ▁champion ship .	0 0 0 0 0 0 0 0 0 0 0 0 1 1 0 0 0 0 0 0 0 0 0 0 0 0 0 0 0 0 0 0 0 0 0 0 0 0 0 0 0 0 0 0	PROPN PROPN PROPN PROPN PROPN NOUN PUNCT NOUN PROPN PROPN PROPN PROPN VERB NOUN NOUN ADP PROPN PROPN PROPN ADP ADJ NOUN VERB VERB PROPN PROPN PROPN PROPN PART VERB DET NOUN ADP PROPN PROPN PROPN ADP DET ADJ PROPN PROPN NOUN NOUN NOUN
